date,author,score,body
2019-12-11 23:52:35,chadimmaculate,6,"Trump volatility is back and should continue as the trade cycle heats up in the coming weeks. Face-ripping SPY rallies are over this year unless we roll down to SPY 303 before EOY, but if that happens it will likely be a dead cat bounce that drops in early Jan. When Trump delays tariffs before Sunday, it might seem a good time to go long, but volatility will reign as the admin will say they’ll charge them retroactively on X date. And China has been docile, but don’t bet on it staying that way for much longer. Play volatility and go hard on SPY calls if we hit SPY 303 before EOY to flip.

When headwinds increase in Q1 2020 after a juicy drop that gets bought up on a continuation of trade deal hopes and real expectations for another early cut with a continuation of Fed repo policy, prepare for headlines like “You’d have made 6% in 3 MONTHS if you bought the January drop, are you fuckin’ STUPID?” We have plenty of time (months) to stay around or above SPY 300 before the earnings recession gets fully-realized. Until then, Papa Jay’s liquidity and hopium will float us. ’MURICA.

Oh wait, this is a Wendy’s. I’ll see myself out."
2019-12-11 23:51:34,cnguy-uci,2,jacking off to my spy calls rn
2019-12-11 23:48:53,jonnydoo84,7,that BA recovery today was fucking beautiful
2019-12-11 23:48:47,Sinadins,-4,"Imagine how much better the world would be if climate activists spent as much time learning engineering, physics, and chemistry for real scientific innovation as they did making signs and protesting in the streets 😂😂😂"
2019-12-11 23:41:42,love2fuckbearasshoe,3,"FUTURES BLOOD GREEN $$

Man being a bull is something man 

“ we gonna be doing so much winning you will  get tired of winning “"
2019-12-11 23:41:10,kemar7856,3,Sooooo are the tariffs delayed or not?
2019-12-11 23:37:51,MooseTendies,2,Was a lil nervous about the mouse but the ship righted today.
2019-12-11 23:37:01,love2fuckbearasshoe,7,"CRAMER BULLISH ON TESLA FUCK!!!

🤬🤬🤬🤬🤬

DUMPING ALL my shares tomorrow 

Fuck man could not let me fucken have this 

😳🥵🥵🥵🥵😡😡😡"
2019-12-11 23:35:34,TheLeafyOne2,3,PTI data when? Palms are sweaty
2019-12-11 23:33:00,divsandpremium50,1,TSLA gonna moon tomorrow it looks like and I’m here for it
2019-12-11 23:31:35,thetimehathcome,3,"thinking about selling more PTI puts.

I sold some $2 puts back when it was $3, and they haven't gone down much in value despite the stock going up 50%. Good value then, better value now."
2019-12-11 23:31:05,NWordTekashi69,0,"futures bloody green

Feels good to be on the winning side !!👏🦅"
2019-12-11 23:31:03,MrBingCrosby,2,PREDICTION: Repo market infusion tonight and futures will be above 3150
2019-12-11 23:29:05,Josh439,1,"Hoping for a good natural gas storage report. Sell UGAZ if gains are solid, then jump into JDST if it goes down alot tomorrow."
2019-12-11 23:28:36,picsorshins420,4,i cant imagine taking a dump before smartphones. how did one distract themselves from painful diarrhea?
2019-12-11 23:26:50,supplecodex9000,1,Put spread on spy
2019-12-11 23:26:47,love2fuckbearasshoe,-8,"When I look at how much money I made this year 

I put on game of thrones theme song 

And tell myself 


“ this is how greatness feels like “

Downvote if u want evil voodoo spirits to tank your portfolio"
2019-12-11 23:24:58,Droidvoid,6,I know at least one person here bet it all on SPY FD puts based on that guy’s mom’s DD. I wanna know how much
2019-12-11 23:24:15,picsorshins420,1,"if i withdraw my initial investment in my account and leave my gains, do i need to report anything for taxes?"
2019-12-11 23:22:44,b7d,1,Anybody doing anything with LOVE?
2019-12-11 23:22:16,OriginalGravity8,1,Cutting my losing CRWD position and loading it all into PTON for that all but guaranteed squeeze
2019-12-11 23:22:07,love2fuckbearasshoe,-3,"I DID HEDGE u idiot 

Don’t u see my shop$ and TESLA$ postion"
2019-12-11 23:20:32,gigantoir,2,outside of earnings does after hours really have an effect on tomorrow’s opening?
2019-12-11 23:19:44,freehouse_throwaway,36,guys i'm starting to think this FD shit isnt going to work out long term
2019-12-11 23:18:04,soccergoon13,2,I'm long 300 shares of TLRA. Anyone work in that space that can provide insight? I want to add to it.
2019-12-11 23:16:24,CardiacJacc,12,Pour one out for lulu calls
2019-12-11 23:16:14,dommytao,17,My account was up 70% today and I ended up losing most of it. Why is it so hard to get over greed. Thanks for coming to my ted talk.
2019-12-11 23:15:01,RubenZ217,5,Futures flatter than your girlfriend
2019-12-11 23:13:11,follow-spy,5,"[https://www.usatoday.com/story/sports/golf/2019/12/11/tommy-two-gloves-gainey-arrested-as-part-of-prostitution-sting/40800421/](https://www.usatoday.com/story/sports/golf/2019/12/11/tommy-two-gloves-gainey-arrested-as-part-of-prostitution-sting/40800421/)

I don't understand these people..lol   If he would have made a couple of phone calls,  I'm sure there is an exclusive service to high class customers.  Maybe the allure is doing something challenging and paying 60 bucks..lol.

edit:  the video is hilarious..lol

[https://www.tmz.com/2019/12/11/pga-golfer-tommy-gainey-arrested-prostitution-sting-two-gloves/](https://www.tmz.com/2019/12/11/pga-golfer-tommy-gainey-arrested-prostitution-sting-two-gloves/)"
2019-12-11 23:10:41,NWordTekashi69,1,Yay spy to the moon
2019-12-11 23:09:21,xc89,1,Should I continue to ignore Oracle?
2019-12-11 23:08:48,HourPackage,1,Anyone else buying Lulu calls in the morning?
2019-12-11 23:08:07,choose_a_use,2,Whats up with FLIX bitch?
2019-12-11 23:07:27,shmowker,2,Hope you auties have calls
2019-12-11 23:03:44,HowLongCanIMakeAName,4,I’m back I just went on a huge trip ama
2019-12-11 23:03:21,bshaman1993,2,Investors hedged like never before. I'm getting calls on this bad boy called spy.
2019-12-11 23:02:01,DeliciouslyUnaware,2,[Do you see these lines on this chart? Its obvious what you need to do to make money here.](https://ibb.co/KGnnJgm)
2019-12-11 23:01:39,NYGiants1532,2,I'm so happy
2019-12-11 23:00:59,micray1,2,Buy CRM
2019-12-11 22:58:31,winkerjack,3,What would Greta thunberg be like as a WSBer 🤔
2019-12-11 22:57:58,irontesties,4,There’s psychics out there saying tomorrow is the crash
2019-12-11 22:55:46,Sinadins,3,Only in 2019 would we look to an autistic teenager for advice on something as complex as energy.
2019-12-11 22:55:30,dawhizkid,1,Congress authorized creation of the Space Force...$SPCE to the moon?
2019-12-11 22:53:45,thesaddestpanda,3,Im gonna trade tomorrow with only results from tarot cards. I need a TA guy to head to head with me to see who wins. 5 trades allowed that day. EOD profit determines winner. Winner gets dinner with Jeanna Smiack.
2019-12-11 22:52:38,VacationLover1,18,"**IMPORTANT REMINDER** 

The market is open tomorrow"
2019-12-11 22:52:09,,6,How much are LULU 12/13 $245 calls looking to lose if this dip holds tomorrow?
2019-12-11 22:49:35,oregon_forever,1,When you sell options as part of the theta gang you are technically shorting VIX.
2019-12-11 22:47:23,,5,bought the lulu dip. good call.
2019-12-11 22:47:05,Lil_Musket,3,Uwu TA traders are wetawded rawr xD
2019-12-11 22:45:58,Big_Factz,5,"Amazon better lay low on this week, need these condors to pay out, then next week my last week of trading for the year 🙏"
2019-12-11 22:43:14,NoftScarlet,5,His name is Yang
2019-12-11 22:42:12,leomeng,4,Bought spy puts an eod. Anyone else?  1/17 $310
2019-12-11 22:35:27,slinkymello,1,"Jesus, should I even say “selling V strangles...”"
2019-12-11 22:34:42,Cnastydawg,16,Greta thunberg won person of the year??? Ummm.....
2019-12-11 22:32:27,ch1p_skylark,8,"feeling bigly gay and autistic for not buying BA calls at 9:30 

FUUUUUUUUUUUUUUUUUCK"
2019-12-11 22:31:19,PapaQsHoodoo,6,"Close was too strong, holding SPY calls overnight like a tard boi."
2019-12-11 22:30:43,freehouse_throwaway,3,"gonna check for analysts PT and PM movement on LULU. 

this pullback really isnt all that much considering you're just back to Nov levels. last year it drilled like 12%+ after Q3 ER being similarly inline as ppl took profit + macro

its up 90% YTD and like almost 20% since last ER. i'm hoping for a bit more pullback and profit taking considering we're near EOY"
2019-12-11 22:30:09,dawhizkid,7,"Damn called this! 

Cousin Greg from Succession to play Adam Neumann in WeWork series https://www.hollywoodreporter.com/live-feed/successions-nicholas-braun-star-wework-tv-series-1261989"
2019-12-11 22:26:42,SendBobsAndVegetas,2,Short the FED
2019-12-11 22:26:21,mikes703,6,"All my scalping positions: ACB, WEI, LB, BA, UNFI, PLCE"
2019-12-11 22:25:59,Sunnydee91,1,32$ PTON calls 12\13. Any life?
2019-12-11 22:25:33,CheffromNowhere,4,Going to $SPCE
2019-12-11 22:23:44,Mookypooks,3,Aight PCG that’s enough consolidation quit being a bish
2019-12-11 22:22:58,love2fuckbearasshoe,9,If u buy peleton u are a fucken idiot even more than weed stock investors
2019-12-11 22:19:27,APHAbaghodler,3,Why did markets close early today?
2019-12-11 22:19:04,seanjbln,5,"$SPY $314P 12/24 //
$AAPL $265P 1/10 (sold everything on early morning Apple drop, switched to calls within 30 seconds of tweet)."
2019-12-11 22:17:52,AgitatedAntelopes,3,"WTF Disney AH block. Is that a sell or buy? Mickey gimme some of dat $194 mill no-biggie ex div order..?

https://imgur.com/a/lwXsQPH"
2019-12-11 22:17:25,Eman2105,4,For some reason I got an itch that trumps gonna slap tariffs on Dec 15. Usually I feel decent about my choices but for some reason I feel really good about this one. Take that as you will. I've had the worst luck lately lmao so inversing me will prob make a lot of money
2019-12-11 22:16:13,Fan_Boyy,5,omg winker 🏳️‍🌈 cr3eated his own [sub](https://www.reddit.com/r/Winkerpack/)  and then banned me for 69 days lmao wut a retard
2019-12-11 22:16:08,Cnastydawg,5,pypl calls really hitting different after hours. 🤑
2019-12-11 22:15:25,JustLookingAroundFor,1,"Why did the market dive bomb on me today fam

Mongodb done like 15% for no reason"
2019-12-11 22:15:18,WBuffettJr,7,The best thing about Lulu reporting earnings is that all the financial articles on Lulu earnings contain girls stretching in Lulu for their headline photo.
2019-12-11 22:14:32,Fuckthisshit6969,3,Gonna get lulu calls if it starts a rebound tmr and hopefully make money on my HD and COST calls
2019-12-11 22:13:07,AvgSizedPenis,3,"holy shit ARQL just hit $21 AH, hope at least some of you followed me"
2019-12-11 22:12:10,iweararobe,3,so china says they will only continue trade talks past dec. 15 if trump removes all existing tariffs. public sentiment is that he will only at most delay dec 15. tariffs. will china accept this and continue talks with only delayed tariffs?
2019-12-11 22:10:11,freehouse_throwaway,4,so whats the news on NFLX anyways
2019-12-11 22:05:50,thecashcow-,5,Umm Nflx?
2019-12-11 22:05:48,touchhimwiththejab,6,Going to look to pickup some long dated LULU calls tomorrow depending on opening price action
2019-12-11 22:04:51,ion3,2,Tariff delay announcement tomorrow?
2019-12-11 22:04:29,CloudIntegration,2,"Bought a 12/20 $295 NFLX put at the end of the day today, don't know what's going on with it AH but hopefully it stays down long enough to get some profit out of it. 

Question for you smart bois out there, what kind of technicals do you like? Doing some research on MACD today which led me to NFLX put"
2019-12-11 22:04:01,Cnastydawg,3,u/wallstreetbust really lived up to his name RIP
2019-12-11 22:02:17,CommanderInTweet,3,Exited my Apple calls. Time for it to pop up
2019-12-11 22:02:07,Cnastydawg,12,60k LULU calls guy was up around 6.5k before the close. Now his calls are going to be worth 4k or less.
2019-12-11 22:02:03,technak,1,"Green by open, we're about to have another CHWY on our hands"
2019-12-11 22:01:32,thecashcow-,2,Merck (MRK) to Acquire ArQule for $2.7 billion
2019-12-11 22:00:38,optionsthatlose,7,"$COST 295 calls 12/20  
$SFIX 27 puts 12/27  
$PTON 32 calls 01/17  
$LB 17.5 calls 12/27"
2019-12-11 21:59:24,pnin22,5,"LULU call spread 232.5/237.5, 6 contracts, 12/20"
2019-12-11 21:58:36,st00ck,5,"long $BAH$HUM$BUG

https://i.redd.it/ous4ccg2s2441.png"
2019-12-11 21:57:05,SVXYstinks,5,"If I was the CEO of a newly public company whose stock was primed to fly higher, only for some short seller to give it a pt that is so below the current price due to cherry picked stats that are irrelevant to each other, I would immediately go on CNBC and talk about how amazing sales are and anything else to get a squeeze going."
2019-12-11 21:55:52,GracieMaeMacieMarie,1,Uh oh. SRNE now flat AH.
2019-12-11 21:53:48,,3,"Man I can't wait to go back home for Xmas so I can carry my gun again, fuck commie Maryland"
2019-12-11 21:53:11,IHaveADreamandadolla,13,For those of you wanting to get serious about trading options then stop playing ERs. Jus FYI.
2019-12-11 21:52:24,24058025480548,5,still holding my puts and vxx calls hbu u/-hyre
2019-12-11 21:52:14,GeoDudeBroMan,15,LULU wins WSBs meme stock of the day
2019-12-11 21:51:09,tonyMEGAphone,2,"AYX is going up, traded flat at it's bottom all day. No doubt it isn't making a move up over the next two  days at least.                     
               
Plus I went long on C, Citi, but I don't remember what my DD was for that. Maybe I saw earnings sometime next month. *Oh yeah that need news in RH LOL         
            
RIP LULU clan. May you bounce back like the butts they tightly cover."
2019-12-11 21:50:25,jyuliahn1,3,There is no difference between -200billion budget deficit and -10000billion budget deficit. Just some numbers you type out. All in calls.
2019-12-11 21:50:09,klayer9,2,Cry
2019-12-11 21:49:45,MaverickMcfly,5,Lulu pls keep dropping
2019-12-11 21:49:23,thesaddestpanda,8,"any brave souls want to goto lulu on stocktwits? im guessing theres a mix of despair, suicides, and broke portfolios going on right now."
2019-12-11 21:49:19,BlueKnightJoe,5,"This is your daily reminder that there is not a phase 1 deal, there will never be a phase 1 deal, you will never be a wayfinder. 🏝🐓🐖🥥⛵🌊💁🏽‍♀️"
2019-12-11 21:49:15,,2,If you turn the daily chart on GE 90 degrees clockwise it looks like pinnoccio with a boner
2019-12-11 21:48:30,fupadestroyer45,2,"Tailored Brands, that pump and dump."
2019-12-11 21:48:06,thesaddestpanda,5,"[homeboy paid $16 for 230 LULU puts. ](https://www.reddit.com/r/wallstreetbets/comments/e85ssu/704k_put_position_in_aapl_lulu_shop/?sort=new)

Whats he waking up to? no way he isn't crushed. prolly lost half his value.

edit: misread them as 12/20"
2019-12-11 21:47:36,throwawaybutforchang,2,Bloody Thursday as per tradition but EOD seemed sure strong today. Green Thursday ??? ew
2019-12-11 21:45:02,MaverickMcfly,2,Did lulu lower guidance??
2019-12-11 21:43:35,scottythecause90,7,Whoops. Thought $COST ER was today. Guess my move for tomorrow is to do nothing and wait.
2019-12-11 21:43:29,OpeningSpeech1,3,"I just hate it when the otm algo I bought my lottery ticket from fucks up after hours and shows a 1,800% gain without anything actually moving"
2019-12-11 21:40:05,GeoDudeBroMan,6,"I have a hunch.... that something is going on with LULU.

Cant put my finger on it"
2019-12-11 21:40:01,Lil_Musket,1,Bought spy puts for tomorrow boy I hope I'm right!
2019-12-11 21:38:52,WBuffettJr,4,"Looks like that Lulu $250 calendar spread I posted the other day is going to be a-ok despite the drop, thanks to them premiums. Sold Dec $250 calls and bought Jan $250 calls. Figured the trade would be profitable if the stock ended up anywhere between $222 and $280.  Would have been better had the stock gone up to around $250, but I’ll take getting out unscathed. A hell of a lot better than folks who bought calls only and hoped to overcome IV."
2019-12-11 21:38:51,Habstah,7,White girl yoga pants stock is red = recession is here
2019-12-11 21:38:39,thesaddestpanda,4,[mfw LULU beats but it crashes anyway](https://imgur.com/a/J0GKval)
2019-12-11 21:38:31,freehouse_throwaway,8,"alright found all the recent bigger LULU yolos:

* about 16k in LULU 3/20/20 $230p: https://www.reddit.com/r/wallstreetbets/comments/e85ssu/704k_put_position_in_aapl_lulu_shop/

* 60k in LULU FD calls: https://www.reddit.com/r/wallstreetbets/comments/e8grt0/lulu_yolo/ (gonna be worth like $4k tomorrow oof)

* 22k in LULU weeklies (240c and 265c lol): https://www.reddit.com/r/wallstreetbets/comments/e91vo6/man_i_love_seeing_those_yoga_pants_im_getting_in/ (he said he took gains from 17k and covered rest with some puts)

i have about 5k in LULU puts but this movement might not be enough. guess ill get some lunch money out of it."
2019-12-11 21:38:30,kingragi,12,🙋🏻‍♂️Only people that won off lulu are the ones that sold them to you.
2019-12-11 21:37:33,wolf_of_wall_mart,1,"journal entry  


12/11/2019  


today was cool, I reflected on my bad trades of the last quarter (almost all losses). I made the decision to start winning, I'm aware it's a bold move however simple.  
Today marks the day that we all begin to win.  
Bears and Bulls alike, sharing beers and watching their accounts rocket to sky high never before seen levels.  


I have the night off from my second job, and a RH account with instant transfers locked; PDT as well.  
The dark triad.  
Otherwise today was uneventful in my trading prospects, besides being down $400 in CORV.  


If you've been having a losing streak, it's as simple as deciding to start winning.  


Love,  
ya boy dbangz 'the booty intruder'"
2019-12-11 21:37:30,MaStNu,1,Anyone playing the rebound on SAGE? Everyone on Stocktwits is head over hills bullish for it... but where it dropped to feel like a major investor pulled out...
2019-12-11 21:36:11,AimMoreBetter,2,I wasn't in LULU but wtf happened after that earning call?
2019-12-11 21:35:30,Xcavor,6,Surprised we didnt get a murder JPOW tweet from Trump.
2019-12-11 21:34:47,Dimeskis,2,Two fucking weeks of my ER condors getting obliterated caused me to only open a few credit spreads on LULU...
2019-12-11 21:34:23,Cnastydawg,6,I’ll never understand why people would think “wow this is gone 90 degrees up maybe I’ll buy it here” LULU was going to sell off no matter what.
2019-12-11 21:33:31,ImagineThat710,3,What's a good ticket I can get through TOS for louis Vuitton?
2019-12-11 21:33:27,divsandpremium50,1,If you need the market to go DOWN do you want the Labour Party or Conservative to win this election tonight??
2019-12-11 21:33:08,Cnastydawg,6,Rip to our fallen brethren https://www.reddit.com/r/wallstreetbets/comments/e8grt0/lulu_yolo/facebiy/?utm_source=share&utm_medium=ios_app&utm_name=iossmf
2019-12-11 21:32:41,satireplusplus,2,**TARIFFS ARE COMING**
2019-12-11 21:32:24,Dykchaney,2,Anyone playing srne?
2019-12-11 21:30:45,tonythetigress182,1,buy FB on a dip before it explodes to 210
2019-12-11 21:30:40,omgroki,3,Why is everyone posting about $COST like its ER is today?
2019-12-11 21:29:49,divsandpremium50,3,Long Live Ir0nyman
2019-12-11 21:28:54,gmorel1012,2,bmy callz
2019-12-11 21:28:50,winkerjack,12,"> Buy puts on $LULU their shit rips so easily. I was grabbing at wifeys ass in her lulu's and that shit just ripped right at the seem.

Looks like u/truethoughts92 was on to something"
2019-12-11 21:28:33,,2,Fake and gay lulu dump not even enough to beat IV crush on the deepest OTM puts
2019-12-11 21:27:29,freehouse_throwaway,3,"oof feel for this guy: https://www.reddit.com/r/wallstreetbets/comments/e8grt0/lulu_yolo/

with FDs there's really not much to roll out."
2019-12-11 21:26:59,thesaddestpanda,2,"can some galaxy brain put this on fucking imgur for me? i cant use chrome at work, just FF in no history mode: 

https://www.reddit.com/r/wallstreetbets/comments/e9d0yt/here_you_go_you_animals/

and FF's inspector cant see this media"
2019-12-11 21:26:34,jeesgalaxy,7,Got fucked by DELL. Got fucked by LULU... GETTING FUCKED BY COSTCO?
2019-12-11 21:25:51,thesaddestpanda,19,It should be illegal to offer someone like me margin.
2019-12-11 21:25:43,DeliciouslyUnaware,1,Choo choo. PayPal train to 107 departing at 930am 12/12/2019. Have your boarding passes ready. 107c for this Friday. Limit order at .16 each
2019-12-11 21:25:20,thesaddestpanda,2,thank god I didnt buy $50k lulu shares today as a scalp. im guessing it will prolly rise back up to close price in the AM.
2019-12-11 21:25:17,Zer033x,2,"Kinda paralyzed until tariff stuff is known, whole market is."
2019-12-11 21:25:16,spanishgalacian,2,"For the love of god TD release my funds already. 

If I knew it would have taken this long I would have sent my girl the cash so she could directly send it with Apple Pay."
2019-12-11 21:24:19,thtguy90,3,"LK and PTON calls for me. 

They both can’t go down again, can they?"
2019-12-11 21:23:25,thesaddestpanda,9,"some dude pm'ing me about his lulu put

yeah pal, call me when you aint IV crushed"
2019-12-11 21:23:21,freehouse_throwaway,17,"oof just scanning front page for LULU's future loss porn

there's a dude with fucking Dec $265 call. 14k worth (and 8k worth of 240c)

https://www.reddit.com/r/wallstreetbets/comments/e91vo6/man_i_love_seeing_those_yoga_pants_im_getting_in/

edit: he said he sold some today so i guess not much of a YOLO"
2019-12-11 21:22:38,divsandpremium50,25,Green Day tomorrow pretty much confirmed
2019-12-11 21:22:17,TheSurfNSnow,5,LULU not tanking enough to turn my lotto tickets into anything. Seller wins again!
2019-12-11 21:21:52,madhav_16,2,"After Tesla, it's all LULU now."
2019-12-11 21:21:28,love2fuckbearasshoe,10,"WAITING FOR COSTCO.  With a MASSIVE hard cock 

Bullish !!!


Like a woman with her ass spread open waiting for daddy"
2019-12-11 21:20:56,sheffieldda,2,Thank god my lulu calls are dated 12/27. Might actually be able to hold on and see this bitch break even
2019-12-11 21:20:55,mylarky,2,Pray for LULU to recover to 225 or more.
2019-12-11 21:20:48,psychcloud,2,Anyone playing Lulu calls is literally reet. Look at that IV. Buy Nike calls ..
2019-12-11 21:20:47,VacationLover1,5,If we don’t get a tweet from tariff man by tomorrow I’m going with tariffs still on for the 15th. If they’re on he will tweet Friday after market close to minimize impact. If they are off he does it beforehand to run the markets. But who knows 🤷‍♂️
2019-12-11 21:20:00,,3,thats 2 day trades in 1 day :(
2019-12-11 21:19:00,thesaddestpanda,1,"wtf firefox cant download a reddit hosted gif? dev tools has no media tab?

just want to put that jeanna gif on imgur"
2019-12-11 21:18:55,CaptKyle,-2,"So, my LULU 12/20 205 put may actually eek out some money for me. Ok."
2019-12-11 21:18:45,GracieMaeMacieMarie,2,SRNE might save my portfolio tomorrow.
2019-12-11 21:18:42,freehouse_throwaway,2,"Meh gonna need more movement on LULU for my put spreads

3~4% down isn't enough.

https://i.imgur.com/tilDZil.png

Should have just done a calendar put spread oof."
2019-12-11 21:18:39,M0ngoos,1,The fight for BECKY is upon us.
2019-12-11 21:18:30,ch1p_skylark,20,"poor LULU bulls 

stock crashing to levels not seen since 2 weeks ago 🦀🦀"
2019-12-11 21:18:19,love2fuckbearasshoe,2,LULU ASSHOE
2019-12-11 21:18:05,vmozara,2,"Sold 100 MU 52 calls today just before close, exp 20th Dec 0.9 bucks 
Bought MU 47.5 puts 100 contracts for this friday
Waiting this friday for AMD 45 calls and 37 puts to expire"
2019-12-11 21:17:59,ILoseTheMonies,1,"Bought LYFT $46p and got fucked
Tell me it goes down bros. They don't even have a P/E!"
2019-12-11 21:17:35,love2fuckbearasshoe,2,FUCK PEOPLE BUYING LULU DIP!!!
2019-12-11 21:17:16,Jerund,1,Gme 5 puts
2019-12-11 21:16:57,manofsteel47,4,I had my mouse hovering over the LULU put button for at least 2 hours today. fuck me
2019-12-11 21:16:04,thesaddestpanda,2,lulu didnt actually beat right? it slipped on revenues?
2019-12-11 21:15:38,rbnihood,5,"SRNE running up so high even my overpriced call buy is mooning, news tomorrow should be 👍👍"
2019-12-11 21:15:31,BlackSky2129,3,I wish I didn’t pussy out of LULU condors
2019-12-11 21:15:27,,1,are we gonna get a tariff tweet tonight
2019-12-11 21:15:22,ch1p_skylark,14,in b4 lulu moons to 240 by market open
2019-12-11 21:15:21,thesaddestpanda,35,"lulu put buyers: IV crushed

lulu call buyers: price and IV crushed

no winners? Yep, welcome to WSB!"
2019-12-11 21:14:44,VacationLover1,6,Butt my LULU lottos .. RiP 😢
2019-12-11 21:14:06,ImagineThat710,2,Lulu still in implied move wouldn't be surprised if it opens tomorrow within 0 to -5%
2019-12-11 21:14:00,Thales111,3,So f*cking glad I sold my puts at like 1:30.  10-20% loss on all of them but would have been close to 100%... At least I’m alive
2019-12-11 21:13:47,Tanav11,1,Lulu position tomorrow
2019-12-11 21:13:32,rbnihood,3,"Lulu beats earnings, still gets crushed. glad I didn’t listen lol"
2019-12-11 21:13:25,thesaddestpanda,4,"makeup stocks, lulu

whose next? if we cant keep white girls spending, thats a huge canary in a coalmine moment.  

puts on spy in the AM"
2019-12-11 21:13:05,love2fuckbearasshoe,5,"Wait so selling leggings to over sized fat bitches won’t make a profit long term ??

Hehehehe he

LULU CONNECTTTTTT"
2019-12-11 21:13:03,Crosa13,2,Buy calls at open market mooning tomorrow
2019-12-11 21:13:02,analyst_84,1,"Apple collapse, when?"
2019-12-11 21:12:48,MandizWey,1,Everyone check out Pacific Gas and Electricity (PCG)... They had a slight bump do to settlement of BK... and it went up last to days it should be coming back down pretty shortly though 😎
2019-12-11 21:12:39,TwerkEthic,1,3 minutes to costco-geddon
2019-12-11 21:12:38,love2fuckbearasshoe,11,"Wsb: BUT ITS BECKY MAN 


Hahahaha STFU 

😂😂😂😂😂😂😂😂😂😂😂🤣🤣🤣🤣"
2019-12-11 21:12:19,HatsuneM1ku,1,HAHAHAHAHA DIE LULU
