date,author,score,body
2019-10-11 05:56:54,Kc_Ryback,6,"First things first, I've been waking up before the bell to check indicators and decide on the positions that will probably end up making everything I work for totally worthless by noon. Given the hype behind trade talks and implied volatility, I'll probably get the lady to dome me up before I start the day. Then, it's straight to the hospital for me bros....to  get the mega dildo that rammed my ass earlier today medically cleared before the one that's probably going to haze me tomorrow shows up.

Bummed to hear that the President will meet for talks in the afternoon. Hopefully the outcome becomes news w/ more than an hour left in trading, leaving enough time for the panic traders to boost me into cover on either side. Earlier in the week, bears blocked bulls at the 297.5 resistance level in epic fashion (for the entire session) propagating a steep bearish reversal at close. That key level will have my attention, representing the strongest bearish resistance before 298.75 (297.5 is the most critical.) If it breaches, a report indicating trade progress - not necessary a deal but + sentiment from both sides - may provide an opportunity for the 300 lotto calls to possibly clear. On the bearish position, 292.4 is my key support even though it wasn't tested to the extent that 297.5 was. If it breaks, further support may present in the 291s before a 290 break becomes even a possibility. I feel that there has to be some relatively negative news for a drop < 288, but market position on the report will be a significant factor here. My wildcard for the session will be the active volume that has failed to materialize most this week, as I feel it will be necessary for a breach of either strong resistance or support levels.

I don't believe the market expects a breakthrough deal tomorrow, but rather, simple progress. Curious to see if the outcome gives the market enough gas to breakout. Lastly, if any of my positions fall writable within reason at any point throughout the session, I will write them and avoid a .01 vs lotto gamble late in the day. If talks happen to extend past the closing bell, that would be mega turbo gay. At that point, I will most likely be found en route back to the hospital for the diagnosis of ass haze #2.

Good luck fellas. Action tomorrow is going to be awesome."
2019-10-11 05:53:36,PinnySkeenus,5,Hang Seng is absolutely ripping
2019-10-11 05:51:06,Desertbears,1,"If trade talks are in fact going well, aren't mms going to keep indices down tomorrow so they can get cheap calls."
2019-10-11 05:50:08,webulltrade,11,"For those thinking a recession is coming next year, it's not. Too many people are expecting one next year so therefore, it won't happen. Many think right after the election, down we go. I don't think so.

It will likely hit around mid 2021, just as most people think the threat of a recession is over. Election is done with, 2020 is done with, no recession, sigh of relief... guards are put down...

then BOOM, like a 100mph freight train slamming into a baby deer in the middle of the night, catching people off guard. That's how recessions happen, when the majority isn't expecting one."
2019-10-11 05:49:23,oriolesa,2,RIP bears
2019-10-11 05:47:51,ApartheidClyde,3,26732 on /YM is 21 day SMA. Important marker.
2019-10-11 05:42:52,TheHorizonDawn,4,Why are futures mooning
2019-10-11 05:41:38,jimmahtimmah,4,An Iranian oil tanker was just attacked. Zoomers ready to die for israhell?
2019-10-11 05:41:07,dnesdnal17,3,Is this G20 night all over again? Dun dun dun
2019-10-11 05:40:56,Chris_TheTrader,5,And on tonights' episode of deal or no deal...
2019-10-11 05:40:15,winkerpack,15,"We're all here to lose money and suck 🅿️🅿️

And we're all out of money 😏"
2019-10-11 05:37:05,maxrenob,8,I sympathise with bears and bulls. But why go one way only? Why not just buy dips and put on longer term hedges in case you buy a dip that turns out to be a mini black swan?
2019-10-11 05:37:01,khanx290,4,"How are you guys managing to sleep tonight? Such a big day, I cant sleep due to anxiety of what tomorrow holds"
2019-10-11 05:36:37,gatoken1,9,"Sorry 🐻

No overnight reversal tonight 😢"
2019-10-11 05:35:27,khanx290,6,Nikkei Shanghai hsi all up huge! Tomorrow can be the day
2019-10-11 05:32:33,vjsworld,4,Any thoughts on AAPL tmrw.. have 232.5 weeklies .. hope i get money
2019-10-11 05:32:06,lunatic_optiontrader,4,Art thou feeling the market now
2019-10-11 05:32:05,Fan_Boyy,9,Do you think gay ppl can masturbate to pictures of themselves?
2019-10-11 05:30:43,winkerpack,4,$BYND has 813k Instagram followers now. Impossible foods has 230k.
2019-10-11 05:30:05,DesoleilMuzik,5,Bears ded
2019-10-11 05:30:02,AgitatedAntelopes,4,tomorrow everything moves but AMD
2019-10-11 05:24:47,ApartheidClyde,4,"If Trump knew a deal was coming, why is the meeting ending at 3:55 PM ?"
2019-10-11 05:24:19,ItsDijital,6,If spy goes back over 300 again I'm clothes-on-craigslist liquidating everything I own to buy puts.
2019-10-11 05:20:38,applesandoranegs,2,"An Explosion In An Iranian Tanker Has Set The NIOC-Owned Vessel On Fire Near Saudi Port City Of Jeddah

Conspiracy or coincidence"
2019-10-11 05:17:18,theycallmeryan,5,"We are doing very well with China, and talking!"
2019-10-11 05:16:58,alighiery360,13," “Anyone who has lost something they thought was theirs forever finally comes to realize that nothing really belongs to them.”  
― **Paulo Coelho** 

Some of us made the wrong bet on this week, our puts expire tomorrow. I hope that the winning side will remember this day and treat our fallen with respect. The capitulation was brought by a sense of distrust in the greatest deal maker of all time; Mr. Mango.

The only consolation that we will find is also the best outcome for the Republic; winning until our heads rotate in their axis uncontrollably. If you ask this humble man, I got tired of winning; so much that I lost in the market. 

Anyway, I hope that your chicken tenders are delicious and enjoyable. 

Until Valhalla Bear Gang"
2019-10-11 05:16:45,winkerpack,5,You think when we're grandpas we will be telling kids how we used to get a coke and cheeseburger from McDonald's for $3 instead of $30 like it is now. Just like how old people today say they got it for 30 cents instead of $3?
2019-10-11 05:16:35,khanx290,2,"Dow futures up 0.5 percent now! What are the chances Dow rises above 1 percent tomorrow, that's around 300 points"
2019-10-11 05:14:39,,2,"My question is.... how much do you drop if there is no deal and tariffs still go into effect? very unlikely he puts more tariffs on like previously stated but a deal is unlikely. Worst case scenario, what happens?

cash gang right now, just so interesting to watch though"
2019-10-11 05:13:38,SushiPants85,3,"Take my morning dump, then head off to my shitty job. Rinse. Repeat."
2019-10-11 05:12:46,oriolesa,4,VIX getting crushed too. This might be the last rodeo for bears who are betting the farm on a short term crash
2019-10-11 05:11:34,nubunit,2,Wow... My 296.5 FDs expiring tomorrow are going to fucking PRINT.
2019-10-11 05:11:19,oriolesa,6,Hang Seng up 2.6%
2019-10-11 05:11:12,greentea45,4,Lol... HSI 3% today?... Looking like it
2019-10-11 05:11:08,hamsupjai,3,bears r ded. all u need to know is that China announced retaliations 3 days ago and didn’t follow through. the deal must be complete
2019-10-11 05:05:38,love2fukmarriedwoman,0,"for people saying it’s a bull trap 
Yeah indexes don’t fucken pump near 2% in a night for nothing ..."
2019-10-11 05:04:15,uninfinity,3,"Closed my BABA calls at loss and got SPY puts before close, knew Mango would pump but didn't think Trade talks going well pump would work. I need to stop underestimating the effectiveness of Trade talks pump."
2019-10-11 05:03:44,greentea45,4,"Really hoping SPX tommorow looks like HSI tonight

Only the Europeans can ruin it for us with their stupid brexit issues"
2019-10-11 05:01:34,love2fukmarriedwoman,0,"“ China trade talks going very well “ 

Happy early holloween 🐻 

Heheheheheh 

🎃 🎃 🎃"
2019-10-11 05:01:09,Big_Factz,2,"This is it bois and gals, the test of 295 will see you tomorrow

think we going above it, magic lines currently show a rising wedge approaching 296, maybe a partial deal sends us flying up out of it"
2019-10-11 05:00:01,daytrader987654321,1,Will DIS finally go up tomorrow or will my account stay flat while SPY is mooning like today?
2019-10-11 04:59:48,oriolesa,4,Shanghai opening back up in 30 sec
2019-10-11 04:59:39,applesandoranegs,8,"That recession last night was pretty scary, thank God it only lasted an hour. Now let's go back to hitting ATH"
2019-10-11 04:59:04,your_mom_loves_me69,2,"Just got back from smashing some legs, took a shit, showered, gonna try to get some head now to help me cope with losses. Looking to scalp some 0 day calls tomorrow regardless of how we open, apologies to bear gang. Made some nice tenders with you guys the past 2 weeks, just to give them all back and more yesterday. Sweet dreams, you beautiful retards."
2019-10-11 04:58:05,ethbux1,3,Futures are gay af and you should be ashamed
2019-10-11 04:57:43,winkerpack,4,Midgetfarm wipes back to front 🧻
2019-10-11 04:55:42,greentea45,1,"HSI futures, premarket suggests a small gap up (26320). Let's see how much longer this rally goes"
2019-10-11 04:53:17,love2fukmarriedwoman,4,"Strength does not come from physical capacity, it comes from indomitable will

Will to prosper 

Will to survive 

Will to fucken win 


🇺🇸🇺🇸🇺🇸🇺🇸🇺🇸

“ give me tendies or give me death “"
2019-10-11 04:51:37,ObsessiveFarkler,1,Bought some INFY calls at the end of the day.
2019-10-11 04:50:52,Desertions,0,tried to buy like 11x spy 294c 10/14s earlier today and i put limit like $0.02 too low and they never bought :(
2019-10-11 04:50:08,mjtumi,2,"Hmmm, smells like a bull trap. Very interested to see what happens during London hours."
2019-10-11 04:48:06,SuperDupler,2,"I do not like this pump. This won’t last until we open, I already know we are opening flat tomorrow"
2019-10-11 04:46:26,DesoleilMuzik,7,B l o O d G r E e N 🐻💥🔫
2019-10-11 04:46:18,AAces_Wild,1, Nikkei 225 pumping
2019-10-11 04:42:14,760prelude,6,This shit better go up. I got calls that need to meet expectations. Nobodys gonna fuck my cousin. Gotta be me out of respect. P.s fuck Brad. Donnie rules
2019-10-11 04:40:59,3fishinatree,7,"The general 

https://www.reddit.com/r/wallstreetbets/comments/dg9zbg/the_real_war/?utm_source=share&utm_medium=ios_app&utm_name=iossmf"
2019-10-11 04:40:09,Slothmeister1123,5,"I know I'm new to this guys and I've only been doing this for a month and a half but I am proud to say that I am up 451% thanks to the inspiration I get from you guys. May one day bulls and bears can live together in harmony, at least until the fire nation attack.(gyna)"
2019-10-11 04:36:04,3fishinatree,18,Guys I think I’m developing a gambling addiction lmao
2019-10-11 04:34:02,Not_reddits,6,My account is blown
2019-10-11 04:32:48,winkerpack,13,Wait. There are some men that actually perform sexual acts with other men? That's not just a meme? Wtf? 😳🤯
2019-10-11 04:31:25,wordscaneverhurtme,0,"Anybody know a good ratio of how many of the opposite options to purchase to hedge against your main directional options? I know puts are more expensive so wondering if I buy 50 contracts of SPY calls tomorrow what is a good hedge against a ""No Deal"" headline drop? Can't wrap my head around it. 1:1.5? 1:2? 1:3? 1:4? I could do spreads but I can't afford to leg out of them on RH and don't want to miss ALL the tendies. I'm thinking this has to do with the Delta but can't comprehend. Thanks in advance."
2019-10-11 04:29:30,daytrader7222,1,"TTD and ROKU are popping up after mk after RBC upgrades.    I Already have some left over 10/18 puts from today.  Both stocks were very weak on strong market Today.  ROKU looked weak after run up from 105 to 120, 2 days ago.  And TTD has been a weakest stock for at least a month or so.       Im thinking about adding more 10/18 puts for both, instead of selling left over puts at the opening.  Since RBC upgrades on both stocks will be short lived.    What do you guys think??"
2019-10-11 04:29:25,HourPackage,0,"Someone explain to me seriously how is a strangle with some extra calls on top not the play for tomorrow?  Sell the calls around 2:45/3:00 while they are in the meeting.  Even if shit hits the fan you've hopefully made enough?

Will I get IV fucked?"
2019-10-11 04:27:30,TSONS1,0,💦
2019-10-11 04:25:56,bigplay85,5,The trade deal still could fall apart. We have been in the cycle before. The pump right before the dump
2019-10-11 04:25:50,winkerpack,7,"Insider? But I dont even know her! 

*zing*"
2019-10-11 04:25:43,oriolesa,1,Fuck I'm kicking myself for selling my 100 $298 10/11 calls for break even 9 cents each. Still holding 100 $298 10/14 calls though
2019-10-11 04:24:39,love2fukmarriedwoman,-10,Universal symbol for CUCK = 🐻
2019-10-11 04:22:22,hawknasty13,4,If there’s a deal and we hit ~304 I’m buying longish term puts.
2019-10-11 04:22:20,braddlersnake,10,Bears fell into the future trap last night now it seems the bulls are falling in to the same one tonight.
2019-10-11 04:21:05,gatoken1,4,"best advice for getting grills:

MAKE HER LAUGH"
2019-10-11 04:20:31,oriolesa,11,F to all the bears here
2019-10-11 04:20:26,,8,Future is already 295 we'll be 300 easily if there is even an article with the word 'deal'
2019-10-11 04:20:18,socialist_baby,11,Pajama traders giving us a taste of the retard energy we’re going to see tommorow
2019-10-11 04:20:10,bigplay85,8,I guarantee if we get anything larger than a gay partial deal. China donated heavily to Trumps personal wealth or gets to buy a portion of our government. Off the books ofcourse.
2019-10-11 04:20:10,,11,Has anybody checked up on Bear General? I actually like that dude. I hope he’s doing alright.
2019-10-11 04:20:08,dontlookup25,3,"Bulls are certain, therefore SPY 282 EOD."
2019-10-11 04:20:02,love2fukmarriedwoman,6,"Ok INSIDER INFO HAS LEAKED 


yeah those futures being bought up Fuckers already know"
2019-10-11 04:19:56,chrisj333,6,"I just looked at the SPY chart with Ichimoku cloud (which sounds Chinese).  The latest green candle is rising out of the poop red cloud like a phoenix.  And there's a fluffy green cloud ahead of it.  As soon as we penetrate the 50 dma, we're back to ATH.  Its science."
2019-10-11 04:19:02,Short-The-Vix,2,"I feel like FD straddles were a risk free play for tomorrow, no way it’s gonna be flat"
2019-10-11 04:19:02,Crosa13,2,Could you get into calls tho? Because my puts were gonna he up 100s of percent after that story then market opened spy was already up and I had to buy them high I’m fine with it I’m confident in them but I still had to buy high
2019-10-11 04:18:32,Hegemon90,5,that green candle on shanghai index is insider trader for full deal. 305 eod tomorrow.
2019-10-11 04:17:51,gatoken1,9,"it's ok  🐻 

we all made a bet and it was 50/50 

i will remember you guys for your valiant effort"
2019-10-11 04:17:48,oshbear,22,First week trading options I’m down 100% this is fun guys!!!
2019-10-11 04:17:06,FOMOhomo,3,Fridays are always green. I win 80% of SPX call spreads I buy that expire on Fridays.
2019-10-11 04:15:44,,4,Tomorrow is the fucking day! we either tank on monday or go green as grass
2019-10-11 04:13:05,bubbaeinstein,-3,Karma :  The DJI will be as red as the Kurds who were betrayed by the orange Turd (aka The Donald).
2019-10-11 04:12:45,betsuni_123,3,"Should I sell my SPY poots at open and buy calls, or...."
2019-10-11 04:12:25,Crosa13,3,Damn I’m sorry man. That dip with Powell didn’t shake me because Powell said he will do anything and everything to stop the country from going into a recession. Right now it’s quantitative easing. I like what he’s doing because until China is thoroughly crushed a recession right now would probably destroy us. He can sound wishy washy but he will stop a recession at all costs. QE was supposed to end in September then October now it’s November. He’s trying to make up for raising rates at the worse possible moment.
2019-10-11 04:12:01,JustAGuyLikeYou,2,"Well, my puts just got assigned so I'm cash poor. Guess I just sell calls and wait. Booooooring. If I sell a an otm leap am I back the action?"
2019-10-11 04:11:52,AAces_Wild,1,"$DAL calls. Failed breakouts this week, then tanked 4% on earnings this a.m. only to rebound to -1.5% on the day. Massively oversold."
2019-10-11 04:11:25,Hunter395,4,"I just got arthritis from tapping my debit card 1,000 times. I'm going to sue for the max amount possible. Everyone buy puts on Robinhood."
2019-10-11 04:08:46,greentea45,0,Think HSI will rally more after lunch?
2019-10-11 04:08:39,uninfinity,5,"Hold your horses, Mango is meeting Gyna vice premier Liu Kang tomorrow  2.45pm ET tomorrow lol"
2019-10-11 04:08:25,peanutbutterjamjelly,3,My second week trading options... it’s been fun. I’m up $139 so far. Hoping not to lose it all tomorrow 🤗
2019-10-11 04:08:24,IllegalArgument,4,"HSI up 2% is breaking my bear heart

Goodbye house money goodbye freedom"
2019-10-11 04:06:12,Droidvoid,4,If I check futures one more time and it’s still green I swear I’m gonna.... cry 😭
2019-10-11 04:06:08,winkerpack,1,Uh oh
2019-10-11 04:05:19,chrisj333,8,My coworker has CNN on and I looked up and saw something about how to make puberty blocker medication more affordable.  Hope mods were watching.
2019-10-11 04:05:08,,0,literally how is not trading FXI free money?  buy right before close on a very green day
2019-10-11 04:02:12,uninfinity,1,"**Market Poll**

[https://docs.google.com/forms/d/e/1FAIpQLSf9FNwIbmFuTa7ACfCm-oySbYiVC6455bhuqnSofUCUWKhWOw/viewform?usp=sf\_link](https://docs.google.com/forms/d/e/1FAIpQLSf9FNwIbmFuTa7ACfCm-oySbYiVC6455bhuqnSofUCUWKhWOw/viewform?usp=sf_link)"
2019-10-11 04:01:27,Steamrrat,8,"I think the most important thing said in the rally was (when referring to the trade deal) ""Wait till you see what...."" then kind of cut the sentence short. Weird. He knows its in the bag"
2019-10-11 04:00:29,,1,How high will SPY go tomorrow if there’s a deal? What do you guys think?
2019-10-11 04:00:18,madamlazonga,3,"I’m sleeping in tmrw. Everytime I’ve woken up for the market this week I’ve sold too early. We’re just gonna melt up till he talks to the their big guy

I hope VXX drops to 20 tmrw"
2019-10-11 03:59:59,HourPackage,2,Wow if this shit holds (yeah i know it won't) the 300c lotto ticket holders are going to make bank
2019-10-11 03:59:45,Harooooouuld,4,"My hopeful scenario

China is pumping one last time until before their close where a massive rush to the door selling event will occur. 

2019 October 11th will be biggest dump of 2019.

Now I can sleep better.  You're welcome fellow bears."
2019-10-11 03:58:20,uninfinity,4,"Wow everyone is bullish for tomorrow, even the pajama traders!"
2019-10-11 03:58:15,oshbear,2,I’m gonna grab the bull by the horns and butt ram it at 6:30 AM pacific time.
2019-10-11 03:53:49,IloveSonicsLegs,3,is Robinhood down? The fuck? I'm trying to cancel an order that never filled today.... MOTHER FUCKER LET ME CANCEL BEFORE MARKET OPEN!!!!
2019-10-11 03:53:44,Flyers179,13,"Jesus Christ anybody see the video of Steve Kerr that just went up online when asked about Chinese human rights abuses.

Motherfucker starts talking about gun violence in America, completely dodges the question, and acts as if the US is deplorable.

Made me physically ill."
2019-10-11 03:53:25,chrisj333,1,Have any of you autists tried an Iron Butterfly into earnings?  How did it work out?
2019-10-11 03:51:58,,2,UPS calls MU puts TLT puts. LETS GOOO!
2019-10-11 03:50:36,mortarboy,4,If china promises to curb IP theft as a result of this trade deal then why would Hang Seng moon in anticipation of it? I get that delaying tariffs is beneficial for both economies but thats childs play compared to what this trade war is really about
2019-10-11 03:50:14,,4,And the third green day
2019-10-11 03:49:08,cookiesxmilk92,3,"Is it possible for this trade deal to be a ""sell the news"" event?"
2019-10-11 03:47:24,leomeng,1,Holding 11/15 puts. Feeling bad man. We still have no concrete news
2019-10-11 03:46:43,HourPackage,12,"Ok, i'm going to admit it.  I sold 10 292c's for a loss yesterday.  FML"
2019-10-11 03:45:47,HourPackage,2,are there options for heng seng that we can trade or a correlated etf that we can trade options on?
2019-10-11 03:45:21,UsuallylurknotToday,5,This dude won't get to bed until 3 AM. No deal- cranky trump coming tomorrow.
2019-10-11 03:43:33,3fishinatree,6,The breakeven on my 3 calls that expire tomorrow is 296.53 and I’m straight up panicked right now. The cockiness is the bulls are somehow making it worse tbh
2019-10-11 03:40:14,,8,I got 99 problems but a put ain’t one 🇺🇸💪😎👌
2019-10-11 03:39:21,TiredOfDebates,8,"Why wouldn’t China want to leak some terrible news tomorrow morning?  (Even fake news.)

We know from White House insiders that Trump watches the market.  By causing a nice lil crash on Friday morning, you get Trump buttered up to cooperate.

WH insiders have said Trump felt free to start the tariff war because of how good the market was doing."
2019-10-11 03:39:01,love2fukmarriedwoman,3,HENG SENG WTF !!! Almost up 2%
2019-10-11 03:38:57,SvenTropics,5,But but but... My puts expire tomorrow :(
2019-10-11 03:38:14,tendiezinmydckies,2,Grinch's bush grean futures has been observed
2019-10-11 03:38:03,BadBehaviour613,2,The trade talk uncertainty is killing me. I am going to give the ps now trial a try and come back here next week to see if we are all speaking Chinese then.
2019-10-11 03:35:54,love2fukmarriedwoman,2," Man after mango speech how the fuck can we end up red ? 

Nvm I seem crazier shit with the stock market"
2019-10-11 03:35:23,HauntedHairDryer,3,If this optimism holds until open I'm selling my calls right away. I do not trust anything
2019-10-11 03:34:11,khanx290,9,"Yolo play 
http://imgur.com/gallery/xMjkNMc

Post yours!"
2019-10-11 03:32:00,rustyryan27,1,🤤 🤤 🤤
2019-10-11 03:31:21,DiprotodonGang,4,"u/yungbillionaire 

You making any China trade talk moves???"
2019-10-11 03:29:45,khanx290,2,I feel sad for bears. I have calls myself for 40k usd qqq but I have been on other side myself many times and it really sucks
2019-10-11 03:29:18,,3,It’s only gambling if you admit you have a problem
2019-10-11 03:28:55,DeMayon,9,"https://www.reddit.com/r/SubSimulatorGPT2/comments/deou74/what_is_the_strategy_behind_buying_stocks/?utm_source=share&utm_medium=ios_app&utm_name=iossmf

LOL.. These bots have better investing advice than r/wsb

For context: the entire subreddit is ran by bots and humans upvote the content. Posts and comments are created by bots

>”it’s like buying a lottery ticket and you’re hungry for the blood”

>”that’s just called a stock exchange”

Top banter

Edit: LMAO https://www.reddit.com/r/SubSimulatorGPT2/comments/dg631w/whats_the_most_underrated_movie_in_your_memory/f39ie7o/?utm_source=share&utm_medium=ios_app&utm_name=iossmf"
2019-10-11 03:28:48,TSONS1,8,🐻🐻
2019-10-11 03:28:10,RubenZ217,7,Press F to pay respects to all autists who have puts expiring tomorrow.
2019-10-11 03:26:58,knotswag,16,"I'm sitting here staring at my blood-red puts and after careful thought and reviewing why I got into the position, I realize that even though I am absolutely retarded that I made the best decision I could given my understanding of the situation and sentiment. I'll die with the other bears tomorrow, but this is one of those mistakes where I would probably make it a hundred times again only because I have conviction in how I reached my conclusion. When I lose it all I'll buy some pumpkin pie filling on Saturday and just stare at my conservative IRA portfolio for a few months until I get enough capital to start flipping FDs with you guys again."
2019-10-11 03:26:44,,1,If crowdstrike could hit 68 tomorrow that'd be dope
2019-10-11 03:25:18,Frijolesenyourmouth,4,Pajama traders are sheep
2019-10-11 03:25:09,yuckfoubitch,8,"Market going to open +1.5% then crash to -5%. Everyone on wallstreetbets will make money, and we will all be so incredibly happy until it rallied back to -1% and we all die to theta. Prediction"
2019-10-11 03:24:10,oriolesa,6,"Holy shit, Hong Kong indexes up nearly 2%"
2019-10-11 03:24:09,hamsupjai,1,gyna has been defeated. hah retaliation!? spineless cucks ended up doing NOTHING
2019-10-11 03:23:44,DiprotodonGang,4,Wish I had kept my 292c’s.  FOMOn right now.  What can I get into tomorrow that will allow me to tingle all weekend long?
2019-10-11 03:22:15,oriolesa,4,Futures are mooning
2019-10-11 03:21:43,sitis172,1,What’s up with AMD? Are we going to get a little rally before ER? My 10/18 $30 calls don’t look so good right now. PS5 and Xbox Scarlett both using AMD chips. Not to mention Microsoft and other tech companies started using more AMD products. Anybody got input on this?
2019-10-11 03:21:42,socialist_baby,2,Futures r pumping
2019-10-11 03:20:41,HowLongCanIMakeAName,3,The wife just stole my 05 vette and ran over Mackenzie (lol she gets wild when she has too much moscato) anyway time to relax and put on some stones amirite men 😎👍
2019-10-11 03:19:21,meow1616,4,"I have a feeling this shit will rally similar to coming out of August this year. We rally to ath all month, then perhaps sink back down to close the year on the real economic problems."
2019-10-11 03:19:11,,2,"Sleep. That's where I'm a viking!

Ready for a fucking crazy day tomorrow.

Or maybe just a bunch of fucking sideways"
2019-10-11 03:19:02,Howtoshortdow,3,🌝!
