date,author,score,body
2019-10-17 22:37:19,benaffleks,1,Well here we are my friend
2019-10-11 13:06:30,seqilol,2,roku what the fuck
2019-10-11 13:01:57,zeion,10,my move is to moms basement
2019-10-11 12:59:22,Kannoj0,0,"blizzard (atvi) puts feel safe.

&#x200B;

[https://www.forbes.com/sites/paultassi/2019/10/11/activision-blizzard-is-completely-silent-and-barreling-toward-an-awkward-blizzcon/#7d321d4478bf](https://www.forbes.com/sites/paultassi/2019/10/11/activision-blizzard-is-completely-silent-and-barreling-toward-an-awkward-blizzcon/#7d321d4478bf)  

[https://www.bloomberg.com/news/articles/2019-10-11/gamers-want-to-get-blizzard-in-trouble-with-china](https://www.bloomberg.com/news/articles/2019-10-11/gamers-want-to-get-blizzard-in-trouble-with-china)

[https://www.pcgamer.com/the-hearthstone-team-that-protested-blizzard-hasnt-been-reprimanded/](https://www.pcgamer.com/the-hearthstone-team-that-protested-blizzard-hasnt-been-reprimanded/)

&#x200B;

[https://www.thedailybeast.com/blizzard-employees-staged-a-walkout-to-protest-banned-pro-hong-kong-gamer](https://www.thedailybeast.com/blizzard-employees-staged-a-walkout-to-protest-banned-pro-hong-kong-gamer)"
2019-10-11 12:00:25,PuzzledJournalist212,3,"This market is so hungry to pump, we’re just under 300 because China markets have rallied, we haven’t even gotten the decision/terms of the trade deal yet, wtf"
2019-10-11 11:46:55,least_competent,9,"I have dreams where I'm trading options and looking at charts, then I wake up and realize I haven't held a position in months. No wonder I'm not feeling well."
2019-10-11 11:42:42,vjsworld,2,Can AAPL.hit 235 today ?
2019-10-11 11:42:03,dodoei,2,3000 3000 3000
2019-10-11 11:34:13,-random-,3,just realized I bought some SPY 298.5C FDs on Wednesday.  Looks like they might actually pay off.
2019-10-11 11:26:12,stricksrforkids,5,Snap is due to pop off soon
2019-10-11 11:10:04,Tefwan,2,Very legal very cool
2019-10-11 11:07:01,DillonMeSoftly,10,"As a call holder I'm ok with this. But as a degenerate stock watcher this market is so fucking dumb now. Everything just happens during futures. We might as well not even have an open market anymore.  

Like look at ROKU yesterday. Stayed in a flat range basically all day only to shoot up overnight. Shit is dumb"
2019-10-11 11:05:29,RoyalDrake,5,Bear general almost inspired me to follow his suicidal charge into battle. Can someone make a gif of the last samurai chronicling u/IS_JOKE_COMRADE and his week so far
2019-10-11 11:04:15,SquanchMcBlanch,3,🐻🐻🐻🐻🐻🐻🐻🐻🐻🐻🐻🐻🐻
2019-10-11 11:02:14,astrangeaim,5,RIP my puts
2019-10-11 10:59:25,visionarymind,12,"Geezus 😳

🎖🐻🎖...

😭😭😭"
2019-10-11 10:56:38,WACS_On,1,"Cashing in the call leg from my SPY strangles today, holding on to the now worthless put leg cause fuck it why not, they expire 10/18 so plenty can happen in the next week and bring them back. Also buying me some TVIX with my gainz since that shit'll be near 52 week lows"
2019-10-11 10:56:06,Th3_Capitalist,3,Imagine if we hit 300 today
2019-10-11 10:55:48,rvrctyshrds,1,"Plot twist? 


https://www.apnews.com/55f68b50763c40eeb25ee19027573d86"
2019-10-11 10:55:37,FOMOhomo,1,Keep melting upward you dirty little whore S&P500. I will fucking credit call spread you real soon and make it rain tendies on your bitch ass.
2019-10-11 10:51:11,uhhhevan,1,RIP my single nov 1st 290P. Probably after -50% by the bell
2019-10-11 10:49:05,,6,"Oh shit, three day trades today. This could be a fun one!"
2019-10-11 10:46:45,winkerpack,1,$CRWD tanking wtf
2019-10-11 10:45:31,winkerpack,3,A *sticky* a day keeps the doctors away
2019-10-11 10:44:56,ek0209,4,"When a trade deal is made, we get a +2% day, maybe 3%. Then everyone again realizes macro numbers are slumbing month after month and we’ll enter bear season. 

Hope for a succesfull deal is the only thing that keeps us at current levels. As soon as a the deal is here, it’s all over."
2019-10-11 10:43:37,heavenlyblues,4,So did the market just go full on erect from Trump’s beautiful rally speech last night?
2019-10-11 10:41:45,Cloud-ee,8,A lady just walked by while I'm looking at premarket and her perfume is so strong... I CANT BREEEEEEE
2019-10-11 10:41:27,Therealmohb,1,So SPY puts or calls after open??
2019-10-11 10:40:58,usernemame,3,Oh god
2019-10-11 10:38:59,hamsupjai,7,"1) US continues to shit talk China at every opportunity. Gyna stays silent


2) US/China reach ‘mini deal’. Looking at the terms, only China is laughing to the bank (america big cock - south park episode)


3) All IP theft off the table, tariffs delayed (lmao because of Thanksgiving/Christmas). In return concessions, China buys 10bn more in soybeans than in 2017


4) Art of the deal. SPY moons to $400. Tech and semis rally to beyond ATH because of soybeans


5) Bears left in disbelief as Trump continues touring ‘Murica while shitting on China and touting the greatest deal that has ever been made"
2019-10-11 10:38:54,rvrctyshrds,1,"Once again my PDD calls are going to rip today, hell yes."
2019-10-11 10:38:48,,8,😳 Hang Seng 600pts 2.34%
2019-10-11 10:37:42,,1,"Three hours until any of those numbers are real. But futures look nice for my calls. Let's hit like, 300 by noon and then crash super hard. So I can offload my puts ;)"
2019-10-11 10:36:56,Master531,-5,Futures up half a percentage point and every bull out here celebrating
2019-10-11 10:36:51,seqilol,4,if $tsla hits 250 today i will suck my own dick
2019-10-11 10:34:58,Thosaiman,1,Just look a sip of my morning India pale. Alls good.
2019-10-11 10:34:27,madamlazonga,4,Got off work an hour ago. Stuck in traffic bc of a fire. Won’t be home till probably after market open. At least the no sleep will keep my selling fingers steady
2019-10-11 10:33:33,hello2016,7,"my big, cold bear dick hurts"
2019-10-11 10:33:17,bagdraggerdad,5,Thank you baby Jesus for my diamond hands that wouldn't let me sell these spy 300 10/14 for 300% profit yesterday. I bought them for $8.
2019-10-11 10:29:03,gettendies,4,"Last of my SPY puts today

https://youtu.be/QEv3zzKyiFQ"
2019-10-11 10:28:45,stricksrforkids,4,Wtf HSI up nearly 2.5% wonder if they know something we dont
2019-10-11 10:28:04,notawallstreetbetter,3,aaaaaaaaaaaaaaaaaaaaaa big green
2019-10-11 10:27:51,UsuallylurknotToday,-4,Futures are already pulling back. They were over 1% a little earlier unless I was still having nightmares.
2019-10-11 10:26:06,MontaukNightSky,6,Think my SPY 10/11 292 and 293.5 calls today will dig me back out of the 56% loss I had over the last two days? Reversed from 290 puts yesterday.
2019-10-11 10:25:36,mommommamamamama,0,Good morning gents.  Sorry if this has been asked but why the mooning?
2019-10-11 10:25:21,khanx290,1,Cant sleep
2019-10-11 10:24:25,Cnastydawg,2,"Okay but I’m going to need Facebook to drop
by next friday. All my calls can thrive until then"
2019-10-11 10:24:17,,2,Gee Willikers Batman thats alot of Green
2019-10-11 10:24:08,,3,All the large cap stocks have big green morningwood
2019-10-11 10:23:29,heavenlyblues,3,Uh... I wish I had bought those calls
2019-10-11 10:19:43,humm1010,0,Oof
2019-10-11 10:18:42,minin71,4,"I almost respect the bears on this sub for being this retarded. But hey,  we are always one tweet away from disaster again so you never know."
2019-10-11 10:15:11,,2,"Why did I buy BBBY puts yesterday? Fuck you whoever inspired me to do such a foolish act.   Thank God they are expiring November 15th.



(I hope to thank you if this bet proves worthy)"
2019-10-11 10:15:04,Midgetfarm,3,WTF is a matter with gold. Rate cuts and QE. Iranian tanker just got bombed
2019-10-11 10:13:19,iggaguy,5,AMD with the pre-market pump then will probably drill at open like it always does.
2019-10-11 10:13:02,Cnastydawg,6,Wow I can’t believe this spy 300 call is going to be an x bagger overnight after I bought it
2019-10-11 10:11:40,Thosaiman,6,Futures very green for now
2019-10-11 10:09:07,BigDG0esHard,8,"Yeah I’m going to just play RuneScape or something. Meeting is at 2:45 today, so we probably won’t know the results until after close"
2019-10-11 10:08:22,CarminSanFrancisco,4,Oh wow. Bought 10/11 calls right before EOD yesterday. I am erect.
2019-10-11 10:07:19,,6,Looks like I sold Calls and switched to puts too early yesterday but ya know.. who knows.. we’ll see.. maybe
2019-10-11 10:06:06,Thosaiman,-3,Futures are green for now. But shuts gonna hit around 9
2019-10-11 10:05:22,aqualityusername,3,Time to load up on UVXY calls or TVIX
2019-10-11 10:04:41,Difth,1,"Recent past dips have resulted in even bigger recoveries ! Refrain from buying puts ! Later, maybe at a new ATH when we'll see a natural drawback!

Do whatever you wanna' do!
If TA is your indicator as it shows downturn soon then so be it!"
2019-10-11 10:02:12,Cnastydawg,1,Feel kind of dumb for selling my LULU $200 C now . Still have $205’s though lol
2019-10-11 10:01:32,your_mom_loves_me69,7,"Jesus christ, someone talk me out of buying 0 day calls at open"
2019-10-11 09:59:23,ANNND-ITS-GONE,2,"Have a couple 295C 10-11, expecting to see some moon exploration; question is do I sell at open or wait till mid afternoon? Don’t want a challenger-esque explosion mid air."
2019-10-11 09:59:21,bobbyhagh,1,What does this mean for TLT?
2019-10-11 09:58:47,WhiskerTwister,4,Worth it to buy calls at open or is it too late
2019-10-11 09:57:18,Smart202020,6,So is futures pricing in a trade deal?  Or will it moon even more after a trade deal is announced?  Or will it tank when the trade deal isn't what they expect it should be?
2019-10-11 09:56:22,Treecrust,5,Cool now let's do the same thing we did last night and have a huge ass reversal
2019-10-11 09:55:20,,8,I just checked futures LMAO fuck my life I’m going to bed
2019-10-11 09:53:28,lowkeyifuxwithjuice,1,This is epic 💯
2019-10-11 09:52:35,gettendies,6,Mother....of....God......
2019-10-11 09:50:43,mcqueenman1010,1,Does anyone plan on buying SNAP calls before earnings?
2019-10-11 09:47:27,ELMOPINO,6,R.I.P. Bear gang
2019-10-11 09:46:26,IRPhysicist,6,"Pro tip: you can use Apple Pay to fund your TD Ameritrade account the same day.  Bring on the degenerate gambling.

EDIT: SAID DEPOSIT CANNOT BE USED FOR OPTIONS SAME DAY."
2019-10-11 09:45:59,NothingTooFancy26,1,Do I buy spy calls at open if I don’t have any day trades or do I sit today out?
2019-10-11 09:37:09,,2,"Edit:Will wait for confirmation to repost


Also You need moar alts to downvote me in oblivion."
2019-10-11 09:34:26,4dr14n,1,This whole Iranian oil tanker allegedly blown up thing is like The Sum Of All Fears. Amazing time to be alive lol
2019-10-11 09:33:57,syntheticapathyy,3,"praying for 297 by open, anything higher is just a cherry on top. please lord"
2019-10-11 09:33:20,nebula504,5,I hate how i have a serious gambling problem
2019-10-11 09:31:29,,1,"Built up hopes, torn down dreams"
2019-10-11 09:28:20,,8,"Alright, doubled down and betted my entire $2000 savings on puts. Let's fucking go."
2019-10-11 09:24:55,bruinthrowaway6969,0,Msft puts at open
2019-10-11 09:23:11,market_gaper,8,Market is slowly edging itself higher until it blows its massive load all over SPY 300 at the close and then immediately passes out for the weekend.
2019-10-11 09:22:46,winkerpack,-6,"r/dudesindiapers vs r/yiff 

Vote below 👇🏻"
2019-10-11 09:15:42,winkerpack,-1,I dont see how people think the tesla model 3 interior/dash looks good. It's a steering wheel and a tablet. Looks so cheap
2019-10-11 09:13:13,Difth,2,All of WSB expect bad news!
2019-10-11 09:12:26,hamsupjai,3,fucking fake headlines 24/7 that dictate how billion$ move
2019-10-11 09:12:03,,1,"Okay:No iran/KSA war.Sanity prevails in the world and people dont get baited easily👁

Oil and metals need to go down

https://twitter.com/miriam411/status/1182581672807718913?s=21"
2019-10-11 09:11:07,vjsworld,2,Any thoughts on AAPL Today? 235 possible?
2019-10-11 09:07:27,wsb_mods_R_gay,3,"Trade talk is going super well, but a deal? Nah we saving that for another quarter."
2019-10-11 09:06:15,freehouse_throwaway,6,jesus this pre market...
2019-10-11 09:06:04,bruinthrowaway6969,2,How much are my 10/18 $300 spy calls gonna be up at open?
2019-10-11 09:05:37,,1,"Breaking news:Owner of oil tanker denies being hit by missile.....WTF....dump oil

Only of WSB

https://twitter.com/skynewsarabia_b/status/1182581417684942848?s=21"
2019-10-11 09:02:26,HeinousVibes,1,Sell SPY calls today after open or hold through the weekend for that sweet trade war news tonight?
2019-10-11 09:02:07,Midgetfarm,4,Morning homoz. Been only getting 4 hours of sleep everynight this week. Tired as fuck
2019-10-11 08:58:46,benjohnson1988,3,High on hopium
2019-10-11 08:57:48,,1,"Iran says missiles not from saudi......someone check with Israel😀😀They have been trying hard to start Iran war and get saudis and usa pay for it.

https://twitter.com/firstsquawk/status/1182576191057747968?s=21

Die oil."
2019-10-11 08:55:53,applesandoranegs,5,Is it too early to say RIP to analfarmer2 2.0? (-Hyre)
2019-10-11 08:54:55,small_root,2,"Yup, I'm fucked today. Not even going to bother checking until lunch."
2019-10-11 08:54:52,winkerpack,2,"Should I touch it, or save my *sticky* for open 🤔"
2019-10-11 08:54:11,chinnick967,3,Snap is gonna moon today after releasing that EU advertising profits have doubled on top of today's market rally.
2019-10-11 08:53:08,tendiezinmydckies,3,Bears r such bigly gays
2019-10-11 08:51:38,Michael---Scott,4,Bears we're dead in the water. Fucking a.
2019-10-11 08:51:00,notawallstreetbetter,2,i got the trade deal on my mind
2019-10-11 08:47:14,syntheticapathyy,1,Serious question if I have a SPY 300C expiring today what would be the ideal time to let go of it before it becomes completely worthless because of IV/theta? (I'm completely new to options)
2019-10-11 08:46:52,4dr14n,5,"Holy shit futures up bigly 

we mooning today boys, congrats to call holders!!"
2019-10-11 08:44:33,vjsworld,1,Any chances for AAPL to hit 235 today?
2019-10-11 08:44:18,PinguPingu,1,RIP put YOLO's may your loss porn comfort you.
2019-10-11 08:44:17,Shiftz,2,Does a trade deal hinder the odds of a Fed rate decrease?
2019-10-11 08:41:52,dontlookup25,1,Need this to moon a little bit more so the drop off can be extra juicy.
2019-10-11 08:40:08,justinswagvila,1,Nooooo my shorts :(
2019-10-11 08:38:03,,1,I’m riding some JPM calls tomorrow gonna jump to $115-$116 easily
2019-10-11 08:35:36,,5,"Warning NSFW:

Its 1:30 and I am drunk.

Sharing pic of my d*ck(for 🌈 mods)


https://imgur.com/gallery/DLodmpw


DM me for naughty chat🍆💦💦💦"
2019-10-11 08:31:37,nubunit,7,IM SOOOOOO FUCKING HARD. My 296C FDs expiring tomorrow are almost ITM.
2019-10-11 08:30:42,bruinthrowaway6969,1,Why we mooning
2019-10-11 08:30:11,deposit_reg,5,RIP to bear puts which will expire worthless today followed by announcement of no deal after market close.
2019-10-11 08:28:46,,3,"Its just me now👀👀👀

Will share my d*ck pic in another 5 minutes"
2019-10-11 08:28:44,long_AMZN,1,\*CHINA TO SCRAP FOREIGN STAKE CAP ON SECURITIES FIRMS DEC. 2020
2019-10-11 08:22:51,Sinadins,4,Going to sleep peacefully knowing I'm hedged perfectly.
2019-10-11 08:12:10,chinnick967,3,"May be time to go long on Snap again

https://www.cityam.com/snap-reduces-overseas-losses-as-revenue-doubles/"
2019-10-11 08:10:18,Shmokesshweed,5,"It's 1 am and I was just randomly reminded of Tony Hawk Pro Skater 2 so I downloaded the ROM. Wow what a throwback to 20 years ago...all running on my phone with zero hiccups for free.

Getting nostalgic af and I'll prob lose a good chunk of money tomorrow but fuck it"
2019-10-11 08:03:42,,10,"This aint good for us 🐻s

😫😫😫

🐻🔫"
2019-10-11 08:03:42,IRPhysicist,6,"I’d say the bears are fucked on this one. Every index around the world is up over 1%.

Keep in mind we have roughly 11 hours till closing."
2019-10-11 08:03:26,hello123654,9,My poots are fooked. See yall bears at the soup kitchen later today
2019-10-11 08:03:18,scroogemcdub,4,"Now we are getting Brexit hopes too. Two nails in the 🐻⚰️

Or it’ll be Hiroshima on all the bulls unexpectedly. Spooky October bros!!! Woo"
2019-10-11 08:01:41,StopDoxxingMePls,3,"Well I'm out for a month or two. Iran attack killed my USO puts for next week.  

Bye for now!"
2019-10-11 08:00:23,Michael---Scott,5,Bears 🐻 look real desperate and bulls look too cocky.
2019-10-11 07:54:42,theycallmeryan,2,Visa better fucking go up with the market this time
2019-10-11 07:52:36,WACS_On,5,Maybe my USO calls weren't a completely retarded decision after all.
2019-10-11 07:48:07,chinnick967,9,Imagine thinking stonks go down
2019-10-11 07:45:08,oshbear,5,"Trump will storm out and and boot Miami vice from the White House premises. Once done, tariffs will increase as scheduled. Miami vice chairman will ban apple from operating in China. 

Spy and 183 by noon Shanghai time. AAPL at 126 by then as well. 

Grab the bulls by the pussy"
2019-10-11 07:43:23,MostlyKelp,19,I just ate a girl out and she did not return the favor. This is the darkest timeline.
2019-10-11 07:39:51,ApartheidClyde,8,"""China ""desires"" to work on it with Trump team""

anyone who knows asians know what this means. It means no Trade deal. They tell you to fuck off nicely."
2019-10-11 07:38:07,davidbigham,4,"Trade talk going very very well . Hence, market mooning. Works everytime"
2019-10-11 07:37:31,winkerpack,8,Who else is up? Let's get a circle jerk going 😏😎😂💦
2019-10-11 07:34:56,GodOfDarknessWine,7,"Iran Tanker was struck by a missile.
Oil Price went up by 2%."
2019-10-11 07:34:15,tendiezinmydckies,7,Looks like our middle eastern friends are playing a game of battleships children
2019-10-11 07:30:45,Dreadster,5,I just wanna see AMD shorties roasted like pigs tomorrow. Please deliver my dream God Emperor Mango!!! 🤞😬
2019-10-11 07:27:22,GodOfDarknessWine,7,"I want to see the China trade ""deal"" collapse, with escalating sanctions, 90% tariffs, American corporations heavily, heavily fined and punished by Congress.

I want to see Tim Cook publicly executed by the American government for bending the knee to China.
All American corporations that cave to China should be executed."
2019-10-11 07:24:45,uninfinity,14,"Here is what I think will happen tomorrow.

1. Mango will delay tariffs until March 2020 or some random date
2. Gyna will agree to buy more corn and promise better control over counterfeit products
3. Mango would lift restrictions on Huawei
4. US and Gyna sign a ""good faith"" interim deal with temporary ceasefire of retaliatory tariffs or with some sort of ""currency pact"" gesture
5. Trade talks for a final deal will continue through end of 2019"
2019-10-11 07:22:28,,3,"Iranians say missiles possibly originated from saudi arabia😀😀🐻🍆💦💦💦💦💦

Wait for retaliation😉

Mossad has upped its game to get them to fight😃"
2019-10-11 07:12:56,applesandoranegs,2,"Why tf did my can of soup make a loud pop when I opened it? Am I gonna get botulism and die?

edit: Ok decided to open a new can and that one only hissed a little, either this one is normal or it won't have as much botulism so I'll be ok"
2019-10-11 07:07:45,Chris_TheTrader,1,Saudis y do this?
2019-10-11 07:04:13,,3,USO calls
2019-10-11 07:04:10,Anowoz,7,Just finished watching Joker 🃏 and it was pretty good 9/10
2019-10-11 07:01:47,GodOfDarknessWine,-7,"You austists keep falling for the same bullshit over and over again.
It's either a nothingburger, or trade talks will collapse.
If it's a nothingburger, Mango will fuck it up this weekend.
There's rising pressure to fight back against China, people are pissed about Hong Kong and American Corporations ass kissing President Winnie.

Mango will fuck it up either way, Bears will have their revenge, and most of you will cry over your puts.
China and the USA are fighting over domination.
The Pentagon would rather stage a mutiny then allow China to dominate the USA. Would be nice seeing more public pressure towards Congress to pass bills, even override Mango to really crack down on China, weaken them economically and militarily."
2019-10-11 07:00:25,i_am_archimedes,4,"its 3:00am

time for the saudis to sell"
2019-10-11 06:58:33,Throwaway1999999asdf,5,"If a deal is announced, we are mooning for the next week. Alot of ppl have been sitting on the sidelines with cash to see the outcome of these talks the past month or so. I wouldn't be surprised if we hit 305 next week."
2019-10-11 06:51:00,Shmokesshweed,2,Lol fuck these futures man
2019-10-11 06:45:06,winkerpack,7,I'm going to dip my 🅿️🅿️ and 🅱️alls in hand sanitizer then stand in front of a fan
2019-10-11 06:41:22,wing_of_wax,2,Crude oil futures up 2% . Is the Iran situation worsening?
2019-10-11 06:41:13,Hanz-Wermhat,13,"You autists really think mango and Winnie are gonna stand up at the fucking press conference and say ""ya we fucked it, tariffs to 100%, we will never make a deal because we both want deals that are fucking diametrically opposite to each other's geopolitical goals""

No, Winnie will give Donny a hamburder and donny Will give Winnie a pot of honey and they will agree to ""framework"" for ongoing talks or some other bullshit and reconvene in November with a truce to tariffs in the mean time. 

Donny pumps the fuck out of stocks and xi drags it out giving him more leverage whilst getting closer to elections and putting more pressure on mango via the slowly tanking economy.

Or version 2.0 without a tariff truce sees Mango ratchet up the pressure via increased tariffs in a few weeks tweeted from the toilet on a Sunday night right after you bought calls"
2019-10-11 06:41:00,,2,Iran tanker stuck by two missiles near KSA port
2019-10-11 06:39:40,Beyond_Duality,0,www.thesun.co.uk/news/10111909/iranian-oil-tanker-explosion-near-saudi-arabia/amp/
2019-10-11 06:37:14,khanx290,7,How much will qqq and spy close tomorrow if trade deal does happen??
2019-10-11 06:32:26,nfa1234,-1,"Wow futures are COLLAPSING now, I'm going to bed and hopefully this recession is over by the time I wake."
2019-10-11 06:28:47,,2,"I think when people see continuous green day’s they forget that one red day = 3 of the green day’s and underestimate how much we can drop on bad news. people expect just a couple dollars of spy, if tomorrow doesn’t sound like “trade talks are going well” then we could easily see $280 monday and if things get to blacklisting then $267-270 by friday"
2019-10-11 06:27:07,MangoMan69x,3,Is anyone buying pge
2019-10-11 06:25:20,The_Devils_Triad,3,Are marijuana stocks ever going to turn around?
2019-10-11 06:19:54,YepRabbit,3,Which of you bombed the Iran ship?
2019-10-11 06:18:10,3fishinatree,2,[night night](https://m.youtube.com/watch?v=q9Nqqs9xvPE)
2019-10-11 06:17:15,sunderw33,13,Just lost 100 bucks at the casino in 6 hands of blackjack. I think I'll stick to spy puts where I can at least sell them for 80% loss instead of 100.
2019-10-11 06:14:42,dfoolio,7,"Knowing Mango, he’ll probably extend the trade meeting through market close.

He won’t receive the deal he was looking for, so he’ll storm out of the room and tweet angrily all night like a cuck boy incel who got denied by a prostitute."
2019-10-11 06:14:15,greentea45,3,"metals popping, oil popping
everything popping"
2019-10-11 06:13:35,dungbat83,2,Metals popping
2019-10-11 06:12:27,gbplfnt,5,"boys its not about tendies or money. Its all about a sign of togetherness, lets suffer our losses together, get high... And jump from the cliff, there is no light in life without muni"
2019-10-11 06:11:14,,1,"Give him a lever, orthopedic shoes, and a clue"
2019-10-11 06:10:57,winkerpack,2,"If CRWD goes to 65+ tomorrow, I'll give gold to the person who guesses the closest to closing price."
2019-10-11 06:10:55,applesandoranegs,5,Wow looks like that Iranian tanker really was hit with a missile. If it was the Saudis shit is going down man
2019-10-11 06:10:46,dnesdnal17,5,Is the military wife down my street going to be available soon?
2019-10-11 06:07:18,i_am_archimedes,0,when i'm president and nuclear power plants are legal in the USA again I'll make sure all the waste is stored in mecca
2019-10-11 06:03:34,,1,3010 or bust. Y'all fake ass weak ass hands.
2019-10-11 06:02:33,khanx290,3,Why Dow failing??
2019-10-11 05:58:31,,2,Well boys it's finally time to end it
2019-10-11 05:58:01,oriolesa,4,"Shanghai mooning too, up 1.1%"
2019-10-11 05:57:43,knotswag,6,"The truest way to fuck over WSB is for the trade deal to be confirmed as done, there's a moon, bears run screaming into the forest, and within the hour JPow confirms no rate cuts and it all comes crashing down and bulls are collectively slaughtered. In the end theta gang stands triumphant, though uncertain of how they could come out victorious."
