date,author,score,body
2019-11-18 23:31:49,whitestansmith,2,What are some optometry related stocks? Imma stock up *wink wink* on them because I see many people near blind in twenty years
2019-11-18 23:29:48,mortarboy,2,UNH puts til sub 265
2019-11-18 23:29:08,diego_tomato,3,If theta gang was an animal (like bull and bear gang) which one would it be
2019-11-18 23:28:52,deposit_reg,9,"What's the minimum buy-in to get into the Vision Fund, /u/visionarymind?

I'm out here rubbing two sticks together while this emoji savant is outperforming Dalio's Pure Alpha Fund."
2019-11-18 23:28:24,RareUnicorn,7,"I swear the only person watching the markets more than most autists in here is Donnie himself. You KNOW he's staring at RH all day every day when he's constantly sending out tweets. 

For all we know the dude sends a tweet and literally goes and watches futures pop or drop..

You ever think he starts panicking when he sends a pump tweet and pre-market instantly starts falling.

""WHAT? That was a great tweet. A strong tweet. The *perfect* tweet. These markets really are retarded, huh? Those r/wallstreetboys are on to something, I should see what they're saying."""
2019-11-18 23:28:08,jimjoekelly33,7,"No, this is Patrick."
2019-11-18 23:27:52,jimjoekelly33,4,KRTX? What the fuck lol
2019-11-18 23:27:35,Bollinger_bandz,4,Who’s still doing NNN? Less than 2 weeks till we can 🔨 🥩 again
2019-11-18 23:26:11,ServedSoft63,2,Markets: [This is fine](https://www.reddit.com/r/worldnews/comments/dy71be/_/f7z3t3y?context=1000)
2019-11-18 23:24:10,Kakilli_,2,What the fuck happened to my precious Roku? Or is this just another dip to buy 🤔
2019-11-18 23:20:38,fairygame1028,2,Picking up more APHA calls tomorrow
2019-11-18 23:20:27,snowdaruma,2,Hey can you all do me a favor and tell everyone you know to buy from AMZN and don't shop at TGT or WMT for Thanksgiving/Black Friday shopping? Thx
2019-11-18 23:19:54,BlueKnightJoe,11,"Let's talk about Trump and Powell meetings. The first Trump and Powell dinner was on February 4th, 2019. It was at Trump's invitation. They had steak (presumably well done with ketchup). Trump and Mnuchin sat on one side, with Powell and Clarida on the other side of the table. They discussed ""recent economic developments and the outlook for growth, employment and inflation.” The Fed switched directions and went from rate hikes in 2018 to rate cuts in 2019. There were no cuts until *after* this dinner took place.

Another private, unannounced meeting between Trump, Mnuchin, and Powell took place today, again at Trump's invitation. ""Just finished a very good & cordial meeting at the White House with Jay Powell of the Federal Reserve. Everything was discused including interest rates, negative interest, low inflation, easing, Dollar strength & its effect on manufacturing, trade with China, E.U. & others, etc.,"" Trump tweeted following the meeting.

We'll probably never know the exact words used, but it seems likely Trump is trying to bribe, pressure, and/or threaten Powell into cutting rates again in a big way. Powell for his part is probably doing his best to appear non-partisan, and we already know from public statements that the Fed wants to keep rates where they are until early 2021, unless the data changes significantly. Trump probably asked him questions like, how bad would things have to get before you would decide to cut rates again?

The timing of the next FOMC rate decision comes on December 11th, a few days before the December 15th tariff deadline. Right now the FedWatch Tool shows it's almost certain they will not cut. If I was Trump and I wanted to make the Fed decide to cut, I might announce a failed China deal and more tariffs *before* December 10th.

Trump would like to have 1. stock market at ATH   2. bigly tariffs on China   and 3. negative interest rates... the job of his advisers is to remind him it's impossible to achieve all three of these objectives at once. We'll see which is the most important to him. So in conclusion, either the rates will drop, the tariffs will drop, or the stonks will drop."
2019-11-18 23:18:56,KAsilvey,5,"Woke up this morning to 154% gain on my AMD calls, how autistic would I be to hold through the week in hopes of furthering my gain? In the past month, AMD has been on the come up and I don't see it slowing down...my calls expire Friday."
2019-11-18 23:17:42,therealshakezula,3,"Is it a safe ish bet to say whenever spy does sell down next that it will likely get bought up before any kind of cascading red days 

Basically should I all in on the next red day"
2019-11-18 23:17:09,,4,🙏🏻🐻🙏🏻 -400 -800 tomorrow pretty please
2019-11-18 23:17:05,knotswag,2,[Put buyers in a nutshell.](https://www.youtube.com/watch?v=s4GAj2v4BIE)
2019-11-18 23:15:57,Truethoughts92,0,"Ever see some girls you'd know youd pork but no one else could know? (Except wifey lmao fuck she would have to be ok with it) like this one girl at dunkins donuts I saw. Bitch was chubby as fuck, but i could tell she had nice tits, and not those fat bitch tits, and braces and a good face. I would bend her over the counter and rub some of that Boston creme pudding on her nipples and ask if she wants me to fill her up with cream like one of those donuts 🤣🤣🤣🤣"
2019-11-18 23:14:33,lax_street,3,Did someone say Disney is releasing updated plus numbers this week?
2019-11-18 23:14:05,hlh4,2,"Wow, yesterday’s are shit purple."
2019-11-18 23:13:56,lmao_fuck,3,Would Donnie stop tweeting about record closes for one damn day lmao fuck
2019-11-18 23:13:41,VacationLover1,2,Ask me tomorrow but puts at close are free money for the PJ traders at open
2019-11-18 23:12:01,PayMe4TradeIdeas,1,Dude get in Google ahs look of up or just look at my previous reply you lazy fk
2019-11-18 23:11:59,MostlyKelp,4,Oh you'll becoming back down Bili. And I will be waiting here in the sewers with my long-dated puts.
2019-11-18 23:11:14,Midgetfarm,7,My wife (winker) hasn't cooked me dinner in years and will never fuck me cause shes ashamed of her body. I dunno where she gets all this food from
2019-11-18 23:10:41,scroogemcdub,2,"Antares pharma ain’t ever stopping guys. I wanted to throw another 5k at it but feels we should get a pull back some day even if it’s minor. I’m long though, probably double my eoy 2020 calls if Walmart and target come through for me"
2019-11-18 23:07:45,IronManKillsThanos,14,Definitely can't quit my day job anytime soon
2019-11-18 23:07:44,Hypocrite_Redditor,4,Looking for a new meme stock? PLUG is your answer! 🔌 🔌🔌🔌
2019-11-18 23:06:40,spanishgalacian,3,Need AMRN to take off or stay above 22.5 for my put credit spread I got today. Knew I should have stayed away from it and done CRWD instead.
2019-11-18 23:05:29,Truethoughts92,5,Roku bouncing up and down like wifey on a Friday night 🤣🤣🤣
2019-11-18 23:04:30,IRPhysicist,4,I hope to god Tesla’s truck makes people cream their pants. I want out of my calls.
2019-11-18 23:02:26,HowLongCanIMakeAName,3,Actually roku puts bears this is finally your chance get nicked or get dicked 👌👌💯💯💯
2019-11-18 23:02:20,M0ngoos,3,I remember 🐻 gang where your only joy comes while coked out pajama boys short everything at night. Then by cash open 🌝 comes out.
2019-11-18 23:01:48,greentea45,4,i guess the nightly futures shorting has begun...
2019-11-18 23:01:13,nadoterisback,5,Blood
2019-11-18 23:00:44,bigstinky2,-2,Wow futures blood red
2019-11-18 23:00:35,darkseadrake,2,CNBC reporting China trade looking doubtful.   Maybe....?
2019-11-18 23:00:32,SVXYstinks,1,RED FUTURES SPY 295 HERE WE COME
2019-11-18 23:00:31,nicozylber99,5,"ROKU selling shareholders account for 0,5% of the entire existing shares. Not much of a deal, will buy calls tomorrow"
2019-11-18 22:58:56,whitestansmith,2,Guys give me strength for my Boeing calls
2019-11-18 22:57:51,winkerpack,6,"u/crohnsandcannabis and I both donated to ST jude this morning. Who is going to join us and form a threesome?

[This was crohns thoughts about his donation btw](https://www.reddit.com/r/wallstreetbets/comments/dy9hca/z/f7zmjvf)"
2019-11-18 22:57:38,ARGOskier,2,Keep going facepage!  👊 👊👊
2019-11-18 22:57:25,ch1p_skylark,4," [https://twitter.com/YahooFinance/status/1196561719612596224](https://twitter.com/YahooFinance/status/1196561719612596224) 

wait a second. if we all pretend to be vegans and join this lawsuit. free money?"
2019-11-18 22:56:49,ScaliePornAccount26,1,AMD is gonna hit fucking 45 and I bought calls at 36 holy shit
2019-11-18 22:54:56,HowLongCanIMakeAName,7,"More puts 

More losses

That’s the true tard™️ way oh yeah 😎👍"
2019-11-18 22:54:46,madhav_16,2,Is it time to buy puts on Google?
2019-11-18 22:53:36,Lil_Musket,3,I can't wait to witness this crash
2019-11-18 22:52:50,jimbob1911,4,Holding 70k in NOW calls trying not to cream in my pants
2019-11-18 22:52:29,kyu2731,1,So I’m trying to sell all my trades to all-in on either APPL or MSFT call option trades with next year expiration date. Which one should I go with??
2019-11-18 22:50:54,ch1p_skylark,2," [https://twitter.com/jsblokland/status/1196559976447250433](https://twitter.com/jsblokland/status/1196559976447250433) 

big yikes"
2019-11-18 22:49:39,visionarymind,3,"Vision FUNd 🌳 goes another consecutive day without 🩸🔛🍃

🗣Who’s trading better (percentage wise) than Ya Boi❔

https://imgur.com/a/4w04B35"
2019-11-18 22:47:19,boohooboi,12,Roku crashing AH. What happened
2019-11-18 22:46:52,vanadios,2,"I have a noob question. When people talk about price target, they mean that's where the stock price should be \*a year from now\*, is that correct? So if someone sets the price target for AMD at $40, it's quite bearish, right? Since they mean that the stock price will remain unchanged in a year and you are actually losing money if we take into account inflation?

I ask this because after WMT's earning, there has been a bunch of price target raises, mostly to 130-135. Should we read those as bullish or bearish signals?"
2019-11-18 22:46:09,karlaxel2,6,"LISTEN EVERYONE! Of course the market is seriously overbought, HOWEVER, the MM’s will not let it crash until after the DEC 20 puts expire worthless! 

A ton of retail investors and some more notable bears opened short positions on SPY over the last month, and they need to get fucked first before the market collapses!

Believe me. The crash will happen shortly after that date. You’ll all see!"
2019-11-18 22:46:02,Phurionyx,2,"Thinking about selling covered calls on inverse ETF’s at the moment. Not sure what to do at this point, but I lack the ability to make money by purchasing options."
2019-11-18 22:45:00,MulchPDiggums,3,MDT calls. Earning reports bless me plz my autism can’t handle another loss.
2019-11-18 22:44:37,Ashes1984,8,"ROKU NEWS:

ROKU Roku files for 571,459 share Class A common stock offering by holders

Thats why the 4% down in AH"
2019-11-18 22:43:42,ProOrlando,5,"Out of the last 10,022 days, SPY has had positive closes 12 consecutive days in a row only one time before a pullback. We currently stand at 7.. There have only been 39 days w/ x>7 green closes. there’s a 1 in 260 chance tomorrow will be a up day. Then we go to 1 in 667 followed by 1 in 1670 and then 1 in 3340."
2019-11-18 22:42:46,HereForMadden,2,"Got 311.5 calls  for 11/29

Im up about 15% and thinking of holding until this friday. Thoughts?"
2019-11-18 22:42:09,OhHelloThere_,2,I’m surprised no one is talking about SHOP today
2019-11-18 22:42:01,,6,Who's the retard that bought the 2022 ACB $2 call for $2?  Identify yourself so that I may dump mine as well
2019-11-18 22:41:49,winkerpack,7,Give me like a 1.5-2% day tomorrow SPY. It's been a while since we had one of those
2019-11-18 22:41:48,PayMe4TradeIdeas,7,"HOLY SHIT THAT $DIS $150 call volume is more than Apple volume on option 

40k contracts just today"
2019-11-18 22:38:23,gigantoir,5,"I have some bearish positions but I know trade talks are going to send the market higher, maybe I'm just fuckin depressed bros but have these trade meetings ever gone badly?"
2019-11-18 22:37:58,optionsthatlose,3,Holding $TGT 11/29 112 calls
2019-11-18 22:37:57,20percentmilk,7,ROKU to earths core
2019-11-18 22:36:22,Ashes1984,3,"[$NOW](https://twitter.com/search?q=%24NOW&src=cashtag_click) \*SERVICENOW TO REPLACE CELGENE IN S&P 500

Hence $10+ in AH"
2019-11-18 22:35:48,DrUNC83,3,Shit!!! I tried to get NOW calls today but difference in bid and ask was huge so I canceled. Up 3% and then got added to S&P
2019-11-18 22:35:39,,1,Close my WMT put credit spread if it falls into the single digits. I would've closed it today after a 60% gain but I didn't want strike from the fun police
2019-11-18 22:32:37,dangerine,3,"someone just bought up 42,000 shares of SOXL in AH.. that's 9.7 million dollars worth... guh"
2019-11-18 22:32:31,marsbup2,1,Does anyone know when Verizon's investors event is?
2019-11-18 22:30:57,thesillyshow,3,NOW making moves
2019-11-18 22:28:50,desturel,3,"Last year I felt like an idiot, constantly purchasing AMD calls because they had good news coming out, only to be let down because the stock dropped even though the news was stellar, so this year I decided that this time would be different.  I would instead buy puts when AMD has stellar news.  Boy howdy it doesn't matter what I do, I lose cash on it.  Lucky for me I have shares so even through all of my dunce like option plays I'm still up."
2019-11-18 22:28:12,aqualityusername,1,Praying 🧎‍♂️ 🙏🏿 for just a little volatility
2019-11-18 22:28:10,iamtony36,5,"ServiceNow glitching up $10 AH lol.

Edit nvm not a glitch. wTf is the news? Lol"
2019-11-18 22:26:13,ryit29,15,Imagine buying puts in this market
2019-11-18 22:25:45,BLCincinnati91,2,"Someone help out a fellow autist here who tried to make a killer play but ended up getting waxed.

PDD stock:
Market cap 48B
Price per share 41.50

Revenue 8B
EPS -0.52


JD stock:
Market cap 47B
Price per share 32.80

Revenue 135B
EPS +2.08

How in the flying fuck is this possible?"
2019-11-18 22:24:04,kyu2731,4,So... what happened to TGT hype??
2019-11-18 22:23:24,Cygopat,2,So how many of you got fucked by NVDA randomly rising today?
2019-11-18 22:22:02,23therealme23,5,"DIS 🚀 

“Disney+ is so hot right now that it's helping this toymaker's sales pop”

“It’s paying early dividends for toymaker Funko (FNKO) to be in the vibrant Disney+ ecosystem.”

“We are really excited about the start with Disney+. Our demand for the Mandalorian is through the roof,” Funko CEO Brian Mariotti said on Yahoo Finance’s The First Trade."
2019-11-18 22:21:54,love2fuckbearasshoe,0,Dude I’m so tempted to but ACB$ as much as I hate weed stocks ACB is the bets one I feel
2019-11-18 22:21:32,Smanjin3290,2,Losing on my HD puts.
2019-11-18 22:21:16,yinatom,3,It is my opinion that only idiots buy snap (respectfully)
2019-11-18 22:20:57,digitalradiohead,1,Anyone have   Mrna calls. The stock and biotech in general has been on fire. I saw a lot of people buying the 20$ calls
2019-11-18 22:19:50,digitalradiohead,1,I bought Pepsi 135 calls. It seemed to sell off there today but it held the 200 day support
2019-11-18 22:18:44,paperboi69,4,$800 left in my yolo account. Thinking about just pulling it out and splurging on something but I just want money and booze.
2019-11-18 22:17:57,GoatsAndHoes17,8,"I heard papa Trump went down on Powell to get another rate cut next month. You heard it here on Wall Street bets first, its insider info so don’t share it."
2019-11-18 22:16:44,Steppyy,3,Wish I had sold my $ROKU at the top instead of buying more 😭 need some good #GYNA news tonight/tmrw AM
2019-11-18 22:15:26,ProOrlando,16,So what’s actually going on when the chairman of the federal reserve had an “off the cuff” meeting with the president of the United States...something is going on we are not being told about.
2019-11-18 22:14:26,SUP3RSLOW,3,"Went in on some TGT calls just before close today because why not

Sold some Roku and sitting on some more and then hoping Mickey goes on a moon mission again this week

Might fuck around and buy Netflix puts in the morning too"
2019-11-18 22:13:36,madamlazonga,1,[am I stupid?](https://imgur.com/gallery/GDjAT3K)
2019-11-18 22:13:06,actuarial_defender,5,dope AMRN conference call
2019-11-18 22:12:08,ProOrlando,3,Can anyone explain the volatility crush this past Friday? How did that happen?
2019-11-18 22:11:24,johnthelizard,2,Does this whole QE / not QE stuff change how effective moving a 401k into bonds before the drop is?
2019-11-18 22:11:10,KimchiFitness,3,The assymmetric reactions by algos to positive and negative trade news is so fucking frustrating as a bear
2019-11-18 22:10:10,ch1p_skylark,2,"Yandex rallied today because the Russian govt wants to work with them to take tighter control of the internet. 

😐"
2019-11-18 22:09:48,gda19,4,Why is nvda up 1%+ AH? Where do you guys get market news from
2019-11-18 22:09:41,teskk,4,Buying a shitload more PLUG because idk what I’m doing
2019-11-18 22:09:39,brags-about-bags,1,Just gonna keep on riding DIS and FCELL. I should probably get a hobby since waiting will be tough. Hoping DIS 155 by mid December.
2019-11-18 22:08:20,Jarreddit15,3,"For every successful ER call run up (e.g. NVDA, SBUX), there's a TGT to remind you how risky it is

TGT call holders now must decide: sell for -30% or let it ride and possibly lose it all..."
2019-11-18 22:07:30,Squirmingbaby,2,Will there ever be a day when spy goes down?
2019-11-18 22:07:12,hawowah,1,Tomorrow will be the biggest red day in over a month! We are going to close more than 0.34% down lmao
2019-11-18 22:07:10,henhaller,3,"TGT, OKTA, CRM 🙏🙏"
2019-11-18 22:06:17,Misterkancho,2,Karuna therpeutics with the +420%
2019-11-18 22:05:54,but-this-one-is-mine,-1,"Hey mods, can I pretty please with a cherry on top have a flair? 🙏❤️"
2019-11-18 22:05:51,PetEthr0waway,1,"Hold onto my $CLF 12/13 $6.50p sale, gonna ride theta at least another two weeks."
2019-11-18 22:05:38,pron_site_operator,8,"Long UVXY.

Diamond Hands Mode."
2019-11-18 22:05:14,SomeComparison,4,"Anybody sill got their $SPY puts? Tripled my $310 puts today, hoping for a miracle tomorrow... only down 37% so far..."
2019-11-18 22:05:11,DanielSon602,3,Calls on Target earnings?
2019-11-18 22:05:10,swamprott,-2,"wsb buzzwords:

Fake

Up

Autist

Moon

Dump

Noob

Inverse 

Neckbeard

Tits up

Loss"
2019-11-18 22:03:37,xplant123,5,I really got fucked buying AMD puts
2019-11-18 22:02:36,Brosiah_,4,Any negative catalyst for a bear to dream about?
2019-11-18 22:01:50,HeaterKing92,5,"CNBC reports teen retailers are decidedly **""off fleek""** today"
2019-11-18 22:00:42,DJRenzor,1,"oops, have some 3100 spx puts expiring this friday, down 16% already, looks like down more tomorrow. Only 6% of portfolio but wish I just kept it on sidelines"
2019-11-18 21:59:19,Ricericebaby0923,3,Sold my roku shares from buy in of $135 have no idea what to do now :(
2019-11-18 21:59:02,OdaNobunagah,2,Ride my pton wave 🥳
2019-11-18 21:57:08,luponicdistortion,8,Finally got around to enabling options on the 401k account. Gonna sell covered calls for the next 30 years
2019-11-18 21:56:54,mikes703,2,I’m long on ACB.  I averaged down as it keeps going down.  Need this rally! Come on!
2019-11-18 21:55:43,thesillyshow,1,Thinking about picking up FL 2/21 calls
2019-11-18 21:55:00,chandler2020,15,All these target Nike team up rumors has me hard
2019-11-18 21:54:10,DrUNC83,1,"Hope my BA, Googl, AMRN calls turn around and that DIS keeps mooning"
2019-11-18 21:53:46,boohooboi,9,I hope roku goes to $0 Tomorrow to punish me for fomo’ing in
2019-11-18 21:49:01,CarminSanFrancisco,5,Wait for an actual dip on SPY so I can buy some mutha uckin tendie calls 👽 🌈 💰 I'm gay
2019-11-18 21:48:56,HatsuneM1ku,13,Fuck was up 900$ today but dropped down to 200$ should've sold earlier
2019-11-18 21:48:39,kknano1256,36,pretty sure rule number 1 is trade with the trend and seeing all these posts about aapl or amd puts is like...dude why
2019-11-18 21:47:38,stacksandwhiskers,5,"Sold weekly puts on AMD at 39 strike, made 40 bucks per. This is good money!"
2019-11-18 21:47:20,ThetaBurnVictim,7,"I guess as long as the FED continues ""Not QE"" this market will continue to pump higher.. I really hope I'm on the right side when the rug pull comes though.. its going to be a blood bath."
2019-11-18 21:47:07,anomander_rake123,4,"Have calls on AMZN,  CVS , CRM, EA and CI"
2019-11-18 21:46:56,Brosseidon,13,Awfully suspicious mango hasnt gone on a rant 🧐
2019-11-18 21:46:04,swamprott,1,"🎶 Cuz when you're high, you never ever wanna come down..so down...dooowwwnn...(guitar riff)🎶"
2019-11-18 21:44:51,Jarreddit15,14,"MSFT and AAPL both hitting ATHs AH, warms\* my heart"
2019-11-18 21:43:23,Kakilli_,7,"I bought on every Roku dip today, am I gonna get tendies or shafted tmrw?"
2019-11-18 21:42:59,scroogemcdub,1,"I want one of two tags
 
Anonymously ominous 

But I’m a huge fan of Asthmatic abstinence which I’d prefer  

Seriously when I get wasted and free style with my boys from Fresno, we always come up with these nifty little shits. 

Or just (retard half chub)"
2019-11-18 21:42:51,njeezyatx,3,I have little bitch hands and sold my GoPro puts too early
2019-11-18 21:42:40,,16,"Red futures tonight, spy 313 tomorrow. You already know what it is"
2019-11-18 21:41:38,rowegor,2,Amd puts and tgt calls... Someone tell me it's gonna be alright
2019-11-18 21:41:18,Midgetfarm,8,Maybe mango called J Pow called cause trade talks **arent** going well. Told him he needs the feds support once he slaps on December tariffs and capital controls
2019-11-18 21:41:00,Phurionyx,8,"ive lost about $4k. Have right at $4k left. Thinking about switching sides and selling covered calls, but now im too poor...was probably too poor with $8k tbh"
2019-11-18 21:40:42,HowLongCanIMakeAName,6,"Had my first green day in weeks. Up by $37

It’s the small victories folks 👍👍👍"
2019-11-18 21:40:24,3fishinatree,2,[perfect juxtaposition ](https://imgur.com/a/Oo7KLOE)
2019-11-18 21:39:56,,2,hopefully make another 35 bucks.
2019-11-18 21:39:50,VacationLover1,2,When does tariff man flop his 🥕 on  🐼?
2019-11-18 21:39:39,AfroSWE,5,Apple going to take us to 313 Boys
2019-11-18 21:38:49,bespokenman,4,Down to my last $50 from my original 2k. Put it into 2 DIS 150c expiring 11/22. Praying for a repeat of last week’s mooning. Failure is not an option.
2019-11-18 21:38:47,PrestigeWWinc,2,🍏 mooning ah
2019-11-18 21:38:44,sheffieldda,1,Anyone else playing ASND ER?
2019-11-18 21:38:14,stonksonlygoup,2,"Wmt callers, who dove from cover today? Did you accept your fate or hold in hopes of another rally?"
2019-11-18 21:37:49,jonnykappahala,6,"I've been sitting on the sidelines leaning bearish on DIS but I ain't shorting it after seeing Disney+. 

It's fucking dope, caters to the millennial audience, and might revitalize ESPNs shit numbers with the Disney+/ESPN+/Hulu bundle. 

In the short-mid term, this is gonna moon (even more), IMO. 

SOURCE: millennial who has watched Rookie of the Year and Remember the Titans on Disney+ three times each already."
2019-11-18 21:35:45,inky2u,1,Hope that twtr opens up .7 so I can get out from these calls at a measly profit.
2019-11-18 21:35:15,,1,AMC mooning after hours bcus why?
2019-11-18 21:34:35,LoveOfProfit,2,"Sold 25 HD puts at $235 expiring Friday for the premium. Hopefully I don't find myself the proud owner of HD stock in the morning. If that goes well, I'll look to either the LOW or TGT ERs (or both)."
2019-11-18 21:34:19,ProOrlando,2,Easiest and best strategy ever created. Stay long until shit starts really hitting the fan and lighten up. Buy back when things settle down. I hate to say it but it’s really that easy. It’s disgusting... there’s no reason to be nuanced and fight the trend. Simply stay long until things start getting rocky.
2019-11-18 21:33:17,TwoTwinOps,4,Life savings on plug this afternoon lol. They filed form 25 with the SEC right after I got in. Hoping buyout but who knows!
2019-11-18 21:33:13,yachtsandthots,12,"Aaaaaaaand that’s the last of my buying power averaging down on these AAPL 250p 11/22

Edit: fuck why is it going up AH!? This fucker has to come back down to earth"
2019-11-18 21:33:07,flowkingfresh,2,"I feel like trump is going to remove December tariffs and Chinese will buy hog. Probably will get a 30-40 billion dollar deal not a 50 like he wants, market roars into EOY"
2019-11-18 21:33:02,Smart202020,3,"Can someone explain option price to me?  At 1:50, the 11/29 DIS 150 Call was $2.05.  Disney was $148.66.   At  3:40, the call was worth $1.30.  Disney was at $147.24.  How do you get a 37% decrease in option price off that small of move?"
2019-11-18 21:32:38,FinalArrival,5,"Coming from a bear who's already lost a lot, why continue buying puts other bears? I understand not wanting to switch to calls, but why not just sit on the sidelines instead of hurting yourself until this nonsense QE rally stops?"
2019-11-18 21:32:26,ProOrlando,2,Subtly volume is starting to increase the last three or four days from the historic low a couple weeks back.
2019-11-18 21:31:20,therealshakezula,1,What are the odds of seeing ACB back to $3 by March 2020
2019-11-18 21:30:33,dfoolio,4,"Mango tryna capitalize on the pump, this won’t be ending any time soon


https://twitter.com/realdonaldtrump/status/1196540711086243841?s=21"
2019-11-18 21:29:22,staannlee9,5,Praying that Disney releases their streaming numbers. I literally created graphs to see what they their numbers will gross out too. Do you know how much youtube and time that took?
2019-11-18 21:28:18,boohooboi,22,Fomo’d into roku and got greedy so now bagholding. Love it
2019-11-18 21:27:09,YellowJulius,5,Bears further retreating into hibernation
2019-11-18 21:25:53,dfoolio,3,Jerking off on my wife’s tits while watching my calls go up
