date,author,score,body
2019-12-13 15:17:58,b7d,1,"Merry Christmas to us then, we’ll get it next year. I made a bunch off of ASLN before they cashed in their depository shares and by some grace of mercy had the thought to cash out the day before they announced it. 

LOVE, cruel mistress, just had to take it back"
2019-12-12 19:42:11,HourPackage,2,LEGO
2019-12-12 18:40:25,HourPackage,5,"ARWR big 🌈  past two days.

cc: u/Frostyfragzz"
2019-12-12 18:11:41,srinips18,1,Pretty good day for me. everything as per plan sold hd n mcd call at high. And entered spy puts 317.6 for jan and entered wday calls
2019-12-12 16:36:58,DaSmartGenius,3,"Is there any actual fucking confirmation that tariffs are going to be cut? Reuters just uses ""people"" as the fucking source.

https://www.reuters.com/article/us-usa-trade-china-tariffs-idUSKBN1YG1VB"
2019-12-12 15:21:34,ieatbreqd,1,I sold my BMY 61.5 call 12\13 for  $1.50 danm with 2.27 now.
2019-12-12 14:58:34,SomeComparison,2,Will $AAPL Break $271? That's the question of the day.
2019-12-12 14:19:49,Hanz-Wermhat,3,Is tariff man coming to town? comment below
2019-12-12 13:05:20,iamtony36,2,Lulu opening at 227-230 would be fucking sweet with all these analyst reiterated buys and price targets of $250+
2019-12-12 12:39:24,tk993,4,"**GILD** weekly and December **68 calls**. This thing is about to pop off and I want some sweet tendies. 

Could also go with some **weekly January 69 calls** for the memes."
2019-12-12 10:52:37,analyst_84,3,I had sweet apple puts I closed out becuase of the retard strength it showed going into close.  Funny thing is that the puts didn’t lose value as price increases.
2019-12-12 10:47:43,love2fuckbearasshoe,4,"Ok IM AM SHORTING PTON TODAY IM
so done with that sack of shit stock/COMPANY


RUTHLESS CEO IS GOING TO WAR WITH PTON 

WATCH !!!!

Fuck lockup is in March and investors bought at 5$ per share"
2019-12-12 10:43:50,divsandpremium50,5,TSLA 420 Premarket on fire
2019-12-12 10:36:45,,-1,"""Tomorrow""'s watchlist 

BABA (204.75) puts 195

SRPT (101.45) calls 107

PTON (32.4) calls 32.5

NVDA (218) puts 210

TSLA (355.25) puts 345

JDST (12.55) calls 13.5

UNG (17.37) calls 17.5

SPY (315.04) puts 312

PCG (12.15) puts 10.5

SIG (21.4) puts 18.5

CRWD (47.75) calls 50

EDIT (29.58) puts 26"
2019-12-12 10:36:32,love2fuckbearasshoe,1,"Besides jerking off what ya use for sleeping aids ? 

This pulling a all night her shit has to stop man 


I love melatonin but I need something new"
2019-12-12 10:35:35,thecashcow-,3,"A goodwill gesture for #TradeTalks? #Chinese buyers have signed deals to buy 585,000 tons of US #soybeans, the US Department of Agriculture revealed, ahead of #tariffs scheduled for December 15. They mark the largest collective purchase from China since April.  #tradewars
-GT"
2019-12-12 10:34:02,love2fuckbearasshoe,3,"HAHAHAAH BACK AT ALL TIME HIGHS SUCK IT BEARS 

Market will never go down fuck your inverted YEILD curves 

Fuck your repo. Bullshit 

Fuck your useless college degree"
2019-12-12 10:33:16,touchhimwiththejab,3,"Bought the COST dip yesterday and sold for 10% gain

Chicken shit move"
2019-12-12 10:26:59,Timetraveller2015,2,So JP Morgan Jamie Dimon says he expect trade deal. Does that mean we should short?
2019-12-12 10:14:40,,4,Fuck I had a literally can't go tits up plan I was going to enact right at market open for free money but forgot what it was so I'm stuck with randomly shooting shit off like im firing bird shot at my cybertruck (trying not to hit the windows of course)
2019-12-12 10:11:53,KimchiFitness,3,"About to hit ATHs on the verge of a trade war escalating

Makes sense"
2019-12-12 10:07:32,gkdjsl,2,"[https://www.dramexchange.com/#dram-contract-price](https://www.dramexchange.com/#dram-contract-price)

MU $60 is back on the menu"
2019-12-12 10:05:06,Mumbolian,2,As if futures are still green! This shit is hilarious.
2019-12-12 09:53:54,Sinadins,1,"im kinda late, but butterfly put spreads on things like panw or tgt for this friday look kinda fire, no?"
2019-12-12 09:52:54,Shiftz,2,Spy puts today if we are above 315.5?
2019-12-12 09:52:47,KramaChameleon,2,futures are fun tonight!
2019-12-12 09:49:48,Regjohn,3,S&P500 calls + TSLA calls = cocaine bing during the weekend
2019-12-12 09:40:40,love2fuckbearasshoe,2,Fuck pulled a all nighter
2019-12-12 09:37:30,love2fuckbearasshoe,-1,TESLA !!!! :)
2019-12-12 09:33:35,Not_reddits,2,So we break ATH tomorrow?
2019-12-12 09:32:55,DaSmartGenius,3,"Assuming we had a recession in the near future, how low would you wait for SPY to go before YOLOing everything into actual long-term holds?

$240? $230? $200 or below?

Personally if we ever touch $200 again I'll probably go balls deep into MSFT shares and hold them until I retire."
2019-12-12 09:23:43,isospeedrix,2,damn at this rate lulu might open flat or green which would be great
2019-12-12 09:19:58,,2,"[What the fuck did I just read on Forbes. Did he say backasswards in the 2nd paragraph.](https://www.forbes.com/sites/mikeadams/2019/12/10/federal-marijuana-legalization-is-a-lock--but-how-when/)

""If you listen carefully, you will hear the sound of a crooked foundation known as marijuana prohibition starting to crumble in the United States. It has been more than eight decades since the federal government outlawed the cannabis plant nationwide, and yet, here we are finally standing on its lawn with torches in hand waiting for a day of reckoning.

Because no matter how much the suits on the Hill have schemed to enslave a population through backasswards drug laws, the nation has risen up in true knock-down-drag-out fashion and fought for its freedom back. Admittedly, this battle for legal bud took a lot longer than it should have, but considering that everyone in the trenches was stoned beyond belief, the marijuana movement seems to be arriving right on time."""
2019-12-12 09:15:35,KimchiFitness,17,This december 15 tariffs deadline is like an earnings call for the whole world
2019-12-12 09:15:27,ValuablePassenger,2,Are we buying the LULU dip? Did anyone follow their ER? It was decent but not stellar and that's why it's dropped?
2019-12-12 09:10:55,niceguy897,5,"i am reading quotes about ""a tariff increase wouldn't effect stock market"" on reuters and i am about to lose my mind. seriously wtf is wrong with people... so they will increase tariffs and we will moon to 320. fuk being a bear."
2019-12-12 09:07:50,Fan_Boyy,1,What is this? The player haters ball 💁‍♀️
2019-12-12 08:56:00,winkerpack,4,[Is this truethoughts wifey?](https://v.redd.it/1dbs7c9v54441)
2019-12-12 08:51:10,Fan_Boyy,5, I just have one ☝️ question.. Do vegans swallow when they suck dick or do they have to spit? 💦
2019-12-12 08:43:11,Fan_Boyy,1,"If ur having a bad ☹️ day this’ll cheer u up 🎈 


https://youtu.be/5sT78Z4lgHI"
2019-12-12 08:40:38,Droidvoid,10,And now we return to our regularly scheduled programming *Stonks Only Go Up* brought to you by *Zero Liquidity and Complacent Fed*
2019-12-12 08:39:08,GretaTs_rage_money,2,Need help slapping my beyond meat.
2019-12-12 08:29:59,SomeComparison,3,"I think I'll buy $AAPL calls on the dip at open, sell them when it sky rockets back to $271 then turn around and load up on long dated $AAPL puts. If they print by close on Monday I'm buying a new MackBook."
2019-12-12 08:28:51,no_sporks,1,Futures are fake and gay
2019-12-12 08:26:59,winkerpack,2,Nostalgia :(
2019-12-12 08:24:58,KimchiFitness,11,"Dec 15 tariffs will come on, and we wont drop even 0.50%. the bulls will say ""it was priced in"" despite near ATHs and im gonna lose my mind"
2019-12-12 08:11:36,Fan_Boyy,0,Oh man I was making ants 🐜 on a log and I had the peanut butter on the celery but I have no raisins ☹️ so now I got 2 use chocolate morsels
2019-12-12 08:10:10,,5,Tomorrow Trump meets with advisers on whether tariffs or no tariffs. His schedule says intelligence briefing at 12:00... wonder if he’ll announce the result before close.
2019-12-12 07:58:41,love2fuckbearasshoe,2,What fucken drugs is Elon on
2019-12-12 07:54:30,Fan_Boyy,4,Holy shit I put 2 steaks in the fridge 6 hours ago and they’re still rock solid frozen no wonder ppl put them on black eyes 👀 guess I’ll have a dang quesadilla
2019-12-12 07:54:27,,3,What drugs did Elon take tonight?
2019-12-12 07:52:56,winkerpack,4,[Wow. This thing was the best](https://www.reddit.com/r/nostalgia/comments/e993dq/hot_wheels_car_wash_with_the_super_spinner)
2019-12-12 07:51:25,Fan_Boyy,3,What’s it called when you sell a $40 call and buy a $40.5 call and buy a $40 put
2019-12-12 07:50:24,SomeComparison,3,I've been out day trading $AAPL the past couple days. But I'm back to all in on puts tomorrow. This markets going down.
2019-12-12 07:45:26,Shmokesshweed,3,"Someone stole my Amazon purchases

I'm buying puts"
2019-12-12 07:33:48,ChinaUnfairGoingWell,4,"https://www.predictit.org/markets/detail/6202/Will-any-tariffs-on-China-take-effect-on-December-15

“Will any tariffs on China take effect on December 15?”

Yes for approx 185% return // No for approx 25% return (at 31c/74c)

Site take a minimum 30 days to withdraw. Read rules and fees if you’re interested."
2019-12-12 07:32:10,,-3,Kiss me?
2019-12-12 07:18:17,followingAdam,0,How in the fuck can we short Aramco?
2019-12-12 07:17:39,J_Powell_Ate_My_Ass,1,"Alexa play Richard Cheese - My Neck, My Back"
2019-12-12 07:15:24,winkerpack,8,Cant go wrong with a grilled cheese and tomato soup
2019-12-12 07:11:20,Nomadic_Marvel07,5,"The cheapest most valuable trade advice you will ever receive is below.



























Don't listen to these retared, Autist, color blind commenters."
2019-12-12 07:08:32,winkerpack,3,"When you put the flag up on your mailbox, it means you have mail in there that you want to send to someone else."
2019-12-12 07:04:49,,3,Aramco is overpriced asf! Shits gonna drop like 25% in one week eventually and them Saudi’s are gonna get caught with their pants down
2019-12-12 06:55:37,winkerpack,2,Got some halo clementines to eat in the shower like r/showerorange but I'm like the autistic brother. Will see how it goes
2019-12-12 06:51:03,lakster1,2,**$ROKU?** What's going on?
2019-12-12 06:50:15,srinips18,3,holy s it takes lot of time to filter junk in the thread. People are so off topic damn.
2019-12-12 06:47:49,,2,"WEED KILLS! stop doing drugs, kiddos"
2019-12-12 06:47:42,The_toast_of_Reddit,3,Why isn't intel fading with all of the bad news?
2019-12-12 06:46:35,Fan_Boyy,2,DAE hate Costco’s ticker like every time I see it I’m like ohh 😮 this decision is going to cost you 🤦‍♀️ same with Ford and Bank of New York Mellon Corp cuz their ticker is Bk which stands for bad kid. Fuck. It’s such a bad habit
2019-12-12 06:46:23,love2fuckbearasshoe,2,I have Tesla 355$ calls and I’m sleeping like a baby :)
2019-12-12 06:44:20,omswindles,6,Where are all the stonk and fd picks? There's all this gibberish about college and student loans.
2019-12-12 06:44:06,Hitachi22,5,No rate hikes in 2020. SPY to $420 by 4/20 confirmed.
2019-12-12 06:42:18,winkerpack,3,Are there ever instances where ERs are leaked during market hours?
2019-12-12 06:40:32,cyphonismus,3,"Instead of gambling 5K this week, I've commissioned 2K in clips4sale custom scenes with my favorite models, and I'm gonna lose the other 3K to bag-holding pharma stocks for eternity."
2019-12-12 06:33:45,love2fuckbearasshoe,6,"UNIVERSITY of PHOENIX CANCELLED most of its student debt !!!

I know half of wsb went there 


Dude u could of took out as many loans and u could put all that shit in Robin Hood and now u GET TO KEEP IT !!! 
Yay ahaha 😂


https://www.google.com/amp/s/www.nbcnews.com/news/amp/ncna1099681"
2019-12-12 06:33:16,Fan_Boyy,1,Just replace “girlfriend” [with](https://youtu.be/AKSGhZi8SLU) winker and you’re all set! 😎😎😎😚
2019-12-12 06:30:40,TheWhiteDelight,4,My wife allotted me 15 minutes of masturbation time tonight (including searching for a good CFNM vid so I gotta be quick lol). Any recommendations? What do your wives allow you to jerk off to?
2019-12-12 06:24:12,NWordTekashi69,4,Damn imagine holding LuLu calls + IV CRUSH GUHHHH
2019-12-12 06:23:38,Fan_Boyy,-1,Anybody ever feel like there’s not enough downside so we’re inevitably going to rally until shit like BA is trading at $4k a share
2019-12-12 06:21:42,NWordTekashi69,6,"Bloody green futures, bloody green tendjes"
2019-12-12 06:20:22,winkerpack,2,All nighter?
2019-12-12 06:15:06,ZeusThunder369,6,Anyone else expecting a HUGE sell off EOD friday?
2019-12-12 06:04:36,,3,"Can someone give a legit explanation for what's happening tomorrow?

QE or whatever. I'm a straight downie and have no idea what it is or what to expect. I pulled all my plays today just in case but dont know if I should buy in at open or not?"
2019-12-12 06:03:05,dhead123456,5,Cant wait for market open to get fuck by lulu
2019-12-12 06:01:45,Mankowitz-,1,Gold futures unusually flat tonight...
2019-12-12 05:59:45,ChinaUnfairGoingWell,1,"Can be talk INDIE MUSIC?

Tame Impala new album is vibes but I recently found Men I Trust on YouTube and I’ve been listening to them a lot."
2019-12-12 05:58:48,Boonboonspy,3,My strategy is 5 call spy and 1 put spy. Mega drop will cover the premium for all my post.
2019-12-12 05:45:08,riskit4debiscuit,4,Good night friends
2019-12-12 05:42:56,Addyroll,2,I got a lot of Costco 300C 12/13. I feel like I should bail tomorrow morning.
2019-12-12 05:42:31,mortarboy,3,"looking at VMware options expiring jan 17th and the strikes are wild. instead of trading in 50c incriments like most stocks, theyre like 153.19, 158.19, etc. Thought it was a glitch on RH, hopped over to tasty and its showing the same thing? 

dafuq"
2019-12-12 05:33:04,,2,"Guys, I’m right like 70% of the time with my trades but I have the worst hands ever and usually pull out before the trade goes in my favor.  How can I get better at holding?  It’s literally the only thing stopping me most of the time."
2019-12-12 05:25:20,sadlone,5,2k worth of Apple puts expiring Friday because I hate money
2019-12-12 05:13:00,love2fuckbearasshoe,10,"college ??

Gtfo 

GO WORK in SBUX$ and get on there stock OPTION PLAN RIGHT NOW !!!

Or cost$"
2019-12-12 05:12:50,24058025480548,6,Still waiting for the rug pull....
2019-12-12 05:04:54,love2fuckbearasshoe,8,"SORRY COLLEGE IS A SCAM 

*PRO TIP*



If I can go back in time to when I was 18 i would tell myself 

Work at mcd$ live with mommy and daddy and save 15k a year 

300*52 15,600.  Min wage nyc is 15$. So 25 hours a week !!! Will get u 300$ a week after taxes 


In 10 years u will be 28 with 156,000$ in cash that will grow at 10% while u invest so almost 312,000$ and will pay u dividnets and u looking at 4% 

12,000$ a year on dividnets alone 1,000$ a month 

THAT WILL SNOWBALL AND KEEP GROWING 




Not all the debt u took for a stupid ass fucken degree 

Stupid fucken degrees man smfh especially if u to stupid to get in a state school and go to a private one"
2019-12-12 05:02:23,chaney3,9,I may be doing a post on random walk & Non-Markov random process models soon as one of my teams have brought some interesting insight to me lately. The developing thesis is a bit complicated but there are many tendies to be made. Are any of y'all interested?
2019-12-12 05:01:56,winkerpack,9,"Life tip: dont get into 5 figure student loan debt if you dont have a plan for when you graduate. Dont go into to student loan debt for a degree that has 0 value or demand. I know multiple people who went to universities to graduate, and then get a job they could have got out of high school and now they set themselves back years, if not a decade."
2019-12-12 05:00:46,JaeRex,4,Everyone expects tarriff's. If Trump delays he gets to control the precise moment thousands of bulls come to simultaneous orgasm and then keep all the power for another couple months. Who really thinks Trump is going to give up his market manipulating superpower just to be tough on China.
2019-12-12 04:59:55,yachtsandthots,3,[wtf news of the day](https://www.thesun.co.uk/news/10522729/man-farts-kill-mosquitos/)
2019-12-12 04:59:15,but-this-one-is-mine,1,All in marijuana calls!
2019-12-12 04:56:41,love2fuckbearasshoe,-1,"WALLSTREETBETS BANNER IS A TESLA TRUCK HAHAHAH 

What fucken mods is all in on calls HAHA

😂😂😂😂😂😂🤣🤣😏😏"
2019-12-12 04:55:29,DeliciouslyUnaware,2,"Tried my first bag of Blue Dream from Aurora today and I've had much better shit from black market dealers in Florida. 

Short ACB till $.50"
2019-12-12 04:54:37,Master531,2,Is there any sign of intelligent life here
2019-12-12 04:51:54,winkerpack,7,"BECKY update: AAL (American Airlines) will begin serving truly seltzers on their planes in 2020. This is huge for the becky crowd. It's no whiteclaw, but its still becky certified.  Get calls. Bachelorette parties will now book American just to be able to get white girl wasted in the air."
2019-12-12 04:51:50,Mpcars,3,Patiently waiting for futures to pop 100 points. Got a duck ton in apple 277.5s expiring Friday
2019-12-12 04:51:37,siege342,6,"Was going to buy TSLA calls, but now Crammer is a TSLA bull and I have a strict inverse Crammer rule, so I’m conflicted."
2019-12-12 04:47:30,ReverseMtg_BuyCalls,8,"I crammed an entire semester’s worth of accounting homework into today


Wanna die, but that’s not really unusual, so fuck it"
2019-12-12 04:45:04,Hegemon90,6,China trashed all their US computers -> Doesnt look like they are willing to sign deal.
2019-12-12 04:45:00,HangSengChinaMang,6,AAPL calls are free monies on any dip
2019-12-12 04:44:15,Heedunk,1,"I need the power of WSB so I can eat free crab. Go to somastreetfoodpark on IG, click on the crab post, and like L_I_S_A_L comment. The most likes gets us free crab!"
2019-12-12 04:44:13,HarryMooseKnuckles,1,Conns is 40% down this month. I'm really thinking about buying further out calls to maybe catch a rebound. Prove me wrong.
2019-12-12 04:43:43,greasy555,2,"$SPCE Virgin Galactic January 2021 $15c they have 0 revenue but Sending first civilians to space early 2020. I’m figuring based on that achievement alone, assuming safety, may see a pop. Merrill Lynch is expecting a 225% gain 
Thoughts ?"
2019-12-12 04:43:29,KramaChameleon,1,some YOLO posting shenanigans!
2019-12-12 04:41:11,Camel-Kid,3,Realistically even if Tarriffs are implemented on the 15th I can't see SPY going much lower than 305 MAX
2019-12-12 04:38:15,NIONIONIONIONIO,-9,"FUK MOD,

&#x200B;

MOD R FUK!!!!!!!!!!!!!!!!!!!!!!!!!!!!!!!!!!!!!!!!!!!!!!!!!!!!!!!!!!

MOD R FUK!!!!!!!!!!!!!!!!!!!!!!!!!!!!!!!!!!!!!!!!!!!!!!!!!!!!!!!!!!

MOD R FUK!!!!!!!!!!!!!!!!!!!!!!!!!!!!!!!!!!!!!!!!!!!!!!!!!!!!!!!!!!

MOD R FUK!!!!!!!!!!!!!!!!!!!!!!!!!!!!!!!!!!!!!!!!!!!!!!!!!!!!!!!!!!

MOD R FUK!!!!!!!!!!!!!!!!!!!!!!!!!!!!!!!!!!!!!!!!!!!!!!!!!!!!!!!!!!"
2019-12-12 04:37:49,mortarboy,26,"Just finished my last final at community college. Transferring to a great 4 year institution in jan. Honestly pumped as it took me a while to get to this point. I know this is a sub full of anons who couldnt care less but I consider you degens my frens.

catch me in the cboe lab fuckin around on the bloomies

peace n luv"
2019-12-12 04:37:32,ohnoitsjanna,1,Is there an updated link? WSB discord link invalid :|
2019-12-12 04:34:32,gigantoir,8,bought feet pics from a girl i went to high school with who has a kid just cuz tendies tomorrow
2019-12-12 04:33:40,winkerpack,10,"I hate to even say this because I hate the abusive of drugs etc, but I sometimes take 3 of my gummy vitamins instead of the recommended dose of 2. Like I know I'm walking a fine line, but sometimes I just like to rebel a little...."
2019-12-12 04:33:04,NIONIONIONIONIO,1,RED DILDOES TONIGHT BOYS
2019-12-12 04:32:05,love2fuckbearasshoe,5,"Cramer is bullish on Tesla 


( time
To jump
Ship 🚢)"
2019-12-12 04:31:31,love2fuckbearasshoe,5,"PTON will fall mark my words 


To many fat bitches up in here

Lulu$ already suffering"
2019-12-12 04:30:18,Midgetfarm,6,Winker canceled our all nighter cause I was mean to him :(
2019-12-12 04:29:07,galactictaco42,4,U/haupt91 do Speed with that scene where dennis hopper is telling keanu reeves to be autistic not stupid
2019-12-12 04:28:37,,-6,If you’re smoking marijuana you need to be careful! That stuff is worse than cigarettes 😣
2019-12-12 04:28:33,pnin22,1,Gonna buy VXX straddles tomorrow morn
2019-12-12 04:28:27,freehouse_throwaway,2,"geez the real play this week was puts on PLCE

drilled 23% today. saw it on the earnings list of course but its one of those companies WSB don't really bother following. shit has been volatile as F in recent months it seem.

didnt realize they're the ones that bought out gymboree. paid 75 mil for it. what a bunch of tools. 

implied move was like 13%. oof"
2019-12-12 04:23:07,actuarial_defender,5,PTON up and up
2019-12-12 04:22:41,WildDisease,3,I cant help but stare at Daddy Buffet's old Earnings to Market Cap chart and see that 2001 and 2008 and now are the only time's market cap exceeded earnings before steep correction...
2019-12-12 04:22:23,ThatDidntJustHappen,1,we
2019-12-12 04:21:45,oriolesa,2,🅿🅿
2019-12-12 04:20:44,RareUnicorn,10,"Have the day off work tomorrow guys. You know what that means!

More time to over analyze all my positions, capitulate at the worst possible times, and somehow turn a winning trade bad. Except I get to do it all day, most likely several times different times without work bothering me!"
2019-12-12 04:20:15,mauimikes,-4,Everybody r fuked!!!
2019-12-12 04:18:07,Midgetfarm,4,QE 4.20
2019-12-12 04:10:23,yinatom,5,I went nearly all in on iron condoms today and I made money for once but every .02% jump made my heart stop I can’t do that shit anymore
2019-12-12 04:09:24,winkerpack,5,"Anyone here still play fortnite? I havent played in over 6 months, but enjoyed just doing like the 50 v 50 team deathmatch type games. Would be easy to jump back in just for casual messing around?"
2019-12-12 04:04:10,,7,"You know, eventually we're all actually gonna have the hang of this and have to disband the sub..

Jk"
2019-12-12 04:02:26,NIONIONIONIONIO,-7,OH SHI \_\_\_ \_ \_\_\_
2019-12-12 03:59:54,gbplfnt,2,someone please just buy vixy at 18 from me and I go freely of this hell product with 20% loss. PLZ
2019-12-12 03:59:31,chessiechoice,1,🏌🏻‍♂️every make a trade and go...”that was a nice shot”  been awhile
2019-12-12 03:53:32,knotswag,8,"I'm looking at the hourly charts of SPY and the amount of little gap ups after flat trading since ""trade deal"" announcement in October is absolutely striking compared to how the market was moving before September and historically. Just really fucking weird and unnatural. 

I hope someone will go back eventually and plot whether each of those gap ups were ""tradetalksgoingwell.exe"". We'll look back on this time and realize just how full of shit and retarded MM really is."
2019-12-12 03:51:16,,6,"Psst....if trump delays sunday tariffs he becomes a laughing stock in trade wars,HE WONT!!

Dont @ me with SPY 280 on mondaay."
2019-12-12 03:50:06,gatoken1,5,"Besides poutine and french shit, wtf do i gotta see or do in quebec city 🤷‍♂️"
2019-12-12 03:49:24,BlueKnightJoe,3,"Ron Vara (Navarro) is one of the advisors Trump is meeting with tomorrow before deciding what to do about the tariff deadline.  


NY Times: the memo circulating in Washington suggests that Mr. Trump could calm jittery investors by publicly backing away from a deal: “Get uncertainty out of the market by announcing NO deal until after the election and ride the tariffs to victory.” 

It also quotes Cramer arguing that Trump should go ahead with the tariffs.  


[https://www.cnbc.com/2019/12/11/peter-navarros-alter-ego-ron-vara-shares-pro-tariff-memo-amid-trade-talks.html](https://www.cnbc.com/2019/12/11/peter-navarros-alter-ego-ron-vara-shares-pro-tariff-memo-amid-trade-talks.html)   


 [https://www.nytimes.com/2019/12/11/us/politics/navarro-ron-vara-tarrifs.html](https://www.nytimes.com/2019/12/11/us/politics/navarro-ron-vara-tarrifs.html)"
2019-12-12 03:49:04,yinatom,6,I was tired all day but good news now that it’s almost bed time I’m not :)
2019-12-12 03:48:48,HourPackage,2,Why is JNUG not down after today's J Pow moon shot?
2019-12-12 03:48:46,NIONIONIONIONIO,-2,ALEXA PLAY OOOWWWEEE
2019-12-12 03:48:18,HereForMadden,3,Thinking of getting a quick day trade tomorrow and calling it a week
2019-12-12 03:46:02,winkerpack,3,"Had a really good day trading. Near 100% on the day. OLLI calls up 150%, then day traded pton for a 70% gain and apple for a 30% gain. Bought back in to apple, have costco calls that I'm up on that might sell half tomorrow and let the other half ride for their ER."
2019-12-12 03:45:48,NIONIONIONIONIO,-1,ALEXA PLAY RAINING DILDOS BY SLAYER
2019-12-12 03:45:34,gatoken1,26,"Holy fuck theta grunberg’s first name is theta 🗣

I thought that shit was a joke

Long theta gang"
2019-12-12 03:44:26,AnExoticLlama,2,"TWTR calls. Oversold/overreaction to news earlier this month. $35-40 is fair for Twitter, as they have a very low PE. Only problem is their EV/EBITDA, but that should improve as they find more revenue streams and further improve the platform.

Very bullish on Twitter in the long run, as it's basically a staple of life to millions of people. As the folks on the Investor's Podcast put it, the platform is becoming less like blogs and more like individualized television channels."
2019-12-12 03:44:08,jenzocaine,14,If I could buy puts on my RH account balance I would be a rich man.
2019-12-12 03:43:58,APHAbaghodler,1,GSK puts soon.
2019-12-12 03:43:23,,1,Marijuana is one dangerous drug. Don’t know why so many people risk their life doing that shit.
2019-12-12 03:43:11,CPA-hole,6,Fuck NIO
2019-12-12 03:43:08,divsandpremium50,2,Damn y’all are gay
2019-12-12 03:43:00,crazyeugene,8,"Fellow ~~gamblers~~ investors, is AMZN going up or down or back to 1740?"
