date,author,score,body
2019-12-22 23:32:20,stormwillpass,1,"All I want for Christmas are pics of people sporting WSB merch (T-shirt, sticker on your laptop, etc).

Will pass along the pics to the other mods, who will greatly appreciate the pics.

Free flair and gold for the first few, and the first will also be included in the WSB awards.

Thank you for making my dreams come true.

edit: [Official WSB merch store](https://www.redbubble.com/people/officialwsb/).

Unfortunately the estimated shipping isn't until January, so I guess this only applies to those who have bought already"
2019-12-23 17:47:47,shmowker,3,FB WTF
2019-12-23 15:53:11,bbvending88,2,Called it AMD $45
2019-12-23 15:39:05,PleaseBuffTechies,5,"Be angry I didn't sell a bunch of puts of ITCI because pussies on the internet told me it was stupid. Now who is the stupid one, huh? That's right, me."
2019-12-23 15:34:40,king_mj13,1,"great job, I loaded up on tsla and a bit of nke. nike has been killing me since earnings"
2019-12-23 11:10:43,InferiousX,2,"Sniffing some possible short term weakness in AAPL

Might take a flier on some 12/27 275P"
2019-12-23 11:01:16,IRPhysicist,7,"Alright, what the fuck TSLA."
2019-12-23 10:39:14,Snuckiez,4,"Trying to see how many eggplants fits in my a.s.s, and once I pop em out I'll have a cardboard with various companies I'll yolo on."
2019-12-23 10:35:09,,2,"i have tons of calls on my acc, but holy fuck these futures got me worried that they're just buttering us bulls up for a massive rug pull slaughter soon"
2019-12-23 10:10:59,astafe,4,"I have calls of Uber , Boeing , Tesla , AMD and Nike . Its  like I don’t F*k know what puts are"
2019-12-23 09:27:03,ch1p_skylark,7,"witcher is so awesome omg

fuck"
2019-12-23 09:24:33,theonlyevanever,1,TNK Calls
2019-12-23 09:13:57,burrito3ater,2,Oilfield Service companies puts. 100% bear gang.
2019-12-23 09:00:41,Francknbeans,1,$PYPL calls and $GLD calls. Let's roll.
2019-12-23 08:35:17,,5,260000 open interest in Jan 17 $7 chk calls lol. What is up?
2019-12-23 08:32:12,denali4eva,5,Why the fuck does ITCI have IV of over 400%? What the fuck? This is the highest I've seen ever.
2019-12-23 08:22:24,Jarebear_805,1,BAC seems high with RSI at 71 and on a near 3 month run up. Is it going to keep going?
2019-12-23 08:22:17,optionstudent516,3,Fuck the mods
2019-12-23 08:06:25,,3,brace yourselves. the midnight powell pump is here
2019-12-23 08:00:01,greenbreadseduction,7,"I just spent $1000 on blackjack lessons today

I love vegas"
2019-12-23 07:55:02,Submittomemeow,2,What is going on with CRTX
2019-12-23 07:48:40,Regjohn,8,420.69
2019-12-23 07:45:32,istergeen,2,Putting this weekend ITCI over-posted ticker to work!
2019-12-23 07:43:36,oregon_forever,24,"Trump: I just bought the pen with which I'll sign the trade deal. 

Market: Up 1%.

Trump: And I bought some ink...

Market: Up another 1%.

Trump: I've been practicing my signature on an empty piece of paper.

Market: Up another 1%."
2019-12-23 07:41:47,oregon_forever,19,"Trump should sign the trade deal page by page so that the market can be pumped for a longer period of time.

""Today I signed the first page of the trade deal and tomorrow I expect to sign the second page.""

SPY up 1% today and another 1% tomorrow and so on."
2019-12-23 07:35:55,flowkingfresh,2,Why is silver up so much ??
2019-12-23 07:34:48,dungbat83,1,I feel retarded for not buying silver when it was sub 17$
2019-12-23 07:34:14,leoeln,3,Ugaz anyone???
2019-12-23 07:31:35,jakersthepig,1,"Damn, 7.5k volume and over 50k OI for Jan 17th 50c Options in Cisco. Now I kinda want to play"
2019-12-23 07:31:30,hamsupjai,1,Lmao what is China on!?!?
2019-12-23 07:22:32,,12,shanghai dumping down 1.4% = BLOOD GREEN OPEN FOR USA stock market. USA USA USA USA USA USA
2019-12-23 07:18:09,Sinadins,2,"2am baby yoda green, baby

gonna take these tendies and buy a baby yoda hasbro"
2019-12-23 07:17:52,dungbat83,4,Wow China down over 1%
2019-12-23 07:13:34,astafe,2,All in AYX  FGDs . literally easy money can’t go tits up
2019-12-23 06:51:11,,7,"oh no futures faded from +0.07% to +0.03%, recession is coming boys"
2019-12-23 06:47:14,DaSmartGenius,5,[Live footage of WSB telling people to buy calls here](https://www.youtube.com/watch?v=i5KBVCoKYt0&t=0s)
2019-12-23 06:44:49,Sinadins,6,"I'd honestly be embarrased af to pull out the Robinhood card, that thing looks like one of those toy credit cards my niece swipes on her toy cash register 🤮

my solid titanium apple card tho 😏"
2019-12-23 06:34:19,DaSmartGenius,3,"Bears, gimme yo bear thesis for why you're holding puts rn.

Bulls, I'd ask the same for you but I already know the answer is ""sToNKs oNLy Go uP"""
2019-12-23 06:30:31,Mav2246,9,I will fuckin say it. I really want that Robinhood cash management card.
2019-12-23 06:29:15,S_Jack_Frost,2,Selling puts this next week. Apple roku shop
2019-12-23 06:28:56,mortarboy,7,8 hours til this misery comes to an end.
2019-12-23 06:28:46,,-2,futures fading GUH
2019-12-23 06:24:55,TheHydroElite,3,My guilty pleasure is eating pastries while in the shitter
2019-12-23 06:23:15,Nghtmare-Moon,1,"So BHC just got something approveed by the FDA on Friday.  
Is it going to the moon or beyond?"
2019-12-23 06:21:08,dungbat83,2,Time for Gold gang again
2019-12-23 06:20:30,HusarzKrolowiec,1,NUGT .. if it shows any signs of life
2019-12-23 06:15:58,jcon877,1,"Open interest on 1/17/2020 $GE 20c is 276,645

That a 81% move up with only 25 days from now..."
2019-12-23 06:12:14,oregon_forever,2,"Once Powell goes on vacation the market might take a dip. Until then, pump to the moon."
2019-12-23 06:09:24,,5,Hunt Santa down and ask HIM what he wants for Christmas.
2019-12-23 06:07:43,dawhizkid,1,Isn’t China incentivized to play nice with the trade war because they obviously want Trump to get re-elected and not a Democrat?
2019-12-23 06:02:56,CashofJohnny21,-14,NORTH KOREA TAKIN US BIGLY RED
2019-12-23 06:02:46,,4,"the market literally cant go down cause powell is willing to throw $1 trillion into buying up the entire stock market with a push of a button, does it really matter if debt increases by 1 trillion when its already this high? nope"
2019-12-23 06:00:18,,2,"this pump wont stop until election time. if they can prop the market up with all the weak economic data being released, theres no way they cant prop it up until election for a trump reelection"
2019-12-23 05:53:56,ChinaUnfairGoingWell,8,My 2020 New Years resolution is to open a real brokerage account.
2019-12-23 05:47:12,OblivionXBA,2,Are $SPY calls the safest calls right now? There doesn’t seem to be reason for it to dump....but then again no reason for a pump.
2019-12-23 05:41:27,0116,7,"I need $15k to make day trading rule go away, what’s the move?"
2019-12-23 05:37:43,Ace12773,4,What’s a nice lil scalp for tomorrow? Looking for a dopamine hit
2019-12-23 05:30:25,Not_reddits,11,I actually don’t know what options are. I just see puts and calls and I buy the ones that are priced within my personal risk tolerance
2019-12-23 05:25:09,IS_JOKE_COMRADE,8,IKEA should go public. Swedish hoes are so hot on PH
2019-12-23 05:20:47,King_Siege,11,"SPY 330 by EOY, followed by a 3-4% selloff to start the new year"
2019-12-23 05:19:06,galactictaco42,11,"what if the past still physically exists? like the universe is one long wierd 4 dimensional shape and like, we experience these individual slices of it as moments in time

like what if the people we were in our naive youths still exist somewhere? eternally immortalized as the young hopeful mind we used to possess? the life with infinite potential you know?

like imagine all the lives you didnt live. the loves lost, never encountered. schedules kept or abandoned. trains caught and planes delayed. every moment of your entire life lead to here, right?

like what if it all means something in some bizarre way? what if the way we write words to transmit ideas experiences and realities into the future and across the world, what if some other worldly power exists as the combined experience of every conscious mind in the entire universe and like, every life of every living thing is just a way of transmitting the essence of existence onto other other worldly beings. 

what if love was a real thing you guys? a physical existing eternal bond between the ineffable silly things we call 'I'?"
2019-12-23 05:16:22,throwaway_0x90,0,"YOLO 100 shares of ITCI

The comments on here have made me dizzy with doubt, but zacks.com [strong buy rating](https://www.zacks.com/stock/quote/ITCI) makes this the best gamble on biotech I've ever taken. That's not saying much though 'cuz I use to just pick 'em based on cool sounding names. :) I'm hoping for gains big enough to offset the potential loss on my March 30th PTON calls."
2019-12-23 05:11:57,IS_JOKE_COMRADE,3,Yeah I’m gonna short it q2-2020 not now too strong
2019-12-23 05:11:51,yinatom,1,Wore my hair different today and no one brought it up that’s bad right?
2019-12-23 05:01:25,ch1p_skylark,5," [https://twitter.com/BloombergAsia/status/1208973229219557379](https://twitter.com/BloombergAsia/status/1208973229219557379)   
FUCK

IT COULD GO UP OR DOWN

WHAT DO I DO"
2019-12-23 04:57:44,winkerpack,9,Hope I make some money tomorrow
2019-12-23 04:53:10,HazyClown,3,MSFT 160 calls for jan 03. Opinions?
2019-12-23 04:48:55,,8,"Red futures mean green at open

Green futures mean greener at open"
2019-12-23 04:47:24,NoftScarlet,4,Smoked salmon at IKEA is pretty delicious
2019-12-23 04:46:03,ch1p_skylark,10," [https://www.cnbc.com/2019/12/23/activist-hedge-fund-marcato-capital-to-shut-down-after-drop-in-assets.html](https://www.cnbc.com/2019/12/23/activist-hedge-fund-marcato-capital-to-shut-down-after-drop-in-assets.html) 

lmfao I understand losing money in 2018

but now fucking terrible do you have to be to go negative in 2019 as a hedge fund"
2019-12-23 04:42:49,Ouijes,3,I'd you get marked with PDT it bans day trades for 90 days but you can still trade right?
2019-12-23 04:41:57,IS_JOKE_COMRADE,3,All father give me strength
2019-12-23 04:41:49,itsdrivingmenuts,0,Calls on Sprint and Verizon.
2019-12-23 04:41:29,IS_JOKE_COMRADE,3,What should I short tomorrow? 1k. Looking for an early January play
2019-12-23 04:41:28,Billie__Gates,1,Someone tell me my AMD puts will be okay
2019-12-23 04:41:04,IS_JOKE_COMRADE,4,Why is whiskey so good
2019-12-23 04:39:10,,1,I can’t decide on what broker I want to use... 1st world problems
2019-12-23 04:37:05,ibro982003,6,BA to $340
2019-12-23 04:31:13,GustavMax,2,AAPL 285 tommorrow would be super nice
2019-12-23 04:29:05,FourOranges,0,"Just saw the new Star Wars movie, man 😍Daisy😊Ridley😍 💋

My $2k in DIS $150 mid January calls are gonna MOON with these to-be-announced record opening-weekend box office sales."
2019-12-23 04:29:03,oshbear,2,"Mods can eat a fat one, including the automod"
2019-12-23 04:26:20,FOMOhomo,3,Asia markets all down.  S&P futures are up... got it. 🤷‍♂️
2019-12-23 04:25:12,IRPhysicist,3,At this rate I’m gonna have a sweet bear pelt for Christmas.
2019-12-23 04:17:11,YOU_PAY_TAX_2_ARAMCO,9,"the past 11 weeks saw 10 green weeks and 1 perfectly sideways theta week.

this is the best stock market performance in the last 30 years thanks to a FED repo bailout, followed by the first 10 weeks of 2019 thanks to the FED emergency policy reversal, the last 10 weeks of 2017 leading up to the tax cuts, the 10 weeks after summer 2010 thanks to front running QE2, 9 weeks at the end of 2003 probably due to retail and saddam capture, the 8 weeks starting off 1998, and 8 weeks in spring 1996

All those weekly runs had at least one red week. Nothing more than 7 to 8 green weeks + one red looking back to 1990.


once again, this is the best stock market performance in the last 30 years. corporate earnings are flat. earnings per share are skyrocketing, because companies can just get loans from banks to buy their own stock then those banks get taxpayer bailouts via not qe"
2019-12-23 04:12:04,yinatom,7,Sometimes I don’t understand your comments but I fake laugh anyway so you don’t think I’m stupid
2019-12-23 04:10:28,yinatom,2,Fluoride water builds character
2019-12-23 04:05:42,,1,Gotcha
2019-12-23 04:03:16,thesharpiesharp,1,STNG - buying that like a fat kid trying to eat his way to diabetes.
2019-12-23 04:03:03,LaMeraVergaSinPatas,1,"SRNE 6/2020 5c
SPCE calls
BB 6p
Hoping my weekly spy 320p stays strong 

Happy Hanukkah to all"
2019-12-23 03:58:00,IlliniFire,1,Got to figure out how far out to sell X puts.
2019-12-23 03:55:19,EEBucks,9,Break out your crayons and technicals 🥇🥇🥇
2019-12-23 03:54:21,mauimikes,6,Damn yo AirPods are dope 😎💯
2019-12-23 03:52:47,punisherlol,9,netflix calls #TheWitcher
2019-12-23 03:50:39,IS_JOKE_COMRADE,2,"What’s the trick where you make a risky trade over the new year? If it goes well, great, if not, tax write off or whatever?"
2019-12-23 03:48:57,oregon_forever,8,"This week even the regular day traders will be ""pajama traders"" for the most part."
2019-12-23 03:48:19,black_and_shredded,5,"I’m convinced this recent surge in ITCI is some market maker shill tryna convince everyone to go broke, because this shit was untalked about even 3 days ago."
2019-12-23 03:46:25,CryptoLukey,7,SHOP puts boyz who in
2019-12-23 03:32:59,zebrawaterfall,2,I would love for my amat calls to print. They got destroyeeeeed around earnings. Had em for like a month lol
2019-12-23 03:31:53,MaStNu,6,I wonder if algobots get christmas holidays?
2019-12-23 03:28:23,citroen6222,1,"I have 12/27 calls in nvda and amd 

And a few 1/31 amd

how I do tmr boys?"
2019-12-23 03:28:11,ev01ution,2,"I really want the rocket man cup, but I'm too cheap to pay for the shipping.  Will you guys donate to my shipping fee if I set up a go fund me page?"
2019-12-23 03:25:26,IRPhysicist,10,Go to airport. Get in a fight in cattle class. Run simulations. Take out limited positions. Drink bourbon and chop wood.
2019-12-23 03:20:53,oregon_forever,5,">A decade of easy money has left the world with a record $250 trillion of government, corporate and household debt. That’s almost three times global economic output and equates to about $32,500 for every man, woman and child on Earth."
2019-12-23 03:17:17,The_Pandemonium,9,Oh shit trade talk tweets boy! Boutta have a green spy tmr. Spy to 325 by eow
2019-12-23 03:15:51,freehouse_throwaway,5,"after reading all the ITCI shit, i've come to the conclusion that it'll go tits up 

thought about selling $4 or $5p but even then there's some risk of assignment

i guess credit call spread may be it."
2019-12-23 03:15:39,gkdjsl,6,"[https://www.cnbc.com/2019/12/23/china-will-lower-import-tariffs-on-over-850-products-from-january-1.html](https://www.cnbc.com/2019/12/23/china-will-lower-import-tariffs-on-over-850-products-from-january-1.html)

includes semiconductors"
2019-12-23 03:12:30,PlataoPlomo19,6,China's cutting import tariffs. SPY to 3000
2019-12-23 03:10:13,HowLongIsWinkersDong,5,I just want a green open for goog so I can cash out and chill
2019-12-23 03:10:10,wolf_of_wall_mart,9,To get a cheap meal I break up dry ramen into small bits and pour the seasoning on em. I call it Puerto Rican popcorn haha
2019-12-23 03:08:01,Th3_Capitalist,8,I’ll buy a WSB tee if $SPY closes above 325 this week.
2019-12-23 03:00:05,APHAbaghodler,30,"Another depressing ass Xmas holiday for me. Alone, broke, losses mounting and likelihood of said YOLO's paying off decreasing by the hour/day/minute etc.

Serious question how do y'all deal with loss induced depression. Sometimes i think if it weren't for the gym i'd fucking end it all. The fucking pain is too much. How much fucking worse can life get? Broke, basically homeless, no family in this city, no fucking nothing besides me myself and my 98% loss YOLO's. Fuck life fucking sucks. Meanwhile i just donated money to pay for some rich piece of shit's cigar and wine budget for the year. Fuck the world."
2019-12-23 02:53:15,dontlookup25,5,"Now that SBUX got all of those downsies and flatsies out of its system, I expect $91 EOW 👏"
2019-12-23 02:53:08,Trappin-Shoes,2,PTON is straight up in a falling wedge...wonder if it’ll fall further
2019-12-23 02:51:30,zebrawaterfall,8,"Protip if you fly Delta this week. Just type in a random TMobile number for free WiFi. I have TMobile but wasn't eligible so I switched one number lol. 

Also the flight has been good. I like Delta.

P.s. all I want for Christmas is a tiny little HAL moon. They got downgraded in the middle of a run up. Such bullshit."
2019-12-23 02:40:31,TequilaTrader,35,Went shopping at Nordstrom’s with the wife and I asked her to help pick out her Christmas presents.  Without flinching she bought a $1500 pair of Valentino boots.  My first thought was that I lost $1500 on a chipotle put in a couple days and I didn’t even get a burrito.   I guess it’s all the same.
2019-12-23 02:39:19,DiogenesTheGrey,3,What is a normal Christmas week for spy? I know we left normal a while ago but still.
2019-12-23 02:36:21,The_odd__todd,8,This sideways year end sell off is really going to surprise people.
2019-12-23 02:33:04,BrokeDayTrader,3,Is trade war finally **Priced in**???
2019-12-23 02:28:25,Submittomemeow,8,Keeping an eye on rocketman in North Korea just in case he tries to lower stonks
2019-12-23 02:25:03,,15,Lmao you should of seen my gf’s reaction to my reaction when the trade tweets hit my phone. I yelled “tendies for breakfast babe”. I think she knows I’m autistic now.
2019-12-23 02:22:36,Gilbertgodfries,6,I've had an ear infection for 5 days now. :( Not fun friends
2019-12-23 02:22:21,ukfan758,2,Oh boy
2019-12-23 02:21:12,dawhizkid,15,"China cutting tariffs on over 800 items Jan 1

According to a statement from China's Ministry of Finance, China is set to cut import tariffs for goods including frozen pork, pharmaceuticals, paper products and some high-tech components starting from January 1, 2020. The move comes on the heels of US President Donald Trump's comment on Saturday where he claimed that a ""breakthrough"" has been achieved in trade talks with China and that he expects a deal to be signed ""very shortly."""
2019-12-23 02:20:06,DeliciouslyUnaware,7,"Yo since pot stocks are taking it up the ass right now, CRON has Jan 3 2020 6.5 puts for 10 cents right now"
2019-12-23 02:17:41,spyaintnobitch,3,"Not sure who tell so I'm telling you guys, my only friends!!

I just got a match on tinder. She seems a little retarded and has down syndrome, like my portfolio. 2020 fitt'n to be lit!!!

I may even get to proudly add to the next generation of wallstreetbets retards!!"
2019-12-23 02:12:10,Afr0Karma,7,what happened to that 1 mill FSLY guy
2019-12-23 02:11:37,brownhairybear,0,I was asleep and I dreamt of a winning strategy!!
2019-12-23 02:09:37,WorstOfWallstreet,7,If Amazon can't go green tomorrow I'm trimming my position 🤷🏼‍♂️
2019-12-23 02:08:13,Randomawesomeguy,6,Crying in bed until 9:30
2019-12-23 02:08:01,VacationLover1,4,Grinch gang leader reporting for doody.. let’s watch people lose money all week
2019-12-23 02:07:45,mortarboy,3,this week seems ripe for some tight JNUG iron condors
2019-12-23 02:05:58,oregon_forever,6,Prepare for a super-low volume rally for the next 2 weeks (as usual).
2019-12-23 02:03:09,oregon_forever,10,"On one side, the market goes up almost every single day so it makes sense to buy calls every day.

On the other side, the market is extremely overbought and in bubble territory and it won't take much to cause it to go south once Fed stops pumping it to death."
2019-12-23 01:58:04,1353-,1,TLT leaps before it's too late
2019-12-23 01:54:52,wolf_of_wall_mart,5,Do you guys think you’ll ever be
2019-12-23 01:48:46,,10,sinister af to bet against America on the week of Christmas.
2019-12-23 01:46:37,barelyreadsenglish,5,Will BA get its shit together this week? I got calls so probably not.
2019-12-23 01:46:32,Howtoshortdow,5,Damn this thread is dead
2019-12-23 01:36:28,HarryMooseKnuckles,3,What are normally some good stocks to buy after xmas/new year?
2019-12-23 01:33:41,earfffffffffff,9,You dont really hear much about j-lo's ass nowadays
2019-12-23 01:32:07,Boonboonspy,4,Holidays guys 🎄 time to join thetha gang. SPY covered calls till EOW.
2019-12-23 01:28:13,CashofJohnny21,1,The retardation on some of these non shit posts recently have seemed almost too retarded to be true
2019-12-23 01:25:48,DillonMeSoftly,2,"RAD looking short term bearish towards EOD Friday. Thinking of getting some weekly puts for a gamble and if they make a bit within a day or two, sell and switch to calls."
2019-12-23 01:24:32,1sildurr,2,Nat gas... you bastard.
2019-12-23 01:23:56,Ke1ton,4,1/24/20 $355 TSLA puts and 1/3/20 $32 PTON calls. Hope they print.... they probably won’t and I’ll lose 1k.
2019-12-23 01:22:47,,7,"Don’t worry about FOMO there will be another time when stock prices drop 50-75% in value.

Apple will be $150-175, MSFT 85-90, FB 150 Amazon 1300"
2019-12-23 01:19:07,OddSalary,13,SPY has no resistance to 330
2019-12-23 01:18:47,iamtony36,5,Looks like SPY  is setup to hit $321.5 tomorrow
2019-12-23 01:17:03,option-whisperer,15,I have no life and a serious trading addiction. I binged watched trading documentaries on YouTube today and stared at my market countdown clock. I need my head examined.
2019-12-23 01:15:39,cookies324,8,It’s time to set the algo’s to the moon tomorrow boys Christmas rally incoming!!🚀🚀🚀🐂🐂
2019-12-23 01:12:56,analyst_84,1,Any of you autists ever hire a pornstar?
2019-12-23 01:11:39,HotStockSlinger,-3,Redder than my wife's tampons tomorrow.
2019-12-23 01:11:36,JCThatsJB,5,Leaving this sub that has been taken over by actual retards.
2019-12-23 01:10:13,excadedecadedecada,1,Gonna need BUD to drop a buck or thereabouts--need to offload the top leg of my IC--don't really like how they blasted past this shit in just a few days. REE
2019-12-23 00:57:16,,5,I found a free book on natural language processing in python... might be a good read. [http://www.nltk.org/book/](http://www.nltk.org/book/)
2019-12-23 00:56:37,Stagathor,4,Selling $5 puts for ITCI. Seems a safe bet. Hoping the stock drops post approval or rejection.
2019-12-23 00:54:11,Robinhood_CEO,6,"Santa rally priced in??

Are there any catalysts this week?"
2019-12-23 00:52:42,masonsbabyblues01,4,"Speaking of using it or losing in...anyone try and write a full sentence or paragraph in proper cursive lately?

 Holy shit I couldn't remember how.."
2019-12-23 00:48:09,bluen,6,NEGATIVE INTEREST RATES??? THE LENDER GETS BACK LESS. ROI IS NEGATIVE. GERMANY IS FUCKED
2019-12-23 00:42:04,jakersthepig,3,Went for it. DIS 155c Jan 17th exp
2019-12-23 00:41:53,ILoveTheAtomicBomb,3,ITCI puts?
2019-12-23 00:39:02,,7,"   PG&E, Groups Reach Agreement on Rate Increases - Buy $PCG calls tomorrow and thank me later"
2019-12-23 00:36:18,,7,How many of the autists here actually have a 500k+ account?
2019-12-23 00:33:44,iliveforedm,11,🦅🦅🦅🦅🦅🦅🦅🦅🦅🦅🦅🦅🦅🦅🦅🦅🦅🦅🦅🦅🦅🦅🦅🦅🦅🦅🦅🦅
2019-12-23 00:31:10,,8,WTF IS THE POINT OF HAVING A COLLEGE EDUCATION IF YOU CANT DO SIMPLE MATH?
2019-12-23 00:29:03,Submittomemeow,-6,"Okay, RH bros who want to view the app on a larger screen. Found this helpful  https://www.youtube.com/watch?v=6iZAM5bYkts

+ To screen mirror iPhone to Mac with QuickTime, start by plugging your iPhone into your Mac using the USB cable it came with. Then, click QuickTime in your Mac’s launch pad to start up the software. At the top of your screen, click File, then select New Movie Recording. By default, QuickTime will select your Mac’s webcam as the source. To change it to your iPhone screen, click the downwards arrow beside the record button, then select your iPhone from the list. You should now be able to see your iPhone screen on your Mac. If you want, you can also record your iPhone screen using QuickTime by clicking the record button. To stop recording, click Stop. If you just want to view your iPhone screen on your Mac and not record it, just don’t click the record button."
2019-12-23 00:26:03,Midgetfarm,4,HomoZzzz
2019-12-23 00:25:55,MP1182,6,AAPL’s been dead flat since Friday 4:30.  I’m worried.
2019-12-23 00:25:18,Wendal_the_great,1,I’m getting my boomer dad Robinhood for Xmas.  Any advice?
2019-12-23 00:25:08,WBuffettJr,2,Can we have a discussion about ITCI? I see everyone posting about the huge premiums. What’s the thesis with them? Are they expected to do well/get FDA approval? If so why can puts be sold for so much?
2019-12-23 00:23:46,Big_Factz,2,Selling more puts tomorrow probably
2019-12-23 00:19:11,MP1182,4,I think I’m going long on MSFT.  29 anal lists have the median target price at $162.  And every time i see MSFT i think of The Misfits.
2019-12-23 00:18:06,giztrem,11,Bought tesla puts on Friday
2019-12-23 00:16:59,APHAbaghodler,5,"Long auto parts manufacturers/conglomerates... legit the industry is huge regularly recurring profit because 75% of aftermarket parts out there are junk that fail and have to be replaced again in 6 months.. and 95% of customers will go the aftermarket route because it's cheaper initially.. fucking junk Chinese auto parts. Take it from a mechanic, they literally only last 6 months and have to be changed again."
2019-12-23 00:14:05,iamtony36,6,"Spy calls in the morning, sell an hour in. Buy puts for the ride down. Rinse and repeat"
2019-12-23 00:13:53,PoodlePirate,6,Probably spent my first big boy paycheck Christmas SPY or TSLA calls
2019-12-23 00:12:21,jakersthepig,1,"Idk if I want to play BA or DIS tomorrow. I think Disney is stable and might be safer, but BA could bounce soonz it's at it's pattern low."
2019-12-23 00:10:14,,1,boeing puts.
2019-12-23 00:09:44,spyaintnobitch,13,"I'm unbanned bitches. Wazzupp!!

P.S Mods suck dick and balls!"
2019-12-23 00:09:41,cryptdab710,1,im gonna follow luv2fukbear shoes guy and buy some boeing
