date,author,score,body
2019-10-10 23:36:49,RareUnicorn,2,"Damn, Robinhood really just keeps pulling me back in... Down bad and don't even quite have $2k anymore, so I stopped margin. 

Switching to TD Ameritrade, and I need a Margin account to create spreads?? So I can buy a Call, but let's say I'm up 40% and want to lock gains.. I have to day trade it? I can't lock it with a spread a strike up?

Robinhood is ahead of it's time in so many more ways than $0 Commissions... I can take $500 and do whatever the hell I want with it on Robinhood. 

TD is gonna end up cucking me if I can't even lock gains with a spread... Like, I've been saved too many times by that. I won't have enough day trades. SOOOO basically I'm just gonna use Robinhood till I either blow my account, save up $2k, or make $2k in profit. (well, less, but I always want more than margin minimum obv.)"
2019-10-10 23:34:22,IWorkForTheEnemyAMA,9,Really looking forward to the $3000 tax deduction I get for the next 5 years.  This is my long con.
2019-10-10 23:33:39,londonistani,8,BREAKING: *Adam Neumann not seen for days. Was invited for lunch at Saudi Embassy in Tokyo days ago.*
2019-10-10 23:33:29,khanx290,4,Why is everything crashing suddenly
2019-10-10 23:31:00,Scottyzredhead,2,Can my IRA buy SPXU shares?
2019-10-10 23:29:40,Midgetfarm,7,"Worked out and went for an hour hike everyday this week, quit smoking weed, and got a juicer. Juice 15$ worth of disgusting veggies and chug it. Feel great. u/winkerpack I'm 180 now with no fat 👀👀"
2019-10-10 23:29:37,Cnastydawg,2,All you re’s keep screaming no deal. Just sell your puts and go cash gang until trump says something
2019-10-10 23:29:37,londonistani,5,"CaLL yOuR cOnGreSsMan, tELL hIm tO bAn FuTuReS 🌈🤕"
2019-10-10 23:26:06,,5,Lost $4.5k but would like to make that back and never fucking deal with FD’s. What should I play next?
2019-10-10 23:25:33,londonistani,5,The british pound jumped 2% and Boris Johnson is still alive. I call bullshit and shorted.
2019-10-10 23:25:13,snoooooooooo,3,"I’m just here becuz I know like one other person irl who’s into trading, and they r retarded (like worse than u retards)"
2019-10-10 23:25:11,kismethavok,1,"Holy shit, primary dealers have increased bond holdings by like 900% from 6 months ago."
2019-10-10 23:23:51,IS_JOKE_COMRADE,29,"🙅‍♂️>🤝

🐂🔫🐻

💎🖐🏻

💎🍆"
2019-10-10 23:23:29,akhtarst,1,Pump is going away - futures slight green not bigly
2019-10-10 23:23:04,inb4ElonMusk,1,Futures trading should be banned from existence.
2019-10-10 23:22:58,oriolesa,1,Mango pump wearing off
2019-10-10 23:22:12,winkerpack,3,"Any other WM bois cash out with some tendies today? I cashed out my 10/18 $115c for a 50% gain.  I'm still bullish on them, but needed to take some gains. Plan to get back in soon."
2019-10-10 23:21:49,aqualityusername,1,Thoughts on baidu?
2019-10-10 23:21:15,PinnySkeenus,1,NE -16.5? Sheesh. Brady bouta take Daniel Jones’ V card tonight
2019-10-10 23:19:08,greentea45,0,"Hm, just browsing IB's margin rates since I have an annoying net negative JPY balance

The rates are for idle JPY balances:
0 - 11M 0%
11M+ -0.607%

WTF, so if I keep a positive JPY balance I'm going to get penalized for it? But it's okay as long as
it's less than 11M???"
2019-10-10 23:18:51,MrBleepBleep,2,#🌈
2019-10-10 23:18:44,winkerpack,6,"Imagine having to buy an adapter just to be able to charge your phone and also listen to music through a cord. 

Apple is a beast of a company, but I have no idea what they're thinking getting rid of the aux port when it's still universally used."
2019-10-10 23:17:11,bobbyhagh,2,TLT Strangle gang
2019-10-10 23:17:01,nastiistacks,1,What’s the play for the weekend?
2019-10-10 23:14:52,SmoresPies,3,futures up. we gettin' gutted in the morning
2019-10-10 23:13:16,Howtoshortdow,5,RICK FLAIR WOOO
2019-10-10 23:11:56,fedorovnick,-1,Ну чо? Trump будет президент?
2019-10-10 23:10:59,kismethavok,16,Just a little advice: Trade talks were going well because mango wasn't involved.
2019-10-10 23:10:34,fedorovnick,0,Anybody know what time the meeting is tmrw eastern?
2019-10-10 23:10:33,SpeedRac3rr,3,Haven't been watching stocks or news all day but wsb seems bullish 🐻
2019-10-10 23:09:29,greentea45,2,"Well, that quote and pump appears to have been mostly ineffective..."
2019-10-10 23:09:08,davide3991,2,Any chance this bullshit bbby pump will dip hard tomorrow?
2019-10-10 23:05:46,greenenergyonly,26,"Trump says China wants a deal but it’s up to him whether he wants it or not, is a face saving move when they can’t agree tomorrow and he comes out and says it was him that tell them no"
2019-10-10 23:05:30,captainndaddy,14,I’m gonna sit and watch my options expire worthless
2019-10-10 23:05:24,astroyeet,3,Is IV on spy high ATM? Wonder how much option prices are affected by the current events
2019-10-10 23:05:21,uninfinity,5,"This pump took out my stop loss. 

*US-China trade talks are going very well, ""probably better than expected"", says a White House Official*"
2019-10-10 23:05:20,TimaaaY142,2,Why is BBBY mooning.... ahhh fuck
2019-10-10 23:05:08,desfluranedreams,4,watching my apple puts die.
2019-10-10 23:04:31,meow1616,2,That was one spikey boi
2019-10-10 23:03:07,TaylorLH,8,Anyone feel like the more they pump trade talks the less likely it’s actually gonna happen
2019-10-10 23:02:42,krushdavis247,2,Where do you guys find analysts eps revisions over the last 90 days before a tickers earnings report?
2019-10-10 23:02:14,timmpeterson,4,Is anyone seriously holding puts right now?
2019-10-10 23:02:11,davide3991,3,Roku is on steroids
2019-10-10 23:02:04,Th3_Capitalist,2,Partial deal and tariff delay = moon. No deal = tank? Tell me why it’s retarded to buy 1 contract for $SPY 280 and $SPY 300 10/18 expiry?
2019-10-10 23:01:55,apismal,2,Will there be a trade deal I guess we will have to wait and fucking see. But the way I see it any deal small like xi’s cock or large like trumps ego will moon us to Valhalla
2019-10-10 23:01:34,greentea45,2,"that spike was apparently because the talks are going 'better than expected'

> White House Official: Trade Talks Between US And China Are Going Very Well – RTRS 
- ‘Probably Better Than Expected’"
2019-10-10 23:01:30,austinblacknj,5,The fact that i sold my $110 roku call last week for about $110 profit makes me physically fucking ill
2019-10-10 23:01:19,oriolesa,2,Mango speaking any minute now 👀👀👀 🥭🥭🥭🥭🥭
2019-10-10 23:00:47,squeakyllama,3,"""Trade talks between US and China are Going Very Well"" - White House"
2019-10-10 23:00:44,kismethavok,3,"Trade talks going very well, i for one believe this obvious truth."
2019-10-10 23:00:26,jsivanathan,1,Stop hunt
2019-10-10 22:59:47,zobger,6,"Someone needs to hack Mango's twitter and tweet ""Fuck the Chinese government""."
2019-10-10 22:59:15,RealisticHumanBot,5,futures just tried to moon
2019-10-10 22:58:40,,4,how many people are actually betting that TrAdE DeAl HaPpEnInG ThIs TiMe Is DiFfErEnT
2019-10-10 22:58:19,zipster8,7,Remember last night when bears were feasting on bull blood only to wake up and see it was a mirage?  Pepperidge Farm remembers.
2019-10-10 22:57:31,,1,"Dear friends, did i fuck up buying   200 BBBY 12p. 11/15?"
2019-10-10 22:57:11,BezosBenzos,3,damn that green was short lived
2019-10-10 22:56:42,Flyers179,2,"In case there was any doubt.

https://twitter.com/edwardlawrence/status/1182428655227719681?s=21


I just confirmed that trade talks with the Chinese will continue tomorrow. #China #Trade"
2019-10-10 22:55:09,hellobrodudewhatdod,2,"LOL someone told me to keep holding my puts but the stock mooned AH. I only daytrade these days mainly to ride the trend. This could easily prove to fail as well over time, but im done with the stress of not knowing and more satisfied with if anything hopefully cumulative low profit and closing the position out so I can not get distracted or anxious at work"
2019-10-10 22:55:07,WallStreetBitch,13,"Monday: $294.5, hopeful of a full deal. 

Today: $294.5, knowing a full deal won’t happen, but maybe a small deal. 

Both calls and puts holder from Monday getting fucked by theta."
2019-10-10 22:54:33,vmar27,1,Is it safe for weed calls yet?
2019-10-10 22:52:54,ApartheidClyde,8,**just confirmed that trade talks with the Chinese will continue tomorrow. #China #Trade**
2019-10-10 22:51:35,Mr_Find_Value,6,Can I get an F for all the put cucks? F
2019-10-10 22:51:33,hasbroslasher,3,"Think this ""trade deal"" we're getting tomorrow will be sold when the news breaks. Trump isn't going to cancel all the tariffs, we're not going to get anything more than promises to buy soybeans and some pump tweets. And my own personal theory is that China has been waiting all week to fuck us with news tonight so they can twist the knife after this week of drama between our countries. With sentiment so anti-China lately it's going to be even hard for Trump to find a way out of this without looking like a soyboy"
2019-10-10 22:50:45,kismethavok,1,"Tonight on chopper-talk: Turkey, gobble gobble"
2019-10-10 22:48:56,StopDoxxingMePls,7,I might be down 60% but at least my car hit [69420 ](https://i.imgur.com/LqGdTwG.jpg) today.
2019-10-10 22:48:40,noyoucant2genders,2,What’s Trump going to announce at the rally tonight?
2019-10-10 22:48:24,knotswag,8,I will continue to hate Edward Lawrence for posting that bullshit news about the delegation leaving. And he had the gall to do it AH when none of it mattered. I despise him and I hope his portfolio winds up being as bloodied as mine.
2019-10-10 22:46:44,Scottyzredhead,5,"Most think there will not be a trade deal. Some think that there are too many people thinking there wont be a trade deal, so there might end up being one.

I'm thinking - delay?"
2019-10-10 22:45:09,digitalradiohead,1,LOL Cramer pumped BBBY.  Thank you sir.
2019-10-10 22:45:09,All_The_Numbers,3,Why are we up so much?
2019-10-10 22:44:37,barelyreadsenglish,2,Did anyone explain wtf is the currency pact or was it more trade talks going well shit?
2019-10-10 22:44:14,Mookypooks,7,"ooof, down $7k today on puts and weedstock warrants"
2019-10-10 22:42:34,Mattreddit760,5,What happened to the bears ? Thought we were drilling today. What happened ?😂
2019-10-10 22:42:25,rikki-tikki-deadly,6,"I feel like a actual trade deal with China, even if it's a shitty and/or mini one, is the last market pumping arrow that Mango has in his quiver. Part of me thinks he'll try to save it for when he needs it even more than he does now, but the other part of me thinks that he doesn't have the patience to wait any longer."
2019-10-10 22:40:45,oriolesa,2,"https://www.youtube.com/watch?v=JYKhO2N1nCo

Mango 🥭 rally, might drop some trade deal info"
2019-10-10 22:40:41,Volte,4,The deal could be an OTPHJ and market will probably still moon
2019-10-10 22:39:18,your_mom_loves_me69,2,"Gonna try and scalp some roku calls tomorrow and probably wipe myself



Edit: Nvm just realized it's up almost 5% AH



Edit 2: Will probably still try, will probably wipe my account"
2019-10-10 22:39:15,chandler2020,1,Kinda weird its so quiet after today. Feel like we were getting more from the prelim talks earlier this week
2019-10-10 22:38:49,humm1010,3,If no deal the fed will catch us and cradle us and we moon again
2019-10-10 22:37:57,southtampatrader,2,If there is a DEAL - do you think we will hit 300? Under 300 or over 300?
2019-10-10 22:36:42,griswalt7,3,"Finally someone on Mango Man's team fixed TradeDealGoingWell.exe. That bug did a number on me. If that script manages to launch BestTradeDeal.exe and Xi Pooh can't launch RugPull.exe then we're good to go until the next tweet storm.

Though, if the other script launches, my $BBBY put FDs will print like crazy."
2019-10-10 22:36:36,SummerSnow8,1,can't just ROKU save some green's for tomorrow?
2019-10-10 22:36:20,Mroder1,2,Uber’s rating gets upgraded so naturally it’s stock goes down. People protest activision so naturally it’s stock goes up. I don’t understand stocks at all...
2019-10-10 22:36:20,knotswag,7,"If the agreement is more soy/currency pact for no increased tariffs, which seems the likely outcome for the mini-deal, I have no idea why the market will moon. And every part of me knows that it will moon regardless."
2019-10-10 22:35:54,VacationLover1,23,Here is why the ‘trade deal is going well’ from Trump is bs. Trump isn’t in the meeting and it’s like being at work. If something is going wrong you don’t tell your boss it’s bad you say things are going great. Then on Friday at 4pm right when you’re both walking out the door you say yea about that.. it didn’t go so well. See ya Monday
2019-10-10 22:35:50,johnthelizard,1,what's a guy gotta do for a lizard/dragon emoji flair around here
2019-10-10 22:35:08,winkerpack,18,"China is 🅿️🅾️🅾️🅿️🆗️ 

Xi has little 🅿️🅿️

If I dont comment for the next hour, I have been compromised 🔒🚨"
2019-10-10 22:34:51,Shmokesshweed,3,u/42reasonswhy congrats on the new flair bro 😉
2019-10-10 22:34:26,njeezyatx,2,Congrats to whoever bought my $120 Roku call today. Fucking a
2019-10-10 22:33:41,virtualmusicarts,1,"I have both put spreads and call spreads on SPX expiring tomorrow. In a perfect world, overreactions in each direction will fill my closing orders. In this timeline , SPX will be flat."
2019-10-10 22:33:18,,2,Biggest fear for tomorrow is a fat fucking sideways. And bees
2019-10-10 22:32:38,benjohnson1988,47,"Bears are right: there won’t be an actual deal.
Bears will lose money because mango will simply claim he made the greatest deal by presenting the status quo as his brand new achievement."
2019-10-10 22:31:23,kismethavok,4,Jormungandr shall consume this bull-market and bears shall live in eternal glory in the halls of Valhalla.
2019-10-10 22:30:07,love2fukmarriedwoman,5,"“TRADE TALKS GOING VERY WELL” 

Why thank  u mango 🥭"
2019-10-10 22:30:00,victorinox109,3,"Im looking to invest in US company shares from abroad.. (India).. 

Is BRK B a good buy? What other shares should I look at?

Thanks"
2019-10-10 22:28:54,Southstar411,2,You autists think we’re not getting deal. Ez inverse legal tendies
2019-10-10 22:28:39,Jarreddit15,1,"BBBY mooning AH, not even mad lol. It’s amazing actually"
2019-10-10 22:27:33,Blackhawk149,20,We bears have to hold the line. Friday will be our last stand let’s go 🐻🐻🐻🐻 army Valhalla awaits us.
2019-10-10 22:27:18,Cnastydawg,6,Everyone saying no deal has me feeling good about my calls
2019-10-10 22:26:47,BelgianBillie,6,If there was a deal I feel Trump would have said so already
2019-10-10 22:26:41,gatoken1,6,"It’s like everyone forgot that we still have tariffs incoming in December 

❓❓❓"
2019-10-10 22:25:33,BUKAKKE_TALENT_SCOUT,5,Every autist and their mother is saying no deal tomorrow. You know what to do bois....
2019-10-10 22:24:11,Shmokesshweed,1,"PP survey

https://www.reddit.com/r/AskReddit/comments/dg5l84/guys_of_reddit_who_have_measured_your_penis_size"
2019-10-10 22:23:24,InSearchofOMG,3,Imagine believing we're getting a trade deal
2019-10-10 22:23:21,satireplusplus,7,I think it'll be a great recession
2019-10-10 22:22:51,Blackhawk149,10,🐻🐻🐻🐻 army assemble
2019-10-10 22:22:37,Jatobi1993,1,"I’m gonna watch for the final deal or no deal.

Personally I think we won’t get a deal, cause trump and his goons are looking at other escalators to hurt China. China has no reason to make a deal, especially with how it acts with unfairly disadvantage by us companies as trump wants them to stop doing but China said they won’t negotiate on that.

Trumps got the Kurd and Turkey fall out. The impeachment fallout. The weakening economy.

China frankly could see roughing it a bit more on the trade war and wait till the orange in chief is impeached, resigns or something else, then get back to the table with someone they can stand and who doesn’t froth at the mouth when his name isn’t spoken every five seconds."
2019-10-10 22:22:36,knotswag,1,"So watching mistress Kayla, she says that Trump is leaving for Louisiana in the afternoon and the meeting will happen sometime midday. That means we may get some news while market is open. That also means it may be time to freak the fuck out."
2019-10-10 22:22:32,Jimtonicc,2,Sleep until 11 am
2019-10-10 22:20:43,,3,"You guys know we add Tariffs on the EU the 18th, right? They already said they were ready for a trade war.

Same fight, different opponent."
2019-10-10 22:19:21,jonnykappahala,8,"If there's a deal, you better fucking believe it'll be in the news *tonight*. If Trump bended the knee to China for market gains, he ain't letting that shit stew over a holiday weekend."
2019-10-10 22:18:26,ILikegardening4000,1,Sometimes i think green is Gods favorite color cause it’s everywhere... also this market likes it too
2019-10-10 22:17:50,snoooooooooo,5,Be glad I didn’t buy ROKU puts
2019-10-10 22:16:05,ElPolloRegio13,2,Buy a sausage biscuit after HEXO drops another 20% and then go swim with some dolphines afterwards
2019-10-10 22:15:51,Cnastydawg,1,[https://www.youtube.com/watch?v=JYKhO2N1nCo](https://www.youtube.com/watch?v=JYKhO2N1nCo) bro tell me this isn't the Lee harvey oswald shot
2019-10-10 22:15:27,Joesmithers,6,Opening a futures account has (not) changed my life!!!
2019-10-10 22:14:55,StopDoxxingMePls,4,Does Congress have any say in the finalized trade deal?
2019-10-10 22:14:26,ktred1996,2,Uvxy calls anyone?
2019-10-10 22:14:20,apismal,9,"I really hate the futures just a bunch of 🌈 seem to like to mention it on this sub every 3 seconds. Ok I get it, it’s a bloody 0.0000006 red. And no your puts won’t make you any money cus you bought 234 puts expiring tomorrow. But they were only a penny right? Lmao. Can’t go much lower than a penni amirite?!"
2019-10-10 22:13:54,VacationLover1,1,"I grabbed a few FAST puts for tomorrow.. those 🦴ers better miss earnings .. besides that a single SPY put ($288p 10/18) and all cash. 

I don’t trust this fuckery to light my money on fire so I’m Waiting to see what cums from the trade talk.. then ride the direction of the splatter. I still think downies are the way to go for end of next week"
2019-10-10 22:13:16,IHeartPussyGunsMoney,20,"Feel half this sub is going to emerge from this week with some form of PTSD, regardless of how much money is made."
2019-10-10 22:12:15,brannock_,3,Do we have any idea of when we'll find out tomorrow if there's a deal or not? I thought it'd be earlier in the day but the Chinese are operating on local time judging from today's lunch thing.
2019-10-10 22:11:09,jigglyjohnson13,8,Cramer just said that kids mom helps him feel good lol
2019-10-10 22:10:39,Sinadins,12,"Next time my parents ask how college is going I can just say ""College is going very well, beautiful relationships with my professors, hope to complete Cum Laude very soon."""
2019-10-10 22:09:34,rustyryan27,7,Boy these last two days have really done a number on everyone. We’ve all gone mad.
2019-10-10 22:09:31,deposit_reg,4,"Live feed of Trump's rally in MN. Might spill the beans on the China trade talks. 

https://www.youtube.com/watch?v=JYKhO2N1nCo"
2019-10-10 22:09:24,Shmokesshweed,13,"I don't believe the Gynese are hurting enough and I think Donnie is, politics aside as much as possible, a complete fucking tool, so there will be no deal. That's why I bought puts.

Hope you have calls."
2019-10-10 22:09:06,KevinMKZ,7,"I dare one of you to call into Cramer and be like

""BOOYAH JIM, what do you think of my weekly FD's"""
2019-10-10 22:08:43,Cnastydawg,5,Now I have to watch this damn trump rally to figure out if we are getting a deal
2019-10-10 22:08:01,rockthepa,6,Trump is a habitual liar. I still believe in bear gang
2019-10-10 22:06:57,dragonf1r3,1,"I hope Roku dies tomorrow morning because holy fuck this AH bs. I don't have puts, but it spiked almost immediately after the market closed."
2019-10-10 22:06:12,flowkingfresh,1,Futures barely red it don’t mean shit lol
2019-10-10 22:06:06,Lostandlostmore,6,Lol right after I bought more puts and averaged down on existing positions. 😂😂 Celery for dinner tomorrow. 😂😂
2019-10-10 22:05:20,brannock_,5,"There's going to be a shitty quarter deal and markets will moon up to 305, I just know it. I should've sold at 2 pm after that drop."
2019-10-10 22:04:56,,3,"First sign of break even, roll my puts forward another month"
2019-10-10 22:04:24,humm1010,6,It’s ok bears just calculate the amount you lost divide by 1k a month by daddy Yang. Mine is 2 years no biggie.
2019-10-10 22:03:40,Cnastydawg,4,# CYCLES EXIST PEOPLE WE AREN’T GREEN FOREVER
2019-10-10 22:03:32,IHeartPussyGunsMoney,1,"Yay more info on not-QE

https://www.zerohedge.com/markets/goldman-expects-qe4-start-bang-fed-will-buy-60bn-monthly-4-months"
2019-10-10 22:03:03,flowkingfresh,1,I wonder what hawk Navarro saying in trumps ear
2019-10-10 22:02:58,,1,"Inspiration for bears

https://youtu.be/A89WVKTjLwM"
2019-10-10 22:02:37,Cnastydawg,-7,I’d rather take an L on all of my options than watch the economy crash tbh
2019-10-10 22:02:36,lunatic_optiontrader,8,If I hear the sentence “trade talks are going well” again I’m gonna go insane
2019-10-10 22:02:19,HourPackage,3,Wait yesterday cramer was a big bear and today he is saying buy buy buy?
2019-10-10 22:02:08,3fishinatree,3,"[bulls, pray for futures tonight ](https://m.youtube.com/watch?v=CGJoxqJOstA)"
2019-10-10 22:02:00,khanx290,2,"What happened just now, why futures came down"
2019-10-10 22:01:20,gatoken1,2,Futures blood red 💉
2019-10-10 22:01:06,chandler2020,5,LOL and futures open red
2019-10-10 22:00:29,socialist_baby,3,Futures RED
2019-10-10 22:00:19,Yo__Highness,3,"My puts ended Shopify’s downtrend 

The retard is strong with this one"
2019-10-10 21:59:33,ItsJambalieya,15,WOOO cant wait for delay on tariffs and some shitty agriculture deal
2019-10-10 21:59:25,gatoken1,6,Imagine thinking Donnie would ttgw.exe
2019-10-10 21:59:24,HourPackage,2,what if mnuchin and the USTR are just trading with a chinese algo and nobody knows?
2019-10-10 21:58:30,UsuallylurknotToday,6,Going (.)(.) \^ most likely.
2019-10-10 21:58:14,hamsupjai,3,"the boy who cried wolf


Trump has said tradetalksgoingwell for honestly? the 70th time?


yet nut sacks with too much money believe him every time. IF talks go south, i hope these moneybags finally wise up"
2019-10-10 21:57:58,Volte,2,Long weekend ahead. Get your EOD puts ready
2019-10-10 21:56:44,,3,Any bear cut their losses today?
2019-10-10 21:56:24,ProOrlando,3,"Trumps words wearing thin now days...if he said that 10 months ago we rip $3...now days, we hardly move."
2019-10-10 21:56:01,love2fukmarriedwoman,0,Robin Hood MasterCard unlimited 2.5% cash back??
2019-10-10 21:55:59,davide3991,3,RIP BBBY put holders
2019-10-10 21:55:32,humm1010,3,Inverse the bears go calls
2019-10-10 21:55:11,freehouse_throwaway,2,We need a wellness check squad with the amount of ROPE that's probably being bought up by the end of this week.
2019-10-10 21:55:09,yachtsandthots,16,"I'm from the future. 

There won't be a trade deal.

Trump is reelected after winning a close race against Warren. 

Patriots win Super Bowl LIV against the 49ers after coming back from a 0-49 halftime deficit. 

Encouraged by the newfound support after a copyright infringement by Trump, Nickelback makes an incredible comeback with their new album debuting at number 1 in the charts."
2019-10-10 21:54:22,heavenlyblues,11,You gotta be fuckin kidding me... “trade talks going well” hahaha
2019-10-10 21:54:21,akhtarst,1,Put holders will be printing $ end of day friday so nobody sell at open regardless of the outcome
2019-10-10 21:54:19,NoftScarlet,3,"Remember what happened only a day after the trade war truce last year?

🐻🌍"
2019-10-10 21:54:12,snoooooooooo,3,Hope BBBY tanks
2019-10-10 21:53:54,gay_ghoti_yo,1,Gold fucking do something
2019-10-10 21:53:37,griswalt7,5,35+% gain today on my calls. I ain't selling. I'm not fucking selling!
2019-10-10 21:52:35,,3,I know futures don't mean shit but I'm so excited to watch futures tonight
2019-10-10 21:52:08,Debeast44,2,The dream for my dead puts trade talks fall through and Trump post a Winnie the Pooh-Xi meme to Twitter. Not gonna happen but a man can dream.
2019-10-10 21:51:54,greentea45,3,"Hm. AH is fading hard. QQQ -0.20% already from when futures closed. SPY -0.10%.
It'll be an interesting futures open and Asia open for sure. Wonder if asia will dump from where they open, sending US
futures red.

Remember, it is Friday there, and Asia futures have been pushed up quite a bit by us markets today."
2019-10-10 21:51:21,flowkingfresh,4,"I was listening to a podcast couple months ago and Barbara Cochrane the lady from shark tank was talking about her experience with trump and how he was gonna do a deal with her and talked her up the whole time for months then he invited her over to a dinner at Maralago and infront of everyone lot of top business people threw her under the bus and cancelled the deal with no emotion.


I can see that happening tomorrow. Power move."
2019-10-10 21:50:53,knotswag,9,BEAR GENERAL WHERE ARE YOU WE NEED A RALLYING SPEECH
2019-10-10 21:50:27,EEBucks,12,"If you switched your puts to calls you’re about to get double cucked when the market sells the news. Y’all are acting like we’re about to get some full deal, it’ll be a BS “skinny” deal that the market won’t like after being drug through shit for 18 months. The business cycle tipping into a recession is way bigger news than a hyped up agriculture purchase, and you bet that’ll be in the spotlight once this “skinny” deal hype is through."
2019-10-10 21:48:43,Cnastydawg,2,Okay maybe that stupid 300 spy call wasn’t that stupid anymore
