date,author,score,body
2019-10-11 03:18:26,eyuuuuu,1,"Hey guys I got a video of whats going to happen tomorrow so if you want some full proof DD, just whacked to it in the gym bathroom while I had a sick chest pump. 

 [https://www.youtube.com/watch?v=5pkWnqtk7hs](https://www.youtube.com/watch?v=5pkWnqtk7hs)"
2019-10-11 03:15:00,Xinlitik,17,Everyone is so confident in calls for tomorrow. Maybe my puts have hope
2019-10-11 03:14:53,IS_JOKE_COMRADE,8,Anyone who watched his rally and the way he spoke on China should seriously doubt whether he lacks steel balls going into tomorrow.
2019-10-11 03:13:26,ciderdonutsandcoffee,13,"Trade talks will fall apart conveniently at 4 pm, so calls at open, sell at 3 pm, buy puts for the weekend.  Get this  🍞!"
2019-10-11 03:10:52,squeakyllama,5,"Who knows, maybe at China close they drop a bomb? Wishful thinking 😢"
2019-10-11 03:06:18,UsuallylurknotToday,6,Timeline Check: Trump is comparing his language to Jay-Z and flirting with strangers on stage.
2019-10-11 03:06:14,market_gaper,5,China will be forced to export millions of asian qt gfs directly to the US as part of the trade deal.
2019-10-11 03:05:41,TequilaTrader,12,Glad it’s Friday tomorrow.  Waking up at 5am to prep for gambling is hard work.  I need a weekend
2019-10-11 03:03:42,captnstabbing,6,Dudes what in Gods names up with Roku?
2019-10-11 03:03:19,Shmokesshweed,1,Wait is Donnie just naming every host on Faux News now? Lol
2019-10-11 03:01:51,ballsvanhouten,1,"https://www.youtube.com/watch?v=JYKhO2N1nCo

protests after that trump rally this may get wild who knows"
2019-10-11 03:01:34,,5,"What are we drinking tonight boys? AirBNB host gave me free pass to the liquor cabinet.  Nobody is perfect, we all make mistakes."
2019-10-11 03:00:23,HowLongCanIMakeAName,4,Is there anyone here who actually only browses and never comments? Pls comment I want to be your first 🤗🤗🤗
2019-10-11 03:00:15,APHAbaghodler,8,Anyone watch the reports from the CME pits and get saddened by how you could shoot a cannon in that place nowadays and 10 years ago you couldn't even do a news report from the pits because of how loud it would be??
2019-10-11 02:59:55,apismal,5,Fuckkk yes eu tarrif on China is goood. More pressure on China. Means more likely for them to cave to our demands meaning we should actually win this trade war
2019-10-11 02:59:15,MrBleepBleep,1,"[Blabbermouth Lindsey Graham spills fucking everything in this phonecall (half way through the page)](https://www.politico.com/news/2019/10/10/lindsey-graham-trump-hoax-call-043991)

tl;dl Tman is desperate for a FREE TRADE AGREEMENT deal with TURKEY aka NO DEAL WITH CHINA BUY PUTS

Edit: this call is *unreal* - I can't believe I slept on this

Fuck you 🐂 listen to this shit and then tell me we're getting a deal with the chinese"
2019-10-11 02:59:12,steelandwine,5,So should I buy spy 300 calls at open or what?
2019-10-11 02:57:21,______Last_Christmas,4,"Shanghai opened +1%, now in the red. Bears got the scent. 🐻"
2019-10-11 02:54:07,MaverickMcfly,6,"We're going to rally purely on hype for what comes at 2:45 tomorrow and If they announce a tiny deal spy will very likely jump to the 300-301 range. 
I've got some calls open now and I'm probably just going to take profit tommorow and not open anything else until trump fucks shiit up again or a sign that he is actually going to play nice in the long run with president 11"
2019-10-11 02:53:44,gda19,8,I don’t feel so good about these puts
2019-10-11 02:53:15,clarence_worley90,8," [https://www.bloomberg.com/news/articles/2019-10-10/china-hit-by-european-union-tariffs-on-steel-road-wheels](https://www.bloomberg.com/news/articles/2019-10-10/china-hit-by-european-union-tariffs-on-steel-road-wheels) 

LMAO tariff-mania is SPREADING. China gona fucking dieeeee 🔥🔥🔥🔥🔪🔪🔪🔪🔪🦀🦀🦀"
2019-10-11 02:49:22,,9,2:45 PM meeting so fuck your 10/11 options. It’s a theta day
2019-10-11 02:49:05,slinkymello,21,"I fuckin love this sub. Like, when people talk shit and say, “it ain’t like in my day when people gave their positions and provided solid evidence,” I say to myself, “you know, I always know what’s going on when I visit wsb, and maybe I have to actually think a little bit, but that shit is invaluable.” We’re all autistic idiots posting the most random shit ever and it looks like chaos, but it’s a beautiful thing, because every possible overreaction is documented here clear as day on a second by second basis."
2019-10-11 02:48:54,ballsvanhouten,3,anyone seein this protest shit?
2019-10-11 02:48:26,snoooooooooo,5,Anyone else notice they don’t double stuf Oreos the way they used to
2019-10-11 02:47:27,rustyryan27,-2,"Mods, lemme get that sticky Gypsie General flair."
2019-10-11 02:47:13,ethbux1,7,"Any natural remedies to brain hemhrogging after watching Trump rally? Already drunk, have some weed"
2019-10-11 02:45:25,Not-The-Government-,9,"A quick reminder to bulls to sell within first 5 mins if a deal is announced, its pretty likely its gonna not be as great as he wants"
2019-10-11 02:44:39,gatoken1,5,"You retards

Donnie still has tariffs lined up for December 

He can just partial trade deal this shit 🤦‍♂️"
2019-10-11 02:44:31,HowLongCanIMakeAName,5,All I’m saying is don’t knock a pump ✊🍆 and dump💩 if you haven’t tried it
2019-10-11 02:44:15,visionarymind,8,"I get attaccd for asking about the 🅱️eautiful 🎖🐻🎖

You hate to see it. Sad. 😿

I only ask because I am concerned. 

Memes almost as good as 🎖🐃🎖

True talent

Wood be a shame and collective loss for WSB if he went tits ☝️

Everyone assumes I just wanna poke fun

💗MARIANNE💗 showed me the truth, all LOVE🥰 on this side fam"
2019-10-11 02:43:57,rustyryan27,3,WSB is getting a new platoon of bears tomorrow I guess... bye gay boys
2019-10-11 02:43:23,knotswag,5,"Trump has another rally tomorrow at 8 PM EST at Lake Charles, LA. Will be interesting to watch depending on the outcome of the trade deal."
2019-10-11 02:42:02,GamecockMaster21,3,Thinking I’m gonna but some 300 FDs for next week cause why the fuck not ammirite?
2019-10-11 02:39:29,love2fukmarriedwoman,10,"If we finish green tomorrow 

I’m doing coke and listening to this 100 times over 

https://youtu.be/9Gc4QTqslN4"
2019-10-11 02:38:12,HowLongCanIMakeAName,5,Shit dude all I know is my gut says maybe
2019-10-11 02:38:10,br0botic,12,"Trump meeting Liu He at 2:45 pm ET. 

Watch us trade flat all day zzzzz"
2019-10-11 02:37:59,BatOuttaHell1,6,"fuck me, talking about china right now and it's not positive"
2019-10-11 02:34:29,Jim1049578,5,"The balance sheet rose by 17bil this last week, another 4billion we will b back over 4trillion. That’ll b a massive headline, long slv gld"
2019-10-11 02:33:18,jaspar1,-2,"LMAO of course they gonna play some fucking country at the end of the rally  


""YOU CANT ALWAYS GET WHAT YOU WANT""  


yea the fucking trade deal bitches the music is foreshadowing something

Edit: ahahah so many triggered boomers"
2019-10-11 02:32:13,Submittomemeow,-7,"Okay serious question: If I buy SPY Calls $301 11/1 and stocks go upsies to $302 ITM then goes downsies, what happens if I want to sell High but no one wants to buy it that high? Do I lose money as it goes back downsies?"
2019-10-11 02:32:03,JerJoBanJo,5,Lmao at that fucking exit chorus. A sign of the trade deal?! Lol
2019-10-11 02:31:35,visionarymind,5,"#MAGA ✊

#MAWA ✊

#MASA ✊

#🇺🇸🗽🦅🇺🇸"
2019-10-11 02:31:34,stockman4life,6,Markets moon because the great Hitler errm I mean Trump has a rally speech. I bet the Hitler rally speeches brought the market up much more. Proving Trump is NOT Hitler.
2019-10-11 02:31:10,PinnySkeenus,6,How many addys you think he popped before this? O/U 3.5
2019-10-11 02:31:06,austinblacknj,3,Wtf even happened to SDC
2019-10-11 02:29:45,snoooooooooo,4,We get it trump ur Christian
2019-10-11 02:29:10,BatOuttaHell1,6,"Guys, you see in Trump what's inside you. If you're a bull you'll think he was positive about China the whole rally."
2019-10-11 02:28:42,kismethavok,2,Great American *Flag*
2019-10-11 02:28:07,snoooooooooo,0,"Who fucking cares it’s a flag 

(No nation is the greatest all have unique positives and negatives) 

(Moon thing was a long time ago)"
2019-10-11 02:27:44,visionarymind,9,Bear arms 💪🐻🐼💪
2019-10-11 02:27:21,snoooooooooo,5,Only thing of agreed with all night lemme keep my guns smh long AOBC
2019-10-11 02:27:12,BrokeDayTrader,5,I wonder if they’ll announce if they made a deal or not before market closes tomorrow.
2019-10-11 02:26:49,excadedecadedecada,7,"While I have no reason to doubt the pump, the extreme bullishness has me concerned"
2019-10-11 02:26:42,printingious,6,"Trump not meeting with Liu He until 2:45PM, Friday puts confirmed dead may they rest in peace"
2019-10-11 02:26:10,ballsvanhouten,3,Who rocks more than..(checks back of guitar) SPRINGFIELD!
2019-10-11 02:25:50,kismethavok,2,The breast agenda
2019-10-11 02:25:12,snoooooooooo,3,MINNESOTA HOLY SHIT
2019-10-11 02:24:38,DonBonleone,2,Anyone placing calls on Roku with this new investor news?
2019-10-11 02:23:27,jaspar1,2,He talkin bout Obama but what Obama last name
2019-10-11 02:23:23,small_root,3, We'll end 294 tomorrow and on Monday we'll moon or drill.
2019-10-11 02:23:18,PinnySkeenus,4,Futures no likey
2019-10-11 02:23:15,snoooooooooo,3,"Love him or hate him, he be spittin straight facts /s"
2019-10-11 02:22:55,LehmanParty,2,"He's starting to talk about China
EDIT Damn false alarm, just said the word"
2019-10-11 02:22:46,love2fukmarriedwoman,2,"Blood green 

Thank you uncle mango"
2019-10-11 02:22:28,oriolesa,3,"Trumy shitting on Gyna AGAIN, smh"
2019-10-11 02:21:40,vocoderasmr,3,I’m not sure what happened today but I bought Hexo calls at like -22%
2019-10-11 02:21:33,visionarymind,4,MOAR 🚁🚀🛩🚧🛸🛰🔪🔫💣🧨
2019-10-11 02:21:16,snoooooooooo,9,TARIFF MAN
2019-10-11 02:20:53,meow1616,8,WSB bullish af for tomorrow. We finally all gonna make tendies together 💕
2019-10-11 02:20:35,uninfinity,1,LMT calls
2019-10-11 02:19:49,nygennygen,2,What’s the TLDR?
2019-10-11 02:18:24,ballsvanhouten,3,PRESIDENT SNOWBALL WAS THE ONE! HE TOOK THE CHICKEN'S EGGS! HE SOLD BOXER TO THE KNACKERS!
2019-10-11 02:18:04,visionarymind,0,Where is the 🅱️eautiful 🎖🐻🎖❓
2019-10-11 02:17:55,surfinbird,1,[It’s beautiful](https://youtu.be/XH1hrfD-bUo)
2019-10-11 02:17:22,freemarketguy,1,Everything is priced in
2019-10-11 02:16:08,dodoei,2,2950 0day calls the most beautiful free money I’ve ever seen
2019-10-11 02:15:28,DusterBinge2029,10,"Going to close my downies tomorrow morning ""we've got a beautiful deal folks. Believe me, it's beautiful."""
2019-10-11 02:15:15,austinblacknj,2,Would you bother buying less then 100 shares of anything?
2019-10-11 02:14:46,snoooooooooo,0,What is the relevance of this story?
2019-10-11 02:14:03,ballsvanhouten,3,damn bitch in the top right looks like a wooden indian
2019-10-11 02:13:36,Sword_of_Caliban,3,"Well, my YOLO call position in $PCG didn't work out with it dropping 29% yesterday. I already put all my assets into it, so now I'm transferring my 401k from my company to E-trade so I can buy the dip. 
Wish me luck."
2019-10-11 02:12:55,MeowMixMongul,8,Mango is gay confirmed. Called a soldier beautiful. Buy puts tomorrow.
2019-10-11 02:12:35,Desertbears,1,"Can stocks finish flat tomorrow, that would be great."
2019-10-11 02:12:00,snoooooooooo,-2,Everyone behind trump trying to look sad for the camera like 😩
2019-10-11 02:11:30,,4,"My name is John Titor, time traveller .I am from tomorrow posting today.Already asleep today. 

AMA

FAQ:Its a red day🐻🍆💦💦💦💦"
2019-10-11 02:11:18,printingious,5,is it a thing for Trump rally-goers to have ridiculous orange spray tans?
2019-10-11 02:09:19,kismethavok,3,100% someone had to STRESS to Mango that he had to write each letter and that is the excuse they gave him at the time.
2019-10-11 02:09:13,clarence_worley90,8,lol I cant believe all these people show up just to watch mango vent about how he's right about everything
2019-10-11 02:09:10,visionarymind,4,Writing is the hardest thing his smol hands have to do 👐✒️
2019-10-11 02:08:36,thecashcow-,10,"We're going to hit them from the front, we're going to hit them from the back..

&#x200B;

Why mango narrating an orgy??"
2019-10-11 02:07:37,ballsvanhouten,6,what. jesus he's totally fucked the kurds
2019-10-11 02:06:53,Short-SPX,7,I'm deep in calls
2019-10-11 02:06:47,1sildurr,15,"I've seen enough. Summary as follows:

LONG: USA, Republicans, inbreeding, the state of Maine, police officers, dementia medication producers, Mexico, pillows, Fox News, and children. 

SHORT: Hilary, Hunter, China, democrats, the popular vote, sanity, and tegridy."
2019-10-11 02:06:43,Izalith66,12,"I'm all in on puts.

But I don't care what happens tomorrow, as long as it's exciting!

300 or 280! Let's GO somewhere!"
2019-10-11 02:05:53,snoooooooooo,5,"I highly doubt any general said they want to fight against ISIS willingly

Edit: stop protesting I’m tryna hear 🥭"
2019-10-11 02:05:51,uninfinity,3,"""We have great war fighters"""
2019-10-11 02:05:19,oriolesa,3,"If we open green I'm selling my calls.

Live to trade another day even though I will still be down bigly 🙏🙏🙏"
2019-10-11 02:04:54,_funkymonkey,3,"picking out the parts for my new gaming pc since i'm closing my roku calls tomorrow.

i think i'll go with a 2080ti :)"
2019-10-11 02:04:31,snoooooooooo,2,"Rolls Royce’s r made in England, he couldn’t have said caddy or something lmao"
2019-10-11 02:03:42,yeamannn,4,BUY ROLES ROYCE HOLDINGS
2019-10-11 02:03:42,visionarymind,3,Largely 3️⃣0️⃣🦶 T A L L
2019-10-11 02:03:39,uhhhevan,4,Fingers crossed no deal tomorrow so my SPY puts are saved.
2019-10-11 02:02:47,snoooooooooo,4,Y is everyone looking up
2019-10-11 02:02:27,snoooooooooo,2,Wall 😳
2019-10-11 02:02:08,,6,GN auties......cya tommorow in the 🐻 castle
2019-10-11 02:02:05,visionarymind,1,Criminaliens!! 👽
2019-10-11 02:01:58,DUMB087,3,Will my 303 SPY Calls Nov 15 survive?
2019-10-11 02:01:34,yeamannn,4,Trump on twitch omegalul
2019-10-11 02:01:04,kismethavok,8,I don't think that one kid top left has closed his mouth once during this whole rally.
2019-10-11 02:00:15,snoooooooooo,11,"He’s literally saying anyone not from the US is a terrorist and these ppl r agreeing wtf

Edit:travel ban gay"
2019-10-11 01:59:39,oriolesa,2,Wow Trump just praised Mexico. Surprising
2019-10-11 01:58:52,jaspar1,12,why does everyone look like fucking relatives at trump rallies LMAOOOOO
2019-10-11 01:58:04,VacationLover1,1,Am I the only one who bought FAST downies for premarket earnings?
2019-10-11 01:57:52,kismethavok,4,"Futures are fake and gay

Trump rally is insane and entertaining

Choose one to talk about

Edit: would you prefer 'Futures blood red!!!!!!!!!!!' when it's down .0001%?"
2019-10-11 01:57:41,oradell18,1,No more Somalis allowed in MN
2019-10-11 01:57:26,Yo__Highness,1,Shopify puts dead?
2019-10-11 01:56:00,snoooooooooo,3,Y is he stanced like that
2019-10-11 01:55:54,,2,The big guy was half interested in that peck
2019-10-11 01:54:55,Rikiking,5,Do my 10/11 roku 130sees have a chance tomorrow?
2019-10-11 01:53:41,snoooooooooo,2,He’s fucking clowning these protesters lmao
2019-10-11 01:52:42,LehmanParty,1,[He's bringing Judge Judy into this](https://pics.me.me/judges-judily-39096369.png)
2019-10-11 01:51:53,ballsvanhouten,4,why is he talking about fucking fox news
2019-10-11 01:51:16,AquaTeenVaporeon,4,"U guys don't have to liveblog your disgust for the Trump rally in the daily thread, you can talk about something else, like hookers or gay jokes"
2019-10-11 01:51:00,OhhBarnacles,3,I held put
2019-10-11 01:49:22,HowLongCanIMakeAName,12,"So much politics in here rn lol

But remember, talking politics is only ok if you agree with it  😎👍"
2019-10-11 01:49:14,heavenlyblues,7,So a rally is basically just a soap box to rant on like a maniac for a couple hours?
2019-10-11 01:49:13,snoooooooooo,5,That was kinda cringe bro 😳😳😳 that poor dudes wife lmao
2019-10-11 01:48:54,swamprott,9,I feel compelled to stock up on ammo and canned goods when I watch trump speeches. Long duct tape.
2019-10-11 01:48:33,stratomaster82,2,Go Pack!
2019-10-11 01:47:52,jaspar1,11,im not a mango supporter but I gotta give it to him. He knows how to enunciate towards the lowest denominator of people and he's very good at it.
2019-10-11 01:47:40,visionarymind,4,"Just finished muh slave shift 🥵

Someone link me to 🥭"
2019-10-11 01:47:40,SenseiWonton,3,"If Spy could go downsies while SQ could catch a wave to $65 at the same time, that would make me a very happy man."
2019-10-11 01:47:33,1sildurr,5,"I swear to zeno, the first politician with a shred of tegridy will be elected. Granted, they'll never be allowed to run or get air time. But can you imagine?"
2019-10-11 01:46:53,snoooooooooo,11,He’s literally just mocking ppl someone stop him
2019-10-11 01:46:49,stratomaster82,8,These Trump rallies are the cringiest shit I've ever seen
2019-10-11 01:46:25,BrokeDayTrader,5,Trump haters really coming out the woodworks in this discussion thread
2019-10-11 01:46:22,bezmot,2,Buy the dip on pot stocks!  Apha
2019-10-11 01:45:53,,8,his demeanor means my puts are FUCKED
2019-10-11 01:45:17,snoooooooooo,4,He didn’t need Beyoncé 💀😱😱😳
2019-10-11 01:44:28,vtryfergy,1,Looks like impeachment is really going to happen and Giuliani might go to federal PMITA prison.  Short term bearish but long term bullish.
2019-10-11 01:44:17,socialist_baby,1,Y r futures whipsawing
2019-10-11 01:44:00,1sildurr,5,I'll say again: LONG Tegridy Farms. SHORT China.
2019-10-11 01:43:54,jaspar1,6,"oh god Mango is just stroking his cock in this ""speech"" now..."
2019-10-11 01:43:45,snoooooooooo,3,He won Wisconsin holy shit!!! Holy fucking shit!!!!
2019-10-11 01:43:43,small_root,3,Should have bought PCG puts instead. Jesus Christ. These trade talks was fucking nothing.
2019-10-11 01:42:49,ImJuicedBro,3,Nothing gets these folks riled up like hating on brown people. Unbelievable
2019-10-11 01:42:42,dungbat83,3,Chinese buying gold?
2019-10-11 01:42:09,jonnykappahala,8,"Mr. Trump, 

What you've just said is one of the most insanely idiotic things I have ever heard. At no point in your rambling, incoherent ~~response~~ *hour-long ""speech""* were you even close to anything that could be considered a rational thought. Everyone in this room is now dumber for having listened to it. I award you no points, and may God have mercy on your soul."
2019-10-11 01:42:03,jaspar1,6,"trump: cRoOkEd hIlLARAy  


republicans: WOOOOOOO!!!!!!! YEAAHH!!!!"
2019-10-11 01:41:56,1sildurr,2,Is he whispering?
2019-10-11 01:41:45,dextro83,3,if theres no deal on currency specifically we drill bigly
2019-10-11 01:41:43,snoooooooooo,4,Y is the woman in the back with the hat over her eyes literally oarnge
2019-10-11 01:41:28,TimaaaY142,4,Can someone please update me what’s Uncle Donny pump is saying. My patriots are playing rn
2019-10-11 01:39:45,uninfinity,2,"So Mango did not pump Gyna trade talks/deal so far, only said Gynese negotiators are tough as hell."
2019-10-11 01:39:21,jaspar1,5,all the trump supporters behind trump look inbred tf
2019-10-11 01:38:49,rustyryan27,2,"SEAL. THE. DEAL

SEAL. THE. DEAL

SEAL. THE. DEAL"
2019-10-11 01:38:38,snoooooooooo,4,I hate trump so much (I’m not even liberal)
2019-10-11 01:37:36,gatoken1,10,"🐻 want no deal because of gyna's egregious violation of human rights and IP theft

🐃 want a deal because tariffs are terrible for our soyboy farmers and economy

can 🐃 and 🐻  just agree that they want the other side to eat shit so they can make a quick buck and not pretend like one side has the morale high ground?

virtue signaling mofos  🤔 

^(also im gay)  🌈"
2019-10-11 01:37:18,chessiechoice,5,[maybe ](https://imgur.com/gallery/zoRk5th)
2019-10-11 01:36:22,BennyFlocka,5,"Do I cash in on these Tim Apple calls tomorrow or let them ride through the weekend..

I think I’m cashing out, who knows what will happen AH tomorrow"
2019-10-11 01:35:15,webulltrade,1,My plan was to buy puts when SPY hit 295 but it did that during after hours. Now it's either buy puts when SPY is around 299-300 or calls if it drops to around 291. Will do scalps in between those prices.
2019-10-11 01:34:32,Beyond_Duality,4,"Remember, these sheep are the future of this country......

I give us a good 10 years max before we go in the 🚽🔥"
2019-10-11 01:34:31,oriolesa,0,"Futures mooning

Chinese markets look like they are expecting a deal"
2019-10-11 01:33:48,GoatsAndHoes17,11,"“Talks going well today, and we are talking”. Greatest quote!"
2019-10-11 01:33:09,uninfinity,5,I can't tell if the blonde person in white jacket is a man or woman
2019-10-11 01:32:33,ballsvanhouten,4,jesus fucking christ he's gonna get someone killed what the fuck is this
2019-10-11 01:32:16,oriolesa,8,"Lmao Trump says ""I'm very angry at you people right now"" and they cheer"
2019-10-11 01:32:00,ImJuicedBro,8,Most trump supporters have no ideology. It’s all about owning the libs. These are the people you see at the rallies
2019-10-11 01:31:33,spanishgalacian,3,So what kind of funeral should we have for the bear gang general? I was thinking Viking style.
2019-10-11 01:31:07,oriolesa,4,"Hang Seng and Chinese H-Shares up bigly, over 1%"
2019-10-11 01:30:15,londonistani,3,FanDuel has Everton -100 against West Ham. Draftkings has them +100 for same game. Holy shit.
2019-10-11 01:29:45,Izalith66,7,"Mango is like Michael Scott when Michael REALLY wants to do something he's not supposed to and just can not possibly stop himself for long.

Mango is going to fuck this up. I'm sure of it. He's bursting at the seams."
2019-10-11 01:29:32,MartinLethalKingJr,2,Hopefully not eating shit on the weedstock calls I bought eod.
2019-10-11 01:29:17,KimBooJoong,3,HSI futures 1.07 percent up gonna open big green soon
2019-10-11 01:29:08,Swissschiess,6,Green futures always mean blood red open. Where the 5pm bulls helicoptering their cocks around at
2019-10-11 01:28:59,excadedecadedecada,1,All right--who's man enough to post their all-time chart?
2019-10-11 01:28:36,Shower_Handel,2,Does anybody else hear some dude in the crowd screaming himself into a stroke?
2019-10-11 01:28:34,WallStreetBitch,2,"Ah yes, I’m sure he’s never talked about not taking a salary before."
2019-10-11 01:28:20,knotswag,3,So what did we learn from this about the trade deal? Basically nothing. Time to go to bed riding on that anxiety train.
2019-10-11 01:27:39,1sildurr,2,"God I want someone to shout out, ''MANGO SAVE OUR TENDIES!''"
2019-10-11 01:27:36,surfinbird,4,That chanting of Donald was kinda spooky 😬
2019-10-11 01:27:28,ballsvanhouten,4,"Are there any queers in the theater tonight?

Get them up against the wall!

There's one in the spotlight, he don't look right to me,

Get him up against the wall!

That one looks Jewish!

And that one's a coon!

Who let all of this riff-raff into the room?

There's one smoking a joint,

And another with spots!

If I had my way,

I'd have all of you shot!"
2019-10-11 01:27:10,Beedubx,3,"lmao, USA not great - Trump"
2019-10-11 01:26:53,1sildurr,4,Imagine JFK pulling this shit.
2019-10-11 01:26:43,gatoken1,2,"ah yes the toughest enemy is yourself 

confucius say"
2019-10-11 01:26:12,JealousEntrepreneur,7,"ah fuck it. Tell me tomorrow how it went, going to watch band in China SP episode instead of this shit."
2019-10-11 01:26:02,LehmanParty,4,This is bizarre. Like out of an alternate reality. I can't look away.
2019-10-11 01:25:47,kismethavok,6,"Donald the Duck

Xi's PP he suck

I don't give a Fuck

I just want a buck

This is bulls right now"
2019-10-11 01:25:31,knotswag,2,"DONALD! DONALD! DONALD!

...save my portfolio."
2019-10-11 01:25:17,uninfinity,2,"LOL, he doesn't know WSB calls him Mango or Cheeto Man"
2019-10-11 01:25:08,gatoken1,2,"ngl even if you hate the mango, he is having too much fun right now 

and we're just sitting here listening and bitching  😜"
2019-10-11 01:24:38,oriolesa,0,Futures doing pretty good
2019-10-11 01:24:33,uninfinity,3,Those retards in the background look  like they are watching a WWE wrestling match LOL
2019-10-11 01:23:54,scroogemcdub,3,"Okay so if the shit pops off tomorrow ima try and ride it up or down whichever way. Only a small percentage of options but I need to recoup. My August to now is hideous and sad. No chasing though, if I get too drunk at 7am and crash then so be it. I slept all through the market today and it was my first good 5+% Green Day in quite some time"
2019-10-11 01:22:14,orrangearrow,6,"If you want an accurate read on China's reaction to Trump ranting like a rabid lunatic, go look at the yuan. It's still strengthening. Those ching-chang pandas are loving this."
2019-10-11 01:21:59,ballsvanhouten,2,"for the fuck jawwed crowd at this thing

https://www.youtube.com/watch?v=5gSW3lec9gU"
2019-10-11 01:21:42,colonel_bob,-4,"[I started trading options 2 weeks ago](https://www.youtube.com/watch?v=8gCjJC_INNE).

I was almost immediately down 48% after my first play because [I was dumb](https://www.youtube.com/embed/KUXb7do9C-w?start=23&end=25) and went pretty hard on a [company and situation of which I had very little understanding](https://www.youtube.com/watch?v=fAKgcgISc8c).

I then brought myself to [plus 5% overall](https://www.youtube.com/embed/S-SqHfckym8?start=35) through SPY day trades and overnight plays.

I'm now liable to be back down 27% if [bull gang has their way tomorrow](https://www.youtube.com/watch?v=WqNMjZpSbnU) (and then 40% if that runs into next week).

I [may not know exactly how this works](https://i.imgur.com/QyuQiPD.jpg) yet but [I'm certainly having fun](https://www.youtube.com/embed/FI1ylg4GKv8?start=84&end=94) and will be back at it next week."
