date,author,score,body
2019-12-23 00:06:51,Scarcedflame,2,What makes spy catch up to spx at a 10x multiple after a dividend??
2019-12-23 00:06:23,DadGoneGamer,46,"Wake up in my DIS resort suite, check futures, fuck my wife, wake the kids up, shower, go eat in the Magic Kingdom, check on my TSLA $405 calls, ride some rides and see some shows, meet some DIS princesses, hit the room again, put the kids to bed, fuck my wife again, sleep."
2019-12-23 00:06:07,HowLongCanIMakeAName,5,Wtf 🅱️eekend thread gone already😡😡😡
2019-12-23 00:06:06,oregon_forever,8,"In the next 2 weeks, analysts will start reducing their expectations bigly so that companies can easily beat them in 2 weeks when earnings season starts."
2019-12-23 00:04:51,Josh439,1,There goes natural gas. Balls deep into UGAZ tomorrow if this drop holds.
2019-12-23 00:03:05,black_and_shredded,7,#BEARSRFUK
2019-12-23 00:01:30,sitis172,2,"I need a Christmas miracle, Disney to $150!"
2019-12-23 00:00:35,LamarHusky,0,"My monies are on market sliding this week. Algos gonna cuck everyone while theyre out doing Christmas shit, year end sell of for taxes. Me thinks"
2019-12-22 23:59:18,,9,"Another day, another ATH."
2019-12-22 23:56:27,brownhairybear,3,"REEEEEEE......

🐃🐃🐃🐃🐃🐃🐃

🍆💦💦💦💦💦💦"
2019-12-22 23:55:39,Smanjin3290,2,Watching my FB Iron Butterfly go up in smoke and I lose everything.
2019-12-22 23:50:27,oregon_forever,5,From 2006 to 2015 Microsoft was considered dead money and it mostly was. It suddenly shot up to the sky in the last few years. There are also stocks that are considered dead money today and will shoot up in the future. Boeing? Amazon? Who knows.
2019-12-22 23:47:49,,2,I’m going long googl. It stayed mostly flat compared to aapl or msft this year
2019-12-22 23:42:47,scroogemcdub,5,"Prolly put another 10k into Antares equaling 35k total. Most likely increase my BMY position and take a few grand position in IBB for 3-5 months. At least to store my available cash until I can have my medical professional buddies review the 3 drugs for 1/2Q 2020 I am speculating will surpass trial 2 significantly resulting in fast track approvals. All small cap novel pharmaceuticals. Under the radar as of now. I have the biochemical processes understood, just some biological factors that could come about using the pathways they focus on. Go eagles. Ya'll bout to lose your pants on Intracellular, I am beyond excited for the thread"
2019-12-22 23:41:16,Anonymous-Green,1,Take a look at DTIL and BYND
2019-12-22 23:36:56,balloonhi4000,-1,$300 of ishares cores calls aye
2019-12-22 23:34:41,codeartha,7,HD calls is some easy money
2019-12-22 23:34:28,Not_reddits,3,So what happens to TSLA tomorrow. Up down or flat. With all these retards saying $420 I think we going down
2019-12-22 23:31:11,arrty,0,sell a lot of OTM puts and calls. then pray
2019-12-22 23:30:01,soccergoon13,1,[Bob Iger is one of my idols. The Boss with Child needs to be framed in my house or office](https://cdn.vox-cdn.com/uploads/chorus_asset/file/19547614/ELgp689WkAUE3f_.jpg)
2019-12-22 23:29:54,oregon_forever,3,There has never been a time in history where buying the dip didn't work out in the long term.
2019-12-22 23:29:01,oregon_forever,1,"If the market closed for the whole week for some reason, it would make theta gang happy."
2019-12-22 23:28:39,,10,"Gonna be a gleaming green Monday boys.
SPY 323.50 by market close on Christmas Eve."
2019-12-22 23:28:32,Th3_Capitalist,3,Probably pick up some late Jan $BA 340c
2019-12-22 23:28:00,Scarcedflame,0,So is it the 0.11% futures are up rn + the 0.18 spy was at after hours so +. 29 for spy rn?
2019-12-22 23:27:10,,5,Weeeeeeeee
2019-12-22 23:27:01,love2fuckbearasshoe,3,BLOOD FUCKEN GREEN
2019-12-22 23:23:12,Not_reddits,3,Blood green
2019-12-22 23:22:07,option-whisperer,1,ES gapped up on open. That means SPX to the moon in the morning.
2019-12-22 23:21:54,oregon_forever,31,"If you hate Christmas because the market is closed that day, you might be a gambling addict."
2019-12-22 23:21:04,Eman2105,1,Will spy catch up to the s&p level or will it lag behind bc of dividend
2019-12-22 23:20:27,rickknightpcw,2,Starbucks packed again.  Calls it is
2019-12-22 23:19:12,oregon_forever,7,Tomorrow they will probably announce some BS macro economic number that comes 0.01% above analyst estimates and the market will rally another 1%.
2019-12-22 23:19:09,oradell18,2,for those of you selling itci puts are you putting your orders in rn so they hopefully fill first thing in the morning or are you waiting until market open to see where they are at?
2019-12-22 23:18:56,ILoveTheAtomicBomb,2,"Probably more shares of ACST and ABUS June calls.

Looking forward to watching TSLA."
2019-12-22 23:18:21,bbvending88,2,AMD SPY calls
2019-12-22 23:16:14,satireplusplus,1,$TSLA 420 tis is da way
2019-12-22 23:15:22,,7,Do you Gaylords honestly think poor star wars viewing will affect their stock? Do you know how much money they make from selling toys and shit? That's where the real money is.
2019-12-22 23:12:25,the_dizzle_dazzle,6,When China opens future will moon
2019-12-22 23:12:19,Professor-Sledge,1,Load some $vxx probably. Put call ratio seems to have bottomed - a lot of folks are starting to hedge.
2019-12-22 23:11:47,Sillybull,2,"Call my mom and say I love her, then tell my dad he is better give me money to YOLO on Tesla for their grandchildren not being sleeping in the refrig box under bridge"
2019-12-22 23:11:21,CPA-hole,21,"Futures green .03%

Bears r fuk"
2019-12-22 23:09:34,bbq-ribs,7,"So I got some insider info, the market is going to be closed on DEC, 25th *wink"
2019-12-22 23:07:36,crazyeugene,2,Future kale green!! Lets make that tendies!!
2019-12-22 23:05:59,Malokium,1,Selling my retard way OTM tsla calls at open and going into NFLX AMD BMY
2019-12-22 23:03:19,gman04444,8,"Remember some dude told me weeks back to get  cheap ass spy $335 calls exp 12/31, praying it goes ITM"
2019-12-22 23:02:18,,2,XLE CALLS
2019-12-22 23:00:24,the_dizzle_dazzle,2,"Any autists here with SEO chops? I need to rank my site better so i can earn more tendies for FDs.

Specifically looking to add links but have no idea where to start.

[www.dizzledazzle.ca](www.dizzledazzle.ca)"
2019-12-22 22:59:52,galactictaco42,1,"is poor star wars reception priced into DIS at the moment?

also, any one have any conspiracies on why they bought star wars just to murder it in a public execution?"
2019-12-22 22:53:21,,8,"My daily data miner is getting a little more sophisticated.  
[https://pastebin.com/jyjcCpyD](https://pastebin.com/jyjcCpyD)"
2019-12-22 22:50:41,yinatom,3,https://imgur.com/a/rUT2UCI
2019-12-22 22:48:34,throwaawwaaayyy,4,420 yolo call of $TSLA
2019-12-22 22:47:39,love2fuckbearasshoe,18,"Hardest part of investing in PTON$ 

Telling your parents u don’t charge money when u suck cock because u doing it for enjoyment"
2019-12-22 22:45:42,Stagathor,1,People really be considering YOLOs ITCI huh?
2019-12-22 22:45:14,Gbabywireless,2,"Looking at the chart for SPCE, what caused that sudden drop?"
2019-12-22 22:45:13,love2fuckbearasshoe,2, ITCI FAT PREMIUMS BABY SOME OF YA GONNA GET RICH off that stock
2019-12-22 22:44:27,love2fuckbearasshoe,4,STONKS ONLY GO UP FOR FUCKS SAKE !!
2019-12-22 22:40:58,jakersthepig,2,Boeing space capsule lands successfully. Maybe Boeing picks up a little? Please...
2019-12-22 22:40:06,Orionaux,2,Straddle of some kind on $ITCI. Or maybe covered calls. Depends on how it looks after open.
2019-12-22 22:39:50,_Idownloadcars_,8,YOLO on ITCI
2019-12-22 22:37:07,flowkingfresh,3,Depending how tomorrow is I might sell some of my VIAC $42 calls I’m up 100% right now probably pick up some SPCE or roll the VIAC out
2019-12-22 22:35:16,hvc801,10,"Account going into the week is TSLA 420 calls, hundreds of SPCE and CRON... 100% confirmed gay."
2019-12-22 22:31:03,mylarky,-1,"If it's a stale day, like a +/- 10 point move, I'm going to sell ATM VIX straddles near the close.... but only if I can get 0.65 or more for each one."
2019-12-22 22:26:08,mr_blockchain_,9,"Looking strictly at the upward sloping AAPL 1Y graph, I can't imagine a future where it does not hit $300, unless the recession literally started tomorrow

Source: $3K into 287.50 12/27 calls"
2019-12-22 22:25:24,mauimikes,7,Stacking more SPCE calls 🚀🚀🚀
2019-12-22 22:24:48,dawhizkid,19,Star Wars only made $175M. Estimate was over $200M. 😱
2019-12-22 22:23:05,clutchonthefly,1,Why does Ally say I don’t have enough money in my account to place an order when I clearly have enough money
2019-12-22 22:22:58,tristatemogul,4,Pray that AAPL rallies
2019-12-22 22:21:33,ashastry,1,"Pray Peleton reports some good news, or maybe an analyst upgrade. 

The same as last week pretty much"
2019-12-22 22:19:54,Lil_Musket,1,I've been trading for like 6 years and hedging still don't make sense to me
2019-12-22 22:18:34,,3,GE to 15 by March hopefully
2019-12-22 22:17:03,weijun1224,1,Someone pm discord link pls. Link in post expired 🥺
2019-12-22 22:16:45,Schneids33,3,For all this talk about Theta Gang I don’t think we talk enough about Delta Gang and Gamma Gang
2019-12-22 22:16:45,satireplusplus,3,"elon 420 <3

Tis is da way"
2019-12-22 22:11:28,ion3,4,Thoughts on Apple and FB this week? Can we rally to 285 and 210 respectively
2019-12-22 22:11:22,satireplusplus,2,"r/midgetfarm

r/winkerpack"
2019-12-22 22:07:39,Gbabywireless,3,"I don't wanna wait
For our lives
To be over"
2019-12-22 22:05:50,jayp20122,5,$LMT calls. The new multi multi multi multi multi multi multi billion dollar defense budget will light her ablaze
2019-12-22 22:01:30,soAsian,6,is it consider a Christmas gift if your wife let you fuck her on Christmas?
2019-12-22 22:00:26,bbq-ribs,9,one hour till futures go up and down.!!
2019-12-22 21:59:09,yachtsandthots,9,"Took a week off from the market and went on a cruise to Mexico. Made $600 on craps. My cousin rolled for over an hour it was crazy. Lost it all the next night. Can’t wait to do the same thing tomorrow,"
2019-12-22 21:50:54,FanTheF1ames,8,"Sbux ATH,  I bought two gift cards instead of one for gifts."
2019-12-22 21:50:46,The_Pandemonium,12,"What are my moves tomorrow, I'm gonna watch spy rocket to 330 and and get my free money."
2019-12-22 21:50:07,Bracciata,2,Pushing back my 1/3 Costco calls to further out itm calls because fuck theta gang
2019-12-22 21:48:27,snoooooooooo,3,Give me one reason not to buy SPY poots monday
2019-12-22 21:45:27,kings_landing,4,Facebook to the moon 🌙 210 by EOW
2019-12-22 21:44:38,abiech,1,I'm holding...😊
2019-12-22 21:39:08,snoooooooooo,2,"Cock

Edit: ball"
2019-12-22 21:37:48,buffalogiraffe,1,"Sold 4 ITCI puts, 7.5 and 5 strike. May do a few more. If BA is still under 330 may pick up a few shares."
2019-12-22 21:34:48,Greensun30,1,What small company do you think will be huge one day?
2019-12-22 21:34:22,snoooooooooo,-24,"Hello

Edit: who the fuck downvoted this I hate u and I hope all your stock trades cause you to go bankrupt you fucking prude 🤬😡

Edit 2: guys I’m crying why do you hate me

Edit 3: 😭"
2019-12-22 21:34:00,trapfactory,2,"This AMD short that I’m down 40% on.. Don’t know if I should cut losses or not, exp 1/17"
2019-12-22 21:32:20,ToDaAtmosphere,1,22c/4p strangle on ITCI if the price is right
2019-12-22 21:30:13,0116,1,TWTR 1/17 $33 Calls
2019-12-22 21:29:54,JC7577,2,Can the exec leaving Tesla be sell the news/needed correction?
2019-12-22 21:27:56,69SluttyPoptarts,1,$ROPE iron condor for greatest probability of success
2019-12-22 21:26:15,Warrick123x,11,SPY 330 calls
2019-12-22 21:23:59,micray1,3,Sell [CRM](https://www.reddit.com/r/wallstreetbets/comments/e9d63o/what_are_your_moves_tomorrow_december_12/faidho6/)
2019-12-22 21:23:27,,1,How da boys feeling about $APPL this week?
2019-12-22 21:19:12,love2fuckbearasshoe,25,"FUCK market is gonna be close on the 25 this week cause of stupid Christmas 

I hate it I have to give free shit to people that I don’t give a fuck about fuck !!!

And early on the 24 

Fuck man 

Like fuck man"
2019-12-22 21:18:49,surfinbird,1,Watching the ITCI show
2019-12-22 21:18:37,ebkallday1,1,All in $isee
2019-12-22 21:18:11,PM-ME-GOOD-DESIGN,2,I’m in DEEP on AMD calls for Friday... broke through pennant and hoping the move continues upwards. Heard everyone and their moms expecting a “pullback” but uhhh could ya not do that? Ty. Market still looking pretty bullish. Hoping it can pass 44.50 & 45.10 since that seems to be where everyone is thinking it’s going to reverse.
2019-12-22 21:16:18,SVXYstinks,1,Wait for granny to give me money so I can yolo it on TSLA 420 calls.
2019-12-22 21:14:57,love2fuckbearasshoe,-9,FLAIR ME “ ruthless paper route ceo “ :)
2019-12-22 21:14:01,1sildurr,1,"Depends on the open. Hope to exit short premium positions in /ng and UNG.

Might buy to close a few strangles in different dumb stocks. Depends if their IVR gets under 20.

Otherwise, watching a few short puts in APA, CNP, etc.

Put on some Jan/Feb put calendar spreads in RUT and DIA on Friday. So either look to close those for 10ish% and reopen them in SPX depending on volatility, or will keep holding them and wait for some volatility to increase their value. 

Beyond all that, just look for opportunity. But with the VIX this low, I might need to start buying some put spreads or something. Not much action for theta gang."
2019-12-22 21:12:18,chessiechoice,-4,Flair me
2019-12-22 21:09:17,Xcavor,20,If The Witcher keeps it up there will be more tits per season than Game of Thrones.
2019-12-22 21:09:04,Beastmode055,4,Is Santa bringing us SPY call tendies
2019-12-22 21:07:59,Peoples19592009,2,Damn I have nothing but biotech in my board.
2019-12-22 21:07:36,Nghtmare-Moon,1,"So Bausch (BHC) just got something approved by the FDA, is it time for it to moon or what?"
2019-12-22 21:07:32,PayMe4TradeIdeas,-7,FLAIR ME
2019-12-22 21:07:28,onyux,1,Imminent recession since I have calls
2019-12-22 21:06:08,HereForMadden,10,"Spy dec 2020 400c are  .37, pick up a few and hope we have a 25% year"
2019-12-22 21:05:41,HatsuneM1ku,3,"REAL puts, ITCI buy, Microsoft calls 🙈🙉

Edit: Staying out of itci actually"
2019-12-22 21:05:28,,15,Depositing the $100 check my grandpa gives me and buying an FD
2019-12-22 21:05:27,KramaChameleon,4,"Just sitting back tomorrow, chart watching."
