date,author,score,body
2019-12-12 03:41:26,IS_JOKE_COMRADE,3,"0-10, how much does the casual monthly joint kill your motivation?"
2019-12-12 03:40:59,MrBingCrosby,8,Star Wars opening night ... yea or nay
2019-12-12 03:39:31,love2fuckbearasshoe,5,"REAL FUCKEN MUSIC MAN I CRIED

THIS IS WHAT A RUTHLESS CEO CRIES TO !!!

https://youtu.be/IyXFHr5jylI"
2019-12-12 03:37:06,TrueLibertyorDeath,11,The amount of ads I see with Bernie asking for money on this site makes me want to buy puts on his campaign
2019-12-12 03:37:05,IWorkForTheEnemyAMA,1,"So what time tonight/tomorrow morning do we think the article about trade talks comes out?  I’m going for a 4am EST release.  I think the odds it’s a tradetalksnotgoingwell article are much higher than tradetalksgoingwell.  I also guess we get just one more article before the weekend, then it’s going to be a non-event by the time trading starts on Monday."
2019-12-12 03:36:58,divsandpremium50,4,Robinhood should give us commission free leveraged futures for the work we’ve done for them
2019-12-12 03:35:46,NIONIONIONIONIO,-9,"BUL R FUK, BLOOD RED"
2019-12-12 03:35:27,galactictaco42,1,"Shorting UVXY is that big drip

Small problems, big moves"
2019-12-12 03:31:52,greasy555,1,"Anyone have thoughts on $DERM ? I’ve got jan 17 11c made a nice profit today unsure whether to hold little longer. BE 11.80. Currently at 11.67.  Bought in yesterday. 

Stock up 16% today"
2019-12-12 03:31:20,NIONIONIONIONIO,-7,"OK IVE LOST ALL THE KARMA I GAINED EARLIER. KIND OF LIKE MY TRADING, SO ATLEAST THAT IS CONSISTENT"
2019-12-12 03:31:15,,6,"how do you decide which girl to fuck

big tiddy blonde or 6'1 Colombian giantess ?

I really can only pick one"
2019-12-12 03:29:51,WorstOfWallstreet,7,"Got some spicy-ass Pad Thai that I'm munching on 🔥

Watching some Regular Show. Shit actually holds up pretty well, but I'm also pretty stoned so

Holding Amazon calls for next Friday, barely green on them after today"
2019-12-12 03:25:35,yinatom,2,Good to see fetty back in the chat 😂
2019-12-12 03:25:12,gigantoir,4,im gonna make so much money tomorrow its like christmas eve boys
2019-12-12 03:25:09,nzholtok,4,How is volume usually in December and January after fed meetings? Last year was crazy because of external factors but what if nothing news wise happens?
2019-12-12 03:24:04,barelyreadsenglish,3,"My fucking cat won't let me study, little shit I got a final tomorrow, ignore the fact Im here with you retards,but I could be studying"
2019-12-12 03:22:01,Droidvoid,7,"I’m from the future and have good and bad news for bears.
Good news: there will be a rug pull
Bad news: it will be next summer from 3500"
2019-12-12 03:21:20,NoftScarlet,3,🐻🌏
2019-12-12 03:20:40,VacationLover1,8,Ever since u/winkerpack got popular and started his own sub with all his alts he doesn’t talk to me anymore 😢
2019-12-12 03:20:11,Zadok__Allen,5,LULU is going to recover nows the time for calls
2019-12-12 03:19:27,TheCigarKing,5,"#GOT $QRVO PUTS AMA!!!

#😈🐻😈🐻😈🐻"
2019-12-12 03:18:24,,5,Bebe's Boobs Destroy Society
2019-12-12 03:18:11,Orgasimo,3,"I have faith in my MSFT 149/147 Put Credit Spreads that hit exp on the 20th.

I am also starting to get drunk. How are all y'all doin middle of the week?"
2019-12-12 03:17:24,CPA-hole,4,How do I ban someone?
2019-12-12 03:16:59,but-this-one-is-mine,6,"I'm a sick fuck

I like a quick fuck  
I like my dick sucked 

I'll buy you a cyber truck"
2019-12-12 03:12:34,irontesties,1,friday 13th full  moon buy calls
2019-12-12 03:12:04,NIONIONIONIONIO,-10,OK KOOL OK KOOL WHO CAN LOSE 40 COMMENT KARMA IN 10 MIN? OH I CAN
2019-12-12 03:11:07,,2,Chk... wtf
2019-12-12 03:10:56,NIONIONIONIONIO,1,ALEXA PLAY CHIEF KEEF OK KOOLAID
2019-12-12 03:10:36,fraqaq,1,Should I buy spy calls or puts?
2019-12-12 03:09:15,,3,"should i sell my 232.5 12/20 lulu straddle? i got straddly fucked by IV crush but i should break even on my put, whereas i might just hold onto my call for a rebound. unless it can drop further EOD?"
2019-12-12 03:08:25,Sinadins,4,"Hey kids, the word of the day is angular velocity and torque"
2019-12-12 03:05:44,J_Powell_Ate_My_Ass,7,"I went to bed 2 hours ago and just woke up. Seriously what the fuck is this malarkey.

I'm considering going to the casino until market open. Thoughts?"
2019-12-12 03:04:31,NIONIONIONIONIO,3,ALEXA PLAY MAC N UP - CHIEF KEEF
2019-12-12 03:04:08,Master531,3,I said $LULU would go up after earning and I’m going to hold my position like a man. Sold put credit spreads on it anyways so I might turn a profit
2019-12-12 02:59:50,oregon_forever,32,"The great inventors that made America great:

Henry Ford

William Google

Tim Apple

Steve Nike

Bill Microsoft

Jeff Amazon"
2019-12-12 02:58:28,NIONIONIONIONIO,-23,STOP CLICKING ON MY PROFILE AND DOWNVOTING ALL MY COMMENTS
2019-12-12 02:57:57,feral_tit,3,Are there any non normie subs that talk about stuff besides options
2019-12-12 02:57:56,Cnastydawg,5,I wrote an essay in two hours today and got a 97. Damn I’m proud of myself even though its for my worthless elective
2019-12-12 02:55:56,Bollinger_bandz,4,What would happen if stocks were to go down?
2019-12-12 02:54:10,NIONIONIONIONIO,-16,WHO CAN FARM 70 COMMENT KARMA IN 4 HRS? OH I CAN
2019-12-12 02:53:22,oregon_forever,5,"I was really hoping that JPowell would come out to Triple H's theme music (The Game), spray water upwards and say ""I am back bitches"". That would have taken SPY easily to $400."
2019-12-12 02:51:44,but-this-one-is-mine,4,"Got TSLA 390c 1/10

Let's get these deliveries boiiii"
2019-12-12 02:51:31,numbnah,4,Need a tsm dip so I can reload on calls
2019-12-12 02:51:27,throwaway_0x90,2,"Well $CHK turned me into a bag holder, but that's not all my funds. Watching $NIO & $JCP; always ready to jump into $PCG if falls again. I'd probably get $PTON if I wasn't a $CHK bag holder, but a huge enough fall in PTON or PCG would probably cause me to drop CHK at a loss just to get in on the dip"
2019-12-12 02:49:49,numbnah,3,Missed out of ba dip today. Pissed me off
2019-12-12 02:49:31,winkerpack,9,I'm banned from my own sub 😭😭😭
2019-12-12 02:48:49,,3,"I have a set of indicators that is always right. When they start to converge it means the price is about to have big movement in that direction, but sometimes it also means big movement the other direction. Also sometimes it just means the movement is over for now and the price may hold steady. Just wait for confirmation of the direction then buy/sell its free money"
2019-12-12 02:48:09,WSB_GayRightActivist,3,Wendy’s messed up my order but it was still lit. Long WEN
2019-12-12 02:46:26,The_odd__todd,3,Bulls are wrong.  Bears are wrong.  Theta wins EOW.
2019-12-12 02:46:09,analyst_84,3,You’re lying at the side of the road bleeding out and you got time for one song before you die.  What do you play?
2019-12-12 02:45:57,greentea45,1,"HSI is on fire, not sure why. should have yolod on hsi futures"
2019-12-12 02:44:56,NWordTekashi69,2,Holy shiiii BER FUK
2019-12-12 02:43:49,NIONIONIONIONIO,5,ALEXA PLAY THESE EYES - RIFF RAFF
2019-12-12 02:43:25,divsandpremium50,3,Said I wouldn’t look at futures yet I check every 5 minutes
2019-12-12 02:43:22,Sinadins,2,"\+.5% day tmrw, don't @ me"
2019-12-12 02:41:54,NYGiants1532,2,I'm gonna be sick with these futures
2019-12-12 02:39:58,winkerpack,9,😳
2019-12-12 02:36:30,yinatom,2,Boys will be boys (respectfully)
2019-12-12 02:36:14,feral_tit,3,"Pretty sure I unconsciously hate money,, like I genuinely think this is the case...wat do. I’ve literally thrown away all of my possessions twice. I just barely got an iPhone after 2 years of flip phone"
2019-12-12 02:35:58,Heedunk,3,God damn this week has been boring. Nothing moving
2019-12-12 02:31:24,GamblingMikkee,13,We are one tariff delay and away from 320
2019-12-12 02:31:06,NIONIONIONIONIO,4,JUST ATE 5 ICE CREEM CON
2019-12-12 02:30:43,,2,Some loser recommended me to buy ABMD calls for 12/20 $240. Glad I was broke then. The stock is in the shitter.
2019-12-12 02:29:02,Footsteps_10,9,"Not going to do another post about it. Quick points.

Costco grew 5% this quarter in sales. Guaranteed figure and topped estimates.

Membership hits the books from China, 200,000 members. It’s not #pricedin -

https://www.marketwatch.com/story/costcos-first-china-warehouse-has-200000-members-blowing-past-the-68000-average-2019-10-04

Possibility of a special dividend 

Traded flat last quarter after earnings and rested at 295. It’s down 5% from all time highs. It’s up 1% in 3 months per Robinhood’s magic chart. 

If it dips, I will sell my entire portfolio tomorrow and buy stock on top of the 100 shares I already have

Best of luck tomorrow. Fantasy football semi finals as well"
2019-12-12 02:28:08,,7,Asked my dad how much he thinks peleton is worth. He guessed 40 million
2019-12-12 02:25:07,1se,2,I’ve been trying to learn about how spreads work and I’m still a little confused. I think I need to try one so I can see it in action. Any suggestions for a cheap first one? Spy?
2019-12-12 02:24:52,BlueKnightJoe,5,"I think it's really gonna come down to, when Trump meets with his advisors tomorrow, who will he side with? Navarro or Mnuchin? Tariffs or delay?"
2019-12-12 02:24:35,dommytao,2,"Spy $316 eow, big sell off Friday before close, trump says something about trade war and we open red Monday"
2019-12-12 02:24:12,BennyFlocka,7,"Have you ever bought FDs for an earnings report at 3:58 and realized you had a crippling gambling addiction? 

Yeah, me neither.."
2019-12-12 02:23:57,jep777,1,"Condors on AMZN 12/20, any upcoming catalysts I should know about?"
2019-12-12 02:23:34,APHAbaghodler,3,Puts it is on JO! Thanks for the play retards!
2019-12-12 02:20:06,divsandpremium50,2,Buying $100C 12/20 on BIL I need this one badly my entire savings is on it
2019-12-12 02:19:11,8415claw,1,Why would trump delay tariffs?  No deal signed  no delay.
2019-12-12 02:17:59,kirbyone,2,"Still long CLVS, been a tendie printer past couple of days"
2019-12-12 02:17:56,NYGiants1532,2,"I fucked up so badly fuck fuck fuck, I gotta average down tomorrow"
2019-12-12 02:17:47,ATastyGrape,3,Costco the play tomorrow?
2019-12-12 02:16:02,,6,Can't believe I'll live to see what happens to a companies share price when a rocket ship holding a bunch of rich wannabe-astronaut rocket man tourists blows up
2019-12-12 02:15:28,InfiniteAccuracy,1,Well.  Still holding these here SPCE puts.  See what happens with these bad boys lol.
2019-12-12 02:13:18,NIONIONIONIONIO,1,JUST GOT SOME M AND M ICE CREEM CUNES
2019-12-12 02:12:45,oshbear,1,Futures are Ferrari yellow
2019-12-12 02:09:17,WarrenBuffetsSon,6,"Feels good to be right, pounding imaginary bear ass every trading day. Bitch boy Trump too afraid to even address daddy powel"
2019-12-12 02:09:05,,14,Getting surgery tomorrow for my gynecomastia. Say goodbye to these titties bois ( . ) ( . )
2019-12-12 02:09:02,dingodoyle,5,"[The Securities and Exchange Commission wants bad guys to know: ""We're watching""](https://www.cnbc.com/amp/2019/12/11/the-sec-wants-bad-guys-to-know-were-watching.html) 

You watching this SEC? Well, you can SEC my dick."
2019-12-12 02:08:30,,5,That was scary af. I accidently wandered out of wsb and into normie subs like gaming and pics. Felt like I had been poisoned and dropped down a pit into a maze
2019-12-12 02:07:59,dang3r_79er,1,"When $BECKY screws your over, rely on your bros, Elon and JPowPow."
2019-12-12 02:07:51,Enron-Musk,4,"I made an order and then cancelled it immediately after. It got filled while cancelling and the system glitched.

These were for weekly calls on DLTR. While on the phone with TD, DLTR spiked about 1% and I made around 80% on my calls. 

TLDR: only time I make money is by mistake."
2019-12-12 02:06:48,divsandpremium50,4,How could you literally be short equities when central banks around the world are injecting 100Billies every month into the market. Gl out there until the time comes
2019-12-12 02:05:33,_foldLeft,2,"Drinking Goose Island IPA and watching the caps game. Not sure about this beer.  

Anyways, anyone in MRK? I'm debating selling my calls, $85 strike 1/17 and 3/20 expirys, this run seems like it's out of steam for now"
2019-12-12 02:01:04,M0ngoos,1,"Lil duval really trailing off on rogan now, too high."
2019-12-12 02:00:08,LegendsNeverDox,3,Buying the dip
2019-12-12 01:57:37,feral_tit,10,Going all in on self-improvement😎
2019-12-12 01:56:26,jep777,2,When is the judge or governor or whoever suppose to rule on PCG? Tomorrow? What's the probably verdict?
2019-12-12 01:54:43,0z1o2t,3,Need a guaranteed 1000% move for Friday so I can buy my ex-god son something nice for Friday the 13th. What’s your play given my predicament?
2019-12-12 01:52:31,VacationLover1,3,"Ok.. last time trump had to discuss tariffs he angrily tweeted out tariffs against the advice he was given. He is meeting to discuss them tomorrow so puts have to be free money, right?"
2019-12-12 01:51:20,analyst_84,-3,House and Lost were peak tv shows.
2019-12-12 01:48:04,Midgetfarm,6,u/winkerpack are you mad at me 👀👀
2019-12-12 01:46:35,SJest,0,Why dont people sell premium on earnings like lulu
2019-12-12 01:45:19,srinips18,6,Holding $hd $mcd $cost. Costco selling before earning. Enter  $spy puts tomorrow
2019-12-12 01:44:29,durrrr___,5,"https://www.cnbc.com/2019/12/11/jim-cramer-turns-bullish-on-tesla-i-am-a-true-believer.html

Will the Cramer curse live on?"
2019-12-12 01:44:09,760prelude,2,"Skyworks=free tendies(always buy calls)
Ringcentral=free tendies(if you bought the dip)"
2019-12-12 01:39:01,TreyATX,2,Pretty substantial move in $VVIX continuing today.
2019-12-12 01:35:12,IS_JOKE_COMRADE,3,"synonym for absolute success, or unrivaled success. Something where 'everything goes right'?"
2019-12-12 01:34:00,kilonova17,2,"Question to the wise folks of WSB. If you take another job and get paid relocation with a contract attached to it; do you need to pay the full amount if you break the contract even though your bonus take home amount will be considerably lower due to tax!

Eg: You get a relocation of 10k and are taxed 40%, so you only get 6k take home, but if you break the contract, then you will have to pay 10k to the company and essentially are down 4k? Is this true?"
2019-12-12 01:31:22,follow-spy,2,I can't play this tariffs BS.  Give me a normal day any day to trade and much more fun to trade.   Fcuk these guys
2019-12-12 01:26:35,heavenlyblues,8,"I hope his mom is right. I bought 2K in SPY puts eod.

https://www.reddit.com/r/wallstreetbets/comments/e2pa9c/1212_dooms_day/?utm_source=share&utm_medium=ios_app&utm_name=iossmf"
2019-12-12 01:25:19,NIONIONIONIONIO,3,ALEXA PLAY BLESS YO TRAP
2019-12-12 01:24:55,,4,SPY hitting ATH tomorrow 😤
2019-12-12 01:23:40,Big_Factz,5,"
Update: https://www.cnbc.com/2019/12/11/reuters-america-update-1-trump-to-meet-with-advisers-thursday-about-dec-15-tariffs-on-china-sources.html"
2019-12-12 01:23:11,NIONIONIONIONIO,2,HOW TO BE BUL GANG?
2019-12-12 01:20:54,dawhizkid,1,how does one find a sugar daddy??
2019-12-12 01:20:47,Red_EyedBear,3,PTI has been good to me. She keeps me warm at night.
2019-12-12 01:19:51,Big_Factz,3,Futures green early 👀 and Japan green
2019-12-12 01:17:11,follow-spy,0,"lol can't stop laughing at this idiot.  The best part is he put his hands behind his head thinking he is gonna get satisfaction..lol

[https://www.tmz.com/2019/12/11/pga-golfer-tommy-gainey-arrested-prostitution-sting-two-gloves/](https://www.tmz.com/2019/12/11/pga-golfer-tommy-gainey-arrested-prostitution-sting-two-gloves/)"
2019-12-12 01:16:27,NYGiants1532,1,I'm not going to be able to sleep tonight
2019-12-12 01:15:53,BossManMark,1,Is it even worth it to play Costco and Adobe tomorrow? I’m sure that IV will screw over both calls and puts
2019-12-12 01:13:19,soccergoon13,4,"I just re-lost my humanity. I was googling Caroline Munro to see what she looks like now, and found a picture of someone who created a Real Doll to look just like her...

of all the people, her?"
2019-12-12 01:13:19,dungbat83,1,All in spy and qqq calls right?
2019-12-12 01:12:09,ILoveTheAtomicBomb,4,"Man LULU

RIP to calls and to put holders about to get trashed by IV"
2019-12-12 01:11:09,oregon_forever,7,Even the poorest of you is only one good FD away from being rich. Keep the dream alive.
2019-12-12 01:06:35,jeesgalaxy,6,"At this point, I'll have to bag hold my 230c lulu Dec 27..."
2019-12-12 01:06:20,oregon_forever,6,New ATHs are well within reach.
2019-12-12 01:05:41,goingontwelvethirty,4,Lol LULU put holders
2019-12-12 01:05:29,oregon_forever,14,"I just heard this conversation.

-I love Hallmark movies, there is no violence, no drugs, no trauma. Only happy stuff.

-Yeah those movies only have white people in them."
2019-12-12 01:05:02,throwawaybutforchang,6,Cmon trump do something
2019-12-12 01:04:23,WorstOfWallstreet,4,That last push on AMZN to 1750 😌
2019-12-12 01:02:22,sturifidness,2,"I just know the market is going fuck me real good for holding onto these SPCE calls for ""just one more day"". Can't. Wait."
2019-12-12 01:00:10,NorseLegend,3,Hopefully waking up to CSCO tendies.  Thanks to the dudes who dropped the DD today.  May turn out to be a great lotto play.
2019-12-12 00:57:26,nordmys,12,Took a position solely based some dude posting in the daily thread that some dude he follows Twitter recommended it. I deserve what's coming
2019-12-12 00:56:01,TheGayLehmanBrother,4,"YOU COULD HAVE HAD A BAD BITCH, NON COMMITTAL"
2019-12-12 00:55:54,Brosiah_,4,Phase one is fake and rainbow [https://www.youtube.com/watch?v=LnE-gnG9Xzc](https://www.youtube.com/watch?v=LnE-gnG9Xzc)
2019-12-12 00:55:49,openchicfilaonsunday,3,Uber calls expiring tomorrow or your dick is soft
2019-12-12 00:54:56,IS_JOKE_COMRADE,2,Alexa play milkshakes by kelis
2019-12-12 00:52:11,juseeb33f,2,"Any one get any LULU puts? Lol I just bought 1- 12/20  210p. Wish I had balls and yolo’d 220s.

Whatever. Profits profitz."
2019-12-12 00:50:40,NIONIONIONIONIO,3,ALEXA PLAY BUL R FUK
2019-12-12 00:50:31,AfroSWE,2,feel like shits going to be flat till sunday evening.
2019-12-12 00:50:19,oriolesa,3,"🅿🅿

🤗🤗🤗🤗"
2019-12-12 00:49:31,IS_JOKE_COMRADE,4,Alexa play red by Chavelle
2019-12-12 00:49:29,NIONIONIONIONIO,-1,"IMAGINE GETTING A BONER FROM SOMETHING MADE OF FAT AND SHITS BROWN MATERIAL THAT SMELLS LIKE

&#x200B;

&#x200B;

SHIT"
2019-12-12 00:49:07,CryptoLukey,2,LULU go down down
2019-12-12 00:48:45,ethbux1,2,"I shorted the top

And that one

And that one"
2019-12-12 00:48:04,sadlone,7,"Apple gonna hit 250 tomorrow 


Or I’ll tell all of WSB that I’m a gay and real"
2019-12-12 00:47:39,rassclat,1,"Buy GBP,
Polls suggest $1.35 by 10pm GMT"
2019-12-12 00:44:59,Cnastydawg,2,Alexa play Lean Wit Me by Juice Wrld
2019-12-12 00:44:55,love2fuckbearasshoe,3,"FUCK U nyc trains all these shit delaying man 


Fuck u nyc I haves car I hate driving because of traffic and the subway are all fucked as well 

Fuck I hate this city 


For anyone who lives here WHY ???

What good u see in it"
2019-12-12 00:44:18,sadlone,5,"Big F for everyone who didn’t buy apple FD Friday PUTS at close. 


Sorry 
U bigly 

RETARDED"
2019-12-12 00:42:43,NIONIONIONIONIO,0,DOES MY NAME SAY ION OR ONION?
2019-12-12 00:41:42,GamblingMikkee,3,"Trump won't roll back tariffs. Calls on CAT, WYNN tomorrow"
2019-12-12 00:41:16,Cnastydawg,2,Drugs got me sweating but the room getting colder
2019-12-12 00:40:12,NIONIONIONIONIO,4,SPY R FUK
2019-12-12 00:40:12,Lark279,2,Long laser companies?
2019-12-12 00:39:24,yinatom,5,Fun fact in Arabic stocks only go down
2019-12-12 00:38:17,M0ngoos,1,Wait rogan has three hours of lil duval. Spark it boys this shit must be ridiculous.
2019-12-12 00:37:48,zebrawaterfall,10,"Realizing today I lost my way and started trading like an idiot to chase missed gains. One of my favorite tickers was up 8% this week, if I had played that alone I could have quadrupled my entire account. Instead I sold off my itm weekly positions to go all in on dumb moves because I was bored.

Playing earnings is part of it, but the other part is playing the news/wsb posts instead of relying on the DD that I do every day. I spend so much time researching and still end up playing stonks I know nothing about.

Just a rant but yeah. Worth thinking about your strategy if you are getting rekt."
2019-12-12 00:34:20,NIONIONIONIONIO,2,TESLA IS THE NIO OF USA
2019-12-12 00:34:11,Not_reddits,4,Futures are as green as my kale smoothie
2019-12-12 00:32:34,Enron-Musk,10,"What’s the play for Enron earnings? 

I’m expecting it to remain flat."
2019-12-12 00:30:10,Not_reddits,3,Does anyone have some vitamix smoothie recipes? I just picked one up
2019-12-12 00:26:55,MorpheusOnAcid,1,"Crazy busy with work, I'm just now seeing what happened with PLCE. hoping some of u auties had puts"
2019-12-12 00:26:01,love2fuckbearasshoe,4,FUCK The S.E.C
2019-12-12 00:24:53,Core_Four,8,"how's the great december crash of 2019 working for you, bears?"
2019-12-12 00:24:22,HowLongCanIMakeAName,34,"Damn y’all so mean tn

One more negative comment and that’s it

I’m out

My mom just bought me a new bottle of flintstones vitamin gummies and I’m gonna have to OD on them bc all the kindness has left this putrid world 😞"
2019-12-12 00:23:10,NIONIONIONIONIO,4,"RUTHLESS FINANCIAL ACCOUNTANT REPORTING FOR DUTY, I CAN USE CALCULATOR ON ANY NUMBER YOU NEED"
2019-12-12 00:22:16,nschumacher,8,"My guess is that trump will not roll back tariffs because he’s in an impeachment inquiry and he doesn’t want to lose voters which he likely would, EXCEPT everyone knows that the incumbent always wins during a {trade} war. Also he’s trying to start a real war so double winning. I have puts"
2019-12-12 00:21:13,VacationLover1,5,"One of my 401k funds dropped 10% today and I almost pooped my pants. Then I realized they’re probably giving me a sweet sweet divident tomorrow. Why do they have to do that to me, my heart can only take so much shock"
2019-12-12 00:21:04,MCohen2019,3,Sit around and hope $pep stays below 137 so I can collect those fat theta tendies
2019-12-12 00:21:01,barelyreadsenglish,4,Wait for my bmy calls to go 5x
2019-12-12 00:20:57,NIONIONIONIONIO,1,"LETS PLAY A GAME:

B\_L \_ F\_K"
2019-12-12 00:20:30,redisamyth,13,I just don't get it any more... Men enjoy looking at women's butts. An entire industry is born designed for women to show their butts. Women pay a premium for a brand of buttshowing.  Buttshowing company beats earnings expectations. Buttshowing company stock falls. I am not good at this.
2019-12-12 00:20:10,johnandrewr,5,sell COST before earnings. prob wont move far enough either way
2019-12-12 00:19:59,Daddy_wont_stop,7,"Find a girl that will make you GUH

Edit: or boy I forgot y’all are homos"
2019-12-12 00:19:15,knotswag,3,Jesus christ CEI. If I was willing to gamble on these energy stocks I'd be -95 instead of -99.
2019-12-12 00:18:30,Not_reddits,2,Just got a vitamix that shit is so niceeee
2019-12-12 00:16:56,,3,Just waiting for my new app 'Peloshort' to be approved by Google for the play store
2019-12-12 00:15:56,Mzavack,8,Ya'll motherfuckers real obsessed with 16 year old girl. Its fucking weird.
2019-12-12 00:14:57,Hegemon90,5,Only trump can help the bears now
2019-12-12 00:13:54,love2fuckbearasshoe,-10,"If u can’t make money in this market stop

Quit 

And get help"
2019-12-12 00:12:32,whib96,4,"My ouija board says SPY is going to 316 tomorrow, can anyone else confirm?"
2019-12-12 00:09:59,WBuffettJr,2,So I did a straddle on SPY this week at the money. I figure markets will move decently one way or another with the tariff decision. But I just had an idea; I looked up a 3x leverages etf such as SPXL and the options look surprisingly cheap. I was thinking why not do a straddle on that as well? Does anyone have any thoughts on that idea?
2019-12-12 00:09:46,DoesntUnderstandJoke,22,PTON better start pedaling faster or my kids are getting my expired calls as Christmas presents 🎁
2019-12-12 00:05:15,cloudneb,6,Funny SNL skit happening on CSPAN rn
2019-12-12 00:04:04,sadlone,3,"All in on APPLE FD’s expiring Friday. 


pray for me brothers"
2019-12-12 00:01:20,knotswag,15,"**Magical Crayons TA.**

Nothing interesting. We're back to Monday levels. Indicators at neutral across almost all metrics. Carry on."
2019-12-12 00:00:12,Sinadins,6,"All you bears that aspire to be the next Michael Burry just remember, he bought shorts in 2006 and it didn't work out for him until the end of 2008."
2019-12-11 23:57:50,NYGiants1532,8,I bought 25k worth of SPY 12/13 314 Puts. How fucked am I?
2019-12-11 23:57:22,migbyo,10,"Brexit election tomorrow, boys... ANYTHING RESEMBLING GOLD IS FREE MONEY"
2019-12-11 23:56:59,bernielootz2nd,2,Could the markets rally hard if a centrist dem like Biden/ Bloomberg/ Clinton/  Buttigieg win the election with back to usual dealings with gyna?
2019-12-11 23:56:37,J_Powell_Ate_My_Ass,13,"Man, every day the markets close I get legitimately sad. 

It'd be like if you could only play video games or jerk off from 930 to 4."
2019-12-11 23:55:19,,4,I’m picking up $316 Spy calls expiring Monday for tariff delay. 🤞🏼
2019-12-11 23:53:34,HowLongCanIMakeAName,-9,"r/wallstreetbets 👎🤢🤮

r/winkerpack 👍😍😩🍆💦"
