date,author,score,body
2019-11-19 02:42:25,sloppysteve543,2,Was gonna unload my roku calls tomorrow but my tendies are gonna be taken from me 😭😭
2019-11-19 02:40:14,JD_Harmeyer_I_Dunno,1,More LK puts a few weeks out
2019-11-19 02:40:02,uninfinity,1,"*Hong Kong Chief Executive Lam says she told police she hopes campus standoff can be solved peacefully, adds she told police to handle protesters leaving the campus in a humane way*"
2019-11-19 02:39:59,TimothyHalpern,24,Why does the market keep going up?  I’m getting worried.
2019-11-19 02:39:57,winkerpack,-4,Give gold to.the person above me ☝🏻
2019-11-19 02:39:43,knotswag,2,stonks only go up
2019-11-19 02:39:12,snoooooooooo,6,"40% gain on my DIS calls tmrrw and I break even, wish me luck"
2019-11-19 02:38:22,uninfinity,3,"Alright who bought puts today, show yourself! 🧭"
2019-11-19 02:37:42,EvilLean,3,"Anyone looking at $AMZN for a swing trade this week? 4HR candles are telling me it's curling up for a momentum swing back to $1800, especially with Black Friday around the corner as a plus. Today's movement was nice, but daily candles are also showing a momentum swing by end of week.  Let me know if this is good DD or if I'm just a fucking gambler."
2019-11-19 02:35:11,VacationLover1,5,Blew my futures load early.. 🥰
2019-11-19 02:35:00,oriolesa,3,"Told you guys about F🅱 calls smh, not too late tbh"
2019-11-19 02:34:19,,3,aurora cannabis?
2019-11-19 02:32:37,nbmcucumber,2,What is going onnnnnn
2019-11-19 02:32:00,PuzzledJournalist212,3,Holy fuck there goes ES
2019-11-19 02:30:40,identifiedlogo,1,"Macys ATM puts are juiced up. Sell the Nov29 16 puts for almost a $1.00. Should be positive forecast, stock has been beaten up too much already."
2019-11-19 02:27:28,ConspiracyTaco,2,Do you still think 109/110 put credit spreads on TGT are a good idea? Or should I go lower
2019-11-19 02:25:03,DiprotodonGang,12,"https://www.bloomberg.com/news/articles/2019-11-18/apple-iphone-11-scores-early-china-success-official-data-shows

AAPL 300C free money"
2019-11-19 02:23:40,mehhhhhhhhhhhhhhhhhh,7,"This car is running on fumes. I've been riding with the bulls for a while now, but I went mostly cash today. Was tempted to get some EOD puts, but I don't think we're quite there yet. If tomorrow hits another low Vol ATH, I'll start gingerly dipping my toe and scalping any decent morning pullbacks.   


A fart could knock this whole house of cards over any day now. I just hope I have the testicular fortitude to hold and add to any puts I have in my pocket when the real crash starts."
2019-11-19 02:23:02,ScaliePornAccount26,5,"What can go wrong with HP? Xerox can throw a higher bid at HP and it will moon, Or HP can big cock it and tell Xerox to get bent, stock moons, AMD buys HP, both moon. Am I retarded or is this literally free money"
2019-11-19 02:22:51,Chris_TheTrader,2,Anyone swinging IntelSat? $I
2019-11-19 02:21:49,PhillipHobbes,4,Wow. This is beyond meme level. StoNks Go up!
2019-11-19 02:21:45,,4,"Jesus, is it to late to buy Poots on Intelsat"
2019-11-19 02:20:35,Midgetfarm,4,Asked my mom to buy me a vanilla ice cd for xmas
2019-11-19 02:19:38,snoooooooooo,12,"Expecting DIS above 150 tomorrow 

How crazy am I 🗿"
2019-11-19 02:18:54,KramaChameleon,0,FUTURES BLOOD NEUTRAL!!!!
2019-11-19 02:13:20,JCThatsJB,4,Stare into the mirror for 45 minutes practicing my Iron Hand technique for my LK 12/29 21.50c.
2019-11-19 02:13:03,,1,ES 3128 by 4am!?
2019-11-19 02:12:36,but-this-one-is-mine,3,"I’m kinda kicking myself over roku too, just watching it moon and still no position"
2019-11-19 02:12:19,JaththeGod,10,Tomorrow will be sell off day. I know because I’m gonna buy calls at open
2019-11-19 02:11:41,Memitim901,1,What if trump being in the hospital is a cover for health issues causing him to resign instead of facing impeachment?
2019-11-19 02:11:10,aljoko,3,Any chance HD goes out of the norm and goes up like 5%?
2019-11-19 02:10:20,therealshakezula,2,Just got the idea to buy some put weeklies on spy
2019-11-19 02:08:25,heavenlyblues,10,GODDAMN just look at the SPY daily one month. That's a fucking erection.
2019-11-19 02:08:15,whib96,3,Still waiting for this trade deal so I can get a nice bump towards breaking even on my stupid moves
2019-11-19 02:08:08,APHAbaghodler,2,Don't even know what to say right now.. have we ever had a face ripping rally this fucking hard before on no real hard news?
2019-11-19 02:07:54,small_root,3,[Every fucking day.](https://i.imgur.com/iUbwvlh.jpg)
2019-11-19 02:06:57,ValuablePassenger,4,anyone worried about Donny?
2019-11-19 02:06:44,digitalradiohead,2,"Anyone else scal Medtronic calls on its move lower today? Earnings in the morning and we’ve seen it gap up before on ER,"
2019-11-19 02:05:28,Big_Factz,1,AAL LEAPs check it
2019-11-19 02:05:13,APHAbaghodler,7,"Yup there it is.. just when you think maybe we'll have a pullback day, PPT kicks in as usual. Fuck this.. gay ass markets fucking rigged. Fuck you. Fuck everyone."
2019-11-19 02:05:07,JaththeGod,2,Can’t tell if buy the dip on ROKU or buy puts hmm
2019-11-19 02:04:27,,2,I’m buying Nintendo before the holidays so that I can go cash raking at Christmas! It’s gonna be climbing especially with all the advertisements already put out
2019-11-19 02:00:06,biggie_gainz,1,Who else  BILI  gang?
2019-11-19 01:59:59,23therealme23,32,We may be close to witnessing a full out bear extinction
2019-11-19 01:58:54,VacationLover1,4,By December 15th we will know how trade talks are going 🤨
2019-11-19 01:58:23,Vxxputs,16,"Always knew markets were manipulated to some extent. But now big boys are shamelessly fucking playing with it. Can’t believe what is happening, someone posted on Twitter that his tools and technical analysis which was been working for last 15 years had no relevance for last 1 month. Almost every indicator pointed a small pullback 5 sessions back but nothing so far

Everything is overbought but we still grind higher. There is no price discovery, futures go up and cash market mindlessly keep the market up without testing supports. VIX is struggling to go above 13, volatility shorts are at all time high. 

I am personally out of this shit since last week, better not lose money.. whenever banks feel like cashing out they will crash the market and bankrupt the put sellers. They are killing the call holders at will by these low vol theta burns sessions anyway."
2019-11-19 01:58:13,DUMB087,1,How does tasty trade or think or swim make money?
2019-11-19 01:56:47,nbmcucumber,11,Wtf is going on
2019-11-19 01:56:40,,9,I like green it’s a good color
2019-11-19 01:56:19,nadoterisback,6,"why do these futures traders even pretend in the evening that we're going red lol

shit always V recovers when asia opens and we stay green/blood green the rest of the night (not counting random news articles/tweets)"
2019-11-19 01:55:14,greentea45,5,"Guess we should start taking bets on what cnbc's ""China source"" is going to say tommorow morning in order to save their puts"
2019-11-19 01:54:53,PuzzledJournalist212,4,"Fuck yes, sitting on these ES golden eggs till morning"
2019-11-19 01:54:48,boohooboi,2,Chances of roku rebounding? Doesn’t make sense to crash that much when the shares are used to finance a critical acquisition that was announced during earnings...
2019-11-19 01:54:38,flowkingfresh,5,Pajama traders just need a little more blow and we gonna be back to green
2019-11-19 01:53:47,DUMB087,3,"Not sure why I shorted FB today, but I did. F."
2019-11-19 01:53:24,AfroSWE,2,"Hang Seng up a good bit, who knew student protest could be so profitable"
2019-11-19 01:53:23,SVXYstinks,4,We need to do one of those polls again to see what the % sentiment is on here.
2019-11-19 01:53:00,Scarcedflame,1,So uh. Roku is fucked huh
2019-11-19 01:52:31,Prorottenbanana,1,"Bought 450 shares of cgc instead of 420 

Anyways already down a few hundred, may buy more soon..."
2019-11-19 01:51:40,Shmokesshweed,12,Scrolling thru IG and it's crazy how these professional IG thots are probably making more than us while doing basically zero work.
2019-11-19 01:51:25,CPA-hole,9,Futures continue to cuck bear gang with no mercy
2019-11-19 01:49:20,bigplay85,2,7 straight green trading days. Pretty sure tomorrow will be small red. Congrats bears.
2019-11-19 01:48:24,Beyond_Duality,-3,"If your peepee doesn’t leave an imprint on your memory foam mattress when you wake up I’m sorry.😕😕😕

“As you can see detective, the murder victim was a 3 legged man.”"
2019-11-19 01:48:06,ShinyPants45,3,Somebody talk me into holding my spy calls
2019-11-19 01:47:04,greentea45,2,"It's like every night, pajamas traders get the direction of Asia wrong..."
2019-11-19 01:47:02,ayysilver,2,"God damn, KRTX up over 400% in a day. Imagine the tendies on a $20c FD"
2019-11-19 01:46:14,ThetaBurnVictim,1,Asia is woke!
2019-11-19 01:44:54,magneph,2,I just want a fatty gap down. Anyone got a time and date for such an occurence?
2019-11-19 01:44:09,fairygame1028,3,"Was only able to pick up a little over $100 of APHA calls today 2 minutes before market closed, loading up on $2500 more tomorrow."
2019-11-19 01:43:50,Cnastydawg,6,And just like that futures are green again. This shit is nuts
2019-11-19 01:43:48,bigplay85,1,"Sold 71 acb $2p at .11c  friday expiration. Seemed like a good move as long as it stays above 1.89 money is made. THETA GANG!!! Also sold theta call speads, just need wensday close below 313.5"
2019-11-19 01:43:29,chaney3,3,just gapped up on 1min candles /ES with volume exploding. RIP my short.
2019-11-19 01:37:42,richard_fuld,5,"Cash gang and it feels amazing, october cucked me good"
2019-11-19 01:35:43,,6,I want 5G and I don’t mean the wireless service
2019-11-19 01:35:23,realister,6,Just look at the SPY monthly chart lol its like a straight line up
2019-11-19 01:34:46,fscumeau,3,Does Xi Pingpong trade options? What is he buying?
2019-11-19 01:30:58,MorpheusOnAcid,28,"I'm helping my little cousin with his resume, hes a junior in college..

under his skills section he added, ""never complains""


Bro wtf LMFAO 😂"
2019-11-19 01:30:54,noideawhatstis,1,$IWM  Nov 22 160/161 Put Credit spread. Let's gooooo!
2019-11-19 01:29:27,Shmokesshweed,8,"SHOP dropshipping update: $45 total sales, $80 in ads.

So it's like my trades with losing money but more effort. 🤔🤔🤔🤔 2/10"
2019-11-19 01:28:51,ev01ution,2,Why did roku tank?
2019-11-19 01:28:01,,2,Patiently waiting for the next correction.
2019-11-19 01:24:37,aim5455,1,Holding 11/20 312.5 SPY calls. Hold or exit in the morning?
2019-11-19 01:22:16,deposit_reg,5,">ServiceNow stock up 4% on news it is joining the S&P 500

Will financial institutions like Vanguard, Schwab, Fidelity, etc. buy shares of NOW for their S&P 500 index funds and ETFs causing the stock to rally further? Or am I a retard?"
2019-11-19 01:20:32,henhaller,3,Anyone’s dick tickling with $OKTA?
2019-11-19 01:20:15,chaney3,5,oof. /ES just crossed over EMA ribbon. Hopefully I can exit this short on a good note.
2019-11-19 01:18:14,HourPackage,1,Anyone trading the BX channel?
2019-11-19 01:17:20,realister,3,What happened to ROKU any news?
2019-11-19 01:17:13,Cnastydawg,10,The fact that trump keeps touting ATH on indexes just proves that this trade deal shit he’s leading on isn’t real
2019-11-19 01:17:08,freehouse_throwaway,5,too bad pos Valve and Gaben is private (cuz why would he want retail money when all they do is print money themselves) cuz the hype around A NEW FUCKING HALF LIFE GAME is already out of this world
2019-11-19 01:15:43,theolejibbs,5,Su Bae deepfake porn at open
2019-11-19 01:13:36,Midgetfarm,-5,Would you rather fuck winker dressed as oprah in drag or L2FMW
2019-11-19 01:13:09,PuzzledJournalist212,3,"Hm Abe’s tax hike leading to another Japanese recession and Nikkei is a house of cards that is effectively owned by the BoJ at this point, better start shorting /ES 

Stay retarded Japanese traders"
2019-11-19 01:12:51,,2,I want this 3% rise by xmas marketwatch keeps claiming
2019-11-19 01:12:05,MangosButtPlug,2,I know better than to get hyped about these roku puts yet but FUCK it just keeps going 🤤
2019-11-19 01:11:34,ES_fancypantz,6,"Someone dipping the happy pickle futures in ketchup, we just need to lick that shit off by morning"
2019-11-19 01:10:28,Izalith66,1,I bought some Roku 120p today an hour before close. Should I be looking forward to a W or L tomorrow?
2019-11-19 01:09:40,Snowlion59,2,Yes ROKU. Come to mama😆
2019-11-19 01:07:30,GamblingMikkee,7,You bears could simply buy puts on XLE (energy sector) yet you try to buy puts on SPY...
2019-11-19 01:05:28,knotswag,1,I'm all ining PSV tomorrow. Let's fucking go.
2019-11-19 01:05:11,lunatic_optiontrader,7,What if trade talks keep going well forever and that’s it. Never a deal but always going well
2019-11-19 01:05:11,GatorMD12,3,"[http://quotes.benzinga.com/quote/KRTX](http://quotes.benzinga.com/quote/KRTX) 

did anyone hit this lottery # today?  God my bunghole hurts missing that one."
2019-11-19 01:02:29,Gaston44,5,Nikkei is on a mission to the Earth's core
2019-11-19 01:02:21,ev01ution,6,Wmt is going to the 🚀🚀🚀🌙🌙🌙🌙
2019-11-19 01:01:17,PM_ME_XBOX_COD3S,2,Futures are promising but no way I shorted aapl at the bottom. Trump isn’t going to let me win
2019-11-19 01:01:08,TSONS1,5,Thank you mango 🐻🐻
2019-11-19 00:57:24,lmao_fuck,8,315 will be the top unless of course it isn’t
2019-11-19 00:56:47,chadimmaculate,2,My moves: buy SPY calls 30-60m after open because any Tuesday reversal will likely happen overnight and the dip will get bought. Those who buy calls first thing and set stops will get wrecked and slurped up by algos before day traders find the day’s “true” bottom. This fucker will continue to get propped up during impeachment talks.
2019-11-19 00:54:32,GatorMD12,-6,"[https://www.youtube.com/watch?v=-OzWJzScONo](https://www.youtube.com/watch?v=-OzWJzScONo) 

perfect GF for u autists."
2019-11-19 00:53:14,chandler2020,2,So roku puts at open?
2019-11-19 00:52:00,oriolesa,11,"Made some nice tendies today from F🅱 calls

https://imgur.com/kyi0aj0"
2019-11-19 00:51:10,boohooboi,3,These fucking pj traders shorting roku when the share issuance was known all along..
2019-11-19 00:51:04,lordofthecarpet,2,"I hate to make fun of looks but man does [Oprah look like a guy doing Oprah drag, and not a particularity good one.](https://imgur.com/a/HFXEOhk)

Is the oprah empire public? Puts on that shit."
2019-11-19 00:50:27,,3,DIS 150 calls exp 12/20 are still mighty cheap
2019-11-19 00:49:57,tendiezinmydckies,6,In few hours futures will be at 3150 children do not worry
2019-11-19 00:49:15,APHAbaghodler,0,"Finally some red, die die die die die motherfucker."
2019-11-19 00:47:57,Frijolesenyourmouth,6,"I want to see SPY $0.79 EOY....
Not a typo.

MM's have dry penises"
2019-11-19 00:47:04,flowkingfresh,13,"Tomorrow is an impeachment hearing, trumps gonna do what’s he’s done every impeachment hearing, pump the markets."
2019-11-19 00:45:11,small_root,38,"If you told me last month I could buy calls every fucking day and just print money, I'd probably run you over with my car."
2019-11-19 00:44:51,,2,Snapchat me pics of ur winker
2019-11-19 00:37:57,realister,3,All in puts boys lets go it just can’t go up forever.
2019-11-19 00:37:36,Howtoshortdow,3,TVIX guy did you sell? I’d at least hold until christmas
2019-11-19 00:37:29,WallStreetBitch,6,PTON is the new meme stock? 🤔
2019-11-19 00:37:07,needmorecoffeeplz,6,AMD to earths core tomorrow?? Please??
2019-11-19 00:35:35,knotswag,9,"After the recession I'm going to join theta gang. They all just seem so chill, like they're smoking herb. That herb, of course, being the green from the premiums we give them."
2019-11-19 00:35:30,,7,"🎖🐻🎖

Fuq ur calls 👊🏻 

Tonight / tomorrow is for 34, 50, 100, 200 spy puts gang and 100k AMZN puts guy

🔥🔥🔥🐖🐖🐖🔥🔥🔥

Can’t wait for you little piggies to burn."
2019-11-19 00:33:18,bluen,4,"I need some event driven volatility

kno wat im sayin"
2019-11-19 00:32:45,PunchingYourSalad,4,"Calling it now: tomorrow opens moderately red, bleeds up into green territory for a little bit and then we end mildly red. Green inverted hammer as the daily candle. Hong Kong is acting scary. This market is ready for a correction. I'm holding UVXY calls with an iron fist."
2019-11-19 00:32:39,flowkingfresh,7,What if spy hits 330 EOY 😳😳😳
2019-11-19 00:32:17,orygunmane,3,"Imagine thinking you’re going to get rich from “investing” in a company that sells a product at a shittier margin than Jeff, your chronically unemployed neighbor who just got out of the hospital because he wanted to try “chicken sushi” on an acid trip.

Weed stocks."
2019-11-19 00:29:45,chaney3,1,Hey does anyone have the copy pasta of the guy with his algorithms and Sharpe ratios? I just went over my entire liked history from the past 6 months and could not find it. Please I'm desperate here.
2019-11-19 00:29:16,deposit_reg,8,"**Bear**ely any mention of red futures in this thread. I guess autists finally learned that this shit gets instantly bought up at open and stonks only go up.  

Only took two months to pick up on that 👏"
2019-11-19 00:28:39,noimthedudeman,1,Can someone tell me what’s going on with ROKU???
2019-11-19 00:27:39,Georgex2inthejungle,0,"just tryna kiss my dad on the lips 😪😪😪

feeling: horny"
2019-11-19 00:27:32,Gaston44,1,i just want to be flat for a few more weeks so we can consolidate around 310 and build towards the next leg higher
2019-11-19 00:27:23,KramaChameleon,1,Thinking of going long on CPRT for investment purposes ONLY!  I’m gonna be a star!
2019-11-19 00:26:57,Argent_,6,Why the FUCK is SPY so FUCKING STRONG. FUCK
2019-11-19 00:24:47,NotEnoughCashStranga,5,"Fuck AMD and fuck SPY. My puts are bleeding like a bitch in heat.

Edit: Sue Bae can suck my dick"
2019-11-19 00:24:10,SVXYstinks,2,How low will weed go? Looking to possibly start getting some longer dated calls and just hedge with fd puts.
2019-11-19 00:22:59,KramaChameleon,1,Stupid ass BMY 65C 1/17 making my hands weak as shit today.  Now the real question is do I buy more on the dip?  Plenty of time still.
2019-11-19 00:22:22,EienShinwa,2,"How fucking high will SPY go, jesus FUCK"
2019-11-19 00:22:13,AvgSizedPenis,1,Cigna up $3 ah?
2019-11-19 00:20:37,follow-spy,3,"So after all the abuse,  Powell takes the invite from Donnie for a makeup kissing session ? 👄"
2019-11-19 00:19:57,SVXYstinks,7,Imagine buying calls at these levels
2019-11-19 00:18:41,WilliamNyeTho,2,"has anyone tried finding a threshold of VIX below which its super profitable to buy weekly spy calls, and if so, how far otm and percentage of portfolio has been optimal so far including the times you lose the principal???"
2019-11-19 00:18:18,gigantoir,2,"Stadia is trash GOOGL puts to the moon

https://twitter.com/genepark/status/1196488999524802562?s=21"
2019-11-19 00:17:23,DoesntUnderstandJoke,6,I wanna go long Pocahontas
2019-11-19 00:16:29,Submittomemeow,2,Does the market go downwards on Tuesdays then back up Wednesdays? Is that the pattern?
2019-11-19 00:14:44,Rile_x99,3,"Wow ROKU taking a hit, knew it would come but not this soon!"
2019-11-19 00:11:58,Midgetfarm,3,So my morning routine is to stop by this fast food place. The owner double vaccinates all his kids so theyre all autistic. He hires adult autists as a form of charity. This one employee who either works the cash or cleans the bathroom. Always tries to give me investment advice when I order or stares at my cock in the bathroom. I've complained dozens of times but the management doesnt seem to care. What do??
2019-11-19 00:10:40,Not_reddits,1,What happened to mango??
2019-11-19 00:09:45,oriolesa,4,"Futures traders selling off again, what a surprise."
2019-11-19 00:08:17,,3,I took a few weeks off from trading and came back to SPY $311. Holy fucking shit.
2019-11-19 00:07:32,woopsiepoopsie69,3,SPY 312 calls exp this Friday
2019-11-19 00:05:30,Kakilli_,3,"I'm obviously retarded, but the shares being sold aren't even by Roku. They don't get any of the proceeds. It's a bunch of funds selling like 570k shares. This is either a sick fucking dip or this shit is going back down to the 130s. Im betting on a dip all in Roku  11/22 170 calls."
2019-11-19 00:04:42,APHAbaghodler,3,"Yes, of **course** i bought APHA calls today.."
2019-11-19 00:04:17,WACS_On,1,Anyone know why $PLUG has been on an elevator the past week?
2019-11-19 00:03:16,fairygame1028,6,Watching the weedstonks meltdown is worth the admission of my $3000 loss lol
2019-11-19 00:03:04,Phurionyx,1,Scratching previous idea of selling covered calls on inverse ETFs. Going to open some vertical spreads on AMZN I think
2019-11-19 00:02:10,VacationLover1,13,I have an armored truck scheduled to come to my house tomorrow morning at 8:45am because my puts are gonna print in the morning
2019-11-19 00:01:49,captls7,1,"BILI: Expected EPS -0.14, Actual -0.15, it's gonna tank or what"
2019-11-18 23:59:49,TheHamburgler8D,1,So you think she’ll go down if I put some money down on her?
2019-11-18 23:59:03,thesillyshow,2,Thoughts on Tesla Nov 22nd 387.50c
2019-11-18 23:56:57,TheHamburgler8D,2,Edit
2019-11-18 23:56:49,IRPhysicist,3,Argh. Me ROKU tendies!
2019-11-18 23:56:26,KramaChameleon,3,ACB were perfect today sold my puts today! SNAP also perfect today.  I might even get me a high life tallboy. StockTradingGoingWell.exe
2019-11-18 23:56:21,KanyeLetMeFinish,2,I'll sell the Friday ROKU puts I bought today and hit McDonald's for lunch.
2019-11-18 23:52:55,AfroSWE,6,Yo guys yes or no we will get a random 3am tradetalksgoing well pump on /ES
2019-11-18 23:51:34,Waltzer999,1,Anyone else expected BILI to have negative ER response?
2019-11-18 23:50:51,deposit_reg,23,">ServiceNow stock up 4% on news it is joining the S&P 500, replaces Celgene

The year is 2022. Trade talks are going well. S&P 500 is composed entirely of tech companies."
2019-11-18 23:49:53,Amadon29,1,"I went from up $540 to up $3 on my VPU calls in 2 hours... I still think it's going up soon, but I wish I had just sold them and then bought them again"
2019-11-18 23:49:50,leomeng,2,SBUX and CORV
2019-11-18 23:49:19,uninfinity,2,Pajama traders shorting futures AGAIN 🤪
2019-11-18 23:49:10,1completeidiot,3,"Sold a lot of my calls today, so will be watching for re-entries tomorrow. 

Sold all of my  DIS $145c weeklies near high of day 

Sold 1/2 of my SQ $70 12/20 calls up 100%, holding remainder. 

Picked up some weekly MSFT $150, up 20% there"
2019-11-18 23:47:23,snowdaruma,1,Yo anyone else on the AMZN call train? No bears allowed
2019-11-18 23:45:09,HourPackage,2,Tomorrow I will try to sell some more TGT FD puts.
2019-11-18 23:43:57,,1,Hong Kong is gonna print for bears
2019-11-18 23:43:37,AtypicalGuido,2,"Damn, was there some roku news or just typical bouncing. Went +20% to -50% in last few minutes"
2019-11-18 23:43:30,HowLongCanIMakeAName,6,30 years ago people had to wait for the new sears catalog just to see some cleavage and now we can 3D print waifus. Amazing
2019-11-18 23:42:46,winkerpack,4,$F gang where you at? I picked up some 2020 yolos
2019-11-18 23:40:51,AfroSWE,4,I wonder what the overnight pump will be this time
2019-11-18 23:38:37,actuarial_defender,2,I know the second I re buy AMD calls it’s tanking
2019-11-18 23:38:36,zebrawaterfall,2,"[My plays for tomorrow...](https://ibb.co/bHz2WTm)

HD and ARMK looking very promising for tomorrow morning. Hoping for a nice reverse guh.

Longer plays on some power movers. Big hopes on LULU murdering their earnings in Dec. 

Playing earnings is so fun 🐂"
2019-11-18 23:37:53,Cody6781,2,"Riding out some solid puts on CHWY, and I have a couple of YOLO's including calls on GPRO. ""It was just at 4.50, it could be there again by the end of the week right?"""
2019-11-18 23:36:46,NickHalden310,2,Is Bili gonna do anything?
2019-11-18 23:36:03,WhyBuyWhy,1,"Puts: 

Cvna 
Roku


Calls:

QSR 
McD 
Bidu 
Ulta 
Stz"
2019-11-18 23:34:09,TheHamburgler8D,3,Where is yandex heading? My thought is it could go up or down.
2019-11-18 23:34:00,greentea45,6,"Honestly, I think people are predicting doomsday trump-powell meeting... but its probably not the case...

I think that Trump probably won't raise tariffs, and that into the election he needs to make it seem that trade tensions are
going down. He needs to probably get the phase 1 deal in by December, and start getting phase 2 ""underway"" as the
election heats up. That way he can brag about phase 1 deal during his tour. There's no way not getting a deal
is going to look good for his election, which is why I doubt he'll go ""no deal"" in december. he doesn't have much
to lose by getting a deal, even if its a crappy one, he can just say 'theres more to come' in phase 2, and phase 
2 could never show up

probably he needs assurance from Powell though, that he's not going to raise rates if the trade outlook gets better.
possibly he asked Powell to wait until AFTER the election to consider any rate increases, and that once he gets
elected, Powell can raise rates as much as he wants"
2019-11-18 23:33:16,winkerpack,4,"Fall/winter drink power rankings 

Hot Chocolate 

Eggnog

Apple cider"
2019-11-18 23:32:38,CXRealTimeVOD,0,"HI, ITS ME"
2019-11-18 23:32:34,AllAboutTheSPY,1,"$BABA calls all day!!

Going to put another 2-3k down on 195-200 calls expiring 11/29-Dec 20 while East vs West institutional investors fight it out to set the HK price per share."
2019-11-18 23:32:24,BrendanIsThrew,8,Mango had an unannounced visit to the hospital over the weekend and the White House explanation was for a physical...one that could have been done at the White House. Trump and Powell met so Trump could give him a heads up that Trump's got some horrible disease and to be prepared for economic chaos when it leaks out
