date,author,score,body
2019-11-18 21:24:45,Professor_Squiggles,4,wake up and pray to the home depot gods
2019-11-18 21:24:25,1TrickJhin,3,104% on my PTON calls. not selling anytime soon
2019-11-18 21:24:25,Disada1,6,"Short $PTON, what a dumpster fire"
2019-11-18 21:23:52,MostlyKelp,6,What's this 7pm BILI annnouncement bs? I want to know their earnings now!!!
2019-11-18 21:23:16,TwoTwinOps,2,One last yolo on my account for plug power 🔌
2019-11-18 21:22:31,,2,Keep holding steady with my puts through the roku short squeeze
2019-11-18 21:22:24,TimaaaY142,2,I bought the dip.... if this thing don’t go green ima beat the shit out of my meat!
2019-11-18 21:21:25,Money_Turtle,5,"Added 60 Dec 27 39P to my AMD position. 

I think short term down, long term up."
2019-11-18 21:21:15,ISICKNEWTON,4,Drill Team 6 is still training for the big day
2019-11-18 21:21:00,kotdbt,1,Dec 20 VSLR Calls at $7 and Dec 20 CYTK Calls at $9.
2019-11-18 21:20:53,Kennyjoon,6,I capitulated when we passed 302. How are people here still burning their money
2019-11-18 21:20:51,knotswag,4,"**Magical Crayons TA.** Flatter than Keira Knightley. No change in bullish projections. Futures also trading strongly. Proceed as planned tomorrow.

The only concern, as I mentioned last week, is whether Congress can successfully kick the can on funding. Progress was made today and the bill is expected to be passed by the House on Tuesday. Due date is by Thursday to avoid shutdown. If I hear no positive news on Wednesday about the status of the bill I may get a small hedge as there's little room for error and Trump can choose not to sign it.

Otherwise, have fun with your tendies you animals."
2019-11-18 21:20:04,Cnastydawg,4,Watch my DBX calls hover around $19 for the next 3 weeks until the last day for them to go ITM just to piss me off
2019-11-18 21:19:57,JaJaJalisco,2,look out guys.  I'm going all in on AMD calls tomorrow.
2019-11-18 21:19:47,ProOrlando,3,We are going to gap down 2% one day coming very soon.
2019-11-18 21:19:34,CovfefeWithSugar,7,I bought spy and msft calls because I'm a basic bitch. We going green tomorrow or are we going to have a fake red day when everyone can load up on calls before a big green day?
2019-11-18 21:19:22,warren_buffoon,16,"I'm gonna start a trading chat room so exclusive that not even I will be in it. Basic package only $500/mo. Pro package $650/mo, includes photos of my dog"
2019-11-18 21:19:07,bruins2214,1,"Kohl’s puts , let’s goooooo"
2019-11-18 21:18:40,hvc801,2,"This shit is going to keep running. Spy red most of the day? Buy and 3:50, WE GOT OUR 3:58 RALLY'S BACK BOYS."
2019-11-18 21:18:31,hawowah,4,Not going to even look at the market tomorrow until 3:00pm or later. That way what’s left of my puts can die peacefully.
2019-11-18 21:18:11,ch1p_skylark,1," [https://twitter.com/cmarinucci/status/1196454039585615872](https://twitter.com/cmarinucci/status/1196454039585615872) 

long"
2019-11-18 21:16:57,toshi_g,5,🎯🎯 better have a green day tomorrow
2019-11-18 21:16:39,Th3_Capitalist,4,"Coming soon to a natural history museum near you -  the late, once great species was classified as extinct today. RIP Bears."
2019-11-18 21:16:35,EcinEdud,5,"Okay so now that the recession and dip is out of the way, we can moon tomorrow!!! 315 EOD"
2019-11-18 21:16:13,Swurlington,2,"I caught the big 🌈
 I joined theta gang"
2019-11-18 21:15:49,Midgetfarm,1,Did powell sucki sucki mango today
2019-11-18 21:15:37,greentea45,2,"Will IWM/Russell finally break out tommorow, or continue being lame and stay in the same damn range..."
2019-11-18 21:14:43,MakeoverBelly,6,"Watching my PTON calls do their magic.

Who's on the tendie train?"
2019-11-18 21:14:16,Andyh10s,1,Holding half my ACB Puts. Kohl’s calls and Disney puts
2019-11-18 21:14:02,Th3_Capitalist,7,$SPY 12/20 $320 calls
2019-11-18 21:13:29,omgroki,9,Stop trading options
2019-11-18 21:13:25,vanadios,6,Who is the designer of the WSB banners? Very talented I would say.
2019-11-18 21:13:18,PuzzledJournalist212,1,"Guh damn, on point with the new thread"
2019-11-18 21:12:50,Droidvoid,2,Almost perfectly flat and uneventful day when looking at the broader market. Signs of strength still seen in the semis so that’s bullish for the overall market
2019-11-18 21:12:47,3fishinatree,4,Made like 80% off of my HD calls. Sold before close. Wish I had bought more of those rather than FOMOing into DIS at the top last week and riding calls down 😞
2019-11-18 21:12:43,flowkingfresh,2,Who bought BILI
2019-11-18 21:12:35,karlaxel2,2,Automod is a loser
2019-11-18 21:12:33,iliveforedm,11,KRTX tendies 🤗  https://imgur.com/a/kTEjkr5
2019-11-18 21:12:17,lowkeyifuxwithjuice,10,"Bought a google call for tomorrow that’s about it. Down $200 today no biggie though Monday’s usually trash for me.


Time to go do some fucking chest I’ll post a physique update for my real nibbas after💯"
2019-11-18 21:12:12,CadburyChocolateEggs,1,"OH MY GOD SHUT THE FUCK UP ABOUT POLITICS ALREADY


ITS FUCKING MONDAY, YOU HAD ALL WEEKEND TO BITCH ABOUT THE DEMOCRATS PLEASE PLEASE STOP

FUCK COWORKERS"
2019-11-18 21:11:37,ATastyGrape,1,"Automod actually sticky -ed, good job dongus"
2019-11-18 21:11:09,SVXYstinks,23,"2018 market bottom: “ALL I BUY IS PUTS!”

2019 market top: “STONKS ONLY GO UP!”"
2019-11-18 21:10:52,Asswad123,2,COTY the new $becky queen.
2019-11-18 21:10:42,23therealme23,8,Sold Mickey around highs. Loaded back up at EOD.
2019-11-18 21:10:40,Fuzea,7,"Anyone catch that V EOD recovery? My put credit spreads were happy to see that, I'm thinking we see continuation on that tomorrow, try to test 181 again. Interesting range on V that we have currently. Tightening range and we should see breakout soon."
2019-11-18 21:10:21,Shiftz,2,Goog pump 3% tomorrow
2019-11-18 21:10:10,Beyond_Duality,3,"So class what have we learned in 2019?👨🏻‍💼

STOCKS ONLY GO UP!👩🏼‍🎓"
2019-11-18 21:09:48,DJRenzor,1,Mad cause AYX couldn't hold 100
2019-11-18 21:09:41,cpgupta561,2,"props to /u/EHobby93 and some of the other folks giving tips on weed stock puts

Wish I had the guts to buy over a week ago back when things were 25% higher and even more profits to be made, but I'm up 20-24k and thankful for the tip.

I may continue with buying back into puts on ACB later in the week, maybe after Wednesday's house bill on fed legalization happens. I feel like it wasn't selling off below 2.30 much today, though CGC still has lots of room to fall imo

Will buy back in Wednesday and hold 11/29 2.5P to profit off the inevitable Monday selloff from the new debt converted shareholders that want their money out of this soon to be bankrupt company"
2019-11-18 21:09:30,ZombieAbeVigoda,2,Keep watching $AMD make me regret selling at $35
2019-11-18 21:09:27,Worldtrekka,3,Prayin' to turkey jesus for AMD to break $40 and have plenty of tendies for Christmas shopping
2019-11-18 21:09:26,MonkeyFishy,1,Do blow off a hooker's ass while I watch TGT ($BECKY) run up to earnings. Sell before the bell. Keep watching SPY print tendies. BTFD. The usual.
2019-11-18 21:09:02,captls7,3,ride on TGT sell before earnings and hope Mickey doesn't fuck me
2019-11-18 21:08:42,djexit,2,dis printing
2019-11-18 21:08:17,CAPSLOCK44,3,Pray that TGT decides to shut it’s doors because Walmart is clearly the superior store.
2019-11-18 21:08:11,Chrysopa_Perla,1,[Draftscapes.com](http://Draftscapes.com)
2019-11-18 21:07:56,Asswad123,1,Regret not taking the morning profit on WMT.
2019-11-18 21:07:55,Brosiah_,3,Whatch my putfolio decrease in value again.
2019-11-18 21:07:54,Keatwan,3,Hopefully TGT pulls through and earns me some tendies in the coming days... took a fat L today
2019-11-18 21:07:45,Jimtonicc,1,13th!
2019-11-18 21:07:42,,28,"Well bears, you ALMOST had a red day.

Almost."
2019-11-18 21:07:20,LessThanCleverName,4,"If it still managed to finish green on a TradeTalksGoingPoorly.exe day, what’s going to happen when TradeTalksGoingWell gets rebooted?"
2019-11-18 21:06:43,ThotianaPolice,3,Daily prayer to Lisa Su
2019-11-18 21:06:15,sarinis94,1,CUB expecting high earnings on Wednesday. Buying $80 calls.
2019-11-18 21:06:09,Petroselinum_,17,Calls on any and every dip. Works until it doesn’t. BTFD.
2019-11-18 21:05:55,warren_buffoon,1,so I bet on $HD again
2019-11-18 21:05:50,IfImHereWhosThere,3,PDT finally unlocked and getting rammed by the market
2019-11-18 21:05:40,DillonMeSoftly,2,Spy with the last minute boner as per tradition
2019-11-18 21:05:34,thecashcow-,1,Hopefully Make Money
2019-11-18 21:05:27,ethereumkid,2,"$FIT puts might actually be in the money soon.

Got some $6.5P for 12/6."
2019-11-18 21:05:23,VacationLover1,15,Today was my first day as an intern working at SPY.. **AMA**
2019-11-18 21:05:21,wxmanz,4,Crying
2019-11-18 21:05:09,hvc801,2,YERRRR
2019-11-18 21:05:02,ISICKNEWTON,1,I time things
