date,author,score,body
2019-11-19 19:16:00,thesillyshow,1,Visa to strong
2019-11-19 17:17:42,asml84,1,"Are there upcoming tesla news this week? My 400 short calls (exp. 11/22) move against me, how are they still worth so much at this point?"
2019-11-19 16:16:40,DrUNC83,1,CHWY calls I got this AM up 75%
2019-11-19 15:45:37,thesillyshow,1,Let’s go Visa!
2019-11-19 13:58:32,ch1p_skylark,1,so TGT is just gona keep dying
2019-11-19 12:27:39,heavenlyblues,2,Snap calls gonna run wild today
2019-11-19 11:54:49,digitalradiohead,2,$mdt beat and raise. muted response so far
2019-11-19 11:46:57,ozone63,1,"What's the ""good news"" this time? Why are futures fucking green again?"
2019-11-19 11:28:29,,2,AMZN $1770 call for Dec 6. Lets go!
2019-11-19 11:13:37,njeezyatx,3,Good morning. Time for Kohl’s to tank.
2019-11-19 11:04:56,AfroSWE,3,OOOF HD
2019-11-19 11:03:26,digitalradiohead,3,Home dept.....guh
2019-11-19 11:00:34,danieell,1,"If BABA HK listing is over subscribed, does that mean US shares will pop?"
2019-11-19 10:58:56,MrBleepBleep,1,"Good morning 🌻

What's for breakfast 🍽️"
2019-11-19 10:58:41,lowkeyifuxwithjuice,2,Good fucking morning nibba please don’t test me I’ve got calls homie 💯💯💯💯
2019-11-19 10:47:47,SmallPotGuest,1,people at r/amd_stock selling yesterday at 39.99 and buying today at 41.00
2019-11-19 10:43:25,Mumbolian,6,The FOMO on AMD is so bad right now.
2019-11-19 10:38:57,AfroSWE,7,"Central banks around the world are pumping liquidity into the system and wsb is still net short, really amazing when you think about it"
2019-11-19 10:38:24,,1,https://reddit.com/r/wallstreetbets/comments/dy1s47/_/f7z5bj4/?context=1 I wonder if he listened to me
2019-11-19 10:32:20,,2,Holy shit my 3128 target last night was just a meme I swear wtf did I do
2019-11-19 10:30:47,ch1p_skylark,5," [https://twitter.com/Amdalleq/status/1196721465032237056](https://twitter.com/Amdalleq/status/1196721465032237056) 

everything is fine just buy calls retards"
2019-11-19 10:28:57,danieell,1,"In all seriousness, if we open at 313 when do we start buying VIX calls (does anyone even do shares?)"
2019-11-19 10:27:09,winkerpack,2,"My trigger finger itchin', Palms itchin' too

We back-to-back in ghosts, playin' peek-a-boo

We went to war with Sosa over a brick or two

So for a hundred ki's, think what my clique could do

I'm talkin' clappin' toasts, bullets 'll hit your roof

They hit his body he went in shock, no Pikachu"
2019-11-19 10:17:42,DiprotodonGang,6,"🇨🇳 #China's central bank boosts liquidity via reverse repos, treasury deposits - Xinhua


PBoC pumped 170 billion yuan (about 24.86 billion U.S. dollars) into the interbank system Tuesday
*Link: bit.ly/2rSZNpT"
2019-11-19 10:15:53,long_AMZN,6,"\*PBOC SAYS TO STEP UP COUNTER-CYCLICAL ADJUSTMENT

\*PBOC SAYS CHINA TO CONTINUE PRUDENT MONETARY POLICY

\*PBOC HOLDS SYMPOSIUM ON CURRENCY, CREDIT SITUATION TUESDAY

\*PBOC SAYS DOWNWARD PRESSURE ON ECONOMY KEEPS INCREASING

\*PBOC SAYS TO BOOST BANKS' ABILITY TO SUPPLY CREDIT"
2019-11-19 10:03:43,OrificeOfOmaha,1,VXX reverse split when?
2019-11-19 09:57:40,log_gi,3,Why are we mooning?
2019-11-19 09:57:00,TimaaaY142,3,"Are we gonna climb up all day or are we crashing 30 min in... holding some 313c 11/20, should I get rid of them right away or wait.. fucking man can't sleep"
2019-11-19 09:55:07,digitalradiohead,3,Let calls ride guys. The easy policy may not effect the real economy but it does inflate asset prices. This could go on for at least the rest of the year.
2019-11-19 09:54:50,PrestigeWWinc,1,SPY over $313
2019-11-19 09:52:34,EcinEdud,1,**Futures** can you do ***this*** soon:  [https://www.youtube.com/watch?v=IxGvm6btP1A](https://www.youtube.com/watch?v=IxGvm6btP1A)
2019-11-19 09:50:05,winkerpack,1,Anyone wanna see it? ☺️
2019-11-19 09:49:13,aqualityusername,1,Alex play firework - Katy Perry
2019-11-19 09:46:44,OrificeOfOmaha,5,AMD at 40.17 in pre market
2019-11-19 09:38:31,ch1psky1ark,3,Why did nobody tell me Evan Spiegel's sister is doing ASMR. Easily the most important news of 2019 and I almost missed it. Disappointed in all of you.
2019-11-19 09:36:58,EcinEdud,3,ok so when is futures fading
2019-11-19 09:34:15,uninfinity,2,"Was up on CMG call today and panic sold at open to ensure I get the measly $40 profit, only to see it moon and missed out on $900 profit.

Got OLED call and was up $50 but wanted to hold it for higher profit, it reversed and now I am down $90 on it.

ALWAYS happens, when you sell early it moons and when you hold, it tanks..."
2019-11-19 09:31:34,uninfinity,1,"*China is reportedly scrutinising a US bid for China Chipmaker Control, according to sources*

*Chinese private firms now ""shun"" the US in their overseas investment, and generally prefer a home listing to a US IPO, says China's Global Times*"
2019-11-19 09:27:06,aqualityusername,1,My TVIX bag 💼 is in danger 🚨
2019-11-19 09:19:37,ch1p_skylark,7,"I can see why you boys like Joker so much, it's literally the story of a WSB retard finally snapping"
2019-11-19 09:06:45,Shiftz,7,If Goog hits 1340 today I’ll buy 20 gold for people
2019-11-19 09:06:42,ch1p_skylark,4,Markets open and mooning
2019-11-19 09:04:46,Twitchys33,7,"I get the same feeling from the market currently as when I do roulette. surely black cant hit 10 times in a row.. all in red.. surely it cant hit 11 times in a row? lend me some money. Ah shit..
replace black with call options.."
2019-11-19 08:57:25,CommanderInTweet,2,Tomorrow is going to be another game of do I take profit off these options and get mad when I see how much more I could have gotten or hold in hopes of getting more and watch them fade away
2019-11-19 08:52:26,danieell,2,SPY put credit spreads are free money
2019-11-19 08:43:36,iliveforedm,1,Man I really wanna switch from IB but ToS is confusing af and the mobile app is absolutely horrendous. Might give Fidelity a try.
2019-11-19 08:43:22,sproutsatoshi,1,14 ITM ACB 1.50 strike calls
2019-11-19 08:42:36,Analslammer,2,"Update. Fucking flight was cancelled. Father's at the home airport not even seeing it on the board. Customer service told me to get fucked and they won't comp me anything because it's not showing up on their system. Like holy fuck. I've got the ticket why's it gotta be in your system.

Gotta call a customer service line at 8am and you already know that they're gonna say the same shit.

Well its not showing up in our system.... 

Holy shit boys. Short $alk"
2019-11-19 08:28:27,Shiftz,2,"Big green, hope Goog pops"
2019-11-19 08:23:12,CallawaySS,1,"Eli5, what exactly did the astros do? And how did it give them an advantage?"
2019-11-19 08:22:09,zeddknite,2,"Well, there's 50% of the price move that happens today probably."
2019-11-19 08:21:43,aqualityusername,4,"Woke up to no hot water in my apartment building. Landlord say we will be compensated, let’s save us both the hassle plz make the check out to ToS"
2019-11-19 08:18:19,,5,Picking up some long dated Mcd calls at the open
2019-11-19 08:16:36,docstock1989,3,Girls what’s should I yolo 50k in?
2019-11-19 08:04:20,whitestansmith,3,"Next think you know: Trump tweets about HK, Xi rages and the trade talk gets scrapped

Probably won’t happen but you never know"
2019-11-19 07:58:10,nfa1234,13,"Buying Wal-Mart puts.  Had a bad experience at Wal-Mart just now, my cars battery had died so I asked this dude if he would help me jump start it.  The dude literally pissed himself in front of me and started begging me not to hurt him or rob him but he wouldn't mind being raped though.  Too weird.  I ended up asking some boomer in a truck to help me and he knew his shit.  Too many weirdos out there. With all these weirdos in the parking lot people won't go to their stores.  Buy Amzn sell Wal-Mart"
2019-11-19 07:49:25,aim5455,2,"These futures are just going to fade once the fucking Brits start shorting, innit?"
2019-11-19 07:48:49,henhaller,4,I need my tendies to get hair transplants. Any recommendations?
2019-11-19 07:48:13,,3,Just saw a commercial for Robinhood lmao
2019-11-19 07:48:07,ch1p_skylark,1,"We're all gona die soon

 [https://twitter.com/CoveringDelta/status/1196491222765965314](https://twitter.com/CoveringDelta/status/1196491222765965314) 

Time to yolo even harder"
2019-11-19 07:45:24,Treecrust,3,Looking at futures turned me gay
2019-11-19 07:43:37,Asswad123,1,Anyone have a theragun? Afraid my wife will turn it into a dildo if I get one for her for Christmas.
2019-11-19 07:38:55,ch1p_skylark,7,Blood green futures. ROKU gonna continue moon mission
2019-11-19 07:37:12,DaSmartGenius,1,My fucking puts about to get ravaged again tomorrow. This some gayness
2019-11-19 07:36:45,aqualityusername,7,What if we kissed 💋 under the yield curve 🙈
2019-11-19 07:28:36,Analslammer,4,Flight delayed at the airport. Gonna be going right from pdx to work here in a couple hours. God damn guys
2019-11-19 07:25:12,winkerpack,4,"Would you rather be on your knees in the middle of nyc at 3am and have to keep your mouth open and eyes closed for an hour

Or

Spend the night with L2FMW in his bed but nude and facing away from him."
2019-11-19 07:20:25,dungbat83,1,Damn Mina Chang 🔥🔥
2019-11-19 07:19:19,49Ikey,1,Ride nflx
2019-11-19 07:17:17,TheWolfofWallStreet1,3,Calls on MO (ticker for moon... I think)
2019-11-19 07:14:05,sola_rpi,3,Too scared to buy at ath but stonks only go up
2019-11-19 07:07:54,Droidvoid,3,I low key just want this market to either moon like 2% or drop like 3% so I can watch the chaos that ensues on here.. #cashgang 💵 💷 💰
2019-11-19 07:05:13,Charlietango2007,3,"I bought some puts for Macy's, now I'm having second thoughts. Any info on this?"
2019-11-19 07:00:50,zendraven,4,I remember when 310 was a pipe dream
2019-11-19 06:57:14,winkerpack,4,"Just gave a guy a jump in WMT parking lot.  Was 20% worried I was going to get jumped.  Had tear drop tats looking scrangly af in isolated part of WM parking lot at near 2am
 
But your boi said yeet I can handle myself if this 🅱️oi wants to try me 😤😤😤"
2019-11-19 06:50:22,flexman100,2,Spy to 313 🔥
2019-11-19 06:46:01,SmallPotGuest,-19,Trump rushed to the hospital. Watch out this week as I bet as soon as he dies the chinese say fuck the trade deal.
2019-11-19 06:42:49,mrperfect6ie,6,All in on TGT
2019-11-19 06:38:02,flexman100,1,SPY 313 c 11/18. Sell at open?
2019-11-19 06:34:43,TSONS1,1,🐂🔜🐻
2019-11-19 06:22:01,whitestansmith,2,Is AMAT where it’s at?
2019-11-19 06:21:53,visionarymind,6,"TGT🎯

☝️ 🔞®️ 👇"
2019-11-19 06:21:00,oregon_forever,2,Germans woke up so now futures will rally even further.
2019-11-19 06:19:17,Georgex2inthejungle,4,"My butthole muscle just twitched

Feeling: surprised, longing"
2019-11-19 06:18:47,ayysilver,-14,"psst...can I tell you guys a secret? I only buy shares, no options"
2019-11-19 06:16:44,knotswag,3,Alright why didn't you shitheads warn the rest of us about KRTX? I thought we were friends.
2019-11-19 06:11:39,,4,I’m tired of being cash gang. Lemme jump into the deep end with you guys who have arm floaties
2019-11-19 06:04:44,dungbat83,5,Hmm why gold and silver getting big green bars?
2019-11-19 06:04:24,KimchiFitness,6,"On the verge of losing my job, on top of being deep red in my investing

$rope looking really good these days"
2019-11-19 05:57:45,greentea45,5,Lol wtf is going on with HSI. China manipulation couldn't be more blatant
2019-11-19 05:56:58,warren_buffoon,3,"Now what you know about a $SPY FD, at the 313

None of these trades you bout to see come free

So you wanna get some sweet FDs, you gotta buy from me

If you ever want some tendies see"
2019-11-19 05:56:32,winkerpack,-4,"Well, I guess it would be nice if I could touch your body

I know not everybody has got a body like you

But I gotta think twice before I give my heart away

And I know all the games you play because I played them, too"
2019-11-19 05:53:32,Shmokesshweed,7,"Bruh how do I always get matched to someone with 10000000 ping in FIFA, WHAT THE FUCK

SHORT EA"
2019-11-19 05:53:08,Vikman007,6,Lmaoooo AMD with that sexy 211 PE ratio
2019-11-19 05:51:14,BluApex,1,Another chart monkey wanna tell me why TEO isn't gonna bounce off all this divergence?
2019-11-19 05:49:36,greentea45,4,"> China's top legislature said HK High Court's ruling on anti-mask law is inconsistent with the Basic Law, emphasizing only NPC Standing Committee can judge&decide whether a law of the HKSAR is inconformity with the Basic Law.The statement is an important move to clarify confusion.

So much for ""one country two systems""

sounds more like ""one country one system"" to me"
2019-11-19 05:43:04,Phurionyx,2,Can’t open vert spreads on ToS cause I’m too poor apparently. Hopefully if I call and ask nicely and tell them I’ll never open a spread that exceeds my personal risk tolerance (max loss exceeding my cash balance) they will upgrade my account
2019-11-19 05:41:24,JaeRex,2,"I hate working market hours, I need a job where I get off work at 8:30 eastern."
2019-11-19 05:34:33,Deezkicks,5,Amrn better not cuck me again
2019-11-19 05:26:02,ayysilver,-13,Here I thought this was a PC friendly sub. Shame on this subreddits new banner and the cultural appropriation it represents.
2019-11-19 05:06:04,HowToBeARedditor,1,Pound $DTIL & $MOD heavy
2019-11-19 05:00:24,but-this-one-is-mine,2,What’s the outlook on tesla tomorrow?
2019-11-19 04:59:09,notmichaelou,2,eating shit
2019-11-19 04:57:06,,-4,"SPY will be red the next 2 days guaran fuckin teed

It won't go lower than 308 but anything else is fair game"
2019-11-19 04:57:06,mr_blockchain_,10,"HL3 confirmed

https://www.theverge.com/platform/amp/2019/11/18/20971514/valve-announces-half-life-alyx-its-first-flagship-vr-game"
2019-11-19 04:54:14,Beyond_Duality,8,"In Trumps infinite pump market how are Triple Leveraged tech ETFS like TQQQ not a great idea
🚀🚀🚀"
2019-11-19 04:53:57,henhaller,6,TGT
2019-11-19 04:53:34,textandstage,1,"1 hr GC looks like it’s gonna pop up to 1472, then dip down into the high 1460s"
2019-11-19 04:50:29,yinatom,17,Remember when China was in town and the rumor was they were leaving and futures dropped like 1.2% and we opened green? That really set the tone for the last month huh
2019-11-19 04:49:00,Shmokesshweed,19,"At Arby's eating truethots92's wife's roast beef 

Lmao fuck"
2019-11-19 04:48:10,23therealme23,16,What a time to be alive... Have we ever had a president pump the markets like this? He probably reads WSB.
2019-11-19 04:47:54,bluen,5,I feel like the market is programmed to fuck me no matter what i buy
2019-11-19 04:47:34,GoingforIvey,2,Anyone think China will actually send in the PLA to clean up HK? Probably a huge dip in global markets if so.
2019-11-19 04:43:40,,3,"I bought my roku 11/22 146 puts at 2.00 this morning, averaged down at 0.91

Also bought AMRN 22 puts this morning at 0.22 but took profits already at 0.36

Tomorrow... Holding through another roku short squeeze probably, but I hope we just skip that part and head straight to Act II - the selloff"
2019-11-19 04:43:26,1OneChina,2,Guhhhhhhh
2019-11-19 04:43:23,nadoterisback,1,"Big dick NQ carried futures hard

Put the whole team on it's back tonight

From -0.22% to +0.18%"
2019-11-19 04:40:44,ciderdonutsandcoffee,4,Imagine being a Chargers fan GUUUHHHHH!!!!!
2019-11-19 04:34:43,scroogemcdub,4,"I wrote this on a whiteboard at work in August/September when we were in the mid 290s

https://ibb.co/tDfN6Yy

Actually had to be before 9/20 sometime cause that’s my expiry for silver which woulda sucked unless I extended ithahah and I’ll only ever do 3 weeks or more

Strikes nice dates bad. Now that I look at it. Everything is right though directionary"
2019-11-19 04:29:04,deposit_reg,27,Some retard keeps logging into my Schwab account and making losing trades.
2019-11-19 04:27:46,Midgetfarm,29,^^never ^^trust ^^a ^^white ^^man ^^named ^^jerome
2019-11-19 04:25:38,3fishinatree,12,ban new copypasta
2019-11-19 04:25:24,fecal_destruction,2,"Puts on EEM for this week 

Calendar spread on spy exp nov 22"
2019-11-19 04:22:21,Midgetfarm,1,Mango is yahweh of gold gang
2019-11-19 04:20:56,TheHorizonDawn,9,Guys I heard SPY is going straight to 400. Recession has been canceled and red days are a thing of the past. Thinking of buying SPY 400c expiring next week 🤤
2019-11-19 04:20:47,IS_JOKE_COMRADE,24,Fuck China. Long live the free people of HK
2019-11-19 04:19:56,winkerpack,4,Gf being 19 now has kind of lost some of its charm :/
2019-11-19 04:19:12,love2frymealatwendys,5,Find retard strength get in get out
2019-11-19 04:18:49,mauimikes,6,Too strong a dollar makes all the BECKYS hollar!!! 👌👌👌👌
2019-11-19 04:07:06,YNeverWAlone,2,Is HSI catching up to the US markets or is it setting the pace for the US markets or is it just reacting to rate cuts?
2019-11-19 04:06:42,BennyFlocka,18,"Thanksgiving coming up. Trump knows all families will be together eating and talking shit. He’ll sign the deal before then so we can all talk about the stock market and the boomers 401k’s. 

Trump playing 7D chess ♟"
2019-11-19 04:01:11,bruinthrowaway6969,4,why is Roku -4% after hours?
2019-11-19 04:01:08,Nick_D_123,7,"$TWTR 30C 12/20
""#LetsGooo"""
2019-11-19 03:58:55,whitestansmith,4,Is there even a way to predict when ROKU will stop or is it just some irrational nonsense
2019-11-19 03:58:04,DamSamalouji,5,Thoughts on HD tomorrow?
2019-11-19 03:57:14,VacationLover1,3,"People are already getting their RH cards.. I’m still 40,000 deep in line"
2019-11-19 03:55:58,uninfinity,10,"   \*Trump Says He Told Fed Chair Powell That 'Fed Rate Is Set Too High' Relative to Other Countries   

   \*Trump Tweets That US Rates 'Should Be Lower Than All Others'"
2019-11-19 03:52:13,chessiechoice,4,Real real thoughts?
2019-11-19 03:46:25,MostlyKelp,1,"RH all butt hurt  by shutting down my account since I’m moving to TD ameritrade. I would stay but the inability to close during your shitty opens have cost me around $5k. 
Let me borrow a Joint...Bye, Felicia!"
2019-11-19 03:44:12,,4,1000 SPY 345 C EXP 11/22
2019-11-19 03:43:48,HowLongCanIMakeAName,3,Disappointed I left all my financial and personal information in here earlier and I didn’t get robbed by a SINGLE person. Sad times we’re living in folks
2019-11-19 03:43:35,catapang,2,Thoughts on buying options with unusual activity? Effective/consistent? Or
2019-11-19 03:42:17,digitalradiohead,3,Wm has done basically nothing for a few months but i think it starts to head higher going into year end. Lower beta no china risk. I was thinking of doing itm 110 calls. Anyone else got calls?
2019-11-19 03:40:12,dawhizkid123,6,Can’t wait to get paid to take out a mortgage
2019-11-19 03:39:14,GoatsAndHoes17,6,Donald trump going ham on Twitter
2019-11-19 03:37:45,TheHorizonDawn,21,If SPY drops 10% tomorrow I’ll personally lick the taint of every. single. person. in. this. thread. 🐻
2019-11-19 03:36:43,flowkingfresh,6,If we break above of this 312 range it can go high aF and absolutely have another face ripping rally even tho we are so extended on the RSI... my lines show a resistance here but last time we broke up over then 305 range it ripped up. So if we break through here it could be a massive rally with shorts being squeezed..
2019-11-19 03:36:40,AfroSWE,3,"https://twitter.com/realDonaldTrump/status/1196632739266596865?s=19

Someone tell me how to feel"
2019-11-19 03:36:35,zebrawaterfall,7,"Futures fucking blood green. Might as well go to bed now, nothing to worry about.

💰💰💰💰💰💰💰"
2019-11-19 03:36:13,oshbear,8,"At my meeting with Jay Powell this morning, I protested fact that our Fed Rate is set too high relative to the interest rates of other competitor countries. In fact, our rates should be lower than all others (we are the U.S.). Too strong a Dollar hurting manufacturers & growth!

-Trump"
2019-11-19 03:35:41,IRPhysicist,-1,Puts on DIS due to the hack of Disney+.
2019-11-19 03:35:11,gatoken1,10,"lmao he called him Jay Powell

im fucking dead"
2019-11-19 03:34:11,l_is_for_ludin,3,"SBUX $95 Call strike for January 17, 2020 sell before Q4 earnings"
2019-11-19 03:32:44,DadGoneGamer,4,I think I caught the flu so most likely I’ll be laid up in bed tomorrow watching TGT tank even further ahead of earnings.
2019-11-19 03:31:33,FuckATVI,1,Tell me what to buy my friends
2019-11-19 03:30:39,StuffUlikeAturkey,1,"Lost about $10k roku after hour trading. I’m guessing the sell off was due to the below. So some insider of the company wants to sell off their position is what I take from it. Did something else happen? 

Roku Inc Files For Resale Of Up To 571,459 Shares Of Co's Class A Common Stock By The Selling Stockholders"
2019-11-19 03:30:21,dawhizkid123,5,"Which one of you is this? 

A 23-year-old college student won parlays of $47,000, $53,000, $239,000 and $333,333 in 21 days. We bring you the story of “Parlay Patz”

https://www.actionnetwork.com/news/sports-bettor-wins-huge-parlay-ben-patz-darren-rovell"
2019-11-19 03:29:01,Swissschiess,2,You boys ever consider that CTN could have used his leverage glitch to go up to millions and sell some super far OTM theta gang plays for ER and have made 6 figures almost guaranteed? GUH
2019-11-19 03:28:20,YepRabbit,3,"Phase 1 could sign before Christmas, bigly green tuesday confirmed"
2019-11-19 03:27:27,webulltrade,8,"I've decided to finally just sell all my puts at a loss and add to my call positions. My puts don't expire for another 2 months but at this rate, buying calls is the only way to go. Literally free money."
2019-11-19 03:26:01,sleepyzebra21,2,Am I the only one who has been buying SVXY puts every week for the past month or two? Please tell me there is another idiot out there like me.
2019-11-19 03:25:03,Rebar_Bryant,2,URBN puts maybe?
2019-11-19 03:23:20,SJest,1,Stonks only go up from here
2019-11-19 03:21:24,chaney3,3,/ES candles just crossed over  EMA ribbon. My inability to properly manage risk and follow through with stop losses may have been the right call. Who's laughing now market makers?
2019-11-19 03:19:30,,1,Who broke $FSLY.   Meme stock extraordinaire looking like Disney with this slow crawl ass shit
2019-11-19 03:18:35,gatoken1,5,I dont really listen to post malone but [this](https://youtu.be/wXhTHyIgQ_U) is lit 🔥🔥
2019-11-19 03:18:07,Nomadic_Marvel07,1,SPY 145p 1/21/2022?????? Only 1.18...might buy 1
2019-11-19 03:16:16,gatoken1,0,"Trump secret hospital visit over the weekend? 

Man idc if you hate the mango, nobody deserves health complications 😞"
2019-11-19 03:11:44,dawhizkid123,1,"Anyone invest in non-financial assets like sneakers, art, jewelry, handbags? 

I’m tempted to buy something at an auction, like a Berkin bag and then resell later. Rich people keep paying stupid premiums for those things."
2019-11-19 03:10:40,uninfinity,7,"\*👨🏼‍⚕️🩺**Trump's Physician: President Didn't Undergo Specialized Cardiac or Neurological Evaluations**

\*👨🏼‍⚕️🩺**Trump's Physician: Checkup Wasn't Result of Chest Pain or Other Urgent Issue**

Time for green dildos because why not lol"
2019-11-19 03:09:31,,2,How does the fed lowering the amount of treasury bills they buy help their balance sheet?
2019-11-19 03:09:25,winkerpack,4,"If spy has a 2% day tomorrow, I'll give gold to the 3rd person to respond to this"
2019-11-19 03:07:03,saib36,1,Anyone else bought FIT puts today?
2019-11-19 03:06:16,TheHorizonDawn,4,Has anybody noticed that r/all is literally all posts about Hong Kong? I’m starting to think there’s some vote manipulation algo going on
2019-11-19 03:05:27,uninfinity,4,"Why FOX??

 

# Fox has filed a trademark application for a TV show called 'OK boomer""

 

 [https://www.cnn.com/2019/11/18/entertainment/ok-boomer-fox-trademark-trnd/index.html](https://www.cnn.com/2019/11/18/entertainment/ok-boomer-fox-trademark-trnd/index.html)"
2019-11-19 03:04:28,realister,2,"yea, I have puts, wanna fight about it?"
2019-11-19 03:03:33,jlp1420,1,Anybody looking at Clovis?
2019-11-19 03:02:18,RubenZ217,5,So it's time to go full retard along with the whole market and buy SPY 320 calls right?
2019-11-19 03:00:00,Nomadic_Marvel07,1,Who had $NOW calls?
2019-11-19 02:58:37,oregon_forever,14,"In 1998, the market was overvalued in pretty much every metric but it continued to rally for another year in 1999 and rose another 20% from overvalued before it crashed in 2000."
2019-11-19 02:57:52,snowdaruma,3,Green until Spring!
2019-11-19 02:55:38,migbyo,3,Trump met with Powell today...? Tariff Man... or Tariff Men...?
2019-11-19 02:54:58,ES_fancypantz,6,Futures are proper happy pickles
2019-11-19 02:54:47,oriolesa,3,Am I missing something or are long-dated expiry PTON puts the easiest free money ever?
2019-11-19 02:51:10,SoLetsLoseMyMoney,4,"So i know if I have a 309 put and want to lock in profits I can sell a 308 put. (same thing with a call, sell a further OTM option) but what if I have a bleeding call or put, how do i prevent further loss? Would I sell a call/put thats closer to ITM? for example, if I have a 310 put, the market goes up instead of down, would i sell a 309 put to prevent further bleeding?"
2019-11-19 02:50:08,follow-spy,2,What stocks around 20 bucks to sell covered calls on?
2019-11-19 02:46:18,HangSengChinaMang,5,# hang seng blood green
2019-11-19 02:46:07,Howtoshortdow,2,Any news tonight?
2019-11-19 02:45:13,ILoveTheAtomicBomb,6,"If AMRN, TGT, and DIS can go up tomorrow, that would be lovely"
2019-11-19 02:44:05,,11,"Stock tip: If you never sell, you can't lose money!"
2019-11-19 02:42:27,Gilbertgodfries,6,"A couple months ago my bank gave me a refund on a purchase of 227 dollars. Every two weeks they've been sending me the same check. I started cashing them 2 weeks ago at the atm. Is there a chance they notice or if by now two weeks has gone by, they won't notice and I'm in the clear?"
