date,author,score,body
2020-06-24 22:39:45,Mario_209,4,$300 SPY put hedge is the best thing I ever did while going balls deep in EV calls
2020-06-24 22:39:33,pugsarecute123,1,QQQ 7/2 249c bought at eod right before the melt down
2020-06-24 22:39:20,colantor,-1,Someone tell me why my 6/29 308c will print tomorrow
2020-06-24 22:39:15,ElvanKing,2,"Honestly, I need BA to reach above 200 before it reaches 150, how fucked am I?"
2020-06-24 22:39:02,bigkev2569,2,"Big money exiting:
 

https://finviz.com/insidertrading.ashx?tc=7

Is this a sign?"
2020-06-24 22:39:00,hi_im_guy69,11,"Can it be 9:30 tomorrow already, just wanna know if I pulled off another miracle or if im at 0 again!!"
2020-06-24 22:38:47,Revolant742,5,Gold Miners just rocket 10% and in a flash sell off
2020-06-24 22:38:40,putsandpizza74,12,"Just wanted to take a quick moment for all of the bulls and call holders, to say, from the very bottom of my heart, get fucked 🖕😎🖕

🌈🐻🚂 SUCK OUR DICKS"
2020-06-24 22:38:37,Kramnet,9,"Time to play vaccines and biotechs again, the bullshit news gonna start flooding the markets. Fucking SRNE is moving already damn."
2020-06-24 22:38:26,dairuinshadowflame,9,"Wow. So glad I bought Aal and Mgm calls
Yesterday. Jesus fuck."
2020-06-24 22:38:17,not_batsoup,12,Banks going up or down tomorrow? They won’t announce any dividend cuts until the 29th
2020-06-24 22:38:11,PutsTookMyMoney,0,Tesla needs to do a reverse split and so does amazon.
2020-06-24 22:38:02,paranoid_tweak,0,"Tomorrow predictions?

Bear are fuk?

Bulls are fuk?"
2020-06-24 22:37:40,shutnr,12,I timed going all in perfectly! Only 41% gone today guys! Nice!
2020-06-24 22:37:26,Mirucias,1,Flat shit
2020-06-24 22:37:02,Throwaway181181181,3,Cmon naschad pump baby
2020-06-24 22:37:02,GourmetFilet,7,"We got jobless claims, GDP and Core Durable Goods at 830am. Gonna be wild leading into open. I don’t think we see too much tonight ahead of that whopper of data. 

Why time is stress test ?"
2020-06-24 22:37:01,Oh_no_bros,5,Might have hedged the wrong way with VXX poor man covered puts instead of just getting vxx calls. Time will tell if I'm dead man.
2020-06-24 22:36:55,blackcoffee0123,6,a short squeeze tmrw past 314 would be epic. rigged economic data could trigger that
2020-06-24 22:36:50,The_Big_Willy,1,Fuck boys. I closed today $75 above margin call and threw about $3k into SPY 305c for 6/29. Send me your energy.
2020-06-24 22:36:46,blueairplane123,6,Remember when bears used to go on downvoting brigades well now the bulls are doing it 🤣
2020-06-24 22:36:44,v1truvian,2,Thoughts on PFE right here
2020-06-24 22:36:40,Tecashine,-1,Any bulls bought calls on ROPE today?
2020-06-24 22:36:29,jp42212,4,"Donny announces 400 billies from nato allies for defense spending. RTX, LMT, BA calls? 


https://m.youtube.com/watch?v=oXPglBbvNWE"
2020-06-24 22:36:28,Mrivera45,1,ACB JULY 2? Thoughts?
2020-06-24 22:36:09,_njhiker,2,"Do yourself a favor and buy APT calls tomorrow on the first dip. More and more states and business requiring masks, COVID cases increasing.  Broke through $20 on volume today and finished good.  Sell when Trump endorses wearing masks and enjoy the tendies."
2020-06-24 22:36:07,shagagav,14,Boy am I not confident in my calls
2020-06-24 22:36:05,kohlarncowboy69,1,Puts on DRI for earnings and calls for TSLA Canadian Internet 🚨
2020-06-24 22:36:05,GatoAmarillo,8,If oil somehow hits $100 next month I'm buying a Lamborghini
2020-06-24 22:35:57,QuanHitter,7,"\*\*\*\*\* Fed Stress Test \*\*\*\*\*  


**Question 1:**   *What's big and red and smells like bear-cum?*"
2020-06-24 22:35:52,1005thArmbar,4,"Did some Alex Jones' Brain Power Plus nootropic shit, going to own trivia tonight and then, using 158.1% of my brain power tonight, I'm going to make some clinically retarded decisions that tank my portfolio even harder"
2020-06-24 22:35:24,nsrbigshot,2,"idk man, when have we had 2 days of red? shit never happens and i doubt we stay red tmrw as much as i want us to, this shits fucking rigged"
2020-06-24 22:35:16,SullyBrr,8,Who in the actual FUCK is pumping Novavax up to $80 from $7 pre covid? They literally have never had a drug fda approved before.
2020-06-24 22:35:11,uninfinity,20,"***White House Trade Adviser Navarro says US President Trump signed proclamation to protect the lobster industry and directed USTR to observe if China is purchasing US lobsters under Phase 1 agreement or he may place reciprocal tariffs***

LOBSTER PUMP!! ***🦞🦞🦞🚀🚀🚀🚀***"
2020-06-24 22:34:54,golfwangthesenuts,3,what was the CNBC tweet that got deleted??
2020-06-24 22:34:50,callmekizzle,7,I love how the Nasdaq is like fuck you we going green
2020-06-24 22:34:46,sgraBer1,5,"Hey bulls, the floor is lava"
2020-06-24 22:34:40,jpowskid,12,"Bought 200k in weekly SPY calls. Bears, do your worst."
2020-06-24 22:34:37,,3,"We should all have hedging positions in our portfolio, I have UVXY shares that shoot up on days like this. I sell calls against them when they’re up high and buy back the calls on green days"
2020-06-24 22:34:28,GourmetFilet,9,Pls be anything but flat. Give me over 310 or under 298
2020-06-24 22:34:01,gmcarve,8,[days like these got me like](https://imgur.com/LuFHWSn)
2020-06-24 22:33:56,I_have_a_dog,3,Are we still doing Thursday unemployment pumps? Cause I could really use an unemployment pump tomorrow.
2020-06-24 22:33:48,,5,calls on satan's butthole
2020-06-24 22:33:29,not_batsoup,31,Our portfolios going to get a stress test tomorrow too
2020-06-24 22:33:25,anxiousnl,2,"Corona is a bear disease, gonna wipe em out."
2020-06-24 22:33:25,PhillipJFry3020,13,"China trade deal is over and Trump is trying desperately to keep that away from media as long as possible. 

I mean it was a core campaign promise and it’s dead."
2020-06-24 22:33:19,GatoAmarillo,7,I'm a permabull but I'm feeling kind of gay about this...
2020-06-24 22:33:17,VistaBlockCrip,6,Fractional shares cuz I’m too fucking poor
2020-06-24 22:33:01,ConfidentGuard,4,Somebody cut me a line of this Corona virus shit. I'll snort the whole thing to prove this is all fake and gay.
2020-06-24 22:32:58,BigMac4414,10,Spy 318 tomorrow?
2020-06-24 22:32:55,Dallas2143,3,GNC 1$c are .13 right now. Wtf do you think they will be at open?
2020-06-24 22:32:53,bosshaug,6,So much blood
2020-06-24 22:32:40,TJwhosurmomma,2,"You have $500,000 for one play to ensure you never have to work again. What is it?"
2020-06-24 22:32:35,mindx3d,2,"guys, im gonna talk to the ceo of devin nunes cow."
2020-06-24 22:32:16,numbnah,1,Gonna load up heavily on Tqqq Sept 20 puts when we hit 310-313 again
2020-06-24 22:32:10,PhillipJFry3020,5,Volume was pretty good today. That’s not a good sign for anyone holding calls.
2020-06-24 22:32:10,Single-Distance,7,Can’t wait to watch Europe tank this bitch tonight
2020-06-24 22:32:02,SmugglerHanSolo,12,I’m rooting for the unemployment report to come in better than expected tomorrow morning then the Fed Bank Stress Test turns out good after the bell. Then we rage on Friday
2020-06-24 22:32:00,junkyard37,2,Waiting for cramer to go bearish on market
2020-06-24 22:31:44,blueairplane123,6,I love how Navarro totally let the cat out of the bag two days ago and everyone’s acting like he didn’t. The deal is dead and the smart money knows it
2020-06-24 22:31:30,wecklesss,6,Think my new yacht color will be red to match gnc after these gainz
2020-06-24 22:31:17,mmanofsteel86,2,Shout out to PLUG for the tendies this month.
2020-06-24 22:31:15,-rigga,13,"Reposted Repost:

There's really no reason not to risk a lot. America no longer rewards those who are financially responsible. Debt is a part of life. Having debt is the only way to get yourself into more debt like a better house or car needing a credit score.

Oh, you paid off your student loans? Get a car. Oh you paid off your car? Buy a house. Oh you paid off your house? Save for your kid's six figure college fund. Oh all that's done? Hope you have enough left for retirement and enjoy your last 10 years of life, thanks for contributing to society with your 9-5 life.

We all need to hit it big. That's why we're here. Fuck [r/investing](https://www.reddit.com/r/investing/) and those 2% savings accounts. 2% is a fucking milk jug number, not real gainz. Go for the millions. But please do not let this extensive clarification distract you from the fact that in 1998, The Undertaker threw Mankind off Hell In A Cell, and plummeted 16 ft through an announcer’s table.

SPY $290 EOW"
2020-06-24 22:31:06,dweeegs,9,"Trump was awfully quiet today

What bullshit will be pulled out of the hat tomorrow?"
2020-06-24 22:30:58,nordmys,5,"Wow, what the fuck happened today?"
2020-06-24 22:30:56,PhillipJFry3020,3,There should be different shades of green and red. That way all you autists can stop saying shit is bright green or bright red when things aren’t moving at all.
2020-06-24 22:30:47,Dbetancourt92,-13,Shut up you fag bull
2020-06-24 22:30:47,EmbarrassedDemand9,0,Alright for the cocksucker who doubted my TVIX play I just doubled down on it at days end for 1000 shares now with my earnings from today. So fuck you im gonna make you look stupid
2020-06-24 22:30:44,Dans2016,4,Market has kangarooed so much most here are now red-green color blind.
2020-06-24 22:30:42,Khalian,4,"I've got spy 309c expiring friday, breakeven at 311 even....im feeling that im totally fucked on this one boys"
2020-06-24 22:30:40,luvtoeatburgers,0,what becky stocks are hot
2020-06-24 22:30:34,tendeeznuts,26,"**Tendeeznut's Retard Market Recap** 

&#x200B;

* **Technicals:**

 **6/17**

* DIX: 50%
* GEX: 7 Trillion
* PCR: 1.61

**6/18**

* DIX: 51.3%
* GEX: 6 Trillion
* PCR: 2.02

**6/19 ( Quad Witch )**

* DIX: 52.5%
* GEX: 2.1 Trillion
* PCR: 2.00

**6/22**

* DIX: 46.9%
* GEX: 2.9 Trillion
* PCR: 1.97

**6/23**

* DIX: 48.2%
* GEX: 4.4 Trillion
* PCR: 2.01

**6/24**

* DIX: 48.2%
* GEX: 2.4 Trillion
* PCR: 1.47

Looks like a pause in overall buying since the Quad Witch, which blew out almost 4 trillion in Gamma - and another 2 Trillion loss of Gamma Exposure from yesterday to today. 

The put call ratio plummeted from 2.01 to 1.47, which signals that large players closed their puts today in anticipation of better than expected ( lol ) economic data thru the rest of the week.

[10 Year Bond Yields: -5% Today](https://www.marketwatch.com/story/treasury-yields-tilt-higher-as-bond-market-shrugs-off-tariff-and-coronavirus-fears-2020-06-24), which typically means investors are indeed fleeing into bonds at the moment. With a few major economic events coming up EOW, it seems most people are hiding out in the bond market until the economic picture is more clear. If the data is bad, bonds are a good place to be, if the data is good - the loss is minimal, and the jump to equities is easy to make, especially at these currently discounted prices.

&#x200B;

* **Fundamentals:**

Fundamentally we have US GDP QoQ estimates tomorrow, Fed has said recently that the economy is recovering much faster than expected. [They've actually only shelled out 6% of their total 2.3 Trillion](https://www.cnbc.com/2020/06/24/the-fed-said-it-could-supply-the-economy-with-2point3-trillion-it-hasnt-come-close-so-far.html) they've committed to assist economic recovery. 

[Bank stress test results](https://www.barrons.com/articles/toughened-bank-stress-tests-are-coming-this-thursday-dont-expect-clarity-on-dividends-51593003490) should be in EOW - [there have been no repo bids at all this week](https://apps.newyorkfed.org/markets/autorates/tomo-results-display?SHOWMORE=TRUE&startDate=01/01/2000&enddate=01/01/2000), which should signal that banks have sufficient liquidity and cash reserves. [Deposits are up overall as well.](https://markets.businessinsider.com/news/stocks/bank-deposits-since-coronavirus-us-grown-trillion-amid-crisis-2020-6-1029330309) Some are worried banks may pull dividends, valid; but this wont be announced tomorrow as they've been instructed by the Fed to wait until 6/29 to announce any shareholder payout changes.

&#x200B;

As you can clearly see, the information above indicates that >!Bear R Fuk!<

&#x200B;

*Disclosure: Im jacked to the tips of my nips in calls exp next week with zero downside exposure.*"
2020-06-24 22:30:25,DatOneBlindSloth,6,Switched my bear costume to bull at 3:59pm. LETS GO MURICA.
2020-06-24 22:30:23,v1truvian,5,"Y’all realize that hulk’s huge green dick takes sometime to get hard, but once it is, bears gonna get their assholes wrecked. Pumping that cock tonight, watch out tomorrow."
2020-06-24 22:30:07,onlyeverdown,24,My mental health is absolutely terrible right now 🤡
2020-06-24 22:30:03,StressPooper,8,"[https://www.worldometers.info/coronavirus/country/us/](https://www.worldometers.info/coronavirus/country/us/)

We're going to hit over 40k cases today. Texas still has \~1k cases to report and California has over 4k cases left to report."
2020-06-24 22:29:58,SmoovMove,7,"I would thank Robinhood idiots for making me tendies tomorrow on GNC.

&#x200B;

But....I am, myself, a Robinhood idiot."
2020-06-24 22:29:55,duathman,2,I need some loss porn to lift the mood of this lost soul right now.
2020-06-24 22:29:40,duhpolan,0,Dammit. We gonna be flat tmrw right
2020-06-24 22:29:39,Scottysewell,4," Over 500,000 americans will have died once Covid-19 is starting to die down. Think about that"
2020-06-24 22:29:35,Mario_209,5,"I bought GNC calls as an absolute bullshit play and it actually may make me money. Lmao

Maybe I should of thrown more than 15 bucks at it"
2020-06-24 22:29:32,spyaintnobitch,2,Somebody pause futures right there. We good!
2020-06-24 22:29:10,PhillipJFry3020,3,Those poor lobster farmers.
2020-06-24 22:28:52,daddydickie,7,"Brother bulls, please join hands and support each other's faith for JPOW"
2020-06-24 22:28:50,MuskIsAlien,6,WE ARE GREEN BULLS NEVER DOUBT USA!
2020-06-24 22:28:46,CigarScotchSex,2,VIX so low. Even if you make short term plays might just get IV crushed.
2020-06-24 22:28:42,YessirACT,1,Keep or sell my AAL puts
2020-06-24 22:28:38,cecpiece,4,Even my boy VIX doesn’t know what to do.
2020-06-24 22:28:37,anal_casanova,4,"Is it safe to assume the opposite of ""buy the dip"" is ""sell the peak""?"
2020-06-24 22:28:37,uninfinity,6,"***US FBI Director Wray says China is the most comprehensive threat to the US and that the FBI has an active role in probing China's response to the outbreak, while he noted the FBI has 2k active probes which trace to China***"
2020-06-24 22:28:36,blackcoffee0123,3,Naschad 10k support.
2020-06-24 22:28:32,LiamPhlegmsworth,6,What's that I see? A glimmer of green. Well I'm off to bed that's all I need to see
2020-06-24 22:28:28,berryman13,-16,Upvote if you got puts. Downvote if you got calls.
2020-06-24 22:28:28,i_whip_bears,3,I GIVE MY ENERGY TO A GREEN THURSDAY MIGHA
2020-06-24 22:28:18,626reppin,16,"Futures green, bears ARE SO FUCKED FOR THE NEXT 5 MIN until futures turn red again."
2020-06-24 22:28:17,Trenchalicious,3,Haha I wasn’t aware of how much a con man Chris Hansen is.
2020-06-24 22:28:15,Switchrx,2,I’m gonna need a limit up if my sanity is going to make it out unscathed
2020-06-24 22:28:06,Bottleofbombay,4,GNC the next HERTZ
2020-06-24 22:28:03,Dallas2143,4,GNC 1$c grab it first thing in the morning and just let it ride
2020-06-24 22:27:49,GenerousRhinoceros,1,Red at night bulls delight
2020-06-24 22:27:47,furrypurpledinosaur,8,Buy the dip guy was on CNBC saying to buy the dip. I don't have a good feeling about this.
2020-06-24 22:27:41,,1,Futures are struggling to stay green...
2020-06-24 22:27:38,p0tempkin,-1,Stocks doing Papa Bear proud AH.
2020-06-24 22:27:36,InvestmentActuary,1,"I would’ve thought I’d be happy making over 500$ per day in NET realized gains, on average, day trading while also working from home.  Most days I’m executing only 1 roundtrip.

I’m not happy."
2020-06-24 22:27:32,fin425,1,SRNE is popping.  Sold my $6 calls today for a small profit. Fuck man.
2020-06-24 22:27:31,IndianTechSupport,5,"Drill Team 6 just doing a stress test today, no need to panic guys."
2020-06-24 22:27:30,BillyG803,3,"Saying fuck airlines, cruises, and banks and going all in on AAPL if it opens green"
2020-06-24 22:27:28,looseinsteadoflose,3,who's in shambles tomorrow?
2020-06-24 22:27:22,fatjoesdick,6,"Trade deal with China is dead. Waiting for the leak, then panic sell, then crash. Could take days, could take months. Until then Kang Gang or bust."
2020-06-24 22:27:09,Nochthitus44,2,"Just noticed yesterday being double the volume of the day before; sweet fucking fuck, my calls!"
2020-06-24 22:27:08,dawhizkid123,3,ALLY 🚀AH
2020-06-24 22:27:06,xjayroox,10,I expect nothing less than a 298 or 310 open tomorrow
2020-06-24 22:27:06,Wallywhitehurst,3,greener than a Gumby dick
2020-06-24 22:27:06,MyBobber113,0,Weeeeeeeeeeeeeee
2020-06-24 22:27:05,sid_55,2,ALLY Going up!! Nice :D morning dump coming?
2020-06-24 22:27:03,Krahndaddy,2,Do you think we will moon once gdp numbers come out at 8:30am? Everyone is predicting shit numbers. If we beat the shit numbers we will probably pop
2020-06-24 22:27:01,ChickenSandwichGuy,5,I went pretty in on calls at 3:59pm EST today as any sane options gambler would do
2020-06-24 22:27:00,sharpmoloko,1,what’s the outlook for straddles tomorrow? realllly hoping it’s not flat by open
2020-06-24 22:26:58,Goonsquad18,2,GNC popping off AH
2020-06-24 22:26:42,aptway,3,...aand we're green. Nap time.
2020-06-24 22:26:40,Japples123,1,🦞GANG
2020-06-24 22:26:31,Trenchalicious,1,Fuck this pump and dump you pj bitches
2020-06-24 22:26:31,Give_me_an_M3,2,The fact that I'm feeling uneasy about my QQQ calls makes me think they'll print
2020-06-24 22:26:16,oprahisnotgay,5,Sad I sold my puts a couple of days ago. I'm going to sit in the corner and think about what I did.
2020-06-24 22:26:14,StressPooper,5,Bulls are too retarded to know when they've lost. You can't argue with them. They are the embodiment of a Trump supporter.
2020-06-24 22:26:10,mywifeleftme_420,12,Downvoting everything that inverses my current positions
2020-06-24 22:26:01,IwantmyMTZ,3,So everything is up? This market is schizo.
2020-06-24 22:25:59,supercoolguy__69,1,"I V R 🚀?

No one’s forgotten right?"
2020-06-24 22:25:39,bigkev2569,22,"Repost:


There's really no reason not to risk a lot. America no longer rewards those who are financially responsible. Debt is a part of life. Having debt is the only way to get yourself into more debt like a better house or car needing a credit score.

Oh, you paid off your student loans? Get a car. Oh you paid off your car? Buy a house. Oh you paid off your house? Save for your kid's six figure college fund. Oh all that's done? Hope you have enough left for retirement and enjoy your last 10 years of life, thanks for contributing to society with your 9-5 life.

We all need to hit it big. That's why we're here. Fuck r/investing and those 2% savings accounts.   2% is a fucking milk jug number, not real gainz.    Go for the millions. If you don't make it, it doesn't matter anyways because most of us will die working. But at least you would have tried, which is more than most.    "
2020-06-24 22:25:25,OofStickyBot,1,"Decided not to buy any calls or puts, so I can buy some plays preMarket and watch most of you complain"
2020-06-24 22:25:19,,6,"YOUR CALLS LOVE HIM

YOUR FRIENDS LOVE HIM

YOUR BEAR WIVES DEF LOVE HIM

ITS THE BIG BULL COCK 🍆💪🥰"
2020-06-24 22:25:19,yeahman64,2,A strong market makes it easier to raise capital which makes the economy better. So surely the market should lead the way to a stronger economy by hitting more ATH and giving good conditions for raising capital. Come on people do your bit and give your cash to the corporations.
2020-06-24 22:25:15,IMakeMyOwnLunch,12,Today saw the single largest number of positive cases and tomorrow will see another million or so unemployment claims. Calls for sure.
2020-06-24 22:25:04,MadNhater,5,Usually opens green after a day like this.
2020-06-24 22:25:01,5gCausesCoronavirus,3,FUCK
2020-06-24 22:24:56,dreadstrong97,2,"Thoughts on INO?  Are we going to see sustained increase in equity price like Moderna, or do you think it's a pandemic pump-and-dump?"
2020-06-24 22:24:56,Elforas_Tero,2,What would it take to make the VIX 0?
2020-06-24 22:24:53,mywifeleftme_420,4,Imagine if we chop for two more weeks. 98% of wsb would be wiped out
2020-06-24 22:24:48,scrimshaw_,1,which retail company is going bankrupt after GNC?
2020-06-24 22:24:32,idsimon,1,You guys thought lobsters we're bad news? Wait till the crab wars start.
2020-06-24 22:24:29,ProfessionalCrazy3,8,"Inverse WSB, sold 300p to buy 310c, gonna make couple grand tomorrow"
2020-06-24 22:24:23,shotclckcheese_7,5,What time is stress test tomorrow?
2020-06-24 22:24:17,Septseraph,1,do ra me fa so la de dough.  “**Two possibilities exist: either we are alone in the Universe or we are not**. Both are equally terrifying.”
2020-06-24 22:24:15,blackcoffee0123,9,yall really think you can buy puts on a bigly red day and the MM's will let you cash out with a bag the next day? HAHAHA
2020-06-24 22:24:10,printer_go_brrr,1,Taco Tuesday and Theta Thursday get ready bois.
2020-06-24 22:24:06,stocksnitch,2,"How am I supposed to feed my ex-wife's boyfriends? This one step forward, two steps back market annoys the hell out of me sometimes. OK let me try selling a GOOG iron condor."
2020-06-24 22:23:32,autismovaccination,4,Futures green and up as bigly as my pp
2020-06-24 22:23:25,theChad802,5,"Well its been fun. I'm now down 90% all time with most of the rest in dead SPY 315c 6/26 that I bag held. Cant keep refilling and losing, so see ya on the flipside wsb."
2020-06-24 22:23:23,bluepancakke,7,"Gdp better than expected,  low unemployment numbers, stress test : good,  here's hoping for a 318 open🙏"
2020-06-24 22:23:21,Goonsquad18,2,What are the odds that gnc actually pops off
2020-06-24 22:23:13,vxzvxzvxz,5,Why the fuck do we have to pay such high capital gains tax to the government for risking our money in their economy. Shit is kinda fucked isn’t it??
2020-06-24 22:22:55,anal_casanova,3,Everything else is slipping. ZM needs to choke on its own enormous donkey dick and die. It's only fair.
2020-06-24 22:22:54,ThatsMyPurse69,9,Mercury is in retrograde and so is my portfolio
2020-06-24 22:22:54,FAKEZAIUS,2,The atmosphere of the market right now is heavily bearish.
2020-06-24 22:22:50,cashmoneyballer69,2,Why doesn’t anyone like $VRM?
2020-06-24 22:22:46,SimplyUnique96,6,Ketchup packets tonight for dinner boys
2020-06-24 22:22:42,jaheig,-13,"Upvote this comment if you are a sexy beast 

Downvote this comment if you look like a fat monkey"
2020-06-24 22:22:36,dolla_bill21,0,I always imagine this sub as a bunch of retarded guys. How many women do you think are actually on this sub?
2020-06-24 22:22:34,NervousTumbleweed,0,">Daimler and Nvidia team up to close tech gap to Tesla

https://reut.rs/2B9pYh0

Nvidia is now in the self driving cars game. Full meme territory boys."
2020-06-24 22:22:20,-rigga,8,Thought today was bigly red? >!TOMORROW WILL BE BIGLYER RED 🐻!<
2020-06-24 22:22:18,G23456789,5,"I have a legit question. What makes ppl think we won’t go green tmrw after what’s happened in the past few weeks, the patterns. And job reports will be out tmrw which I’m assuming won’t be bad but who the fuck am I too talk."
2020-06-24 22:22:17,iloveyoungho,3,Would trump losing cause a mass boomer sell off? Isn’t time they go all on bonds anyways? Why risk your retirement in this market
2020-06-24 22:22:16,toasted_t_rav,1,Idk call me crazy but I feel like the unemployment numbers are going to be low tomorrow morning.
2020-06-24 22:22:15,illumynite,1,"HTZ is retarded.

Bought calls during the moon this morning, sold at the peak, immediately bought puts."
2020-06-24 22:22:14,Oprahapproves,1,Thoughts on long AMD? It's held pretty strong through the drops the past month
2020-06-24 22:22:06,,2,Getting rid of my puts
2020-06-24 22:22:03,ThatBoiDonQ,3,If stress tests are shit tomorrow I’m going to be rich
2020-06-24 22:21:55,GreyArea23,1,Too much data coming out tomorrow morning to put much stock in futures tonight (in either direction)
2020-06-24 22:21:45,v1truvian,0,What’s the point in this sell off? We already knew Corona was going to spike. We are not shutting down the economy again. This all seems like bullshit market manipulation to get cheaper shares.
2020-06-24 22:21:37,leomeng,5,Need another fake jobs report
2020-06-24 22:21:36,tinybabyjeezus,-3,Futures green as a leprechauns dick
2020-06-24 22:21:33,lhatekale,3,Here’s hoping Navarro cancels China again tonight
2020-06-24 22:21:29,raobjcovtn,10,I think i fapped too much in quarantine
2020-06-24 22:21:27,Dans2016,0,"Violated my own rules and sitting on an AAPL put overnight.  Will print tomorrow, I hope.

312.5p 7/10"
2020-06-24 22:21:27,Rhynoster,3,Anybody holding tech through this?
2020-06-24 22:21:26,oregon_forever,7,Powell: VIX is too high imo.
2020-06-24 22:21:25,DrUNC83,3,"“The Justice Department, led by Attorney Gen Barr, is preparing to file an antitrust lawsuit against Google according to sources

Rupert Murdoch's NewsCorp Has Apparently Been Integral In Spurring The DOJ's Antitrust Probe Into Google”"
2020-06-24 22:21:20,SGTANTEATER,1,I posted itt yesterday looking for some penny stock pump and dump ticker that someone had posted because i wanted to play but forgot the name and couldn’t find the post. I finally remember the name just now (SNTX). It’s up 272% today obv.
2020-06-24 22:21:18,Scottysewell,-3,did you guys hear that? i just heard that BULLS are FUK
2020-06-24 22:21:17,RichardFarter,2,Everytime I touch SPG the entire market drops and SPG drops even harder. 3rd time in a row now
