date,author,score,body
2020-08-14 00:29:59,-OpportunityCost,44,"Step 1: Find a company that almost no one has heard about it

Step 2: Make a convincing DD post about this new innovative tech company specializing in unprecedented mattresses

Step 3: Continue making non stop threads and hype around your amazing discovery

Step 4: Dump everything after 2 weeks of hardcore pumping

Step 5: laugh at the wsb retards that are now holding your bags"
2020-08-14 00:29:57,q112,7,"“This markets over bought”


Damn that’s crazy


“Tech is a bubble”


Damnnn


“Don’t get me started on JPow”


Haha damn"
2020-08-14 00:29:56,Grass02,2,Imagine buying PENN puts last week
2020-08-14 00:29:45,fpsdr0p,4,AAPL be a fucking chad and announce Apple One already. swat away this little fly called epic so we can go to the promised land.
2020-08-14 00:29:26,Bytemebytch,-10,My $140k TSLA Model S MCU / Screen just died for the 2nd time and now it is stuck in some random strip mall parking lot. Had to book service through the Tesla App.. They said they will come replace the 12 volt battery in a week but only can replace the 12 volt battery at that time. I KNOW it is NOT the 12 volt battery that is dead.. Went and bought a Porsche GT3RS out of spite...  Tesla is burning relationships. The Tesla brand grew by word of mouth and might die the same way. BTW. I own 4 Teslas and have 2 more on order... not for long. Never got the upgrades on multiple cars I paid Tesla for years ago......Fucking ugly Taycan might be my only option for a daily driver. TESLA to the moon because it is 2020 and everything is FUK.
2020-08-14 00:29:26,Monkeybob275,6,fuck everything. This market has taught me a lot of lessons. Mainly that nothing makes any fucking sense.
2020-08-14 00:29:20,partially__derived,3,What’s your DKNG lotto ticket? Mines 9/4 33C
2020-08-14 00:29:09,yacnamron,3,"Stonks r 🤡🤡🤡
🤡🤡🤡 r Stonks"
2020-08-14 00:29:03,baby-yoda-stan,3,Suddenly feeling worried about my prpl 10/16 calls 😅
2020-08-14 00:28:08,logcanoe,1,"Max cash into CHAD welcome to 2020 bro’s China is under water 9/21 is probably safe for a target. And I’m in at 24&29
CORN options are already bought 2/2021
GL everyone else!"
2020-08-14 00:27:55,Hematocheesia,1,Do y’all leave the lights on for the living room at night? For security reasons?
2020-08-14 00:27:40,UnwantedRelishMan,8,"jesus christ, textbook companies know how to fuck you with their fucking dumbass online codes for their online bullshit"
2020-08-14 00:27:36,PRINTINGBENJAMINS,5,"Selling premium is straight up free money, takes 15 minutes to set up trades and I make money without trying"
2020-08-14 00:27:25,StrudelMania,12,"I can’t believe half this sub YOLO’d on earnings for a mattress company 

I mean it’s WSB so it makes sense but wtf guys"
2020-08-14 00:27:23,BentoMan,3,It is no coincidence that Epic is pulling this shit shortly after the Congress’ hearings of the Big 4 Tech concerning antitrust behavior. They are basically screaming “look at me!” to politicians. Android has workarounds so Google is good. Apple doesn’t have the market share Google has. I bet Amazon is filled with glee since they didn’t have the balls to pull the same stunt.
2020-08-14 00:27:06,Houston_swimmer,7,"Is Biden’s Cornpop story actually a subtle endorsement of Corn Gang? 

Calls on corn"
2020-08-14 00:26:57,stuartstustewart,2,"How come you all don’t like IPOs? 
I had a great one today nobody put money into. BEKE. Tomorrow we have DCT and CVAC, which is backed by Gates."
2020-08-14 00:26:09,Noob_Noodles,-6,"Fellas If you could help this Sub out by voting for this post to be un-deleted I think that would be good:


https://www.reddit.com/r/wallstreetbets/comments/i8pbik/wsbvotebot_log_for_aug_13_2020/?utm_source=share&utm_medium=ios_app&utm_name=iossmf"
2020-08-14 00:25:58,iredditacc,2,I’m just going to walk away from my computer tomorrow at 2:50 PM because I think I already know what SPY is going to do
2020-08-14 00:25:55,BuffaloRhode,15,"Government suing spple, Fortnite suing Apple. The fruit is under attack!

This will hurt Apple supply, strain Apple demand. Customers will need to look for Apple alternatives for sustenance. 

I present the answer: 🌽🌽🌽"
2020-08-14 00:25:55,rjsheine,6,Is it me or are futures green AF
2020-08-14 00:25:42,Desert_Hawg,2,"Pton gearing up for the mountain phase, one can hope"
2020-08-14 00:25:38,TimeBndit,8,Stonks only gap up
2020-08-14 00:25:19,cutiesarustimes2,4,"Is gsx the company that I keep hearing hires people in America at like $15/hr to teach Chinese kids English?

I remember someone telling me they did that right after college and I was like the pay seems low tbh"
2020-08-14 00:25:18,hoogetraps,2,Now I know you said dream sequences are for fags but I think it could work. I mean we all gotta dream don’t we? not just the fags.
2020-08-14 00:25:07,breakfastsamurai,5,Dem Futures tho
2020-08-14 00:24:36,kevasto,12,Cramer is begging for everyone to stop heckling him on twitter so you  know what that means.......everyone go heckle him on twitter
2020-08-14 00:24:32,br0botic,21,"When I first discovered WSB, they were meme-ing MU 90C, MartyMoho was the head autist, and we prayed to the god Shkreli. Now its corn and a fucking purple mattress. 

A lot has changed but one thing is constant: I’m still great at losing money."
2020-08-14 00:24:24,mattrob1995,5,[kinda called it on PRPL](https://www.reddit.com/r/wallstreetbets/comments/i8xa70/daily_discussion_thread_for_august_13_2020/g1c6fyx?utm_source=share&utm_medium=web2x)
2020-08-14 00:24:03,tylertime98,8,chainlink has been mooning wtf
2020-08-14 00:23:57,MongolianThroatSing,7,"If a 5:1 split does this, just imagine why battery day is going to do... my god I should buy leaps after pullback"
2020-08-14 00:23:51,Boomhauer_007,8,If PRPL keeps dumping the next few days it may come full circle all the way to becoming a good pick up again
2020-08-14 00:23:42,Tetkobear,7,Man this PRPL scam is fucked up. I just hope the dudes also switched to puts after selling all their warrants as the ultimate fuck you. Full disclosure - I was stupid enough to jump into PRPL right before close today.
2020-08-14 00:23:41,NoLimit315,7,Puts on society
2020-08-14 00:23:40,DankMemelord25,5,Clang Gang 🥈🥇 how we feeling Boyz??? I know I'm a bucket load richer 🤠🤗🤗🤗
2020-08-14 00:23:16,JamesRoth949,6,Just watched “Avatar” and let me tell you what a waste of time biggly over rated movie.
2020-08-14 00:23:11,The_toast_of_Reddit,5,"Wow, the r8s aren't even THAT expensive. You can pick a used one up for less than a new m5."
2020-08-14 00:23:11,freehouse_throwaway,2,"GSX looking oof AH now that IQ has disclosed SEC investigation.

Too bad it has ran up an insane amount so that shorts are fucked already anyways and all those WSBer piling on expensive as fuck July puts are already dead."
2020-08-14 00:22:49,aiiot,6,SPY calls/puts on Monday-Wednesday had more CALL buyers than PUT buyers. Thursday close the PUTS outweigh the calls...thinking it will be a red SPY day
2020-08-14 00:22:48,leanpunzz,6,I sold my tsla looks like fomo back in tommorw
2020-08-14 00:22:47,lakersttgy,8,I’m day trading Tesla tmr. Gonna look for confirmation and either scalp with calls or puts. Easy in and out. Love the volatility
2020-08-14 00:22:47,My_Papa_Is_Elon_Musk,-1,Is fortnite broke for anyone else
2020-08-14 00:22:23,-OpportunityCost,3,CSCO coming for your throne @INTC
2020-08-14 00:22:17,-rigga,98,Getting fucked by a mattress company instead of fucking on a mattress has to be the most WSB thing ever
2020-08-14 00:22:09,q112,-5,Imagine imagining you were in imagine dragons singing a cover of imagine
2020-08-14 00:22:04,lizardwizard77,7,You don’t have calls? I’d be alot cooler if you did
2020-08-14 00:21:53,throwmeawayafter111,4,Anyone holding DKNG
2020-08-14 00:21:47,gigantoir,-2,sushi boys not looking too hot
2020-08-14 00:21:44,Hematocheesia,1,What are the chances Trump wins?
2020-08-14 00:21:33,llFruiTCakell,18,i love trading options i hate losing money
2020-08-14 00:21:28,lizardwizard77,6,Futures looking bright 😎
2020-08-14 00:21:27,KegSed,1,"Sell wall was at 1647ish in TSLA today. If it doesn’t get well over that in PM, it might get slapped back down. If it doesnt get slapped, we could see a fun run tomorrow. If it doesn’t, we will see if the volume is there for a run after the sell off."
2020-08-14 00:21:25,SuspiciousStuff3,1,What time does the giant red dildo lighting bolt come crashing down on futures?
2020-08-14 00:21:07,ledxi,8,Someone please just lie to me and tell me my PRPL 8/21 $35 calls are going to be okay tomorrow
2020-08-14 00:21:07,UsernameTaken_123,6,"search for ""stock market from 1800 to 2020"" in Google images

Now, can anyone explain to me why bears even exist?"
2020-08-14 00:20:40,SkuxxMyster,2,Best options 4-6 weeks out?
2020-08-14 00:20:14,VirtusInjection,0,So did tesla gonna make big moves tomorrow morning y’all think?
2020-08-14 00:19:38,tylertime98,19,"i took out a loan to buy Prpl calls because i heard it would go up. why does it say i lost money
😡😡😡😡"
2020-08-14 00:19:17,jyjdlns,7,"Guys I have to decide between:

Happiness in terms of: lambo/expensive lifestyle

Happiness in terms of actual happiness, where you wake up and just feel happy with how your life is going, because you live where you want to live, have friends, good food etc. - but no lambo and shit


What would you choose ?"
2020-08-14 00:19:15,ThePeoplesBard,4,"Holding SPY calls for the first time over night and it honestly feels gross. But good luck, Bulls."
2020-08-14 00:18:50,BiscuitRampage,14,"I don't need the stimulus.  I don't need more money from the stock market.

But if the stimulus package was needed to prevent a second recession, then they shouldn't have left town without passing it.  It makes no sense to interrupt the economy and then pass it anyway later, when it will be less effective because of the momentum shift.

So, a big screw you to Congress today.

Good luck traders.  I know all bad news is good news, but I'm taking a break."
2020-08-14 00:18:37,MakerofMarkets,8,Anyone got any corn porn?
2020-08-14 00:18:27,gda19,3,Got PTON 80c sept 11 am i fukt
2020-08-14 00:18:18,Mynamejeff66666,21,"Guys here’s a drunk revelation for everyone: 

Yellowstone could fucking blow any minute, a meteor could come out of goddam nowhere, a nuke could drop and start a nuclear war. And you’re worried about your fucking IRA? 

Live life to the fullest boys and whatever that means for you. 

SPY 340 8/14"
2020-08-14 00:18:10,rjsheine,8,The market loves no stimulus
2020-08-14 00:18:02,red_man_dan,9,"For the sake of the great city of New York and my shares in the Empire State realty trust, I really hope Deblasio loses his job."
2020-08-14 00:17:46,wildmongoose90210,0,Prison stocks up 10% since Biden announced VP pick kamala
2020-08-14 00:17:42,Willthrowaway2445,9,Joined the INTC gang today 1/15 47c  - Seems its the only cheap stock right now.  Surely they'll edge back up to where they were in the coming months right?
2020-08-14 00:17:33,,4,I hate that if there is another huge dip it will probably take 2 years to do what it did from April to June. So many people got swindled by rich insiders.
2020-08-14 00:16:56,iceiceclinton,9,Got out of PRPL today around lunch time... feels good to be on the right side of a trade for once.
2020-08-14 00:16:56,Rweb88,5,"PRPL PIGS GOT SLAUGHTERED. 

Anyone who didn’t take profits a week ago deserves to lose it."
2020-08-14 00:16:35,trainwreck001,3,"Market TANKS Tomorrow. Here's why: 

$400 Unemployment Supplement Is Really $300, and Won’t Arrive Soon

[https://www.nytimes.com/2020/08/13/business/economy/unemployment-benefits-coronavirus.html](https://www.nytimes.com/2020/08/13/business/economy/unemployment-benefits-coronavirus.html)"
2020-08-14 00:16:30,vzff,2,🙏🙏🙏
2020-08-14 00:16:29,radioref,10,If TSLA came out in the morning and announced they are being included in the S&P 500 the stock would definitely close above 2000 tomorrow and the 15 8/14 2000C that I bought for 15 cents each at the close would totally print and I would certainly take the wife to Rasin Caines this weekend to eat tendies paid for with my tendies.
2020-08-14 00:16:24,Hematocheesia,7,Imagine not cashing out on PRPL. Fools
2020-08-14 00:16:18,DeanYerdon,10,Why does it need to be a gambling addiction for me? Why couldn’t it be alcoholism or something
2020-08-14 00:16:11,lakersbestinleague,8,Watch PRPL drop another 10% at open when everyone exits their positions 😂
2020-08-14 00:16:03,JefBezosExWifesNewBF,1,So whats the pump of the year? My vote is the day NKLA did 100%
2020-08-14 00:15:52,Donttouchmydorritos,5,"To all you dumbass sock cummers screeching how can so and so company be constantly going up, why the fuck don’t you just stop being a douchebag and buy into the rallies?"
2020-08-14 00:15:50,SaqJones,5,you turds are buying options on turds while i sit pretty with my 600 DKNG shares rofl
2020-08-14 00:15:15,MetalliTooL,2,Someone out there got rich on AZPN.
2020-08-14 00:15:05,devildog9,-7,Suck a dick gay nerd bears
2020-08-14 00:14:53,Mdalkirk,2,LF platonic gal pal to talk about stocks with
2020-08-14 00:14:53,aqjingson,3,"I’ll give some internet reward if someone can reply with some facts about how large market cap stocks tend to perform one week prior and after their stock split, thanks"
2020-08-14 00:14:42,Peter_Banning,1,Ripip PRPL gang
2020-08-14 00:14:41,theta-dog-420,3,PRPL boys now homeless
2020-08-14 00:14:34,NoLimit315,3,"Anyone else have zero social media outside this?

Going on a decade and I really do feel ancient."
2020-08-14 00:14:00,MakerofMarkets,25,At least I didnt get scammed by a mattress company today
2020-08-14 00:13:55,eyerollingsex,12,So can Biden get a press secretary as hot as Kayleigh? This factors into my vote
2020-08-14 00:13:49,Noontimesnoo,3,"PUTS on Intel
https://youtu.be/gXReifFHXbY"
2020-08-14 00:13:44,dweeegs,12,"Tech is just a self fulfilling prophecy at this point

Why are you buying Shopify and Tesla? Idk everyone else is. Repeat for months"
2020-08-14 00:13:33,SFtoSD,4,I have 5 rupees 25 yen and 17 pesos. What stonk will make me rich
2020-08-14 00:13:32,lasco10,1,"Hog Hoe’s had a good day today, almost on par with Cob Mob. 🐷 🌽"
2020-08-14 00:13:24,stonksthrowaway730,1,What do you think an 08/21 PRPL 20P will be worth tomorrow
2020-08-14 00:13:19,Barracuda_Blue,2,"I'm too heavy in gas and oil with returns exceeding 300% in leaps. I know that as soon as I trim back or cash out, all hell will break loose somewhere and oil will spike to $85 a barrel. Maybe I'll just roll them forward?"
2020-08-14 00:13:16,MrRigobertos,6,Friday better put on a god damn show.  If SPY doesn’t hit above 441 or below 333 at least once intraday then I will be disappointed.  Preferably both.
2020-08-14 00:13:07,fuzzyblankeet,5,Fuzzy $PRPL breakdown drops Monday market open
2020-08-14 00:13:01,arichnader,1,BRO ALL THESE OPTIONS ARE DYING. my gain went from 250% to 100% and I sold this morning
2020-08-14 00:12:40,q112,43,"“_________ is a bubble and you guys are still buying calls?? Lmaooooo”


Yeah dude, I literally do not care, as long as I get out before it pops it has absolutely zero effect on me. I would seriously buy calls on company named BUBL if I knew I could make a few bucks."
2020-08-14 00:12:35,EwNotLikeThat,3,💅💇‍♀️💁‍♀️🤰
2020-08-14 00:12:20,rah_karo3,0,thanks for buying my OTM TSLA spreads its FUR sure going to break 1.8k guys
2020-08-14 00:12:03,fawkesmulder,11,"I cut drinking soda to be healthy, but I just had some coke and holy shit I can’t believe how fucking good this is. No wonder we get fat, it would be so easy to drink liters of this per day.

Especially that cane sugar, glass bottles from Mexico.

Shares KO (dividend) - they ain’t going anywhere"
2020-08-14 00:11:58,Great_Chairman_Mao,5,We’re going to wake up to silver $28 an oz and then slow climb all day to $28.75 tomorrow. Book it.
2020-08-14 00:11:55,ControlAltDelTiddy,7,"Every bear thinking their puts are worthless, just relax there's still like 12 hours until open. Europoors are actually as poor as the US right now if not more, Hang Seng is probably gonna have some diarrhea and the Nikkei is just gonna keep trying to stay afloat like it was 1980. Y'all see a +.2% futures and shit your pants. Remember it's just digital money."
2020-08-14 00:11:40,PlaneReflection,3,"I can tell my future kids I had calls when SPY hit ATHs, when JPOW beat the bat flu with his brrrrrinter."
2020-08-14 00:11:39,dudz23,6,MU continuing to be a piece of shit.
2020-08-14 00:11:35,ReadAndReddit123,9,The US Tech 100 is the new high yield savings account
2020-08-14 00:11:18,tylertime98,10,"

Google play removed fortnite from their store too HAAHA





https://www.theverge.com/2020/8/13/21368079/fortnite-epic-android-banned-google-play-app-store-rule-violation"
2020-08-14 00:11:02,cutiesarustimes2,5,"Twitter gleefully celebrating trump liking pissing matches while congress hands their money to the rich and the fed and banks loot their accounts is peak america.

Calls on pyrrhic victories."
2020-08-14 00:10:29,creature1231,7,"So I saw someone saying that Square (SQ) is used by prostitutes to get paid. So needless to say I'm going to get calls at open. 

It'll tank right after, you've been warned."
2020-08-14 00:10:12,G23456789,10,If Tesla ain’t 1825 tomorrow I ain’t sellin
2020-08-14 00:10:12,TAWS,0,"Government suing AAPL

https://www.google.com/amp/s/mobile.reuters.com/article/amp/idUSKCN259332"
2020-08-14 00:10:01,lander69,2,This corn shit is getting real.
2020-08-14 00:09:59,wd1998313,6,You betta thank me for buying QQQ puts right before close you simps!
2020-08-14 00:09:46,SaqJones,2,So I see a 240% IV for DKNG options tomorrow. That means DKNG can range from $36 to 110$ tomorrow cool. Make millionaires
2020-08-14 00:09:40,Hellforasailor,8,I didn’t trade well today but learned and will make more progress tomorrow.
2020-08-14 00:09:22,shindiggaa,9,"SPY ATH tomorrow on a glorious Friday.

My position is only TSLA 1700c FD. Very big stonk numbers AH!"
2020-08-14 00:09:21,Ramboow23,7,Watching futures is like watching paint dry.
2020-08-14 00:09:17,drkgla,10,We could have the greenest day on god's green earth but MSFT will still trade flat or mildly red.
2020-08-14 00:08:55,curiousprovisions,6,Hah those fuckers sold the fuck out of TSLA at right when AH closed. 1 min RSI is below 12... sheesh
2020-08-14 00:08:55,Hematocheesia,3,Damn UberEats ain’t giving me anymore $10 promos. Wtf you’re trying to be profitable all of a sudden Uber?
2020-08-14 00:08:33,Sea_Seaworthiness,3,Just bought a bunch of shitcoins. Is this life now?
2020-08-14 00:08:09,Huey_Long_Schong,9,"LMAO, out of all commodities, 🌽 outperformed everything last week at +4.42% WoW, and by a large margin too (crude oil +1.31% at the second place). It even beat the S&P 500, NASDAQ, and DOW. Strap in for we are heading to a future where corn dictates every single aspect of life, a true *Corntopia*"
2020-08-14 00:07:12,wooderboy1,7,"If you ever think your retarded, just look for matches on hinge to feel better about yourself."
2020-08-14 00:06:51,drkgla,6,Apple and Google is ass hoe
2020-08-14 00:06:43,justseeyoutonight,12,Apple has doubled in value in 6 months and y’all don’t think this is a bubble
2020-08-14 00:06:38,TAWS,6,Break up AAPL for them trying to kill PTON
2020-08-14 00:06:32,pron_site_operator,3,/ES 3379.25 is the line that bulls must cross.
2020-08-14 00:06:19,Wino-Junko,3,Wolf of wall street or the big short?
2020-08-14 00:06:16,richbeezy,6,ENPH is on the verge of going parabolic. So much to love about them.
2020-08-14 00:06:01,WagieInTheCagie,4,"🧳💼👜🧳🛍

👁👄👁"
2020-08-14 00:05:43,mattrob1995,3,"aggressive dip buying on /ES sheesh

""oh it's at the VWAP? BUYBUYBUYBUY"""
2020-08-14 00:05:39,lifesimulationadmin,3,Holding LOW 8/21 calls. Already up 2x. Considering selling tomorrow to avoid theta. What do?
2020-08-14 00:05:37,Kramnet,4,"AMC charging 1920 price of 15cents a ticket, but was the popcorn and soda still $50 in 1920? 

Corn calls confirmed"
2020-08-14 00:05:28,UndertheShayde,7,I bought 4 $10 puts on sea world 2 months ago. Can you believe after horrible earnings and horrible news they gapped up? Ladies and gents....this is our market.
2020-08-14 00:05:06,Donttouchmydorritos,4,TSLA will test 1794 tomorrow around 12:30 PST. Run up will start around 11:30 PST.
2020-08-14 00:04:55,Barracuda_Blue,5,"I don't like girls nicknamed 'Peggy."" I wanna feel the heat of the real meat."
2020-08-14 00:04:46,thenimblecentipede,2,"I've been following this sub for a while and literally everything posted goes to shit, CVS, ELY, ATVI, PRPL, AZN, just a few from the top of my head. How the fuck is this game supposed to be played. I get inverse wallstreet is the meme, but even then it's fucked. 95% of the people on here don't know jack shit on how to invest and are giving retards investing advice, kinda fucked. Why not cut out the middle person and just rob them.

edit: with that said, what's the next play? I'm ready to make it big for reals this time <3"
2020-08-14 00:04:40,ethereumkid,3,"> Google pulled ""Fortnite"" from its Google Play app store, joining Apple in a high-stakes dispute over in-game purchases

https://twitter.com/WSJ/status/1294058997260193798"
2020-08-14 00:04:34,bliss16,0,options are so cool. you can construct trades to have specific exposure to individual greeks and also control the amount of leverage you have. all options strategies are a combination of long and short options.
2020-08-14 00:04:32,black_and_shredded,1,AUY still a buy? Wanting to tie up some buying power after a lucky two day streak. Thinking shares and selling calls on them
2020-08-14 00:04:17,MongolianThroatSing,6,"It’s like you guys didn’t even see Trumps charts yesterday

You could clearly see the US bar chart had larger bars than the other ones what more do you need to know?"
2020-08-14 00:04:11,reditt84,1,Buying the shit out of oil tomorrow’s morning
2020-08-14 00:03:54,Cramer4President,2,"BREAKING: Bears r fuk

-Bloomberg"
2020-08-14 00:03:50,winnning007,4,"0dte. Don’t miss out on 50-100 baggers. 


If u got RH ... lolz"
2020-08-14 00:03:25,liquid_swords,2,Anyone thinking puts on Uber and Lyft after they lost a bid to delay worker reclassification in CA?
2020-08-14 00:03:06,NoLimit315,5,All 12K of my net worth sitting in robinhood so student loan ppl don’t freeze my bank acct
2020-08-14 00:03:04,G23456789,4,"Wow Tesla really baited me in AH, whatever PM is really what will cause some movement"
2020-08-14 00:02:59,gpeters1,3,Trump cutting capital gains 🇺🇸 🦅
2020-08-14 00:02:31,,5,Ready for the V-Bucks standard
2020-08-14 00:02:18,DoggieKim,16,imagine thinking fortnite has ANY influence on AAPL 🤡
2020-08-14 00:02:12,csr8765,0,Don’t get your hopes up boys tomorrow will be another low volume flat day
2020-08-14 00:01:56,DiamondHanded,14,"FB $280  
AMZN $3320  
TSLA $1780  
DOCU $230 (poster's choice)

They called it ""ATH Friday"""
2020-08-14 00:01:33,Dmillehee,12,If your portfolio ain’t 100%  Apple wtf you doing
2020-08-14 00:01:13,605_,31,Dude I’ve never heard of PRPL mattresses in my entire life until I came to this sub and y’all throwing your savings accounts on it 😂
2020-08-14 00:01:02,i_love_my_scrotum,8,Can someone explain why almost every AH/premarket INTC is green then goes shit red during the day?
2020-08-14 00:00:37,tyreeks_son,6,wtf tsla
2020-08-14 00:00:19,SolitaryEgg,30,"Oh thank God, all the bears saying their puts are fucked at 7:59pm.

Literally the best bearish indicator on earth.

I will sleep like a baby."
2020-08-14 00:00:16,infinitelimits00,11,There probably was like maybe 10 people in the world who thought we could reach ATHs again by end of August on March 23rd.
2020-08-14 00:00:13,heresmykey,16,Apple pricing in like it has no exposure to China
2020-08-14 00:00:06,Stockengineer,2,Well as long as we hold these levels. Or if spy wants to break 340 tmr id be happy
2020-08-13 23:59:59,Peaches0k,10,Stop gambling your money away into the market and Venmo me so I can outfit my garage gym pls
2020-08-13 23:59:54,chadpewtin,15,PROTIP: if you want real life DD just go on the company website -- contact us --- investor relations and ask whatever questions you want. They usually respond. I emailed APT and TDOC about stuff and they responded pretty quickly. oh and fyi... TDOC and LVGO merger will be complete 4th quarter
2020-08-13 23:59:48,esk8_one,2,I have $5k to gamble with. What should i buy tomorrow for guaranteed profits
2020-08-13 23:59:42,aqjingson,4,I feel like I got bamboozled by Tsla ah wtf
2020-08-13 23:59:42,strangerx03c,3,I was looking forward to my TSLA calls printing tomorrow. But I guess with these PRPL bags I’ll probably break even
2020-08-13 23:59:41,ReadAndReddit123,2,#Wow it sure would suck to go into tomorrow with puts. Big stock market numbers
2020-08-13 23:59:36,visionarymind,4,BYND🍀🥩 👢👀🎋ℹ️🆖 GUHd ✌️ ♏️ℹ️ℹ️
2020-08-13 23:59:35,AcrobaticWord2,4,"I have my entire account in 48 SPY 338 calls expiring tomorrow, need 338.70 to break even."
2020-08-13 23:59:30,SilverSpirit7,2,Looks like we're most likely green tomorrow boys
2020-08-13 23:59:24,madeenahjyasu,22,SLV GANG will finally slay the crusty ancient dragon that is JPM
2020-08-13 23:58:59,mydandy11,1,Wtf is $MELI as a company their stock price? Anyone cares to explain
2020-08-13 23:58:50,AyeeTerrion,7,Can someone whose not a noob help. I’m super deep in my Apple options play and it expire 8/21. Should I sell closer to expiration or sooner because doesn’t the closer you get to expiration it devalues your contact?
2020-08-13 23:58:46,abbyabbster,1,Why is PYPL climbing AH?
