date,author,score,body
2020-08-20 16:20:30,rookienumbers6969,1,Will Apple hit 480 by Friday??
2020-08-16 23:01:18,aorta89,1,Soooooooooooo... I have aapl 9/11 465c but the stock splits 8/31. What the fuck happens?
2020-08-16 15:22:36,Turlututu_2,1,"its finally sunday. dont forget that the rug pull is always scheduled for tomorrow

im not being specific on which tomorrow though"
2020-08-14 21:49:22,kinkyhentai69,1,is there any reason not to have the markets open 24/7 in an era where computers do all the work ?
2020-08-14 19:27:35,highflyer01,1,Timmy Apple is mean. Stole the money Lisa AMD gave me
2020-08-14 17:54:33,russianstocks,8,Niggas lost a lot of money today
2020-08-14 17:12:40,KeyserS0ze666,2,"Team $RKT

how are all options in the red (both puts and calls)?    i bought 20c 12/18 when the stock was at the low $18.40 yesterday when it was at a 25% loss.    it shoots up today and im up until a few hours ago and now down 20%   wtf"
2020-08-14 16:19:47,RMonroeski,3,"Did anyone get in on CVAC? IPO price was supposed to be 16, trading at 30 something now"
2020-08-14 16:02:20,llFruiTCakell,1,netflix need some love :(
2020-08-14 15:11:33,AssistRegMngr,2,"Bad news good, good news bad"
2020-08-14 15:09:27,IAlsoLoveBasketball,3,"God damn there are some dumb, purely emotional traders here. Makes me feel like a boomer in comparison with how risk averse i am in comparison"
2020-08-14 14:41:10,tdotz123,0,Tesla needs to break thru vwap to push up higher
2020-08-14 14:07:07,Eaglecrest2018,1,They make AG chemicals for growing corn.
2020-08-14 14:01:52,Edwinbuddy,1,What’s the cure for hangovers 🤦🏽‍♂️
2020-08-14 13:47:14,happyjackss48,10,"so many trading careers ended this week

yikes! gg guys."
2020-08-14 13:43:02,CuriousNecklaceGuy,3,TSLA holders aren’t selling off easily. Very good sign
2020-08-14 13:42:38,happyjackss48,2,"BUY BUY BUY

can't go tits up

*lol*"
2020-08-14 13:31:43,stonkdropandroll,1,BUY THE PRPL DIP BOIS
2020-08-14 13:30:03,1dmkelley,2,Ding ding ding
2020-08-14 13:14:48,Bitcointhummper,2,Can someone talk me out of putting half my portfolio in a tsla 2000k sep 18?
2020-08-14 13:00:23,MrCoolizade,1,"I think I figured it out, there is a correlation between case # and SPY. The correlation is positive."
2020-08-14 12:46:40,AllDatDalton,1,Lollll
2020-08-14 12:44:57,1foxyboi,1,Is the market ever going down again
2020-08-14 12:30:35,analyst_84,2,Cash gang rise up
2020-08-14 12:24:48,lokapolly,7,Think we might crash today. Got a feeling
2020-08-14 12:17:51,BorisYeltzen,2,Bears in shambles
2020-08-14 12:17:42,love2fuckbearasshoe,4,YES TECH :)
2020-08-14 12:17:17,chewks,2,hold or sell tesla at open?
2020-08-14 11:58:02,Safina_,2,Just gonna sell more PRPL puts today
2020-08-14 11:55:16,balloonhi4000,1,#BEARS BROKE
2020-08-14 11:38:55,The_Terrific,6,"father forgive me, for i have bought the intc dip"
2020-08-14 11:34:54,Dategmiot,3,"Wondering if the Europoors are really the 🌈🐻 emotional support group in disguise. It's almost like those people hate tendies, wtf!"
2020-08-14 11:33:04,mosinnagantrifle,8,Chat is weak. Looks like everyone’s asleep. Cant make money like that guys
2020-08-14 11:26:44,HerezahTip,1,Balls deep in puts if we fade to green before open again... I’ll lose a couple hundy
2020-08-14 11:18:56,Revolant742,3,If VIX continues to 🌙 I might not have to sell the farm. 🌽 🚜 🐖
2020-08-14 11:16:43,Kakilli_,1,"BABA getting added to the HSI, big pump inc"
2020-08-14 10:48:39,ReadAndReddit123,3,Futures... whoa
2020-08-14 10:41:39,Donttouchmydorritos,2,TSLA going for that 07/23 1689 gap fill today
2020-08-14 10:40:43,IVDrips,3,Anyone else notice how low the Retails Sales expectations are set for this morning? We have to smash - but If we match or miss do we tank like a lead brick today?
2020-08-14 10:37:56,Scottysewell,1,whats a smart aapl leap
2020-08-14 10:37:30,The-Hyrax,0,Friendly reminder that the FED is gonna pump 12B in the market today according to their schedule
2020-08-14 10:34:30,iSufiyan,2,Green by open
2020-08-14 10:34:13,fwoot_fwies,7,TSLA up on that potential new China car model news?
2020-08-14 10:32:26,Affectionate_Leave_4,6,"Tsla doing it again 😅 
Rocket 🚀?!?"
2020-08-14 10:31:38,Scottysewell,14,"Silver bouncing back, could be back to last close by open. who knows wtf am i saying"
2020-08-14 10:29:57,iguy22,0,Fucking my hand hella good rn
2020-08-14 10:29:13,IVDrips,9,"The last week of June - the S&P was hovering around 3000 with pressure to the downside until Mnuchin came out and said we will have another stimulus package with further UI benefits protected before they expire in July (pump, pump, pump)

S&P bumps to 3200 where it stays until mid July and the Senate finally finalized the HEALS Act. Again, with assurances from Mnuchin a deal would be reached shortly with the House/Senate minority (pump, pump, pump...)

We mooned on a pump and prayer from Mnuchin end of July and it turned out to be crap. The stimulus we 'mooned' on was not just about the UI benefits. I have been terrible at trying to time this, but this market is going to crash hard before both sides come to the negotiating table. When? Who the fuck knows."
2020-08-14 10:25:25,TairyHaint,3,Was going to sell my TSLA spread at open but I dunno about that now lmao
2020-08-14 10:23:42,,3,daily thread is up
2020-08-14 10:21:05,Throwawayeconboi,7,We should do an IRL WSB meetup but it has to be at the Cayman Islands so we can weed out the shitters
2020-08-14 10:20:50,breakfastsamurai,0,Almost forgot what a red day looks like.
2020-08-14 10:20:05,creature1231,1,"Almost twice as much pullback as the financial crisis, but this -2% day will price it all in. 

Back to regular uppies on monday."
2020-08-14 10:18:13,Nate_Doge,5,Got a nasty carpet burn earlier I should have known this was coming
2020-08-14 10:17:34,dana1234567,1,I woke up today expecting a new nickelback album and it was only a cover? Plus it being blood red? Fuck today sucks
2020-08-14 10:17:30,Chicano_Ducky,5,"the DAX got murdered because China also missed forecasts.

how tf does China miss forecasts?"
2020-08-14 10:17:27,Donttouchmydorritos,4,KODK’s 5yr chart is nuttier than squirrel shit.
2020-08-14 10:17:18,SolitaryEgg,1,"S&P 3350 STRAIGHT AHEAD

PREPARE THE LIFEBOATS FOR THE BULLWOMEN AND BULLCHILDREN"
2020-08-14 10:17:17,WSBrexiteer,3,When you're completely ambivalent about Europe dying because you just know CORN is about to POP OFF 🌽🍿🚀
2020-08-14 10:16:36,drdixie,0,Any SPCE boyos up this early?
2020-08-14 10:16:23,ProfessionalCrazy3,-4,I love hot women
2020-08-14 10:16:21,Alone_and_unafraid,3,This market I'll tell you hwhat
2020-08-14 10:15:40,IVCrushingUrTendies,2,Sweet another Friday that some of my positions will be on the bubble EOD. Man those Euro numbers are terrible.
2020-08-14 10:14:29,cuzih8u,2,What in the fuck happened to futuress
2020-08-14 10:14:20,jday112,3,"Ahh good ol europoors, knew I could count on ya"
2020-08-14 10:13:56,wnsgus,2,"Anyone thinking of jumping in on Panasonic (PCRFY) shares before Tesla’s upcoming battery day? It’s sitting pretty low and I could see an uptick leading up to the event. 

No options unfortunately."
2020-08-14 10:13:54,Cmdr_600,15,⡟⠛⢻⣿⡟⠛⣿⡟⠛⠛⠛⠛⢻⣿⡿⠛⠛⠛⢻⡟⠛⠛⠛⠛⢻⣿⣿⣿ ⡇⠄⠄⢻⡇⠄⣿⣿⣿⠄⠄⣿⣿⡏⠄⣼⣿⣿⣿⡇⠄⣿⣿⣿⣿⣿⣿⣿ ⡇⠄⣧⠄⠄⠄⣿⣿⣿⠄⠄⣿⣿⡇⠄⣿⣿⣿⣿⡇⠄⣥⣥⣥⣿⣿⣿⣿ ⡇⠄⣿⣧⠄⠄⣿⡟⠛⠄⠄⠛⢻⣷⣄⠈⠙⠛⢹⡇⠄⠉⠉⠉⢹⣿⣿⣿ ⣿⡿⠛⠛⠛⢻⣿⠿⠛⠛⠛⢿⣿⣿⡿⠛⠛⠛⢻⡟⠛⣿⡿⠛⣻⣿⣿⣿ ⡟⠄⣼⣿⣿⣿⡇⠄⣾⣿⣧⠄⢻⡏⠄⣼⣿⣿⣿⡇⠄⡟⢀⣴⣿⣿⣿⣿ ⡇⠄⣿⣿⣿⣿⡄⠄⣿⣿⣿⠄⢸⡇⠄⣿⣿⣿⣿⡇⠄⣀⠈⢻⣿⣿⣿⣿ ⣿⣄⠈⠙⠛⢻⣧⡄⠙⠛⠉⣠⣿⣷⣄⠈⠙⠛⢹⡇⠄⣿⣧⠄⠻⣿⣿⣿
2020-08-14 10:13:53,dsun1,7,Does fortnite really think it could take on big tech??
2020-08-14 10:13:31,Baconmessiah420,7,"Has nothing to do with stocks, but I think I have a ghost in my house.👻

Watched three picture frames get pushed off a mantle by themselves. Still processing it."
2020-08-14 10:13:19,Bluemoonclay,5,Who ordered a rug pull
2020-08-14 10:13:07,DeanYerdon,0,TSLA 🤤
2020-08-14 10:13:00,Nick9502,4,In this sea of red TSLA stands tall. Nice
2020-08-14 10:12:48,JefBezosExWifesNewBF,2,"THIS ONE IS FOR YOU VIX ☺️


Alexa, play Up Where We Belong by Jennifer Warnes and Joe Cocker"
2020-08-14 10:12:39,SavorySkills_,5,Silver uppies or downies today?
2020-08-14 10:11:23,creature1231,7,"Hello miss Printer, can Stimmy come outside to play?😊"
2020-08-14 10:11:22,TheAmazingSpiderBan,2,Daddy Elon pls
2020-08-14 10:10:42,Donttouchmydorritos,8,"TSLA already up 2%, breached yesterday’s high... gonna be a run to $1700+ today"
2020-08-14 10:10:37,PsychoSynthesizer,-1,"No Mr Sorkin, Apple won't just put up the price of their phones. They will be forced to compete more and crimp some of their huge margins....This spat can't be spun as a good thing for Apple"
2020-08-14 10:10:28,MetalliTooL,1,Kodak... lol
2020-08-14 10:08:54,Throwawayeconboi,8,"TSLA is on X Games mode again, congrats to all you fucks. Somehow I can never bring myself to play it"
2020-08-14 10:08:31,cbitz,4,I missed this coked up mornings on cnbc
2020-08-14 10:08:29,send_the_gnar,7,red futures means they will find some vaccine news to pump for sure
2020-08-14 10:08:18,junkrattrap,14,I like how 3 banks have upgraded Tesla since its up 20% so they can appear like they predicted this shit.
2020-08-14 10:08:03,yaboiRich,15,"The girl from the AT&T commercials is so damn hot. 

Calls on the AT&T girl"
2020-08-14 10:07:58,LeafLocal,7,Only people who should be scared of bear markers are investors. Day traders should thrive in the volatility of that type of market
2020-08-14 10:07:45,ShinyPants45,2,I need vxx to go to about 28 today please
2020-08-14 10:07:28,Frank3434,2,"Investing gods you fucked me on fastly, you fucked me on PRPL don't you dare fucking me on PTON and NET you piece of sh\*t"
2020-08-14 10:07:25,redfish303,0,We all know what to do. Dip? Already bought
2020-08-14 10:07:24,creature1231,2,At least I have some retarded FD puts that make up for my silver losses today. Why the fuck is Europe so Red?
2020-08-14 10:06:54,Throwawayeconboi,10,"If I died, would u guys cry"
2020-08-14 10:06:28,junkrattrap,1,"https://twitter.com/livesquawk/status/1294213560176975873?s=21

Still not worth jumping into $AZN"
2020-08-14 10:06:16,foolsirkle,9,"AMC 20th Anniversary & grand opening 8/20 🚀🚀

15 cent movie tickets
$30 cokes 🧉 
$25 popcorn🍿 
$20 hot dogs 🌭"
2020-08-14 10:05:37,SX2k7,6,Tesla gapping up!
2020-08-14 10:05:23,Baconmessiah420,5,Wonder how fucked up Airlines are gonna be without that second stimulus. 🤔Hmmm
2020-08-14 10:04:48,Donttouchmydorritos,-1,"Bears about to get reamed, invest in UL, Vaseline may start flying off shelves"
2020-08-14 10:04:12,eduardopazruiz,3,I miss Epstein so much :(
2020-08-14 10:04:09,z3ro-chill,4,Sup PURPLE gang! Haha told you inverse these tards when they hype a stock
2020-08-14 10:03:25,balloonhi4000,1,Bears in shambles
2020-08-14 10:02:42,jtvez,6,"""No stimulus? Doesn't matter, money printer go brr""

Famous last words"
2020-08-14 10:02:33,be_lou,2,Holding these 23 SLV Calls for september has taught me more in the last week about perseverance than any other life lesson. from up 250% to up only 10% and then seeing the charts this morning. i should really learn to sell. trying to turn my 500 account into 10k for closing costs for a house and the 6k mark seems to be fire. every time i approach it i hit a bad day and dont know what the fuck to do.
2020-08-14 10:02:28,confusedtaco,2,any fire nation stocks?
2020-08-14 10:02:22,thesnukeIL,6,HOLY SHIT tech is so fucking strong
2020-08-14 10:01:47,AgentChester,3,Pop Smoke :(
2020-08-14 10:00:20,Patriotnation5,10,"So Taiwan Semiconductor Manufacturing is not the secret to a lifetime of wealth, wish I knew that"
2020-08-14 10:00:16,CptTonyStark,4,This market
2020-08-14 10:00:13,,5,I like my women like I like my leather: supple
2020-08-14 10:00:03,elija_snow,9,I like to this Pelosi broad. She play poker with out fears. 💪
2020-08-14 09:59:59,macrorip,5,When the gods are cruel they grant your wishes
2020-08-14 09:59:25,SlimyMarvin,9,Where my TSLA bois at 🚀
2020-08-14 09:59:23,analyst_84,1,What’s the wholesale price of a pound of really good weed?
2020-08-14 09:59:10,JonnyBonkers,4,"Only 3 hours and 30 minutes for futures to be green again? 
 
Bet it can do it in 2"
2020-08-14 09:58:32,tex_3,2,MESO. Gonna moon 50% today
2020-08-14 09:58:14,AgentChester,3,None of us will ever have the Guap like drake does :(
2020-08-14 09:57:46,elija_snow,7,"When Jimmy Crammer aka "" Mr.Pump it Up"" is the voice of reason expect the Market to drop -500 points. 💯💯💯"
2020-08-14 09:57:45,yaboiRich,1,How much does a 8ball of blow run where you live?
2020-08-14 09:57:24,SlimyMarvin,10,Why SLV so volatile AH
2020-08-14 09:57:23,Throwawayeconboi,8,"This is a moment to be cherished. We got the emoji PhD, the analcyst, the 🤡, the 🥚, the 🍤, the memelord, etc. all active at the same time."
2020-08-14 09:57:06,SavorySkills_,4,What’s SLV going to do today?
2020-08-14 09:56:58,siorge,2,Who's willing to bet that RVLV does an OSTK and goes x10 within a few month?
2020-08-14 09:56:32,JefBezosExWifesNewBF,6,"Its 6am and its going to be a bloody friday? 

Alexa, play Still by Geto Boys"
2020-08-14 09:55:45,nosalute,3,DXY is skyrocketing rn
2020-08-14 09:54:17,robertobaggio91,17,"Everyone assumed money would keep flowing from Congress. Congress off until September, no decisions made. Unlikely to reach agreement this close to election, why would either side concede or negotiate. 

Very bad for equities. I'm a bull, but the current environment is looking ugly.

Buy gold and silver."
2020-08-14 09:54:07,AgentChester,4,All hail chief keef
2020-08-14 09:53:29,iSufiyan,8,"China closed green for the week. Really America, you gonna be gay red just because of Europoors? 
This isn’t the America I grew up in. We should beat them dirty commies with more green. 

USA USA USA 🇺🇸🇺🇸🇺🇸
🦅🚀📈💰🇺🇸"
2020-08-14 09:53:17,Ugly__Pete,2,#🌽
2020-08-14 09:53:07,AgentChester,1,https://youtu.be/Xs-UEqJ85KE
2020-08-14 09:52:38,visionarymind,-2,"https://m.youtube.com/watch?v=5qm8PH4xAss 

ℹ️Ⓜ️❇️♌️ℹ️🖇✨ 🅰️ 🅱️🤖✝️ ®️eeeeeeee🅿️🛴⚠️©️ℹ️🆖 ♏️ℹ️ℹ️

👢〽️🍑💩 🎏♾🎋😹😹"
2020-08-14 09:52:26,OverAndUnder500,5,What’s going on in Congress is disgusting. Help the damn people.
2020-08-14 09:52:21,bigpee69,3,Idk what all the stock market talk in here is all about but I just want a hung shemale to break that dick off in these cheeks and take me on a fishing trip or whatever fathers are suppose to do
2020-08-14 09:52:20,nosalute,22,"Imagine being up at 5:52 in the morning

^(message brought to you by 2:52 west coast gang)"
2020-08-14 09:52:18,RnGesus14,13,Look I don’t ask for much in life but I need AMD to yolo rally about 6 dollars on this glorious Friday. My account and life is small potatoes. I just need a little butter to go on top
2020-08-14 09:52:00,1005thArmbar,8,RKT please stop fucking me
2020-08-14 09:51:02,schlenkerk15,4,"Fellow retards, just because congress went home does not mean stimulus can't be passed [link](https://www.bloomberg.com/news/articles/2020-08-14/stimulus-talks-are-stuck-in-1-trillion-ditch-over-aid-to-states?srnd=premium&sref=9bU3crNI)"
2020-08-14 09:50:41,hypertr00per,0,Pls gold let's check that 1900 today. silver pls 23
2020-08-14 09:50:32,Donttouchmydorritos,-10,"I cringe every time someone says “this market”.


You sound so professional and you should definitely pickup trading as a full time job. I’m sure the hedge fund managers would be so impressed with your vocabulary."
2020-08-14 09:50:16,Throwawayeconboi,14,Only real ones up right now 🥱 I recognize all these usernames
2020-08-14 09:50:08,haasvacado,1,My memory is shit but wasn’t there a day last week where the DAX and FTSE were down like -3% or -4% and we ended the day green?
2020-08-14 09:49:56,analyst_84,9,"The stock market crash of 1929 and the subsequent Great Depression cost Fisher much of his personal wealth and academic reputation. He famously predicted, nine days before the crash, that stock prices had ""reached what looks like a permanently high plateau."""
2020-08-14 09:48:50,elija_snow,7,It's 6:00 AM do you know where you're 🌈🐻 & 💵🐂 are?
2020-08-14 09:47:35,adatausb,4,What news came out at 1am that crashed futures all of a sudden?
2020-08-14 09:47:00,yaboiRich,4,INO shit the bed this week. Time to buy the dip?
2020-08-14 09:45:36,Buildingdetroit,3,"Sweet. This is exactly where futes should be, slightly red, for the levels we are at, in order to smash through ATH""s and make that shit stick over the weekend.  Now I know we getting stim end of day. MAKE ME RICH PAPA ELON AND DADDY TIM APPLE!!!!!!!"
2020-08-14 09:45:10,pervsensei11,11,"Just paid 2$ for a blowjob from the PRPL shill behind my local Burger King

How is everyone doing"
2020-08-14 09:43:35,schlenkerk15,3,"For all you bears wondering why shit keeps going up. Why are you still not looking at [money supply](https://tradingeconomics.com/united-states/money-supply-m2) and pretending it isn't real. Seriously, stop buying puts. A 30-35 P/E is not that bad for a company that is growing earnings with the alternative rates of return out there"
2020-08-14 09:43:00,Nafarious,3,Thoughts on SLV doing a dead cat bounce?
2020-08-14 09:42:54,saifly,1,Who’s going into WMT for next week’s ER?
2020-08-14 09:42:13,JefBezosExWifesNewBF,3,"Remember.  When we gap down then rally and fill the gap, buy puts"
2020-08-14 09:42:06,wilhelm96,2,"That IBEX index looks scary. Talk about L shaped recovery, Spaniards still fighting a ceiling set in April"
2020-08-14 09:41:43,elija_snow,12,Epic Game CEO During Meeting:  I did the math & peep the science. We can sue APPL for 10x our company worth. 💵💵💵💵💵💵💵💵💵💵💵💵💵💵💵💵💵💵💵💵💵💵💵💵
2020-08-14 09:41:41,hypertr00per,2,scalping gold = high risk free money
2020-08-14 09:41:37,foolsirkle,3,There goes NKLA acting like a ◼️
2020-08-14 09:41:33,angryirishman,1,Anyone used IKBR margin before ? About to dip a toe tmrw
2020-08-14 09:40:37,heartstesler,2,"Eurozone GDP falls 12.1% in Q2

The seasonally adjusted gross domestic product (GDP) in the euro area contracted by a seasonally adjusted 12.1% in the second quarter of 2020 compared to the previous trimester, according to an estimate released by Eurostat on Friday. In the entire European Union (EU27), the economy shrank by 11.7% on a quarterly basis. Both figures represent the steepest GDP drops since the report started getting published in 1995.

GDP contracted by 15% in the Eurozone and by 14.1% in the EU27 in the second quarter compared to the same time span a year ago."
2020-08-14 09:40:26,Throwawayeconboi,7,"Open up universities, not elementary schools 😢


Sentence those little fucks to Zoom for life for all I care."
2020-08-14 09:40:14,neoarchaic,4,"Anybody else think it’s funny 🤔 how headlines do not even resemble what’s happening in the market.

Totally uncoupled from reality, headline futures mrkt slip on bad euro/Asian outlook or Asian markets muted as they await US stimulus news.

This whole world we live in is fugazi"
2020-08-14 09:40:00,CptTonyStark,3,many 🔢 bears 🐻 comparing favorite 📑 red 🔴 dildos 🍆 of '29 and '87👌💦
2020-08-14 09:39:43,mattrob1995,5,"CNBC:

Stocks still on track for positive week

VIX:

Hold my beer"
2020-08-14 09:38:53,balloonhi4000,7,Bears fuckin gay
2020-08-14 09:37:49,mmmokisee,1,I got SPY 340 calls yesterday that expire today. Are we printin'?
2020-08-14 09:37:28,almostmicrochip,4,"at least i get paid today 


and it looks like stonks will be on sale!"
2020-08-14 09:36:39,JefBezosExWifesNewBF,6,UVXY printing today fuck ya
2020-08-14 09:36:19,Donttouchmydorritos,2,Looks like all the experts are back rallying up their little bear friends...
2020-08-14 09:35:54,cbitz,7,Only people with no children don't want schools to reopen imo
2020-08-14 09:35:34,,-6,"I want to present a different point of view about bears

I see a lot of posts blasting bears with the reasoning that they are betting against America or something on that line

But there is another explanation why some of us expect or wish for the market to tank

It comes down to empathy 

Some people actually empathize with all the human misery that's going on out there and our moral stance makes it very difficult to accept that a lot of people can make a lot of money by taking advantage of these dire circumstances where literally half the country is struggling

So it's not like bears wish utter destruction or rooting for others to fail

Bears simply are crying inside when they see how much suffering is going on out there and they wish that maybe the more fortunate can for once in their lives resist that greed and actually try to be a decent human being and help others who are less fortunate

Show some god damn sympathy for others and stop constantly obsessing about the fucking stonk market

The stonk market would not exist without people

And people are now struggling badly

If you're one of the 10%-ers who own most of the stonks maybe you could donate 10% of your obscene gains in the last 5 months to help someone who is waiting in line at a food bank"
2020-08-14 09:35:34,CptTonyStark,3,It's your boy small 🥚
2020-08-14 09:35:29,lmmol,-1,BTFD
2020-08-14 09:35:11,Krahndaddy,10,I have a feeling today will be a setup for a bloody next week. The vix is rising which is scaring me. Also its guaranteed we won't get a stimulus deal until at least September. And the market was pricing a deal to be made. Im closing positions at open.
2020-08-14 09:33:45,bigkev2569,9,GUH....VIX IS THE NEXT MEME STOCK
2020-08-14 09:33:18,touchhimwiththejab,11,"Just lol 


August 12, 2020 01:37 AM ET (BZ Newswire) -- Government

An Eastman Kodak Co. (NYSE:KODK) board member and his wife donated nearly half their stock holding in the company, amounting to 3 million shares, to a religious charity on a day when the company’s stock hit its highest valuation since 2014, the Wall Street Journal reported Tuesday. 

What Happened

George Karfunkel and his wife Renee Karfunkel made the donation to New York-based Congregation Chemdas Yisroel on July 29, according to a filing with the United States Securities and Exchange Commission. 

The donation, thought to be the largest made to a religious organization based on a list maintained by the Chronicle of Philanthropy, is valued at about $116.3 million, based on the Kodak stock's average trading price of $38.75 per share on that day, with an intraday low of $17.5 and high of $60.


The New York charity’s registration filings indicate that the benefactor Kodak board member Karfunkel is also its president, as per the Journal. 

The donation has the potential to give the couple a tax break in the region of tens of millions of dollars."
2020-08-14 09:32:39,ty_for_the_norseman,6,If futures were Pay-Per-View I wouldn't be able to afford other things to waste my time on.
2020-08-14 09:32:33,usernemame,2,EU r fuck bigly
2020-08-14 09:32:16,CptTonyStark,8,-0.3% and bears 🐻 come 💦 out of the forests 🌱🌲 with long 🕚 DDs and history 📜⌛🏺 lessons 🎓 from the great 👍 depression 😭 and flash ⚡ crash 💥. Classic 📰🗞 🤡
2020-08-14 09:32:09,SolitaryEgg,30,"hey everyone it's your boy chimpu here with your daily pre-market roundup

like all days i predict the markets will go up, because im playing a numbers game here and i need people to think im right more than im wrong so i never rock the boat or say anything that could really be wrong

international markets looking pretty gay, but investors shrug stuff off ive noticed sometimes

i also looked at a robinhood chart and the line seems to have upward pressure

personal bias is that we will will trade between SPY 280 and 400 today

quote of the day: ""no one will notice that you say the same shit everyday if people like what you are saying."""
2020-08-14 09:31:32,foolsirkle,9,Seriousness. Who thinks a member of a Hedge fund would create a WSB account and try to fit in with the crowd ????
2020-08-14 09:31:31,macrorip,3,Ah as I predicted all bears have gone to hiding and bulls will slowly come back out again based on .5% moves. I love WSB 😊
2020-08-14 09:30:57,balloonhi4000,0,Fuckk
2020-08-14 09:29:29,cbitz,10,"Bear trap activated, stonks only go up"
2020-08-14 09:29:01,OGGD8,7,"Ok so, I asked some advice on what to do with my last $700 in yesterday's discussion... some of you gave me solid advice like buying SLV calls, etc... but I didn't listen to anyone's suggestion like a fking POS and bought NVAx put (thx to Putkin) and lost $400.... now tell me what should I yolo with my last $300 ...this time I will listen to your advice I promise

Edit: I am looking for ""get rich"" quick yolo play for today NOT  ""you're stupid, learn how to trade, get a job"" bulshit"
