date,author,score,body
2020-06-01 22:50:20,oz_-,2,"Big, beautiful, though soldiers with big guns hunhun."
2020-06-01 22:50:19,SpiderBiteHurts,1,Already counting the amount of soundbites that'll be in future rap songs.
2020-06-01 22:50:19,HunchoBryant,1,good stuff trump!!!
2020-06-01 22:50:18,Isuckatfantasy0,6,LMAO he actually deployed the military. I can’t believe it. After he spent all week shitting on China’s national security law.
2020-06-01 22:50:18,learningoptions,2,"this shit makes me want to go out and fuck shit up, too, and I'm an old motherfucker."
2020-06-01 22:50:17,Andyh10s,2,One beautiful law
2020-06-01 22:50:15,yawn_this_gets_old,4,"Trump is going to start throwing anyone he disagrees with in prison. Look what we are allowing. Fuck this cunt.

> We will help your family...

Who are you, Escobar? STFU faggot, this is terrible."
2020-06-01 22:50:14,spyaintnobitch,1,Can't tell china shit about Tiananmen square after this
2020-06-01 22:50:14,red_man_dan,1,Hard to “reopen the economy” with martial law and curfews
2020-06-01 22:50:10,AllJuiceMustDie,3,THIS IS SUPER BULLISH
2020-06-01 22:50:10,Droidvoid,3,"I sold puts.. lol GG fat lardo needs to hit the sack already. Cmon heart disease, do your thing"
2020-06-01 22:50:09,MiltDavis,0,"Gonna sell my DKNG 6/5 calls tomorrow. I promised myself I’d move on after 100%

What is my next buy tomorrow?"
2020-06-01 22:50:06,Lothire,2,Martial fucking law holy shit lol
2020-06-01 22:50:04,ottermodee,2,"TRUMP GOIN HAM LOL, WE ARE SO FUCKED"
2020-06-01 22:50:03,caramelpies,4,LMFAO. Is this America or some communist regime
2020-06-01 22:50:03,GatorMD12,2,"trump Insurrection Act:  [https://en.wikipedia.org/wiki/Insurrection\_Act#:\~:text=The%20Insurrection%20Act%20of%201807,disorder%2C%20insurrection%2C%20and%20rebellion.](https://en.wikipedia.org/wiki/Insurrection_Act#:~:text=The%20Insurrection%20Act%20of%201807,disorder%2C%20insurrection%2C%20and%20rebellion.)Very bullish"
2020-06-01 22:50:01,xKhaos420,5,OH GOD MY CALLS ARE FUCKED
2020-06-01 22:50:00,urraca,7,"""thousands and thousands of heavily armed soldiers"". So inspiring."
2020-06-01 22:49:59,nameofthatsong,3,There goes SPY
2020-06-01 22:49:59,rastadreadj,3,Hell yeah police state. My puts are saved
2020-06-01 22:49:56,learningoptions,4,he's so goddamned proud of himself
2020-06-01 22:49:55,AnonymousAstro,2,"2020 wild AF, kinda scared and turned on at the same time

-	me, a pajama trader, hard from green dildo markets tomorrow"
2020-06-01 22:49:55,JoJoBabbit,5,Trump destroying futures
2020-06-01 22:49:52,Cnastydawg,3,# ONE BEAUTIFUL LAW
2020-06-01 22:49:52,ztw2002,16,He talks like a fucking 5 years old
2020-06-01 22:49:48,yawn_this_gets_old,7,"**CURFEWS ARE THE LEAST AMERICAN THING EVER, WTF DID WE JUST ALLOW**."
2020-06-01 22:49:48,BorisYeltzen,4,Trump calling in military - BULLISH. Stocks to 3500 - all in on calls
2020-06-01 22:49:46,honestywins,1,Can he actually do this?
2020-06-01 22:49:46,cryptdab710,3,Futures fuckin hate this lol
2020-06-01 22:49:46,fetusblender666,3,I feel like he’s gone nuclear heavily armed soldiers? Is that what he said?
2020-06-01 22:49:44,dash_trash4255,2,He clearly didn’t run this speech by JPOW. All that work - gone.  And I just got back from gay bear conversion camp.
2020-06-01 22:49:42,sixplaysforadollar,2,Uhhhhhhhhh
2020-06-01 22:49:41,ch1p_skylark,3,"HEAVILY ARMED

SEND IN THE TANKS

WE NEED TIANAMENG SQUARE GUY"
2020-06-01 22:49:40,clarkefromtheark,1,Fuckkkkk vtiq went back down :/
2020-06-01 22:49:40,Psyc5,2,Calls on Bullets!
2020-06-01 22:49:39,Harry_Butterfield,4,You got 10 minutes mofos!! Daaaamn!
2020-06-01 22:49:38,butterflyfrenchfry,1,This is so good for my calls thx papa smurf
2020-06-01 22:49:38,infinitelimits00,3,Calls no matter what Trump says.
2020-06-01 22:49:38,techbro01,1,"Fuck even on Monday evening. Wonder how bad it will get

 [https://www.twitch.tv/woke](https://www.twitch.tv/woke)"
2020-06-01 22:49:38,dontlookup25,5,We are now China.
2020-06-01 22:49:36,,8,This is going to make people riot harder.
2020-06-01 22:49:35,urraca,1,There's that red.....hello again old friend
2020-06-01 22:49:30,jamesishigh,3,Christ dude stocks and options aside I feel like a lot of people are going to die tonight
2020-06-01 22:49:29,IyMoon,5,Wait... so is this martial law? Like did it actually happen?
2020-06-01 22:49:27,ChunsLLC,2,SOLVE THE PROBLEM
2020-06-01 22:49:26,Soon2beonthestreet,7,OH SHIT 1984 IS COMING TRUE
2020-06-01 22:49:24,z33tec,4,I feel like I'm in a movie
2020-06-01 22:49:22,,2,Wait... no martial law yet... where are you getting this?
2020-06-01 22:49:22,GlassNeighborhood,2,oh god. he is wildin
2020-06-01 22:49:21,decjr06,4,Oh man this is not good
2020-06-01 22:49:19,,8,HOLY SHIT! Military against citizens?!?
2020-06-01 22:49:18,spyaintnobitch,3,The fun is about to begin
2020-06-01 22:49:17,jzone5604,6,Yeah DOMINATE these streets big Daddy 👅💦
2020-06-01 22:49:15,WhoWasBlowjob,6,Are my calls all fucked?
2020-06-01 22:49:12,fishermanfritz,5,Oh he must have SUCH a boner to say all this war shit
2020-06-01 22:49:12,yawn_this_gets_old,5,Trump is really fucking up y'all.
2020-06-01 22:49:11,learningoptions,4,"holy shit, he just emphasized 2nd amendment rights... he just dog signaled a fucking civil war"
2020-06-01 22:49:10,Wakanda_Dreams,2,Lootstreetbets
2020-06-01 22:49:10,xKhaos420,3,CALLS ON DFEN
2020-06-01 22:49:10,rankiba,2,DOMINATE
2020-06-01 22:49:08,Ban_787,2,Fuck its selling off
2020-06-01 22:49:07,SpiderBiteHurts,2,"Oh boy, escalation. Live fire incoming."
2020-06-01 22:48:58,jammyarab,5,VERY BULLISH
2020-06-01 22:48:58,honestywins,3,Thousands and thousands
2020-06-01 22:48:55,watchshoe,4,"Well America, its been fun."
2020-06-01 22:48:54,ch1p_skylark,2,"Futures glitched, don't worry, they're actually green"
2020-06-01 22:48:54,GamblingMikkee,3,LET'S GO BABY DOMINATE
2020-06-01 22:48:54,Viromen,4,MARTIAL LAW
2020-06-01 22:48:51,Andyh10s,2,Well fuck.
2020-06-01 22:48:50,Durzzzz95,2,Riots ending tonight after this
2020-06-01 22:48:50,dcss_west,5,oh shit dude
2020-06-01 22:48:47,Wowpoliticsyousmart,3,Oh shit. Oh shit!
2020-06-01 22:48:46,thesaddestcuck,4,BULLISH 🐂🐂
2020-06-01 22:48:46,,2,time to Donaldnate the streets
2020-06-01 22:48:42,nameofthatsong,3,"INCLUDING YOUR SECOND, AMENDMENT, RIGHTS. BULLISH."
2020-06-01 22:48:42,Mrseanis,5,D O M I N A T E !!!!!
2020-06-01 22:48:42,stonkdropandroll,6,"DOMINATE THE STREETS  


BULLISH"
2020-06-01 22:48:36,Draynnox,1,GUH
2020-06-01 22:48:33,Shacreme,4,Calls on LMT
2020-06-01 22:48:29,cheezor42,1,Idiot jay Inslee fake crying on tv
2020-06-01 22:48:26,VacationLover1,7,**ALL FEDERAL RESOURCES BEING DEPLOYED**
2020-06-01 22:48:25,diabeetusboy,24,Martial law declared until DKNG is downloaded on every man woman and child’s phone
2020-06-01 22:48:25,Harry_Butterfield,2,Oh fuck. Lol!!
2020-06-01 22:48:24,yawn_this_gets_old,4,"**IF THIS FUCKER PUTS A CURFEW ON THE COUNTRY, HE GOES...TONIGHT**."
2020-06-01 22:48:23,eskjcSFW,4,He's going to order the protestors executed
2020-06-01 22:48:17,unknownuchiha,3,OH SHIT
2020-06-01 22:48:16,butterflyfrenchfry,2,Pump up the military defense Donnie
2020-06-01 22:48:15,arikevs,3,Our country always wins. Bullish
2020-06-01 22:48:15,MotorizedDoucheCanoe,7,Holy fuck this is bad
2020-06-01 22:48:14,Wowpoliticsyousmart,1,Get em Trump. Get em!
2020-06-01 22:48:13,,2,"Uh oh, looter bros!"
2020-06-01 22:48:13,tidu,3,This won't end well
2020-06-01 22:48:11,Soon2beonthestreet,3,"Did he serious just say ""We will shoot all protesters that have type V-VI skin type"""
2020-06-01 22:48:09,gdsmonster,2,🦅🇺🇸MURIKA #1🇺🇸🦅
2020-06-01 22:48:06,BillyG803,1,Will Apple hit ATH this week? I’m so tired of their sideways bs.
2020-06-01 22:48:03,learningoptions,6,"listening to this fucking piece of shit garbage mother fucker while the protests play right next to the WH stream.

ALL power to the fucking protesters."
2020-06-01 22:48:02,Cnastydawg,5,Shit he’s ending the riots that’s not going to end well
2020-06-01 22:47:59,oz_-,5,"WONT SOMEONE THINK OF OUR BRAVE NURSES? Not me, I take no responsibility"
2020-06-01 22:47:59,yawn_this_gets_old,9,"**TRUMP IS A FASCIST, WE LET THIS HAPPEN**."
2020-06-01 22:47:59,amar15x,1,What happens now? Stocks go up because more defense equipment?
2020-06-01 22:47:58,HeaterKing92,2,I sold SPY $312 calls expiring Wednesday. They gucci?
2020-06-01 22:47:56,PencilChant,5,Trump makes me want to cut my dick off
2020-06-01 22:47:55,jamesishigh,2,The military comin
2020-06-01 22:47:54,CuseTown,2,Ah fuck
2020-06-01 22:47:52,,1,sToCK mArKeT uP oN iNvEsToR oPtiMiSm
2020-06-01 22:47:52,vince24L,1,"Maybe I'm getting old but... All these white kids seem like they're there just for the thrill of ""going against the man, man."" It's like those who burn cars in Phili after a Super Bowl. Makes no sense or difference."
2020-06-01 22:47:48,jamesishigh,1,Oh lawd
2020-06-01 22:47:47,GamblingMikkee,5,MARTIAL LAW BABY
2020-06-01 22:47:45,IgoChopUrDollar,2,He said it
2020-06-01 22:47:44,MrBdstn,1,"Oh boy, I am not liking where this is going. . ."
2020-06-01 22:47:43,gigantoir,4,"i went  bullgang after seeing that even soybeans couldnt keep this market down

riots dont matter"
2020-06-01 22:47:42,spy66may,1,OUR COUNTRY ALWAYS WINS
2020-06-01 22:47:37,4chanstan,2,Crime against God!
2020-06-01 22:47:35,MmmDarkMeat,2,INSURRECTION ACT
2020-06-01 22:47:30,Dwarfguy,5,TRUMP GONNA SQUASH RIOTS AND STILL LET PEOPLE PROTEST PEACEFULLY GG BULLISH
2020-06-01 22:47:12,yawn_this_gets_old,17,"Trump is a stochastic terrorist, prove me wrong."
2020-06-01 22:47:10,yosheroni,12,The flashbangs going off in the background is fucking incredible. I hope some tear gas wafts in.
2020-06-01 22:47:09,TummyAcheJake,3,Sold my WORK and CRWD calls today for around 200% gains. Now both stocks are doing decent AH and I feel like a pussy
2020-06-01 22:47:03,WhyWaitProcrastinate,1,Still counting on yachty to pull through for me
2020-06-01 22:47:03,ChunsLLC,1,**Insurrection Act** LET'S GO
2020-06-01 22:46:57,honestywins,2,"Ngl not a fan of Trump but I haven't speak this calmly and smooth before.


SPY 350?"
2020-06-01 22:46:57,spy66may,2,Futures rallying go DJT!
2020-06-01 22:46:52,SpiderBiteHurts,3,Dude the brave nurses have been pepper balled and rubber bulleted  *by* police. Don't draw attention to that if you're pumping.
2020-06-01 22:46:50,ShawnHans007,6,I just want to see Trump entering a press conference like Stone Cold Steve Austin
2020-06-01 22:46:50,openyourmindpls,3,Fuck man don’t say thugs
2020-06-01 22:46:47,Plumpeo,4,wait he said thugs again.
2020-06-01 22:46:47,diabeetusboy,3,"Oh 🦌, 🥭 finna 🗣 martial 🏛"
2020-06-01 22:46:44,MotorizedDoucheCanoe,8,"Well, this is how fascism starts"
2020-06-01 22:46:36,CurtHolls5,3,Alright 2 month out SPY puts locked in tomorrow
2020-06-01 22:46:34,Harry_Butterfield,5,Bout to declare some martial law shit...
2020-06-01 22:46:28,shagagav,6,Trump say you’re going to Disney world!!
2020-06-01 22:46:25,yawn_this_gets_old,3,"Trump is a thug, he's fucking up the market now on top of it."
2020-06-01 22:46:19,Sh1tcanoe,2,Anybody playing DFEN?
2020-06-01 22:46:13,Cnastydawg,16,"Something bad is coming I can feel it from Donny

Edit: it did not end well"
2020-06-01 22:46:10,FightingLasagna24,6,He’s saying the peaceful protesters shouldn’t be overshadowed as his pig brown shirts tear gas the peaceful protestors. Fuck him
2020-06-01 22:46:08,ottermodee,1,"Which states are getting rekt the most from riots? Guessing Atlanta, GA."
2020-06-01 22:46:06,knickerdick,1,Where do y’all think visa is gonna hit in the next week?
2020-06-01 22:46:06,ShawnHans007,2,ARE YOU READY TO RUMBLE
2020-06-01 22:46:04,ijakebeltran,2,this about to be like that one mission in MW2 where you save DC
2020-06-01 22:46:03,MrBdstn,2,SURE THING BUDDY. . .
2020-06-01 22:46:00,caramelpies,0,"An ally of all peaceful protestors

Unless you're a fuckin lib then fuck you"
2020-06-01 22:45:57,RayCashIsTrashDalio,6,the moment powell mentions anything related to the possibility of an interest rate hike is when the market will flash crash 20%. practically happened in late 2018
2020-06-01 22:45:51,ddiddy171,1,Donald pump or dump?
2020-06-01 22:45:49,Enot_Fead,1,ELON BUY ME A BEER. Or 50.
2020-06-01 22:45:46,yawn_this_gets_old,4,"Trump hates law and order, who's he kidding?"
2020-06-01 22:45:46,MushroomManiac,1,"Finally bought some calls, I know it's wrong but it feels so right"
2020-06-01 22:45:45,Shower_Handel,4,He's gonna declare martial law
2020-06-01 22:45:45,CursedEthirty,-1,I fee like martial law may be coming from the way he’s talking.
2020-06-01 22:45:42,GodHog777,2,He said ALLY!! DGLY
2020-06-01 22:45:39,3headed__monkey,5,"Here you go, the motherfucking administration"
2020-06-01 22:45:39,Droidvoid,1,Some of those that work forces are the same that burn crosses. It really be like that huh
2020-06-01 22:45:36,CuseTown,4,I am your president of law and order
2020-06-01 22:45:34,Difficult_Cook,1,Pfft. Yawn. Riots are good for the market. Wall of More Worry. Bears R Fukt.
2020-06-01 22:45:25,americaswetdream,3,booms in the background nice
2020-06-01 22:45:18,idsimon,9,"Does this look like America to you?

Fuck you conservatives. What if this was Obama doing this to your protest? Fuck off."
2020-06-01 22:45:16,lame_irl,2,"Keep up the sparkler bombs dc, they’re harmless but sweet fuck the optics get my puts hard"
2020-06-01 22:45:08,Harry_Butterfield,2,PUMP IT DONNY!
2020-06-01 22:45:07,PhilMcCrack69420,2,Donald PUMP Baby lets gooooo
2020-06-01 22:45:06,yawn_this_gets_old,4,"Trump thinks Americans like this, that we want him firing on citizens. What a tool."
2020-06-01 22:44:59,ltsPricedIn,0,"trump coming up now!!!

https://www.whitehouse.gov/live/"
2020-06-01 22:44:56,Dwarfguy,3,HEre's the orange man now
2020-06-01 22:44:51,flyingeverywhere11,1,tramp is here
2020-06-01 22:44:51,nostylist2900,2,here we goo
2020-06-01 22:44:47,Investinwaffl3s,3,"Fuuckkkkkk I didn't buy TSLA this morning.

FML, run of the century right there. Now no one knows what the fuck it is going to do. TSLA is famous for cratering (or mooning) $10+ in a matter of minutes so I can't really buy in now..."
2020-06-01 22:44:45,Wino-Junko,0,Trump should speak no matter what it's not like anything is going to happen to him
2020-06-01 22:44:45,hangingbacon,2,I need recommendations for a good looting stream
2020-06-01 22:44:42,ineededanameagain,1,Can't wait to see movies use these protests in their apocalypse montage 10 yrs from now
2020-06-01 22:44:40,jak151d,2,Wtf an announcer
2020-06-01 22:44:37,TheChaoticYeet,6,Trump needs to resign right now.
2020-06-01 22:44:36,,2,what the fuck is this announcer?
2020-06-01 22:44:34,4chanstan,3,They announced him like Dwayne the Rock Johnson ffs
2020-06-01 22:44:33,lcsaenz979,2,Want a real Mic drop
2020-06-01 22:44:29,PunPryde,1,Twitch.tv/woke
2020-06-01 22:44:28,watchshoe,1,Lol what the fuck was that announcer
2020-06-01 22:44:26,yawn_this_gets_old,1,This is pretty fucking weak. Trump fucked up.
2020-06-01 22:44:25,tipsystatistic,1,"Trump Logic: People rioting because the cops killed people? Have the cops kill more people, that will calm things down."
2020-06-01 22:44:21,diabeetusboy,4,PUMP TIME
2020-06-01 22:44:20,Andyh10s,2,Sportscasting!
2020-06-01 22:44:18,whofcentury,3,Trump is out
2020-06-01 22:44:18,GlassNeighborhood,3,donald trump bout to have a seizure
2020-06-01 22:44:13,FightingLasagna24,-2,Police are pigs. Those protesters weren’t doing anything
2020-06-01 22:44:12,scopolamine,2,"Lot's of autists are asking how stocks can rally in the face of riots. But history suggests it's very possible. For example, in 1968 after Dr King's assassination there were riots in 125 US cities with the 82nd Airborne on the streets of DC. S&P gained 16%. Tragic but true!"
2020-06-01 22:44:08,approachingX,2,"Alright you guys need to learn some terminology.
To the moon is not +1.4% daily. Blood red futures are not -0.12%."
2020-06-01 22:44:07,stonkdropandroll,5,We literally have the biggest fucking fragile-ego orange fuck of a tyrant for a president right now. Jesus this country is pathetic
2020-06-01 22:44:04,spy66may,0,Fucking idiots give the presser in silence
2020-06-01 22:44:04,VacationLover1,3,DC protests are popping off right before trump speech.. shits wild
2020-06-01 22:44:01,Infamous-Sheepherder,3,Riots canceled Kendall Jenner brought the Pepsi
2020-06-01 22:44:01,jak151d,1,"Watching the press conference before 45ths appearance, all you hear is helicopters and shots in the background."
2020-06-01 22:43:59,s0sa,3,This is what ppl expected lowkey when trump was elected
2020-06-01 22:43:59,openyourmindpls,2,Futures down .01% every minute trumps late
2020-06-01 22:43:56,fishermanfritz,1,I'm astounded that nobody took his 2A rifle out yet and shot cops or rioters?!
2020-06-01 22:43:49,degenwsbbears,1,What's with the explosions?
2020-06-01 22:43:49,winnning007,1,2 MIN WARNING FOR DADDY TRUMP
2020-06-01 22:43:43,GamblingMikkee,2,CAVALRY CHARGE
2020-06-01 22:43:42,Guavaman,2,$50 he doesn’t do q&a
2020-06-01 22:43:37,ottermodee,2,"Protests are still in full effect, damn. Coronavirus cases are going to be back to peak levels in less than a month, doubt the media will care anymore though. In other news, 7/17 340c is cheap, should I stock up? lul"
2020-06-01 22:43:27,cp5,2,What channel is everyone watching rn?
2020-06-01 22:43:26,caramelpies,10,Loud fucking explosions. Trump is gonna panic like he did at his rally a few years ago.
2020-06-01 22:43:25,aswinneel,2,SPY dude .. just sell off  by 10% and get it done with ..It’s been a long time since we saw a big red day
2020-06-01 22:43:25,yawn_this_gets_old,4,This is a really bad look for America. Trump has zero chill.
2020-06-01 22:43:24,TheWallStreetBear,5,Trump is finally going to get his chance to be a war time president!
2020-06-01 22:43:24,decjr06,2,Damn they just brought out a fuck ton of cops on horses to push protesters back in dc
2020-06-01 22:43:18,lame_irl,3,"If he waits 18 more minutes all the protesters have to go hone because curfew

Big 🧠🧠🧠🧠🧠🧠"
2020-06-01 22:43:14,ReactingPT,11,What a shithole country... jesus...
2020-06-01 22:43:12,GlassNeighborhood,2,damn yall hear those explosions in the background
2020-06-01 22:43:11,MotorizedDoucheCanoe,2,"The optics of this are not good for trump.  This is absolutely fucking crazy.  This is fucking America, or so I thought"
2020-06-01 22:43:10,bitteryw,2,Wtf that was a loud explosion holy crap
2020-06-01 22:43:08,spy66may,3,LOL BOOM BANG
2020-06-01 22:43:07,nostylist2900,2,Holy shit DC is wilding
2020-06-01 22:43:03,jawndergone,3,O/u 15 seconds til Trump mentions China today
2020-06-01 22:42:59,SpiderBiteHurts,2,"Uh, that was large"
2020-06-01 22:42:53,saliym1988,2,someone should throw a rock and hit trump in the rose garden
2020-06-01 22:42:47,LivingFlow,1,"My power is still off in a luxury apartment in downtown Chicago, in the loop...."
2020-06-01 22:42:29,Sundim930,2,Calls on RBR
2020-06-01 22:42:24,AlonneCaptain,2,Are AVGO ER in the morning or AH on Thursday?
2020-06-01 22:42:16,TonguePressedAtTeeth,4,Heard the Rolex store on 5th ave was looted.  They contacted my company for barriers.  Now that’s a smart looter!
2020-06-01 22:42:06,4chanstan,3,Knock-off Kushber gently placing his binder full of women in the podium
2020-06-01 22:42:05,Wowpoliticsyousmart,-1,Don't ever disrespect me and my govt.
2020-06-01 22:42:05,Bluerigg,7,"They started using tear gas/flashbang at 6:30, right when trump was supposed to speak. Does he want the explosions in the background while he talks??"
2020-06-01 22:42:04,DrMoogala,1,Buying more CLVS MBRX and leaps on SPY
2020-06-01 22:42:01,vegaseller,1,Anyone else want looters to start burning down their neighborhood?
2020-06-01 22:41:58,YepRabbit,-7,Future Bloody Red 😱😱😱
2020-06-01 22:41:54,gronaninjan,2,The explosions and choppers sure make a great entry for the president
2020-06-01 22:41:40,AnonZeit,3,The same docu shills will hate and buy puts for zoom? Does one have a better revenue structure? Or yall just actually autistic
2020-06-01 22:41:38,lame_irl,3,He’s waiting for curfew to go into effect to come out
2020-06-01 22:41:30,AmbitiousSingh,5,Didn't even look at ZM today lol. How is this stock still have 10%+ days
2020-06-01 22:41:29,wellzy17,5,My fuck get these protesting retards off the road
2020-06-01 22:41:19,PeanutButter91,6,This is just pissing people off even more. Someone’s going to show up with a grenade. Fucking stop this!!
2020-06-01 22:41:17,z33tec,10,Trump should probably call this one off. There's no way he could possibly say anything that will help the situation aside from SPY 400
2020-06-01 22:41:16,ottermodee,2,Does it make sense to close a covered call that has become ITM to lock in gains and free up money? Your gains from shares should cover the extra premium cost for the calls right?
2020-06-01 22:41:08,v-shizzle,5,the MC just straight up said Why are we doing this in the rose garden right now?
2020-06-01 22:41:00,dawhizkid123,2,I can’t believe Supreme hasn’t been looted yet or have they?
2020-06-01 22:40:57,idsimon,3,Tear gas seeping into rose garden right now. Trump isn't going to speak.
2020-06-01 22:40:50,Mrseanis,8,There is no fucking way trump will give a speech outside. LMAO.
2020-06-01 22:40:40,JoJoBabbit,0,Why are futures menstruating?
2020-06-01 22:40:28,121518nine,4,"TSLA 1,180"
2020-06-01 22:40:22,1bigplay,3,Jim Acosta looks like he wants to get his face punched in
2020-06-01 22:40:19,kiwiatv,0,"Come on lard ass, get this over with"
2020-06-01 22:40:12,,1,who the fuck loots a hot topic
2020-06-01 22:40:11,staynight,1,ELON I KNOW YOU’RE HERE
2020-06-01 22:40:03,dwright120,0,Pelosi got the speech written already. Frail little biotch
2020-06-01 22:40:01,fuegocossack,3,"So boys, what city are we testing the super duper missile on tonight?"
2020-06-01 22:39:54,pdkevin8,2,Trump just talking about protests? Any chance he’ll talk about China?
2020-06-01 22:39:52,ch1p_skylark,2,I think trump just likes to make the fake news sit there and wait and be miserable in the hot weather
2020-06-01 22:39:49,unknownuchiha,3,"wait, do you guys hear the explosions?????"
2020-06-01 22:39:36,Droidvoid,3,Lmao disperse the crowd. Genius idea so they can get pissed and start lighting shit on fire.
2020-06-01 22:39:33,flyingeverywhere11,1,tramp is late again
2020-06-01 22:39:27,s0sa,4,6 bux says trump doesn't come out
2020-06-01 22:39:26,yawn_this_gets_old,2,Trump just launched on everyone right before the speech? What a punk.
2020-06-01 22:39:12,BenjiWon,6,Futures flat before brief red during declaration of martial law followed by printer run to green. Youre rights are fucked but at least your portfolio is green. Its the great traddoff made possible by Powell and an Office Depot device.
2020-06-01 22:39:07,spy66may,6,LMAO WAR ZONE IN DC OH NO MY CALLS
2020-06-01 22:38:50,ShawnHans007,1,"He the one I hate the most, brown boy

Makes me sick when he brag and boast, brown boy

He could turn my wifey to a ho, brown boy

I don't know how he sell out shows, brown boy"
2020-06-01 22:38:44,ozud100,6,How many Zoom retards actually realize market cap is higher than some of the world's biggest companies?
2020-06-01 22:38:43,thewaterb0yyyy,7,Trump about to ask for law and order with audible flashbangs during the speech
2020-06-01 22:38:37,diabeetusboy,2,Bid ask spreads on SWBI is cancer
2020-06-01 22:38:33,ClaimsForFame,4,Fucking explosions lol
2020-06-01 22:38:29,yeahman64,2,Thoughts on Wells Fargo? I know fuck all about them but looks like a bank that’s down bigly.
2020-06-01 22:38:27,staynight,8,Man I love trading stanks
2020-06-01 22:38:25,idsimon,2,Turns out MPs cracking heads on DC streets isn't bullish who knew.
2020-06-01 22:38:17,gohoos13,1,"Straight up tho they needa push ppl back from the White House. That’s why I think they are being so aggressive, you don’t know who’s there."
2020-06-01 22:38:14,Ijustquaffed,4,Futures barely red. Went green when they were -1% lol. this will be 1% by AM
2020-06-01 22:38:12,nsrbigshot,2,what happened to L2FBA?
2020-06-01 22:38:07,v-shizzle,1,unless bunker boy is streaming from the basement this speech is gonna get cancelled due to the protesting
2020-06-01 22:38:04,Roach_Coach_Bangbus,3,You can hear bombs going off in the background lol.
2020-06-01 22:37:59,dash_trash4255,2,Nothing like pre-gaming for a presser with flash bangs and tear gas.
2020-06-01 22:37:57,TheDolleyLlama,4,"Idk if you guys are watching the White House right now but this is super fucked. I don’t care if that’s political. Trump is having cops flashbang and beat fuckin teenage girls on live television right now. This is nuts.

Edit: the fucking CALVARY POLICE are now shooting flashbangs and rubber bullets. ON HORESEBACK."
2020-06-01 22:37:45,lame_irl,1,"I’m guessing given the random declaration of this press conference trump is going mostly non-teleprompter 

Should be good!"
2020-06-01 22:37:33,ottermodee,2,"I'm starting to believe the ZM hype... every time a commercial airs and it's video chatting, I always check to see if it's Zoom."
2020-06-01 22:37:31,gohoos13,1,This is crazy bruh 😂😂
2020-06-01 22:37:29,kk7766,1,sit down Jim
2020-06-01 22:37:27,eyebeeleaf,2,cnn hoping for a clash!
2020-06-01 22:37:23,showerbro666,1,"realistically, what do you autists think dkng will be at eow"
2020-06-01 22:37:16,CombodianBreastMilk,3,Anybody using the Martingale strategy with SPY puts?
2020-06-01 22:37:13,Electrical-Video,2,wrtc gonna print. all these policeman need their gear for the riots coming
2020-06-01 22:37:08,whofcentury,4,Holy shit Washington DC is getting very ugly
2020-06-01 22:37:02,Harry_Butterfield,1,Imagine being so poor you'd rather choke on tear gas than watch futures all night. 🤣
