date,author,score,body
2020-09-01 22:29:01,ensoul,5,"Me watching metals drift upward on thin volume between 6pm and 9pm EST:

[https://youtu.be/Yvd3aEsThbc?t=12](https://youtu.be/Yvd3aEsThbc?t=12)"
2020-09-01 22:28:44,nanaboostme,8,"Tesla hiring video game engineers and software developers? wtf?

Tesla the simulator game?"
2020-09-01 22:28:36,Osgiliath,5,Damn I sold some RKT cause I thought earnings was premarket tomorrow
2020-09-01 22:28:22,96reltihleih,1,"If you guys were talking to a CEO in a few days/a few weeks of a major stock that’s discussed here: what would you say? 

Only the most retarded suggestions please."
2020-09-01 22:28:21,TH3PhilipJFry,51,"It doesn’t feel like AAPL had that big of a day today, but it’s up 4%. 

My concept of the market continues to be more and more fucked up because of this year."
2020-09-01 22:28:11,realister,25,"who is ready for:

>OMG TSLA at $500 in Frankfurt!"
2020-09-01 22:27:56,techbro01,5,Anyone use [waffles.finance](https://waffles.finance)? I'm starting to like it more and more. that autist really did a good job for us and he wasn't even allowed to pose the launch on wsb
2020-09-01 22:27:55,aggieclams,9,RKT is fucking insane
2020-09-01 22:27:47,Smooth-Criminal-TCB,4,"What’s the gameplan for RKT, when we selling?"
2020-09-01 22:27:42,supercoolguy__69,2,Keep buying and holding silver.
2020-09-01 22:27:32,ryit29,4,I should just stop paying rent. This eviction moratorium can save me tens of thousands of dollars if I just stop paying.
2020-09-01 22:27:28,almostmicrochip,1,"so when kodak goes below 6 dollars u buy and then sell the next day.


got it"
2020-09-01 22:27:26,Bigbotofernz,0,NasDick 12k tomorrow
2020-09-01 22:27:11,ThePeoplesBard,1,Aww MSFT gave back it’s AH gains
2020-09-01 22:27:02,AperatureLavatories,3,"I held a JAMF call through earnings, not looking so good for tomorrow?"
2020-09-01 22:26:55,AnimalSharp589,3,"Stock market Crashing in March 

JPOW : DONT 🤚

Stock market : I can get you anything you want all you gotta do is say okay 🎵🎶🎵🔝"
2020-09-01 22:26:55,-nye-,6,"From WSJ 9 minutes ago:


WASH­ING­TON—Trea­sury Sec­re­tary Steven Mnuchin urged Con­gress to ap­pro­pri­ate more money to com­bat the ef­fects of the coro­n­avirus pan­demic, say­ing at a hear­ing Tues­day that he was ready to sit down with De­mo­c­ra­tic lead­ers to re­sume ne­go­ti­a­tions at any time."
2020-09-01 22:26:54,xKhaos420,6,"I went thru the entirety of August expecting a rug pull, too afraid to make a move until I saw a nice dip to buy. That shit never happened, now we are at ATH, with VIX climbing

You bet your ass I'm going all in with no hedges"
2020-09-01 22:26:44,fazawood81,3,"lol 10 million shares of the offering is on hold it will be given to ETFs that want to get in on TSLA. These newbies don’t even know how badly they are getting played right now. I will be rich when this goes back
Up soon 😂😂😂😂😂"
2020-09-01 22:26:26,AnaLaCervix,-11,TSLA will be stuck at 480 till the week before Battery day
2020-09-01 22:26:23,stacksandwhiskers,1,"CRM 9/18 $300. Thank me when they’re ITM at end of week 

🤩🤩🤩"
2020-09-01 22:26:18,Pleasant_Plantain,1,SPCE hurted me today :(
2020-09-01 22:26:11,shroomycannapasta,19,Just saw a robinhood commercial on nba playoffs. Calls on everything.
2020-09-01 22:26:00,almostmicrochip,2,"UTZ with the fake ass dump


my after hours balance just went up like 10 dollars and i’m tryna figure out where


UTZ"
2020-09-01 22:25:57,kk7766,5,Stupid China. First coronavirus....now trying to fuck up TikTok deal !!!
2020-09-01 22:25:54,throwaway446944,9,My boyfriend will be happy when I tell him I bought a 490 TSLA put at the top yesterday and sold at today’s bottom. 🌈🐻
2020-09-01 22:25:54,pump4iron,0,"If Kodak can go up to $60 a share, why not Tesla and apple???"
2020-09-01 22:25:51,GourmetFilet,3,If these puts don’t hit tomorrow think I’m gonna have to take a week off from the market and cool down a bit. Shit got me stressing and I’m usually calm cool 😎 and collective
2020-09-01 22:25:51,the13thrabbit,3,This market is setting up for an even bigger rally. The only way to hedge is by picking up cryogenic equipment to keep ur dumba$$ alive for the 500-year recovery if it's *allowed* to go down.
2020-09-01 22:25:37,PaperShark0001,3,Try to say irish wristwatch outloud
2020-09-01 22:25:22,im4stocks,1,Up 250% on my SWBI calls I took for earnings. My calls are for the 18th and earnings is the 3rd will that keep me relatively safe from IV crush?
2020-09-01 22:25:18,djwired,5,I’m trying to join the CRWD again
2020-09-01 22:25:16,TheAlmightyLoaf,1,"Looking for some ideas on what to buy calls on. Time frame: two weeks out at the minimum, but anything before November."
2020-09-01 22:25:05,WIPESASSWITHSOCKS7,1,"BRO IS ROBIN HOOD ipos ...

For fucks sake I will be tempted to put in half my networth in that shit for the most 

Heart pounding SWING trade I done in my life"
2020-09-01 22:24:52,-nye-,13,When you have $10-$15k to swing around for a day trade making a couple hundred bucks is pretty fuckin sweet. I got some pretty safe FB calls that go up like $500 when share price bounces between 296 and 297. Super fuckin tight yo
2020-09-01 22:24:51,almostmicrochip,2,"mfw amd chart today kinda looks the smoke  trailing a rocket blasting off



why the fuck didn’t i hold my calls 😠"
2020-09-01 22:24:45,PlutusVeles,0,Visa can suck a bag of dicks
2020-09-01 22:24:26,n-cend,2,So does Trump's rent order mean I should immediately sell all my REITs?
2020-09-01 22:24:23,GoBeaversOSU,3,"Houston, Texas and wearing a Detroit Tigers cap. Something is not right."
2020-09-01 22:24:21,Al-Anda,5,Can you imagine an entire subreddit gathered together in real-time and blowing a stock up together? They’d have to shut us down.
2020-09-01 22:24:07,titanmachine123,3,Can AAPL see $175 by November?
2020-09-01 22:23:58,SolitaryEgg,5,"UTZ making fucking moves.

#PretzelGang"
2020-09-01 22:23:49,TheLankyIndian,1,holding INTC 50c but have this sinking feeling the announcement will be a lot of nothing. Anyone have better info to confirm my biases?
2020-09-01 22:23:47,cheeseandbeans4,4,"My NVDA 560c expiring this Friday isn’t gonna print, is it 🥺"
2020-09-01 22:23:41,HiBoobear,14,TSLA After hours > TSLA during hours
2020-09-01 22:23:36,MattDamonIsGod,5,AMC calls just randomly print every other week. Free money glitch.
2020-09-01 22:23:35,umblueberry,3,"Prediction: Tomorrow, tsla and msft are going to do. Cheers"
2020-09-01 22:23:33,tim_rocks_hard,3,Get aboard MSFT now
2020-09-01 22:23:30,AccidentalBirth,1,strike and expiry for fedex and adobe calls /??
2020-09-01 22:23:28,jessasch,1,Why does my broker count P/L as available balance? 🤔
2020-09-01 22:23:22,Isorry123,12,"People who keep yelling “bubble” are just crying cause they’ve been sitting there holding cash like a couple of losErS

Edit: OR PUTS"
2020-09-01 22:23:22,Jflint95,-3,BABA PUTS = FREE $$$
2020-09-01 22:23:03,SnortinDietOnlyNow,6,Keep pumpin WMT. My 150c almost there
2020-09-01 22:22:43,mshambeau14,1,Imagine being someone who paid $129 for a single share of ACB lmao
2020-09-01 22:22:31,EricsonGQMan33,8,Tesla needs to at the very least be 490+ to more morning but hopefully 500+
2020-09-01 22:22:29,TwerkEthic,4,"Doesnt even have to bee apple and tesla, pick any tech stock at all and its like they just blasted earnings - spotify randomly up 17% from 2 weeks ago when i sold an october call that was already a 300% return. Trade desk still popping random 6% swings... Both have had significant bad news. 

This is my most successful 4 months of trading ever, but anyone would be making money as long as they are buying tech"
2020-09-01 22:22:24,jeffdidntkillhimslf,2,Think I'll have a glass of scotch tonight to celebrate taking some profit
2020-09-01 22:22:10,G23456789,-4,Plz Tesla 200 tomorrow and Spy 50
2020-09-01 22:22:06,PsychologicalBus3,3,What will AAPL open at tomorrow?
2020-09-01 22:22:00,degeneratesampler,6,My first wife was retarded. She’s a pilot now.
2020-09-01 22:21:57,hala207,3,"Docu gang how we feeling, how high you think this boy will go"
2020-09-01 22:21:56,TrenAndOptions,1,Even people with shit credit can get a fucking loan for 400k for a house at 4-5% interest lmao fucking real estate is a racket
2020-09-01 22:21:42,ianuJ-,7,RKT 9/18 30c
2020-09-01 22:21:41,GoBeaversOSU,2,T lookin like a buy opportunity after it keeps slidin on this DTV news
2020-09-01 22:21:17,AnonZeit,5,RKT is RKTing
2020-09-01 22:21:15,FedIsFucked,2,Yolo'ing on BigC calls for ER 9/9
2020-09-01 22:21:01,ryit29,3,WTF? They banning owning Chinese stocks as a condition to work for the US government?
2020-09-01 22:20:50,AccidentalBirth,1,Are we buying adobe or fedex for the 09/15 earnings date
2020-09-01 22:20:28,titanmachine123,1,Can AAPL see $175 by November?
2020-09-01 22:20:22,OsamaBinTrading,2,Futures are red? That's illegal is it not? It's in the bill of rights that stocks only go up??
2020-09-01 22:20:20,FormalFew,3,trying to convince myself that from 12:10-close on TSLA charts is a cup and handle rn
2020-09-01 22:20:16,Drunken_Monkey5,13,"Im aware that im one of like 6 people losing money but im just more pissed about being wrong then the money. Like im right, the markets wrong. Fuck you."
2020-09-01 22:20:00,HornetsAreBad,12,"if you lost money today, literally how?"
2020-09-01 22:19:54,Wsbgal,7,Last time I said “fuck it all in calls” it crashed the next day. I’ve been saying this same phrase for over a week or two now. O.o
2020-09-01 22:19:50,smokeykeys,3,I realized today I ain’t shit. All well 🤷‍♂️
2020-09-01 22:19:48,Rickysnake23,0,Rocket puts or calls before earnings? Anyone?
2020-09-01 22:19:40,GoBeaversOSU,5,If UTZ is such a great company why have they not gone national in 100 years of existence ? Miss me with that shit
2020-09-01 22:19:40,frontbutthole,3,"sold my SE and APPL to reroll longer dated calls, then those ripped again so I sold half. what a day."
2020-09-01 22:19:35,_DarkForce_,5,Crowdstrike up $10 AH
2020-09-01 22:19:33,Rokine,3,"realistically, what’s tesla’s eod tomorrow?"
2020-09-01 22:19:28,MrRapCap,2,Why the fuck is my net worth in H&R Block
2020-09-01 22:19:26,maximuminimum,0,REEEE by open
2020-09-01 22:19:16,TrenAndOptions,0,Anyone ever rent a car on Turo to go to Vegas in ? Or to take a girl out? I’d wanna rent an Audi R8 for a day and pretend it’s my car lmaooo
2020-09-01 22:19:14,Hank-Hi11,2,"congrats rocketeers! tendies print, unless it shits the bed by open again"
2020-09-01 22:18:55,TH3PhilipJFry,7,"Something about futures....

GREEN TOMORROW"
2020-09-01 22:18:48,Stereo-Gito,1,When's the rug pull?
2020-09-01 22:18:41,GoBeaversOSU,-2,"I got a mortgage quote from RKT and then one from Willamette Bank, the latter had much more favorable interest rate and loan terms"
2020-09-01 22:18:33,undermon,1,Can someone please explain to me why SPX was up 1% today
2020-09-01 22:18:27,BobbyRayBands,8,Blessed be our AAPL calls. Salute to all the retards like me that held through the split.
2020-09-01 22:18:09,gigantoir,-11,OH FUCK ITS BLOOD RED
2020-09-01 22:18:08,IOnlyEatChickens,13,We can all agree on one thing. Fuck China.
2020-09-01 22:17:56,GatorMD12,6,AAPL/FDX/SPY GANG RISE TUE FUCK UP.
2020-09-01 22:17:47,almostmicrochip,16,"when stock go down so u buy the dip which makes stock go up ✅

when stock go up so u fomo into stock which make stock go up✅


🧐 

stocks only go up"
2020-09-01 22:17:46,LaPulgaAtomica87,3,"What's the conventional wisdom on averaging down on options? Of course this is a common strategy with stocks. But stocks don't suffer from theta decay. I have 2022 leaps on XOM (I'm bullish on XOM). Unfortunately, due to COVID on other factors, my leaps are down 40%. I'm still bullish on XOM and energy in general. Should I average down on them? Or is that unwise? 

Does anyone have a story/experience where they averaged down and stock rocketed later?
Many thanks WSB."
2020-09-01 22:17:41,mannequit,2,"Put $300 into ORCL 9/4 58.5c lmao cause why the fuck not, they could actually buy tic tac"
2020-09-01 22:17:35,subnative1,9,Tesla is guaranteed at or above 500 end of week it's that simple
2020-09-01 22:17:33,staynight,15,TSLA 500 tomorrow pls
2020-09-01 22:17:19,_klighty,3,WMT gang how we feeling about tomorrow?
2020-09-01 22:17:18,americaswetdream,1,"little baby qqq hit 300! 

tqqq is so proud!!"
2020-09-01 22:17:16,Redskins47Chaos,15,"If TSLA could open at $500 + tomorrow, my calls would appreciate it. Thx"
2020-09-01 22:17:02,IDolphinLordI,4,Sell my WMT calls
2020-09-01 22:17:02,ryit29,1,I have never seen tech stocks go up this much in one day and not give up some gains the next day. Maybe this time will be different...probably not though
2020-09-01 22:16:58,BarrGang,4,WMT gonna have another 6 percent day
2020-09-01 22:16:57,asphalt_astronaut,9,Tesla gap up
2020-09-01 22:16:55,GoBeaversOSU,0,Did Guy Adami FR just say Roll Tide was for Georgia? Holy shit. I don't think he can be my favorite anymore. The disrespect
2020-09-01 22:16:51,HungDiepTran,3,"Now listen here you sissies. 

A 5 for 1 stock split AND a ""at the market"" offering happening shortly after?

Speculations for the past few weeks but hasn't been confirmed?

Calls or Puts? 

Better yet, would you rather be a clown or Jim Chanos? And yes there is a difference between the two."
2020-09-01 22:16:46,InvestmentActuary,7,"Honestly, theta gang 3-5k/mo is really starting to add up."
2020-09-01 22:16:45,ImHereForTheTshirt,1,"Calls on my LinkedIn. 230->300 in a day. 

Turns out ignoring LinkedIn my junior and senior years of college meant I had lots of homies who were thirsty for my connection. 

Gonna hit 500+ by the weekend."
2020-09-01 22:16:44,Mymatchthrowaway,1,AAPL bleeding it's AH gains after being up a little bit. It was 134.50 at 3:59.
2020-09-01 22:16:29,Jpatrickj,4,Jerome looking fine for 67 if I must say
2020-09-01 22:16:18,flappytango,1,this is just soup for my family
2020-09-01 22:15:50,TitanLife,7,Which one of you Momo's was just on Fast Money asking about RKT lol
2020-09-01 22:15:26,DonCorleone47,6,I’m going to drop out of college like a true degenerate!
2020-09-01 22:15:19,luvens,2,https://www.fincen.gov/news/news-releases/statement-fincen-regarding-unlawfully-disclosed-suspicious-activity-reports I wonder who this is about.
2020-09-01 22:15:16,AirspeedIsLife,5,QQQ 1/21/21 300c
2020-09-01 22:15:12,silverlink22,3,"Nasdaq futures green by top of hour. Also Lmfaoo Nasdaq futures are at 12,300. No bubble here."
2020-09-01 22:14:55,Hematocheesia,12,"Can we make a law to prevent chinese from buying up property in our country? Even if their kids are here to study, you fucking rent. 

You can’t use our country as a bank account because you don’t trust your govt with your $$"
2020-09-01 22:14:32,n-cend,7,Holy shit that PTON price target raise. Is it still too late to get in? More people will buy in tomorrow because of that right?
2020-09-01 22:14:18,RainMan214,6,If zoom killed earnings the way it did and docu ran up as a result prior to earnings that only means one thing tbh
2020-09-01 22:14:18,AccidentalBirth,-2,What sites allow you to track multiple stocks on a dashboard including pre market and after market ? Koyfin doesn't allow for premarket/afterhours
2020-09-01 22:14:14,ToFiveMeters,2,Fuck me tqqq. I’ll stop being 🌈 and I’ll hold tqqq for two days. Jesus I missed out on four fig gains because I tried to time the top. Fuck me
2020-09-01 22:14:08,InoculumFear,-14,Am I unbanned yet?
2020-09-01 22:14:03,Mr_Burkes,7,Can't wait for TopGolf to go public
2020-09-01 22:14:03,ryit29,4,"I don't care how much you get paid as a UPS driver, that much manual labor ain't worth it"
2020-09-01 22:13:59,studioaesop,10,A 3% drop in TSLA now is like a 15% drop a month ago. BTFD
2020-09-01 22:13:41,stenappy34,6,Bought 5K worth of DraftKings shares gonna b rich in a few years
2020-09-01 22:13:35,TheRogueHippie,3,So are the Abbot rapid tests garbage or something? How is it possible that a test that could reopen like 95% of the economy cause share prices to tank? Was that just a failed pump?
2020-09-01 22:13:33,GoBeaversOSU,12,These pretzels are MAKIN ME THIRSTY
2020-09-01 22:13:33,chad99gt,2,How high will rkt need to run for 9/18 35 calls to overcome iv crush??
2020-09-01 22:13:15,Mooseinpoose,8,"Holy shit futures are red, we’re going to be up BIGLY"
2020-09-01 22:13:05,Likelyfucked,10,Imma need TSLA to stop playing games and be 555....... tomorrow
2020-09-01 22:13:03,motomike1,3,🐢 gonna take me to early retirement
2020-09-01 22:12:51,UpperSpinach,5,"AAPL 130c done

AAPL 140c coming up next"
2020-09-01 22:12:49,Al-Anda,9,"How much power does WSB have over the US market? A rational person would think none but these kids seem to know the trends. What if we united?
                -Anarchy"
2020-09-01 22:12:36,ohhimark123456,11,"They kidnapped my wife, need to make $10,000 from $1000.    

Help. This is not a joke"
2020-09-01 22:12:36,EvanderofPallene,6,thank god i went in on apple and not tesla
2020-09-01 22:12:35,water_is-H30,3,LULU reports next week play run up?
2020-09-01 22:12:34,Mikos_Enduro,4,"Big Dick-After Hour gang fighting hard over Tesla, so there's at least a lot of interest in the stock still"
2020-09-01 22:12:34,plasticblock4dayz,6,"Friendly service announcement:

Make sure to save up tendies to buy 9/11 FD calls on 9/10. Stonk indicies rarely go down on 9/11 unless there’s some catastrophic event the day of. It’s just un-American to sell stonks on 9/11, instead people buy because they feel patriotic."
2020-09-01 22:12:21,Hematocheesia,7,After all the shit China copied from us they’re being lil bitches about a thot app. FUCKING sell your shit already.
2020-09-01 22:12:18,kohlarncowboy69,2,Labor Day weekend is just a mini Fourth of July right? We gonna keep melting up until next Tuesday in that case
2020-09-01 22:12:12,tomwdance,5,AAPL Oct 16 $150 call. That’s going to print right?!
2020-09-01 22:12:11,Ponypoops,6,Everyone holding RKT and TSLA calls. I am fuk
2020-09-01 22:11:33,chodmode2,45,## Just got a paid subscription to JPows OnlyFans
2020-09-01 22:11:26,EdwardTittyHands,1,For the bois and girl here who have LEAPS in their profile. What are you holding and at what expiration? Im trying to add on to my appl 2022 LEAPS
2020-09-01 22:11:12,Ban_787,5,I wanna buy puts so bad😩
2020-09-01 22:11:11,rum-n-ass,5,My apartment sent out 5 different reminders to pay rent this month. Normally they either send one or don’t at all. Sounds like people might be having some trouble
2020-09-01 22:11:10,killeral7,1,"Any of y'all pickup who gives a fuck leaps in CRWD or DOCU ER? If so, what did you get?"
2020-09-01 22:11:05,Michigan2014,9,Rkt 🚀🚀🚀
2020-09-01 22:11:00,wd1998313,1,Lol [Thetagang really hates me](https://www.reddit.com/r/thetagang/comments/ikq3n4/from_330_to_now_only_sold_put_credit_spreads/?utm_source=share&utm_medium=ios_app&utm_name=iossmf)
2020-09-01 22:10:54,shesh9018,2,CLDR
2020-09-01 22:10:41,_El_Dragonborn_,3,“Hold JAMF earnings” they said. “$50 EOD” they said
2020-09-01 22:10:33,CheddarCheeks,6,Will my TSLA 500 FD print? Bought it late afternoon.
2020-09-01 22:10:18,iLikeLambos,8,Big Green Day’s are sexy but nothing is better then the feeling of a red day but your account is still green. Makes me hard just thinking about it
2020-09-01 22:10:12,im4stocks,1,The mute is over
2020-09-01 22:10:10,Nick9502,5,"RKT, CRWD, DOCU swings. Looking good so far boys"
2020-09-01 22:10:04,pilotsepisode,-9,"I will not be silenced

I will continue to herald the values (or lack thereof) for the Joker Head community.

I am your shepherd.

We will destroy the forces who are trying to denigrate the good name of Joker and divide this community.

I will not stand for it. And you won’t either."
2020-09-01 22:09:56,LostAndFoundWSB,5,Who of your retards put a limit order on aapl for 2250 shares @ $134.25?
2020-09-01 22:09:48,redicalschool,12,"I wish the degenerates of this sub actually realized gains and posted the dumb shit they bought with them

I can just see the shitty jet skis, short shorts and PRPL ass cushions already"
2020-09-01 22:09:48,Jpatrickj,7,In heaven nothing expires worthless
2020-09-01 22:09:46,jbrownwood,12,"I have APPL calls and their doing well, but lowkey I have no idea why this shit is going up or why everyone is so convinced it will continue. Don’t tell anyone though I don’t wanna look dumb."
2020-09-01 22:09:31,rbc8,4,X3 Tesla etf??? Sign me up
2020-09-01 22:09:12,Trumpowell,8,"Palantir  is  dogshit

Be  warned"
2020-09-01 22:09:10,CharmingStabilizer,2,Somebody knows something about CRWD earnings tomorrow. Shits on Arnold’s super pump.
2020-09-01 22:08:51,ImHereForTheTshirt,5,I would be ruined by a -0.2% red day.
2020-09-01 22:08:45,RagefireHype,3,"I'm only gonna say this one more time.. Otherwise dont cry in a few weeks. Short ass DD

Draftkings 9/18 calls are CHEAP and good reason to believe it'll exceed the strike you pick.

The NFL is fucking huge. Mega huge. Dicks in ass huge. We're less than 10 days away from the NFL being back. There is going to be a surge with NFL betting coming back.

Get in now or get FOMO. The NFL season will atleast last 3-4 weeks, so 9/18 are safe calls before COVID fucks up the NFL season

Degenerates love sports gambling and the NFL is the king of it, get in while the waters warm before the water is full of your piss because you missed out again"
2020-09-01 22:08:45,dan220201,1,https://www.google.co.uk/amp/s/www.thestreet.com/.amp/investing/peloton-share-price-target-raised-to-wall-street-high-at-goldman
2020-09-01 22:08:34,Rootbeerpanic,7,Why is nobody talking about INTC? They reveal their new chip tomorrow and I read the leaked specs are better than AMD's. Am I missing something?
2020-09-01 22:08:24,PutsTookMyMoney,5,"Any of you guys had covid? It’s hitting close to home now. Should I be scared or just go on about my daily business?

Lmao seems like now everyone went from bashing people for underplaying the virus to making fun of them for worrying about it. Hmmm, humans are such funny creatures"
2020-09-01 22:08:23,TrenAndOptions,7,I love how when someone comes back from a ban they get downvoted immediately shit cracks me up bro
2020-09-01 22:08:19,callsnputsallday,1,"For intel, y’all selling before event??"
2020-09-01 22:08:11,iLikeLambos,2,yo so like when do we sell so we don’t crash with the ship?
2020-09-01 22:08:07,LordoftheEyez,4,How long til TSLA IV dies down again?
2020-09-01 22:08:06,ryit29,5,Unemployment benefits is going to be a permanent thing isn't it
2020-09-01 22:07:59,gwre,1,"Anyone else been having issues with markets.buisnessinsider? Feel like it keeps presenting slightly out-of-whack numbers until refreshed, failing to load properly, not loading the graph, hanging on f5/ctrl+f5, and/or displaying weird fonts for me.

Only started like a week or two ago."
2020-09-01 22:07:54,Sbul26,1,Anyone have Palantir IPO date
2020-09-01 22:07:50,pump4iron,6,"Where are we on vaccine?? How come nobody talks about it anymore...what happened to all the ""hopes and wishes"" that rallied this market from the bottom???"
2020-09-01 22:07:36,WayneSVW,1,Why doesn’t UVXY have any November strike dates?
2020-09-01 22:07:32,I_love_boobs86,1,All of a sudden feeling pretty good about those $160 FDs I bought for CRWD literally last minute lol
2020-09-01 22:07:23,Arimir,5,"WSJ is so slow, these are old news. MSFT is goin to print 🤞"
2020-09-01 22:07:22,flipacoinmyguy,25,RKT Boys hold through earnings!!!No TP hands here. 🧻
2020-09-01 22:07:11,cnbPEE,8,Last time Elon did a stock offering it ended up being him calling the top. Is this the same shit?
2020-09-01 22:07:09,Ganjashark420,2,"[https://www.investopedia.com/terms/b/blowofftop.asp#:\~:text=What%20Is%20a%20Blow%2DOff,or%20high%20volume%20as%20well](https://www.investopedia.com/terms/b/blowofftop.asp#:~:text=What%20Is%20a%20Blow%2DOff,or%20high%20volume%20as%20well)."
2020-09-01 22:07:02,tendeeznuts,3,"Just remember DIX/GEX is all relating to SPY only not the overall market

&#x200B;

Silly bois"
2020-09-01 22:06:53,AutisticMoneyPrinter,2,Will my AAPL $130c 9/11 ever start decaying?
2020-09-01 22:06:52,spyaintnobitch,10,I'm making my yearly rent every single day. At some point this gotta stop but I hope that's not tomorrow
2020-09-01 22:06:51,Trumpowell,0,"J  Pow  has  created  a  monstrosity  and  it  can  not  be  stopped

To the moon"
2020-09-01 22:06:38,carlians,6,Whats another major earnings coming up in a days/weeks? I want to get in before the run up.
2020-09-01 22:06:37,GoBeaversOSU,2,Why tf would you buy BYND when Nestle CEO was on CNBC today talking about their foray into plant based meats? BYND is fukt
2020-09-01 22:06:36,Master_Relative,8,I see you WMT keep doing you baby
2020-09-01 22:06:34,quesobueno1,3,Just got off the phone with Tim’s personal ass slave and he said that AAPL is hitting the stratosphere tomorrow!
2020-09-01 22:06:30,chewks,3,how are my 495 tesla calls 09/04 i bought eod looking ?
2020-09-01 22:06:15,pilotsepisode,-7,"I can’t believe you people for banning me

I was unjustly silenced"
2020-09-01 22:06:10,thanosizedballs,-1,Futures 🩸
2020-09-01 22:06:09,GoBeaversOSU,4,Cramer on holiday is like a holiday for all of us
2020-09-01 22:05:59,yaboigoat53,10,Tesla baby tm is the big day to show the haters who is boss
2020-09-01 22:05:59,IDoLikeMyShishkebabs,3,"Anyone happen to know why you can’t gild most of the comments in this thread?

e: my dude"
2020-09-01 22:05:54,IAmConsidering,0,"All I want to do is just jump the bridge, I'm fantasizing about it, people would enjoy it. I wouldn't be able to annoy anyone else, couldn't make them mad, couldn't bother them, couldn't take up their time."
2020-09-01 22:05:42,kpthemaster,1,All in SQQQ. And you?
2020-09-01 22:05:41,ryit29,1,DGX is dirt cheap. They even below their pre-covid price
