date,author,score,body
2020-04-06 01:00:49,typotter103,12,"[This explains the pump](https://www.bloomberg.com/news/articles/2020-04-05/trump-and-pence-say-there-are-signs-u-s-outbreak-stabilizing) 

One day-over-day reduction in deaths and Trump calls the virus stabilized? Pence even followed his statements up with “The experts will tell me not to jump to any conclusions, and I’m not, but like your president I’m an optimistic person.”

Jesus Christ. Buy as many puts as you can get your hands on."
2020-04-06 01:00:30,pump4iron,7,"I had a funny feeling Futures were going to moon after seeing BofA article and Ackmans tweet. What you have is couple of hedge funds working cohesively to pump the market no matter what the news were..Oil could be tanking, corona could doubling...don't matter"
2020-04-06 01:00:20,LivinLike,7,Markets might be mooning on the fact that small businesses will fail which allows market share to be even further developed by the Big Corps. Big Corps with more market share means higher stock value. Pretty disgraceful.
2020-04-06 01:00:14,gigantoir,7,damn sub rejected that FAQ faster than futures rejected 257
2020-04-06 01:00:13,Lightingfast31,11,With this market trump could die and the futures would be up
2020-04-06 01:00:09,Howard_510,18,Bears we can save our puts if one of us ODs on hydroxychloroquine in front of a news station tonight
2020-04-06 01:00:08,absolutxtr,7,"So many ""please be green tomorrow so I can buy more puts"" comments earlier. Where are ya now, friends?

Hold puts. Buy more puts tomorrow."
2020-04-06 00:59:54,Cocaine_Addiction,6,"4 weeks into quarantine, starting to grow mushrooms out my ass"
2020-04-06 00:59:53,cuddlypolarbear1,11,"Nowadays every 🌈🐻 wanna talk like they got something to say

But nothing comes out when they move their lips

Just a bunch of jibberish

And motherfuckers act like they forgot about Jay 📠📠📈📈📈"
2020-04-06 00:59:51,inferno9416,6,futures drilling slowly could be red by morning
2020-04-06 00:59:48,legendarygap,2,Fuck IV. Even holding calls I’m not making much
2020-04-06 00:59:44,sh1t_trader,5,you know what would be cool? if jnug hit $20 by 4/17.
2020-04-06 00:59:44,,-1,Guess my disney 6p aren't printing.... :/
2020-04-06 00:59:42,,12,People on this sub always declaring victory 12 hours before the markets even open
2020-04-06 00:59:41,imadeitjustfor_this,2,bye bye puts :(
2020-04-06 00:59:40,dawhizkid,1,Idk what to believe anymore
2020-04-06 00:59:24,Agent248,0,"What’s a for sure 500% play? 


I am thinking msft 200c and spy 220p

Can’t go tits up"
2020-04-06 00:59:07,jpapon,4,"The market is just going to move sideways until we either get good news about a therapeutic drug that can reach the market quickly (somewhat unlikely) or earnings season plus jobless numbers start to scare people out of the market.

Until then, we're just going to bounce around since nobody knows how bad the next 6 months will be."
2020-04-06 00:59:00,oregon_forever,-15,"Salty bears still thinking downvoting people will bring their money back. 😂 Downvote all you want, your money ain't coming back."
2020-04-06 00:59:00,Painpita,7,Looking at futures rn. Spread my cheeks and let it happen I guess.
2020-04-06 00:58:59,10111010001101011110,0,GO LONG GO LONG GO LONG
2020-04-06 00:58:58,job182,12,"all those bs posts by people who were right a couple times are just reflective of regular analysts.. i work for an actual investment bank, and these guys, while smart, are still wrong half the time. 53% accuracy will make someone a superstar.

it's not about being right or wrong. its always been about the management of RISK.

because indeed while large movements can really make bank, if you're going all in again and again, you're bound to get wiped, even on days that you are right."
2020-04-06 00:58:54,carlians,2,Vix going up bigly
2020-04-06 00:58:54,g____19,1,"My job is miserable but is most successful in a recession. Now that were in one it’s even busier and more miserable.

I want to start looking at other roles but everyone is on a hiring freeze.

People who experienced ‘08 - did you find it harder to get a job in finance the years following the recession? I have a feeling many will be looking for jobs at this time with less people hiring. High job demand and low supply. 

Should I just wait it out for a bit?"
2020-04-06 00:58:39,cmAyP8658,2,Shorting ZM at premarket open?
2020-04-06 00:58:28,mattlockesreddit,1,"what stocks are you guys focusing on for tomorrow?

Im thinking about going in on Delta"
2020-04-06 00:58:14,ThirdCrew,8,It's hard to be a bull when my state will be a minimum locked down for 6 weeks and I know some businesses won't open back up or if they so they will close down permanently within a month or two with half their usual income. The market acts like everything will be fine but you know it's not.
2020-04-06 00:58:08,superwonton,19,"What did I learn from Trump's presser?

Next time I get sick, no matter what illness, the first thing I am reaching for is hydroxychloroquine. It can't hurt to try!"
2020-04-06 00:58:00,BosticReiva,4,Bears taking it up the ass
2020-04-06 00:57:58,jonnydoo84,5,The fucking excuses and mental gymnastics people make when they are wrong is astounding. play both sides and stop being fucking retarded.
2020-04-06 00:57:54,jregi83,2,Market will likely fade the gap up tomorrow as it has consistently done so in the past weeks
2020-04-06 00:57:49,OccasionallyLearning,3,"I’ll check back tomorrow, who knows what’ll happen"
2020-04-06 00:57:36,buddingdoc,6,"https://mobile.twitter.com/ElisabethKangMD
Young resident physicians dying too."
2020-04-06 00:57:33,InKanosWeTrust,3,This market is fucked up the booty hole but ya know. Stonks only go up. They go down sometimes
2020-04-06 00:57:30,killerk14,5,"If spy closes 258.99 I cash out like 50 iron condors. If it closes 259.12, I break even. If it goes above that, things get weird boys and girls"
2020-04-06 00:57:29,JerseyFlashBoys,2,Balls deep n leaps right now but i ain't sellin tho rn
2020-04-06 00:57:24,YangGangBangarang,7,Finally one red candle to represent the blood leaking from my ass after all the green dildos
2020-04-06 00:57:20,xjayroox,-1,🎵🎵 I fought the ~~law~~ Fed and the ~~law~~ Fed won🎵🎵
2020-04-06 00:57:19,,3,"Sad part is, it will be flat tomorrow and everyone but theta gang getting crushed. Fml."
2020-04-06 00:57:09,MrBigBossMan,0,"Bears don’t look

https://imgur.com/a/OyOoOxF"
2020-04-06 00:57:05,byrnedoctor,6,"market opens at spy 253 or ban, then dumps back to 248 and we pick a direction"
2020-04-06 00:57:02,10111010001101011110,-1,Over 3% up now holy fuck bear fuk 😷😷😷
2020-04-06 00:56:57,IgrewAtomato,3,Have to keep the markets strong.  China's markets stayed strong and so must ours.  Using similar mechanisms.
2020-04-06 00:56:52,LatinoMuyFinO,5,Damn market really don’t give a fuck about ma boi Boris....
2020-04-06 00:56:49,undermon,4,God I am so tempted to close everything and just go all in on shares tomorrow...
2020-04-06 00:56:47,degenerati1,5,Holy fuck just checked futures. What are the odds my 4/6 260c that I bought at 3:30pm on Friday will print?
2020-04-06 00:56:40,GourmetFilet,2,"America’s new slogan “What have we got to lose?”

The answer: Everything"
2020-04-06 00:56:27,TheOriginalRK,3,So when rug pull?
2020-04-06 00:56:22,vcarpe,8,How is it possible? The futures are having a huge erection. I no understand
2020-04-06 00:56:20,mikally,4,"Considering some deep otm calls on CSCO because of webex. The zoom privacy concerns are going to have a significant portion of the market shifting towards cisco/Microsoft. Was eyeing some of the 5/15 $49 and $50 calls. I was also considering 5/22 $50 to maybe catch some the earnings report premiums. 

IV seems lower than most of I have been looking at and the premiums don't seem insane. The spread is pretty poor and volume isn't great but they contracts are cheap."
2020-04-06 00:56:19,superwonton,6,"what's the % of newly unemployed who won't have a job to return to? and the impact to their credit card, auto, rent/mortage?

who cares about that, tonight we MOON!"
2020-04-06 00:56:14,excadedecadedecada,6,"I'm sorry, but ya gotta laugh... bears fought the fed tooth and nail from october (or earlier) until jan/feb, constantly claiming that there was no way the house of cards could hold... and they were right honestly, even before covid-19, the market had no business being where it was.

And now bears are literally watching the calamity unfold right before their very eyes in a way the likes that we've never seen before. And who's standing right there? Fucking JPOW. Just right fucking there, hasn't moved an inch."
2020-04-06 00:56:10,Peetrius,2,"My plays going into the week:

AAPL Iron Condor expiring 4/9, between 230 and 250.

MSTF Iron Condor expiring 4/9, between 145 and 160. 

Hold till expiry or close on Monday?"
2020-04-06 00:56:05,Howard_510,6,WSB sentiment is exactly like right before we drilled 30% back in January
2020-04-06 00:56:04,carlians,6,Bulls excited to make $20 tomorrow 😂 yes!!!
2020-04-06 00:56:03,C-Squid,1,Selling my 4/17 SQQQ puts but keeping my 5/1 INDA puts
2020-04-06 00:55:52,FrshlySqueezed,2,Fk futures
2020-04-06 00:55:49,fuegocossack,9,5/15 🌈🐻 gang sound off!
2020-04-06 00:55:45,BubbaCrosby,5,"It’s hard to say if CNN is even any better than Fox. Just absolute trash. They aren’t even left wing, just neolib and neocon poo poo."
2020-04-06 00:55:46,noah8597,11,"#It’s been an honor

My FDs will expire worthless on 4/17 and I won’t have any money to participate on the way back up. 

Bears strong together!"
2020-04-06 00:55:41,joch256,2,Nice time to load up on puts
2020-04-06 00:55:31,taxman1922,2,"Welp, looks like it’s gonna be a long week. SPY puts were a bad idea. Maybe my USO puts will be ok."
2020-04-06 00:55:14,adoseofcommonsense,5,"God bless 

Saint Jerome Powell of Washington"
2020-04-06 00:55:13,TwoToolsAndADream,-3,tried to warn some of you. Should of sold out puts at eod wednesday.
2020-04-06 00:55:08,MagicalMule,16,"On the bright side, my tax burden for 2020 is going to go down substantially tomorrow..."
2020-04-06 00:55:05,mmmttt123,6,Just limit up already so I can go to bed.
2020-04-06 00:55:05,moazzam0,5,"💎🖐️
SYF $20P 4/20"
2020-04-06 00:54:58,oldprecision,3,"Damn it, i still have cash, don't leave without me!"
2020-04-06 00:54:51,,1,Hoping muh MSFT can break 160 soon :(
2020-04-06 00:54:34,Gilbertgodfries,6,Lol that thread got removed already
2020-04-06 00:54:30,tofu_tron,2,bought FD 4/6 265c on friday as inverse wsb insurance.. should ease the pain
2020-04-06 00:54:24,RidiculousSN,2,For some reason I'm holding 260s expiring tomorrow. Sell at open or hold til close?
2020-04-06 00:54:14,aasul49,7,"**Looks at futures**
🤢🤢🤮"
2020-04-06 00:54:14,carlians,2,Fuck worrying about my WMT call credit spread right now.
2020-04-06 00:54:13,Orngarth,12,"I'm finally admitting to myself that my puts are fucked.  Since I'm always 100% wrong, that's great news."
2020-04-06 00:53:55,JustTheWriter,17,"Re: the ""peak"" in COVID19 infections in NY. Nice idea. Quaint. Very feel-good. Looks nice for both Trump and Cuomo. Great little graph that plays the ""flatten the curve"" narrative.  

Here's the thing, though. There's still plenty of people not practicing social distancing in the city. I anticipate that yes, we'll see a dip... followed by a sudden, sharp jump in the numbers about 7 - 14 days after the Easter weekend, when people are going to gather in much larger numbers creating a huge exposure spread over three days and then contribute to a big spike in hospitalizations and casualties.  

Yep: double-top in COVID19. Holding my 0501 220 puts."
2020-04-06 00:53:53,Quatto,12,Y'all read two hours of futures as an absolute sign that the bear market is over. No wonder the $ROPE.
2020-04-06 00:53:40,Chuchuchu01,2,Turns out wallstreet don’t give a fuck to whatever the fuck Boris is doing over there in England. Who would’ve thought? Definitely not wsb
2020-04-06 00:53:35,DrUNC83,10,"Midfriday
Brain: sell your puts now even the ones that expire may and June 

EOD Friday 
Brain: Sell
Heart: fuck that, hold, plenty of time 

Sunday night futures singing “shot through the heart.. and you’re to blame”"
2020-04-06 00:53:35,HideIt1,9,Everyone seems to get so worked up over day to day moves. There are positive days in a bear market.
2020-04-06 00:53:34,throwaway78907890123,-2,"🐻 u have been tricked into comparing this with previous recessions. There is no second leg down.

We have a V shaped recovery starting now, leaps end of year would print!"
2020-04-06 00:53:34,legendarygap,8,Actually feel so bad for put holders. Y’all should not be losing money tbh :(
2020-04-06 00:53:26,svpa3991,2,Red green red green. Puts Tuesday it is
2020-04-06 00:53:25,pump4iron,9," Cramer said you only need about 15-20 million to manipulate the Futures...But if you have multiple hedge funds working together, you could make a lot of money pumping and dumping.."
2020-04-06 00:53:25,Exitshuffler,6," MSFT 200c 3/20 all over again 

 [https://i.imgflip.com/3vj0b6.jpg](https://i.imgflip.com/3vj0b6.jpg)"
2020-04-06 00:53:19,Fuckthisshit6969,3,I’ve got 5/15 225p on SPY. I’m not even gonna open robinhood tomorrow this gay market can smd until it crashes
2020-04-06 00:53:14,swamprott,3,futures dont mean shit
2020-04-06 00:53:04,catsRawesome123,2,Lol my puts...
2020-04-06 00:52:56,robohydrate,5,My only move is to cry as my puts incur even more loss
2020-04-06 00:52:54,SebastianPatel,2,why are the futures sky rocketing?!
2020-04-06 00:52:53,StreicherADS,4,"Well I'm probably gonna start buying calls now, but you'll pry these spy puts from cold dead hands."
2020-04-06 00:52:28,Tacos20,15,i can already feel the -90% coming 😩
2020-04-06 00:52:26,x_driven_x,6,"Buy some SABR,calls and underlying.

 See if my ZM puts can make money. Watch my Starbucks, Hasbro, Roku, square calls and see if they can make money.

Hope SLV goes up.

Buy USO again on a dip. SPY puts if it goes up."
2020-04-06 00:52:20,zangor,34,"The year is 2024.   SPY is sitting at 695.  You go into the daily thread.  First comment you see:

""This seems soooooo fake."""
2020-04-06 00:52:19,speeddemon266,4,"How fucked will I I this week. I just want to break even again.

5/1 Z $28p 
5/15 VXX $95c
5/15 GD $130p
6/19 F $4p
10/16 USO $7 c
1/15/2021 CHK $.50 c 
1/15/2021 NOV $18 c"
2020-04-06 00:52:15,sh1t_trader,1,"Why is it when anything goes up the term ""mooning"" is used? I feel like ""mooning"" should be said when a stock is at its all time high, not just when there's a bounce. Am I missing something?"
2020-04-06 00:52:06,UsernameTaken_123,8,"looks like limit up incoming

lots of bear portfolios in here getting ripped to shreds R.I.P."
2020-04-06 00:52:03,96ZJ,-5,I fucking called this shit
2020-04-06 00:51:59,thesaddestcuck,3,"Double spinning top forming on the 5 min wheel lock chart. AKA FUCK TA traders. All full of shit lmao

VIX to $95 LOL cant wait until his ass gets BANNED"
2020-04-06 00:51:59,Dsopptha,5,"As a fellow bear I feel for all you guys, good luck to everyone I hope both sides win"
2020-04-06 00:51:56,,6,"To the autists who don’t seem to get it...

#FAKE RECESSION CANCELLED FOR THE LOVE OF ALL THAT IS HOLY GO LONG"
2020-04-06 00:51:56,2-leet-2-compete,0,welcome to the range: 245-265 until one of those breaks
2020-04-06 00:51:55,Drexlay,7,Nobody knows shit Friday and know y’all think you now know because of futures? Lolol
2020-04-06 00:51:53,flotl37,5,Everyone is bullish ... Time has come to buy puts cock suckers
2020-04-06 00:51:46,crptq_beats,8,"My theory:

As light at the end of the tunnel is becoming brighter the shift in focus will turn to economic recovery and fundamentals. It is at this point investors will realize how truly fucked the economy is and already was.

We're not even 2 months into this shit and business are already talking about closing doors and begging for bailouts. Don't you think that is telling about the state of Trump's economy (see: bubble)? 

Also, the addition of all this leverage and free credit is going to be really fucking ugly if it backfires.

&#x200B;

SPY 6/30 200P"
2020-04-06 00:51:44,superwonton,2,just jerome being jerome
2020-04-06 00:51:44,Jamie_DiamondHands,4,Somehow the market always knows when I sell calls.. simulation theory confirmed
2020-04-06 00:51:38,brokeinOC,11,My move tomorrow is to find a new sub that doesn’t have u/jartek profiting off it
2020-04-06 00:51:31,caramelpies,7,Life-changing money was made and lost
2020-04-06 00:51:31,minnesota_nice17,6,5/1 230p and 5/15 225p SPY .. are they dead in the water finally? I’ve been holding since mid-March
2020-04-06 00:51:30,BertMacklinFB1x,4,Unless you can day trade.... my advice to you is to pick a side and buy leap options!
2020-04-06 00:51:25,EightOneZero810,3,"Good DD here: inverse Buffet.

There was a huge story that Berkshire bought tons of DAL stock at $45, then it dropped. Now there is story about berkshire selling some DAL stock, it will skyrocket."
2020-04-06 00:51:11,D3EZNUT5,2,Any bulls here want to have their way with my 🌈🐻🍑
2020-04-06 00:51:06,bxgoods,2,Imagine holding puts over the weekend brehs
2020-04-06 00:51:01,shortwhite12,1,Puts on zillow
2020-04-06 00:50:57,kd_uoft,4,What the fuck just happened? Why are futures mooning lol
2020-04-06 00:50:51,medthrowaway68,0,Upvote so someone can ask an oil question
2020-04-06 00:50:48,Raccoonpug,6,The fuck is this? Within the next month million of small to big businesses going to be in debt and some cant even pay off the loan even if economy start rolling. Stop thinking the economy is only in the US but its the whole world. Fuck this rigged market and the fed.
2020-04-06 00:50:38,JeffBezosNewWife,2,What’s gayer the mods or futures right now
2020-04-06 00:50:37,Apdvadar,4,"Young thug: I go up up up and away.
      Truly an inspirational artist.
Better DD than Separation Anxiety."
2020-04-06 00:50:25,shamusotool,1,Do people actually say ess pee why for SPY?
2020-04-06 00:50:25,LivinLike,4,This talk from Trump about US stabilizing will only foster false hope and cause the outbreak to last longer than it needs be. We're about to have one of the toughest weeks yet but the focus is to Pump the markets. Longer dated puts will be fine here. Delaying the next leg down.
2020-04-06 00:50:16,themadpooper,6,"S&P going up, VIX going down... are we reloading on puts tomorrow or waiting until later in the week?"
2020-04-06 00:50:05,urnanmypan,24,*WSB declares bankruptcy tomorrow as spy opens +69%*
2020-04-06 00:50:04,legendarygap,5,Holy shit I looked at futures like 30 mins ago and it was up 1.5. Now it’s 3 lmaooooo. So glad I held calls
2020-04-06 00:49:55,Swagsung,5,Jesus limit up incoming.....please no
2020-04-06 00:49:51,LeveragedShit,2,"Puts on sale tomorrow. Long holiday weekend, Friday markets closed. Keep up the pump boys."
2020-04-06 00:49:49,YangGangBangarang,11,Remember that one Sunday night where futures limit down then Monday was +10%
2020-04-06 00:49:49,Hitachi22,5,Coronavirus deaths top expectations and raising guidance explains why futures up bigly
2020-04-06 00:49:22,Opening-Risk,-1,We're gonna limit up 😂
2020-04-06 00:49:13,r710m406,3,Organizing a hunger strike until we hit new lows. Who's in? (No eating your own feces/cum allowed!)
2020-04-06 00:49:04,ebkallday1,4,Bears please don't do anything stupid. We all love you
2020-04-06 00:48:59,enate1111,3,I guess that’s why they call him Donald Pump
2020-04-06 00:48:58,noe5634,2,how fucked are my 4/17 240p
2020-04-06 00:48:51,IgrewAtomato,1,There's a clear Poveracci tenor on the 1 min with a Carole Baskins crunch happening on DIX.  Look out bulls.
2020-04-06 00:48:49,Hookemvic,2,Man I’m glad I’m mostly out until Sept and January now. Fuuuuuck crazy green.
2020-04-06 00:48:48,cmackmason,5,"found the news futures is pumping on.  man are they so fucking wrong 

https://www.bloomberg.com/news/articles/2020-04-05/trump-and-pence-say-there-are-signs-u-s-outbreak-stabilizing"
2020-04-06 00:48:37,beervirus69,-2,Anyone else thinking we may see a mass amount of cash withdrawals once ppl get their trump bux? Or am I truly stupid
2020-04-06 00:48:21,engineerboy29,0,"i love how cnn has this one clip..not even from the meeting today of fauci saying ""we are struggling to get this under control""...they use it on their banner...so much fear mongering and hate on trump lol."
2020-04-06 00:48:15,23564987956,4,"I have two Apple 245s, I hope I make some money"
2020-04-06 00:48:13,TradeCalls,0,Bears better swallow some lube when they are going to be sucking big bull cock tomorrow
2020-04-06 00:48:13,LeveragedShit,2,Guess my $LK calls gunna print big mula tomorrow
2020-04-06 00:48:07,mages112,3,😥 i dont fking get it. We got rejected at 260. 252 and now it going back to 253 254 😅 anyone $rope with me tomorrow
2020-04-06 00:48:06,minnesota_nice17,5,How fucked are my SPY 5/1 puts
2020-04-06 00:47:49,GG_Henry,4,"Guys what a roller coaster we are living in.

&#x200B;

Just remember what comes right before the biggest drop on every roller coaster."
2020-04-06 00:47:48,,8,"Want to be rich?

#LONG $MGM FIRST THING IN THE MORNING

The sale on stocks will be gone soon when vicious buying begins this week"
2020-04-06 00:47:46,MrCreateWealth,5,filling the gap from Wednesday. Open big green and it’s all downhill
2020-04-06 00:47:44,Shower_Handel,8,Is this a fucking joke
2020-04-06 00:47:39,typotter103,8,"Lmao did I miss something during that press conference? I heard nothing that would trigger a buy in my head. If you guys think institutional investors are as retarded as Pajama traders, then you will be sadly mistaken. Tomorrow should be interesting"
2020-04-06 00:47:35,apolloandbackk,12,SPY puts just became 3/20 200c MSFT
2020-04-06 00:47:32,LaMouth,4,Cashed out all my contracts last friday before close. Glad to be on the sidelines for this open.
2020-04-06 00:47:25,consygiere,2,Holy fuck. I’m holding USO puts but at this rate they might not even print.
2020-04-06 00:47:20,throwaway78907890123,2,Red candles are killed right away.
2020-04-06 00:47:17,SomeComparison,5,"Seriously, Why are futures up? There is no good news? It's just getting worse, now the tigers have the beer flu..."
2020-04-06 00:47:14,g____19,4,"Positions:

SPY 4/27 $200 puts
SPY 4/27 $300 calls

I figured wtf why not. We will prob close at $250 on 4/27 anyways so I will hold until expiry and pray for the best!"
2020-04-06 00:47:10,dan_coyle,1,"Damn, should’ve averaged down my 5/15 SPY 298c last Friday — limit missed by $1/contract. Anyway, I’m sure there’ll be more opportunities over the course of 5 weeks.

If nothing else, could we at least get our crazy futures and intraday moves back? That was more fun regardless if green or red."
2020-04-06 00:47:09,TheOriginalRK,3,At least if we go up 5% tomorrow then down 5% Tuesday VIX will go up right?
2020-04-06 00:47:09,RyChrome,2,Are markets closed Friday?
2020-04-06 00:47:02,oregon_forever,-3,Imagine buying puts after stonks already dropped 35% not to mention sky high IVs.
2020-04-06 00:46:56,,-4,"Oh boy these future comments really crack me up ""But muh fundermentallsss! But muh 1929 collapse... but muh death toll, but muh lockdown... but muhhhhh!"""
2020-04-06 00:46:44,Lezzles,5,"If you're looking for ""good news"", you've got it wrong. Things are going to flatten/go up in the absence of new worse news."
2020-04-06 00:46:44,Dragonsinja,8,"Virus fading doesn't mean everything's fine. It's fading due to the quarantine, and as soon as we reopen the economy cases will spike again. Until there's vaccine were still fucked.

But still, SPY could either go to 350 or 180 or no one fucking knows."
2020-04-06 00:46:43,job182,7,"you guys need to understand.. whatever oil production the US cuts, it wont be trumpted and it wont be public... it won't even be framed as a ""cut"". it'll be ""maintaince"" or ""taking some rigs temperorily offline"". that's national security we're talking about here. but thats just how all this works..

if nothing has changed and the sauds and putin are still trading barbs, why are they even considering a ""tentative meeting date""?"
2020-04-06 00:46:39,enate1111,3,Will AAL rise with the markets tomorrow?
2020-04-06 00:46:36,,3,Corona be gone thot. Fuck the little gay ass flu. Limit up baby!
2020-04-06 00:46:34,WillToAscend,6,gape my anus for these huge green futures dicks
2020-04-06 00:46:32,mike1234567654321,5,"The market will go up every day until the pandemic is officially declared over, then down."
2020-04-06 00:46:27,foot56,6,🚀 🚀 🚀 🚀 SPY 🚀 🚀 🚀 🚀
2020-04-06 00:46:17,dawglurker,7,Damn. I guess my USO calls going to print by morning.
2020-04-06 00:46:14,Lightingfast31,11,A major world leader is in the hospital with coronavirus and futures are up. What are we gonna hit limit up if he dies
2020-04-06 00:46:13,shotsfordrake,6,"Fuck it, calls it is. Bottom is in, goodbye"
2020-04-06 00:46:10,_elroy,5,Elliot wave theory at work here on the 1m.
2020-04-06 00:46:09,Myballzwashott,3,Was gunna do some weekly calls at open but now with limit up not sure. Sigh.
2020-04-06 00:46:04,10111010001101011110,1,Corona winding down quickly. Maybe the warmer weather helping out. Bears absolutely fuk 😬🤤🤤👏👏
2020-04-06 00:45:55,Kiffins_Disciple,8,Where were you when 🌈🐻s died?
