date,author,score,body
2020-08-13 21:31:46,avelak,115,"Alrighty, think I've got most of the stupid gangs from the past 6 months or so.  I was personally sucked into 5 or 6 of these, shameful.

* dIaMonD hAnDs SPY 200p

* Tanker Gang

* PRPL gang

* Team RKT

* Corn Gang

* That ULTA DD motherfucker

* ATVI

* SNAP puts

* SPCE Soldiers

* Metals gang (SLV Surfers)

* Quad Witching

* MSFT 200

* MGM

* KODK bagholders anonymous

* Kang Gang

* DKNG DKNG DKNG DKNG

* VBIV dude (he'd be happy now if he wasn't banned)

* JNUGgalos

* AZN Fever

* AMD puts

* REITs

* Gun riots

* NKLA

* The many fallen in service of TSLA gang on the uppies and downies

* PG&E (AKA the easiest fReE mOnEy)

* MU 90c

* ZM puts

* DGLY

* LL 

* Luckin Coffee

* HTZ bankruptcy moonshot"
2020-08-13 21:31:40,Houston_swimmer,3,Breaking: different states are much different
2020-08-13 21:31:37,SunriseSurprise,2,Scalped DKNG run-up today. Cash gang until tomorrow when I'll probably play SPY 0dte calls depending on how early action looks.
2020-08-13 21:31:35,widespreadhammocks,1,the atmosphere is different lol
2020-08-13 21:31:25,UpSideofDown,1,"Watch my BBY and WMT calls gain value.  And pray that AAPL finally rallies up to $500...

Edit:

Also picking up some more HD calls to play nice with my LOW calls."
2020-08-13 21:31:17,Heedunk,8,Jesus Christ you people are so dramatic. AAPL down like a $1 and it’s the end of the world
2020-08-13 21:31:16,PutsTookMyMoney,3,Anyone know how to get robinhood to quit sending you emails about orders you made? Mine shows a lock when I go to settings
2020-08-13 21:31:13,scopolamine,2,Wow I was expecting US 10 year to touch 0% but it seems like that it is going to touch 1%.
2020-08-13 21:31:10,SullyBrr,2,Why can’t this mother fucker read his speech? I need one of those red bouncing balls that jumps across the words on the screen when he talks
2020-08-13 21:31:03,buckinbronco74,5,So just buy TSLA call at like 10am and sell an hour later?
2020-08-13 21:30:56,Jackie296,7,Watch people in the am spam “bUy tHE PpRL dIp”
2020-08-13 21:30:46,cutiesarustimes2,3,*laughs in Android*
2020-08-13 21:30:25,SpyPutLambo,13,This is what it’s like to have Tesla calls? You can actually sleep?? Holy shit
2020-08-13 21:30:24,sloop703,28,"No position on PRPL but can we all say fuck off to the massive prick that is u/patrickbateman02 ? This guy has NINE wsb posts in the last two days. He basically just barfs whatever comes to mind into a post. He has two separate posts after hours today to troll PRPL people 

I can’t get mods to approve a proper dd post once a month... yet this guy has 5 moderna posts a week"
2020-08-13 21:30:24,Buildingdetroit,2,yuuuuuege em pact
2020-08-13 21:30:12,Stonks0nlyG0Up,5,How do you fucks afford TSLA options
2020-08-13 21:29:44,VirtusInjection,3,Tesla is hitting 1700 after hours sorry
2020-08-13 21:29:41,stupidgutsneverglory,1,man i really hope donnie gets his adderol dealer back.
2020-08-13 21:29:34,StylizedPortfolio,2,what happened with PRPL earnings? Are they out yet?
2020-08-13 21:29:32,BLACKdrew,3,I fucking hate fortnite so much
2020-08-13 21:29:15,olshbk4,14,If AAPL has a bad day tomorrow im gonna go find a baby seal and beat it with an iPhone.
2020-08-13 21:29:10,karanrucks,3,Fuck off Fortnite. ATVI time is now
2020-08-13 21:29:07,whiteninja123,1,Buying SLV seems grossly undervalued compared to Gold. And the price is low.
2020-08-13 21:29:07,ketolad1,3,"Its not a 1 day trade guys....plus i will scale more as it rises upto 485. Or as it drops below 430ish...
Who cares about split. I will be short 4 times more share and will adjust my stop and target levels accordingly."
2020-08-13 21:29:06,q112,5,Hopefully AAPL dips tomorrow because of this lawsuit and I can buy in for cheaaaappp
2020-08-13 21:29:01,tinkleweiner,3,Why is baba down even more AH
2020-08-13 21:28:59,VirtusInjection,2,Sleepy joe 😴 💤
2020-08-13 21:28:59,Buildingdetroit,3,Sleepy Joe right out the gate
2020-08-13 21:28:58,Donttouchmydorritos,0,"Did any of you see this before the EOD rally?

https://reddit.com/r/wallstreetbets/comments/i8xa70/_/g1cvv2x/?context=1"
2020-08-13 21:28:58,disastrophy,1,Damn it.  I had a bunch of PRPL puts and call credit spreads because I knew their was zero chance WSB was going to make money off a mattress company.  After getting tired of waiting for PRPL to die I finally took a small profit this week when it was at 23.80 and closed my positions.  If I had held on 2 more days I could've been rich
2020-08-13 21:28:50,The_Weekend_DOW,10,"Quick reminder that if TSLA hits 1700 before end of week, u/thereckoning2918 has to get a tattoo that says “US TECH 100” 

https://www.reddit.com/r/wallstreetbets/comments/i8l3ny/what_are_your_moves_tomorrow_august_13_2020/g19h8fb/?utm_source=share&utm_medium=ios_app&utm_name=iossmf"
2020-08-13 21:28:45,ESECash,3,Why is the fed calling it digital dollars instead of fedcoin
2020-08-13 21:28:44,ProfessionalCrazy3,3,Purple gang in shambles 😂
2020-08-13 21:28:42,love2fuckbearasshoe,2,Oh shit when they gonna catch biggi and Tupac killer
2020-08-13 21:28:29,PattyIce132,3,$900 in PRPL calls and $300 in PRPL puts. Hopefully it will offset my losses on the calls
2020-08-13 21:28:28,thestashman23,7,Aaaand I’m holding an AAPL bag
2020-08-13 21:28:20,EssentialUSAWorker,0,"I hate you INTC, but its my own fault for being a 🤡"
2020-08-13 21:28:10,nosalute,3,AAPL BOOMERS VS FORTNITE ZOOMERS PLACE YOUR CALLS AND PUTS HERE
2020-08-13 21:28:04,cherrycolasoda,1,☂️☂️☂️calls
2020-08-13 21:27:58,buck_tardwater,2,Why aren’t we all playing $SEDG? Look at this fucking stonk bro
2020-08-13 21:27:49,Panda_Pineapple,8,"Probably have corona....

You guys should probably go get tested too"
2020-08-13 21:27:49,Orzorn,-2,Does anyone have an options calculator that lets me alter IV to see how IV affects position growth/deflation?
2020-08-13 21:27:47,butterflyfrenchfry,3,This motherfucker
2020-08-13 21:27:46,Ac-28,5,"No stimulus deal, so obviously skyrocketing tomorrow right?"
2020-08-13 21:27:36,q112,8,"Will Tesla finally be able to get past 1647 in after hours today, let’s hope"
2020-08-13 21:27:33,HonestManufacturer1,0,Elon just tweeting shit about robots makes me thousands. He's basically my dad giving me a weekly allowance for the past 4 months
2020-08-13 21:27:30,chefromnba2k,1,In a different timeline — PRPL market cap worth more than 100% of U.S. GDP
2020-08-13 21:27:27,HonestManufacturer1,1,Elon just tweeting shit about robots makes me thousands. He's basically my dad giving me a weekly allowance for the past 5 months
2020-08-13 21:27:23,GillTheGreat,8,Bought a 1605 8/14 Tesla call for $360 and sold for $3000 on the dot today. Got a 1750 call for next week because I don’t know how to quit while I’m ahead
2020-08-13 21:27:19,ScienceDave-RE,15,Upvote if you are Elon Musk’s illegitimate child.
2020-08-13 21:27:08,SlimyMarvin,5,Who here actually believes TSLA won’t reach 2k before the split...
2020-08-13 21:27:00,Nemo-pluribus-unum,4,You know what would be cool? A time machine so I could win this game for once and avoid my most painful mistakes. Damn.
2020-08-13 21:26:50,VirtusInjection,1,Is trump speaking today?
2020-08-13 21:26:42,FearlessTrader,34,"The level of retardness on some of the folks here is astronomical!

AAPL falls 0.3% AH, comments from retards: “holy shit AAPL is drilling hard AH” 🤦‍♂️🤦‍♂️🤦‍♂️🤦‍♂️"
2020-08-13 21:26:39,chewks,1,"What does it mean upgraded to equal weight from underweight for Tesla ?

Edit : swap to and from"
2020-08-13 21:26:28,raobjcovtn,16,Imagine going all in on a mattress company
2020-08-13 21:26:16,Vyruz2,27,"Imagine betting your entire net worth on a mattress company


Edit:  I knew I should’ve gotten puts when I saw every 13 year old bullish on this piece of shit"
2020-08-13 21:26:08,300lean,11,You guys ever feel like you want to hang out with people that you can talk about stocks and investing with all the time but no one understands this shit. I cut so many friends off years ago because they’re 9-5ers with no ambition.
2020-08-13 21:26:03,YoshikageHands,2,More prpl puts at open? Could go under 15 by next week
2020-08-13 21:26:02,Buildingdetroit,1,DONNIE IS ONNIE: https://www.youtube.com/watch?v=-hre_R98v-M
2020-08-13 21:25:59,gotfelk,1,Holding PRPL puts. GANG GANG
2020-08-13 21:25:53,oli-sonyeon,1,UBER can't catch a break
2020-08-13 21:25:50,sixplaysforadollar,2,AMAT holding well after earnings. Glad it didn't follow suit of most other jawns during earnings
2020-08-13 21:25:46,upsetrobinhood,5,"When I sold Tesla at $900 it seemed like it had already gone parabolic. Now on the 1year chart, $900 seems like such a small blip in the road."
2020-08-13 21:25:44,Throwawayeconboi,1,"Me last night: DOCU is gey


Me tonight: AMD is gey"
2020-08-13 21:25:42,javillal,1,Man I've gotten wrecked by MU and I never learn. Holding my last calls for 47 8/21. This AH is not looking good
2020-08-13 21:25:40,dogthatbrokethezebra,4,"No, seriously. Who the fuck plays Fortnite on an Apple product?"
2020-08-13 21:25:39,throwaway21342134213,0,"I only have PRPL shares left

Sell them at open?  Won’t let me sell AH for some reason"
2020-08-13 21:25:38,almostmicrochip,8,"me buying a call three weeks out:


this is a LEAP, right?"
2020-08-13 21:25:15,PalekSow,2,Any remaining MSFT/FB FD holders praying over their lotto tickets?
2020-08-13 21:24:52,cambiebridge,1,PRPL is absolutely going to touch $19s. No fund manager would hold a mattress stock that cant even provide guidance.
2020-08-13 21:24:25,thebreadjordan,8,Tesla to 1700 right?
2020-08-13 21:24:13,Donttouchmydorritos,5,"Happy I added TSLA $1625 08/14 today on that fat dip🤑🤑🤑

My $1490 08/14 and those are now going to buy me a new nursery for my newborn daughter and a new Model S performance."
2020-08-13 21:24:07,Snoopsie,5,I will buy lunch for 3 homeless guys if TSLA hits 1650 tomorrow
2020-08-13 21:24:00,q112,4,"Don’t want to get ahead of myself but maybe, just maybe, holding onto my [8/14 TSLA 1650](https://www.reddit.com/r/wallstreetbets/comments/i8xa70/daily_discussion_thread_for_august_13_2020/g1cwvkf/?utm_source=share&utm_medium=ios_app&utm_name=iossmf) might have actually paid off."
2020-08-13 21:23:56,visionarymind,-1,🟣🟪💜☔️
2020-08-13 21:23:53,jawnutah,1,I know my PRPL calls are fucked but sounds like they are going to keep growing a lot
2020-08-13 21:23:35,robalob30,1,Ayyy one more day of TSLA tendies
2020-08-13 21:23:31,dasgrmn,1,"AAPL cuts fortnite. Shaved 9b off of market cap AH. Hahahaha wtf, shoulda just bought Fortnite."
2020-08-13 21:23:29,marine_guy,2,"XOM 

Going full tard"
2020-08-13 21:23:28,Hal______9000,3,So where I u/lurkingsince2006 loss porn?
2020-08-13 21:23:21,NearbyPlenty1,2,AAPL get your ass back in the saddle and on to 475
2020-08-13 21:23:13,jawnutah,3,"PRPL also said when second facility is in, they’ll have capacity for 1B in revenue"
2020-08-13 21:23:03,dudevinnie,0,I want my covered calls to drop so i can buy them back and resell Monday morning
2020-08-13 21:23:00,almostmicrochip,16,"“i’ll make it back eventually”


🤡"
2020-08-13 21:23:00,B0KCH0Y,0,Lol imagine apple gets rocked maybe they will start using amd chips cause they’re cheaper than intel.
2020-08-13 21:23:00,mattrob1995,1,watching Margin Call again
2020-08-13 21:22:58,Jefflandryeverybody,3,I want to make a PRPL mattress joke but there are too many ways the joke could back fire on me....kinda like everyone's calls on here today.
2020-08-13 21:22:49,freehouse_throwaway,0,man i'm just glad i have zero position in MU. sold everything before pandemic and never looked back.
2020-08-13 21:22:37,DeanYerdon,6,Who would have guessed that fucking fortnite of all things would be biggest downward catalyst for AAPL pre split? We’re 100% living in a simulation I fucking hate it here man lmao
2020-08-13 21:22:27,CraftyScotsman,7,Automod is a nerd
2020-08-13 21:22:24,Ryykur,3,Is Nvidia going to moon or not?
2020-08-13 21:22:21,cherrycolasoda,7,Any chance PRPL makes it to $26 tommorow?
2020-08-13 21:22:17,THEIRONGIANTTT,0,"Tbh you shouldn’t even have the fuckin ability to open a brokerage account with under 25k, fucking lucky you even get PDT warnings and shit, if it was up to me you’d be locked tf out"
2020-08-13 21:22:15,TheOriginalRK,1,So does my TSLA $1700 weekly have a chance? Lmao
2020-08-13 21:22:13,Mr_Dr_Papa_John,9,"“All it takes is a few circuit breakers” - I mutter to myself as I diamond hand my puts to zero 

📉📉📉"
2020-08-13 21:22:13,robot141,4,"Aww...isn’t it cute that TSLA is taking off after hours, instead of when its needed during trading hours"
2020-08-13 21:22:06,bliss16,-1,"STO 1x3 BIDU 121/116p 8/14 for 0.60 credit

STO 1x3 BIDU 122/116p 8/14 for 0.25 credit

STO 3x8 ratio put spread PRPL 22.5/20p 8/21 for 0.75 credit

If prices hold their current levels, these should print hard tomorrow."
2020-08-13 21:21:55,fuzzyblankeet,1,Presented without comment https://www.reddit.com/r/wallstreetbets/comments/i8olie/prpl_q2_2020_earnings_expectations/g1cntpw/?utm_source=share&utm_medium=ios_app&utm_name=iossmf
2020-08-13 21:21:51,The_toast_of_Reddit,2,Is Mattress King now the Joker?
2020-08-13 21:21:40,VirtusInjection,0,Damn did some laundry and Tesla is starting to move
2020-08-13 21:21:30,doll2185,3,"Go TSLA... you sexy son of a bitch.  If this thing hits 1700 tom, I’m streaking all the way to your wife’s house."
2020-08-13 21:21:30,suhleem,2,"Wtf just happened to tsla?

Lmao had 1650s and never sold let’s see reeee"
2020-08-13 21:21:28,jawnutah,3,PRPL said looking for a third facility by the end of 2021
2020-08-13 21:21:26,LivingTheHighLife,5,Sometimes I feel like I got scammed with all these spacs I have
2020-08-13 21:21:19,dat1olive,2,always inverse wsb purple puts🚀📈🔥
2020-08-13 21:21:14,TheLastAckbar,1,I'm starting to think I shouldn't have bought tesla puts before close
2020-08-13 21:21:11,mjb_dfw,4,Difference between 💜 and 🎖️🥈is the latter will bounce back and make you 💰💰💰
2020-08-13 21:21:04,strifelord,2,Time buy up all the purple loses
2020-08-13 21:20:56,Brandonurbz,3,"My vanity plates for my Tesla got denied today went for “MODELO3” cause I’m Spanish. Fuck you NJ DMV

So fucking “TSLAPUTS” it is"
2020-08-13 21:20:55,fr33_,3,"Well, looks like SLV is a better color than PRPL.

I'm fucked come morning, had 30% of my portfolio in it."
2020-08-13 21:20:46,kiddmiggy,5,lmao No way Apple is going down over an EPIC Games lawsuit right?
2020-08-13 21:20:36,guykirk9,8,"HAHA TSLA about to open at 1670 tomorrow, 




why did I hedge 🧠"
2020-08-13 21:20:35,q112,7,[Tesla call holders rn](https://youtu.be/psLjNy9-L_c)
2020-08-13 21:20:26,edison_joao,3,"I really despise FortNite.

Apple has been clean and they’re trying to get them with App Store BS drama.."
2020-08-13 21:20:25,MLGameOver,4,"https://twitter.com/sbwcws/status/1294019228115374082?s=21

TSLA with the upgrade"
2020-08-13 21:20:22,dtheo1242,6,Nobody talkin bout chegg p/e
2020-08-13 21:20:21,drkgla,3,i for one am sufficiently stimulated
2020-08-13 21:20:20,BoomBoomMansena,0,BREAKING: S&P INCLUSION FOR TSLA CONFIRMED
2020-08-13 21:20:19,DandWLLP,3,What's TSLA doing now?
2020-08-13 21:20:17,cutiesarustimes2,1,"https://www.wsj.com/articles/cities-weigh-cutting-police-budgets-and-discover-how-hard-that-is-11597261079?redirect=amp#click=https://t.co/1yFKuQ6cL3

Forget police it's going to be a huge problem across the board. When times are ""goods"" bonds and spending are insane. Then when shit falls apart people suddenly become ""responsible"". Either people cough up more cash or start working in the onion fields."
2020-08-13 21:20:16,Halo4ftw,1,DKNG tanking or mooning before open tomorrow?
2020-08-13 21:20:00,coderedrabbit,3,the amount of money i make is inversely related to the amount of time i spend on this thread. i want to be rich. but dammit i can't quit you degenerates
2020-08-13 21:19:51,visionarymind,2,💜GAYng💜 🐝 like 🔮🔮🔮🧞‍♀️🧞‍♀️🧞‍♀️🛐🛐🛐
2020-08-13 21:19:49,,4,"Really just completely fucked myself this week. At all time lows, percentage-wise. Probably need to switch to some longer-term plays."
2020-08-13 21:19:44,SpyPutLambo,9,I’m not watching but if CNBC is really railing on AAPL they will all be fired by tomorrow morning
2020-08-13 21:19:42,skykitty89,6,"I am so fucking scarred from TSLA wiping out my account last month, now that its actually doing things I am TERRIFIED to try and get my tendies back. I hate this."
2020-08-13 21:19:38,nfa1234,3,Any correlation between length of dd post and how much you will lose If you follow the advice?
2020-08-13 21:19:38,sucdic69,6,TSLA 2000
2020-08-13 21:19:31,Cowpie249,4,Sit on TSLA and enjoy the ride
2020-08-13 21:19:26,mke1996,1,Why do chinese companies love cooking the books so much. Alibaba is the one and only chinese company I trust everything else is a meme
2020-08-13 21:19:23,e30jawn,8,"I would love to see the over lap of people involved in PRPL, Tankers, SLV, CORN, TSLA 2000c, MU 90, Lumber. Like its got to all be the same people right?"
2020-08-13 21:19:21,oldredditdidntsuck,1,"Can someone tell me how to post this FN question in a thread?

So if MSTR Allocates 20% of its assets to an insane volatility asset, this should mean that theta is going to rise substantially until people figure out the proper new pricing yes?"
2020-08-13 21:19:16,DeanYerdon,2,Thanks Morgan Stanley! Perfect recipe for another retail fomo pump 🤝
2020-08-13 21:19:15,Huey_Long_Schong,2,What will be the next gang to get GUH'd 🤡
2020-08-13 21:19:12,Kit_Adams,1,Shitty prpl calls offset by my zm and Etsy calls.
2020-08-13 21:19:11,swshrXX,2,🅱️rypto 🅱️oppin
2020-08-13 21:19:06,ketolad1,1,Short AAPL with 520 stop and 390iah target.
2020-08-13 21:19:02,CyanideMuffins,7,Fuck Epic Games.
2020-08-13 21:18:52,wsushox1,-2,Sell Apple.
2020-08-13 21:18:44,pctammela,5,mod the prpl autist
2020-08-13 21:18:40,gayflowerboy,1,mOON YES MOON MOON MOON
2020-08-13 21:18:40,scopolamine,5,">NY Fed Weekly Economic Index updated to -5.47% vs initial read of -6.37%, scaled to 4-quarter GDP growth, for week ended Aug 8, 5-month high & third straight weekly improvement  Key drivers: Falling jobless claims (bye-bye $600), rails & steel production (auto inventory rebuild)

Honestly if jobless claims fall, why is there even a need for a second stimulus?"
2020-08-13 21:18:37,redblade79,2,What are we thinking happens to AMD tomorrow?
2020-08-13 21:18:36,widespreadhammocks,6,apple better watch out.  they went after GAMERS
2020-08-13 21:18:34,Chfrle96,2,🥈*STILL HERE* 🥈
2020-08-13 21:18:23,guykirk9,3,Fuck TSLA at 1641 🤤🤤🤤
2020-08-13 21:18:20,BigPamp,1,Both Apple and baba getting railed rn I am not having fun
2020-08-13 21:18:16,gigantoir,4,"tomorrow shrek dick green

im holding puts but its all about low expectations"
2020-08-13 21:18:15,uniaintshit,6,"1. Apple exists

2. App Store collects fees for doing nothing

3. Profit

4. No forthnight"
2020-08-13 21:18:14,Jogawilliams,8,prpl just raped the shit out of my retarded ass.
2020-08-13 21:18:10,ESECash,1,Has duolinguo worked for anyone?
2020-08-13 21:18:09,nfa1234,3,Anyone ever seen wallstreetgod and the purple twins in the same room?..............
2020-08-13 21:18:06,JabootieeIsGroovy,9,"the guy who organized the PRPL gang is a fucking genius manipulator, he literally knew some of yall would fomo into prpl with your life because you thought it was so retarded it would make u rich, gg yall"
2020-08-13 21:18:04,yourballstruckmyfoot,3,GIVE ME DEM PRPL LOSS PORN
2020-08-13 21:18:01,SX2k7,2,Dat Tesla AH gap up doe...
2020-08-13 21:18:01,tvnghia,1,Why tsla up ath
2020-08-13 21:17:40,jamila22,2,Should have put in more puts in my Purple strangle
2020-08-13 21:17:37,CountingCrush,1,Look at the green dildo on TSLA. S&P Inclusion coming I'm guessing and funds are buying it up with insider info.
2020-08-13 21:17:28,GoBeaversOSU,5,I guess Fast Money is just AAPL Money today
2020-08-13 21:17:28,psychninja,2,"Massive Prpl loss porn coming soon, looks like it got deleted by automod though

https://old.reddit.com/r/wallstreetbets/comments/i98fq2/prpl_asshole/"
2020-08-13 21:17:25,DeanYerdon,3,Wait what’s the TSLA news? Was it the Morgan Stanley upgrade?
2020-08-13 21:17:17,redsweetness,0,"How fucked are my PRPL 9/18 22.5C?

Went against my own rule: Never hold through earnings. 

Kinda new to options and really just did because...""eh, let's just see""

One fucking hell of a rollercoaster ride. And I stopped liking rollercoasters ages ago."
2020-08-13 21:17:16,bigmeatbag,3,"I hope y'all jumped in 🐢, it's going up another 20% tomorrow."
2020-08-13 21:17:16,chewks,4,Why is Tesla mooning ??
2020-08-13 21:17:09,Rare-Homework,4,Tsla round 3 tomorrow would be pretty great
2020-08-13 21:17:09,nosalute,8,Holy shit CNBC is STILL drilling apple it's been 15 minutes
2020-08-13 21:17:03,jbrownwood,38,Fuck me. Five months I’ve spent hiding out from covid and I finally took a buddy out fishing this past Saturday. Mother fucker just called and said he tested positive today.
2020-08-13 21:16:56,cherrycolasoda,2,I bought prpl 22.5 calls and I'm probably getting f\*\*ked it doesn't make sense because the earnings call seemed really good
2020-08-13 21:16:55,LMY723,9,"The Apple and Epic thing is a lawsuit that will change the whole digital marketplace landscape. Crazy that they chose to do it now. 

Google play on iOS. Xbox store on PlayStation. Etc. 

Shit could get crazy."
2020-08-13 21:16:50,cheapterrorkitty,1,PRPL gang now is SLV gang two days ago.
2020-08-13 21:16:49,jamila22,5,TSLA taking off again
2020-08-13 21:16:46,BillyKean,2,thanks elon
2020-08-13 21:16:44,Derpyderpderpdurr,2,Just threw my life savings in lemonade. 2 year hold
2020-08-13 21:16:41,ATHLETIC-BUILD,3,TSLA just went uppy.
2020-08-13 21:16:40,RebarBusiness,2,Time for VROOM calls yet?
2020-08-13 21:16:39,utterlyirrational,2,"what are my moves tomorrow?  lose money

what kind of dumb fuckin question is this"
2020-08-13 21:16:36,RayCashIsTrashDalio,-1,wtf aapl calls are fukced!!!! 1.7m share sell in AFTERHOURS trading. bigger red candle than any candle during actual market hours. someone really wanted to offload those. fortnite sueing apple has larger implications. tencent owns fortnite. if gyna is mad at apple thats a no no
2020-08-13 21:16:32,Due-Cryptographer,2,"wow, slv gang is back. these guys really know how to take the abuse 😂"
2020-08-13 21:16:29,ApplecriteKiller,0,Anyone know why TSLA is pumping?
2020-08-13 21:16:29,guykirk9,3,TSLA up 1% AH 🤠
2020-08-13 21:16:22,smitty1543,3,Taco Bell or Five Guys for dinner? I know those are opposite ends of the price spectrum but
2020-08-13 21:16:21,BigPamp,1,What’s up with apple
2020-08-13 21:16:20,BentoMan,1,Is shorting SNAP dumb? They are more of a messaging app than a social media app. And we know messaging apps are a dime a dozen.
2020-08-13 21:16:17,goldensteaks,1,"Here's your purple heart autist 💜, I'm sorry those PRPL calls didn't work out. Even though you are gravely injured we believe in you."
2020-08-13 21:16:15,officialbro,1,"Ever since I saw the post about how you shouldn’t let brokerages sell your info, I actually think this is a simulation. Literally 4 stocks I got today ended a cent from my avg price."
2020-08-13 21:16:07,TheOriginalRK,1,WHY APPL DYING
2020-08-13 21:16:02,almostmicrochip,1,"LILAK


👁 👁 


🤫"
2020-08-13 21:15:59,chiney889,2,If Spy doesn’t drill tomorrow I’m longing $GUN  permanent leaps
2020-08-13 21:15:49,Stonks0nlyG0Up,9,Not even Billy Mays could convince me to buy an overpriced mattress
2020-08-13 21:15:46,stunner47,2,thank god I had blnk and not prpl !
2020-08-13 21:15:43,scopolamine,1,"I fucking hate preparing business cases, took me all day long and I couldn't check financial markets today.

Now let's see what I have missed."
2020-08-13 21:15:41,CASH_K1NG,2,"If AAPL doesn't go up , I'll drink a bottle of Soylent"
2020-08-13 21:15:41,shalomstocks,2,amzn is my top stock pick
2020-08-13 21:15:36,infosecki,1,TSLA news?
2020-08-13 21:15:33,robbinhood69,7,What if CORN really ends up being the one thing that keeps this sub solvent
2020-08-13 21:15:28,wtfridge,1,"My first green day in a looong time, feelsgoodman"
2020-08-13 21:15:27,q112,1,I don’t know why we’re running but I like it Tesla I liiiiike it!!
2020-08-13 21:15:17,sirms,2,tesla ah moonshot please
2020-08-13 21:15:05,imacoolchcik,0,You forgot the SLV gang
2020-08-13 21:14:52,-nye-,6,Only thing worse than watching my INTC FDs expire worthless is selling them for pennies on the dollar and then watching them expire ITM I’m talking about those $49 8/14s that have been dick teasing me all week
2020-08-13 21:14:51,Balzac7502,2,"Haven't seen a presser in a while, is Trump still 40 to 50 minutes late on average?"
2020-08-13 21:14:38,ReversalTheory,5,Tesla upgraded to Equal Weight from Underweight at Morgan Stanley
2020-08-13 21:14:38,SpyPutLambo,5,Quick Tim remind everyone you’re about to split the stock!!!!
2020-08-13 21:14:33,kex06,2,Thank God I have shares in BLNK and not something stupid like a mattress company
2020-08-13 21:14:30,Mr_Dr_Papa_John,1,"With Kamala Harris as VP, what does that mean for $DIS?

Does Splash Mountain make a comeback?

Is ATH reached while parks are closed?"
2020-08-13 21:14:27,harridyl10,4,i thought for sure SPY was going ATH today... and then it didn't......... tomorrow will it?
2020-08-13 21:14:26,0-Income-FreeLoans,3,What can I get with my Kodak Coins that I still own???!?!?!????!?!????
2020-08-13 21:14:23,Teachyouright,2,"Damn, I'm just gonna hold onto these Facebook bags till 9/11 then"
2020-08-13 21:14:18,codingstudent7,5,Thank god I didn’t buy prpl calls. Can’t say my decision to buy shares instead was smart either though
2020-08-13 21:14:01,noobiepoobie2,-1,AAPL in free fall
