date,author,score,body
2020-03-22 15:09:42,,1,🐻🌍
2020-01-16 16:44:16,ilcanadiano,4,Basically we have 15 minutes at open to make max tendies? Then the market fucks us?
2020-01-16 14:47:03,saifly,2,Tesla dumping again
2020-01-16 13:48:25,RoyalPatriot,2,SPCE leaps or too late to jump on this rocket ship?
2020-01-16 13:19:28,PleaseBuffTechies,5,Almost fomoed Tesla calls. But then my retard foresight must've foresaw this drop so I barely made it out of nuking my account. :)
2020-01-16 13:17:05,Mark-Crumpton,2,AMD calls or NIO puts?
2020-01-16 11:58:04,YangGangBangarang,2,"I have SPY iron condors expiring tomorrow.

At this green open buying back the short put.  During the inevitable dip before EOW, selling the long put for small gain and buying back short call.  During EOW rally, selling long call.

Boo yah - I get to be theta bear and bull all in 48 hours."
2020-01-16 11:32:53,chibears20,3,"Anyone thing natural gas has bottomed out ? If so taking your chances on ugaz, eqt, rrc?"
2020-01-16 11:27:39,MP1182,10,"What do you guys use to track your net worth?  Personal capital, mint or Grindr?"
2020-01-16 11:25:42,dadivrik,2,"I’m short puts, yet am highly concerned about the feasibility of this market trajectory."
2020-01-16 11:16:47,Spartan_Blazer,-9,You guys still mad 😡😡😡 or wut 💁‍♀️
2020-01-16 11:05:51,subaeisgood,7,"Are you kidding me 

If rise why drop yesterday"
2020-01-16 11:05:01,hello-world-foo-bar,4,"Gold is a hedge against a global liquidity trap that we are headed towards. In which time, there will be currency wars and global devaluation."
2020-01-16 11:04:14,Ardesic53,7,SPCE at 16 today. Tendies need to print
2020-01-16 11:02:07,DaKaiser21,2,SHAK closing at 60 or 80 today bois?
2020-01-16 11:01:50,swamprott,2,got a feeling we close red today
2020-01-16 11:01:36,gregot76,1,shorted some micro /es contracts here.  Therefore expect spy to keep mooning. You are welcome.
2020-01-16 10:59:54,justinswagvila,4,Aapl gonna open at 314 and hit 317 🤑🤑🤑
2020-01-16 10:56:26,row2gobro,7,"Got woken up by a dream that I missed my margin call and had my positions closed while I was asleep. Don’t even have any FDs open. 
I am getting way too into this"
2020-01-16 10:52:22,,4,Bull Jesus shall make his face to shine upon me this day.
2020-01-16 10:52:18,Fagatoli,9,Short /u/Spartan_Blazer's chance of ever getting laid.
2020-01-16 10:46:42,OblivionXBA,1,"According to RH, SPY is at 329.49 😎😎😎😎"
2020-01-16 10:41:55,Rubenov,10,"Fed will repo until 13 Feb at least; free money buy stocks at any point

https://www.newyorkfed.org/markets/domestic-market-operations/monetary-policy-implementation/repo-reverse-repo-agreements/repurchase-agreement-operational-details"
2020-01-16 10:38:43,Spartan_Blazer,-2,r/whiteknighting
2020-01-16 10:35:34,AfroSWE,7,Lol tsla
2020-01-16 10:34:07,lerakk,1,I opened NIO 3/20 6c. Guess i shouldave waited till today. Once they announced funding wasnt confirmed i knew i shouldave bought some puts
2020-01-16 10:26:17,BrassBallsReformed,3,Wow buying the dip is free money
2020-01-16 10:24:13,Evie_Chandler,0,So I'll ride AAPL's morning spike... And then what? NIO puts? SPCE calls? Or just more AAPL/SPY calls at EOD to ride the next morning's spike?
2020-01-16 10:22:16,Robbinh00d7,13,"Man, I want a fucking yacht"
2020-01-16 10:21:37,Spartan_Blazer,-19,"I’m a simple man. I 👀 see a comment, I downvote 😤 like dame y’all some salty ass 🅱️itches 2nite-ahh"
2020-01-16 10:15:55,Hellrs,12,I’m so anxious for open I can’t sleep :(
2020-01-16 10:14:03,Spartan_Blazer,-3,🅿️🅿️
2020-01-16 10:12:04,hello-world-foo-bar,6,"It doesn't even matter what we debate about pre-opening. FED repo liquidity kills bulls and bear position if the liquidity is enough or not enough.

This is why we dont have a free market.  Price discovery is being distorted."
2020-01-16 10:01:59,Jalford,4,Balls deep (1000+ cons) in $SHAK. Come on 72+ today 🙏🏻🙏🏻🙏🏻. Should have sold all when it went over 71 yesterday... unless it goes over 72 today and I look like a genius.
2020-01-16 10:01:52,Spartan_Blazer,-4,🎒
2020-01-16 09:59:48,mikes703,1,"Wall Street got it wrong.  You cut the tax credit from Tesla, and you expect the same sales.  You deserve to miss out on this awesome run.  We just keep buying the dip now."
2020-01-16 09:59:27,Spartan_Blazer,-7,I really wonder if it’s in girls jeans to nurture or if it’s their only choice after being physically inferior for a million years. I’d love to set up a Truman show world where the girls are all taught they got to provide for us guys and we all sit around like blow drying our hair and finger painting while making pb&js just to see if their roles in today’s society are social constructs or if they’re naturally prone to finger painting 🎨 lol
2020-01-16 09:56:41,Regjohn,0,"TSLA already V, watching the retarded sub bears when it opens green/flat gonna be something. 

Y’all just meat for our tendies!"
2020-01-16 09:55:23,Ardesic53,3,Ffs why does MLK close the market? No one even celebrates it
2020-01-16 09:54:10,Spartan_Blazer,-5,You guys making me backpack the thread again😡😡😡 gimme some content boys
2020-01-16 09:53:42,niceguy897,4,dax already turned red but sp500 pajama traders insist to keep the gains
2020-01-16 09:52:32,Ardesic53,3,SPCE printing tendies. Cant wait to be a millionaire
2020-01-16 09:52:26,Spartan_Blazer,-3,There’s really no one quite like me 🤗🤭🥳
2020-01-16 09:51:28,knotswag,2,My portfolio angers me.
2020-01-16 09:49:18,,0,hey guys im going to bed. but for the sake of being nice ill tell tsla bears to dump your puts at open while u can. :)
2020-01-16 09:48:31,Spartan_Blazer,0,Did I show you guys this yet? Don’t got to watch the whole thing I got it set up to start at the transition into that fat beat 🤰
2020-01-16 09:47:38,Jaabaas,2,"alright, take all that money out of tesla, and put it into MSF, FB, NVDA, BABA, TWTR, all them to the moooon please"
2020-01-16 09:47:12,PapaQsHoodoo,1,"Where does a homo go to look at premarket prices?

E: not a joke. Am gay. Want to watch stonks at 4am"
2020-01-16 09:46:08,Spartan_Blazer,2,Dame. Fat buzz 🐝 off this wine grape 🍇 🥳
2020-01-16 09:45:40,mikes703,1,Wait my chart says Tesla actually went down to 496 at one point.  But you guys say the aftermarkets is inaccurate.  Hmmmm
2020-01-16 09:42:41,mikes703,3,Buying the Tesla dip!  Make it cheaper.  The cheaper the better.
2020-01-16 09:41:35,Spartan_Blazer,2,I bet you anything the CIA has backdoor access to NASDAQ and if they need a billion to fund some proxy war in Somalia they just withdraw it from the exchange and send some random stock down 3.69% 🧐
2020-01-16 09:39:48,Trippstarr21,4,Congrats on the Tesla put holders. Lemme suck your toes for a buck
2020-01-16 09:38:01,wsb_mods_R_gay,2,Damn SQ wait for me!
2020-01-16 09:37:11,berdflysohi,-5,What would happen if I buy Tesla puts based on pre-market prices ? Would my puts get filled in at the prices I see right now?
2020-01-16 09:36:18,Spartan_Blazer,3,"I honestly can’t believe there’s liquidity with TSLA at $500+ like who is buying at that price? I’m convinced it got 2 be the Chinese or some foreign fund that has no idea how significant Ford and GM are as automotive companies so they have no problem buying TSLA at a market cap higher than both combined. That’s the only thing that explains this retardation

🅿️🅿️"
2020-01-16 09:35:53,Ardesic53,5,Shoulda bought TSLA puts yday but I got SPCE calls for Friday
2020-01-16 09:34:28,row2gobro,1,ERs today? Who's in play?
2020-01-16 09:32:53,Helpmeeeeett,2,I hope my gains don't get jewed today
2020-01-16 09:26:55,PrinceofPeachtree,6,I think we can all agree that $420 is a great share price for TSLA.
2020-01-16 09:26:10,3at,1,daddy musk save us all!
2020-01-16 09:25:35,etatdejouer,1,Long AMZN calls. Praying for money toMorrow after a bit of volume AH. We know AH don’t mean much though sometimes.
2020-01-16 09:23:55,Pdtiger1,3,Well there goes my whole portfolio :/ tsla why 😭
2020-01-16 09:22:34,oregon_forever,6,"When Tesla was climbing to $550, Cramer was telling people to buy as much as possible because it will moon but if the drill hols, Cramer will be the first one to tell people to sell this shit and he'll add ""I told ya so!""."
2020-01-16 09:22:14,digitalradiohead,6,No DD but think about it. If you were a money manager and missed the rally in Tesla and tried to buy it here and the stock kept going down you would have to explain to your clients that you were bearish on Tesla at 250 but bought it at 500 and were wrong twice. It needs to come in a lot before big buyers start coming in again.
2020-01-16 09:21:55,Not_reddits,1,Fuck Tesla
2020-01-16 09:21:46,noonecarestho,2,"Really glad I got out of my TSLA call yesterday and rolled the tendies to Apple and TSM, hopefully they print today 🙏🏻"
2020-01-16 09:21:33,sankalp89,3,I have AAPL 320 Jan 17 calls with 1.38 avg cost. Closed at 0.43 yesterday. Should I call it a loss and take whatever I can or wait until Friday?
2020-01-16 09:18:19,frostygrubz,1,"Going to start trading /RTY starting tomorrow. 

Hard for me to keep steady hands on /nq so gonna tone it down a little bit."
2020-01-16 09:17:15,oregon_forever,4,Maybe there is hope for stormwillpass after all. Tesla is drilling hard.
2020-01-16 09:17:09,GretaTs_rage_money,1,"What the hell are Germans smoking that's driving Tesla out of the Earth's core?  
  
After yesterday I thought Tesla was switching to oil with all that drilling..."
2020-01-16 09:16:27,CommanderInTweet,2,🕵️+🔮🖍=🚀🚀🚀
2020-01-16 09:13:58,Robbinh00d7,2,is ToS tripping or did someone sell a fuck ton of AAPL down to 263 right after close? Wasn't paying attention
2020-01-16 09:13:53,Regjohn,2,Watch TSLA open green plebs
2020-01-16 09:11:50,CommanderInTweet,5,Sold my AMD 50c yesterday. You’re welcome
2020-01-16 09:11:45,ThatNewNewNewGuy,5,AMD just reached $49 pre-market. Maybe we can do that once the market is open. Stay strong my dude
2020-01-16 09:11:03,digitalradiohead,2,All of these Tesla orders that got filled at 510 gonna wake up to some pain.
2020-01-16 09:06:32,wsb_mods_R_gay,1,TSLA stock being pulled up by Falcon Heavy!
2020-01-16 09:06:31,Muntberg,2,AMD 🚀🚀🚀
2020-01-16 09:06:17,fallouthong,2,LOL @ TESLA. The website was semi right
2020-01-16 09:04:33,y7nx90,3,"TSM is trading super wide PM, but it's not really up that much right now.  I have no TSM just NVDA (short some ATM puts), so I do hope it goes up."
2020-01-16 09:04:27,CommanderInTweet,2,1k down the drain thanks Tesla 🥵
2020-01-16 09:04:16,fallouthong,2,TSMC UP 1% premarket. WE PRINTING SOON BOYS
2020-01-16 09:04:00,freehouse_throwaway,1,oof hopefully thats just low vol TSM pre market
2020-01-16 09:03:55,oregon_forever,3,TSLA dead in the pre-hours.
2020-01-16 09:03:01,Spartan_Blazer,2,My TSLA 160 🅿️´s looking tasty❗️
2020-01-16 09:02:47,touchhimwiththejab,3,RIP BYND and TSLA
2020-01-16 09:01:10,Muntberg,3,LMAO IT WAS REAL
2020-01-16 09:00:47,,3,OK? Tsla gapped down 5% in premarket? ???????
2020-01-16 09:00:46,y7nx90,1,"I do see TSLA 501 PM right now.

I can actually buy at like 499 lol, won't do it though.

EDIT: now around 504 ish."
2020-01-16 08:59:53,WhiskerTwister,3,My AAPL calls were up 43% at one point now they are down 9%. Sometimes 💎🖐= trouble
2020-01-16 08:58:01,oregon_forever,2,">Portland man hits $8M jackpot after accidentally putting winning ticket through the wash

https://www.oregonlive.com/pacific-northwest-news/2020/01/portland-man-hits-jackpot-after-accidentally-putting-winning-ticket-through-the-wash.html"
2020-01-16 08:56:35,freehouse_throwaway,1,i dont even know why i bother to buy puts on IWM as hedges. stock only goes upppppp
2020-01-16 08:55:41,al409,1,Honestly don’t think SDC is done
2020-01-16 08:55:27,y7nx90,4,I've never been more excited to see the 4 AM opening price just to see if that website is close to being right.
2020-01-16 08:55:06,fallouthong,3,TSM TSM TSM TSM TSM TSM
2020-01-16 08:52:34,digitalradiohead,1,So i see a lot of tsla call holders posting but who is holding puts? What’s the plan? Take profits tomorrow or let it ride?
2020-01-16 08:51:41,berdflysohi,-6,It's bear time
2020-01-16 08:49:03,oshbear,3,"Gas guzzler gang baby. 1,000 hp 8mpg gang"
2020-01-16 08:47:43,zevzev,1,What’s the move on tesla
2020-01-16 08:47:17,LogicUpgrade,1,"DD: Tesla registrations halve in California.

[https://www.reuters.com/article/us-tesla-registrations/new-tesla-registrations-in-california-nearly-halves-in-fourth-quarter-data-idUSKBN1ZF03N](https://www.reuters.com/article/us-tesla-registrations/new-tesla-registrations-in-california-nearly-halves-in-fourth-quarter-data-idUSKBN1ZF03N) 

Haha, we goin' back to 300s, folks. Do it, I wanna buy some."
2020-01-16 08:46:27,oregon_forever,4,"Imagine being hit by an earthquake followed by a tsunami, followed by a citywide fire, followed by a tornado and hurricane. That's what bears have been experiencing for the last few years."
2020-01-16 08:46:10,dnesdnal17,1,"[TESLA INC: MORGAN STANLEY CUTS TO UNDERWEIGHT FROM EQUALWEIGHT, RAISES TARGET PRICE TO $360 FROM $250](https://twitter.com/firstsquawk/status/1217728992582569989?s=21)"
2020-01-16 08:45:13,yjruan,1,Don't you guys have to go to work tomorrow?
2020-01-16 08:44:34,y7nx90,2,Hopefully NVDA goes up next few days.  TSM should help but it'll only be a portion of what TSM is up.
2020-01-16 08:43:36,svpa3991,6,BACK TO MONDAYS EUPHORIA. Bless tuesday for that discount 😭✊
2020-01-16 08:43:26,soar-x,1,wut sites u guys use to watch aftermarket/futures? marketwatch or brokerage?
2020-01-16 08:43:20,digitalradiohead,1,Broadcom calls or amd calls?
2020-01-16 08:42:28,oshbear,1,The future is priced. “Efficient markets” yada yada
2020-01-16 08:41:46,OblivionXBA,5,BLOOOOD GREEEEEN 💚💚💚💚💚🍀🍀🍀🍀🚀🚀🚀🚀🚀
2020-01-16 08:40:48,SmallPotGuest,3,TSMC saying the segment of business where AMD is will grow 20% may be the impulse needed to break over 50. Hold tight.
2020-01-16 08:39:53,CommanderInTweet,2,"how long should I hold 

1/31 SPY 328c and 330c?"
2020-01-16 08:38:59,dnesdnal17,1,If sbux goes up to 93 today i will off myself. Sold my FDs for a yuge loss smh
2020-01-16 08:38:48,oregon_forever,2,TSM beating earnings is good for AMD too.
2020-01-16 08:37:58,svpa3991,4,Where’s that guy saying this is not a dip to buy 🤔🤔
2020-01-16 08:37:57,RetardedChimpanzee,4,Spy $330 🤯
2020-01-16 08:35:43,wsb_mods_R_gay,3,Wow not QE money doing it’s thing...
2020-01-16 08:35:43,CommanderInTweet,2,5 min chart is beautiful
2020-01-16 08:34:29,shmowker,2,AAPL finna
2020-01-16 08:34:16,,2,HOLY FUCKING GREEN DILDO.
2020-01-16 08:32:38,ominousc,3,"BIG PIPI!!

Edit: Green pipi"
2020-01-16 08:32:37,Enra_,3,+0.41% bye bears
2020-01-16 08:32:37,wolfenstein1998,1,Holy shit
2020-01-16 08:32:21,Muntberg,2,omg lol
2020-01-16 08:31:34,realister,3,Did Iran just surrender?
2020-01-16 08:31:31,RetardedChimpanzee,1,Go spy 🕵🏻‍♂️
2020-01-16 08:31:20,ThatNewNewNewGuy,2,Futures just keeps going up 🚀🚀
2020-01-16 08:29:17,Muntberg,3,NIIIIIIIIIIIIIICE
2020-01-16 08:27:58,Itzep23456,1,Goodnight brits
2020-01-16 08:26:33,y7nx90,1,"Wait, didn't I read stormwill pass sold like a ton of naked put options on TSLA a few days ago?  Can someone confirm?  And confirm he's ok?

EDIT:  [https://www.reddit.com/r/wallstreetbets/comments/eo2pe0/daily\_discussion\_thread\_january\_13\_2020/fe8v5n4/?context=3](https://www.reddit.com/r/wallstreetbets/comments/eo2pe0/daily_discussion_thread_january_13_2020/fe8v5n4/?context=3)

He says he sold 19 naked TSLA puts.  Man I really hope they weren't like the 520 strike or something and TSLA is like 490.  I hope they were either much lower strike puts or TSLA isn't going to crash 5% as implied by that website.  He did this 2 days ago too when TSLA was way higher."
2020-01-16 08:25:44,brokeeboii,2,"so i’m apart of bull gang but i saw this

https://www.bloomberg.com/quote/TL0:GR

long $ROPE because rip my portfolio 💀"
2020-01-16 08:25:32,Mumbolian,1,Really need $x to recover. It was so much tendie potential.
2020-01-16 08:24:12,oregon_forever,2,"3300 broken!!!

America wins again!!!!"
2020-01-16 08:23:52,kbell1990,1,Anyone else Trading DAX it's going absolutely bonkers right now ....
2020-01-16 08:23:35,CommanderInTweet,3,One more gap up pls
2020-01-16 08:21:05,y7nx90,1,To make you guys feel better that same website has TGT up like 2+% (for all you TGT call holders)
2020-01-16 08:19:19,,2,"no need to panic fellow TSLA call holders. the gay deutsche bank (aka next lehman brothers, aka close-to-bankruptcy retards), have a large short position on TSLA. u can tell cause they keep trying to short it. the ""pre-market"" price is inaccurate. see here. https://www.bloomberg.com/quote/TL0:GR volume is 4802. which is literally nuffin. the gay DB is just trying to induce panic with their shit tactics so that there is panic selling. but its not going to work cause this is the most retarded shit ive ever seen in my life. whoever bought those 4802 shares of tsla got a 5% discount on em. https://www.marketwatch.com/investing/stock/tl0?countrycode=de&iso=xfra click on the volume, literally 5000 shares being traded vs 15M average on US exchange. and since when was tsla fucken listed on the GERMAN stock exchange? what kinda retarded shit is this

btw. germany has been in a recession for like 20 years now cause their dooche bank is shit."
2020-01-16 08:19:08,digitalradiohead,1,Tsla is tanking on foreign exchanges usually representative of the trading day in the United States?
2020-01-16 08:17:35,CommanderInTweet,3,PUMP IT!!!!
2020-01-16 08:17:20,Leaky_Buns,4,Taiwan Numba Oooooooneee!
2020-01-16 08:17:02,RubenZ217,3,SPY 330 🥳 🥳 🥳 🥳 🥳
2020-01-16 08:14:05,Enra_,5,"SPX over 3300, we’re good"
2020-01-16 08:11:49,mulligun,1,"Market effect of the BYND news?

:They released the details of the pea deal"
2020-01-16 08:07:21,Evie_Chandler,2,"Watching The Mentalist and alt-tabbed to watch /es

BROKE 3300 BOIS"
2020-01-16 08:05:39,digitalradiohead,3,If Tesla gaps down to 500 I’m going to buy calls expiring tomorrow that get really cheap and hold my puts expiring next week. It could rebound off that level or really tank down to 475-450. Either way Tendies secured
2020-01-16 08:05:37,YOU_PAY_TAX_2_ARAMCO,2,3:00 am = the time the royal family of Prince Andrew steals american stocks to resell to the royal family of Aisha.
2020-01-16 08:05:25,Itzep23456,6,This sub reddit don’t sleep
2020-01-16 08:04:35,CommanderInTweet,7,Hope my SPY gains outweigh my Tesla loses
2020-01-16 08:04:08,Itzep23456,2,Wait wtf goin on are y’all tradin on eu stock market
2020-01-16 08:02:55,Muntberg,3,oh baby we mooned straight past 3301
2020-01-16 08:02:20,ThatNewNewNewGuy,2,HOLD AT 3300
2020-01-16 08:01:41,y7nx90,1,"Man that earnings page is a joke.  I was just taking a look because I wanted to see what other earnings could be off (since we are trying to guess TSLA).

It's off for ROKU, SQ, TWLO, and a ton of names.  It didn't even get the right week for those names.  SQ hasn't even announced but there is almost 0% chance (which is what the market is pricing too) it's on the week it lists it at in the link above.  ROKU and TWLO already announced and it isn't on the week it is listed.  BIIB also has the wrong date, even though that was announced like a month ago..."
2020-01-16 08:01:40,CommanderInTweet,3,HOLD THE LINE!!!
2020-01-16 08:01:33,Warm_donut_hole,1,Wow huge green dildo. My favorite
2020-01-16 08:01:23,,1,Let’s go!!! Europe with a good open to kick futures into overdrive
2020-01-16 08:00:50,ilovewsb,1,"Sell put spreads on Wells Fargo, Target, FedEx. ?"
2020-01-16 08:00:15,wsb_mods_R_gay,1,"Anyone looking at SQ? Shit hasn’t participated in this monster rally and it hasn’t been over $70 since Aug.  well it just broke that’s yesterday.

Looking like it might run."
2020-01-16 08:00:02,Warm_donut_hole,1,Futures 3300 at midnight
2020-01-16 07:57:02,yjruan,1,is it a good idea to straddle a earnings play?
2020-01-16 07:54:11,realister,2,RIP TSLA call holders.
2020-01-16 07:42:25,WorthyAlpaca,7,UH WHAT IS THIS -4.2% DOWN PRE MARKET FOR TSLA? [https://markets.businessinsider.com/stocks/tsla-stock](https://markets.businessinsider.com/stocks/tsla-stock)
2020-01-16 07:40:05,Shmokesshweed,7,Jacked to the motherfucking tits rn. Need a bottle of melatonin.
2020-01-16 07:39:36,Sandroli,1,Are SBUX earnings 1/23 or 1/28?
2020-01-16 07:37:44,link5114,8,"Took out a $9k loan to refinance cc debt to a 10% APR.

On an unrelated note, what would everyone's play be if they found a 9k lottery ticket on the ground? Asking for a friend"
2020-01-16 07:35:42,Tommiahipp,1,has anyone succesfully got robinhood to lift the PDT restriction?
2020-01-16 07:33:49,Evie_Chandler,2,I'm so fucking bored and awake.
2020-01-16 07:31:45,fallouthong,5,"“TSMC forecast revenue of $10.2 billion to $10.3 billion in the March quarter, surpassing estimates for $9.6 billion.” 

We 🚀 🚀 🌝 tomorrow boys?"
2020-01-16 07:23:30,realister,2,So if European banks can borrow at 0% and we have 1.7% 10yr bonds why dont they just borrow at 0% and all in US10yr bonds?
2020-01-16 07:22:09,binxur,9,"https://finance.yahoo.com/news/nio-surges-talks-china-gac-193436740.html?bcmt=1
So that 1billion NIO fund from Chinese government is fake, well play commies."
2020-01-16 07:20:48,Muntberg,2,"1/31 PTON call i'm holding has 70% iv, should i be worried?"
2020-01-16 07:20:43,SoundShadowZ,2,"How the fuck do you guys hold on to a call for longer then FD status? Longest I’ve held is legit like 3 days... other then some 6month GEs that got turned into nonstandardized calls.

Edit: Before I became a degenerate I bought 258 OTM calls on GE that were Leap status The stock price was $10 at the time.  They spun off a business and for 2.5 minutes my portfolio went from 2.5k to 64k and turned worthless due to illiquidity. I have trust issue."
2020-01-16 07:13:25,fallouthong,2,C C WEI again said newspaper is full of sht.
2020-01-16 07:11:52,svpa3991,2,3300 really bout to blue ball us all night huh 🤔
2020-01-16 07:07:36,BOOGNISH_IS_REAL,2,Thought I was cheeky scooping up some FXI eow calls. Let’s see
2020-01-16 07:04:54,vouching,5,Fuck thought about buying TSM calls all week but didn’t.
2020-01-16 07:02:52,CommanderInTweet,3,Pre market going to pump or dump?
2020-01-16 07:02:31,fallouthong,7,"HOLY SHT, IF INTEL CHOSE TO OUTSOURCE TO TSM, THAT SHT IS HUGE"
2020-01-16 07:00:42,lolnowhy106,5,Plz help me get back the $500 I lost today. I might join the theta gang since bullgang is fucking me rn. I also have 2 call options on sbux expiring two days from now
2020-01-16 06:59:36,Deezkicks,5,Got a few $60 tsm calls exp Friday lessgo
2020-01-16 06:58:24,oregon_forever,8,"We almost witnessed history. 

Futures were 3299.99 a few minutes ago but 3300 is still not breached."
2020-01-16 06:57:56,fallouthong,8,C C WEI just said that TSMC WILL DO BETTER THAN THE FOUNDRY AVERAGE.
2020-01-16 06:57:54,YOU_PAY_TAX_2_ARAMCO,-4,"ATH

S&P500 increasing by more than 1% a week

Soon the log graph will be growing exponentially

15 unprecedented straight weeks of green never seen in the S&P500

Kimbal Musk [dated Epstein's ex girlfriend](https://www.businessinsider.com/jeffrey-epsteins-ex-girlfriend-dated-kimbal-musk-2020-1) and Taxless *Sunni* (Aisha) Saudi Royalty PUBLIC INVESTMENT FUND [owns 5% of TSLA.](https://www.nasdaq.com/market-activity/stocks/tsla/institutional-holdings) 

Thank Rockefeller the FED targets a 2% inflation which [steals half of every american's wealth in the same 35 year age minimum to be the president](https://www.google.com/search?q=.98^35) And now international banks get to steal a trillion dollars of ownership the means of production every year!

Ya know, with a gold standard, they'd have to be mining asteroids for gold by now. Instead the international royalty is just taking all the US tax dollars for...

 ~~replacing secular republics with aisha theocracies~~ 

 ~~space flight so they can get the gold~~ 

~~military weapons for themselves~~

 facilitating their pedophilia child rape <- We are here lol"
2020-01-16 06:56:36,Smit_W,9,"I use to think people who were superstitious were fucking mentally handicapped, but it seems like every.single.time. I talk about my play it or get excited about my positions it almost immediately backfires. I'm going to be up bigly tomorrow, but I refuse to say anything about what I'm doing because of my aforementioned circumstances. I feel like an 8 year old with a secret he can't share.

""I'm not superstitious, but I'm a little stitious."""
2020-01-16 06:52:11,,3,Hopefully raking in those TSM tendies
2020-01-16 06:51:51,cyphonismus,2,AIMT! FDA decision this week!
2020-01-16 06:51:32,Sinadins,8,"Guys, I'm a senior political analyst, and the trade deal is BIGLY huge."
2020-01-16 06:50:28,akchen60,5,"So many options, so little money. What plays are y’all making. Gimme something to throw my poker earnings at. I’m looking at FB, AAPL, and SPY 1/24 calls right now."
2020-01-16 06:50:27,JaeRex,3,Tomorrow is going to be deliciously different.
2020-01-16 06:48:46,Trippstarr21,14,My chase account alerts me when I send money to Robinhood and my wife got the notification on her phone and she says she’s “done” with me losing money. I’m only down 30k though 😭
2020-01-16 06:41:34,Cnastydawg,-6,"LULU earnings report out

Beat by 31% 

Forward guidance expected to double in sales over the next year

LULU down 9% pre market on analyst downgrade"
