date,author,score,body
2020-07-27 02:34:43,JustLookingAroundFor,2,"TSLA $900p 9/18

Don’t hate me cause I’m beautiful"
2020-07-27 02:34:37,kushani321,2,ETH moon
2020-07-27 02:34:37,ShawnHans007,3,what if a glitch causes stocks to go up 40% for 1 day
2020-07-27 02:34:25,PeacefulDiscussion,3,GLD SLV Bee-Tee-Cee ETH
2020-07-27 02:34:18,ismytatbad,7,Did anyone have a similar experience on physchdelics where they understand the stock market a little more and see the truth in it?
2020-07-27 02:34:15,howboutthemgators,8,I will say that my portfolio seeing a 90% uptick this month solely from SLV calls made me feel like a boomer. Then I realized that they don’t leverage themselves to the tits with calls so we makin money millennial style
2020-07-27 02:34:02,tsaullgoodman,4,# FuTuReS FaDiNg
2020-07-27 02:33:34,plasticblock4dayz,11,"The collapse of the dollar. Stagflation.

Isn’t it beautiful?"
2020-07-27 02:33:16,ShawnHans007,-3,"bulls have long dongs

bears have limp dinks"
2020-07-27 02:33:16,G23456789,5,"That was a false alarm, printer is working again"
2020-07-27 02:33:16,BooBrew32,1,BATTLE OF THE ALGOS
2020-07-27 02:33:14,jjwax,6,dollar index at 52 week low...
2020-07-27 02:33:07,veryfloppydisk,1,"AMZN to miss, thus starting the Bezos 2024 campaign?"
2020-07-27 02:33:03,trustnobody01,4,"# What should I eat for lunch tomorrow

1) Pizza Hut

2) Jersey Mike's

3) Moe's

4) Sarku Japan

5) Arby's"
2020-07-27 02:32:52,Autist4AudiR8,1,How can I short the dollar? And ticker
2020-07-27 02:32:41,AnonZeit,0,Buy ICE calls to ride the DeFi wave?
2020-07-27 02:32:33,CombodianBreastMilk,1,Nasty Daiquiri needs to break out the extra green dilds.
2020-07-27 02:32:25,UnBuenNombre42069,3,"Pack it up, pack it in, let me begin I came to win, battle me thats a sin -Jpow"
2020-07-27 02:32:20,Papa_Burgundy4,3,Always wondered if MySpace Tom will lose his fortune buying FB puts in spite
2020-07-27 02:32:17,Tiberius08,3,I'm so europhic from my USD shorts I might short the yuan or something somebody stop me
2020-07-27 02:31:54,RealBullishcowboy,7,Confidence in Usa  inflating the money supply being hit in forex markers....retail mom pop forex Usa longs being brutally punished
2020-07-27 02:31:48,ShawnHans007,8,BRO AMZN GONNA GO UP 10% AFTER EARNINGS AND YOU IV CRUSH RETARDS GONNA MISS OUT
2020-07-27 02:31:46,snaigy,3,How are my AMD calls lookin tmr boys?
2020-07-27 02:31:35,YoshikageHands,16,Saw a stock 2019 Honda Civic(not R) trying to race a dodge challenger on the freeway. We need to cleanse the earth of civic owners.
2020-07-27 02:31:33,tttyg,2,Anyone else holding physical gold?
2020-07-27 02:31:29,orockers,4,man if this rally loses steam the fed has really painted itself into a corner
2020-07-27 02:31:22,-OpportunityCost,3,"WSB retards on the precious metal hype, now all we need is a few articles and grandpa will start shilling out his social security checks for physical ounces and we will all be vibing."
2020-07-27 02:31:20,ShawnHans007,1,KANG GANG
2020-07-27 02:31:20,WSOP290,1,China tank.
2020-07-27 02:30:43,silverlink22,3,"So we are expecting another $1200 stimulus check? 

How is that gonna pay people’s rent for next 3 months?"
2020-07-27 02:30:39,,-5,WHY AM I SHADOW BANNED
2020-07-27 02:30:24,option-whisperer,3,wtf futures
2020-07-27 02:30:21,G23456789,1,New candle better be green
2020-07-27 02:30:08,LordoftheEyez,13,Who else thinks of being more wealthy/successful than everyone else 90% of the time?
2020-07-27 02:30:04,TEdward504,9,Glad this sub is slowly getting off TSLA dick
2020-07-27 02:29:58,spikiera,3,if AMD hits 90 on Wednesday ill buy my wife a Model Y
2020-07-27 02:29:56,G23456789,4,Holy shit hang seng +200 to +10
2020-07-27 02:29:49,orockers,3,who knew those ads on fox news were right the whole time
2020-07-27 02:29:42,veryfloppydisk,1,"Are they realizing antitrust actions would bring QQQ and the broader market down, ruining reelection chances, or why the change of heart?"
2020-07-27 02:29:37,visionarymind,2,🖍🩸💉🧸
2020-07-27 02:29:29,CambodianInvestor,4, [https://imgur.com/a/wCG4UcC](https://imgur.com/a/wCG4UcC)
2020-07-27 02:29:27,Guilty-Marzipan,9,"Listen putos. 

1. Gold calls. Duh, it's literally gold.

2. Snap calls. Tik tok go bye bye

3. NCLH calls. I forget what this company is, but there must be a reason I got a call

4. PFE call. They literally about to have a cure for corona, hellloooooo

5. Intel put. They cant even make 7mm microchips wtf

6. ACB put. I wanna say I did tech analysis on their charts and they dropping to $9 next week or so

You're welcome"
2020-07-27 02:29:19,europags,2,Next pump Prescott Pharmaceuticals
2020-07-27 02:29:14,ShawnHans007,0,nasdaq bull are temporarily fuk for couple seconds
2020-07-27 02:29:07,G23456789,2,Geeeez wtf was that nasdaq?
2020-07-27 02:29:06,love2fuckbearasshoe,8,"I BETTER see loss porn 

FROM ALL U FUCKS who will get IV crushed by tech this week !!!

I BETTER SEE tons of fucken loss porn !!!!"
2020-07-27 02:29:01,xxshadowcavexx,2,"Futures slipping, someone hold me"
2020-07-27 02:29:00,IBenchBenches,2,"Thinking about moving my savings acct into forex so I don’t have only post WWI German Marks to my name, are y’all feeling Yen or Euros?"
2020-07-27 02:28:59,SpiderBiteHurts,7,"""I am sorry, Mu'ubatu. I know today is your 10th birthday, a significant benchmark in our society, but you and the other children must return to the silver mines. Too many spastics bought an excess of FDs, far too many for us to support. If we cannot meet these quotas, then Elon will force us back to the Lithium abyss, and we all know there won't be an 11th birthday if that happens."""
2020-07-27 02:28:54,emcob80,2,Where’s the guy that was gonna suck a cows balls of SPY dropped?  Need something to take my mind off the markets this week
2020-07-27 02:28:46,timboSlice490,3,I see suspiciously low volume of AAPL comments in here it’s spooking me
2020-07-27 02:28:42,BooBrew32,2,Alright which of you Pajama Boys are ruining it for the rest of us?
2020-07-27 02:28:39,RIZup18769,1,EOW automod gonna dm me
2020-07-27 02:28:31,crackpk,2,Are my INTC Calls going to be ok?
2020-07-27 02:28:16,MiltDavis,2,Wtf why am I showing green by .3 on investing app but people keep saying red
2020-07-27 02:27:57,veryfloppydisk,0,I'm not even thinking about thinking about making any moves until the election
2020-07-27 02:27:32,ShawnHans007,9,stonks going up next month for august ames appreciation month
2020-07-27 02:27:28,orockers,5,holding cash but at least won't run out of toilet paper
2020-07-27 02:27:12,Papa_Burgundy4,7,"Assigned $200,000 of GLD EOD friday and somehow it feels like the safest play of my life. Like get out of here with that margin call"
2020-07-27 02:27:03,ShawnHans007,3,im bull and kinda scared and thinking about going cash gang
2020-07-27 02:26:50,carlians,11,Gold all time highs 🚀
2020-07-27 02:26:49,KingAutist-0004,-4,I can’t believe you guys pump or hate the same exact stocks everyday...SRNE going to $24 by end of August
2020-07-27 02:26:37,-OpportunityCost,10,I just imagine so many of those dudes who bought hundreds of physical ounces of silver in 2011 finally starting to not feel retarded.
2020-07-27 02:26:30,deemie,5,i miss mama yellen
2020-07-27 02:26:14,ShawnHans007,8,BULLS JUST KEEP BUYING THE DIP ALL THE TIME
2020-07-27 02:26:10,neutralpoliticsbot,6,hopefully silver keeps going baby
2020-07-27 02:25:55,CombodianBreastMilk,7,I will put a Mercedes emblem on a Dodge Charger and then never acknowledge it to anybody I know irl if QQQ hits 268 tomorrow.
2020-07-27 02:25:54,4-eva-dickard,5,"LOL of course

[https://www.wsj.com/articles/amazon-tech-startup-echo-bezos-alexa-investment-fund-11595520249?mod=business\_minor\_pos8](https://www.wsj.com/articles/amazon-tech-startup-echo-bezos-alexa-investment-fund-11595520249?mod=business_minor_pos8)"
2020-07-27 02:25:35,RealBullishcowboy,7,"Usa dollar  collapsing as gold  rocketing

All the big boyy analysts got it wrong"
2020-07-27 02:25:34,brianjamesxx,13,Team America World Police is on holy shit this movie 😂😂😂
2020-07-27 02:25:19,silverlink22,9,This is healthy. Extremely healthy economy. God we’re so fucked.
2020-07-27 02:25:13,tayzer91,10,Gold is gonna make a new ATH. You heard it here first and nowhere else okay?
2020-07-27 02:25:12,ShawnHans007,2,omg red omg green omg red omg green
2020-07-27 02:25:08,bearlycoping,1,Best charts for swing trading/day trading?
2020-07-27 02:25:07,Get_Gwap_247,2,"Dollar crashing, riots, maybe a civil war. cold war with China, Rona, huricane season.  brrrrrrrr stimulus or pop, buy at the bottom sell at the top, dont catch knives unless you wanna bleed out."
2020-07-27 02:25:04,love2fuckbearasshoe,-3,"YA ARE SOME STUPID FUCKS WHO DID NOT GET 

MSFT 205 calls Easy money play 

MSFT is one of the heaviest WEIGHTED COCKS 

IN ETFS AND INDEXES

ANY OF THOSE GO UP 

MSFT COCK GOES UP WITH IT"
2020-07-27 02:25:03,12Skidoo,5,Hey you fucking retards if the USD was about to collapse due to inflation why the fuck would the FED and banks be buying bonds.
2020-07-27 02:24:54,Nomadic_Marvel07,5,Asia faded enough for a more tactical pump. We gonna 🌕
2020-07-27 02:24:31,AnonZeit,2,What are the news
2020-07-27 02:24:30,UnwantedRelishMan,10,so gold just kinda surpassed it's ATH of 1917
2020-07-27 02:24:27,ReadAndReddit123,3,[USD ](https://imgur.com/gallery/r2xgWBJ)
2020-07-27 02:24:22,drdixie,1,DAL 9/18 calls. How we lookin??
2020-07-27 02:24:18,chrisvictors,1,How’s AMZN lookin for tom?!?! someone tell me cuz i don’t have my computer
2020-07-27 02:24:14,RightTackle,1,I’ve never been more convinced that we are going to ATH than now with the dollar tanking.
2020-07-27 02:24:04,visionarymind,-1,3️⃣1️⃣8️⃣5️⃣ 🅱️👁 🌄
2020-07-27 02:23:58,ShawnHans007,2,OMG RED
2020-07-27 02:23:52,option-whisperer,2,I wanna go to bed but the futures are whackamola wut to do???
2020-07-27 02:23:44,JimmyChill2020,12,Ex gf lives a state away and somehow had a reservation at my country club restaurant with her new bf after I posted myself teeing off today. Small world.
2020-07-27 02:23:38,bearsgotoalaskanstfu,4,SPCE GANG🚀
2020-07-27 02:23:27,coxidasical,5,SLV is looking like it’s gonna be a juicy gap up tomorrow
2020-07-27 02:23:12,-OpportunityCost,5,Fire up da prin..... I mean silver mines
2020-07-27 02:22:53,www123x,2,AG 10/16 18c??
2020-07-27 02:22:48,iwoketoanightmare,6,Tsla needs a nice 200 point green dildo at open tomorrow and I'll be happy af.
2020-07-27 02:22:38,UserZwei,2,Damn my futures algo actually works.
2020-07-27 02:22:27,visionarymind,-8,#🅱️LUHD RED 🔜
2020-07-27 02:22:14,Level-Local,9,Accumulated bottle caps preparing for this exact dollar collapse
2020-07-27 02:22:13,ensoul,12,**GOLD**
2020-07-27 02:21:50,BooBrew32,2,FUTURES WOT YOU DOIN??
2020-07-27 02:21:47,ShawnHans007,13,HEAR YE HEAR YE TOWN RETARDS; BUY GOLDDD
2020-07-27 02:21:46,NiGhTCuck,1,How do I lose my belly fat? Im currently only eating greek yogurt. Should I do more cardio?
2020-07-27 02:21:42,love2fuckbearasshoe,-9,Spy 330 EOW
2020-07-27 02:21:13,Spuri0n,3,"wait doesnt a weak dollar improve margins for grocery companies by passing the change onto the customer? 

dang glad i got some $ACI calls"
2020-07-27 02:21:13,ShawnHans007,12,GOLD STANDARD COMING BACK
2020-07-27 02:21:10,ThatOneDrunkUncle,20,"If gold keeps running, I'm going to make fuckin dozens of dollers. Call me midas baby"
2020-07-27 02:20:52,ShawnHans007,7,imagine you became a billionaire by being a bull and then you threw all that money into puts and became a trillionaire
2020-07-27 02:20:47,el_copt3r,2,the fact that /es has bumped previous spx close 7 times and not broken through is a good sign tomorrow is red
2020-07-27 02:20:46,pao664,3,So glad I dumped my VIX calls last week
2020-07-27 02:20:37,1dayoungj,3,"The new strategy is to make trendy tiktok dances while sharing the stock you want to go up, so go make a dance and buy calls. The tiktokers will follow"
2020-07-27 02:20:29,WhySoSerious37,10,Best silver etf?
2020-07-27 02:20:28,MakerofMarkets,8,"This place isnt nearly as retarded as it used to be, in a sad way"
2020-07-27 02:20:18,L0ial,2,"Has anybody else been short UUP for a whiile?  I have some 1/15/21 exp 30p that have been slowly climbing, but there's no volume."
2020-07-27 02:19:50,horribleatthis1313,2,How much will long dated NKLA puts print?
2020-07-27 02:19:44,ShawnHans007,12,"GOVERNMENT ANNOUNCES GOOD NEWS TO SAVE STONK MARKET

STONKS GO UP 10%"
2020-07-27 02:19:44,Bleached_Hole_Patrol,0,"CNBC headline says ""Mnuchin and Republicans ready to pass stimulus bill"" you know goddamn well if they're quick and ready to pass something, there is some bull shit in there that the dems will scoff at, then repubs will be like seeeee dems don't want to help but we do! Nothing imminent take everything with a grain of salt"
2020-07-27 02:19:30,Autist4AudiR8,7,Low dollar is SUPER BULLISH btw
2020-07-27 02:19:17,Turlututu_2,12,"""China yuan will replace the USA as world's reserve currency""

yes of course. i definitely trust Chinese ~~banks~~  government with my billions of dollars"
2020-07-27 02:19:03,Yellowdickedtoad,6,"So the last time we crashed , gold crashed with it. 
Will it happen all over again the same way ???"
2020-07-27 02:19:03,CambodianInvestor,1,there is roughly 19x more silver in the ground than there is gold. yet gold/silver is about 82 rn
2020-07-27 02:18:46,Wilsons7thfutbol,6,nkla puts?
2020-07-27 02:18:39,orockers,5,"lol, UDX is down more than S&P is up"
2020-07-27 02:18:32,Jay3377,2,"Serious question, Will AMZN goes to 5000 this week?"
2020-07-27 02:17:47,IBenchBenches,22,"Holy fuck the dollar is falling off a cliff, J Pow raising rates or are we zimbabwe?"
2020-07-27 02:17:37,kevasto,2,How high do you guys think DDOG can go? I have shit-ton in OTM calls expiring Aug 21st lol
2020-07-27 02:17:22,winkerpack,31,"Here you go fellas.  Shoot some *sticky* and get some sleep. Big week ahead 

⠄⢸⣿⣿⣿⡇⣏⣾⡞⡯⣥⣽⣷⡘⢶⡀⠡⣌⡔⢣⣿⣿⠄⠄⠄⠄⠄⠄ ⠄⢸⣿⣿⣿⣷⢹⡖⠬⣚⣛⣯⣭⣛⢂⣙⠦⠈⡇⣾⣿⣿⡆⠄⠄⠄⠄⠄ ⠄⠘⣿⣿⣿⣿⢰⣾⣿⣿⣿⣿⣿⣿⡼⣿⣿⣷⡆⣿⣿⣿⣧⠄⠄⠄⠄⠄ ⠄⠄⣿⣿⣿⣿⠘⡿⢛⣿⣿⣿⣿⣿⣧⢻⣿⣿⠃⠸⣿⣿⣿⠄⠄⠄⠄⠄ ⠄⠄⣿⣿⣿⣿⢀⠼⣛⣛⣭⢭⣟⣛⣛⣛⠿⠿⢆⡠⢿⣿⣿⠄⠄⠄⠄⠄ ⠄⠄⠸⣿⣿⢣⢶⣟⣿⣖⣿⣷⣻⣮⡿⣽⣿⣻⣖⣶⣤⣭⡉⠄⠄⠄⠄⠄ ⠄⠄⠄⢹⠣⣛⣣⣭⣭⣭⣁⡛⠻⢽⣿⣿⣿⣿⢻⣿⣿⣿⣽⡧⡄⠄⠄⠄ ⠄⠄⠄⠄⣼⣿⣿⣿⣿⣿⣿⣿⣿⣶⣌⡛⢿⣽⢘⣿⣷⣿⡻⠏⣛⣀⠄⠄ ⠄⠄⠄⣼⣿⣿⣿⣿⣿⣿⣿⣿⣿⣿⣿⣿⣦⠙⡅⣿⠚⣡⣴⣿⣿⣿⡆⠄ ⠄⠄⣰⣿⣿⣿⣿⣿⣿⣿⣿⣿⣿⣿⣿⣿⣿⣷⠄⣱⣾⣿⣿⣿⣿⣿⣿⠄ ⠄⢀⣿⣿⣿⣿⣿⣿⣿⣿⣿⣿⣿⣿⣿⣿⣿⣿⢸⣿⣿⣿⣿⣿⣿⣿⣿⠄ ⠄⣸⣿⣿⣿⣿⣿⣿⣿⣿⣿⣿⣿⣿⣿⣿⡿⠣⣿⣿⣿⣿⣿⣿⣿⣿⣿⠄ ⠄⣿⣿⣿⣿⣿⣿⣿⣿⣿⣿⣿⣿⣿⠿⠛⠑⣿⣮⣝⣛⠿⠿⣿⣿⣿⣿⠄ ⢠⣿⣿⣿⣿⣿⣿⣿⣿⣿⣿⣿⣶⠄⠄⠄⠄⣿⣿⣿⣿⣿⣿⣿⣿⣿⡟⠄ ⢸⣿⣿⣿⣿⣿⣿⣿⣿⣿⣿⣿⠇⠄⠄⠄⠄⢹⣿⣿⣿⣿⣿⣿⣿⣿⠁⠄ ⣸⣿⣿⣿⣿⣿⣿⣿⣿⣿⣿⠏⠄⠄⠄⠄⠄⠸⣿⣿⣿⣿⣿⡿⢟⣣⣀⡀"
2020-07-27 02:17:14,Nobody07011,13,I’m so fucking high right now . Tried to look at futures and all I see is green YUPAAAAA BOIS
2020-07-27 02:16:41,rent-a_dwarf,5,Is anyone still fucking with WMT?
2020-07-27 02:16:41,ensoul,8,Think of all the resources they've wasted trying to suppress the price of gold
2020-07-27 02:16:30,love2fuckbearasshoe,2,"
I have msft calls 205$ 

Watch them print Monday 

And notice that the best plays

Are the most simplest one 

MSFT 210 EOW"
2020-07-27 02:16:28,CombodianBreastMilk,12,The president of Bears got caught having sex with his wife.  SPY 333 at open.  351 EOW.
2020-07-27 02:16:10,PaperShark0001,87,Dm me if u wanna turn 100 bucks into 1k. Its not a scam we selling crack
2020-07-27 02:16:03,Nope______________,2,FB 325C weekly literally can’t go wrong
2020-07-27 02:15:51,pennystockplayer,9,Local street walker upped her handies to 7 bucks a pop. Inflation is a bitch.
2020-07-27 02:15:47,SwoleStoner,8,NVDA calls this week to ride on AMD earnings?
2020-07-27 02:15:43,option-whisperer,18,Can I have a 7 day ban please? Need time to get my head right...
2020-07-27 02:15:18,SlipperySerpent,2,"cmon Donald i need a ""trade talks vaccine talks going very well ! "" tweet"
2020-07-27 02:15:17,dweeegs,5,"Dow leads every night until Europoors flip the switch to tech at 2 am, have you learned nothing"
2020-07-27 02:15:11,Integrationbyparts01,1,"Just got a call from JPow, stocks gonna moooooon tomorrow. SPY 330 EOM confirmed."
2020-07-27 02:15:07,ienjoycorgis,8,INTC futures index starting to look really good to me!
2020-07-27 02:15:05,pnwguy1985,2,So your saying I should hold onto my Jan 21 slv 21c Leaps for a bit?
2020-07-27 02:14:58,hotwingbias,3,Alright y'all. Tonight I treated myself to delivery Chinese food. I didn't just YOLO a paycheck did I? 💵
2020-07-27 02:14:56,MakerofMarkets,2,Are there any companies that make strictly guns AND seeds?
2020-07-27 02:14:48,Smart202020,2,"VIX is dying, Monday going to be one of the greenest days of the year"
2020-07-27 02:14:48,Chidoba,3,GDX $42c 9/18 and SLV $20c 1/21 - you can only add to one
2020-07-27 02:14:47,1dayoungj,8,I just want a nice yolo trade so I can leave my job 🥱
2020-07-27 02:14:41,disappointingstepdad,0,"Looks like my MRNA weekly gonna print.

How bout crushing ABUS at the same time and making me a happy man"
2020-07-27 02:14:33,MatthewWoolsey,2,"Just now realizing the big boys have been using all this as a chance to re-up their Carry Trades.

I don't know if that was accident, opportunity or cyclical, but it happened nonetheless."
2020-07-27 02:14:29,yachtking1,2,Why are you idiots trying to give futures meaning
2020-07-27 02:14:27,johnny63137,8,whats the most you left on the table? i got greedy two weeks ago and left 25k on the table and watched it disappear...  i'm only asking cause i just cant get over it and i feel its fucking with my decision making now or it the fucking market thats all fucked up.  but for really i just keep thinking about why i did not sell that fucker. ( it was AZN ).
2020-07-27 02:14:21,1n_evitabl3_,4,"can i get unbanned from the discord

promise i won’t be gay"
2020-07-27 02:14:14,drewthegoat3,5,MSFT 300 eow
2020-07-27 02:13:55,mcchicken2,-1,I have SLV calls but I might inverse myself and switch to puts tomorrow
2020-07-27 02:13:50,ShawnHans007,2,pound to pound the bears are holding up against the bulls with the pennies they have left over. however they shall fear thy wrath of thy GREEN SWORD
2020-07-27 02:13:48,pennystockplayer,2,Can you even be considered a superpower if you aren’t currently bussing ethnic minorities to concentration camps? US gotta step their game up. China number 1 in everything.
2020-07-27 02:13:47,NullRad,1,When someone slapped a bunch of **dildos** on the Wall Street **Golden Bull** they were sending a signal.
2020-07-27 02:13:45,orockers,17,How Can Gains Be Real If Our Dollars Aren't Real
2020-07-27 02:13:30,SusiePowell,4,GET FOOOOOOOOKED BEARS
2020-07-27 02:13:28,idiotnoobx,4,We broke all time high!!!!!
2020-07-27 02:13:28,Buildingdetroit,3,All the bears keep scrawling through 10 minute old comment threads to downvote bulls. LMFAO
2020-07-27 02:13:27,ohmy420,10,Dollar in shambles America exposed as a banana republic
2020-07-27 02:13:26,pstric8,1,Thoughts on amazon tomorrow? I’ve got an 8/7 3200C
2020-07-27 02:12:37,orockers,20,I LOVE GOOOOOOOOOOOOLD
2020-07-27 02:12:25,AMcMahon1,10,About to go make an egg frittata that cost me $3 in supplies to make. Tomorrow it might cost my paycheck but it'll be worth it
2020-07-27 02:12:24,ShawnHans007,6,A FUCKING TWEET OR SOME RANDOM RETARD CAN DESTROY YOUR SUPPORTS AND RESISTANCE NONSENSE YOU IDIOT TECHNICAL NERD
2020-07-27 02:12:22,ODNI_NSA_FBI_CIA_DIA,3,How come I don't see people buying AGQ?
2020-07-27 02:11:51,kneeknee25,1,thoughts on renewables/infrastructure calls if B\*den wins in Nov...
2020-07-27 02:11:49,atlfirsttimer,7,Remember when we were scared of ebola?
2020-07-27 02:11:41,thtguy90,5,If we gap up at open my NVDA calls will print
2020-07-27 02:11:26,CambodianInvestor,-2,"what are we actually ""progressing"" towards anyways? and what are conservatives failing to ""conserve""?"
2020-07-27 02:11:23,zayplus1997,75,High af thinking about how Chicago got both bears and bulls
2020-07-27 02:11:23,ShawnHans007,2,"DONNIE GREENBUCKS

DONNIE GREENBACKS"
2020-07-27 02:11:16,BooBrew32,7,"Looks like S&P futures are hitting some... euuuugh... ""resistance."""
2020-07-27 02:11:12,howboutthemgators,12,S&P futures up almost the exact same as USD is down. Melting upwards I tell you
2020-07-27 02:10:50,Tiberius08,12,"Becoming a dollar bear was the best decision I ever made 👍

Id like to thank the great u/diabeetis for turning me on to this money printing position"
2020-07-27 02:10:47,identifiedlogo,1,BA will drill to 150-160
2020-07-27 02:10:38,idiotnoobx,2,Wait till the Indians wake up and sallow up all that gold.
2020-07-27 02:10:35,PeacefulDiscussion,2,Kriptoe is banned because you some of the most retarded amongst us fell for [BEET-CONE-EEEEEEECHT](https://youtu.be/lCcwn6bGUtU)
2020-07-27 02:10:35,paragon_1235,1,Whats msft gonna be at eod?
2020-07-27 02:10:33,tokyobob,2,"Anyone have any idea about who is slow to raise precious metal prices? Like places offering gold coins/gold jewelry at prices from 2 months ago that will catch up over the next two months. Would guess that prices for designer jewelry lag, but on the other hand that's probably not the greatest investment...

I'm in Tokyo and the yen is appreciating against the USD so that probably mutes the sense of rising precious metal prices here..."
2020-07-27 02:09:41,Dougiejurgens2,1,Should I put my Donnie Dollars into slv calls? I need to stop making my own decisions
2020-07-27 02:09:39,YoungGucci66,0,If we see futures hover around 3215 for the whole night I won't be able to sleep.
2020-07-27 02:09:31,DonCorleone47,3,"And on the 5th day, my account was resurrected from dust and ashes..."
2020-07-27 02:09:30,AMcMahon1,6,If Powell doesn't raise the rates then he hates America
2020-07-27 02:09:22,Spuri0n,3,"if futures could continue to moon and stop consolidating, me and my $ACI calls would really like that"
2020-07-27 02:09:21,RunYoJewelsBruh,8,"Watching the movie Falling Down with Michael Douglas, for research purposes."
2020-07-27 02:09:12,TEdward504,43,Anyone else just expecting a green surge tomorrow but in the back of your mind there’s a sell off coming and you might dump more cash after the dip then be in way over your head financially and job loss is a possibility and at the same time you’re getting older and less appealing physically?
2020-07-27 02:08:46,samaritan1331,1,Bears vanished
2020-07-27 02:08:33,throwaway10k10k10k,3,"Theranos was a 9 billion dollar scam, how much Nikola is worth?"
2020-07-27 02:08:31,nutfugget,9,"Gold  Up  
Dollar Down

MOARR PRINTING BRRRRRRRRRRRRRR"
2020-07-27 02:08:06,DogSplooge,9,Pls Elon dont let me down 🙏
2020-07-27 02:08:05,ReadAndReddit123,26,America’s downfall will be that it tried to live in the past and “go back to the way things were”. We will be left behind by more progressive global powers
2020-07-27 02:08:03,905the_one,6,This sub is getting stupidly bullshit. Inverse time!
2020-07-27 02:07:58,NullRad,6,Gold 2k EOW
2020-07-27 02:07:58,visionarymind,0,🩸🩸🩸🩸🩸 🅱️👁 ⭕️🖋
2020-07-27 02:07:56,ponciouspilote,3,"Dollar goes down 
Hooker prices go up?"
2020-07-27 02:07:18,love2fuckbearasshoe,10,"FUTURES UP BY TRIPLE DIGETS 

FUCK SLEEP 

WE HAVE MONEY TO MAKE !!!!"
2020-07-27 02:06:50,Lokyeezy,11,"hong kong at record level covid cases -> HSI up

thx to the US for teaching us how its done"
2020-07-27 02:06:44,howboutthemgators,12,The market was down .5% last week and the dollar has gotten 2% weaker. Technically we lost more than .5%
2020-07-27 02:06:31,throwawaystemcel,14,Usd to end up like venezuelan bolivar.
2020-07-27 02:06:31,addictedtothetendies,7,I love blank check companies. They are so mysterious
2020-07-27 02:06:30,helloIAmDan7,3,"Anyone playing BUD earnings? Sam Adams rocketed, and they claimed it was largely due to alcoholic seltzer market. BUD is in that market as well and has not really ripped yet in sympathy"
2020-07-27 02:06:28,-OpportunityCost,2,My cheeks are going to be so fucking clinched this week
2020-07-27 02:06:09,maxkingusa,2,All the insurance companies had benefited from Covid and now they will have to pay out huge claims for all the property destroyed because of Riots.
2020-07-27 02:06:08,Augustus-Romulus,1,NRZ? LLNW?
2020-07-27 02:06:05,love2fuckbearasshoe,7,"COME AT ME MARKET !!

IM FUCKEN READY !!

MSFT CALLS !!!

WHO WANTS TO BE KING!!"
2020-07-27 02:06:00,the_gunit,3,Calls on Metallica
2020-07-27 02:05:59,ShawnHans007,-2,i have barely itm amzon jan calls.. i r fuk?
2020-07-27 02:05:42,namsilat,12,"My boy Dow Jones about to show that old dudes can still hang.  You know what sells well to other countries when the dollar is weak?

Mother fucking industrials, motherfuckers"
2020-07-27 02:05:33,radioref,6,Sell your dollars and buy the DONG
2020-07-27 02:05:04,ShawnHans007,9,PSYCHEDELICS GOT ME GOING CRAZYYY
2020-07-27 02:04:31,howboutthemgators,5,"When the fed raising rates in 2018 dumped the market 10%, imagine what that would do in 2020?"
2020-07-27 02:04:28,derprondo,10,Sold all my GLD on Friday.  How much regret am I facing on Monday?
2020-07-27 02:04:16,Zippy129,11,Silver futures rn are making me nut
2020-07-27 02:04:08,throwawaystemcel,9,I love betting against America.
2020-07-27 02:03:58,ThatOneDrunkUncle,7,Idk if it's gay but I wanna buy gold and silver bullion because I'm legit worried about everything going on
