date,author,score,body
2020-06-05 02:39:59,PaperShark0001,-5,Downvote if i will be green tmr
2020-06-05 02:39:57,zerokelvin_0,5,"TSM, CNTY, UNFI 

All going to make your asshoe pucker."
2020-06-05 02:39:50,illusiveab,0,"LULU, ADBE, CHWY next week...all calls"
2020-06-05 02:39:48,cashflow_,3,Just got my COVID test result back literally a minute ago lol https://imgur.com/a/gFe3JTQ
2020-06-05 02:39:48,trumpsplug,7,"we gonna hit 315 tomorrow on Vaccine news because shits evening out.

&#x200B;

Buy PFE and SPY calls at open if you dont have them already"
2020-06-05 02:39:46,davidithejew180,-10,"What the fuck is this downvote thing?
Please upvote me"
2020-06-05 02:39:44,2Mango2Tango,2,"Anyone want to try to make a case for being a bear? I know the economy has taken a massive hit, but I don’t want to get into market timing unless I have a good reason it’s going down in the near future"
2020-06-05 02:39:39,ma8033,5,Meme Stock of the Day: MRO
2020-06-05 02:39:33,Jay3377,5,Buying the dip always works
2020-06-05 02:39:16,Powerful_Business,2,BEAR LIVES MATTER!
2020-06-05 02:39:07,Orngarth,1,"Does anyone know when MarketWatch updates their ""Percent of Float Shorted"" (%FS) stat?  Because check this out:

* DAL: %FS = 5.21%, Price change today: 13.73%

* UAL: %FS = 12.36%, Price change today: 16.20%

* AAL: %FS = 35.41%, Price change today: 41.10%

What I'm getting at, is were the massive jumps in UAL and AAL mainly due to a short squeeze or is that %FS the result of the massive increases today, rather than the cause?"
2020-06-05 02:38:59,Turlututu_2,19,"SPY can go up to infinity

but it can only ever go down to ~~zero~~ 285

checkmate bears"
2020-06-05 02:38:57,T_alsomeGames,2,"Tomorrow is my last chance to sell my Zynga calls. Hopefully having diamond hands will payoff, because I-am-in-the-reeeeed. It can't possibly fall for 3 days straight right, especially not on a friday."
2020-06-05 02:38:47,pillow38164926,4,#FUCK DIVIDEND INVESTING
2020-06-05 02:38:45,steatorrhoea,1,"Downvote bot psychic,

Downvote this comment if spy 🚀 tomorrow"
2020-06-05 02:38:42,MiltDavis,3,So what's the deal are the airlines gonna keep going up tomorrow?
2020-06-05 02:38:23,Andyh10s,-22,Downvote me plz
2020-06-05 02:38:04,shagagav,7,Nasdaq lagging again I don’t know if these bags could even possibly get heavier
2020-06-05 02:37:56,robohydrate,17,"made 300% on a 8k bet for AAL today  
[https://imgur.com/a/djtLaVV](https://imgur.com/a/djtLaVV)

6/5 16C 16.5C bought after lunch"
2020-06-05 02:37:55,Jetisfly420,11,Jeez what happened in here looks like I walked into 2020
2020-06-05 02:37:47,tropicalia84,15,B E A R L I V E S M A T T E R
2020-06-05 02:37:47,LiveNDiiirect,3,Thoughts on IVR? Thinking of loading up all my remaining buy power on OTM 6/19 calls and see if I get rich or blow 15% of my account doing retarded shit
2020-06-05 02:37:35,kilrock,2,"99 luftballons , calls on Germany"
2020-06-05 02:37:11,McBuddie,5,Should I put my life savings in Tesla?
2020-06-05 02:36:48,nafinmasjid,6,[IVR calls](https://www.cnbc.com/2020/06/03/mortgage-demand-from-homebuyers-spikes-18percent.html)
2020-06-05 02:36:42,BootySenpai,4,when you have the plays but capital is locked LORD Why have you forsaken me
2020-06-05 02:36:40,ChiefDewy,4,Y'all think BA can pull off a AAL
2020-06-05 02:36:38,bshaman1993,12,"Downvote if you think I'm beautiful

Edit : I'm sad now"
2020-06-05 02:36:37,itsbeenaminute1,-8,This comment leverages one downvote to +$100 into my account
2020-06-05 02:36:33,WizardSleeves118,-1,THREAD TO 275 BY BELL!!!
2020-06-05 02:36:09,steatorrhoea,2,This movement is a whole lotta virtue signaling fest
2020-06-05 02:36:07,pillow38164926,-4,"#how you feel about dividend investing

I like selling cash secured puts and running wheel"
2020-06-05 02:35:55,Sam_Handwich69420,11,Bears downvoting just so they can see some red for once
2020-06-05 02:35:54,openyourmindpls,4,Bears are poor
2020-06-05 02:35:46,Covert_elite,11,I'm trying to retire by the end of the year tbh
2020-06-05 02:35:34,wd1998313,2,"Imagine pride parade, BLM parade, and free mask parade hapenning at the same time. Lolz"
2020-06-05 02:35:24,miketarann,8,Spy put gang and proud
2020-06-05 02:35:20,JefBezosExWifesNewBF,26,OH NO ITS THE RUG PUSH. THEY PUT THIS NICE SHAG CARPET UNDERNEATH OUR FEET WHEN WE WERENT LOOKING
2020-06-05 02:35:05,Andyh10s,7,Can SQ blast off with SPY? I would greatly appreciate it
2020-06-05 02:34:56,aaronparon,17,boys im geting really nervous. i have 3.5k in aal puts as well at 2.8k in spy puts that i held in profit. think imma get absolutely fucked tomorrow
2020-06-05 02:34:49,ScroheTumhaire,0,There was a bear post outside this thread and I seriously considered yoloing big time VXX calls.  Still might.  But on top of my bull stuff.  A gay in bulls clothing.
2020-06-05 02:34:29,zerokelvin_0,0,"TSM calls. Going to 65.

Let's not forget what happened with Nvida

Semiconductor gang."
2020-06-05 02:34:20,pillow38164926,0,#IMA BUY THIS SUBREDDIT ONEDAY
2020-06-05 02:34:16,NoftScarlet,-9,fuckfuckfucj stop pumping
2020-06-05 02:34:13,EugeneApplebottom,-1,Downvotes are a ploy from the Bear Party to distract from the fact that futures are going up
2020-06-05 02:33:49,VacationLover1,2,"**IMPORTANT REMINDER** 

If you didn’t Venmo me your money yet, for the rainbow dildos we are sending the mods for pride month, please make sure to do so today. They are getting rainbow double dildos this year so they can take turns on each other"
2020-06-05 02:33:46,smitty1543,4,If you think chart patterns are real I feel sorry for you
2020-06-05 02:33:36,BuyThoseDips,2,Cats are the worst pets jfc
2020-06-05 02:33:33,TrantMerris,1,We buying WORK calls at open before Friday rally?
2020-06-05 02:33:31,,5,"Bears gonna get fuk 3 Fridays in a row?

BULLS LOVING SUMMERTIME"
2020-06-05 02:33:26,ELC183,4,Seriously should I just go balls deep on airlines tomorrow or is the party over
2020-06-05 02:33:18,Rianis96,1,"just fuck off, how much further will this trash go up"
2020-06-05 02:33:16,ScroheTumhaire,-13,Why is everyone getting downvoted?
2020-06-05 02:33:01,,-22,"If this post gets more than 5 downvotes, my penis is legit less than a half inch hard

Edit: it's true it is"
2020-06-05 02:33:00,ThankYou_oFcOuRSe,2,Every song of Karol G I swear 🤤
2020-06-05 02:32:44,illusiveab,-1,Salty bears downvoting everything again?
2020-06-05 02:32:43,Moojuice4,0,So green and it's not even pump o'clock
2020-06-05 02:32:37,BootySenpai,-2,I SWEAR TO BOB IF U DONT HOP INTO DGLY YOUR DUMB
2020-06-05 02:32:36,umbrella_corpz,1,looks like my 6/5 SPY 311c are already in the money. I'm sure my 313c will be ITM by the time I wake up
2020-06-05 02:32:29,dekbrner,-5,Upvote this comment and share with three friends or else Hilary Clinton will be under your bed tonight
2020-06-05 02:32:23,mattbeau80,-1,Oh hey we’re green!
2020-06-05 02:32:18,NoftScarlet,-4,"🍖🐻🍻🐻🍴🥩🍴🐻🍷

Bear feast party"
2020-06-05 02:32:01,PlasticRice,-1,Too late to get in on some Norweigan calls? Will cruiselines really have a V shaped recovery? Hmm..
2020-06-05 02:32:00,VirtusInjection,2,I’m worried that if I keep dipping into savings for more yolos I’ll never be able to save lol. I need sir wise words please
2020-06-05 02:31:50,MokebeBigDingus,2,"The day is coming, and coming soon, when the artificial suns will rain down to punish the degenerates of this sub. Heathens will ruin the land, acid will rain from the skies, we'll never hear my voice again; It will be anarchy!"
2020-06-05 02:31:37,hellomario,-10,Bitcoin 110k next year.
2020-06-05 02:31:32,cashflow_,0,I still haven’t had pizza or burgers since superbowl. My will power is undeniable
2020-06-05 02:31:24,WizardSleeves118,-2,"alright, there's gotta be a way to generate some kind of market of upvotes and downvotes in the downtime threads and track it.  could give us an edge over the MM's"
2020-06-05 02:31:18,pillow38164926,-3,"#ELECT ME PILLOW AS YOUR NEW LORD OF WSB

#BOW DOWN TO YOUR NEW KING NOW"
2020-06-05 02:31:15,doglover211,6,anyone still in dkng
2020-06-05 02:31:00,cadavarsti,1,My moves are weak.
2020-06-05 02:30:42,hellomario,-7,Why bears gay?
2020-06-05 02:30:41,dekbrner,0,Hertz is an easy short right guys?
2020-06-05 02:30:20,cashflow_,4,"What restaurant in a city that you used to live in or visit do you often think of? 
  
For me it’s small cheval in Chicago (burgers) and tucci’s in boca raton, Florida (pizza)"
2020-06-05 02:30:10,_cannoneer_,1,AAL Calls? Should I yolo?
2020-06-05 02:30:07,elisdas,5,SMOKIN MEATS BOYYYYYYYYSSSSSSS
2020-06-05 02:30:03,eyerollingsex,22,Before I traded options I’d go to bed super late. Now I go to bed early so I can wake up early to check pre market
2020-06-05 02:30:00,CryptoMstrmnd,2,Remember when bears made money once when the market became red for like 30 minutes after a 2 month rally
2020-06-05 02:29:46,pillow38164926,-3,"Andrei jikh the youtuber has 200K in RH and makes about $1200 a quarter from dividend investing

BITCH I MAKE $32K A MONTH SELL PUTS WITH THE SAME ACCOUNT SIZE"
2020-06-05 02:29:41,BootySenpai,1,Waoh woah guys calm down. Tell me what happend.
2020-06-05 02:29:38,unclekarl_,-1,THIS IS THE WSB RUG PULL!
2020-06-05 02:29:35,dayfly96,-1,Aye wtf with the sub...I thought I had it sorted as controversial for a sec lmao.
2020-06-05 02:29:35,LifesAGamble727,3,I feel like a dumbass for making thousand dollar moves on a 45 dollar phone
2020-06-05 02:29:20,steatorrhoea,-5,"If this comment is downvoted, trump will win next election"
2020-06-05 02:28:55,thewaterb0yyyy,47,I spend way too much time on this thread
2020-06-05 02:28:46,JefBezosExWifesNewBF,-7,Downvote all you want. I only read two comments before refreshing again anyways
2020-06-05 02:28:35,steatorrhoea,26,"If this is downvoted, I have a big dick

Edit; holy shit downvote bots are right"
2020-06-05 02:28:33,dookeeburger,-1,TOILET PAPER HANDS SQUAD UP 🙌 🧻
2020-06-05 02:28:19,FightingLasagna24,-2,"We’re going to 315. 322 next week. 

It’s that simple"
2020-06-05 02:28:12,love2fuckbearasshoe,-2,BLOOOD GREEN
2020-06-05 02:27:43,the_next_core,5,I don't see the hype staying around for long in casinos and sports betting when so many people are unemployed right now.
2020-06-05 02:27:39,steatorrhoea,-5,What’s the story on Logan Paul? Did he just suddenly grow up and become more mature?
2020-06-05 02:27:36,CollegeStudentYOLOs,2,Wtf happened to investing.com’s app. It is dogshit now.
2020-06-05 02:27:07,CokeAndPuppiies,0,"Betting my life savings on XSPA VISL and MARK, because getting 100%+ profit in one day is amazing. GNUS crew"
2020-06-05 02:26:55,LouieM13,0,Who are some traders I should follow on Twitter?
2020-06-05 02:26:48,uninfinity,8,***Twitter (TWTR) reportedly disables US President Trump's campaign tribute to George Floyd claiming copyright complaint***
2020-06-05 02:26:41,aaronparon,0,Who told blm about wsb?!?!
2020-06-05 02:26:34,WizardSleeves118,-13,"TOP IS IN!!!

SELL SELL SELL SELL SELL!!!!"
2020-06-05 02:26:06,pillow38164926,-6,#I WANNA BUY THIS SUB! LET ME ON AS FULL ADMIN AND THEN ALL MODS LEAVE AND JOIN AS LESSER RANK
2020-06-05 02:26:05,fbi-office,5,I’ll buy NKLA eventually. But the fact that it takes $0.00 to reserve any amount of all their trucks and then they brag about their 14 billion dollars in pre-revenue is a bit ridiculous
2020-06-05 02:25:54,uninfinity,7,"***US-China financial law is unlikely although there is a risk of the US imposing firm financial sanctions on China for the national security bill in Hong Kong, according to SCMP citing analysts***"
2020-06-05 02:25:51,Singleguywithacat,2,"Reading tea leaves.. but it turns out I'm illiterate... In TD I've been obliterated.  I waited to long or was it not long enough, who the fuck knows, these options, ugh!  I find humor even when it's not funny, that's the only way of even thinking of stomaching, loss after after loss, hit after hit... like my ex-girlfriend said you'd think he'd take the hint.  But tell that bitch, I didn't and I never will.  Sitting here waiting for my premiums to fill.  Waiting for my premiums to fill up like their helium, off to the sky, never to be seen again..."
2020-06-05 02:25:46,Gilbertgodfries,-9,Who the hell downvotes on Reddit? I swear you have to have a fragile ego or a small pee pee to downvote
2020-06-05 02:25:46,dekbrner,8,Twitter has so many gay people. Every tweet I go to has some sort of gay reply
2020-06-05 02:25:44,Powerful_Business,1,THE REVERSAL! GOVERNMENT MANDATED UPVOTE STIMULUS PACKAGES!
2020-06-05 02:25:18,arniepieindasky,-1,"You know, Elon’s a bitch for whining about Amazon. If you do something really well you should be rewarded, not punished for being the best at what you do. So what if shitty retail mom and pop stores can’t sell a fucking overpriced picture frame because of Amazon. Get with the times and sell that shit on SHOP or amazon and save yourself the overhead. Survival of the fittest. Amazon has been a savior for probably a billion of people especially during the virus shit. Fuck outta here Elon you autistic fat fuck. 

I still like Tesla’s and I think he’s brilliant  but fuck you with that bullshit"
2020-06-05 02:25:11,Dackelzz,6,TRXC has decent volume on 1/15/21 $1 calls. Interesting
2020-06-05 02:24:59,edmonddantesofficial,6,I’m thinking about a big YOLO 0dte tomorrow. Give me your best recs.
2020-06-05 02:24:55,Dannimaru,12,WHERE IS ALL THE GODDAMN GNUS LOSS PORN?!
2020-06-05 02:24:30,AngryDingo,7,"So looks like GME put their report out a week early, right before AH close.  Terrible numbers for a terrible company of course.  But they got their notes extended out to 2023...so no short term bankruptcy.  With such a high % float sold short, and such a high borrowing rate(23%) shorts might just get out.  I think the bear case was this thing is going under now and that's clearly not the case.  

Mother of all squeezes incoming?  Thoughts?"
2020-06-05 02:23:57,thejoker4059,-1,You're forcing me to go to /r/investing for an hour. Fuck right off.
2020-06-05 02:23:57,leejenkins94,-2,"WHAT YOU ALL FAIL TO REALIZE IS THAT we are the market.

YOU HAVE LESS CONTROL than you think you do.

BEARS WILL RISE AGAIN 🌧🌩⛅ it is today or the next."
2020-06-05 02:23:51,ThankYou_oFcOuRSe,5,Hey Google - Play Jump by Julia Michaels #WORK
2020-06-05 02:23:40,pillow38164926,10,"#CPTONYSTARK

#LOVE2FUCKBEARASSHOE

#GATORMD

#PILLOW42069

#CUNTS"
2020-06-05 02:23:28,Grueshbag,15,Remember when futures had an 10% intranight swing. Pepperidge Farms remembers
2020-06-05 02:22:58,Patcha90,16,Upvote if you downvote
2020-06-05 02:22:55,TheChaoticYeet,3,Do most of you day trade options or hold them for extended periods of time?
2020-06-05 02:22:43,Versedx,4,"CLS63, RS7, M6  if you had to choose one for weekend use/flexin"
2020-06-05 02:22:35,winnning007,13,"Was just scanning spy daily candles and every time we gap up, we almost always go even higher. 

Why am I now finding this out"
2020-06-05 02:22:34,zanif,7,I mean... these nightly threads were getting cancerous the past few days
2020-06-05 02:22:10,pillow38164926,-6,"#HIPSTER LIVES MATTER

#HARVARD GRAD STUDENTS MATTERS

#THE MARKET MATTERS!!!!!!!!!!"
2020-06-05 02:21:59,theetravismiller,4,Daily thread 200 please 😔🙏🏻🙏🏻
2020-06-05 02:21:55,dekbrner,-9,Downvote if you hate black lives matter
2020-06-05 02:21:40,cheezor42,12,"Dear journal,

my downvoting script works.

...it works too well in fact ... if someone finds this, I’m sorry"
2020-06-05 02:21:34,Emotional-Trader,6,Jay cAnt pumP mArkEt if he is up all NiTe WitH ME 🥳🐻😜😏
2020-06-05 02:21:32,PhantomChihuahua,8,"🧑🏻‍🦲🧑🏻‍🦲🧑🏻‍🦲🧑🏻‍🦲🧑🏻‍🦲🧑🏻‍🦲🧑🏻‍🦲🧑🏻‍🦲
🧑🏻‍🦲🧑🏻‍🦲LORD BEZOS🧑🏻‍🦲🧑🏻‍🦲
🧑🏻‍🦲🧑🏻‍🦲🧑🏻‍🦲🧑🏻‍🦲🧑🏻‍🦲🧑🏻‍🦲🧑🏻‍🦲🧑🏻‍🦲"
2020-06-05 02:21:29,cutiesarustimes2,5,Lol trump RT Obama's bro
2020-06-05 02:21:26,,7,As if up and down votes actually mattered. Fuck off.
2020-06-05 02:21:23,dekbrner,32,Downvote if you are straight
2020-06-05 02:21:12,dekbrner,-12,Downvote if your gay
2020-06-05 02:21:11,ThrowawayUser22324,5,How much commision do americans pay to buy/sell options? I think I am getting cucked as a canadian
2020-06-05 02:21:09,JefBezosExWifesNewBF,6,MODS!  STONKS ONLY GO UP! WHY NOT COMMENTS TOO? REMOVE THE DOWNVOTE BUTTON
2020-06-05 02:21:07,Ripdre,5,Did anybody else catch the LVS flash crash or was that just me
2020-06-05 02:20:59,timboSlice490,4,Whoa what did I miss with Hertz? They were down like 7% AH at 6pm and now they’re up 6%?
2020-06-05 02:20:56,meanmug44,3,PENN PUTS BOYS!
2020-06-05 02:20:45,NoftScarlet,8,"Stonks go up stonks go down, I only go down, can't explain that."
2020-06-05 02:20:39,Bangada,-1,I wanna start losing money. Is there a starter guide specifically designed for wallstreetbets i can work with to get going?
2020-06-05 02:20:36,e30jawn,1,Daily thread just lost 20pts in 3 minutes
2020-06-05 02:20:28,follow-spy,-1,"i cant stop watching this video...lol

[https://www.reddit.com/r/ConvenientCop/comments/gujad4/usa\_looting\_at\_vans\_in\_atlantic\_city/](https://www.reddit.com/r/ConvenientCop/comments/gujad4/usa_looting_at_vans_in_atlantic_city/)

The girl also casually in beginning is something else...lol"
2020-06-05 02:20:26,Gilbertgodfries,3,One thing we can all agree on is that mods r 🏳️‍🌈🏳️‍🌈🏳️‍🌈
2020-06-05 02:20:23,throwaway60501,-4,"BEARS, THINK ABOUT ALL THE MONEY YOUVE LOST AND THINK HOW DIFFERENT YOUR LIFE WOULD BE IF YOU HAD THAT IN CASH IN FRONT OF YOU. NOW OPEN YOUR EYES AND LET REALITY SIT IN BROKE BITCH 🤣🤣🤣🤣🤣🤣🤣🤣🤣🤣🤣🤣🤣🤣🤣🤣🤣🤣🤣🤣😂😂😂😂😂😂😂😂😂😂😂😂😂😂😂😂😂😂😂😂😂🤣🤣🤣🤣"
2020-06-05 02:20:22,umbrella_corpz,-7,"he did it again!!!

[https://twitter.com/realDonaldTrump/status/1266231100780744704=21s](https://imgur.com/a/28Wf4ze)"
2020-06-05 02:20:20,Rianis96,1,Bear lives matter 🐻🐻🐻
2020-06-05 02:20:15,alex21turner,2,[COPS KILLED AN OLD MAN ](https://twitter.com/wbfo/status/1268712530358292484?s=21)
2020-06-05 02:20:09,TenMegaFarads,-3,This thread is fake and manipulated. Going novote gang for now
2020-06-05 02:20:05,theetravismiller,-1,I'm betting everythin on future dialy upvote 200!
2020-06-05 02:19:54,oughmoment,2,The Boeing short float pumped to 40% 👀 maybe BA 200 is achievable tomorrow
2020-06-05 02:19:48,TrenAndOptions,-12,If you downvote this comment you LOVE DICK IN YOUR MOUTH
2020-06-05 02:19:48,philmacrack123,2,"Do you think when spy hits 400 by July, Jerome might be a little worried?"
2020-06-05 02:19:43,The_Weekend_DOW,7,"I leave for 30 minutes and come back to this, what the ever loving fuck?"
2020-06-05 02:19:38,SayCyberAgain,2,"I had diversified 9k and decided to play with options with another 2k, so now I’m left with 9k. s my stock’s didn’t grow and my options obviously failed, should I pull all 9k out and yolo?"
2020-06-05 02:19:35,throwawaybutforchang,-5,Take me down to the downvote city
2020-06-05 02:19:27,NoftScarlet,1,"Buy at ATH, sell at ATL, buy high sell low, buy low sell lower, buy lower sell lowest

🤡 kingdom forever"
2020-06-05 02:19:13,WizardSleeves118,-6,"ALRIGHT EVERYBODY UP!!!

BUY BUY BUY BUY BUY!!!!"
2020-06-05 02:19:10,pillow38164926,0,#ASIAN LIVES MATTER
2020-06-05 02:19:09,thunderchkn07,-3,Why did work tank?
2020-06-05 02:18:59,love2fuckbearasshoe,-3,I love licking ass
2020-06-05 02:18:58,JefBezosExWifesNewBF,0,I made good money on the way down and am making good money on the way up. Don't be mad bears. Be mad at your parents for bringing you into this world and making you experience pain. They shouldnt have been allowed to breed anyway
2020-06-05 02:18:58,Kombucha_Slim,-11,Black lives matter 😎
2020-06-05 02:18:55,VacationLover1,-9,I don’t know why but seeing all these downvotes gave me the urge to go down the list and hit the downvote
2020-06-05 02:18:54,eyerollingsex,-13,If you have a micro penis downvote this
2020-06-05 02:18:49,pillow38164926,-1,#FUCKKKKKKKK
2020-06-05 02:18:48,CryptoMstrmnd,-4,Now things are normal! SPY UP VIX DOWN on ventilator ! Ha! Bitch ass cunt slobbering pee pee mouth bears
2020-06-05 02:18:47,love2fuckbearasshoe,0,Only the strong survive
2020-06-05 02:18:46,ItsreallyQ,-6,What the hell happened here
2020-06-05 02:18:40,love2fuckbearasshoe,-4,Downvote my cock in your anus
2020-06-05 02:18:38,throwaway60501,-4,Ok downvoting was fun but as a chad bull I’m bored. Also BA 200 tomorrow
2020-06-05 02:18:30,love2fuckbearasshoe,-1,I’m the boss
2020-06-05 02:18:25,love2fuckbearasshoe,-2,My cock in your anus
2020-06-05 02:18:25,your-missing-mom,-12,Stop downvoting or mods will lock the threadsz fucking idiots
2020-06-05 02:18:24,shagagav,-6,This thread is cancerous lmfao
2020-06-05 02:18:18,love2fuckbearasshoe,-1,Suck my cock
2020-06-05 02:18:12,love2fuckbearasshoe,-2,U
2020-06-05 02:18:07,love2fuckbearasshoe,0,S
2020-06-05 02:18:03,KevinAndTheZitz,-5,You mad bois?
2020-06-05 02:18:01,love2fuckbearasshoe,0,S
2020-06-05 02:17:57,steatorrhoea,-4,"Chi Na bots working overtime today. Calls on LMT, RTX, and BA"
2020-06-05 02:17:52,love2fuckbearasshoe,2,HAHAHAHAH PRETTY FUNNY THO
2020-06-05 02:17:47,GatorMD12,-2,The bears are fucking livid.   Lol down vote my asshole
2020-06-05 02:17:46,e30jawn,0,WSB protesting the fake market
2020-06-05 02:17:42,throwawaybutforchang,4,"It’s funny cause this is the only thing going down , stocks only go upppppppp"
2020-06-05 02:17:39,nafinmasjid,-1,Which sector is next boys
2020-06-05 02:17:37,Kysiz,11,C'mon bulls lets upvote these bears away ⬆️⬆️⬆️
2020-06-05 02:17:36,pillow38164926,-1,"#DOWNVOTE THE THREAD

#DO YOUR PART"
2020-06-05 02:17:32,Jfri33ss,-2,Futures looking yummy.
2020-06-05 02:17:29,presly121,-7,DOWNVOTE THREAD FOR FREE INSTANT TENDIES
2020-06-05 02:17:21,marky244,-4,"If a fortune cookie says it how can it go tits up?

http://imgur.com/gallery/KHXFJtQ"
2020-06-05 02:17:13,WizardSleeves118,-6,"bears be like:  ""who's thread? OUR THREAD!"""
2020-06-05 02:17:11,he_gone1,9,"Green 🟢 at night, bulls delight 🐄"
2020-06-05 02:17:05,BearDiamond,-1,Lmao. Looks like there's a couple dozen faggots who missed out on the airline's tendies today. Deciding to offset their vaginal pain by downvoting everyone 😂🤡👸👸
2020-06-05 02:17:01,love2fuckbearasshoe,1,FUCK THERE LOOTING MY KARMA U FUCKEN PROTESRS !!!
2020-06-05 02:17:00,pillow38164926,-1,"So companies and channels talking about black lives matter

Ok, even fuckin Kings and Generals youtube history channel? WTF"
2020-06-05 02:17:00,sirms,0,where were you when the bears took back wsb
2020-06-05 02:16:55,eyerollingsex,-4,"Not to sound gay but I love you guys and this sub

Hope all your trades end green"
2020-06-05 02:16:53,AUserOfManyThings,-4,"""INCOMING LOCKED CUZ YALL CAN'T BEHAVE"""
2020-06-05 02:16:51,ArsonDub,-8,Downvote this if my portfolio is green tomorrow :D
2020-06-05 02:16:35,thejoker4059,-10,"See you children tomorrow. This is now more than counterproductive, it's actually annoying."
2020-06-05 02:16:31,malthaczar,-8,BEAR LIVES MATTER 🌈 THE TIME TO RIOT IS NOW!!
2020-06-05 02:16:26,JefBezosExWifesNewBF,-11,Your ruining the sub you faggots
2020-06-05 02:16:22,ThirdCrew,-13,Is it illegal for ETFs to be red now? I ain't really complaining because it's easy money but damn.
2020-06-05 02:16:19,steatorrhoea,-10,Buffet ditched airlines and has been hoarding cash to buy Sirius xm 😂
2020-06-05 02:16:04,Gilbertgodfries,-11,"Anyone else getting pretty tired of these companies shoving their wokeness down our throats? I get it what happened to George Floyd was terrible and it should never be forgotten, but I don't need no company to tell me how outraged I should be if I'm already outraged. Yes Nike I know your upset about this, but I'm not gonna go buy your Joe smoe Nike 25s that were made from sweatshop labor."
2020-06-05 02:16:02,VacationLover1,-12,"I’m so close to 1 million karma, please upvote to get me there"
2020-06-05 02:16:00,throwaway60501,-10,KEEP DOWNVOTING BRING THIS THREAD TO NEGATIVE ‼️‼️‼️‼️
2020-06-05 02:15:57,pillow38164926,-2,"#WHERE R THE MODS? OH THEY SUCKIN DICK HA

#DOWNVOTE THE THREAD!!!"
2020-06-05 02:15:35,A-Ronyells,-7,ELON WHERE ARE YOU? 😢
2020-06-05 02:15:26,PaperShark0001,-8,"Downvote this if u love ur mom

Edit: im dumb i deserve to be downvoted"
2020-06-05 02:15:23,Powerful_Business,-7,"THE MODS HAVE LOST CONTROL! #BEARLIVESMATTER

RIOTS AND ANARCHY IN THE WSB DISCUSSION! 

LOOTING OF KARMA ENSUES"
2020-06-05 02:15:22,pillow38164926,-4,FUCK THIS THREAD!!!
2020-06-05 02:15:21,clarkefromtheark,-11,Why the fuck does every post have so many goddamn downvotes
2020-06-05 02:15:20,presly121,-11,"DOWNVOTE THE ENTIRE REDDIT THREAD


BEARRRR REFOR
BEAR RISE UP
🐻 🐻 🐻"
2020-06-05 02:15:15,theetravismiller,-9,Stupid bears all downvoting smh..
2020-06-05 02:15:10,umbrella_corpz,-5,oh wow looks like the airlines bears gang finally realized what happened. the gay virgins are downvoting everything
2020-06-05 02:15:09,CryptoMstrmnd,-13,Yo why is everyone being downvoted ? no one downvote me
2020-06-05 02:15:08,Arcanne,-7,Mini pump from JP
2020-06-05 02:14:59,pillow38164926,-4,#DOWNVOTE THE THREAD!
2020-06-05 02:14:51,AUserOfManyThings,-5,Downvoting the daily thread too? Cmon strangerinos
2020-06-05 02:14:47,Cranial-Nerve,-5,"This guy on /r/investing needs advice. Go on ahead

https://reddit.com/r/investing/comments/gwvd1k/rate_my_401k_comeback/"
2020-06-05 02:14:44,illusiveab,-4,I have DKNG calls AMA
2020-06-05 02:14:40,pillow38164926,0,"#WOULD YOU RATHER

- GET $1 MILLION DOLLARS AND SUCK OLD 65 YEAR OLD DICK

- GET $250K AND A FREE DONUTS AT DUNKIN FOR 1 WEEK. $10 MAX TRIP PER DAY"
