date,author,score,body
2020-02-28 03:15:14,gettendies,1,"I look at futures and see them all turning red

I see the market and I must have it open red

Maybe then I'll buy more puts until the bulls are dead

It's easy being a bear, when your whole world is red"
2020-02-27 19:45:33,shmurda-trippin,4,Who else is bored of watching spy bounce between 304 and 305
2020-02-27 19:16:33,FatassWindex,1,Should I buy $ALK puts? I’m new to this and Im looking to lose all of my savings fast
2020-02-27 17:30:00,68Des,1,Anyone playing DELL
2020-02-27 17:08:21,reddituseranyonymous,3,"Market goes down big.
Idiot buys DAL puts for 3/20. Market sinks to a low. -900. DAL dips then rises more than 10% 

I hope this is a dead cat bounce. :/

Fuck me."
2020-02-27 16:50:26,lagoonboyzgasco,1,Tlt and vxx puts are gonna print
2020-02-27 16:33:16,Lord-Bjorn,1,https://youtu.be/Rntm3yDAQuM
2020-02-27 16:25:45,plinko_champ,1,What the fuck just happened to $MRNA & $GILD????
2020-02-27 16:04:15,G00nSqd447,1,"Don't forget about Gold, gents."
2020-02-27 15:18:10,winenbug,3,Lol it looks like we're not gonna even be able to get a nice bounce today. It's drilling all the way to the abyss
2020-02-27 15:12:27,iHeartThots,3,"Vxx, easy money"
2020-02-27 15:02:42,iamtheoldkanye,2,Let’s fuckin go Netflix!!
2020-02-27 14:53:27,artiirage,1,CLOROXXXXX
2020-02-27 14:49:01,parker2020,2,Theta gang trap 🤔
2020-02-27 14:47:28,parker2020,1,That feeling when the circuit breaker is gonna get flipped today and have no idea what the fuck that’s going to do 😬😬😬
2020-02-27 14:27:27,theycallmenubs,4,What can you buy puts on that hasn't already gone down significantly?
2020-02-27 14:23:33,legend27tv,0,"haha haha die you stupid market, FUCKING DIEEE"
2020-02-27 14:18:46,,2,Europe is so fucked - especially Italy - gets your $EWI puts before it’s too late
2020-02-27 14:12:55,whib96,1,Why is SPXS hardly increasing with SPY's massive drop?
2020-02-27 14:12:29,whib96,1,March 4 SPY OTM put not a bad idea?  Or FD?
2020-02-27 14:09:35,whib96,2,"Shit, would buying an OTM spy put be promising at market open?  I've got only about 160 available to try to capitalize on this drop.  MIght just grab SPXS shares."
2020-02-27 14:08:54,Thevsamovies,7,Trump pump? Clearly this is a trump dump you cucks -- can't believe one letter difference fucked 50% of portfolios overnight
2020-02-27 14:03:26,love2fuckbearasshoe,2,"HOLY SHIT 


😭😭😨😨🤮🤮🤮🤮🤮🤮🤮🤮🤮🤮🤮🤮🤮"
2020-02-27 13:52:04,mcchicken2,0,I have 9 3/2 315 puts likely ITM today. Do I sell today and roll it into later exp dates?
2020-02-27 13:39:10,Warzeal,2,Imagine thinking this 10% drop will matter in 10 years
2020-02-27 13:32:10,Fantasnickk,2,"3/20 67.5p for $BUD was the right move. Predicted earnings to be bad and it’s already down 8% overnight 

Sell at open for 500% profit or just keep until expiration?"
2020-02-27 13:31:34,Supermax64,3,"Got $90 leftover, any cheap put that's gonna print?"
2020-02-27 13:25:06,LiviuDragneaOfficial,6,All European markets are dropping 3%+ btw
2020-02-27 13:21:14,maxrenob,5,Gotta love R/investing praising this sweet 23.45 P/E market as a discount
2020-02-27 13:16:43,SandKey,6,"Today may be difficult for trading. With Futures being 40+ points down, do you buy puts on the S&P or calls?

If this was up 40 points, it would be an easier decision. But we're easily in an oversold condition from a technical standpoint so a lot of puts may quickly become very uncomfortable very quickly in the short term even if the markets continue to fall. 

Eventually, without fail, some of the big boys are going to swoop in for an easy payday and wipe all of the trades by mass lifting the markets by pumping and clearing the board. This will happen. So being down like this on a Thursday when a lot of people are going to be looking to close positions by the weekend is cause for second thought.  

I have a feeling that a lot of people with expiring 2/28 options might get trapped. Of course, I could be wrong. But markets opening so low usually confuses me. Especially when longer term downward momentum is most obvious."
2020-02-27 13:15:45,LiviuDragneaOfficial,2,10 year bonds on all time low
2020-02-27 13:03:42,SandKey,1,"Earning reports for the 4th Q are still coming back very positive. 

However, companies like Best Buy are having to revise outlook due to virus. So even with great Q4 earnings, share prices are flat or falling."
2020-02-27 13:02:18,HourPackage,6,SPY 290 today?
2020-02-27 12:59:51,ImagineThat710,2,$aapl 283.81
2020-02-27 12:57:07,perfectentry1,7,"Holy shit. This market actually starting to completely fall apart. Honesty, this is getting kind of scary. Obviously, we will rebound at some point, but FUCK."
2020-02-27 12:49:30,Omg-a-Turtle-17,1,"AIght bois, I still havent made up my mind on which travel stock to dip my toes in. I was thinking MGM p and maybe RCL p, maybe an airline instead? I was thinking of exp being next week"
2020-02-27 12:49:11,steven_1il,2,If my puts are exercised  tomorrow but I don’t have a margin account or assets what happens?
2020-02-27 12:48:40,catfroman,1,My $285P 3/23’s are PRINTING. Hyped for market open rn
2020-02-27 12:46:34,SugaryPlumbs,1,I sold my puts yesterday because holding overnight is stressful. Anyone expecting another morning bounce for cowards like me to jump back in?
2020-02-27 12:44:34,LiviuDragneaOfficial,3,"Vix nearing 30, almost surely will go over that. Was too young in 2008, glad I can live in a time we can live shitpost while the market ""disintegrates"""
2020-02-27 12:27:45,iWarnock,8,"As of 1h a lady that was infected, treated and cleared of the virus just raised the flags again after her release and tested positive again.. so this bitch virus is more persistent than my ex.."
2020-02-27 12:23:31,AgStacking,6,bulls r fuk
2020-02-27 12:05:17,GiannisFishesInMay,6,I'm very excited to find the bottom on AMD/MSFT and toss some money on them for Sep 2020 or January 2021 and watch my tendies grow.
2020-02-27 12:01:27,SitcomImBonanza,1,"Most things will never change....

Bears are still gay🐻🦄, people still get sick, Bulls have giant veiny dicks🥒🥒🦅🦅

Cash Gang=Pussy Gang"
2020-02-27 11:59:09,,0,This will definitely be you last chance to get in GOLD and GLD at cheap prices. Gold is going up and up during pre market and up over all.
2020-02-27 11:58:05,GiannisFishesInMay,0,Salty bulls out here downvoting lmao
2020-02-27 11:55:12,TheJokerInTheMirror,1,"Long $Rope then Short $Drop

https://imgur.com/a/CPXjyvV"
2020-02-27 11:49:44,,6,Holy shit I sleep 4 hours and y’all blow up the world
2020-02-27 11:45:08,Baconmessiah420,2,"[https://twitter.com/BNODesk/status/1232994445248712704](https://twitter.com/BNODesk/status/1232994445248712704) \- 75 New Cases in Italy, 2 New Deaths."
2020-02-27 11:43:56,wsb_mods_R_gay,8,Pour one out for MSFT call holders...rip
2020-02-27 11:32:43,Ardesic53,12,I just jerked off thinking of AOC wearing a white thong
2020-02-27 11:30:47,Cnastydawg,0,GDP and durables come out this morning might get a bounce off of that
2020-02-27 11:21:49,YaBoyRustyTrombone,6,i give up. selling my spy calls and buying very out of the money puts. fuck it
2020-02-27 11:17:06,TAWS,8,Just in: Virus is now in Athens Greece
2020-02-27 11:14:50,ek0209,-3,"I guess we’re bouncing at least 1,8% today. Still a bear but this drop can only continue big if we get somekind of a bounce"
2020-02-27 11:14:03,tea_anyone,7,How has SPCE stabilised at 26.5 after dropping to 25. Who on earth is buying this stock
2020-02-27 11:12:28,EEBucks,6,Joe Kernen is the guy everyone at CNBC talks shit about around the office
2020-02-27 11:11:37,mackoviak,5,"Ah, the US 10 Year down to 1.289% briefly"
2020-02-27 11:10:54,Regjohn,5,TSLA 420 eod
2020-02-27 11:09:05,Cnastydawg,5,When does FedRateCuts.exe kick in
2020-02-27 11:07:33,HumbleNoob,5,Corona virus task force. Assemble 🦅
2020-02-27 11:06:34,GeneralGay421,12,I need to purchase a firearm to protect my tendies
2020-02-27 11:06:20,cyberarc83,5,So buy spy  puts 279p for 3/13.
2020-02-27 11:05:58,bidenisretarded,7,"WHO no outbreak 

ok yolo put"
2020-02-27 11:05:57,bxgoods,1,Lk and baba green
2020-02-27 11:02:59,,18,"if you guys look at the charts. right after coronavirus was officially announced on jan 24th. all stocks took a dip, before mooning BIGLY for a month straight. this was all the funds getting the last maximum pump in before the dump exactly 1 month later on february 24. all calculated and orchestrated. they blamed it on WSB and retail traders, but nah it was them giving everything one last big pump before they start to dump. there was no reason for stocks to exponentially moon the week after jan 24 when the virus was announced. very legal"
2020-02-27 11:02:51,,1,"Need SPCE to keep dropping, my $30 puts looking great 😀"
2020-02-27 11:01:34,WillEinHausKaufen,6,bulltrap.exe
2020-02-27 11:01:26,DjengisKhanye,1,Hella shorting the Dax
2020-02-27 11:01:08,Millerman121,1,Too late to fomo into airlines puts till Friday??
2020-02-27 11:01:06,GodfatherofBullMafia,2,Dow implied -300
2020-02-27 11:00:59,ZT0931XK,7,TSLA secondary offering buyers underwater
2020-02-27 11:00:28,DerpySmirk,4,So much fear. Be careful folks.
2020-02-27 11:00:26,Connortbh,3,Seems like PTON is the move if people are going to avoid group activities. Plus the lockup that people were concerned about crashing the stock is over now.
2020-02-27 11:00:19,upyoursshill,2,"sp500 has to go  to 3070, if it breaks through support will try around 2900"
2020-02-27 11:00:09,down40kin6years,6,Just to update: corona virus is still a problem.
2020-02-27 10:59:46,wafflepiezz,2,SPCE pls drop below $20 by this week ty hedge fund bois
2020-02-27 10:59:34,poundofmayoforlunch,4,Futures are plunging.
2020-02-27 10:59:19,Cnastydawg,6,I’m still baffled that twitter is down 13% the last few days. It makes no sense considering that a social media company has no exposure to a virus and on top of that is probably doing better than expected on revenue because of the virus and traffic flowing to the site.
2020-02-27 10:58:45,JefBezosExWifesNewBF,5,Vix approaching 30.
2020-02-27 10:58:35,ZT0931XK,1,"If you're in INO may wanna give this a check. https://twitter.com/juliaskripkaser/status/1230869949591302144 

I don't have a spot looking at puts but I hate biotechs"
2020-02-27 10:58:14,edmocha93,1,Why tf flights so expensive right now?
2020-02-27 10:57:26,jprest12,5,"Ugh wish I held spy puts, sold on fear trump was going to just lie and pump last night."
2020-02-27 10:57:07,wordscaneverhurtme,7,"Wow, this dip really is nothing compared to the 5 year chart."
2020-02-27 10:56:55,mackoviak,4,So the US 10 Year is at 1.297% that seems normal and healthy.
2020-02-27 10:56:03,GodfatherofBullMafia,1,FLYT was just plugged on CNBC
2020-02-27 10:55:09,furrypurpledinosaur,3,I'm starting to run out of cash buying this dip. How many more layers?
2020-02-27 10:54:09,venderil,2,First case in Vienna. How do I long beans?
2020-02-27 10:52:46,TAWS,7,Kind of BS how the 10 year yield is at 1.3% but the 15 year mortgage rate is still at 3%.
2020-02-27 10:51:59,JPSpiller,5,Which will yield the most tendies out of $APT $INO and $GILD? Have already been on the $MRNA rocket since $21 and wanna diversify my bat soup portfolio
2020-02-27 10:51:22,komoggmu321,3,"China closed green, hopefully Europe brings it home"
2020-02-27 10:51:18,Mint_Juul,24,"Fixed Bloomberg

[https://imgur.com/a/NdFjSdL](https://imgur.com/a/NdFjSdL)"
2020-02-27 10:50:32,hello-world-foo-bar,7,"Circuit breaker today or tomorrow. All the boomers talk about at work is the coronavirus and their retirement being slammed.

I smell massive fear in passive investing."
2020-02-27 10:50:12,NSA_Official_Account,4,DAX is taking a beating right now
2020-02-27 10:48:47,Oakland_Trader,4,US 10 yr down 25bp in 10 days.....
2020-02-27 10:48:08,GiannisFishesInMay,8,"For anybody who was asleep or hasn't looked at the charts and thinks we're going up today:

SPY hit $305 during the night. We closed at $312 if you didn't remember. 

That's a massive fucking gap down. We will test the 200MA around $304 tomorrow if not today."
2020-02-27 10:46:03,teegacy,3,Shorting Germany
2020-02-27 10:45:03,JefBezosExWifesNewBF,10,I'm on a layover in San Juan PR. I'm going long those grey sweatpants that Rican girls love to wear that ride up and give them a weggie as they walk so it looks like your rubbing two cantaloupes together
2020-02-27 10:43:42,,0,Flat by open
2020-02-27 10:43:11,benjaminikuta,-3,How can I use derivatives to construct a double or nothing bet?
2020-02-27 10:42:17,Fineous4,1,Today will be a great day for bears!
2020-02-27 10:41:53,GiannisFishesInMay,2,This rally for the last ~2 hours is a pathetic pump attempt.
2020-02-27 10:39:27,D50UZA,-9,Buy #ESL #NYCT Now! (lSE)
2020-02-27 10:38:38,ch1p_skylark,-3,If SPCE goes to $20 I'm going long
2020-02-27 10:38:31,hello-world-foo-bar,-3,"After cruise ships and airlines, fast food has got to fall sometime.  Timing the right entry is hard because they can be supported awhile.

No ones gonna want to eat out.  Order delivery ppl are gonna pass that virus so a headline on that will kill takeout. But that could be months away."
2020-02-27 10:38:00,,7,remember when this sub used to be fun and memes about gambling losses or wins. now its fucking retarded /r/all fucks asking stupid fucken questions and being butthurt and not being able to take a small bit of shittalk even a fucken 10 year old could take. dont fucken post 21k comments in thread when 100% of em are fucken useless. ur just taking up space that could be used for breaking news by someone who has a fucken bloomberg terminal. instead ur asking if u should buy fucken spce or not when the run is already done blocking out the one fucken guy who has the bloomberg terminal giving us breaking news about bigly things
2020-02-27 10:37:53,IsaacMovieDude,3,What's a good 3-day holding position.
2020-02-27 10:37:05,OlaviX,5,Is $GILD gonna rocket?
2020-02-27 10:36:41,StopDoxxingMePls,3,"I got SPCE $20 and $21 puts for 3/6. Never thought it would actually get this close. 

Can't wait to see what bids/asks are today"
2020-02-27 10:35:35,_FundingSecured420,1,[The Bloomberg article on r/WSB is hilarious!](https://www.bloomberg.com/news/articles/2020-02-26/reddit-s-profane-greedy-traders-are-shaking-up-the-stock-market)
2020-02-27 10:34:34,RememberSLDL,0,"My EWY puts will moon at opening - hooolleee

https://www.bloomberg.com/quote/KOSPI:IND"
2020-02-27 10:33:54,gopoohgo,7,"US 10 yr broke 1.30.  

Yeah we fucked."
2020-02-27 10:30:46,al409,0,SPY 295 puts 3/20 - I just want to ride these baby’s to the ground. Should i go longer or 3/20 seems like plenty of time to continue drilling?
2020-02-27 10:30:32,ch1p_skylark,1,"wtf is this, 4th red day in a row?

theres no way this is legal"
2020-02-27 10:30:28,wordscaneverhurtme,12,Don't get too upset about your losses this week folks. If it makes you feel better I bought 10k worth of SPCE stocks last night and am still holding because I don't want to take the loss... holding till 2040 that is. Don't worry be happy. GL to everyone today and have fun.
2020-02-27 10:30:16,LMY723,10,"Hey boys, I did some actual research for once.

APT is being discussed because they are announcing loud and proud. If you missed APT, get in on LAKE. 

Attached is the revenue breakdown by segment from APT and LAKE. LAKE will scale wayyyyyy better than APT.

https://imgur.com/a/AA8Nmde

Other news: I went to sherwin williams and scalped some of the masks for tendies, and when I did the regional manager of a major city told me that the N95 masks are on backorder for 3 weeks from the vendor. 
Additionally, my friend who works in the emergency room said they are also having masks on backorder for at least 2 weeks. 

Long Coronavirus.

EDIT: LAKE has increased only 35.7% the past 5 days while APT increased 152.34%. LAKE is a nearly guaranteed thing. The reason APT is doing so hot is they were announcing their involvement in the coronavirus outbreak in early february. This looks too fucking good to be true. I'm all in."
2020-02-27 10:29:28,,10,"At least Indonesia, a country of 240 million people with thousands and thousands of Chinese tourists is safe and still hasn't found any infections  


The health minister said it's all because of their prayers   


allahu akbar"
2020-02-27 10:27:55,GiannisFishesInMay,1,Come back spy 305
2020-02-27 10:25:53,winkerpack,1,Peanut butter is a yummy low calorie treat you can put on almost anything if you're dieting 🤗
2020-02-27 10:25:44,mikes703,7,"My grandpa who is 94 and doesn’t speak English woke me up in the middle of the night asking to sell his stock.  He’s always the last to the news.  This is bottom sometime tomorrow.  He bought Tesla, it goes down the day after.  He buys PCG it goes down the next day.

Edit:  Thought I convinced him to sell but I went to check on him, he’s reading the newspaper and says it’s “fresh” news about the corona virus numbers and something about Iran.  He’s gonna sell Bank of America and Tesla at open.   While holding PCG and Home Depot."
2020-02-27 10:25:16,,0,Think of all that money sitting on the sidelines now
