date,author,score,body
2020-06-25 04:18:24,dawhizkid123,7,"PSA: Sweden has population of 10M. Stockholm has a population of a little less than 1M, about the same size as a mid-sized US city like Austin. 

Stockholm has a population density of 13,000 per square mile. This is similar to Boston. Compare to NYC which is 27,000 per square mile. San Francisco is 17,000 per square mile. 

TLDR everyone saying “lOoK aT sWeDeN” needs to chill cause they are tiny and their largest city is not dense at all"
2020-06-25 04:18:19,pback621,2,Opening at 309 lesssgooo
2020-06-25 04:18:18,JeSuisAmiralAckbar,5,"More than 1,000 Australian troops are being sent to Melbourne to enforce quarantine and help with testing and logistics"
2020-06-25 04:18:12,blackcoffee0123,10,everyone calling for 290's on twitter rn lmao. if I had puts id be shook. 2020 has shown us 1 thing. when everyone is short and calling a drop. we go up and blow their asses out.
2020-06-25 04:17:54,Hawkpro,5,Its funny i moved my 401k to bonds but lost 8k in buying calls.
2020-06-25 04:17:38,word55555,0,Futures Ba Ba Ba BLOOD RED...
2020-06-25 04:17:25,PoloNewt,4,Brrrrrrr uppies we goooo
2020-06-25 04:17:10,PutsTookMyMoney,3,Pumps just don’t last anymore... have spy calls and sold atm puts on KBH....
2020-06-25 04:17:09,dungbat83,4,Huge bear trap again
2020-06-25 04:17:02,HighNoonMonsoon,5,Elon’s “lol” tweet the last day was him being told there was a second crash incoming and TSLA would be back at $350 once again and also I have no fucking idea what I’m talking about
2020-06-25 04:16:56,kok823,10,"Why do ugly bitches wear the shortest shorts they could buy? No one wants to see their saggy, wrinkled asses in bed let the fuck alone in public."
2020-06-25 04:16:54,somanychins,6,If you say “green by morning” three times in the thread it actually happens
2020-06-25 04:16:47,MetalliTooL,4,When are we getting back into airline calls?
2020-06-25 04:16:39,190octane,3,"Imagine being a pro MMA fighter and having to make your money by being punched in the head.

It could be worse, you could be a bull and pay to get punched in the asshole instead."
2020-06-25 04:16:39,7FigureMarketer,3,"Thu: Red  
Fri: Green  
July: SPY 243

Load up on 8/21 puts Friday gentleman (and the few women that lurk here)"
2020-06-25 04:16:38,Stuupid,3,"I dont wanna toot any horns, but there's a iddy widdy bitty of some grass color coming in smirk 😏"
2020-06-25 04:16:04,Huckleberry_Ginn,3,"Why is there a weird optimism here? If wave 2 continues to come to fruition, we must surely reach near 275 spy? Even with stimulus and brr?"
2020-06-25 04:15:55,hockey_bettor,2,How much credence should we give that Sonos acquisition rumour?
2020-06-25 04:15:49,eyerollingsex,8,"Me: Alexa, play Futures ft. Lil Pump

Alexa: That doesn’t exist"
2020-06-25 04:15:42,dysonGOAT,4,Did SPY get a delisting notice?
2020-06-25 04:15:22,thedirewolff21,2,"I wonder if buying ual puts and JPM calls was a good idea.
Heres to hoping one can help me recover from a horrific last week"
2020-06-25 04:15:14,Mookypooks,11,God I hate my girlfriend. Cheaper to keep her around though
2020-06-25 04:15:08,red-chickpea,5,In this market I guess the only moves that consistently give good returns are on your mom
2020-06-25 04:14:50,Nomadic_Marvel07,3,"Did Disney rebuke its own statement and wait till 5:30 on Friday to say stupid shit?/s

Also I heard Disney is looking for a new press release adminstrative assistant."
2020-06-25 04:14:49,DankReynolds,6,Goddamn “it’s it” ice cream sandwiches are fucking crack cocaine.
2020-06-25 04:14:48,spysspy,4,I sold my SPY puts when it was only down to 306 today 🤡🤡
2020-06-25 04:14:40,KingAutist-0004,0,"Just got done hinge video calling being jacked off due to covid....had to do it 
BA 195c 6/26"
2020-06-25 04:14:39,TheCryptoDeity,2,Somebody poke spy with a sharp stick
2020-06-25 04:14:13,RichardFarter,3,Does TDA approve everyone for level 2 options?
2020-06-25 04:14:07,BottledMaster,6,"turning 21 in a few days, what whiskey should I get"
2020-06-25 04:14:00,ar1195,8,"Mandatory masks are the next step. They lower transmission rates and it’s the perfect balance between being safe, and reopening. 


Governors are gonna have three choices

1. Many people die, bad publicity, no reelection 
2. Do not reopen, many business’ fail, no re-election 
3. Open, make masks mandatory in any and every business. Low transmission, good economic reopening, best of both worlds. Certainly re-election. 


It’s not going to be a choice either. It’s a forced position we will be put in- and it’ll be great.

If we don’t force masks then after we reopen too many people will die and then we will have to shut down again"
2020-06-25 04:13:49,MrWSB,6,"Bought REIT leaps at close. 


Maybe that was a bad idea.

🚀🚀🚀🚀🚀"
2020-06-25 04:13:42,thegoldstandard55,2,"What's the consensus on NKE earnings.  Calls, puts or a theta gang play?"
2020-06-25 04:13:35,WestSorbet,2,"Why is TVIX, VXX, VIXY, etc. being delisted by Credit Suisse?"
2020-06-25 04:13:34,penguinkillah420,8,"🚨🚨🚨ATTENTION🚨🚨🚨

All bears, report immediately to your bank's ATM and withdraw the maximum possible! Together we will make them fail the stress tests!"
2020-06-25 04:13:19,kiwiatv,13,I built a gazebo today so I’m gonna get drunk and eat pizza now
2020-06-25 04:12:54,jessasch,3,If you buy calls on BA when companies like MSFT exist in the world you deserve to be broke
2020-06-25 04:12:42,zekeupnow,5,Did y’all know the more beers you drink the more drunk you get?
2020-06-25 04:12:25,Tbones014,9,Trump: oh I’m sorry. Did you think I meant Easter 2020? Haha my bad.
2020-06-25 04:12:24,SmugglerHanSolo,2,How is the growing FB ad boycott deal not giving a bump to TWTR? You’d think they’d pick up a little MO from that. No?
2020-06-25 04:12:17,PapaQsHoodoo,2,Goodick'ldodat
2020-06-25 04:12:14,getrektqqmore,4,I fully expect some random vaccine news premarket tomorrow
2020-06-25 04:12:05,Morty-c147,5,Will Disney crash more?
2020-06-25 04:11:45,Gxndhy,6,"Haven’t traded in 3 weeks, waiting on the second crash to load on puts"
2020-06-25 04:11:30,oddocorekt,5,"Lost everything on KO calls. Soda, i thought we were friends."
2020-06-25 04:11:27,jpowskid,18,"IF YOU THINK THE FED IS GOING TO LET BANKS CANCEL THEIR DIVIES AND CAUSE MORE MARKET TURMOIL, YOU DESERVE TO BE BROKE

BRRR"
2020-06-25 04:11:24,UsernameTaken_123,10,"If Spy opens green, red or flat, I will do nothing at all"
2020-06-25 04:11:18,Raccoonpug,8,What happen if i take acid during market hours with SPY dropping -5% ? Will i have a bad trip?
2020-06-25 04:11:14,Autistic_trash,2,Long AAPL and short Wirecard. Can't go tits up
2020-06-25 04:10:56,idsimon,0,Did bears go to bed after a hard days work or some shit. C'mon finish the fucking job.
2020-06-25 04:10:16,Noleova,8,"Raise your hand if you bought GNC calls.

Someone is bound to retire off of this ..."
2020-06-25 04:10:15,Sea-School,5,Imagine not buying calls EOD. You never learn bears
2020-06-25 04:10:13,blackcoffee0123,4,naschad only down .18% lol. yall really held your puts after -3% down LMAO
2020-06-25 04:10:09,openyourmindpls,0,PUMP 2020
2020-06-25 04:09:57,FlaccidEggroll,32,you ever lose so much money that you're afraid to even open robinhood
2020-06-25 04:09:55,Borozco,17,"Ever since me and my bitch ex broke up In February I’ve made more money than I ever have on options , bought a new bmw and graduating from college before her"
2020-06-25 04:09:50,degen1010101,-4,Can someone explain why NKLA is such a huge meme stock 🤣🤣
2020-06-25 04:09:45,dekbrner,3,Fuk fuk Fukkity fuk
2020-06-25 04:09:43,kiwiatv,3,Imagine not buying FSLY
2020-06-25 04:09:25,,1,SHREK JPOW
2020-06-25 04:09:11,Stuupid,7,"Should be a tax write off if for every dollar you lose on stonks you do an arm curl, pull up etc. Kill WSB obesity."
2020-06-25 04:09:08,wave_action,1,LUV 6/26 31p got a chance?
2020-06-25 04:09:04,Nukklz,3,Who the fuck is buying GNC after hours?
2020-06-25 04:09:03,arniepieindasky,1,So when will XLF get out of the toilet?
2020-06-25 04:08:59,numbnah,0,"Puts at 310-315 zone

Don't fight the roo."
2020-06-25 04:08:25,,3,I would be up so much if I hadn’t blown 90k on retarded 4 DTE options last week
2020-06-25 04:08:07,Insomniarch,2,Picked up more lvgo calls at close. Praying to the bull gods for a nice open.
2020-06-25 04:08:05,bacterialprostatitis,3,This market aint too bad. The swings are all within a certain range. Just buy spy calls / puts at the peaks. Will work until it doesnt.
2020-06-25 04:07:59,onlyeverdown,9,2020 is awful life is hell fuck the earth 😁
2020-06-25 04:07:27,Sea-School,31,Upvote if we’re green by open
2020-06-25 04:07:08,b1ackfyre,5,"I have bearish positions, but I bought more calls today to hedge. Futures so far aren't looking too good to the upside. We'll see what happens."
2020-06-25 04:07:06,Cwatson9373,2,Guna load up on AMZN calls either eod tomorrow or Monday.
2020-06-25 04:07:02,justafish25,16,"Why is like every other post “If SPY is green I’m gonna drink my piss,”. “If SPY opens red I’ll pick some fudge out of my ass and smear it on my face like war paint.”

Like wtf is wrong with you people"
2020-06-25 04:06:53,fiftieth,1,"Someone tell me why I shouldnt buy LEAPs on Delta Airlines. Stock is down 50% over the last year. Trading at a PE of 5.4. 

Why is it a retard play?? I cant find the reason"
2020-06-25 04:06:52,high4days420,5,Starting to like Webull the more time i spend on it. Hype to lose money on there
2020-06-25 04:06:49,avelak,7,"Broke even after digging out of a 10k hole on June 8th

Thought about selling it all and starting from scratch but got greedy and wanted to hold one more day... 3 weeks later I'm back down 7k after most of my calls expired worthless"
2020-06-25 04:06:42,DadINeedMoreMoney,10,"Goodnight boys, best of luck tomorrow!"
2020-06-25 04:06:37,www123x,7,Would you rim Jerome for 1000% return in one day?
2020-06-25 04:06:31,MoarTarriffs,7,[WSB prediction poll for tomorrow ](https://www.strawpoll.me/20430801)
2020-06-25 04:05:57,yosheroni,1,GBO
2020-06-25 04:05:48,UnwantedRelishMan,5,Someone ELI5 what this bank stress test is
2020-06-25 04:05:42,shit-escalates,17,"Got some puts, got some molly, Asian girl coming over tomorrow. Was a bear switched to calls but it didn’t feel right. Went back to puts, lost money but felt right. Overall feeling ok. Whatever side you’re on, Godspeed."
2020-06-25 04:05:40,durrrr___,6,Dude Elon stopped giving gold! Is it because Tesla had a few red days. 😳
2020-06-25 04:05:39,SilverSpirit7,1,PPT aka Dai Li from Avatar
2020-06-25 04:05:31,lgdamefanfanfanfan,0,"Isn't every single bear thesis rendered invalid if we just get a real vaccine? Like it's all over then. There is not a single obstacle in the way of SPY (and more importantly QQQ) reaching ATH and beyond. Maybe just 2020 elections but big money likes Biden too so idk.

Vaccine = bears in absolute shambles"
2020-06-25 04:05:13,King_of_Gremlins,5,Futures just bouncing around waiting for tomorrows news. I am jacked to the tits in puts though so might have to buy some beer and wait until europe opens
2020-06-25 04:04:49,Jmoon1997,2,On the APPL train 🚂
2020-06-25 04:04:38,shanish82,2,Maybe J wants the market to go down so that he can have the excuse to buy up all the shitty loans from his buddies
2020-06-25 04:04:30,neocoff,0,"https://robintrack.net/symbol/BRK.A

You mean to tell me that there are plenty of rich fucks on RH who are holding BRK.A?"
2020-06-25 04:04:25,OofStickyBot,2,"I would just like to say, My batch of Peach Crescendo Indica/Sativa strain I grew is by far the smoothest hitting shit ever. Tastes like fruit. But cotton mouth as a mother fucker"
2020-06-25 04:04:19,hockey_bettor,1,"Anybody in on ETSY? Heard its been pumping on masks? Masks now mandatory in some states, wonder if it'll keep pumping on that."
2020-06-25 04:04:16,staunch_character,11,"Imagine if RH gave traders a stress test like the banks. 

F"
2020-06-25 04:04:14,xKhaos420,3,"Are the high escorts any better than the cheap ones, I'm asking for a friend?"
2020-06-25 04:04:08,theta-dog-420,2,*jazz music*
2020-06-25 04:04:07,stuffandthings16,2,My calls really hope gdp and unemployment numbers are bullish because futures are currently making me sad
2020-06-25 04:03:54,,1,Huge green cocks
2020-06-25 04:03:46,CallsOnAlcoholism,17,"Was really debating sharing but feel the urge.

$505 -> $11.2k in a month. What a fucking rush.

https://ibb.co/S5dbqF6"
2020-06-25 04:03:38,skykitty89,6,"Sometimes I wonder how many comments I don't see from all the regards I've muted over time, or if they died or got booted. Also I'm sure no ones seeing this comment right now."
2020-06-25 04:03:02,Mynamejeff66666,9,My fear is that we open at 303 and stay at 303-305 all day
2020-06-25 04:02:55,vxzvxzvxz,1,"I got an idea. Everyone dontates $1 dollar I will proceed to yolo the total in spy calls or puts 5 dollars otm on Friday for the following Monday the play will be exited 1 hour before close. A Tuesday through Thursday vote will be taken to decide put or call. Following the first bet there will be a pole on Monday after hours deciding whether the profits will be distributed (or not if none) or if we will yolo into then next week.

Edit: I’m not setting this shit up. I’m relying on one of you savvy autism’s you don’t care about liabilities etc. this would be cool though"
2020-06-25 04:02:41,MemeticEntity,8,"*Jules Winnfield: Okay, so, tell me about these TSLA puts.*

*Vincent Vega: So what you want to know?*

*Jules: Well, TSLA puts are free money, right?*

*Vincent: Yeah, it's free, but it ain't a hundred percent free. I mean, you can't walk into any self respecting broker, get on margin, and use that to recklessly gamble. They want you to do that shit on Robinhood.*

*Jules: That's how TSLA puts work?*

*Vincent: Breaks down like this, okay: it's legal to buy it, it's legal to own it, and if you're the proprietor of a TSLA put, it's legal to sell it. It's illegal to buy it without money you don't have, but that doesn't really matter 'cause, get a load of this, all right; if you get stopped by Robinhood after you get margin called, they can't just take the money from you if you have it in another account.*

*Jules: [laughing] Oh, man. I'm going to do it, that's all there is to it. I'm fucking doing it.*"
2020-06-25 04:02:27,cool_BUD,7,I got spy 310c 7/2. Hoping for a rip up tomorrow. But with my luck were probably gunna tank
2020-06-25 04:02:13,bitteryw,17,Some bears that I’ve insulted in the past when I was a bull are now replying to my past comments with a “I told you so” 😒
2020-06-25 04:02:13,WestSorbet,1,Does anyone know what webpage exactly publishes the weekly job numbers? I want to keep an eye on it for tomorrow morning. Thanks.
2020-06-25 04:02:06,argc,3,I wish we had statistics on losses and gains. Mostly losses
2020-06-25 04:02:02,seancarr181,2,"If we go red tomorrow (we probably will), there is a 1000% chance we go green Friday. Regardless of what happens, Bears r fuk"
2020-06-25 04:01:49,sebas2ezz,1,Best investment/ market technical book someone recommend?
2020-06-25 04:01:39,Ijustquaffed,9,They’ve already shown that they will manipulate and provide false data with the jobs report a few weeks ago. Literally nothing is out of scope for them lmao
2020-06-25 04:01:36,spyaintnobitch,20,How do I sue Robinhood for giving me access to options?
2020-06-25 04:01:29,LordoftheEyez,2,Why didn’t I double down on Disney puts on the second bounce 😢 was perfect timing to complement a few of my zoom calls with more Disney puts
2020-06-25 04:01:29,ElvanKing,2,"Will BA hit 200 first or 150 first, that's the question"
2020-06-25 04:01:22,Year3030,0,"Hey bulls, ready to lose another 100 /ES points? :) Just watch"
2020-06-25 04:01:02,BaronJomini,7,"Tomorrow a lot of retards about to get crushed, aren't they?"
2020-06-25 04:00:49,Spuri0n,5,so are $DIS puts the free money play tomorrow morning?
2020-06-25 04:00:33,Ijustquaffed,4,PPT!!!
2020-06-25 04:00:24,dysonGOAT,6,How do I convert my paper money account into real money so I can financially recover from this?
2020-06-25 04:00:02,lolyeahsure,2,I'm betting on the inverse of y'all
2020-06-25 04:00:00,fireball23451,1,Naked forex is such a good book even for stocks
2020-06-25 03:59:51,Holysmokesx,4,Bears r fuk
2020-06-25 03:59:39,tradekaiser,48,"Only one thing is certain, Robinhood’s going to crash tomorrow."
2020-06-25 03:59:35,steatorrhoea,3,Are mortgage rates lower now? Last year I was quoted at 4.9%
2020-06-25 03:59:28,Huey_Long_Schong,3,"""I want the stock market fixed fastly, Jay"""
2020-06-25 03:59:20,Sea-School,-10,Upvote for red open and downvote for green open
2020-06-25 03:59:20,AceVonSpades,1,Has anybody here accidentally hit the screen share button on Pornhub? Did your parents see?  Please share lol
2020-06-25 03:59:17,theta-dog-420,-4,what is more gay: waxing your chest or buying puts
2020-06-25 03:59:15,DiogenesTheGrey,1,I just started wondering what type of multiple profit a person would have that bought $225c on SPY the day it hit $222 expiring next month. Currently $79 for the call.
2020-06-25 03:59:07,G23456789,0,"Ok there is no way hertz is green tomorrow, right? Please say yes"
2020-06-25 03:59:02,jpowskid,5,"OVERHEARD DAD SAYING THAT BANKS PASSED STRESS TEST AND THAT THEY CAN KEEP THEIR DIVIES. 

BEARS ARE FUK"
2020-06-25 03:58:51,italysky08,5,Fuck I’m going to need Trump and his puppets to manipulate some GDP and jobless claims data tomorrow
2020-06-25 03:58:37,skykitty89,-3,"Step on a crack, break your mother's back! Buy a put, break your mother's foot!"
2020-06-25 03:58:36,ASSU-WaZe,16,First time buying spy calls. If this opens green I'll get jpowed tattooed on my anis
2020-06-25 03:58:32,IMakeMyOwnLunch,2,Green by midnight
2020-06-25 03:58:00,chr1sthagod,2,"I held BA 162 puts overnight YOLO, am I cucked or am I printing??!"
2020-06-25 03:57:48,luist3k,2,This place doesnt look like Lucky Charms’ aisle no more
2020-06-25 03:57:38,Year3030,11,I just drove four hours listening to you degenerates on wsbsynth talking about dix and bulls anuses
2020-06-25 03:57:32,eyerollingsex,7,"Bear Gang: When does Printer stop and stonks go down?

JPOW: You can't expect me to divulge information that would put Bull lives in danger.

Bear Gang : Well, now JPOW, that's where you're wrong, because that's exactly what I expect. I need to know about Bulls hiding in them trees, and you need to tell me, and you need to tell me right now. Now, just take that finger of yours and point out on this here calendar where the bulls r fuk, how many's dollars we’re dropping, and when the printer stops.

JPOW : [puts his hand over his heart]  I respectfully refuse, sir.

Bear Gang : [a smack is heard offscreen]  Hear that?

JPOW : Yes.

Bear Gang : That's Sgt. Donny Donowitz. You might know him better by his nickname: ""The Bear Jew"". Now, if you heard of Aldo the Apache, you gotta have heard of the Bear Jew.

JPOW : I've heard of the Bear Jew. 🥵

Bear Gang : What d'you hear?

JPOW : He beats Bulls with a club.

Bear Gang : He bashes their brains in with a baseball bat is what he does. Now, JPOW, I'm gonna ask you one last goddamn time, if you still respectfully refuse, I'm callin' the Bear Jew over. He's gonna take that big bat of his, and he's gonna beat your ass to death with it. Now, take your bull retard lickin' finger and point out on this map what I want to know.

JPOW : [after brief pause]  Fuck you... and your Gay Bears!"
2020-06-25 03:57:32,trumpdiego,7,"Mickey Mouse will be in public domain in 2024 when his copyright expires. Doesn’t that effectively ruin Disney? Without the mouse, he’s nothing."
2020-06-25 03:56:53,udabess,-10,"Tin foil : IMO Rona possibly intentional. 8-10 yr busts on Fiat currency seems to be the norm. This time it doesn’t look like an inside job I suppose. Trumps alright with me for the most part, in fact his intention to cut into the entrenched bureaucracy was the first ray of political light I’ve seen in my lifetime.  However, the economic scene ain’t good and is there a more appropriate time for a second leg down then the worst earnings period in a decade? Politics/economics it’s just all one big manipulation, right? Oh yeah, has there ever been a V shaped recovery for a drop of the March magnitude?"
2020-06-25 03:56:40,NotMe357,11,Why is there so many people in here that want to drink their piss or eat dog shit if they don't get what they want? lol. Sometime it feels like that people in WSB got some kind of fetish lmao.
2020-06-25 03:56:28,bigfellas,6,The question now is what will cause millions of millennials to fully withdraw their money from the market? The answer to that is the next big drop.
2020-06-25 03:56:07,tubby_LULZ,4,"Help me daddy bezos, you’re my only hope"
2020-06-25 03:55:58,G23456789,1,"If we go red tomorrow, what is there to expect? If we go green tomorrow, what is there to expect? Nothing leads to anything..."
2020-06-25 03:55:52,TheChimpKing,11,"I spent 50k on BA shares at 200, AMA"
2020-06-25 03:55:49,freehouse_throwaway,9,"my rona bear play if reopening ever hits a real snag. both  RH and LULU made me retarded amounts during the feb/march dive.

* RH puts. the valuation is nuts and they are saying they're gonna expand into bullshit like hospitality and restaurants (the fuck). problem is Jan puts are already pricing in either a total collapse or further short squeeze. (WSM is a good alt candidate too if you dont want the crazy option premiums). they've paused their buyback program so a lot of this valuation was driven by short squeeze and reopening rally. % float short has reduced signiifncalty from 30% to 22% from end of May to Mid June.

* LULU puts. betting against becky made me tons during the first dive and lost me tons during the rally. current valuation is ridiculous and their last ER shows that DTC can only carry them so much. being a pretty woke brand, they are the type of retailer to consider reclosing if rona gets outta control. positive catalyst continues to be online growth, men's line, and international expansion (Asian stores are all gucci, so only the US can fuck this up).

other plays to consider:

* W short shares: Wayfair is a rough oen and its a rona fav even though their ER continues to be dogshit. put premiums are pricing in collapse so its gonna be tough to time this one unless you're willing to pay big bucks for time and go with a debit spread. shorting shares seems better. short float % is still significantly high.

* BBBY short shares: i think this is an easy one not just in rona reopening fail but in actual economic impact. cheap debt may make them out live your short share position tho. they are a good short if they go above $12 imo.

* MIK short shares: any price point above $8~$10 is worth considering imo. this thing crater to $1 and has recover quite a bit. positive catalyst: current ""newish"" CEO is from TGT and was working on restructure and a path to house brand to make $$$ before rona hit. negative catalyst: reality of situation and a post COVID world. they were up 56% earlier this month during reopening hype as small caps really started roaring back but has faded quite a bit.

all of these might be moot tho as we're in a world of cheap money/debt. just ideas to consider if a correction ever happens."
2020-06-25 03:55:36,trumpdiego,4,Welp at least there’s Albertson’s ipo on Friday to lose the rest of your money on. Wish it was albertacos instead.
2020-06-25 03:55:17,Cj96734,0,"u know when you call wolfgang in cologne and u get that weird 2 ring ring (like at the end of that pink floyd song)? anyway, someone wake him up, the un-poors are going to need him and his eurofag friends to buy stonks"
2020-06-25 03:54:55,626reppin,6,Yo Srs where are these green dildos coming from
2020-06-25 03:54:55,Panda_Pineapple,10,honestly a good time to continue to average into long term positions
2020-06-25 03:54:54,littlephinger,3,"Going to have to see where the market moves tomorrow, but I’m wondering if anyone is considering $RAMP and $ORCL calls? Apple making the IDFA opt-in will surely make LiveRamp’s IdentityLink and 3rd party data even more valuable."
2020-06-25 03:54:37,MrCryptoBoi,21,This is like a group meeting for gambling addicts. I love you all
2020-06-25 03:54:06,shanish82,9,"Went to go buy crack from my dealer and we got to talking about todays sell off and traded thoughts on our moves tomorrow while hitting the pizo.
This is the top
7/2 269p"
2020-06-25 03:53:56,bacterialprostatitis,9,Didnt some fucker promised to eat dog shit if spy hit a certain level? Wtf happened? Did he own up or what?
2020-06-25 03:53:47,hockey_bettor,2,NET calls tomorrow?
2020-06-25 03:53:32,IMakeMyOwnLunch,6,Congress has one month to extend the unemployment benefits before shit hits the fan.
2020-06-25 03:53:29,TrantMerris,9,"I called my nikkei in Hokkaido. 

All he said was “Gojira”. 

Bigly green tomorrow bois."
2020-06-25 03:53:28,Happy-Teddy24,1,Auto mod is shit
2020-06-25 03:53:20,Dedent98,9,God Im fucked. Why did I sell those puts and bought calls eod
