date,author,score,body
2020-06-03 21:20:25,notarandomtrader,1,SPY 310p 6/5
2020-06-03 14:17:32,Difficult_Cook,1,"Haha, if only I bought options. PLAY 15's oh la la."
2020-06-03 14:15:32,Difficult_Cook,1,"Squeeze me, make me short bad stocks."
2020-06-03 12:48:05,OverallPriority,1,MGM - MIGHT GO MOON 🌝 📈📈📈📈
2020-06-03 01:59:10,sid_lwa,2,I have $800. You’re my financial advisor - what are we doing with it tomorrow?
2020-06-03 01:54:19,frykobs,1,[https://www.youtube.com/watch?v=6fwNtCKbrMM](https://www.youtube.com/watch?v=6fwNtCKbrMM)
2020-06-03 01:36:11,pennystockplayer,2,"I hope people flock to MGM like BLM on a small business. 

20c 7/17
17c 8/21"
2020-06-02 22:08:29,BOOGNISH_IS_REAL,2,Chad bought DKNG calls a month ago and now Brad is buying them. Beware.
2020-06-02 19:58:04,I-got-options-,1,Fomo’d TIF puts. Bout to lose big after contracts adjust tmrw lol.
2020-06-02 17:22:53,,1,Spy 1d puts for the close. Thinking 305p 06/03
2020-06-02 17:04:59,Difficult_Cook,-1,"Oh Mark Smith thinks RGR is an 80 bucker. Where are we rioting err, shoplifting err, borrowing and burning tonight?

How about the lib's burbs for a change."
2020-06-02 16:29:39,foshizzlemyjonas,3,Su Bae about to take AMD to ATH after this small correction
2020-06-02 15:51:19,,1,GE 7p 06/05 looks very appealing.
2020-06-02 15:50:55,bbq-ribs,0,"shit spy @ 300 with .25 interest rates != spy @ 300 with 2.25 interest rates. Spy's yesterday price is really 60, put holder would of been rich"
2020-06-02 15:44:16,hallwaysoffat,-6,"‘You’re retarded’ - nice retort. 

Oh by the way, I shot a fat load on your mom’s face last night and yelled ‘your son’s retarded!’  

We both laughed."
2020-06-02 15:44:09,,3,"I am not even sure if Trump  and Fed want the market to be this high, given the divide between rich and poor and what it does to this country.  And yet, SPY is making its way to ATH."
2020-06-02 15:42:09,,1,Fuck is this shit. Market can have one  certain red in weeks?
2020-06-02 15:25:57,Mitt_Candunk,1,WRTC GREEN DILDO
2020-06-02 15:05:48,drkgla,1,S&Pee?
2020-06-02 15:02:43,BullSheiss,1,"Anybody know if there is a mass hacking of media pages going on? I tried to access CNBC,  Fox News and CNN news just now and they all say ""IP address cannot be found""..."
2020-06-02 15:00:26,drkgla,1,wut in tarnation
2020-06-02 14:41:38,vegaseller,-2,"Spy calls in the brokerage         
Ar-15 on the lap.           
Feels good to be American"
2020-06-02 14:01:08,vxzvxzvxz,1,Sell or hold baba 6/5 call?
2020-06-02 13:48:49,WeOutOrNah,2,holy dick i pulled out at 907 ty papa elon
2020-06-02 13:46:15,packman0321,2,TSLA to 1000 🚀
2020-06-02 13:43:14,Doobyashtray420,1,Sold 25% just now. Will sell 25% Thursday. Ride 50% thru earnings
2020-06-02 13:34:39,OblivionXBA,2,"WORK opened pretty damn high but being dumb right now. Good thing I sold! But, I gotta buy this dip!!!"
2020-06-02 13:28:20,POOTERSS,3,"so facebook had a ""virtual walkout"" what does that even mean..."
2020-06-02 13:05:32,balloonhi4000,-1,"#BEARS: fuck Woah Vicky

#BULLS: fuck Becky quick"
2020-06-02 13:00:04,balloonhi4000,2,"I bet the cops are possess fuck to the Minnesota cop

Most just wanna do their job and go home"
2020-06-02 12:56:35,CurtHolls5,2,Hopefully today I don’t fat finger my way into +10 DIS calls instead of +1 and lose all my buying power
2020-06-02 12:55:51,Chilleeen,1,Let’s go casinos
2020-06-02 12:45:26,Naureal,1,Green like goose poo. So good for the environment. Bulls rise up
2020-06-02 12:36:57,balloonhi4000,1,#THETA GANG ASSEMBLE
2020-06-02 12:34:56,WeOutOrNah,6,Honestly ill suck elons dick for a roadster
2020-06-02 12:33:25,iuntitledi22,0,We are so fucking green today!!!!!!!!!!!!!!!!!!!!!!!!!!!!!
2020-06-02 12:31:34,Navit916,2,MGM calls?
2020-06-02 12:27:31,enter57chambers,3,Indexes fake pumping and now getting ready for the dump into open??
2020-06-02 12:08:15,ThePeoplesBard,3,"God damn, even with all this green all my 6/19 calls are probably not going to get ITM. The recoveries of LUV, MGM, NCLH, and BUD are lovely but steady, not spikes. I should probably sell them while they still have pipedream value bc one red day this close to expiry could make them worthless."
2020-06-02 12:02:54,LoudLou24,1,What the fuk happened in my sleep holy green
2020-06-02 11:42:31,pancake2708,8,if it holds that would be the ninth green day in a row for the S&P. crazy times
2020-06-02 11:35:33,balloonhi4000,9,Bears fucked
2020-06-02 11:29:19,yeahman64,2,What the fuck happened to Zoom yesterday?? This shit is unreal
2020-06-02 11:28:52,krolicea,7,Damn docusign just won’t stop
2020-06-02 11:27:46,yeahman64,3,"SSL goddamn those premarket orbital boosters, is this the return of oil already?!?"
2020-06-02 11:15:59,lululemonhead,2,Some market mavens are not buying the rally. Magellan co-founder Chris Mackay has quietly turned extremely bearish on equities; Jeremy Grantham's GMO says the bull run is divorced from reality.
2020-06-02 11:15:34,istike29,1,Zoom? Millions of dollars went into it only yesterday. Crazy
2020-06-02 11:10:46,domokun89,2,Who else hates money enough to buy puts on ZM. Goddamn retard strength with the current economic climate.
2020-06-02 11:08:23,walasjert,6,In the federal reserve we trust 🤑🤑
2020-06-02 11:05:03,Arcanne,3,Greeeeeeen
2020-06-02 11:00:34,jimmyolsenblues,18,"##GOOD MORNING BEARS

WAKE UP.

TIME TO DIE"
2020-06-02 11:00:01,pajumajo,4,My 6/19 $MSFT 200 calls are going 2️⃣🌙
2020-06-02 10:59:02,cheesetouch2,10,Fell asleep at -.7% and woke up at +.7%
2020-06-02 10:58:26,lululemonhead,7,"6 per cent.
That is the amount by which analysts expect Wall Street’s earnings per share to fall in the fourth quarter of 2020 from a year earlier.
Just 6 per cent. That’s it. That’s how mild the market expects the impact of the biggest global economic hit in a generation to actually be."
2020-06-02 10:54:37,youreaditfirst,10,Fuck CNN they make me feel like an old racist white guy
2020-06-02 10:53:09,m77w,6,Late to the party but Homeland really good
2020-06-02 10:50:29,calebrowland98,5,Am I dreaming or is spy at 307
2020-06-02 10:47:53,Vinyyy23,15,Reformed bear here...much easier to buy calls and watch stonks go up.    The red futures to green is hilarious by morning
2020-06-02 10:39:21,jefferiesthrowaway,9,"Well, already no point in opening any social media today boys unless you wanna get irritated by simpletons. 
Good thing we have our stonks 
#greendaytuesday"
2020-06-02 10:37:50,CASUL_Chris,2,Does WORK have more to run?
2020-06-02 10:37:37,Dillzer8,2,Will TSLA break $900 today?
2020-06-02 10:34:39,StopDoxxingMePls,2,MMs really are running away with this money.
2020-06-02 10:33:04,Ankel88,3,"guys, let's brainstorming  all possible stocks affected by sports re-opening.. apart from donkey kong and disney..

Let's make a shit load of money from it.

No way they are gonna delay it any further."
2020-06-02 10:30:50,Vinny32295,1,"SBUX cut worker hours, should be Bullish no?"
2020-06-02 10:27:37,Fuckedchildsupport,3,Gan woke up with a hard on at 5am
2020-06-02 10:26:49,Viromen,3,So it seems the market won't leg down on these riots but will moon once the riots end. Makes sense.
2020-06-02 10:26:48,reddituserzerosix,2,How far out did people get PFE? I got Jan 21
2020-06-02 10:26:09,Vinny32295,6,I have so many random position open in different companies. I think today’s the consolidation day to close some out and refocus
2020-06-02 10:24:18,CASUL_Chris,8,DKNG waking up
2020-06-02 10:23:22,bradleykirby,5,Joe Kernan is unusually sober and lucid this morning. Proud of him.
2020-06-02 10:23:13,lululemonhead,10,"Lady friend of mine literally just got into stocks over the dippy doo dah months, she’s turned 60K into 180K in 2.5 months...she wonders why she didn’t do this easy shit earlier...heaps of newbies are doing it."
2020-06-02 10:23:09,btoned,2,DKNG and SNAP looking good this morning boys.
2020-06-02 10:22:51,ShinyPants45,2,I wish I stuck with airlines
2020-06-02 10:21:38,AnonymousAstro,2,Is it too late to jump into YEXT? Best strike?
2020-06-02 10:18:27,LiquidEijs,-2,This might dump a bit at open.
2020-06-02 10:18:08,Bryant570,1,What stocks are effected by NBA
2020-06-02 10:18:02,Ban_787,1,Why isnt TSLA mooning????
2020-06-02 10:17:58,Surfincloud9,8,"Damn someone really killed a US Marshall last night. These idiots are barking up the wrong tree. By Wednesday these cities are gonna be fully militarized and by Friday silent. Market going up cause they know once the government unleashes their full power fun and games immediately over. 

Even hating on Wendy’s man. Wendy’s is the shit"
2020-06-02 10:17:30,nomadofwaves,3,"Lol


https://twitter.com/pdpj/status/1267676130984763393?s=21"
2020-06-02 10:16:26,Treehugger2344,2,National guard + cops cracking skulls = strong country get ready for an even bigger bull run then we've been seeing
2020-06-02 10:16:22,PeakOfTheMountain,2,What time is the vtiq rocket liftoff?
2020-06-02 10:16:21,robstar211,3,"Anyone here on the vtiq/NKLA train to oblivion today? Made something tasty tendies yesterday, hoping they can make meat green today!
40 EOD"
2020-06-02 10:13:03,houseatreides1776,-5,"There’s no way these Antifa pussies haven’t been infiltrated by the CIA. I bet they allow them to play their little games, but have multiple assets that stop the big shit 🛑 🤚"
2020-06-02 10:13:03,infamousnj69,5,Bought calls yesterday thinking what the fuck am I doing buying this during a pandemic/looting/recession/rioting/race war/mandatory curfew. Actually am legit surprised SPY is pumping lol
2020-06-02 10:12:20,Vinny32295,5,"Ho-lee-fuck, BIG GREEN!"
2020-06-02 10:12:10,ozud100,1,When Occupy Wall Street?
2020-06-02 10:10:32,Skwigle,21,"You have probably seen some of the shockingly horrific riot videos online. At first I thought it would get better but the more videos I saw the more I realized it wasn't going to get better. I tried to bite my tongue but I can't stay silent anymore. It's just too much. Someone needs to speak out against these atrocities because as humans it's everyone's responsibility to take action when no one else will. So here I am, making a public plea to stop all this insanity. Please, for the love of all that is good, STOP SHOOTING LOW-RES VERTICAL VIDEO!!!"
2020-06-02 10:10:10,AnonymousAstro,14,"“Dow futures rallied as investors focused on the economy reopening despite civil unrest”

Thank you, CNBC, for the wonderful analysis"
2020-06-02 10:10:02,sh1t_trader,1,Please hold up MSFT so I can offload these shitty calls
2020-06-02 10:09:34,Shuffleshoe,4,Why are people rioting? Did they miss the fact that the Fed is printing money and everything is fine again?
2020-06-02 10:09:14,ThePenetrations,17,"Check twitter:
Cops being shot and run over

Think:
Uh oh. Looks like it got worse. My calls are fuk

Check futures:
Green as fuck, smile and go back to sleep"
2020-06-02 10:09:09,Dominis-s,15,Wonder what South Park has cooking up for this season
2020-06-02 10:08:18,PeakOfTheMountain,8,Where the fuck is our boy Kanye
2020-06-02 10:07:50,maxvesper,5,PPT will never let us down
2020-06-02 10:07:34,RandyCrane17,12,"Donkey Kong opening at $45, VTIQ at $40. I’m gona be fucking rich biiiitch. No more stupid PDT rule. FTW!!!"
2020-06-02 10:07:33,Covert_elite,6,You guys think July 320c are a good idea? They seem pretty cheap rn and like a good play
2020-06-02 10:06:39,ebfeebfe,5,Scientists discover teargas cures and immunize against COVID19. Europe to announce riot-stimulating policy called Green-Tear. SPY 400c 0619
2020-06-02 10:06:33,Klacker,3,I like to think we are trading in the year 2069 thanks to the market's forward thinking
2020-06-02 10:05:37,Treehugger2344,8,Good morning retards the market is about to moon today due to the bullish riots and looters 🚀🚀🇺🇸🇺🇸😎😎 get ready for calls to print and bear to be fuk
2020-06-02 10:05:10,Covert_elite,1,"Dear msft, pls hit 200 by eow. thank you"
2020-06-02 10:04:53,throwaway60501,6,"Looting is fucking retarded and for ignorant, retarded, and useless poor people (if you can even call them that) . MGM 18c 6/19."
2020-06-02 10:04:42,carlians,5,Bid at 44 on DKNG 🤩
2020-06-02 10:04:06,urmomsboyfriend6969,7,"Pathetic dip early, 310 EOD"
2020-06-02 10:04:03,JefBezosExWifesNewBF,4,"Stay at home stocks are hot again. We'll get a good run. Then ""rotate"" again"
2020-06-02 10:03:58,Mrivera45,3,White people scared in Manhattan LOL
2020-06-02 10:03:37,RayCashIsTrashDalio,11,"bears keep whining about how the market keeps going up wah wah wah. but you do realize you need big fucking balls to be a bull right now right? bulls are buying calls in the middle of the worst fucking sequence of events to unfold ever. there could be a rug pull any second, which has almost happened many times these past couple of weeks. so before you bears start bitching about how spy needs to be at 100 try having the balls to buy calls for once. at the very end of the day, if you're too scared to buy calls dont whine about how spy is overvalued. cause all you are is a big pussy. you think the market is that easy? short when things look bad and buy when things look good? no. you need to throw ur brain out of the window and have steel fucken balls to make money in this market."
2020-06-02 10:03:20,AmbitiousSingh,11,"I bought 2 SPY 300 06/05 puts just for the hell of it but doesn't look like those are gonna hit. But if a pandemic, mass rioting, and civil unrest doesn't make this market go red, then there's no point in buying puts anymore. Just ride the calls train until one day when it just suddenly stops."
2020-06-02 10:02:32,okaw,3,"Damn, bought calls on Friday morning. Sold Monday morning. Shoulda held some. Oh well let's try and day trade a morning rally."
2020-06-02 10:02:28,RPMayhem,5,Markets rally after the protests stop covid19
2020-06-02 10:01:43,RandyCrane17,9,We’re hitting 310 today boys
2020-06-02 10:01:02,yayahi,5,"Just so you guys remember, there’s an immense pile of cash banks/hedge funds are currently sitting on. This goes up anymore, and they’ll be forced to buy in or risk underperformance. Already managers on average have piss poor returns for the year. 

If u think shit is overvalued rn, wait till we get a blowoff top and spy hits 400 by eoy. Wouldn’t surprise me"
2020-06-02 10:00:36,esisenore,5,Any put buyers have a only fans they wanna shill. I know times are tough.
2020-06-02 10:00:19,Ankel88,4,who's of the opinion that all sports will be super pushed to re-open AT ALL COSTS since it's the only way to keep those rioters at home?
2020-06-02 09:58:33,dogleg88,1,SNAP 6/5 20c
2020-06-02 09:58:24,J_Powell_Ate_My_Ass,14,I'd like to thank all the dumbass rioters who are proving Coronavirus was another fearmongering attempt by the media
2020-06-02 09:58:12,PauperGod,14,How do these protestors expect me to respect their cause if they can't even save my puts?
2020-06-02 09:57:56,jok178,1,"Fuck MA over 1% pre market, makes me happy in my pants"
2020-06-02 09:57:27,plasticblock4dayz,4,"Anyone else ever go risk-off only to have markets rally a bunch? Then when you go risk-on, market drills like a mofo or trades flat?"
2020-06-02 09:57:13,Patriotnation5,15,If you're still buying puts I never want to run into you in a dark alley. Absolute psychopaths.
2020-06-02 09:56:41,doublebeatloaf,4,Just got my day trades back. Too late to FOMO into VTIQ?
2020-06-02 09:55:42,Thommywidmer,8,Lmfao it never fails
2020-06-02 09:55:10,Klacker,18,"This has been an extinction level event for bears, JPow not even letting them have bread crusts st this point"
2020-06-02 09:54:51,gopoohgo,6,"Huge sector rotation is continuing.  

Financials, energy, travel and leisure, car cos all up bigly PM"
2020-06-02 09:54:50,2ezHanzo,10,"REEEE HOW ARE WEEE GREEEENNNNN

-Bear currently r fuk"
2020-06-02 09:54:31,thetruerythm,4,Woke up just in time to close my /ES longs on that pop 😎
2020-06-02 09:54:06,amm0s,15,CNBC: Dow futures rallied as investors focused on the economy reopening
2020-06-02 09:53:14,,7,VTIQ calls print today baby
2020-06-02 09:52:59,,2,ATVI puts - they banned players for supporting Hong Kong protests
2020-06-02 09:52:50,thesnukeIL,0,"Anyone watching $FIS ? most dominant processor for merchants world wide, and amazing company overall. thinking of going long"
2020-06-02 09:52:12,yayahi,6,"Gay bears just happy they ain’t holdin puts on big Green Days 

Meanwhile bulls fuckin their wives & laughing all the way to the bank 😭😭"
2020-06-02 09:52:08,flyingeverywhere11,7," NBA vote Thursday

Edit: still looking out for MLB"
2020-06-02 09:52:06,Soon2beonthestreet,0,If we open around 309 I'll pick up a few 6/19 300p at open stop lose 311 exit 306. Probably going to feel JPow 9 inch green dildo though
2020-06-02 09:51:21,high4days420,-2,"And i was right on the money


https://reddit.com/r/wallstreetbets/comments/gurxgt/what_are_your_moves_tomorrow_june_02_2020/fsllbyu"
2020-06-02 09:50:36,jmc774,1,Dump VTIQ at open?
2020-06-02 09:50:02,JunSnu,3,My vix calls are sad
2020-06-02 09:49:51,nosalute,20,Wow everything is so cheap on facebook marketplace. 8k TVs are going for 100 bucks
2020-06-02 09:49:35,botulism69,0,How TF are we green?!
2020-06-02 09:48:54,JefBezosExWifesNewBF,7,GOOD MORNING🌅 TODAY we make massive money on VTIQ. 🥂🥂🥂🚀🚀🚀 Don't forget to give to charity. I can't believe I'm going to have such positive memories of this time while so many other Americans are suffering. I WARNED YOU NI🅱️🅱️AS. GOTTA DO YOUR DD
2020-06-02 09:48:34,wsb_mods_R_gay,10,China stuns jpowell with the old but reliable 1-2 soybean slap - jpowell counters with a bigger printer...OH and it looks to be a knockout!
2020-06-02 09:48:33,life_sized_hotwheel,25,"\>be bear

\>Finish watching big short

\>turn on news, America on fire

\>market crash incoming

\>remember big short, buys puts

\>easy money

\>browse autotrader, search lamborghini

\>check futures, red

\>feelsgoodman.jpeg

\>remeber, don’t dance

\>go to bed

\>wake up, futures are green

\>stare at futures until market open

\>market opens, dips a little

\>shit’s gonna tank

\>candles shoot back up

\>ohshit.png

\>post losses on reddit

\>bunch of retards give me reddit awards

\>made more money on reddit awards than I ever did trading

\>MFW I’m technically hedging my losses with reddit coins"
2020-06-02 09:48:26,Kevinyeungg,1,tesla predictions today? too late to fomo into calls?
2020-06-02 09:48:13,RayCashIsTrashDalio,6,"ITS NOT TOO LATE TO BUY CALLS AT OPEN!!!! EUROPOORS ARE UP 3%!!!!!!!! IF EUROPOORS CAN BE UP 3%, AMERICH MARKETS CAN BE UP 5%!!!!!!!! USA USA USA"
2020-06-02 09:48:03,mccrrll,9,Thank you dear lord for finally giving me the strength to ignore all rational thought and buy calls last week.
2020-06-02 09:47:35,qwertyaas,5,"I think I figured the cheat code. 

Buy anything on Friday other than short/put.

Profit on Monday."
2020-06-02 09:46:28,LecteurIntrouvable,1,Strong resistance at the $900 mark for Tesla. It’s struggling to stay above it
2020-06-02 09:46:20,_parallaxis,3,Drop at open
2020-06-02 09:46:13,bleeeeghh,2,Jerome carpet bombing futures with moneyyyyy!!!
2020-06-02 09:45:30,RayCashIsTrashDalio,6,from -0.7% to +0.7%. fuck me shouldve loaded up on more CALLS!!!
2020-06-02 09:45:25,visionarymind,1,#🇺🇸💵🇺🇸 ℹ️💲 💐⚰️
2020-06-02 09:45:16,goalsandbowls,0,Any good vidya games that have come out recently? Got a bit tired of Warzone and just beat Maneater
2020-06-02 09:44:59,j4rd7n,0,Why haven’t I went all in calls yet
2020-06-02 09:44:26,flyingeverywhere11,1,"ITM on MGM, good work market"
2020-06-02 09:44:04,Rianis96,-7,America is a joke country now
2020-06-02 09:43:39,mikis9,1,"This is so nice! We need higher difference!

[https://i.imgur.com/wL2PZu7.png](https://i.imgur.com/wL2PZu7.png)"
2020-06-02 09:43:39,Fishyace,1,Thanks AMD for being awesome! Sue bae if you’re watching I salute you
2020-06-02 09:43:11,96ZJ,6,"man those green dildos are unreal. Are any of you guys seriously buying at these prices? This is ridiculous! I just wanna load up on calls every eod, but can't talk myself into it."
2020-06-02 09:42:52,redepression20,3,Just fucking dip below 3k like a good ponzi so us trapped bears can get out of this shit for good
2020-06-02 09:42:46,learningtosail,3,Europe is jacked to the TITS today
2020-06-02 09:41:53,Milkoway,4,Can we slow down a bit! Geez 🙄
2020-06-02 09:41:40,2ezHanzo,5,Pour one out for all the gay bears who went to sleep with hope because of red futures
2020-06-02 09:41:35,xXMeebleXx,3,That bid ask spread on DKNG 🍆💦
2020-06-02 09:41:20,ShinyPants45,2,I knew better than to touch dvax
2020-06-02 09:41:06,Gagex,2,Realistic price target for DKNG?
2020-06-02 09:40:30,SoberCharlieSheen123,3,Futures nice and green
2020-06-02 09:40:29,Rianis96,4,"imagine thinking 307.58 is fair price for spy currently, seriously just fuck off"
2020-06-02 09:39:44,calamana2019,1,is there any reason to sell 6/19 SPXL calls that are ITM or just keep riding?
2020-06-02 09:39:34,LiquidEijs,4,"Well my fellow degenerates, its boom or bust for me now. Nasdaq hits 9800, i'm out. It was a fun ride, enjoyed discussing with my fellow retards on this thread, but this bear is about to die."
2020-06-02 09:39:20,sculpin_aficionado,3,I wish I could understand these little communist fks who run around breaking shit all day but half of them are pathetic 18 yr olds who don't even know why they are there in the first place
2020-06-02 09:39:19,blacksteveman,4,"I bought a spy call yesterday. Is this what it feels like to be a bull?  I'm already up 10 percent on it, so like 110 percent more than my puts"
2020-06-02 09:39:00,yayahi,7,"every fucking analyst: ""no way we get a v recovery- U or L shaped recovery""

qqq: hold my beer 

seriously how does anyone take these nerds seriously is beyond me"
2020-06-02 09:38:23,whyislifesohardei,2,"GSX up 9% pre, never shorting a Chinese ponzi ever again"
2020-06-02 09:38:16,TheLastAckbar,2,Wow this is ridiculous.
2020-06-02 09:37:49,PrestigeWWinc,6,So 3100 by open or nah?
2020-06-02 09:37:02,RonDonJohnson69,1,"Thoughts on $ZUO earnings play? Subscription market shouldn't be hit so hard, but they are still down heavily from pre-covid while other cloud players rose, and they just got SAP's cloud CFO"
2020-06-02 09:36:36,analyst_84,5,QQQ $1 away from ATH
2020-06-02 09:36:36,globohydrate,1,"Went to bed thinking my calls would broke me, just woke up and saw that I am whole"
2020-06-02 09:36:31,whyislifesohardei,1,DOW 26k by EOW?
2020-06-02 09:35:53,_parallaxis,-2,Sell in may and go away. Bulls r fuk
2020-06-02 09:35:48,nosalute,18,"We here at \[company name\] feel your pain.

During these hard times, \[company name\] wants to assure you that we stand with you and have every intention of continuing to make a profit off of your purchase.

We hereby guarantee to always do our best to publicly declare our support for whichever opinions will make you keep liking us.

We hope this action encourages you to view \[company name\] positively without expecting anything from us"
2020-06-02 09:34:08,smallchimpu,2,So y'all have stocks in your portfolio aside from from options?
2020-06-02 09:33:48,DrippinMonkeyButt,2,"https://www.reddit.com/r/PublicFreakout/comments/gv128k/uhhhhhhhhhh/fsm7wix/

It seems like piles of bricks being placed in cities all over the country.

Sooo......  place acme brick co calls."
2020-06-02 09:33:22,BigGreenCandles,3,I’m not one for holding calls overnight but those damn $SPY weeklies are paying. Make money while you sleep.
2020-06-02 09:33:22,dbo199523,1,I’m stuck bag holding ULTA $245c 6/12. -15k right now. I have 5k left in equity. Hold for another week? Sell and save my 5k? All the analysts raised ULTAs price point even tho they missed earnings by -300% but I can’t see ULTA going up in the next 2 weeks.
2020-06-02 09:32:12,benndover_85,6,"The WSB riot chant:

What to we want? 
MARKET GAINS! 
When do we want them? 
DAILY!

The difference between WSB and all the poor people chanting for shit in the real world? We actually get what we want.

To the fuckin' moon Alice 🚀🚀🚀"
2020-06-02 09:31:57,Ratty-fish,1,"Damn MGI, be cool."
2020-06-02 09:31:43,randomhotguy35,8,Give me a moment in history where the US was in a worse situation than they are today.
2020-06-02 09:31:17,deathspiral217,4,"Going on a trip, won't be able to trade for a few days.

Anyone wanna manage my account for me"
2020-06-02 09:30:24,goalsandbowls,1,If BA can actually keep its gains till the end of tomorrow I will nut
2020-06-02 09:30:04,Droidvoid,5,"Y’all hear that? It’s the sound of silence. Bears are all gone meaning we could very well be near a pullback here. I’m as long as the next guy, but not hedging you’re longs as NDX nears ATHs is silly. A double top is likely, especially with SPX approaching 3100 where it failed after the initial drop. Yes I get it BRRR BRRR, we can resume to that shortly after a small drop."
2020-06-02 09:29:53,IHateMaxRoyalGiants,2,"https://www.usdebtclock.org/#

Which of the spending categories relate to the market the most?"
2020-06-02 09:29:30,Kevinyeungg,3,too late for tesla calls at open?
2020-06-02 09:28:43,Spuri0n,1,"LOL what a beautiful sight to wake up to. Granted we will probably slide by premarket, my pre earnings tech calls love this green"
2020-06-02 09:28:39,nosalute,5," If you get deployed in Washington as a national guardsman all they give you is a stick😂

*Here 🥢*

wtf do i do with this?

*tell people to get back*"
2020-06-02 09:28:30,austinblacknj,1,💪🐭📈
2020-06-02 09:28:08,DinglerBerries,3,Rip to that dude who put his life savings on ZM puts last night
2020-06-02 09:27:53,Mrivera45,1,Green at open?
2020-06-02 09:26:40,j4rd7n,3,Went to sleep when this was at -.6% lmfaooo bro I don’t even understand anymore
2020-06-02 09:24:44,thxfrthmmry,-2,"If my TSLA puts print I’m gonna buy myself a MP5 clone, or an HK’s if it prints bigly"
