date,author,score,body
2020-09-02 04:39:44,junkrattrap,0,Trevor Milton the type of dude that tries to strike up a conversation in the shower at the gym.
2020-09-02 04:39:17,Cretin___,3,NVDA 555c 9/4.....gonna print?
2020-09-02 04:39:12,BuyThoseDips,10,Elon if you’re reading this just know I have faith and will not sell
2020-09-02 04:38:48,somanychins,3,"Puts on NFLX, calls on Cobra Kai as a hedge."
2020-09-02 04:38:44,xDeltaVx,4,u think barron thinks abt smashing melania
2020-09-02 04:38:12,samaritan1331,3,"Trevor Milton the type of guy who joins the comment section,  won't even scroll and keeps bragging about how annoying these comments are"
2020-09-02 04:38:11,billbrown96,-1,"Lol - a 2005 episode of always sunny talking about my boy Tommy B!

Even Jeff Bezos wishes he was Tom Brady"
2020-09-02 04:38:02,Dumberjack,9,My body just wakes me up at 1 am now to check futures
2020-09-02 04:38:01,python_js,6,Trevor Milton the type of guy who asks his friend to smell his breath after gargling mouthwash
2020-09-02 04:37:48,TimCooksButtBuddy,-2,Trevor milton the kinda guy to inspire an entire community to have a sexually charged jealousy and hatred towards him
2020-09-02 04:37:38,Houston_swimmer,8,Trevor Milton the type of dude to shush the class when the teacher stepped out of the room then point out the kids who told him to fuck off to the teacher
2020-09-02 04:37:31,Lokyeezy,4,"Trevor Milton the kinda guy to reply all with just ""Thanks"""
2020-09-02 04:37:31,HoneyBadger308Win,14,This thread is trash smh
2020-09-02 04:37:27,pilotbots,0,Trevor Milton the kinda guy to use this thread for actual investment advice
2020-09-02 04:37:10,Mooseinpoose,3,"Okay need a good play to yolo on some time mid next week. My plan is 240 fedex calls for earnings the following week, play the run up sell most calls let some run and then yolo on that for Tesla battery day. Literally can’t go tits up am I right"
2020-09-02 04:37:08,devodid,7,Nasdaq has literally never had a monthly candle outside bollinger bands this should mean something but it just keeps going up man
2020-09-02 04:36:09,NovelOrganization5,20,Jesus fuck the covid test absolutely rapes your nasal cavity
2020-09-02 04:36:04,poundofmayoforlunch,1,Trevor Milton announces he will be selling all of his shares and will be moving to Jamaica.  Claims he wants to smoke weed everyday and watch Seinfeld reruns.
2020-09-02 04:35:59,rustyryan27,8,"Tonight i learned who the CEO of Nikola is.

Also that he is a vanilla cuck with a bad taste in... everything... except his wifes boyfriend."
2020-09-02 04:35:51,J-Lam,6,Going to grab some INTC calls at open and maybe a few more AAPL calls as well. I want some NVDA but premiums seem high.
2020-09-02 04:35:47,electromojo,0,"I’ve seen a lot of pro Michael Jackson stuff recently on Reddit and Twitter

Y’all think he fucked those kids?"
2020-09-02 04:35:35,all_day_jayy,5,Trevor Milton's stock too high imo
2020-09-02 04:35:28,robbinhood69,6,"After seeing ZM go fucking ham af, I think it's clear the market has gone full idiot again

What would be the absolute worst company to yolo into that is reporting earnings in the next few weeks? It's gotta be a company that should no way be at it's present value, with insiders selling every day they get the chance and a long list of competitors with superior products and deeper pockets

IDK when NKLA's earnings are but honestly this is the only ticker I can think of that could be any more idiotic than ZM"
2020-09-02 04:35:23,insight-out1,3,Trevor Milton is the type of dude to take a shit and pee between the seat and bowl.
2020-09-02 04:35:16,dragoniteVS,4,I think I'm just going to buy calls for all the major tech earnings. At least one of them has to announce a split after what happened to AAPL/TSLA
2020-09-02 04:35:01,ohmy420,10,Trevor milton the kinda dude that asks a female employee in target to help him in the underwear aisle
2020-09-02 04:34:58,cbjerke18,6,Trevor Milton pees sitting down
2020-09-02 04:34:52,Jackprot69,6,Hi. I bought ZM puts today. 🤡🐻🤡🐻🤡🐻🤡
2020-09-02 04:34:51,waylon106,-2,Spy nasdaq calls are similar to tsla 🍏 calls *without the risk*
2020-09-02 04:34:47,Tonku,8,Trevor Milton the type of dude to jerk off thinking about your mom after you confessed to him that you jerked off thinking about his mom because he's the type of dude that does something because someone else does it.
2020-09-02 04:34:45,misterjefe83,8,this entire year and options have ruined me.  even making like 5-10% in a day and it's nothing.
2020-09-02 04:34:41,JMSeaTown,-1,"Hey Trevor Milton, keep rolling your eyes over these comments, perhaps you'll find a brain back there."
2020-09-02 04:34:37,AceVonSpades,2,"Oh, that guy earlier wasnt kidding. 

https://www.marketwatch.com/story/this-stock-market-metric-has-correctly-predicted-presidential-election-results-since-1984-11598986959?mod=home-page"
2020-09-02 04:34:35,crap___shoot,6,Trevor Milton is the type of dude to come to this subreddit and see all these posts and laugh out loud (even though he's alone) as a defense mechanism.
2020-09-02 04:34:33,Snoo1726,1,$GSX announced earnings and a SEC investigation and internal audit. Long dated puts are basically a guaranteed return now. Wonder how the market will react.
2020-09-02 04:34:26,TimCooksButtBuddy,5,Trevor milton has a couple billion
2020-09-02 04:34:22,understood_head_nod,3,Short calls on apple
2020-09-02 04:34:13,mcdoty,4,Why don’t people understand that Stonks. Only. Go. Up.
2020-09-02 04:33:44,theta-dog-420,2,ouf SLV whatchu doingggg
2020-09-02 04:33:28,alex21turner,3,Trevor Milton would go into a deep depression if he saw all of this shit
2020-09-02 04:33:21,Nate_Doge,4,Wtf is going on with Trevor Milton? I’m at work rn
2020-09-02 04:33:12,RedDreadsComin,13,Too many people here thinking they are funny
2020-09-02 04:33:09,python_js,0,"Trevor the type of guy to come back from a week-long vacation in New Orleans and pronounce the name of the city as ""Nawww' Leans'"""
2020-09-02 04:33:04,ProOrlando,-3,Futures are gay right now
2020-09-02 04:33:03,kxtrader,-3,futures looking good so far
2020-09-02 04:32:54,richhomie66,5,"WORK 35c 9/18

INTC 51c 9/18"
2020-09-02 04:32:44,VacationLover1,15,"Dear WSBs Janitors (I mean mods) 


Please quit circle jerking one another and purge half of this sub. Keep me though, it hurts my feeling when you ban me 


Thanks
VL1"
2020-09-02 04:32:43,RunYoJewelsBruh,-1,"Everytime you go to Trevor Milton's house, he is playing """"You Got Served"" on every TV."
2020-09-02 04:32:40,Shacreme,7,Trevor Miltons wife's boyfriend is Elon Musk.
2020-09-02 04:32:36,MasterChief118,4,Trevor Milton is the type of guy to tweet that his stock price is too low
2020-09-02 04:32:34,TimCooksButtBuddy,1,Guys u/SolitaryEgg is back🤩🥂 king bear hows it hangin?
2020-09-02 04:32:26,Prize-Trip,0,Trevor Milton is the type of guy to ask you to explain what’s going on in the movie to him every 3 minutes even though you’re both watching it for the very first time and you know just as much as him
2020-09-02 04:32:13,python_js,-6,Trevor Milton the type of guy to be strangely attracted to women who look like his mother
2020-09-02 04:32:05,Houston_swimmer,6,Trevor Milton the type of dude to say “sector rotation” every time the nasdaq is down .3%
2020-09-02 04:32:03,callsnputsallday,11,"Someone logged into my Robinhood from New Orleans, didn’t those fucks just get hit by a hurricane but didn’t take anything. I changed my email should I do anything else ?"
2020-09-02 04:31:41,throwAwayMyCsDegree,1,Anyone have positions in MAXR?
2020-09-02 04:31:31,Desert_Hawg,5,Trevor Milton type of guy to cuss his mom out when he has friends over
2020-09-02 04:31:29,goatiger,1,"Why we hating Trevor Milton? I’m in, just need to know why"
2020-09-02 04:31:27,KRONOS_415,4,"https://i.imgur.com/2LN9wy6.jpg

Had a great day today."
2020-09-02 04:31:19,lordscoby,-2,I have made nothing but free money on Levi's spreads
2020-09-02 04:31:02,Shacreme,4,Trevor Milton is the type of guy who would save his fish from drowning.
2020-09-02 04:30:52,python_js,-1,Trevor Milton the type of guy to like the direction the story took based on the leaks for The Last of Us Part II
2020-09-02 04:30:48,BullShiterey,1,DOW CRUSHING this week you autist bears go hibernate until your nuts shrivel into a raisin
2020-09-02 04:30:27,EwNotLikeThat,4,"So you're going by ""Trevor Milton” now nerd? Haha whats up douche bag, it's Tanner from Highschool. Remember me? Me and the guys used to give you a hard time in school. Sorry you were just an easy target lol. I can see not much has changed. Remember Sarah the girl you had a crush on? Yeah we're married now. I make over 200k a year and drive a mustang GT. I guess some things never change huh loser? Nice catching up lol. Pathetic.."
2020-09-02 04:30:15,billbrown96,17,"OMG Jeff Bezos is xyz richer this week - so unfair!

Just buy stocks mofos - you can literally be a poor version of him"
2020-09-02 04:30:04,diddycorp,5,"Almost everything went wrong today, thought I was going to get fired, pipe burst, then AC broke. Only thing that went my way is the market. If this keeps up for a while longer I’ll be out of a job and it won’t matter. Calls on my finances, puts on the rest of my life."
2020-09-02 04:29:59,sleeper_crypto,-2,Trevor Milton is the kind of guy who thinks Will Smith is a titan of hip hop
2020-09-02 04:29:50,Lokyeezy,-6,Trevor Milton the kinda guy to tell you how much TSLA has gone up
2020-09-02 04:29:47,Houston_swimmer,-7,Trevor Milton the type of dude who’s a Netflix adaptation of Elon Musk
2020-09-02 04:29:45,EatTacosDaily,5,Trevor Milton is the kind of guy who speaks louder when talking to blind people.
2020-09-02 04:29:00,ruld14,-3,Here's a Podcast by NPR about our retardedness. [https://open.spotify.com/episode/0ourTSytT1KwtEPNRipInf?si=Hpwjop5nRbCFEcatcq9tZg](https://open.spotify.com/episode/0ourTSytT1KwtEPNRipInf?si=Hpwjop5nRbCFEcatcq9tZg)
2020-09-02 04:28:59,thrusher,11,Trevor Milton actually thought season 8 of GOT was great
2020-09-02 04:28:55,G23456789,6,This is peak shitposting
2020-09-02 04:28:49,Financeguy33,1,Tomorrow I start my attempt at full time pajama trading. Wish me luck gentlemen
2020-09-02 04:28:42,G23456789,1,OwO UwU OwO UwU
2020-09-02 04:28:35,all_day_jayy,6,"Oh, hey there...
Well since you asked, I could use a TSLA & RKT mega pump. The TSLA is a fomo/dbl down and the RKT is just good business. 
Lil help plz."
2020-09-02 04:28:26,electromojo,8,Trevor Milton the type of guy to be good a photoshop and convince the Americans public to give him a billionaire dollars to make a fake truck
2020-09-02 04:28:18,Verystablegenius11,9,Why is everyone talking about Trevor Milton?
2020-09-02 04:28:16,bigkev2569,17,Trevor Milton is the type of dude who buys 26k in SPY puts expiring the next day
2020-09-02 04:28:09,xKhaos420,24," I saw Trevor Milton at a grocery store in Los Angeles yesterday. I told him how cool it was to meet him in person, but I didn’t want to be a douche and bother him and ask him for shares or anything.
He said, “Oh, like you’re doing now?”
I was taken aback, and all I could say was “Huh?” but he kept cutting me off and going “huh? huh? huh?” and closing his hand shut in front of my face. I walked away and continued with my shopping, and I heard him chuckle as I walked off. When I came to pay for my stuff up front I saw him trying to walk out the doors with like fifteen Milky Ways in his hands without paying.
The girl at the counter was very nice about it and professional, and was like “Sir, you need to pay for those first.” At first he kept pretending to be tired and not hear her, but eventually turned back around and brought them to the counter.
When she took one of the bars and started scanning it multiple times, he stopped her and told her to scan them each individually “to prevent any electrical infetterence,” and then turned around and winked at me. I don’t even think that’s a word. After she scanned each bar and put them in a bag and started to say the price, he kept interrupting her by yawning really loudly."
2020-09-02 04:28:05,RunYoJewelsBruh,3,Bravo WSB.  Good times....good times.
2020-09-02 04:27:58,EatTacosDaily,11,Trevor Milton the kind of guy who leaves the toilet seat up when he is done.
2020-09-02 04:27:54,LeoFireGod,-1,What if VXX just tanks tomorrow wouldn’t that be neat?
2020-09-02 04:27:48,zeeubermensch,8,Trevor Milton the type of guy to take a shit with the seat up
2020-09-02 04:27:30,PutsTookMyMoney,4,Trevor Milton and I are bff’s!! Y’all jealous
2020-09-02 04:27:30,poundofmayoforlunch,9,Trevor Milton pops his collar during zoom meetings.
2020-09-02 04:27:27,SnortinDietOnlyNow,13,Trevor Milton's favorite comics are  Amy Schumer and Dane Cook
2020-09-02 04:27:24,thrusher,7,Trevor Milton is the character in movies that only saves himself but eventually dies in a fucked up way
2020-09-02 04:27:13,ohmy420,5,Trevor Milton the kinna guy that doesn't poop before a rafting trip and makes everyone wait for him halfway through
2020-09-02 04:27:13,DeanYerdon,-3,"Any of you watch Game of thrones? Thinking of starting it, heard the last couple of seasons were whack but still down to give it a go"
2020-09-02 04:27:07,Houston_swimmer,10,Trevor Milton the type of guy to be a never nude. Rockin’ then jorts at all times
2020-09-02 04:26:55,pilotbots,11,Trevor Milton the kinda guy to think the song “WAP” is about FETTY WAP
2020-09-02 04:26:55,Prize-Trip,7,"Trevor Milton is the kind of guy who says “thanks, you too!” when the movie theater worker tells him to enjoy the show"
2020-09-02 04:26:51,Mitesite,10,Robinhood fucked me over this morning I’m switching to TD
2020-09-02 04:26:31,AyeeTerrion,13,So what’s up with this tik tok? My MSFT calls are being starved
2020-09-02 04:26:28,shacoand2boxes,9,Trevor Milton is the type of guy who cancels his doctor appointment because he is sick.
2020-09-02 04:26:28,v1truvian,4,"

They fucken killed Pat Tillman, didn’t they. Shot him right in the back because he was just too good, too special, and stood out like a sore thumb in a sea of mediocrity. And no I am not playing Tilly’s earnings."
2020-09-02 04:26:08,VirtusInjection,7,Anyone else here still out of a job? I got out of the Marines 4 months ago and still waiting for my government job to start. Shit sucks. Am I the only one
2020-09-02 04:26:07,ElonTaxiDriver,3,Trevor milton the type of guy to watch Lifetime movies
2020-09-02 04:25:45,Rjeezy858,1,So NKLA weeklies ?
2020-09-02 04:25:31,Kensmash619,9,Trevor Milton stands and slow claps at the end of hallmark movies.
2020-09-02 04:25:22,ITS_MAJOR_TOM_YO,13,Trevor Milton is the kind of guy who beats a joke to death
2020-09-02 04:25:16,alexneeeeewin,4,How do I get approved for options on fidelity zzzz
2020-09-02 04:24:53,Houston_swimmer,10,Trevor Milton the type of dude to get on a freeway at 55 mph then cut over in front of you while you’re driving 70 without using a turn signal
2020-09-02 04:24:49,flying_ina_metaltube,8,What's up with this Trevor Milton bullshit? People butt hurt that he gave away shares to his employees?
2020-09-02 04:24:48,Desert_Hawg,10,Trevor Milton type of guy to jack off in your shower
2020-09-02 04:24:47,byeungc,6,trevor milton the type of guy to eat his own cum after jacking off
2020-09-02 04:24:47,EwNotLikeThat,5,I. DECLARE. TREVOR MILTON!!!
2020-09-02 04:24:45,sleeper_crypto,4,Trevor Milton is the kind of guy who goes on Maury and is not the father
2020-09-02 04:24:37,bitteryw,6,Trevor Milton is the type of guy to shower with no clothes on
2020-09-02 04:24:35,AdditionalPyl0nz,7,Trevor Milton is the kind of guy to use tacticool speech while playing CoD.
2020-09-02 04:24:30,samaritan1331,4,"Gonna scrape all of these ""trevor milton the kind of guy..."" and make a pdf tomorrow"
2020-09-02 04:24:25,ElonTaxiDriver,3,Trevor Milton the type of guy to double park that motherfucker sideways
2020-09-02 04:24:24,ilivehereyouleave,9,Calls on big knockers
2020-09-02 04:24:19,shacoand2boxes,10,Trevor Milton is the kind of guy to try to shake hands with a blind kid.
2020-09-02 04:24:17,Baadllama,1,TRMN
2020-09-02 04:24:11,_klighty,5,“Found” some buying power. Which LEAPS am I picking up?
2020-09-02 04:24:03,Kensmash619,11,Trevor Milton's favorite Star Wars character is Jar Jar.
2020-09-02 04:23:57,RunYoJewelsBruh,3,"This fucking reply tho🤣🤣🤣  guy is a fucking champ.  
  
https://www.reddit.com/r/wallstreetbets/comments/ikrr8t/what_are_your_moves_tomorrow_september_02_2020/g3oksr7?utm_medium=android_app&utm_source=share&context=3"
2020-09-02 04:23:56,thrusher,8,Trevor Milton is the kind of guy that likes big nipples and floppy vaginas
2020-09-02 04:23:54,tal_i_ban,4,Trayar Miltard the type of guy use a blow dryer to dry his whole body rather than a towel
2020-09-02 04:23:53,eyestrikerbaby,2,"https://youtu.be/XzPXUAbXZv4

He basically predicted where we were heading back in June to a tee. Can’t fuck with Marky Mark"
2020-09-02 04:23:37,billbrown96,5,Trevor Milton buys Tesla puts
2020-09-02 04:23:33,69_420_69_420-,3,Trevor Milton = Elern Mersk?
2020-09-02 04:23:31,Oh_no_bros,9,Trevor Milton the kind of guy who pumps his own stock and leaves you bagholding
2020-09-02 04:23:28,ElonTaxiDriver,5,Trevor Milton the kind of guy to buy high sell low
2020-09-02 04:23:27,TheBabush1,5,Trevor Milton sits when he pees
2020-09-02 04:23:21,arkorous,9,My biggest losses have been from buying puts. Never again.
2020-09-02 04:23:20,PutsTookMyMoney,-4,Trevor Milton is the type of person I’d hang out with
2020-09-02 04:23:05,BluePuts,11,Traver Milkcarton the dude that park in a handicap spot without a handicap sticker
2020-09-02 04:22:57,JMSeaTown,7,"Born on a mountain, raised in a cave, fightin and fuckin, is all I crave"
2020-09-02 04:22:57,HolderofFour,8,"For every guy on here making big gains someone lost a shit ton life changing money chasing a dream they want see themselves in. After I hit my target of 1.5M, I’m done! Going to live by a lake somewhere in the Midwest and focus on my hobbies."
2020-09-02 04:22:48,seven0feleven,8,Trevor Milton is the kind of guy who upvotes every other Trevor Milton comment.
2020-09-02 04:22:43,ohmy420,14,Trevor Milton the kinna guy that doesn't pull all the way up after ordering at the drive through and the speaker asks your order from 10 feet away
2020-09-02 04:22:34,SkuxxMyster,6,"I almost forgot to mention: I went deep in the red after some stupid plays at the start of my options career. I bottomed out in July and finally made my way back into the green just a few days ago. Hopefully it’s all up from here. 

I’ll see you boys in the morning"
2020-09-02 04:22:33,Blackhawk149,2,What in the world are the marketing people at Walmart thinking? Walmart+ is a total ripoff of Disney+ ? Don't they have a creative/marketing team. Anyone that work at WMT corporate want to chime in?
2020-09-02 04:22:28,dmej,6,I’ll gold everyone in this thread if Trevor Milton isn’t mentioned for 15 min
2020-09-02 04:22:27,joefromdownstreet,6,45x RKT $44 9/18 calls for tomorrow. Either rich or dead fam
2020-09-02 04:22:22,cesrep,2,"#ELI5: What do I have to do for my job to be to convince risk averse strangers to give me hundreds of thousands of dollars in exchange for a 5% annual return so I can make that on two calls, set it aside, and gamble with the rest to buy myself a yacht?"
2020-09-02 04:22:16,pilotbots,2,Trevor Milton the kinda guy that would do a desk pop at work 🔫
2020-09-02 04:21:53,ElonTaxiDriver,8,Trevor Millton the type of guy to test positive for covid 19 and try to keep it secret and hang out with his loser friends anyway
2020-09-02 04:21:48,G23456789,0,"Best pick up line.   
“They call me big Vince, I’ll let you know why they call me BIGGGGG ( ͡° ͜ʖ ͡°), you got a name?”"
2020-09-02 04:21:41,learningorsomething,4,So does this mean NKLA will go up tomorrow?
2020-09-02 04:21:40,python_js,9,Trevor Milton the type of guy to open pornhub and type “personality” into the search bar
2020-09-02 04:21:27,shacoand2boxes,5,"Trevor Milton is the type of dude to lick his fingers, while flipping a page, on a iPad."
2020-09-02 04:21:17,samaritan1331,4,r/NikolaCorporation need to check these comments. Those fags ban if you say these in there
2020-09-02 04:21:17,Dredog83,9,Trevor Milton is the type of guy that wears crocs when he has sex with his boyfriend
2020-09-02 04:21:16,tal_i_ban,10,Trevor Milton the kind of guy to put a loud exhaust on his 2003 lowered Honda Civic
2020-09-02 04:21:12,bcoop29,8,What’s the deal with Trevor Milton
2020-09-02 04:21:10,Houston_swimmer,16,Trevor Milton the type to buy calls then post “sorry guys we tankin’ I just bought calls”
2020-09-02 04:20:58,EwNotLikeThat,4,Trevor Milton is the kind of guy who microwaves fish in the office kitchen
2020-09-02 04:20:58,Bubbledood,4,Trevor Milton the kinda dude that moans when he poops
2020-09-02 04:20:50,zestykite,1,my boss talked to me about a hot new EV stock to buy into.... NKLA. this is the top boys. cash it out.
2020-09-02 04:20:45,Semithedog,5,"There should be a book of “trevor milton the kind of guy..” jokes 🤣

Loving some of these comments btw"
2020-09-02 04:20:45,Trappin-Shoes,2,Holding my 535/545c 9/11 TSLA debit spread
2020-09-02 04:20:43,mfortney43,5,Y’all laughed at me when I brought up my INTC 10/16 52.5 calls a month ago oh how the turntables
2020-09-02 04:20:37,Desert_Hawg,6,Trevor Milton type of guy to shorten your name without asking
2020-09-02 04:20:25,throwaway21342134213,8,"What’s the difference between Trevor Milton and a bag of shit?  


The bag"
2020-09-02 04:20:02,dedmanspartywastaken,9,Trevor Milton the type of dude that puts the milk in the bowl first then pours the cereal on top.
2020-09-02 04:20:00,Baadllama,5,Trevor Milton the guy to bogart the joint and tell a story
2020-09-02 04:19:47,Nomadic_Marvel07,-2,The world doesn't make sense because AAPL keeps going up. They litterally do not do one thing better than monopolize the nich market they own to be dumb. Which they are.
2020-09-02 04:19:28,ProOrlando,3,When do you ever see three hourly candles like that on the NASDAQ futures. We’ve gone flat for three hours and haven’t moved more than a 10 point range
2020-09-02 04:19:25,Itsme_eljefe,5,"Why doesn’t this guy just give up? Lol. 

https://reddit.com/r/wallstreetbets/comments/ikek5e/i_am_known_as_the_market_crasher_and_i_will_buy/"
2020-09-02 04:19:22,leftyjef,6,Trevor Milton is the kind of guy who cries at double rainbows.
2020-09-02 04:19:08,EwNotLikeThat,6,Trevor Milton the kind of guy who eats the skin off fried chicken and leaves everything else on the bone
2020-09-02 04:19:01,Webfarer,5,"Lol you guys, wtf did trevor milton dooooo?"
2020-09-02 04:18:57,python_js,8,Trevor Milton is the type of guy to have a room in his $32m mansion specifically for crying
2020-09-02 04:18:56,poundarr,16,Trevor Milton the type of guy who gets bit by a zombie and hides the bite mark from the rest of the crew.
2020-09-02 04:18:56,ImHereForTheTshirt,6,"When I do cardio, I think of every fucking time I got called “big Chief” when I was fat. 

If anyone in my real life figures out how much that triggers me I’m fucked."
2020-09-02 04:18:56,Desert_Hawg,2,Trevor Milton type of guy to buy redbottoms after listening to Future
2020-09-02 04:18:53,carlians,2,"Should I stop now? While I’m ahead? Feel like I’m gonna lose it and regret it.


https://imgur.com/a/2ldRxhl"
2020-09-02 04:18:44,swshrXX,8,Trevor Milton the kind of guy to remind the teacher about the forgotten homework
2020-09-02 04:18:43,NeuteredTestis,3,Trevor Milton the guy to sue the paramedics for saving his life
2020-09-02 04:18:36,IveGotNoOtherOptions,6,We get so high we go to the moon - QQQuavo
2020-09-02 04:18:32,cutiesarustimes2,3,Watching some news. Watching them report that the murder rate is up in 69 cities. I always wondered if violent crime rates was a better indicator of economic health than something like unemployment.
2020-09-02 04:18:28,toughc0okies,9,"it is not our job to predict the market

the market is omnipotent and the most intelligent being that exists

it is only our job to listen to it and to please it

it wants more calls"
2020-09-02 04:18:28,hoobaacheche,3,DD: The name is literally Rocket companies. Where you think the rocket s gonna take the company’s stock price to? To the moon! 🚀🚀🚀
2020-09-02 04:18:28,pilotbots,5,Trevor Milton the kinda guy to ask the teacher if they have homework before being dismissed
2020-09-02 04:18:27,Really_Very_Expert,3,"Would you rather:

Wear an astronaut helmet with a tube leading to a funnel covering Chris Christie’s asshole and sucking his farts

or

Breathe in air at the covid ward with no mask?"
2020-09-02 04:18:17,joesmamma98,2,aapl 140c 9/11
2020-09-02 04:18:13,r2----d2,5,"Wake up Trevor milton, wsb is celebrating you"
2020-09-02 04:18:13,adeladazeem,2,Someone bought/sold $8m worth of WMT 11/20/20 150p today.... what's the sentiment here?
2020-09-02 04:18:09,Houston_swimmer,12,Trevor Milton the type of dude who doesn’t carry all his groceries from his car in one trip.
2020-09-02 04:18:01,franco9494,10,Trevor Milton the type of dude to use baby wipes to clean his finger after eating chips
2020-09-02 04:17:56,-rigga,9,"Trevor Milton the type of dude to say ""Sorry it's a bit of a mess in here"" knowing damn well he's a lazy dirty fuck"
2020-09-02 04:17:54,ovaiskhann01,7,trevor milton is the type of guy to type one of these trevor milton is the type of guy jokes
2020-09-02 04:17:34,dragoniteVS,5,"Wow, I just realized that one of my best plays through this entire ordeal is the fact that I bought a decent amount of silver coins in January because they were John Wick themed and ""looked cool"".

I'm going to go cry now"
2020-09-02 04:17:23,Desert_Hawg,8,Trevor Milton type of guy to say “hey chief”
