date,author,score,body
2020-04-06 04:25:18,coyote500,3,"last ten 1min candles on crude. apparently this is being traded solely by two cats

 https://imgur.com/t5BBg6d"
2020-04-06 04:25:11,psytokine_storm,7,"[This](https://imgur.com/a/oeRwFr2) is the graph showing new cases per day in the US.

It's plain to see that yesterday had fewer deaths than the day before, but this honestly doesn't seem to be an established trend to get excited by.

Also, given the typical lag of infection to death of 10-12 days, things are about to get pretty fucking morbid up in here."
2020-04-06 04:25:01,captain_blabbin,7,there's basically a 24/7 edm concert going on in case ya didn't know [https://www.youtube.com/watch?v=9GWWu34VhJs&feature=youtu.be](https://www.youtube.com/watch?v=9GWWu34VhJs&feature=youtu.be)
2020-04-06 04:24:40,Droidvoid,7,"So is the Fed ever going to leave the market? They intervened when the economy was still expanding, during this crisis, and will likely remain here long after things have begun improving again. When will all the shitty companies finally fail? They’re basically just blowing the bubble bigger until we utterly lose faith in the system and society actually collapses lol"
2020-04-06 04:24:39,nakedwaffeln,3,Currently cash gang with MSFT LEAPS. Sleeping like a baby bull tonight.
2020-04-06 04:24:36,,3,"And that weekend wall street was indicating a flat futures open

Good job guys, 2 days refreshing that shitty website well spent!"
2020-04-06 04:24:15,RDU-D2,5,"Last Friday, sold puts and bought calls (SPY 5/1 c $300). Monday will sell calls and buy puts. Tuesday sell puts, buy calls. Rinse repeat as long as we’re looking sideways."
2020-04-06 04:24:09,NoftScarlet,4,"🐻🐻

Blood red by open"
2020-04-06 04:24:06,HyerStandards,6,"Who cares if the consumer has no money to spend and can't spend money even if they wanted to.  Stonks only go up.  There was just a kink in the money machine in February.  All fixed now.  AB Left Right Pause R and poof, infinite money."
2020-04-06 04:24:02,Zinno--,5,"As much as I think puts tomorrow will be free money, I'm going to not trade tomorrow because I can see that it comes from a place of revenge rather than genuine DD.

But, genuinely, fuck this god damn economy. It makes no sense. We have a pandemic getting worse every day and the stock market moons? Wow... this printer really is OP."
2020-04-06 04:23:49,,2,It's time to start fucking with SVXY again
2020-04-06 04:23:36,gambler_no_1,1,I swear to fucking god I am gonna bang my head to the wall if we still somehow go red tomorrow.
2020-04-06 04:23:32,palopalopopa,7,"Honestly, if VIX falling by 8% on a red SPY day (last Friday) wasn't enough of a sign for people to get out or at least hedge then they deserve to lose their money.

VIX futures down another 7%."
2020-04-06 04:23:13,Acidbait,1,"I don’t know why, because all my plays are bull right now, but something tells me EOD red if not deep red by Thursday or Black Monday. I am liquidating majority of positions by lunch time"
2020-04-06 04:22:58,Zamoon,6,"Ok google:

Define GUH"
2020-04-06 04:22:30,therock21,7,TSLA gonna be up 20% tomorrow.
2020-04-06 04:22:15,SpacemanSenpai,2,How the fuck oil going to open -12% and then go green?
2020-04-06 04:21:57,Opening-Risk,1,Just limit up already futures
2020-04-06 04:21:50,PrinceofPeachtree,6,Man these fucking VXXp’s are boutta print bois! I’ve held on to these fuckers for weeks patiently waiting.
2020-04-06 04:21:50,Exa8yte,9,Guess I should've taken my 10% pootie gains on Friday... Now I'm just gonna have to double down like the degenerate gambling autist I am.
2020-04-06 04:21:14,apronstrings07,6,"It’s a good thing I broke down last week and just went all in Microsoft shares with margin, this shit rigged"
2020-04-06 04:21:08,ASuag,7,MOMMY WHERE DID YOU KEEP MY BULL COSTUME????
2020-04-06 04:21:05,DropDoctor,13,We will open limit up and just slowly bleed out all day. Bulls will bag hold hoping it will break upward. Bears will hold trying to scrape back the ashes of their puts. We all cry to our wife’s boyfriends. The end.
2020-04-06 04:20:54,Mal4kh,5,I wouldn’t be surprised if SPY futures start to go towards negative by the time we open.
2020-04-06 04:20:51,,-9,"Bears please post screenshots showing your portfolios when it is redder than Satan's dick, and I'll show you all my gains from selling you guys puts. This is going to be a brutal week for all of you. RIP. 

I also want to thank you again for your service in making me richer. I'll print a sticker with the emojis 🌈🐻💎🤚 and paste it on the new Tesla I'm going to get to honour your sacrifices in helping me buy another one."
2020-04-06 04:20:48,Lezzles,2,Holy shit my VIX $45 puts might actually be back to life.
2020-04-06 04:20:36,like-a-bbas,3,God dammit I’m holding SPXU
2020-04-06 04:20:23,psytokine_storm,8,"Theta gang might be the right bet over the next 6 weeks, as Vega is going to pound all our asses. 

I can't bring myself to write options with all the bullshit going on, though. Although the premiums right now as sweet as can be, at least with puts my losses are limited."
2020-04-06 04:20:15,190octane,5,Should BoJo be sad that the futures are green for the FTSE when he was hospitalized?
2020-04-06 04:20:12,DrunknHamster,11,Relax fellow bears the economy is frozen. The great depression had a bunch of bull traps. This is far from over...
2020-04-06 04:20:10,Captain_Chad,16,"*Coming out of my room with red eyes after weeks of quarantine*

“I finished PornHub. The whole thing. I’ve seen it all. It is done.”"
2020-04-06 04:19:49,Scrogdiggle,10,God damnit. My dumb ass thought I’d be riding the wave back up. Not getting totally fucked by it. Fuck dude. So sick of losing.
2020-04-06 04:19:29,coyote500,2,crude is going to take a breather soon and bounce off 28.75-28.80 over the course of about an hour and resume it's retard strength recovery
2020-04-06 04:19:26,isles478,6,limit up by morning. this is retard strength.
2020-04-06 04:19:23,Jay3377,17,Futures: It's just flu bro
2020-04-06 04:19:11,maybedisaster,13,"I'm fucking out.  It was fun for awhile, but now I'm stressed AND losing money. Godspeed 🏳️‍🌈🐻s"
2020-04-06 04:19:11,xKhaos420,1,Sell my uso 5.5$ calls at open or hold till 4/9 expire ?
2020-04-06 04:19:03,InferiousX,2,Damn crude filled the gap
2020-04-06 04:18:50,OutsideTheBay,23,"“Instead of protecting the people, (Ron) Paul contends that the Fed now serves as a cartel where ""the name of the game is bailout""—or otherwise known as privatized profits but socialized losses.”

This is exactly what happened in 2008 and what is happening today"
2020-04-06 04:18:47,ScratchyCow,6,"It's not wins and losses guys, its wins and *lessons.*

If you lose money take it as a learning opportunity.

Well, until you have no money left, then it's a loss."
2020-04-06 04:18:21,reyx7,5,My dumb fucking 259 4/9s might print. Selling these babys at 9:31
2020-04-06 04:18:14,ThereGoesYourKarma,7,"Charts updated
https://covid19.healthdata.org/projections

Bad news for my puts, but whatever. Glad its taking a turn for the better."
2020-04-06 04:18:11,gambler_no_1,-3,"Shout with me !

LIMIT UP !!! LIMIT UP !!! LIMIT UP !!! LIMIT UP!!!"
2020-04-06 04:18:11,edenney56,2,"okay, would throwing some money and buying some long dated calls/shares on airlines be a dumb play? after i sold my SPY puts for a huge loss i just want a stress free long term play."
2020-04-06 04:18:11,Randomness898,6,"Here's Dalio's AMA if ya'll wanna spam him with questions - he'll actually probably actually answer your ""are SPY 200 puts a good trade"" question since he'll be impressed you knew what puts were

 [https://twitter.com/RayDalio/status/1246186177515925504](https://twitter.com/RayDalio/status/1246186177515925504)"
2020-04-06 04:18:10,WizardSleeves118,7,VIX futures at 41.77 :(
2020-04-06 04:18:07,IgrewAtomato,5,Classic pump and dump.
2020-04-06 04:18:00,Teflondon_,2,TSLA calls on open lets go
2020-04-06 04:17:58,WorstOfWallstreet,10,"What the fuck do you even do after a gap up like this? 

I'm close to just selling all my puts and buying shares because buying calls on a +6% day always feels stupid.

Maybe ITM call spreads or something... if we still can't go down with an indefinitely closed economy we never will. Infinite Money wins again. No more red days"
2020-04-06 04:17:18,DjangoNinja,4,"https://www.insider.com/baltimore-mayor-calls-for-shootings-to-stop-amid-coronavirus-pandemic-2020-3

Stonks go down /s. But seriously fucking christ what a headline."
2020-04-06 04:17:16,SuperGoA,3," [https://www.washingtonpost.com/world/2020/04/05/coronavirus-latest-news/](https://www.washingtonpost.com/world/2020/04/05/coronavirus-latest-news/) 

I don't see how it's only up from here"
2020-04-06 04:17:16,RANDY_MAR5H,2,If it breaks 263. Is 300 out of the realm of possibility?
2020-04-06 04:17:09,thtguy90,6,"Okay guys. Despite the world crumbling around us, it seems as though it’s time to go long."
2020-04-06 04:17:08,cheezor42,13,Age of empires series on sale on steam - low key best strategy games of all time.
2020-04-06 04:16:58,AbruptlySoundCeased,5,"Wow crude oil going to be +5% by market open, amazing recovery"
2020-04-06 04:16:38,ottermodee,4,"I don't get it, if we're at the peak, then everything was waaay overblown? It's too early to tell but everyone keeps talking about the drop in the last two days, it's just two days of info!  

TLDR: Spy to 270 tomorrow?"
2020-04-06 04:16:36,Opening-Risk,3,We're gonna have a lot of bears tomorrow saying how wrong they were about JNUG
2020-04-06 04:16:27,redditor1246,4,"I think recession is actually canceled, thanks to JPOW. Also fuck variation separate for getting our hopes up, back to calls. MONEY PRINTER GO BRRRR."
2020-04-06 04:16:25,weedbrowines,8,"Dow Futures = +735 Points

VIX Futures = -7%

OIL = about to go Green soon (-12% to -2%), probably +5% by 9:30am"
2020-04-06 04:16:23,chihuahua001,5,Seems to me selling covered calls above your cost basis is basically guaranteed money? Basically the only way you lose is if the price of the underlying goes down so much it offsets the premium you were paid?
2020-04-06 04:16:20,sosarya,3,"SPY WILL TEST $262 level for the third time and fail. Puts will print late this week/early next week. However, if it breaches $262 and goes up to 270 you can shove those 4/17 puts to your ass and start renting your wife.  JPOVD and Trump Sins will be waiting."
2020-04-06 04:16:09,PepeSilviaFTW,5,Hope some of you don’t forget the markets closed Friday.
2020-04-06 04:16:09,SasquatchAstronaut,5,At a certain point I just gotta sit back and marvel at the climb.
2020-04-06 04:16:04,Dsopptha,6,JPOW is having a candlelit dinner with futures rn
2020-04-06 04:15:52,throwaway78907890123,6,Does anyone understand why futures are almost limiting up right now?
2020-04-06 04:15:32,tychus-findlay,4,Is VIX going down the only sure bet?
2020-04-06 04:15:31,,6,Is there any reason for futures being up so much?
2020-04-06 04:15:28,BroSofa,5,I can’t believe my stupid 4/6 SPY 262 hedge bought EOD on Friday might actually make some money.
2020-04-06 04:15:08,therock21,6,"Corona cases in US are only up 8% in the last 24 hours rather than 15-20%

It’s leveling off. That’s why everything is green."
2020-04-06 04:15:06,Cre8or_1,12,🐻's capitulating is what should give true 🐻's hope
2020-04-06 04:14:57,Lolsmileyface13,3,"jpow up late tonight smashing print while he plows your wife. 

holy shit"
2020-04-06 04:14:55,el_copt3r,5,"i... i don't think that chart is accurate.

&#x200B;

 [https://twitter.com/MarcoMNYC/status/1246935677909991430](https://twitter.com/MarcoMNYC/status/1246935677909991430)"
2020-04-06 04:14:53,Vinny32295,1,Sooo at what point do I close my market go up positions for profit and close my market go down positions for losses?
2020-04-06 04:14:53,pojo18,0,"I want to join bullgang, how can I turn 25k into 100k?"
2020-04-06 04:14:47,WizardSleeves118,0,"required reading for all autists

**What It’s Like to Isolate With Your Girlfriend and Her Other Boyfriend**

https://www.thecut.com/2020/03/what-its-like-to-be-poly-in-coronavirus-isolation.html

4/24 USO 6p"
2020-04-06 04:14:33,Jay3377,6,Anyone buying calls on open tomorrow? Seems like a 10% day to me
2020-04-06 04:14:07,Ban_787,7,the bull trap wont “close” until everyone here capitulates....
2020-04-06 04:13:55,DxLaughRiot,4,"Everyone here says buy calls. Recession confirmed, starts at 6:30AM PST"
2020-04-06 04:13:53,coyote500,5,"the fed could probably turn the printer off at this point and just lie about it, and the markets would continue to behave in the same way because people think the fed is still pumping. self fulfilling prophecy"
2020-04-06 04:13:33,engineerboy29,0,"ooph ah ooph ooph ooph ah

ooph ooph slap\* slap\*

ooph ooph ooph

ooph ooph ooph .....the sound of gay bears taking it by jpow"
2020-04-06 04:13:33,UsernameTaken_123,0,"any ya'll bears wanna share some loss porn?

need something to fap to"
2020-04-06 04:13:20,TeddyTrain,10,Everyone thinks tomorrows gonna be blood green so i'm gonna guess -10% at open
2020-04-06 04:13:08,bultard,2,Have 251/255p 5/1s bought Friday. Just going to sit tomorrow and see how this holds
2020-04-06 04:13:04,Patriotnation5,7,I didn't know there was this much green in the whole galaxy
2020-04-06 04:13:02,letthebandplay,3,"so this is the OPEC delay pump huh

looks like they'll dump on all of you that buy calls and sell puts tomorrow lol"
2020-04-06 04:12:50,worsethanwetsocks,3,257 bears in disbelief 👀
2020-04-06 04:12:44,engineerboy29,5,"thing about VIX, the explosion before was due to FEAR...straight up fear...much has been stablized since.

unless another variable comes into play to drive fear  make bets accordingly"
2020-04-06 04:12:42,Adrolehn,3,So how we feelin about IWM puts
2020-04-06 04:12:38,dreggers,10,"Bulls love talking shit about bears, but they can't even explain why markets are going up."
2020-04-06 04:12:37,Lolsmileyface13,11,"damn. 

spy really will be 280+ by mid may. trump will reopen america once ny and jersey are stabilized. 

and then the other 48 states will get absolutely demolished. spy to 200 in june, one month after 99% of this subs poots vanish into thin air."
2020-04-06 04:12:34,Randomness898,3,"Do people have like weird definitions of what YTD (year to date) means?

I thought it meant since January 1st of this year...

Cause I keep seeing posts like ""only down 10% YTD"" or ""only down 12% YTD"" and I'm thinking either I'm not understading YTD or someone wasn't very good at math.

Cause we are down like \~20% YTD!"
2020-04-06 04:12:32,whatcouldgw,2,"$TSLA 440p 4/9

This gonna print"
2020-04-06 04:12:32,FAKEZAIUS,2,Direction doesn't make you money long term. Position size and risk management does.
2020-04-06 04:12:30,MajorAdmin,2,Anyone know what just happened. Is AMD gonna moon tomorrow ?
2020-04-06 04:12:27,Edz_,10,Limit fucking up incoming. I literally can't believe it. I must be the worst person to ever trade options.
2020-04-06 04:11:52,Howard_510,3,VIX my boy I need you to fight
2020-04-06 04:11:21,KidneyFailure,6,Just caught a glimpse of what tomorrow will be like for my positions. -$3000. Yikes
2020-04-06 04:11:15,OutsideTheBay,10,Anyone in the mood to steal the Declaration of Independence with me? Puts might print
2020-04-06 04:10:51,Captain_Chad,-4,Do you fucks do anything besides stare at the god damn futures ticker all night? Oh it went up it must be Green Day tomorrow! Stfu
2020-04-06 04:10:39,Randomness898,5,"Lol Ray Dalio is doing an AMA on reddit.

Should I ask him if he's currently hiring autists from WSBs?"
2020-04-06 04:10:07,ch1p_skylark,7,"wow no wonder the market is mooning, surgeon general said this week is going to be the peak. that's literally what the market has been waiting to hear..."
2020-04-06 04:09:45,gambler_no_1,1,"I am being serious, something is wrong or weird with algorithms and market.We literally sell till 4 pm and quickly go green in after hours ? Why? Why do we have such red green red green red..... pattern ? Are algorithms trying to buy at each local low and sell at each local high ? I have no idea how algorithmic trading works but this pattern is something very interesting we are seeing. This pattern didnt happen in 2018 rate increase crash and trade war crash."
2020-04-06 04:09:41,Bearfoot420,3,2 + 2 = rope
2020-04-06 04:09:40,Bustincherry,11,Imagine only being down 12% year to date while the majority of the economy is shut down for a month minimum
2020-04-06 04:09:24,Captain_Chad,9,I’m going to break into my gym. The GAINS will not be delayed again!
2020-04-06 04:09:08,UsernameTaken_123,3,this is a warning for all you bears.... dont come to the stonk market tomorrow....
2020-04-06 04:08:58,bazookatroopa,2,Are my 5/1 220p fucked
2020-04-06 04:08:38,le_ebin_maymay,9,"Ok haha, good joke. You can dump any time now. You really had me there tbh."
2020-04-06 04:08:06,190octane,2,"Going to be hard to not dump more money into RH tomorrow if the futures hold and buy more puts.

Shit didn’t magically get fixed over the weekend."
2020-04-06 04:08:00,coyote500,5,"i'm calling it right now. crude oil is hitting $41 before thursday's meeting. look at how this shit is being traded, how could it not?"
2020-04-06 04:07:54,TJnova,3,"If I'm not going to need the money for at least 5 years, is there any reason not to buy 1000 shares of spxl?"
2020-04-06 04:07:34,IgrewAtomato,12,"Hoping to wake up and post: ""Oh how the turntables""."
2020-04-06 04:07:29,BannedbyLeftists,1,"Rate my positions that might be saved tomorrow:

AXP 90c 4/17
CNQ 11p 4/17
CCL 12c 4/17

I am a retard yes."
2020-04-06 04:07:16,pennystockplayer,9,Crude is only down 2.8%. That shit is going green like my calls.
2020-04-06 04:07:15,,4,[Donniedollars just arrived.](https://imgur.com/k5YZ2MV)
2020-04-06 04:07:11,flyersfan018,8,You retards will upvote anything that makes you feel better about your positions
2020-04-06 04:07:11,10bangerFD,4,Yall might as well keep holding your 04/17 180-220 puts. They couldnt have much downside left to them
2020-04-06 04:07:04,wordscaneverhurtme,1,SPCE to 17 tomorrow baby pleaseeeeeee
2020-04-06 04:06:55,LatinoMuyFinO,8,Oil giving up zero of its gains from last week. Oil calls finna print
2020-04-06 04:06:55,Waltis12,5,So advice for someone with money in 4/17 spy puts? What’s the move Monday
2020-04-06 04:06:46,dtanimal,0,this bullshit shouldnt even be going up
2020-04-06 04:06:13,ScratchyCow,14,"if your dick was one inch into carole baskins box and joe exotic had his dick one inch into your ass -

would you move forward or backwards?"
2020-04-06 04:06:11,gabethebaeb,2,"so glad my inner artist told me to buy spy 250 calls, can’t wait for tomorrow to reverse and fuck me hard"
2020-04-06 04:06:01,Individual_1ne,4,"People always say futures don't matter, but they do... Historically you can see that more often times than not, entire weeks stay in a defined range. The only times we break out of those ranges? Futures."
2020-04-06 04:05:57,weedbrowines,3,"LOLLLLL $CL\_F (WTI crude oil futures) only down -2.5% now... going to be green before Europe opens and up +5% by USA 9:30am open.

Next 4 days the price of oil will be dragged up into the event."
2020-04-06 04:05:53,consygiere,10,"Dude, like, fuck this. Oil was -12 at open, now is at -2.5 and will for sure open +5% green. Why would you torture my puts so slowly, just fucking open GREEN ALREADY."
2020-04-06 04:05:52,Tri-Stain,5,Fml up 700... Damn spy is just getting green this week
2020-04-06 04:05:50,,1,This sub is so fucking bullish for no reason which leads me to believe tomorrow will be red
2020-04-06 04:05:49,AllJuiceMustDie,2,THETAGANG WINS AGAIN BABY
2020-04-06 04:05:37,coyote500,2,"so stupid. can't believe it's as simple as a god damn trend line and nothing else.

 https://imgur.com/coXQenb"
2020-04-06 04:05:36,T_nooky,2,Projected deaths from https://covid19.healthdata.org/ went down to only 80k from 93k earlier. Bullish
2020-04-06 04:05:36,Petrovich1999,5,"Bulls, zoom out to 3 months chart. This dead cat bounce is weak, we didn’t even retrace 50% of the drop. Market oscillates up and down to find the balance. And it always overshoots ups and downs. The top was 263 iirc. +3% move today is still within trading range of the past 3 days. Previous trading range was above. So technically we are still at the end of dead cat bounce and a downtrend, and everyone with a brain sees that.

If you flip calls as short term plays then good job timing this, but don’t think that this is a V shaped recovery because it’s obviously not."
2020-04-06 04:05:35,etchasketch4u,0,Chinese healthcare calls.
2020-04-06 04:05:24,Bearfoot420,7,Some of you are alright. Don't open Robinhood tomorrow.
2020-04-06 04:05:13,consultant_25,4,"Seeing all these bullish comments, I feel much better about my puts now 👍"
2020-04-06 04:04:57,27onfire,6,256.. fuck this.  Ima go to costco and buy 10 cases of water.. sell them off the highway exit.  guaranteed 400% bitches.
2020-04-06 04:04:56,DusterBinge2029,1,Thank you Prez Ratzenspeger futites stay blue tomrrow
2020-04-06 04:04:43,KimJongUnsTrousers,7,"We're about to get sub-40 VIX so both puts and calls are going to get crushed. If we reach sub-30 this week, 99% of this sub is getting wiped out."
2020-04-06 04:04:41,siredwardpennybags,2,"&#x200B;

&#x200B;

Trump Warns of \`Battle' Not Seen Since World War 

[**Trump and Pence Say They See Signs U.S. Outbreak Stabilizing**](https://www.bloomberg.com/news/articles/2020-04-05/trump-and-pence-say-there-are-signs-u-s-outbreak-stabilizing?srnd=premium)

**This is FUCKING UNREAL**"
2020-04-06 04:04:07,Big_Factz,2,FUCK I HAD 800 UCO shares at 1.58 average sold at 1.61 the day before oil mooned Fick this
2020-04-06 04:03:49,_Slayton_,3,"Oof, this stock market makes no sense. Just gonna chill and wait for the relief check aka the ""throw it at FDs, lose it and get upset"" check before I mess with this again.   


Was up to 6k but the fed ass blasted me for a 90% loss on my SPY puts T\_T"
2020-04-06 04:03:27,bacon_conundrum,10,Has anyone here ever called that number for when things get real bad? Did it help?
2020-04-06 04:03:12,KushJenkinzz,5,Mid may USO calls looking MOIST tomorrow lets fucking go
2020-04-06 04:03:08,Zapping101,3,Long term vix puts
2020-04-06 04:02:43,_elroy,4,257 we either pop off to 260 or drop down to 253 lets see what happens BB
2020-04-06 04:02:42,coyote500,6,never seen so many bearish dojis followed by green candles in my life as i'm seeing on crude
2020-04-06 04:02:20,Ban_787,3,limit up is 2601.50
2020-04-06 04:02:07,Bryan995,6,Lolol. This market.
2020-04-06 04:02:01,gambler_no_1,2,"you naughty bitch spy, you know you want to hit limit up 😜"
2020-04-06 04:01:35,Big_Factz,5,At least my Boeing shares might be up
2020-04-06 04:01:24,flowkingfresh,2,Wonder if Tesla follows market or sells of on factory closure extension news
2020-04-06 04:01:21,BedRiddenWizard,2,All in calls?
2020-04-06 04:01:19,HurriKane37,4,"Bears: “Perhaps we are living in a completely fraudulent system!”

Bulls: “Or maybe you were wrong?”"
2020-04-06 04:01:06,descendantoflubu,16,"Alright folks, recessions over, coronas over, it's back to bull market. I give up, i will never fight JPow and Donald Pump again. My morale is shattered and so is my net worth, I think I should have just lit my money on fire rather than trade options because at least I have something cool to watch for 20 seconds."
2020-04-06 04:00:16,brodil,7,The volume of the futures is super low. I wouldn’t bet on the green just yet.
2020-04-06 04:00:12,jinxy0320,10,"I'm going to roll 50% of my portfolio into 7/15 230/220P SPY, and then sell as many SPY puts as they will allow me to 3 times a week at exactly 3:55PM for next day expiries and strikes that are -5 to -7% of whatever that days closing is going to be. I'll make back 40-50% of the premiums I've paid by 7/15, and/or we get a circuit breaker day at some point and my SPY puts print."
2020-04-06 04:00:04,PolishSwagDaddy,4,How is oil looking for tmr?
2020-04-06 04:00:03,,7,"It's kind of funny how much Sunday futures can make someone a bull to a bear or vice versa. 

If futures would be flat like 75% of this sub would still be bears"
2020-04-06 03:59:59,thisisbsol,5,How much does VIX have to out outpace futures to fuck my calls
2020-04-06 03:59:47,Slachi,3,"I'm just gonna go back to how I was investing before Covid-19. That is, Betterment 10/90 for all but emergency fund, dollar cost averaging, vanilla ice cream pepperoni pizza root beer boring ass life til I die. I'm basically where I'd've been anyway."
2020-04-06 03:59:42,ch1p_skylark,12,gona neeed a separate bailout package for bears
2020-04-06 03:59:33,Zamoon,5,Im going to buy calls on lube because we're all going to get raped by this green dildo
2020-04-06 03:58:51,dayvieee,3,We still got the jpow pump in the morning huh
2020-04-06 03:58:39,Nabz23,-3,"lol u/separate-variation deleted his account...??

nvm: I'm a retard switched the words around"
2020-04-06 03:58:29,hodlforlyfe,3,Is JNUG going up tomorrow or...?
2020-04-06 03:58:25,AdjustedMold97,2,"honestly, with my current holding sitting at $400 I don’t have much to lose."
2020-04-06 03:58:22,dasturtlemaster,5,Not sure what's worse. The fact that my BA puts are probably fucked or that I have poison ivy on my slim jim.
2020-04-06 03:58:10,MolassesGlassesBruh,5,"Think ima sell my spy put, grab a quick call and sell within a few days, and do straight put credit spreads til the market decides to not trade sideways"
2020-04-06 03:58:05,alex21turner,6,Any chance LK goes up on this?
2020-04-06 03:57:57,fg2wil,8,4/17 220p RIP
2020-04-06 03:57:37,BMH0918,-7,Market mooning! Going to be up big tomorrow on my SQQQ calls! I love wsb! Thank you for teaching me how to trade! This trading competition is going to be awesome!
