date,author,score,body
2020-06-04 22:31:44,gumbyj,3,"If you think airlines are going to stay at this price I have a bridge to sell you. That said, next time they take a nosedive BUY THE FUCKING DIP (calls not stock) because every motherfucker and their mom is going to have FOMO from this week. If you are reading this and don't listen then don't say no one ever gave you a real tip.

Edit: lol on the downvotes, as expected."
2020-06-04 22:31:23,OHHHHHHshidFAM,2,Thoughts on Azul?
2020-06-04 22:30:52,SuperPwnerGuy,2,F to those who didn't jump on the Mattel train before close.
2020-06-04 22:30:48,DingleberryBlaster69,13,lmao restaurants moving outside is fucking awesome. Drinking a beer outside on the street while there's homeless tweakers wilding the fuck out right across the street
2020-06-04 22:30:46,RollTide16-18,17,Airlines gonna keep going up tomorrow.
2020-06-04 22:30:41,knicksAHgoat,0,LK  is a sextuple bagger
2020-06-04 22:30:06,XPgains,-6,"Lol I literally called we would be green whole of May and I got downvoted. Suckasssss, here's to a green June as well"
2020-06-04 22:30:05,ryit29,1,Even the MM need to go on vacation
2020-06-04 22:30:04,PoggersWineGroup,3,TSLA 900 tomorrow morning please!
2020-06-04 22:29:53,AnonZeit,5,How to lose 10k in a day F
2020-06-04 22:29:51,,3,"Aviation industry appears to have bottomed out, and BA broke through 180 resistance which apparently is big news (if you believe in that magical bullshit)"
2020-06-04 22:29:51,ScallyWag-Idiot,6,word on the street is UAL on the verge of having a 40% short dick ripping day. should be amazing for the call holders.
2020-06-04 22:28:51,pillow38164926,-6,I hope markets open up flat as fuck tomorrow
2020-06-04 22:28:45,Stockengineer,0, green so early lol
2020-06-04 22:28:42,spycall420,7,kinda sad..my bac shares will get called away on Friday. We were such a good team!
2020-06-04 22:28:27,nosalute,3,Ya'll think its safe to drop a couple grand on the other airlines?
2020-06-04 22:28:26,adaptive_LA,5,holy shit that pump for spy lol
2020-06-04 22:28:20,Trenchalicious,7,Every dollar spy goes up and down I either lose or make like 2.5 thousand. So umm please moon
2020-06-04 22:28:01,atthegates421,1,"AAL has to go down tomrorrow right? Picked up some 6/12 16 puts and ngl, I’m a little nervous."
2020-06-04 22:27:44,numbnah,3,"tomorrow might be the day if ba moons past 185 and rtx past 68

if it does, it can only go back to ath"
2020-06-04 22:27:25,L_Bron_Hovered,7,Up 4k the last week and one -$100 day and I feel like a failure lol. What a week though!
2020-06-04 22:27:19,cheezor42,3,Anyone have a good explanation for why ADP payroll unemployment #s were SO FUCKING OFF from the weekly new unemployment claims in May? Like 2.5m vs 10m
2020-06-04 22:27:13,pillow38164926,13,#IMA FUCK SOME HOES TONIGHT
2020-06-04 22:27:05,JoJoBabbit,2,#Green as your sperm
2020-06-04 22:27:01,gopoohgo,4,Hope y'all loaded up on CCL
2020-06-04 22:26:21,numbnah,6,would be nice if ba and rtx moon at the same time
2020-06-04 22:26:19,s4yum1,10,"Cmon AMD, you need to shoot up to 55 soon.."
2020-06-04 22:26:14,The_Collector4,181,"If you sold your calls for a profit that’s all that should matter. The fact that you missed out on potentially more profits is misleading. By selling your calls, history was altered. If you didn’t sell, history from that point on could be entirely different, and there is no guarantee you would have made more money, or any money at all for that matter."
2020-06-04 22:26:14,curiousprovisions,2,There we fucking go. At least I know i've seen something green AH
2020-06-04 22:25:59,tendeeznuts,86,"Barren Wuffet is like 7 cherry cokes deep just market buying AAL all day, risk managers banging on the door begging him to stop"
2020-06-04 22:25:57,dweeegs,2,So now that we shook off potential trade war over Hong Kong are we at the ‘Mnuchin announces trade truce’ part of the circle
2020-06-04 22:25:45,SB52Birds,1,I wish I had the self control to delete my account for a week and let my zoom puts become ITM.. too much of an addict to do that
2020-06-04 22:25:41,NervousTumbleweed,10,"Hurt my back putting in an AC 

Puts on my youth 

Calls on my bong"
2020-06-04 22:25:26,VanillaBox,2,"Why do people here worry about if its safe to hold things? Holding something is the same thing as buying it for the price it currently is

If you asked people ""Should I buy MGM tomorrow"" you'd get a mixed response. But ""Hold MGM to monday"" is responded with an ""Yeah it'll gradually go up you're safe"""
2020-06-04 22:25:21,,11,"Good lord the escort posts...

Seriously can you not get pussy without paying for it"
2020-06-04 22:24:57,2easy619,4,I just started trading.
2020-06-04 22:24:56,alexgnfnr,6,Pumping all the CASINOS with 6/12 calls.   Those puppies are gonna net me some delicious tendies while we get to watch the experiment of all the drunk tourists mingling their coronas on each other.
2020-06-04 22:24:53,waylon106,2,how much cash do you need to cover cash-covered spy puts?
2020-06-04 22:24:34,Lief1s600d,3,"Anyone see ZoomInfo listed today? Fuckers say the IPO was $21, but that bitch opened to us at $40. 

Fucking superrich bastards could dump at open and double their money.

I want to be them

SPY 320C 6/8"
2020-06-04 22:24:24,Bakerfish1717,2,Fomo into ivr or resist the urge??
2020-06-04 22:24:08,Headkickerchamp,1,"the slightest downtick in unemployment numbers will send the market skyrocketing, now?"
2020-06-04 22:24:06,yeakevinc,7,"Someone bought 77M in SPY Puts today.. Jesus 

https://imgur.com/Sg5Gwqg"
2020-06-04 22:23:28,MusicalNate,1,"Playing soon to expire options. Sometimes daily sometimes 2 days till expiry. Buy into a position at either a peak or dip, set stop loss to 2% loss then pray I times it correctly. Surely I'll hit a big winner before long."
2020-06-04 22:23:24,Trenchalicious,9,Imagine being Warren Buffet and selling airlines at a loss and then not buying back in on the way up. All that money can’t make up for autism.
2020-06-04 22:23:23,arniepieindasky,3,So what airline is gonna rip up 19% tomorrow?
2020-06-04 22:23:16,nosalute,3,I'm the type of person to buy AAL calls at market open.
2020-06-04 22:23:12,scopolamine,1,"Are riots still going on in USA? If so, is it more intense than a week ago or less?

Also if you are watching some live stream, send me some links."
2020-06-04 22:23:12,thelolzies,2,What happened with IVR for it to moon like that?
2020-06-04 22:22:45,tipsystatistic,5,"Took my biggest single position ever in WORK. $6k in July17 $39c.

43 DTE are they fucked or am I over reacting. Would be happy with a 20% loss at this point."
2020-06-04 22:22:39,Harry_Butterfield,7,"J
E
T
S

JETS! JETS! JETS!"
2020-06-04 22:22:31,ItsameAnthony,4,Where my tanker gang at??
2020-06-04 22:22:20,FernFan,1,Hope SPY goes up
2020-06-04 22:22:19,YungDonOfHTine,3,BETZ to the moon!!!
2020-06-04 22:22:17,hk_enthusiast,3,Name the tickers that are still beaten down aka not airlines they already ran
2020-06-04 22:22:10,Kysiz,2,How do you do puts on police
2020-06-04 22:21:54,ComputerDude94,1,"Bought 2000 shares of ALK at $20, 2000 shares of DAL at $20, and 2000 shares of CCL at $10.  Ask me how my weeks been."
2020-06-04 22:21:44,PoopChuteChomper,10,I sold for $500 profit instead of $6.5k. AMA.
2020-06-04 22:21:39,cecpiece,10,I've gotten an inordinate amount of trades wrong in a row. Feels really bad.
2020-06-04 22:21:28,dr0odles,2,IVR calls. Let’s fly
2020-06-04 22:21:27,m77w,3,"Tomorrow we remember our brother Tank Man of Tiananmen Square. 

His fate unknown.

F

[https://www.history.com/news/who-was-the-tank-man-of-tiananmen-square](https://www.history.com/news/who-was-the-tank-man-of-tiananmen-square)"
2020-06-04 22:20:53,mandelu,19,I'm up 8 dollars 😭👍🏻
2020-06-04 22:20:48,Trenchalicious,11,Spy earnings premarket tomorrow. Hope you bought calls. Gonna moon!
2020-06-04 22:20:47,marsbup2,2,Waiting eagerly to see the big green candle
2020-06-04 22:20:47,swift_sadness,13,"Historically speaking, every time the NASDAQ has gone above 9700, it drops to 6800."
2020-06-04 22:20:46,PlasticRice,13,"My DD on MGM going even further up and to hold calls over the weekend:

Vegas about to pop off this weekend. Read this quote from some Casino executives:

""One downtown casino official said Wednesday night was like a normal Saturday night, as if the coronavirus shutdown had never occurred: 'Makes me wonder what Saturday night will be like.'""

Stimulus will also cause an even bigger run. Senate passed it, Trump has to sign it into law now. He might do it this weekend to calm down protests, in which case, reopened casinos will literally fly to Jupiter for people betting."
2020-06-04 22:20:33,GdaMan21,1,"Bears are happy cause the markets gonna go down tomorrow and probably Monday. They are right. But come Tuesday, stonks will, once again, go up. I’m Bull Gang till they stop giving out $600 a week for unemployment. Then again... I’m retarded 🤪"
2020-06-04 22:20:28,MotorizedDoucheCanoe,9,Feels like we’re teetering at the edge of a cliff
2020-06-04 22:20:25,el3trics,3,Where did all the DD and shitposts go?? Guys I’m actually up today without all of it I don’t like it
2020-06-04 22:20:24,Iowafield,1,Got me some 6/19 30 calls on AAR. What you foo's think? Got em at .25
2020-06-04 22:20:21,Bleeding_Irish,1,PCG doing things that DKNG wishes it did in the AH.
2020-06-04 22:20:10,gumbyj,6,Have been cash gang for a month and barely left my apartment for two. Just transferred 25k to my TOS. I'm ready to lose some money.
2020-06-04 22:19:55,Blackneutron,4,Wow Futures are green already
2020-06-04 22:19:39,rainman-ratard,21,"I successfully saved my portfolio. Down -40% all time to up +55% in one month. All risky options trades, fuck shares. Taking out my entire initial investment and gonna try to rebuild with house money only. 
My biggest winners DKNG DOCU HEAR ATVI TTWO SOXL ROKU HD LOW FB SPOT
BIggest cucks ZM SPY UVXY

Tips that helped me revive my account. Don’t chase but ride the waves. Don’t go against your gut. Stop having paper hands. Fuck the news. Buy the fucking dip

Good luck to everyone with clapped accounts"
2020-06-04 22:19:11,kortokrizzle,15,"Imma dip my balls in some thousand island dressin, cause I got depression."
2020-06-04 22:18:49,Viromen,3,"Anyone agree the spy movement was really weird today. So much sideways movement

At least my puts play paid off. 313 resistance. 313 was rejected hard and that triggered sell off an hour later."
2020-06-04 22:18:36,cutiesarustimes2,5,TIL humans only have 500 million years left on earth. :(
2020-06-04 22:18:32,mango1144,1,What's Donkey Kong doing tomorrow?
2020-06-04 22:18:05,gambling_rambler,2,"CRWD gaps up to 105 tomorrow

pls"
2020-06-04 22:18:04,PaperShark0001,1,Tmr will be red or green
2020-06-04 22:18:03,Whaddaulookinat,4,F 6.5c if there's a dip tomorrow at open
2020-06-04 22:18:02,mgbkurtz,4,Going to hold on to JETS and BA.  May swap out QQQ for SPY.
2020-06-04 22:17:59,m77w,3,"humanity is basically a complete shit show, isn't it"
2020-06-04 22:17:58,arniepieindasky,5,MGM and BA continue a mild run tomorrow?
2020-06-04 22:17:57,johnnywingo,2,What’s ROKU going to do tomorrow?
2020-06-04 22:17:55,HunchoBryant,4,anyone got JETS calls?
2020-06-04 22:17:52,blackholesarecool,4,looking at WORK's 1W graph... how the fuck is that legal. all after hours dumping
2020-06-04 22:17:47,silverlink22,6,"This market hates me. You are telling me if I held onto my Cracker Barrel  calls one day  after earnings, I would be up 10K. I figured they would shit the bed during earning which means the stock is gonna moon, but it pretty much held steady with a slight dip so I sold EOD. Then the following day it fucking 🚀🚀🚀. FML"
2020-06-04 22:17:33,GatorMD12,5,https://www.marketwatch.com/story/italian-trader-loses-his-entire-life-savings-on-one-insanely-risky-position-2020-06-03 dead reading this lmao
2020-06-04 22:17:13,ReactUp,7,Too late to chase MGM tomorrow morning?
2020-06-04 22:17:12,BLACKdrew,7,the spelling/grammatical errors increase so much after the market closes. almost like everyone starts drinking
2020-06-04 22:17:02,SVXYstinks,6,"Hell yeah have the place to myself for the night. Booze, porn, and call of duty are on the menu."
2020-06-04 22:16:59,ButtFart88,6,"What’s crazy is that, for the last month, as we’ve all been going crazy, riding the wave, and having a blast on this market, front page WSB’ers have been masturbating about the next rug pull"
2020-06-04 22:16:56,HoosierPride,2,Imagine not loading BETZ before close
2020-06-04 22:16:55,The_Collector4,6,Is it easy to start an ETF? Could we make a $WSB one?
2020-06-04 22:16:41,SteveStacks,7,"Why the fuck was I trying to be like Warren buffet? Being a WSB Retard has paid so much and so quick.

There's a method behind all this retardation."
2020-06-04 22:16:36,scopolamine,2,">The number of new coronavirus cases is growing faster than ever worldwide.  Twice as many countries have reported a rise in new cases over the past 2 weeks as have reported declines, according to a [New York Times database](https://www.nytimes.com/interactive/2020/world/coronavirus-maps.html?smtyp=cur&smid=tw-nytimes). 

Most fucked up countries: Brazil, India, Peru, France, Chile, Mexico, Pakistan, Qatar, Sweden and South Africa.

Mark your calendars from 2 weeks from now on!"
2020-06-04 22:16:34,xKhaos420,2," [https://www.facebook.com/angela.abramovmikhaylova/posts/3325434047487846](https://www.facebook.com/angela.abramovmikhaylova/posts/3325434047487846) 

Calls on home depot"
2020-06-04 22:16:33,oughmoment,6,"Any predictions for Boeing tomorrow, trying to get out of this 6/12 205c that I’m 25% up on"
2020-06-04 22:16:30,PlasticRice,3,"At this point, the only thing that could send us spiraling into a bear market is if Trump announced the dissolving of the Plunge Protection Team.

Futures would literally be -30% overnight, and the power of the Soybean Import Trade would singlehandedly tank the markets once again"
2020-06-04 22:16:25,raydemond,4,"Imagine holding DOCU, PD, YEXT, WORK, MDB through earnings and none of them print. Good old days of TECH earning plays are gone. RIP"
2020-06-04 22:16:00,jamestran26517,1,"BE green because job loss is lower than expected.
P/s: Slack downed 15% ATH. LOL"
2020-06-04 22:15:39,arichnader,40,Just made 15k and buying an escort rn
2020-06-04 22:15:35,m77w,4,did musk forget he's a libertarian?
2020-06-04 22:15:17,626reppin,5,"Airlines went from negative to positive during ah, why tho"
2020-06-04 22:14:57,TradeExcellence,4,"Top is in, calling it"
2020-06-04 22:14:52,,4,I am thinking shit will run up through Q2 earnings. If those don't bring this down idk what will.
2020-06-04 22:14:40,Pingpongandblunts,2,Anyone else on regn calls? Their covid antibody drugs going to trial and their ebola drug is now the standard of care for the resurgence in drc
2020-06-04 22:14:37,TrantMerris,9,Honestly that WORK conference call was Stewart looking me in the face and asking if blood or tears were my preferred lube of choice. Fuck.
2020-06-04 22:14:36,OliTheMongol,12,"I modified my Thinkorswim interface to swap the buy and sell buttons. Then made a close position button that just says ""Lambo"" on it. 
Now gunna go get blind drunk so I forget that I did it. Tomorrow, trade as usual. Literally can't go tits up."
2020-06-04 22:14:36,EightOneZero810,6,Anyone heard from our boy Kim Jong Un lately?
2020-06-04 22:14:35,reditt84,3,"I’ll say this for the millionth time 
DKNG - 
NBA was priced in last week along with euro soccer 
MLB and NASCAR are not priced it. It will go to $45 tomorrow it will truly moon once numbers starting coming out in a couple months once they start reporting the record number of new users"
2020-06-04 22:14:24,tobbyboi,12,I want to a big gain to feel the big dopamine rush again
2020-06-04 22:14:03,ohmyguh69,5,yo there was a guy in here who said there was an upcoming partnership with slack a few weeks ago. bro got dat insider info.... anyone remember his username ?
2020-06-04 22:13:54,eyerollingsex,3,This Musk Bezos beef will just make both stocks go up
2020-06-04 22:13:53,GRINGOxFLAMINGO,3,So is this finally the next leg down?
2020-06-04 22:13:46,pillow38164926,0,"#MY DAY

- I live at 450 West 17th street in my studio condo

- I wake up at 7am daily and work out in the in building gym

- it’s 8am and the concierge service sends up my breakfast. I believe breakfast is the most fuckin important meal of day. 

- then it’s 8:30 premarket. Showered and jacked off"
2020-06-04 22:13:29,anonlvx,3,6pm team sux.
2020-06-04 22:13:02,GGININDERLAH,6,Is wsb better than stock subs? Or just more retards here
2020-06-04 22:12:45,cstage559,1,Super bummed out that I haven’t gotten my STONX license plate yet 😤
2020-06-04 22:12:45,Surfincloud9,3,Jeez Epstein was a mad man. He was that one dude to see behind the veil and eventually get charged. Woulda loved to study his mind. Then kill him cause I have a daughter
2020-06-04 22:12:32,churnAmex,5,Futures r bloody green
2020-06-04 22:12:32,MartinePorteLaBurka,1,"Oh... these damn red candles. 😍   
  
I can see through them the dreams of bulls paused for an hour or two. 😘"
2020-06-04 22:12:27,,1,Fuck yeah IVR. Didn't buy calls cause volume was bad but ate up shares a while back.
2020-06-04 22:12:21,fourcubes,1,What happened to that Bear2020 dude who was promoting a crash.  I can't find his threads.
2020-06-04 22:12:14,krolicea,5,"https://www.teletrader.com/amp/news/details/52347170  

Big shrek dildos coming for WORK!"
2020-06-04 22:11:54,gumbyj,0,ZM calls all day
2020-06-04 22:11:54,Draynnox,7,Drop an eggplant if you made money on airlines today 🛫🛫🛫🍆🍆🍆🍆🍆🍆🛫🍆🛫🍆
2020-06-04 22:11:45,Alexleonel,5,AAL puts
2020-06-04 22:11:40,The_Grim_Kleaper,1,I'm thinking of a buying a spread tomorrow morning on AAL
2020-06-04 22:11:36,jackstocking,2,What are your predictions on federal loan forbearance in the coming months? Extension? No?
2020-06-04 22:11:32,TrenAndOptions,-9,FUTURES BLOOD RED
2020-06-04 22:11:32,MLGameOver,2,IVR MOONING
2020-06-04 22:11:24,Trenchalicious,5,"Spy down 12 cents already. Can’t sleep, won’t sleep"
2020-06-04 22:11:20,PumpersLikeToPump,2,TAP calls on tap
2020-06-04 22:11:20,mesor,1,STONK!
2020-06-04 22:11:19,imsrrybby,22,"Anyone else hate both major political parties? I hate the mob mentality, groupthink, and cancel culture of the left and most religious nutjob, trump supporter sheep of the right"
2020-06-04 22:10:54,QuantitativeTeasing,7,The moment that the protesters decided to start protesting peacefully is the moment that the protests started to die. No one gives a shit about peaceful protesting. The media will stop covering it in week.
2020-06-04 22:10:50,9tacos,4,"Imagine how bullish a Bezos + Musk or AMZN + TSLA partnership would be.  Full on sky net automation.
This could drive the market to insane valuations."
2020-06-04 22:10:44,justin_time_4_life,9,"I kinda wish I could get laid off and kick it on unemployment till 2022

This work shits for the birds"
2020-06-04 22:10:37,lucasandrew,3,Anyone know someone who can post a legit-looking article saying that soybeans are going to tank? Need this put to print to get me out of a margin call.
2020-06-04 22:10:27,oregon_forever,5,"Fuck theta. You make 10 good plays back to back, barely make any money, then one bad play erases it all and you go back to square one.

And everyone here thinks theta is making a bank."
2020-06-04 22:10:25,maximuminimum,6,"red futes at sleeptime, bull portfolios gonna be fine"
2020-06-04 22:10:23,Panda_Pineapple,1,Any stocks you guys are going long on right now?
2020-06-04 22:10:22,RandyCrane17,7,"Need to stay away from weeklies and focus more on calls that are at least a month out. 

Need to actually hold calls i have a few months out instead of selling the first chance of profit. Had a bunch of 06/19 $47 citi calls that i sold a couple of weeks ago for a profit of like $50 a contract. That's a fucking 10 bagger right now and i'm stuck with a bunch of shiitty tech weeklies that i'm down 70% on :("
2020-06-04 22:10:08,18845683,3,"Elon is right, break up Amazon"
2020-06-04 22:10:05,eyerollingsex,3,Musk and Bezos will settle this feud by having their Mandingo fighters duel to the death
2020-06-04 22:10:00,YungDonOfHTine,3,"Look at the ETF $BETZ it just IPO’d today! It takes all the sports betting stocks that are in person, online and even the techs that make up the betting. It’s already goin off ... get in where u fit in.. Has stocks like “DKNG, ERI, PENN, GAN and many more” 🙌🏼"
2020-06-04 22:09:39,CharmingSoil,-5,"Limit down soon!

Just getting that out of the way."
2020-06-04 22:09:16,PayMe4TradeIdeas,-7,"TODAY

I finished my formula, 

How to turn 50k into 2.5 million under 24 months 

RISK FREE"
2020-06-04 22:09:12,ArsonDub,1,Why is LK up 60% lmao
2020-06-04 22:08:55,niiickster,6,Who’s on the FMCI train
2020-06-04 22:08:51,Stupidnames04,10,15% gain on stocks I got 3 weeks ago.  150% gain on options I got 1 week ago.  What’s more fun people.
2020-06-04 22:08:46,CaptZeek,4,"Roku make me broku. 50% portfolio on roku calls


(4)110c 6/12 (2)90p 6/12


I expect both to print"
2020-06-04 22:08:16,krootz1,1,MREIT’s got room to run more? IVR looking like it’s still going AH
2020-06-04 22:08:12,SullyBrr,3,"If you think NVAX will produce a vaccine out of the 250 companies trying, I have a beach front condo for sale in Ohio for you! Listen to me and Buy 7/17 or later puts. By then, their trials will have failed and the virus scare will be over! Don’t miss the boat on all these fraud companies that made a killing on vaccine news. BUY PUTS 🦠💉"
2020-06-04 22:08:06,Tao-Lee,5,"Seeing all these DKNG bag holders sharing old, priced in news, in hopes there will somehow be another significant pump... If your calls aren't ATM or ITM now, of are any sooner than 7/17, you're fucked for tomorrow."
2020-06-04 22:08:05,Surfincloud9,5,"If anybody wants my job I’ll give it to you, gonna bail on this place and go work at big pharma. Double the salary, double the 401k, free medical, free stock options as a raise. Work with too many lazy people now"
2020-06-04 22:07:56,LordShesho,3,MMs edging the market downward so they can kill VIX on the uptrend and downtrend. The manipulation is recursively deep
2020-06-04 22:07:54,pnin22,1,ZM ?
2020-06-04 22:07:52,bshaman1993,2,Papa Musk not happy with AMZN stock price?
2020-06-04 22:07:34,tendeeznuts,1,Lottos on Autos thats the Motto
2020-06-04 22:07:31,pillow38164926,9,#WSB makes more money than people with music PHDs.
2020-06-04 22:07:23,mcydoeslil,4, Fuck its blood red im out im done gg no re no coming back its over
2020-06-04 22:07:13,9tacos,1,[The original Luckin Coffee scam](https://www.reuters.com/article/us-china-shortsellers/special-report-chinese-stock-scams-are-the-latest-u-s-import-idUSTRE74A71F20110511) custom designed for American equity investors needs.
2020-06-04 22:07:08,Noobtradegod,1,Some may call me reeeetarded but I dumped my portfolio in F to swing it tomorrow
2020-06-04 22:06:58,azurexz,6,"Musk picks a fight with Bezos. 1 day later. “Amazon Go launches electric cars, drive away pay later”"
2020-06-04 22:06:56,,2,AAL 6/12 p16?
2020-06-04 22:06:55,brssnj93,13,Spy green tomorrow for Trumps b-day
2020-06-04 22:06:41,Rednuht0,1,"DD: puts on LYV.
Just got an email from ticketmaster. My June 17 concert that was postponed 2 weeks ago is now just cancelled, refund within 30 days. 😭"
2020-06-04 22:06:36,Srinurocks12,-9,Futures bloody
2020-06-04 22:06:25,eyerollingsex,5,"You guys keep spamming about PPP loans expiring as if nobody will have realized this till tomorrow

Priced in"
2020-06-04 22:06:13,mywifeleftme_420,2,Hoping for big green but flat seems like the best way to cuck the most people on those 6/5s
2020-06-04 22:06:00,torrentialtacos,3,"My account opened up 5% at 9:30am, then:

10am up 15%,
11am up 25%,
Noon and beyond steady decline,
3pm down 5%, and finally
Market close: up 5%

Literally rode a fucking roller coaster up and down all day only to end exactly where I opened. Still a 5% gain for the day, but Jesus...what a ride. 

Tendies tomorrow."
2020-06-04 22:05:57,love2fuckbearasshoe,-1,"IF U DID NOT GET PEPSI OR MSFT CALLS 

U STUPID AS FUCK 

EASY MONIES NIBBA"
2020-06-04 22:05:50,Alford22,1,PFE $38c exp 7/17 $0.62 a share. Very new to option trading can someone just tell me if I'm a complete fucking idiot or not? Lmao in true r/wsb fashion I followed the advice of the first post i saw earlier today
2020-06-04 22:05:43,clarkefromtheark,3,Boring bout to open at 187 tomorrow hopefully
2020-06-04 22:05:36,visionarymind,-2,"https://imgur.com/a/dOQ16uC

Everyone keeps calling me 🅿️🚭🚳®️

🤸 tho❔

🅿️rofitable AF 🅰️ll-➕ime

Literally 📵 market exposure 💲ince it’s all profit 

®️acked 🆙 enough 4️⃣ used ®️ollie ⌚️

♾✖️ ♏️🚫🅰️®️ 🅿️rofitable than ⛈ & that one 🅰️utie who blew $300,000 over 15 years

🔱💲🅱️ ℹ️💲 🦄➕🌈

🕵️‍♀️🌳1️⃣6️⃣🔜

🗣©️an 👁 git 🅰️ ♓️ELL 🤸EAH⁉️"
2020-06-04 22:05:36,rogue_roads,1,Anyone else balls deep in ERI calls for next week?
2020-06-04 22:05:30,pillow38164926,-7,So I fucked this girl. Took her to dinner and enjoyed what she talked about. But the moment I nutted I wanted her to just leave and maybe talk later. Is there a hormone in your brain after u nut that’s like “fuck outta here”? Anyone have this thing? Or issue?
2020-06-04 22:05:29,BaronJomini,1,Anyone have any guesses on where we'll open tomorrow? I'm holding 6/17 SPY Calls tonight that I bought towards close to the lower point of that dip...
2020-06-04 22:05:12,The_Weekend_DOW,1,Going to get fucked by IV crush on DOCU calls tomorrow
2020-06-04 22:04:51,lame_irl,7,"JCP gets chapter 11 financing and only goes up 3%

HTZ does the same and goes up over 100%

🧐"
