date,author,score,body
2020-06-05 06:46:29,420bot,7,"I'll see you glorious bastards at the lambo dealership tomorrow, 415pm"
2020-06-05 06:46:23,braehunz,2,"I hope none of you idiots actually listen to me.

That being said. AAL & MGM calls are printing without question."
2020-06-05 06:45:54,hanily2020,2,Didn’t realize you could give away your gilds.... lol I’m such a reddit noob.
2020-06-05 06:45:50,realister,8,Another day another -99% on puts
2020-06-05 06:45:45,fungusdickhead,6,"Options is taking over my life lmao, I can't even focus on my physics hw bc of my calls"
2020-06-05 06:45:43,,7,Have made over 700% gains in my account this past month yet still am somehow down a little more than 50%. Is this what weaponized retardation feels like?
2020-06-05 06:45:27,Cmdr_600,6,"Spy is back with a vengeance , after the way he was disrespected yesterday."
2020-06-05 06:45:24,alex21turner,2,I’ve got 10k worth of calls that will be ITM. JPow you can fuvc my bitch anytime
2020-06-05 06:45:20,targetfan76,1,Yo stop giving random awards and give me gold instead . I liked the features it gave last time I got it . I'll bless you with 15% gains.
2020-06-05 06:45:06,Regjohn,3,Hi Elon 😘
2020-06-05 06:44:53,nsrbigshot,3,all the counties you fuckers could’ve bet against and you chose AMERICA 🇺🇸🇺🇸🦅🦅??????????????????? YOU FUCKING DESERVE TO LOSE MONEY
2020-06-05 06:44:49,mages112,1,🚀
2020-06-05 06:44:35,Iuliuss,1,"Someone won big time seems like from the Flair's, congrats and fuck you"
2020-06-05 06:44:02,ThePeerlessScarredd,1,What’s the play for IVR?
2020-06-05 06:43:38,OatOat,3,"7/17 GDEN, MGM, CCL"
2020-06-05 06:43:36,braehunz,5,MGM 23 EOD. Big weekend in Vegas. Calls.
2020-06-05 06:43:26,Droidvoid,1,TDA doesn’t even show me how up futures are.. it just says “FKN GREEN... DUH”
2020-06-05 06:43:19,t21r,6,Deployed to Saudi Arabia means I can spend all this tax free money on options 🤑🤑
2020-06-05 06:43:09,Jacobiangod,1,Elon please tweet.
2020-06-05 06:42:55,cpc98,4,TRUMP PUMP
2020-06-05 06:42:52,Demosama,1,"Can i have a shiny trinket?

Edit: 🥳😍🥳"
2020-06-05 06:42:51,bishopwatts,2,Shorting moderna. Fuck the world.
2020-06-05 06:42:49,Soon2beonthestreet,2,"WHY DID I FLIP 6/12 313C INTO 6/12 305P EOD!? Never holding puts overnight again, PJs too stronk"
2020-06-05 06:42:48,targetfan76,0,Something big happend last time everyone was getting awards like a couple of weeks ago. Getting dejavu. Wonder whats gonna happen.
2020-06-05 06:42:18,ThePeerlessScarredd,1,IVR or VVI?
2020-06-05 06:42:09,Av8erphoto,5,I have $1200 to do options. What you y’all recommend?
2020-06-05 06:42:05,oniontelejubbal,1,"Giving out participation awards, classic millennial..."
2020-06-05 06:41:54,Aids-baby,1,Lol who tf is gilding all these retarded posts?
2020-06-05 06:41:54,cruzemmanuel277,1,So how high are we going tonight? Accidentally won by buying the dip
2020-06-05 06:41:49,TheBegMidEnd,2,Fattest award of all time
2020-06-05 06:41:47,Maxismahname,3,"Elon let me get some gold or something. I'll buy a fractional share of TSLA

Edit: sweet, now I gotta figure out how to get fractional shares on RH"
2020-06-05 06:41:30,gainsusmaximus,1,I'm here for thebgangbang
2020-06-05 06:41:28,yukezter,1,It still hurts knowing I didn’t YOLO on AAL🤦🏼‍♂️
2020-06-05 06:41:23,dlee1996,1, Award = green days
2020-06-05 06:41:15,Imolared333,2,AWARD SEASON
2020-06-05 06:41:06,botulism69,4,Limit up
2020-06-05 06:41:00,Swag_God,1,It's past my bedtime daddy
2020-06-05 06:40:56,ijakebeltran,3,I love Mr. Stark
2020-06-05 06:40:52,fungusdickhead,3,I feel very good Mr. Stark
2020-06-05 06:40:52,trumpdiego,2,I for one am upset. Upset we aren't at SPY320 yet. Not mad. Just disappointed
2020-06-05 06:40:48,the_next_core,2,Market is scared during presidential elections not because of the challenger winning - they are scared of what the sitting president will do in the last 2 months when he knows he's leaving...
2020-06-05 06:40:42,ngjundi,2,"$Carr , not a juicy stock but has been hitting 52 week highs. Has contracts for big contracts including Hong Kong airport and around Singapore for clean ventilation that is needed because of this covid situation now. Long term hold i expect it to reach $40 end of year.  https://www.prnewswire.com/news-releases/carrier-launches-healthy-buildings-program-to-help-customers-reinvent-their-buildings-for-occupant-health-301069152.html"
2020-06-05 06:40:31,cruzemmanuel277,2,Cool that someone is giving out awards
2020-06-05 06:40:29,gohoos13,3,"It’s really sad that the Fed is destroying the future of our economy and no one knows anything about it.

And no I’m not a butthurt 🌈🐻, im just genuinely concerned for this country’s future."
2020-06-05 06:40:22,hanily2020,1,Need to have big tech day tmr to save my portfolio...
2020-06-05 06:40:09,Hillcat10,2,WYNN=win
2020-06-05 06:40:02,aglowwiththeflow,3,How do people feel about KR earnings?
2020-06-05 06:40:02,SquintsRS,1,"I like shiny things, but prefer paper tendies"
2020-06-05 06:39:29,OM3N1R,1,Fuck Fuckity Fuck This
2020-06-05 06:39:24,dp77pd,0,AWARD
2020-06-05 06:38:59,appleciroth,2,"Who the fuck is giving out awards at 3am.


edit: Thank you kind autist"
2020-06-05 06:38:38,enPaz,3,Went to sleep with mfs talking about 3130 resistance LMAO
2020-06-05 06:38:36,getrektqqmore,9,thats a lot of green for 2am
2020-06-05 06:38:28,kingfortheday772,7,Gonna go to bed now. Talk to u guys again during pre market
2020-06-05 06:38:02,Dograt2000,10,Holy fuck my calls will print.  Good game boys this week I mopped up the bears.
2020-06-05 06:37:57,TheCuriousKorean,2,"Elon Stark is here. Quick! Comment for your awards! Free tendies

&#x200B;

Edit: thanks for the tendies"
2020-06-05 06:37:57,BootyShoe,1,"Riding LULU 360, MGM 23, KO 50, SPY 337, CCL 27.5, BUD 60 long calls for at least another month. 

Might buy some IVR tomorrow before it takes it's happy ass to pre-covid levels"
2020-06-05 06:37:49,WowVeryJosh,2,"Whichever retard won the SPY lotto and is handing out awards, post gains pussy"
2020-06-05 06:37:15,Gilbertgodfries,2,The diversity of our country is our greatest strength but it is also our greatest weakness - gilbertgodfries on the decline of America
2020-06-05 06:37:10,LetsGetSomeManswers,3,Became a 🌈🐻 a week ago when I pulled out completely. Today’s the day I go all in on casino stocks and get my cock back from out of my ass. WYNN and MGM 🎈🎈🎈
2020-06-05 06:37:01,tradingthrowaway679,3,MODS EXPLAIN MY FLAIR PLEASE???
2020-06-05 06:36:59,dwdsquared2,3,If McDonald's wanted to make a ton of $ right now they need to bring back the McRib & Monopoly right now at the same time.
2020-06-05 06:36:53,iEatGarbages,3,Did you guys hear 10-15% of Americans are not good people? Biden’s brain must be half mush saying shit like that running for President
2020-06-05 06:36:31,GutterTr0ut,7,So biden in office we buy puts got the dd
2020-06-05 06:36:17,tradingthrowaway679,2,AAL AND PLAY GAPPING UP TOMORROW EASY MONEY
2020-06-05 06:36:12,cpscott1,1,Is getting Spy calls in July essentially free money?
2020-06-05 06:35:52,kingfortheday772,-7,My day would be made if BA just fell off a cliff tmrw
2020-06-05 06:35:40,wdcvvv,2,Is that you Tony🤥
2020-06-05 06:34:59,python_js,5,tHiS iS thE ToP..rUg PuLl iMmiNenT
2020-06-05 06:34:48,AntiqueFig0,2,What do you guys think will be the reason for the next market crash?
2020-06-05 06:34:42,superwonton,3,Casino 🚀🚀🚀
2020-06-05 06:34:42,nafinmasjid,12,I still can’t believe west coasters actually wake up at 6 AM to start trading lmao
2020-06-05 06:34:40,cstage559,10,"I hate talking to heauxs on tinder, they dry asf. Like wtf am I supposed to say to make y’all talk more lmao"
2020-06-05 06:34:39,ButtFart88,3,Cruise lines are worth a lot of money fuck. I guess in normal circumstances they have incredible margins and are at capacity at lot? I mean they’re basically just floating hotels
2020-06-05 06:34:35,ShawnHans007,5,MGM only goes up
2020-06-05 06:34:34,realister,5,"Can you guys just imagine the option volume activity we will have on election night?  

It’s like earnings but for the whole market."
2020-06-05 06:34:28,novydoo,9,Bears are now bulls and bulls are now super bulls
2020-06-05 06:34:13,et1haan,2,Poopy poooo pooo bear strong 3138 strong
2020-06-05 06:34:08,cheezor42,3,We’re all just lucky sperms if you think about it
2020-06-05 06:33:47,,4,And it’s not even midnight yet? Fuck ima not think about those 313 calls I sold earlier this week.
2020-06-05 06:33:46,burrowed_greentext,1,Good God I cannot wait for JPow to get hawkish again with this rise and all those poor gold bugs and crypto kiddies get wiped. But then Trump might have him killed and step in as acting Fed Chair himself so idk maybe the jokes on me 🤔
2020-06-05 06:33:16,DandierChip,5,LK up over 20% in Germany right now. Might see another huge day here
2020-06-05 06:32:41,Cam2071,3,"Invest in RICK

I may legitimately buy some shares."
2020-06-05 06:32:02,hkusbeckham,3,Fuck!!! I need ba to stop mooning!!
2020-06-05 06:32:00,kingfortheday772,9,If Biden becomes pres he won’t pump as much as trump
2020-06-05 06:31:58,josephrent,1,What to do with WORK calls? RT
2020-06-05 06:31:40,YepRabbit,0,"What did Elon do? 

ToS says ticker TSLA doesn't exist ???"
2020-06-05 06:31:05,targetfan76,14,one sector is skyrocketing tomorrow. Hard part is finding it. I bet on news of opec meeting saturday announced hour ago  and oil rising steadily already and will rise more after the meeting when they decide to halt production again so manufacturing and oil stonks will go up.
2020-06-05 06:31:02,LeastAttempt,3,"Make money with me 
CCL 7/17 30c
NCLH 7/17 30c
MGM 6/26 30c"
2020-06-05 06:30:51,dadftendirekt,6,"I'm all in on calls but this just doesn't feel right, lol. We'll be paying for this for the rest of our lives"
2020-06-05 06:29:48,joyful-,3,"https://www.cnbc.com/2020/06/04/tech-is-the-new-safe-haven-and-the-semi-trade-is-on-paul-meeks.html

this dude ran the largest tech fund during the dot com bubble and is now bullish on semi conductors... amd/intc/qcom are fuk"
2020-06-05 06:29:48,Septseraph,2,Is there a /r/wallstreetmemes? I miss the fun stuff. ^(\*holy shit there is!)
2020-06-05 06:29:35,cheezor42,6,They’ve got the whole country distracted by nonsense issue after nonsense issue meanwhile they’re committing the crime of the century with the stock market and we’re all just sitting here merrily profiting off the wave :)
2020-06-05 06:29:31,marketingdesigner,3,Let's go TDOC!
2020-06-05 06:29:26,3min33sec,4,How green it will be ? R:0 G:255 B:0 That is how green it will be. The purest green possible. The very definition of green itself.
2020-06-05 06:28:50,needadvice881,-5,"If it's this green rn that means it's going to be a blood bath when we open.  Hope I'm wrong because my calls expire but if there's anything I'm good at it, it's losing money"
2020-06-05 06:28:37,najdorfsicilian,7,I think the reason why I’m doing so well recently is because of the idiot sports gamblers who have nothing to do rn
2020-06-05 06:28:06,TDhbo,23,I am 100% all in calls. Literally have no cash balance to spend. Jerome better not take his finger off that button!
2020-06-05 06:27:42,braehunz,11,"Sometimes I realize the plays I’m making and think to myself: wow you’re a fucking moron. 

Then I remember anytime I thought I was making smart plays I’d lose."
2020-06-05 06:27:36,throwawaystemcel,7,"We need a new virus.

Deadly as ebola, contagious as Corona, homophobic like AIDs and incurable like cancer."
2020-06-05 06:27:30,gainsusmaximus,3,Who's gonna be biggest winner/sector tomorrow?
2020-06-05 06:27:13,wdcvvv,16,Hundreds of hours invested and I barely broke even.😣
2020-06-05 06:27:06,Soon2beonthestreet,5,Caught the EOD run up with calls but flipped into puts EOD. I must have been dropped on my head as a child to think there would be a pullback after 2 weeks of green
2020-06-05 06:26:02,reditt84,-4,What stock do you want to become a millionaire with ?
2020-06-05 06:25:25,wdcvvv,3,How long do you guys think this hype will last
2020-06-05 06:25:25,Gilbertgodfries,13,Man watching videos of all the looting makes me sad. No hope for the future. I don't think we'll ever see any significant change for the remainder of the United States as a country. Only way we'll get change is from nuclear war or aliens invade. We are a stagnant country on the decline. Really feels dark once you look at it all with wider eyes.
2020-06-05 06:25:17,Princess_Nincompoop,10,I’m pretty bad at this trading thing..
2020-06-05 06:25:16,nnaoeznnaoezhis,13,"I get withdrawal syndrome if i dont open wsb at least once a day, not that proud"
2020-06-05 06:25:03,Jtech91,7,Man I miss the days of 1k in premarket either way; felt so alive. Can’t even get interested in 200 up
2020-06-05 06:25:01,ShawnHans007,3,I don't believe in inflation
2020-06-05 06:24:47,pancake2708,2,"yesterday i thought about getting WORK calls for earnings, thank god i didn’t do it.


i’m still way too scared of playing earnings anymore since i got buttfucked from First Solar last time"
2020-06-05 06:24:46,nafinmasjid,13,Someone said the second leg down will start if trump loses to Biden and for some reason I believe it lmao.
2020-06-05 06:24:35,bodiddlysquat26,2,I have no idea what to do with my 100 NKLA shares. Price action is garbage so can’t sell weeklies. Fuck.
2020-06-05 06:24:34,ButtFart88,5,Why should I not buy cruise tickets? I’m not afraid of the Corona virus whatsoever it seems dope to get a free cruise with half the people for like $50
2020-06-05 06:24:08,ShawnHans007,8,West coast gang checking in
2020-06-05 06:23:56,marketingdesigner,2,RCL hasnt spiked like the other ones. Anyone feeling the big dic energy from RCL?
2020-06-05 06:23:40,Mishaloli,-8,Mgm calls are fucked. Hope I can sell w/ my initial profit :c
2020-06-05 06:23:23,AntiqueFig0,8,My 1 320 spy call about to print tomorrow.
2020-06-05 06:23:21,nafinmasjid,5,Listening to one direction rn (One Thing). Which is pretty ironic considering how SPY is only moving in one direction 📈
2020-06-05 06:23:04,marsbup2,1,Do we have any good China news?
2020-06-05 06:22:38,ButtFart88,5,Who exactly is still laid off from the Corona virus? I’m thinking retail workers and the like but who else?
2020-06-05 06:22:31,cheezor42,3,I think almost everyone has capitulated as this point
2020-06-05 06:22:17,joyful-,8,"i love doing remindme on the prediction posts here, always entertaining to read in retrospect

so many reminders of people buying spy 200p, 180p and even 150p back in late march/early april... wonder how the calls will turn out in a few months"
2020-06-05 06:22:17,realister,18,Just 5 years ago you had to pay $20 in commissions for every option! Imagine that?
2020-06-05 06:21:59,AntiqueFig0,7,There is really idiots here that believe DKNG will get to 50 tomorrow lol I will be happy if it gets past 45
2020-06-05 06:21:31,avelak,6,I feel like there'll be a bitch slap at open that shakes out weak hands before we steadily climb back tomorrow... Then we let PJ traders push us higher for Monday
2020-06-05 06:21:22,Isuckatfantasy0,23,I am getting calls tomorrow... margin calls 😭
2020-06-05 06:21:00,ReyTheFox12,1,Jpow plays pinball with spy balls.  Whenever he’s not looking and spy splits in between spy dips just alittle and then he puts in another ball and keeps racking points.
2020-06-05 06:20:55,Jay3377,7,"It's meme season again, wsb was screaming to buy Ba, Aal and mgm this week and I ignored because of my bitter experience with MSFT 200C. I'm hyped and want to Fomo into CCL 30C next week. Seems like the force is strong with this one"
2020-06-05 06:20:54,Marshawns-lunch,-4,"All the bears are mad because they think they’re smarter and some shit about “mUh FuNdAmEnTaLs!!”  If you were so smart, why not join the bull team and actually make money instead of handing it over?"
2020-06-05 06:20:51,dontargue69,1,whats the most sex/porno related stonk so i can have it in my portfolio for the lols
2020-06-05 06:20:37,throwmeawayafter111,14,"Is anyone else just tired of life

Not because of the market but in general"
2020-06-05 06:20:30,Droidvoid,6,STONKS
2020-06-05 06:20:25,420bot,6,"where is your god now you sick bear bastards

https://imgur.com/a/0UUwdJn"
2020-06-05 06:20:21,smallchimpu,4,"This is better than porn hub


Live Papa Powell anus play : https://in.investing.com/indices/us-spx-500-futures"
2020-06-05 06:19:53,Marshawns-lunch,7,Fuck I can’t wait for us to hit ATH.
2020-06-05 06:19:51,MainThr0waway,4,Drank too much cheap box wine
2020-06-05 06:19:45,wdcvvv,12,"If we all keep buying, stonks will only go up"
2020-06-05 06:19:45,Pokemaun,5,"its crazy witnessing the rise from 240 when i started investing. So many fibonacci numbers that were ""guaranteed"" to start the next leg down. Now were approaching ATH which is so crazy that i think it might just happen lol"
2020-06-05 06:19:39,rainman-ratard,6,"Grab amc puts while you can. Very likely going to declare bankruptcy. If you ever seen what happens to an option chain when that news breaks out your puts will skyrocket 1,000-10,000% instantly"
2020-06-05 06:19:26,saliym1988,6,11pm pump like clockwork. Thanks jPow!
2020-06-05 06:19:17,27onfire,3,Yahoo posted an article about why the stock market is going up.. that is all I know about the article though.
2020-06-05 06:19:05,happysocks466,2,Bought my first calls in months today. This feels dirty.
2020-06-05 06:18:56,rickonymous,4,I should learn not to check futures before sleep. Going to bed angry now
2020-06-05 06:18:32,Anonymous___Noob,6,Goin all out on MGM and AAL calls when markets open
2020-06-05 06:18:31,Lezzles,5,Did you guys know you can buy calls on stocks *before* they go up 50%?
2020-06-05 06:18:31,nafinmasjid,3,"Bears I’m sorry papa Powell tricked u into buying more puts. It’s nothing personnel. 

He just needed one red day so the next 4 Green days in a row didn’t look too suspicious"
2020-06-05 06:18:22,TrueHavoc,1,What happened to the night gang? It's pretty dead today
2020-06-05 06:18:13,swooshZ0691,2,So many trust jpow so much and still dont know what he did in 1995 smh
2020-06-05 06:17:43,throwawaystemcel,11,Sex
2020-06-05 06:17:42,nubshat,5,Just need CCL to hit $20 tomorrow
2020-06-05 06:17:26,pervsensei11,6,Buying SPY puts should be illegal at this point
2020-06-05 06:17:23,gigantoir,7,"bro in 6 months u gonna look back at march and be like bro

wtf happened

oh yeah corona

like how u look at the christmas 2018 crash now 😂"
2020-06-05 06:16:47,m77w,2,AMC 6p September bruh
2020-06-05 06:16:09,RayCashIsTrashDalio,42,*STOCKS RALLY ON HOPES OF STOCKS RALLYING AFTER STOCKS HAVE RALLIED FOR THE PAST MONTH AFTER A HUGE STOCK MARKET RALLY IN THE PAST 2 MONTHS LEADING TO INVESTORS BUYING INTO THE STOCK MARKET AND A RALLY IN THE STOCK MARKET*
2020-06-05 06:15:48,kinkyhentai69,-7,what was the last time we saw a red day ? i'm genuinely curious
2020-06-05 06:15:43,Herbert9000,1,Don’t want to be in the fake ass market? Buy Euro long! Clear direction. Soon you can buy a house for 100€
2020-06-05 06:15:32,ShawnHans007,2,SPY!
2020-06-05 06:15:32,ThePeerlessScarredd,4,"One ticker a week from the travel industry just going to rocket up 60%? We got AAL, I’m thinking CCL?"
2020-06-05 06:15:31,WestSorbet,16,"Today I bought 50 shares of DKNG. When I turn 30, I will sell one share to buy a home. Then when I turn 65, I will sell another share to pay for my retirement. And finally when I die, the 48 remaining shares will be passed onto my children who can use it to pay for everything they need to live a great life."
2020-06-05 06:15:30,Jay3377,1,"Next week hype play guesses?
This week belonged to Ba, Mgm, Aal and Tsla."
2020-06-05 06:15:28,Skwigle,4,"Joking aside, how long do you guys really think this is going to keep up? Every day I tell myself tomorrow I'll jump in with calls but then look at that fucking chart and too scared to pull the trigger. lol."
2020-06-05 06:15:24,pervsensei11,5,316 by open
2020-06-05 06:15:20,dontargue69,2,which stonk do you think jpow bought first on march 24?
2020-06-05 06:15:11,marketingdesigner,10,Who's actively trading while having a remote full time job lol. Shit gets edgy when on Zoom meeting
2020-06-05 06:14:56,gohoos13,2,"Honestly if Biden gets elected, I think Trump would order Jerome to cut off QE and reduce the balance sheet. Then the markets would tank and Trump would like a genius to the proletariat."
2020-06-05 06:14:28,bleeeeghh,5,"I'm fucked, anyone got tips how to get back your job at the mcdonalds?"
2020-06-05 06:14:20,lincoln929,3,What will be price of BA tomorrow?
2020-06-05 06:13:49,JonBoy82,6,BA 6/5 calls look good.
2020-06-05 06:13:43,bornno1,1,What colour lambo should I pick?
2020-06-05 06:13:37,cpc98,4,"Green across the board, except for VIX.. of course 😉 feels good"
2020-06-05 06:13:37,Panda_Pineapple,6,"I’m holding calls, but I’m fully expecting to wake to red considering how excited this sub already is"
2020-06-05 06:13:29,SquintsRS,1,Any chance the mouse gets to 140 this month?
2020-06-05 06:13:08,drinkyafkingmilk,4,I want to deal with my problems by getting fucking rich
2020-06-05 06:12:47,SirElfishOne,0,Can someone explain how selling options works? Do you hold on to these sell options till close if the option will expire worthless for the other person? How much $ does this give compared to buying options and selling once the price jacks up?
2020-06-05 06:12:18,I_KNOW_EVERYTHING_69,6,Any other retards holding MGM calls over the weekend?
2020-06-05 06:11:56,nsrbigshot,0,didn’t realize how many retarded ass stocks are in the s&p 500
2020-06-05 06:11:38,GadnukBreakerOfWrlds,6,"I did some DD  
  
An anagram of Jerome Powell is ""Empower Jello""  
  
Kraft Heinz Co makes jello. Calls on KHC?"
2020-06-05 06:11:37,,2,anyone know why kpop is so huge in europe and america when the people don't even speak korean. what am I missing here.
2020-06-05 06:11:32,,1,So for real no travel outside the US still this summer? You mean I gotta spend summer vacation in the states? Fuck
2020-06-05 06:11:29,ButtFart88,5,CCL gonna be the next big play. 80% off it’s ATH and Corona is going away. There might be some slight lingering fear but the idea that a corporation will lose 80% of it’s value over that is absurd.
2020-06-05 06:11:23,pervsensei11,6,"CALLS GONNA FUCKING PRINT

10TH DAY IN A ROW 

FIST IN ASS

NO BEARD 

👊🏼👊🏼👊🏼👊🏼👊🏼👊🏼"
2020-06-05 06:11:02,itsbeenaminute1,3,Volume for BA 200c 6/19 doubled from 10K close Wed to 20K close Thurs and open interest increased from 6K to 7K. Calls less OTM didn’t move as much. Hopefully performance matches sentiment tomorrow.
2020-06-05 06:10:55,LeastAttempt,3,Guys CCL and NCLH are no where near highs pre-covid. What are weee dooing step bros. Should we load up 10/1 calls on them?
2020-06-05 06:10:53,kfuzion,8,"Reward-free risk: 10Y yield at 0.8% annually

Risk-free reward: /ES futures at 0.7% daily while you sleep"
2020-06-05 06:10:37,grubernack276,9,Bulls dont need stop losses. They only have stop gains.
2020-06-05 06:10:36,LEVELUP99,4,Looks like people’s 315c 6/8 calls got saved lol
2020-06-05 06:10:33,ModernLifelsWar,1,Spy relax I need to buy more calls!
2020-06-05 06:10:02,trumpsplug,6,wait so robinhood gives u a free 1000 if u upgrade to gold ?
2020-06-05 06:10:01,mtsai,2,almost looks like futures want to give back that green shlong
2020-06-05 06:09:58,reditt84,3,"Airlines and retail tomorrow 
Start buying energy for next week"
2020-06-05 06:09:53,go_home_cook_rice,3,"Probably gonna sleep through tmrw, me and my portfolio are havin a fight"
2020-06-05 06:09:46,yukitq123,5,Holy fuck SPY is making me hard
2020-06-05 06:09:44,SquibFace,6,This rally will wipe what little remains from my account
2020-06-05 06:09:29,pervsensei11,3,JEROME THUNDERCOCKBRRRRRRR POWELL
2020-06-05 06:09:10,Axon_16,0,Anyone been following Snapchat (SNAP) recently? They’ve just been trending up and up
2020-06-05 06:09:05,Septseraph,-1,"I'm happy for you bulls. I like reading about people making money. When I jumped in this game I wanted to play on hard mode. It's easy being a bull when the market naturally wants to go up. Just buy the fucking dip.   


Being a bear is so much more challenging. There reading the market. Listening to sentiment, filtering out the garble and gabble. And taking all these aspects and formulating the precise and accurate strike and time for the perfect play.

&#x200B;

Only to have it all go to shit by some printer in dank dark basement going brrrrrr. But I'm happy for you bulls. Enjoy."
2020-06-05 06:09:05,rainman-ratard,5,I fucking hope so. I loved this rally but this is too damn much kill this shit already
2020-06-05 06:09:01,kkeshav97,5,"If you're not buying calls on $JETS to diamond hand, idk what you're doing"
2020-06-05 06:08:50,Investinwaffl3s,5,"I assume at this point all the bears are completely broke - or they have switched to calls

I wanna see a fucking green dildo day for a change. No more of this dumping at open bullshit"
2020-06-05 06:08:50,Jay3377,2,I pity for those who buys puts when it becomes -0.3% red and hold overnight just to wake up with green dildos and cries 'This doesn't make sense' and does the same thing again and again.
2020-06-05 06:08:47,nosalute,2,Buy the top faggot - Warren Buffet
2020-06-05 06:08:33,Throwmeaway199676,1,Smh after paper handing a 10 bagger I told myself I was going all in when SPY hit 280 again. Guess what never happened again
2020-06-05 06:08:33,reditt84,2,Yo plays for tomorrow?
2020-06-05 06:08:27,elija_snow,3,So June 2020 decided to start with an Earthquake in Vegas.  I want raining fire from the Sky.
2020-06-05 06:08:07,LecteurIntrouvable,4,I’m all into AAL and BA calls. Crossing fingers in hope for some tendies 🤞🥺
