date,author,score,body
2020-04-06 20:59:08,indrgun,2,I gave up & sold all non SPY puts except SIX and CNK puts rolled out to May.
2020-04-06 20:26:50,Dabiggustchungus,6,"Don't take out too much.  Im one of those suckers under a shitload of debt.   I got more schooling and joined the Marines.  Decided to leave next year which is scary... but I gotta move on.  What is your focus in psychology?  Aren't there distress lines you could work for?  That is something you can do from home. Especially now when people need it most, this could actually pay you and get you some good looking experience; you were helping people when they needed it."
2020-04-06 19:06:04,djst3venn,2,"Second question, what's the EOD move guys?"
2020-04-06 18:46:33,meikawaii,1,"SIX mooning for no reason, covered short straddle at 12.5? can't go tits up"
2020-04-06 18:03:14,fulltimeledge,1,By sent a text about 15mins ago saying mandatory lock down has extended April 29. My gay ass loaded up on puts thinking that would someone bring things down
2020-04-06 16:53:51,Bigjake32,-2,I didn’t fuck tard do get mad at me ur puts are shit
2020-04-06 16:51:17,Troll4Fun69,1,Real talk tho how long do I hold my 4/20 275 spy calls?
2020-04-06 16:50:17,robban_90,2,lol why is Square up 12%?
2020-04-06 16:17:52,VickysTits,1,USO calls?
2020-04-06 16:13:20,rmrd26,3,Where is everyone??🤔
2020-04-06 16:12:03,UeberMeister,10,"Every single time I buy puts the stock spikes, it's amazing, somebody hire me"
2020-04-06 15:45:24,slowpedalturner,9,"What we want 📉, what we get 📈"
2020-04-06 15:25:31,frickin_darn,3,"Oil will pop here eventually when Saudis, Russia come
To a deal  and people go back to work.   HAL 8c 6/19"
2020-04-06 14:57:29,kalef21,6,"deleted robinhood, can't keep watching this fake...ass...market. It was fun. Maybe if I hear there was another crash I'll reinstall and check but fuck this. Don't worry about me, lots of people get depressed or suicidal, I get fucking mad. I want to beat jpow to a pulp or something idk"
2020-04-06 14:55:01,we_wuz_kangz_420,1,Ok who gives a fuck if dow is soaring and corona is slowing down. Dave and busters literally is on the clock and has no income. FUCK
2020-04-06 14:48:43,SandKey,1,Kudlow : Business Payroll Tax Holiday
2020-04-06 14:47:04,baconography,1,"JYell chiming in with a reality bomb just meow. Wish it happened on Friday night to save even my ITM SPY poots, though"
2020-04-06 14:24:08,EightOneZero810,2,Here goes cramer with his fucking war bonds
2020-04-06 14:20:26,InsaneWhiteKid,3,"Ok, I admit I don't know what is happening here. 

I sold my puts for whatever was left of them (nothing) and I bought puts and calls in June. 

That way if things look up forever I'll get rid of puts. If things look down forever I get rid of calls. See you next week."
2020-04-06 14:17:24,EightOneZero810,2,What's w the low volume on BA calls?
2020-04-06 14:16:32,EightOneZero810,2,O fuck kudlow coming on cnbc soon. Pumppp
2020-04-06 14:10:45,GamblingMikkee,2,XOM sucks
2020-04-06 14:07:13,we_wuz_kangz_420,12,Just sold all my puts and put my entire portfolio into 80% SPY and 10% Waste management and 10% Berkshire shares. Probably won't touch this for a long time until I have kids or some shit and probably even just delete my broker app so I don't get any enticement to gamble again. Guess I'm a boomer now
2020-04-06 13:48:42,ButtFart88,1,Just took the loss and joined bull gang. HCQ is working and trump is telling everyone we are seeing the light at the end of the tunnel. Reported cases in New York dropped yesterday. It’s over gents.
2020-04-06 13:48:40,candymaxie,1,Bears get rekd
2020-04-06 13:39:23,The-Hyrax,3,Wow Jesus Christ... my puts are bleeding I can hear them cry
2020-04-06 13:34:59,shnoiv,1,I don’t buy into any of this. What puts am I buying on discount today?
2020-04-06 13:32:04,tvvt,8,"-$20k open lol 

From up $92k now up just $12k 

Fml I’m done"
2020-04-06 13:20:39,jyohnyb,7,God damn how do all of you live with such paper hands.  Should I do this should I do that.  Make a decision and stand behind it you fucking pussies
2020-04-06 13:12:23,Laghacksyt,2,JNUG calls are killing it
2020-04-06 13:10:29,magictie-,1,Hold USO calls or sell at open. It’s already down 5%
2020-04-06 13:09:02,infamousnj69,7,I know if I try to hedge my June spy puts I’ll end up getting fucked on both somehow
2020-04-06 12:57:17,we_wuz_kangz_420,2,Should I hold or cut my losses and go bull gang
2020-04-06 12:56:51,we_wuz_kangz_420,1,Does this oil field attack mean I should hold my puts
2020-04-06 12:47:26,Crosa13,7,We’re just gonna shrug off an Iraq oil field attack? Might put a dent in futures? Okay very real market.
2020-04-06 12:41:03,redisamyth,13,"😂😂 pearl harbor moment, oil talks delayed, 800 point gain. 😂😂"
2020-04-06 12:30:06,Dorkrain,0,Tesla calls? Zm puts? Uso puts or calls?
2020-04-06 12:14:35,millert13,1,Too late on ZM puts? Thinking about picking up some $90p.
2020-04-06 12:03:24,Stowski,4,"Caveat: I am very bearish

Prediction: I think this rally could have legs. As we saw with TSLA last week, Q1 numbers reported might actually not be too bad and improve market sentiment. I still think long term its fucked, but I think that Q1 could have the opposite effect we are all expecting. The real crash will come with debt defaults on a massive scale (both commercial and personal)."
2020-04-06 11:48:00,consultant_25,13,Boris put on oxygen. [source ](https://www.google.com/amp/s/metro.co.uk/2020/04/06/boris-johnson-put-oxygen-battles-coronavirus-hospital-12515404/amp/)
2020-04-06 11:44:42,APHAbaghodler,11,Everyone just waiting for this to open so they can sell it off.. so fucking flat..
2020-04-06 11:39:11,WizardSleeves118,3,"so what's with the apple tree in the banner?

just to have some green/red in the mix with all the brown or something?"
2020-04-06 11:34:43,Snotteh,1,My health for a 2500 spx
2020-04-06 11:32:06,yourfanboynick,18,Live nation is up 5 percent. Its all fucking fake
2020-04-06 11:31:24,buck_tardwater,13,I’m gonna cling to my puts til the day I die
2020-04-06 11:28:51,Cryptic0677,6,Why in the everliving fuck did I buy nvda puts. I should have sold them at the bottom friday
2020-04-06 11:27:26,yourfanboynick,10,Where the fuck did all this money come from
2020-04-06 11:26:07,JustLookingAroundFor,2,"Can’t wait for the cuomo show today to verify the panic is over

Bears final death blow 12pm est"
2020-04-06 11:26:01,vers_ace_bitch,10,to be honest i want corona to continue being a shitshow until at least the summer so i don’t have to go to court for a plant
2020-04-06 11:24:43,Vinny32295,4,Mortgage Industry on the Brink of Collapse. SPY 275 EOD
2020-04-06 11:23:11,PedosoKJ,17,"[US Oil Field just hit with rocket attack in Iraq.](https://www.nytimes.com/aponline/2020/04/06/business/ap-ml-iraq-us.html) 

What will this do to the market?"
2020-04-06 11:20:59,kingkex22,2,At least I was half right today lol
2020-04-06 11:17:05,Crosa13,13,"US oil field was struck in Iraq. I heard about it hours ago and waited for futures to react, idk if they will.  This is gonna be a bumpy day guys. No casualties reported at the time. Az Zubair oil field Iraq."
2020-04-06 11:15:29,SpecialtyHamSandwich,17,"Biggest bull trap in the history of mankind

“Hey guys Italy’s and nyc’s numbers are leveling off!”

Lol Italy’s been on lockdown and not allowed to leave their houses for a month. 

Put in a different way, doesn’t Bill Ackman screaming positive things give you just a little bit of pause?"
2020-04-06 11:13:42,ItsyBitsySPYderman,7,"So we tried to the 15-30 days to slow the spread, now we're all going back to work after easter. 

What happens when Easter accelerates the spread again? Im holding on to these puts. Just not looking at them today"
2020-04-06 11:12:27,brosephjones77,12,10k to 156k to probably 70k today.. I’m quitting stocks after I sell my puts tomorrow and buying a brand new tesla..making out like a bandit in the grand scheme of things if you ask me
2020-04-06 11:12:06,,8,"People gonna' be born, people gonna' be dyin'. Can't explain that."
2020-04-06 11:10:46,thepatientislight,19,This week is about to be the biggest bull trap of all time as New York corona slows down and the rest of the country begins to accelerate.
2020-04-06 11:10:01,LamboBy22,3,"so like hear me out, most people are staying home, so the virus can’t really spread, but most people also kind of aren’t working, so that’s not good for economy, now the question is, what does the market care about more, low infection rate or low GDP."
2020-04-06 11:09:38,Nonotreally999,5,That's almost an +800 point implied open noice.
2020-04-06 11:08:35,consultant_25,7,I would not be surprised if this goes below 500 by premarket and below 300 by 9:30
2020-04-06 11:07:37,The_Other_Angle,2,bearflag ^tm
2020-04-06 11:06:50,MrSilverBug,8,"Not going to get shaken out of a short cause someone with a bid dick is pumping futures. I have time for this play. Now maybe its the wrong decision, but if I'm going to crash and burn fuck it I'll crash and burn, not going to get shaken out of a position based on emotion. Will be watching chart carefully though if we break 263.9 with conviction I may need to sell and rebuy closer to 270. I'm pretty much all in some averaging down not an option."
2020-04-06 11:06:22,smackinov,2,What goes down must go up
2020-04-06 11:06:13,jobuii,3,"I’m jacked to the tits in credit put spreads! Buy calls bois, we’re going up for sure. Reverse my plays and you’re sure to make money!"
2020-04-06 11:05:58,ItsyBitsySPYderman,4,"I just woke up, but did the world forget there was a goddamned global pandemic going around?"
2020-04-06 11:05:25,Filippo5678,6,What kind of lube are bears using? Asking for a friend .... that may or may not be me
2020-04-06 11:05:19,consultant_25,2,Weak pump. Couldn’t gap up even in the entire night! Weak. 3% swings are nothing.
2020-04-06 11:04:32,CharbelU,-10,You'd have to be a special kind of retard to believe we're in a bear market
2020-04-06 11:03:36,scopolamine,4,"October 1929: S&P 500 plunged 34% in a month. In the next 2 days, a wild relief rally of 18% followed.  Then, stocks plunged another 26% in the next 13 days.  Eerie resemblance..."
2020-04-06 11:02:49,CryptoMadeMeCrakHed,3,Higher lows. You know what that means..
2020-04-06 11:02:11,,0,"We’re gonna fucking open limit up, aren’t we?

EDIT - Jesus fuck guys. Are we gonna have to start ending our posts with /s now?"
2020-04-06 11:02:06,bear2008,2,What the fuck Disney? Is the fucking mouse going over a 100 today?
2020-04-06 11:01:47,zirtbow,3,USO was up 15% on trump's lie there was a deal.. over the weekend there's no deal and it's only down 5% .. definitely a logical and rational movement.
2020-04-06 11:01:28,Phillybirds8,1,So SPY puts EOD?
2020-04-06 11:01:21,rbc8,2,Spy at 257 pre market.  I wonder if my 262 call will break even or sell at open.
2020-04-06 11:01:14,CamarosAndCannabis,6,Poop gang report in
2020-04-06 11:00:12,vers_ace_bitch,2,i just need the gap up to be like 6” so i can readjust for the 12” coming later in the day
2020-04-06 10:59:04,DoctorBalpak,15,Once this shit is over - we seriously have to rewrite economic and finance theories from scratch 🤦🏻‍♂️ Feels like reading outright fiction reading my textbooks 😭
2020-04-06 10:58:56,Benzo_Head,4,"Lower highs

Jerome your unlimited QE is weak af"
2020-04-06 10:58:43,Filippo5678,5,Who could have predicted another swinging 7% upturn on TSLA today ... woe is me indeed
2020-04-06 10:58:40,off_the_spectrum,5,I sold some put credit spreads on Friday. coulda made 20% on my capital in a weekend but doubted my vibe.. woulda been 100% dubs last week
2020-04-06 10:58:17,Bryan995,9,"LISTEN. Inversing our sentiment did not work. The NLP bots saw all the big 🅿️🅿️chads and starting buying like crazy. We need to INVERSE the INVERSE. Today is our day. 🌈🐻For life.

4/17 230p. 5/15 160p. 6/19 110p. 7/14 340c."
2020-04-06 10:57:02,alohaclaude,2,my TA always looks amazing until the one line I put all my trust in gets shattered. We have to break through the fucking 10 Year support Line of S&P 500 this week or my puts are fucked
2020-04-06 10:56:35,cjster1234,5,"🌱🌬️ check, SPY puts and USO shares, fucked. I'm yoloing everything into either 4/9 AMD or Tesla calls help me out autists"
2020-04-06 10:56:24,DoctorBalpak,3,I hope we either get a big dick green from here taking SPY to +10%. Or this should dump to circuit breaker. This stayin gay flat is really disheartening to watch. For God's sake we are in the middle of a global crisis here. And you gonna stay flat SPY ?
2020-04-06 10:56:06,JefBezosExWifesNewBF,14,We should erect a bronze statue in memory of 4/17 puts. And a wall to the side with all the names of the fallen
2020-04-06 10:54:37,YaBoyRustyTrombone,12,"FUCK IT IM MASHING TESLA CALLS AND VXX PUTS

NOTHING MAKES SENSE ANYMORE"
2020-04-06 10:54:10,YangGangBangarang,2,"Got USO, IWM, and CCL puts.  I think 4/17 is enough time... 2 weeks in this environment is 2 months any other time."
2020-04-06 10:53:50,_George_Costanza_,-6,"Young people should be allowed to go back to work as they will likely be just fine. We need to create herd immunity. If the virus infects someone young who is more likely already naturally immune to it that’s a dead end for the virus. Create enough dead ends and the virus has nowhere to go, aka herd immunity."
2020-04-06 10:53:44,cryptooakmont,0,new highs by Thursday ?
2020-04-06 10:53:42,creature1231,3,"I bought Shell calls 25 for September, is this retarded, yes or no? I already lost a ton on Shell puts by the way."
2020-04-06 10:53:42,000Kurpitsa000,13,"Markets are retarded everywhere right now.

A small (1bn) finnish airline furloughs all of their employees from a few weeks to a month. Also they announced that they will cut their operations by 90% due to corona.
This was a bit less than a month ago.

Now the company is back trading almost at the same price as they were before announcing all these furloughs and operations cuts.

REEEEEEEE"
2020-04-06 10:52:59,ddiddy171,3,If delta goes up then Buffett is no longer the wizard of Omaha
2020-04-06 10:52:59,Bexanderthebex,1,seeing nvda's premarket makes me so fucking happy
2020-04-06 10:52:23,JustLookingAroundFor,7,"Bears three weeks ago:

> wow lol fuck the boomers and their 401ks fucking idiots get what they deserved 

Bears today:

> noooo how did I deserve thissss"
2020-04-06 10:52:21,amoctar,4,Delta getting raped by Theta and Vega. Sad
2020-04-06 10:52:05,scopolamine,-2,"Here's a graph shows the denial period of pandemic:

[https://imgur.com/ayMrFb0](https://imgur.com/ayMrFb0) 

Fear period has not even started yet."
2020-04-06 10:51:58,wellzy17,11,My spy 5/15 $220 spy puts dead
2020-04-06 10:51:44,Jackismyson,6,Not buying into this suckers rally.
2020-04-06 10:51:37,tommy2figers,10,"Listen I’m cash option right now, so don’t bear or bull me but you guys are getting all crazy over a 3-4%. I’m not doing anything right now lol, this shit will most likely plummet tomorrow. And don’t get all hasty with me I will buy some calls and make it go down! Minute I buy in it’s gonna go opposite bitches😂"
2020-04-06 10:51:31,esparaeso,4,Anyone know the /u/ of that guy who put 750k on SPX 1500p?
2020-04-06 10:50:49,Dnj79,13,"My SPY $253c 4/6 seemed retarded when I bought them Friday, but this is likely to be the most profit I’ve seen in two weeks"
2020-04-06 10:50:41,Cnastydawg,10,All muh bro’s got permabanned for speaking out against the mods🤮
2020-04-06 10:50:35,grotness,2,I sold USO calls and bought puts. Missed a good play by 1 day. Yes I have retard
2020-04-06 10:50:35,THExNeo,2,Good morning my fellow morning people; should be one hell of a start to the week based on pre market - let’s get dis bread
2020-04-06 10:50:33,TimAppleBurner,2,"MBS MY NEW BEST FRIEND 

Aramco calls"
2020-04-06 10:50:16,pie31415,9,Fuck me and my worthless 4/17 SPY puts...
2020-04-06 10:49:53,The_Other_Angle,5,"-10k, very cool, very legal"
2020-04-06 10:48:56,brosephjones77,3,I can’t sleep :’(
2020-04-06 10:48:30,CryptoMadeMeCrakHed,-3,"RIP 🌈🐻

HELLO 🐂"
2020-04-06 10:47:49,,30,"Everyone needs to report jartek’s bullshit trading group to the better business bureau as the scam that it is.

report them to the better business bureau here:

https://www.bbb.org/scamtracker/reportscam

Scam website: https://truetradinggroup.com

You don’t need to put any personally identifiable information if you don’t want to. Use a bogus name and email. Just report them."
2020-04-06 10:47:42,ClearHouse6,9,Make VIX great again!!
2020-04-06 10:47:35,DrUNC83,5,I’m holding puts and this AM well pump not working: what a shitty day.
2020-04-06 10:46:24,JJJJJay,12,"so y'all can't sleep either?

..holy fuck it's almost 7 in the morning"
2020-04-06 10:45:53,ZincBoii,12,Man my SPY puts got rocked.
2020-04-06 10:44:02,life_sized_hotwheel,9,Who makes the paper that’s used in money? I want to buy calls on that
2020-04-06 10:44:01,WizardSleeves118,2,"might just break even on my USO puts between the fall in share price and IV crush

feels good!"
2020-04-06 10:43:54,jtvez,8,That dow futures up 700 thread is some sad shit. It's 350 posts of emotional support group bullshit for terrified bears and zero actual discussion.
2020-04-06 10:43:37,MangosButtPlug,5,"Hey look the UK is more ‘tarded than our little corner of the internet called WSB

https://www.cnbc.com/2020/04/06/coronavirus-uk-cell-towers-set-on-fire-amid-5g-conspiracy-theories.html"
2020-04-06 10:43:33,JefBezosExWifesNewBF,6,Who bought puts EOD Friday. Show yourselves.
2020-04-06 10:42:46,,4,No way this shit is flattening it’s just beginning
2020-04-06 10:42:38,Rubenov,8,Bear King Commander Dr. Fauci better come up with another presentation quick.
2020-04-06 10:42:30,Velshtein,4,"JPow collecting scalps, including mine."
2020-04-06 10:41:32,KRONOS_415,2,Glad I held AMZN calls into the weekend
2020-04-06 10:41:09,sgshortt,6,is the meme about the s&p hitting 2710 then crashing down going to come true?
2020-04-06 10:40:33,ShawnHans007,17,"RIP to my retarded bear brothers who threw all their money on puts on Friday because of the term ""bloody monday"""
2020-04-06 10:40:09,NAh94,9,"If this shit can happen after a one-day good news with the death toll and not a moving average reduction, this market is more volatile than anything. VIX baby where you at?"
2020-04-06 10:39:46,Filippo5678,6,Is Donny coming on for a surprise announcement to pump SPX to 3000 or ? That's all we bears need to fuck us in the ass
2020-04-06 10:39:41,goatmaster95,2,any earning plays this week ?
2020-04-06 10:39:29,motomike1,16,"Ackmans words move the market. He’s manipulating it the same way trump used to. Only difference is he will is making money on the changes in direction. He’ll close more of his long positions today and open more shorts. Next time he calls into CNBC the sky will be falling again. 

TDLR: inverse bill ackman 5/1 230p"
2020-04-06 10:39:28,_George_Costanza_,4,There’s going to be a shortage on ink cause JPOW bought it all.
2020-04-06 10:39:02,Envio29,5,VIX getting crushed. We all lose.
2020-04-06 10:38:32,ShawnHans007,2,"My banker buddy Chad who works for Goldman told me to throw my live savings on Disney. He's tight with the higher ups, they even call him Chadowitz now."
2020-04-06 10:38:28,scopolamine,4,"U.S. jobless rate may soar to 30% in Q2, Fed’s Bullard says according to Bloomberg.

For comparison, during Great Depression, unemployment rate was 24%."
2020-04-06 10:37:44,BlueKnightJoe,9,"How can anyone believably make any claims about nearing a peak or flattening the curve when we still don't have enough kits to test everyone who suspects they have it?

""Two days ago we had 700 new ICU patients and today we only have 500 new ICU patients. Therefore RECESSION OVER VIRUS DEFEATED GG"" 🤡"
2020-04-06 10:37:20,_George_Costanza_,9,Should just pull money and go play high limit blackjack at the casino.
2020-04-06 10:36:14,Crosa13,10,"Last week: crude oil is up this is bullish!

This week: crude oil is falling bullish because it can only go up."
2020-04-06 10:35:36,BillyG803,9,Congrats JPow. You have successfully acquired all of my tendies. At open I will be out until y’all give me that $1200
2020-04-06 10:35:29,fbi-office,11,"At this point, I can see either a V shaped recovery or the next Great Depression happening lol... nothing in between."
2020-04-06 10:32:42,tubby_LULZ,5,My VXX puts and short term SPY calls are really going to help hedge my long term SPY and IWM puts. Selling the SPY calls at open for sure. Will probably buy more IWM puts
2020-04-06 10:32:13,goatmaster95,11,my 05/15 puts are stressing me out now...
2020-04-06 10:32:10,Cre8or_1,0,"I just realised I was so close to getting assigned 100 shares of IWM for $103 on friday. Would have made $600 on that if I sold IWM at open today for the current price. more than my puts lost over the weekend. Rip, lol, could've been green :("
2020-04-06 10:32:06,jimjoekelly33,8,Chaos is priced in baby :)
2020-04-06 10:31:44,measuredrisk,3,If TSLA falls the moment it opens I am going to be so angry
2020-04-06 10:31:42,PedosoKJ,5,I bought a $0.08 260c 4/6 out of being a fucking retard Friday afternoon.  Maybe that shit will print and will keep me even for the day.
2020-04-06 10:31:28,queefer__m4dness,1,"what are some good plays for bear credit spreads today? I'm already playing hog, SeaWorld schnitzer, chwy,"
2020-04-06 10:31:10,MetalliTooL,3,"...Green by open?

😭"
2020-04-06 10:30:21,clarkefromtheark,2,Thinking zm is the next LK
2020-04-06 10:29:36,JefBezosExWifesNewBF,9,Good morning everyone 🌞 I hope you all get this 🍞🙏 namaste
2020-04-06 10:29:10,cjster1234,1,AMD calls $46-50 4/9 exp. on open. Print or nah
2020-04-06 10:28:40,,6,"Guys today is going to be blood green, get ready to sell your puts...to me...preferably an early/mid may SPY 220"
2020-04-06 10:28:08,JefBezosExWifesNewBF,9,How many gloryholes should I get on my yacht🤔
2020-04-06 10:27:16,alexatestcom,6,"this market is crazy, it should be up much more"
2020-04-06 10:26:12,MetalliTooL,8,"Hey, how about that DEATH CROSS guys?????"
2020-04-06 10:25:43,esisenore,5,Pissed this happened pre market. Not sure what the move is today now
2020-04-06 10:23:55,playhelicoptergame,3,I bought VXX 48c 4/17 calls ask me about landmines
2020-04-06 10:22:58,THALLFO12,11,I’m pissed Fauci was treated like a sideline bitch yesterday. Free Fauci!!!
2020-04-06 10:22:33,mstack,2,whats the best ticker to play on gold rising with options ?
2020-04-06 10:22:07,,7,Reminder that longing Google (and many tech co) is really longing digital advertising. Unless you think Google fiber or Google glass will lead to revenue. Don't be fooled by nerds in Patagonia vests with God complexes.
2020-04-06 10:21:32,International-Wealth,7,Is the market closed Friday? I just realized my ZM options expire this Thursday...
2020-04-06 10:20:53,sgshortt,6,What stocks do I buy if I anticipate rising divorce rates? Casinos?
2020-04-06 10:20:30,smallchimpu,2,"S&P 500

2,577.62

DERIVED"
2020-04-06 10:20:12,reddituserzerosix,4,Fuck spy up and zm down guess what I'm holding
2020-04-06 10:19:02,NLS-SWE,13,"Triple top might be forming today. 

https://i.imgur.com/PtPRZSB.jpg

Watch for reversal at 2634.25"
2020-04-06 10:18:52,,7,/r/collapse is a fun subreddit to hang out in...
2020-04-06 10:18:20,scopolamine,-3,"The Silicon Valley Age is over.  The tech startup mania was really a gigantic Fed-fueled bubble.  Now, tens of thousands of startups are going to implode.   Make no mistake: this was destined to happen even without coronavirus.

You think unemployment is bad now?   Just wait until tech startups fold by the thousands and jettison their employees.  We're only in the very early stages of this depression, I'm afraid.  This bust will continue to play out even if we magically cure coronavirus today."
2020-04-06 10:17:00,alohaclaude,2,is this the second shoulder of the dead cat bounce?
2020-04-06 10:16:28,smallchimpu,-5,"Real-Time Stock Indices Futures

Dow 30

21,746.5

DERIVED

06:16:14 | Futures

+789.5 +3.77%

S&P 500

2,576.25

DERIVED

06:16:14 | Futures

+93.50 +3.77%

Nasdaq

7,824.38

DERIVED

06:16:14 | Futures

+301.63 +4.01%

SmallCap 2000

1,098.10

DERIVED

06:16:15 | Futures

+45.10 +4.28%

S&P 500 VIX"
2020-04-06 10:16:26,G0ttkaiser,2,Who is buying? Except retail?
2020-04-06 10:15:59,idonotknowidk,1,is uso calls 2 weeks  expiration a good play or no
2020-04-06 10:15:38,Smilesrck,4,Oil has been a wild ride to check in on futures wtf lol. Glad I went to bed.
2020-04-06 10:15:28,MLCollector,5,Jerome stayed up all night......
2020-04-06 10:14:58,ddiddy171,4,Stonks up Recession cancelled
2020-04-06 10:14:51,JustLookingAroundFor,14,I heard they’re sending refrigerated trucks to reddit HQ to hold all these dead bears
2020-04-06 10:14:49,chuktidder,3,how.. why.. the f can spy be going up? the world is on lockdown and everything is pointing to massive unemployment and utter chaos the likes we have not seen in 100 years... yet 420 spy 4/20 might happen wtf
2020-04-06 10:14:23,_George_Costanza_,11,"“It’s not a lie, if you believe it.”

-JPOW, 2020. When referring to equity markets."
2020-04-06 10:12:50,pancake2708,8,"we fall .5%, my puts gain 0.02%, nice"
2020-04-06 10:12:16,benjaminikuta,2,What do I need to put for my income and assets on Interactive Brokers in order to be able to trade all the things?
2020-04-06 10:10:55,ValuablePassenger,2,"SPY/smallCap - roll now or sell your April/May expiring puts for now and wait for better entries/later expiries?

Anyone even switching to calls?"
