date,author,score,body
2020-09-09 07:33:37,sillysyllogism,1,"Any advice NVDA call 560, 12-18/20 hold on or just run?"
2020-09-09 04:13:30,pichicagoattorney,3,Short the fuck out of everything
2020-09-09 01:38:54,silverbugoutbag,3,Balls deep long TSLA calls
2020-09-09 00:16:04,AubieTigers,1,Still a ways down to go. Stay in SQQQ. I tried to tell you last week.
2020-09-08 23:15:36,toughc0okies,1,looks like jerome has started the printer
2020-09-08 23:08:57,WHOOPS_WHOOPSIE,1,EVFM cause feminism
2020-09-08 23:03:05,winkahpack,2,Milady Cathy bought Tesla today!!!
2020-09-08 22:46:16,mrl2r,2,Fuck you oil go down. My oil puts may be the only thing I did right in a week
2020-09-08 21:29:28,danddrox,1,NKLA and TSLA straddles
2020-09-08 20:37:11,infinitelimits00,1,UVXY hopefully keeps crashing.
2020-09-08 20:10:36,CryptoeinInMyJordans,5,"When everyone says “Buy the Dip”, do they mean Thursday’s dip, Friday’s dip, today’s, or the rest of the red week’s dips?"
2020-09-08 19:57:08,putsandpizza74,4,🚨🚨BUY YOUR FUCKING CHEAP ASS TESLA CALLS AND ENJOY THE UPTICK RULE UNTIL FRIDAY 🚨🚨
2020-09-08 19:08:04,thatsenoughMrLahey,3,Do I buy tesla??
2020-09-08 18:38:23,cameroncrazy666,1,F 8c free money can't go tits up
2020-09-08 18:29:11,Gremlin232,6,Volume here is low. My guess is most you autists lost everything.
2020-09-08 18:24:56,highsupplementguy,4,I really hate being retarted
2020-09-08 18:10:50,donny1231992,2,i'm fucking done. gonna go find a bridge to jump off
2020-09-08 18:06:36,satireplusplus,3,fuck softbank
2020-09-08 17:58:08,HammyHamDog,3,"Today, I bought: Apple, fb, pld, abt, jnj, nvda, Microsoft, avgo, google... I bought TSLA and Rocket last week... and I plan to buy amazon next week if market keeps going down."
2020-09-08 16:31:30,TrenAndOptions,2,TSLA selling pressure is done. All recent “bad news” are now reflected
2020-09-08 16:30:44,TrenAndOptions,6,Imagine a day where NKLA shoots up 40% and TSLA drills 20% in the same day
2020-09-08 16:08:45,alex20910,5,Stockmarket on the clearance rack today
2020-09-08 16:07:46,alex20910,4,AAPL ain’t a 2 trillion dollar company gg bois I say keep your long term calls and hope for the best come 2021 we will be far into tendyland
2020-09-08 15:52:26,Image1920,5,My zoom class has 100 retards in it so calls for zoom this week
2020-09-08 15:49:58,Carnal_Sanders,3,That’s bottom for today
2020-09-08 15:46:30,albinokitkat,-1,Just started trading idk what im doing so im just gonna follow what u guys do lol
2020-09-08 15:19:12,chadpewtin,1,IM THE KING .......of selling early 😔
2020-09-08 15:14:31,Panda_Pineapple,2,Spy October calls?
2020-09-08 15:11:00,ducktwo,1,Poop trading for ultimate clarity of mind 🧘‍♂️
2020-09-08 15:07:59,small_root,2,I was promised that calls would make money...
2020-09-08 14:31:25,Snoo1726,1,"So GM was dumb enough to buy into the hype and pick up a NKLA stake at these valuations????

I'm definitely a buyer of GM puts."
2020-09-08 14:28:07,herpefreesince1983jk,5,cash gang anyone?
2020-09-08 14:25:25,Rianis96,7,"it's okay guys. i sold my calls for immense losses, only makes sense we rip now"
2020-09-08 14:23:37,Yamilo_oWarrior,5,All of a sudden Nikola is a real company
2020-09-08 14:21:35,HowToStonks101,3,Pton is the dumbest shit. 3k for a bike and monthly membership when u can buy a dope ass road bike and ride outside. Calls it is
2020-09-08 14:14:42,Yamilo_oWarrior,4,Apple going up UVXY going down let gooooo
2020-09-08 14:11:56,_maxt3r_,7,Looks like it's recovering 😸
2020-09-08 14:10:05,MrBojangerangs,6,"I stepped off mr bones wild ride. With like $6 profit.

Going back to sleep"
2020-09-08 14:07:01,UrKewlito,2,I see tesla is down to 340. I'm going back to sleep.
2020-09-08 14:06:16,highsupplementguy,2,SQ AND TQ GOING FOR A RIDEEEEE
2020-09-08 14:00:14,jleVrt,3,*tumbleweed bounces across wsb*
2020-09-08 13:57:12,toughc0okies,5,I BOUGHT THE DIP
2020-09-08 13:50:11,micahr2100,3,Tesla is holding around 340
2020-09-08 13:49:02,PlataDePablo,3,I went crazy with my credit card shopping this weekend cause I was sure my calls would print
2020-09-08 13:45:34,PlataDePablo,-4,"Fellas, I want to call the market the N-word sooo bad. Wut do :/"
2020-09-08 13:40:03,freehouse_throwaway,3,RIP TSLA. starting to move against market.
2020-09-08 13:35:56,seinfelddragon,3,Down 90% on my Apple calls
2020-09-08 13:32:55,LoseALotOfMoney,6,✨I lost a lot of money✨
2020-09-08 13:32:41,gainbabygain,2,look like the bear party continues
2020-09-08 13:28:52,micahr2100,2,Do not be afraid
2020-09-08 13:28:14,ItsJambalieya,3,damn rip that 28k bear guy from 2-3weeks ago kicking himself now
2020-09-08 13:25:23,SprinterSacre-,3,We’re all fucked
2020-09-08 13:23:06,chadpewtin,11,ask me if im about to catch this falling knife on tsla.. go ahead ask me
2020-09-08 13:22:02,Mrzbady,5,Rip all calls. At this point if you don’t have leaps into 2021 you should just become an hero. That’s probably what I’ll do.
2020-09-08 13:18:34,Howard_510,4,Lololol imagine being the bulls that went to sleep when futures were up .8%
2020-09-08 13:17:52,krakdis,2,damn you to hell CRBP
2020-09-08 13:17:10,JackOfAllTradezs,1,It’s about to be a tough morning trying to decide when to sell puts . How much harder can this shit really drill?
2020-09-08 13:08:06,bettercallsaully,1,"does potus think ""super v"" is a W?"
2020-09-08 13:07:53,ephapax1,1,I regret the day I ever “invested” in BA. Guh.
2020-09-08 13:02:53,intangibleJay,0,Are there any publicly traded skateboard companies?
2020-09-08 13:01:14,Mrzbady,9,"Ok guys, I need aapl to go up $30 in the next 30 minutes. Only $1 a minute. EZ."
2020-09-08 12:58:51,ArtoriasOfDeep,5,Rip 9/11 calls
2020-09-08 12:58:24,bitstock1500,3,I think they are trying to keep the market up and also keep the dollar up at the same time by stalling the Stimulus m. They can’t eat their cake and have it. Stimulus is the main driver of this fake market. No stimulus market will continues to fall.
2020-09-08 12:58:01,bd_1994,4,Never been more anxious for the premarket. Fingers crossed we’re having tendies for lunch
2020-09-08 12:56:41,TheRealAlexKyle,2,Elongated making me tap out
2020-09-08 12:52:54,TheRealAlexKyle,3,Calls are cheap
2020-09-08 12:52:33,richunclepennybags27,1,"Wsb volume = low, meaning, market losses for call holders = high"
2020-09-08 12:49:24,T0pher90,3,Holy shit its bloody. It must suck sitting on calls
2020-09-08 12:48:26,ephapax1,1,I somehow think we open red to big dildo green by EOD. I’m looking for something to swing today.
2020-09-08 12:45:57,lil_nascar42,3,"Still super v, we just haven’t found the bottom yet"
2020-09-08 12:43:13,plzplzplztendies,2,Should have bought puts.
2020-09-08 12:42:08,MrGiggles668,7,Holy fucking shit. Where are all those guys “if you didn’t buy calls Friday you are retarded.” Get fucking rekt
2020-09-08 12:41:19,akdbaker816,2,Ahaha I'm convinced half this sub wasn't here on friday. Everyone chill out we good. Retest that support real quick so we can consolidate for the rest of the week
2020-09-08 12:35:35,HinduHamma,1,"GM and nkla teaming up for one purpose. To squeeze shorts.

Big fat fucking F to nkla putholders. You dumbasses shoulda shorted the company that’s actually overvalued to all hell - TSLA."
2020-09-08 12:31:15,23therealme23,4,F to Elon’s net worth
2020-09-08 12:31:06,redblade79,5,Wtf man. NKLA partners with GM to compete against the cybertruck.
2020-09-08 12:28:48,redblade79,8,Dude. Fuck SoftBank.
2020-09-08 12:27:56,ElonTaxiDriver,3,Are puts really the move at open?
2020-09-08 12:26:50,23therealme23,2,“Tech is not overvalued” 🤦‍♂️🤦‍♂️
2020-09-08 12:25:05,Gsogso123,4,"Who is ready to admit they didn’t load up on puts EOD Friday? Today is looking like it’s going to be a day to remember and probably a week for the record books as well, it doesn’t get much easier than this, time for a second mortgage on the house. The only hard part is getting enough capital together to short every tech stock that is up 30% or more this year with out any reasonable explanation or serious catalyst. and pic xx"
2020-09-08 12:24:26,alwayshungry0704,2,"Hold tesla or sell tesla?
Is selling it now and trying to buy it back a better strategy? -80% of my summer gain so far 
Damn"
2020-09-08 12:20:24,ephapax1,7,Why the eff is the whole market tanking?!! I went to bed and the futures were looking so good! 🤦🏽‍♂️
2020-09-08 12:20:24,Proof-Flounder,1,Lub up boyz
2020-09-08 12:18:33,csklmf,7,Why the rug pulling?
2020-09-08 12:16:11,ElonTaxiDriver,1,Oh lord we drilling
2020-09-08 12:15:58,mingling4502,4,🤣 futures are slightly in the red. Did china shoot a missile at the US or something?
2020-09-08 12:13:52,ItsJambalieya,2,"cmon nvda drop, wanna get in for cheaper before 3080s out"
2020-09-08 12:13:36,reallysmartdude,7,I am straight up not having a good time.
2020-09-08 12:12:30,ArcanoBot,2,No more papa Musk fuck me...
2020-09-08 12:04:36,WSBrexiteer,3,"Maybe I'll take my crayon drawings of trucks to GM later, I heard they like to reward special boys like me ☺️"
2020-09-08 12:02:45,spoookymorty,10,"Jesus Christ every bear in here sounds like biggest group of Incels I’ve ever heard. You act like no one here knew this probably was going to happen. The point is that we know it but don’t give a shit. I’m not even in calls, but the amount of “I tOld u bUllS tHiS wOuLd hApPeN” posts are actually making me want to chew my hand off"
2020-09-08 12:01:48,Proof-Flounder,5,Today is more quiet than usual in here
2020-09-08 12:01:21,toughc0okies,5,"no shit here's one of the best moves I have made in the past month

put a fixed amount of money in your yolo options account and (hopefully) never deposit again: you take that money and make a million or you go bust

if you do go bust figure out a way that you can conservatively restart from $500, but set limits"
2020-09-08 12:01:13,hmchugh98,3,"just got laid, but could not get blow. the guy texted me back and said he just woke up but is going back to bed"
2020-09-08 11:48:21,highsupplementguy,7,Well I might be a little gay 🐻
2020-09-08 11:47:15,peruvianitalian,5,"I just bought 4 shares of NKLA for shiggles. 

But seriously, NKLA puts at open???"
2020-09-08 11:44:16,ovaiskhann01,5,when the market was crashing  in march ppl said to buy the dip too 🧐
2020-09-08 11:43:33,SavorySkills_,4,People still don’t want cash. Find some other plays outside of tech. It’s not hard
2020-09-08 11:42:30,wwjr,1,NQ heading toward friday lows
2020-09-08 11:41:34,SavorySkills_,1,I liked this sell off until my plays got hurt 😰
2020-09-08 11:36:12,Proof-Flounder,2,https://www.google.com/amp/s/money.yahoo.com/amphtml/nikola-and-gm-team-up-to-make-this-900-horsepower-super-electric-truck-113011979.html
2020-09-08 11:32:48,notrly_ty,3,What fuck just happened to NKLA???
2020-09-08 11:31:14,toughc0okies,6,"you know the drill:

\- WSB turns bearish <--- you are here

\- ""just buy puts on literally anything tech! free money""

\- QQQ $100p 11/20

\- another rally new all time highs"
2020-09-08 11:26:39,cclem0013,2,Need your advice Bolz .. 10/23 3500c Amazon call do I sell at open or continue to hold and pray. Thanks ahead of time too
2020-09-08 11:26:38,theoinkypenguin,2,Boeing just can't do anything right
2020-09-08 11:25:19,Environmental_Turn_6,1,"the europoors are takin tsla down, about -6% today."
2020-09-08 11:23:06,y-eoj,9,Friendship ended with Elon. Bank loan is new best friend.
2020-09-08 11:19:54,toughc0okies,0,who else is going to buy TSLA calls today?? 🌈🦘
2020-09-08 11:19:30,bettercallsaully,2,"tsla flat the rest of the week, that was messed up.  pre-market robbed us of the action"
2020-09-08 11:18:41,Jacked_Tidies_,-1,Gotta love em 🐻 traps
2020-09-08 11:16:00,toughc0okies,2,"test your play first: post a comment and check downvotes, the more the better"
2020-09-08 11:14:39,mynameisdal,3,VIX up almost 10% dumb shit bulls what you at? Whales got all you stupid hive minded same shit saying redundant ass bulltards TRAPPED LONG LEVERAGED TO THE TITS. HA!!!!!
2020-09-08 11:08:29,toughc0okies,1,"bear market you heard it here first

when you buy the dip just make sure you realize it's gonna get DUMPED again"
2020-09-08 11:05:10,Pubgsus420,3,What is happening?
2020-09-08 11:01:57,MothafuckingMufasa,-3,Just checked futures guys. VIX in red everything else green now. Get some sleep kings. You guys need it. Everything is okay
2020-09-08 11:01:21,wwjr,1,NQ broke through resistance. may go up from here if it doesn't go below 11310
2020-09-08 11:00:37,Throwawayphone79,1,"Fucking spy, better wait for me to get in firsr"
2020-09-08 11:00:27,robinhood_intern,3,Damn even Amazon down to $3194
2020-09-08 11:00:06,SilverSpirit7,1,Trump tweet + Softbank= Recipe for disaster
2020-09-08 10:58:43,Rich265,1,Guy on CNBC is saying Paradigm Shift.. time to sell!
2020-09-08 10:58:22,Mondrayish,12,"Elon: Are you out?

Kimbal: Ya I'm out. Domp eet."
2020-09-08 10:58:20,rioferd888,2,GET THE LUBE READY
2020-09-08 10:56:24,mynameisdal,2,HahahahahahahaHHAHAHAHAHAHAH
2020-09-08 10:53:11,robinhood_intern,2,Lol PTON
2020-09-08 10:50:04,soap808s,1,Well duck me MRNA
2020-09-08 10:50:04,DeepBass10,2,Is this a place to buy more gold or cut losses?
2020-09-08 10:46:56,Alpra_Cream,9,Only dip I'm buying today is some guacamole.
2020-09-08 10:46:12,ShinyPants45,8,This open is going to fucking hurt
2020-09-08 10:45:26,misfitsiri,2,COST looking solid
2020-09-08 10:44:59,PlutusVeles,9,I stayed up until 7 am watching cobra Kai for that BULLSHIT ass cliff hanger? Fuck you eat shit Netflix.
2020-09-08 10:43:58,Jabroni4L,9,Silly bulls praying to the false god of the fed. It was Softbank all along!
2020-09-08 10:42:22,LanN00B,3,My only disappointment about today is having to trade this market while working. Better be dead on the store so I can get these 💰
2020-09-08 10:42:18,toughc0okies,6,VIX 🍗
2020-09-08 10:41:57,Faultylntelligence,6,I'm sitting patiently waiting to short VIX
2020-09-08 10:41:33,0Dillhole0,3,Muh spy 346c's are gone go from red to redder
2020-09-08 10:39:00,hndrx_j,1,what are some good buys rn
2020-09-08 10:37:49,analyst_84,5, Can’t wait to buy tesla at 200
2020-09-08 10:37:40,bitteryw,1,Can we get more of that QE
2020-09-08 10:35:16,PostM8,1,Work calls at 10:40 are the move to hold through er?
2020-09-08 10:34:45,SavorySkills_,1,RIP KCAC
2020-09-08 10:34:41,toughc0okies,5,"psa: dont buy silver

silvergang = tankergang 2.0"
2020-09-08 10:34:36,Beyond_Duality,6,"Can’t wait to buy this dip

🤤🤤🤤"
2020-09-08 10:34:06,cutiesarustimes2,4,Good god tsla ppl.
2020-09-08 10:33:24,TheJarlos,5,This is like June 11th^2.
2020-09-08 10:31:54,PostM8,2,Ok I’m selling all my calls at open (mostly not even tech)I know when I’ve lost :D
2020-09-08 10:30:19,nosalute,8,The only people alive EOD tomorrow will be those that deserve to be. Everyone else wouldn't have made it anyways
2020-09-08 10:30:17,Jabroni4L,4,I took a shit and it's down another .4% hold me i'm scared.
2020-09-08 10:29:01,bettercallsaully,9,"don't know if i want to buy tsla calls at open, put my life savings into SQQQ, or just click around and keep saying ""WOW"""
2020-09-08 10:28:20,Rich265,-2,"NVDA was 135 in May 2019, now it's 504, and people ask how market is overpriced. 

So I look at their yearly gross profit.. 

7.1 Billion for 1/2019  
6.7 Billion for 1/2020  
8.2 Billion for TTM

Profit up 15.5% in < 2 years. Stonk up almost 400%. Makes sense."
2020-09-08 10:27:43,silverlink22,7,"I’m so fucked at open. Celebrated too early. Roos r fuk. 

This can also reverse. 🤔🤔 And FDX is still green. But Tesla has absolutely destroyed me. 🥺🥺"
2020-09-08 10:27:31,Gua_Bao,8,i’m gonna lose all my money today aren’t i
2020-09-08 10:27:02,v1truvian,6,"If we are going to drop, I’d rather have this be in the guillotine style, quick, painless, and merciful. Yeah you lost -99% but at least you know where you stand. This slow bleed bullshit disgusts me."
2020-09-08 10:26:51,AdrianThatGuy,4,"If you pucker up your lips, your iPhone’s faceid won’t work. Puts on Apple!"
2020-09-08 10:26:38,Mrzbady,24,"Chill guys. A lot can happen in 3 hours.

You can lose a lot more money between now and then 🤡🤡🤡"
2020-09-08 10:26:12,toughc0okies,1,"hohoho merry christmas bears

i couldn't have asked for bloodier futures

same plan still applies"
2020-09-08 10:26:09,nosalute,10,Tiktok thots mad they lost 200 dollars from shares
2020-09-08 10:26:01,D_Cooscoos,4,"Alright guys, I just got off the phone with Elon and he said ""roll up your blunts bois, TSLA $420 by EOD""🔥📈🤑"
2020-09-08 10:25:36,gronaninjan,2,So open at 340. 15 min pump. Huge drop and then back to 340 eod. Is that the play?
2020-09-08 10:24:45,TheRealMattHarvey,3,335 incoming =\
2020-09-08 10:23:53,creativityswitch,7,"Seriously do not buy the fucking dip people. All the technicals are pointing to this going down WAY further. Look at the volumes this early in the morning in the sell side, insanity."
2020-09-08 10:22:59,TheJarlos,8,Did everyone in RKT go extinct?
2020-09-08 10:22:56,UsernameTaken_123,15,"CNBC: *""Tesla announces a 1:5 reverse split""*"
2020-09-08 10:22:42,waylon106,4,Softbank’s aftermath
2020-09-08 10:21:48,philipthemole,3,I was confused why everyone is panicking tech stocks sold off after ATH but I remembered this is a casino
2020-09-08 10:21:37,nosalute,5,If TSLA does a -20% day this could be its last day. It still has to bleed 1 more week worth of gains to find a bottom
2020-09-08 10:21:14,eduardopazruiz,5,I might actually cancel my sell order at open for Tesla. Seeing how futures have been during the weekend. It goes from bigly down to green and I think near open we might be closer to green. I think we’re just in panic mode since some of us slept to green futures
2020-09-08 10:21:13,Huck000,5,u/cpttonystark gives elon back rubs and gets paid in fractional shares of tsla stock
2020-09-08 10:21:03,throwaway21342134213,1,Fugggggg
2020-09-08 10:20:22,silverlink22,5,Puts at open? Fuck. I know as soon as I get into puts that’s when the month of green starts again.
2020-09-08 10:20:06,AndyAdv,16,Guys im german and doing my best to buy the dip
2020-09-08 10:18:47,Huck000,7,so 1000 pe wasnt good afterall? note taken
2020-09-08 10:18:12,yaboigoat53,10,That guy who had tesla puts must want to die right about now would have mad somewhere near 1mil
2020-09-08 10:18:12,eerfdd,2,"Can someone remind me what the RH reset buttons are? Ctrl, Alt, Del?"
2020-09-08 10:18:01,Rangeamazed,2,Dw boys fed will save us
2020-09-08 10:17:57,MOTM_NW,5,Hey retards...maybe...just maybe...tech was overvalued. You only have yourself to blame for buying calls at the top which will turn into panic selling and buying puts at the bottom.
2020-09-08 10:17:56,Huck000,6,u/cpttonystark sucked jpow off in a bathroom stall
2020-09-08 10:17:45,TheCuriousKea,2,Do I hedge with my free cash or close my tech positions and double down on puts with what’s left 🤔
2020-09-08 10:17:44,wikifeetarchivist,6,"what the fuck is everyone crying about, everything except tsla is above friday's low"
2020-09-08 10:17:05,thehope12345,1,Is having tsla shares still pretty bad or long run is alright?
2020-09-08 10:17:03,3bago,2,Is Tesla bouncing at open or is it straight down from here?
2020-09-08 10:16:53,bagel_maker974,2,"Guessing my 9/18 calls might be called into question if todays market doesn't close trending green.

Good thing my 100% returns from RH are already in my bank account and I am back to original starting capital :) if it gets flushed away that really sucks but its already made its money for the year really."
2020-09-08 10:16:53,emirsway,5,"Banks are pumping the stock and retailers are buying, then banks are running away with whole that money. 





-Welcome to Wall Streets."
2020-09-08 10:16:22,nosalute,3,Imagine holding TSLA 500 puts bought at the top.
2020-09-08 10:16:21,creativityswitch,5,Honestly this is the most action I’ve seen in the market since March/April. Bad times ahead.
2020-09-08 10:16:13,ohwtfIamin,1,market is acting like a slut (will f\*ck everybody) .. I want a bitch (f\*ck everybody but me) ..
2020-09-08 10:15:57,Rice-Paddy-Daddy,0,"First time being a bear, and I think I might be gay 🤑"
2020-09-08 10:15:35,itmetheSEC,2,What are we buying this has gone on long enough
2020-09-08 10:15:35,americaswetdream,1,vix always take a min to power up his punches but when he swings!!....
2020-09-08 10:15:07,SDOW-Investments,3,Is this what D-Day was like?
2020-09-08 10:14:47,Nushpapa,1,Buy tesla calls when it reaches close to 270 or will it break below?
2020-09-08 10:14:23,TConductor,6,This is why After-hours and Premarket shouldn't be a thing.
2020-09-08 10:14:03,LaurieDavis23,6,"Finish it for me boys. 

R"
2020-09-08 10:14:00,eerfdd,14,"Rip the guys who bought the dip Friday,"
2020-09-08 10:13:54,UBERto100,9,Guys. We need a murder investigation to figure out who killed aapl and tesla.
2020-09-08 10:13:41,thehope12345,5,Burn the fuckin market reset it from sept 1 I know what to do this time let’s go!!
2020-09-08 10:13:40,Huck000,5,bulls=fucked
2020-09-08 10:13:37,zanbeats,7,Tesla bleeding out. MEDIC WE NEED A MEDIC
2020-09-08 10:13:33,bye_stander2,5,gonna lose all my 2019 profits today. 2020 profits were already gone
2020-09-08 10:13:20,nosalute,3,Watch the noobies buy the SPY run up to 340 at open only for them to get trapped. Like taking candy from a retard
2020-09-08 10:13:12,silverlink22,2,"Jesus fucking Christ, I look away for four hours. What happened this time? That green was a fucking tease."
2020-09-08 10:12:52,onedollarpizza,14,Let’s tank SoftBank.
2020-09-08 10:12:40,maxulcgn,2,3..2..1.. next red wave
2020-09-08 10:12:30,Nick9502,3,Dahmp et
