date,author,score,body
2020-09-02 01:30:11,CambodianInvestor,0,the more exposure people have to stonks the more anti-semitic they become. this is a science thing!
2020-09-02 01:30:07,ReadAndReddit123,3,Big oil is back all in MRO
2020-09-02 01:30:05,ilivehereyouleave,-11,Puts on Wakanda
2020-09-02 01:30:02,laudy152,8,RuG pUlL iNcoMiNg
2020-09-02 01:29:59,carsonjargon7,1,Fucked up bigly today. My NVDA calls are down ~50%. Should’ve averaged down
2020-09-02 01:29:18,Birddoggy99,8,Do NIO leaps make cents?
2020-09-02 01:29:17,PedoFileDoggy,18,Fuckin financial advisor was trembling when I told him to take my dads retirement shit out outta bonds into the stonk market. They just don’t want me to pour my dads retirement money into TSLA AND APPLE TO MAKE SOEM TENDIES
2020-09-02 01:29:09,SpliffMaster489,1,No bubble when MZM money stock is up 25% in less than 4 months
2020-09-02 01:28:54,throwmeawayafter111,4,ily
2020-09-02 01:28:52,Peter_Banning,15,Is it about average for an account to increase 7% in a day?
2020-09-02 01:28:41,xbonzox,3,Seriously what's the next play? There is no entry point for anything.
2020-09-02 01:28:33,kobeef_,7,Wow i didn’t even notice ZM went up 40% today wtf
2020-09-02 01:28:28,Elite_Status_Flyer,8,I’m a retard. Can someone please tell me why the fuck the $800 10/14 TSLA call I bought this AM went up 26% while the stonk went down 4.67%?
2020-09-02 01:28:22,BigDickRetard69,2,What is the minimum amount of money you would have to win if you made it for you to feel ok trying to make an NBA 3 pointer with a 3 month old child?
2020-09-02 01:28:22,cw21398,12,If you sold NVDA you must hate money or your parents are cousins
2020-09-02 01:28:20,bcgraham,2,"Did QQQ companies add 10% of value in the last two weeks, or was everyone underestimating their true worth to the tune of ~10% two weeks ago?"
2020-09-02 01:28:17,Real_Martin_,29,"17 yr old cousin is telling me about how she made $16 of her stocks rn 

THIS IS THE TOP"
2020-09-02 01:28:11,jmremote,0,My HOME 9/18 $18 put going to do well tomorrow?
2020-09-02 01:28:09,bshaman1993,5,If wmt does another 5% tomorrow I'd be so happy
2020-09-02 01:28:03,kfuzion,-2,Tesla cucks sure are quiet tonight
2020-09-02 01:27:48,ASuag,5,I sold my CRWD position at close today 🤡🤡 Tried to frantically get back in AH but order didn't get filled.
2020-09-02 01:27:44,ReadAndReddit123,4,Nothing is red
2020-09-02 01:27:43,IAmConsidering,13,"There's no point in life, just misery, more and more everyday, no matter how I feel, manic, paranoid, depressed, it's miserable, everything changes so fast, fine one moment, suicidal the next. Idk how much longer I can go. I have no goals, no dreams, no aspirations, no plan, nothing. I'm just drifting away, withering till the end"
2020-09-02 01:27:35,TrenAndOptions,5,Last minute anti slut defense
2020-09-02 01:27:35,AlamoCandyCo,5,Up bigly on the aapl Tsla wave but have no idea when to exit
2020-09-02 01:27:33,umichjon,3,"Costco monthlies for earnings 

First time in a while I have been baited in by a post on here, I’m sure it will bite me in the ass 

10% OTM???"
2020-09-02 01:27:27,bagel_maker974,6,at this point it would be best for the tech bubble to burst while the fed is helping. Would just be a rotation into other companies lol.
2020-09-02 01:27:17,NoCollegeKids,1,How much longer is TQQQ gonna run?  Correct answers only please.
2020-09-02 01:27:17,Itsme_eljefe,3,"If AMZN hits within the next two weeks I’m buying my sister a new camera.

What do you all recommend?"
2020-09-02 01:27:10,Houston_swimmer,6,What if the real bubble was the retardedly otm weeklies we bought along the way?
2020-09-02 01:26:56,RideTheWaveRW,3,Futures traders blew the Nasdaq to 12k and dumped it before trading hours great
2020-09-02 01:26:47,Dumberjack,15,Imagine Tesla s&p announcement tomorrow
2020-09-02 01:26:38,notdanecook,1,Sippin’ on a gin and tonic to kick back and celebrate a good day today. What are thoughts for tomorrow boys?
2020-09-02 01:26:33,chumpaste,1,Anybody know what happen to Berkshire in those last few minutes
2020-09-02 01:26:30,microwave2016,2,What are that chances the CAD goes to par with the USD in the next two or three years?
2020-09-02 01:26:29,dsugg24,2,Someone want to explain the 3x leverage etn and Tesla? What does this mean?
2020-09-02 01:26:27,ohmy420,2,"PRPL leaps Jan 21 25c

We weren't ready for its glory and it rejected us. Get ready for its second coming"
2020-09-02 01:26:13,Bluemoonclay,13,"Woah missed the RKT AH moonshot, glad to see things are back to normal"
2020-09-02 01:26:13,jeffdidntkillhimslf,3,"When I first started option trading I thought it was completely stupid and irrational how the markets just kept going on up. Finally I just accepted that's what they do, made a decent amount until being hit hard by the crash. This time around I accept stonks only go up and making great profit like I should've before. (Plus a dependency on VXX calls for hedges)."
2020-09-02 01:26:04,Desertbears,0,"Thinking of a tsla directional calendar at 600C on either side of baytery day. Sell the 18th, buy the 25th."
2020-09-02 01:26:02,dogthatbrokethezebra,10,"Just FYI, the last time the ‘crash’ happened via circuit breakers, it happened the night before. Over in EUR. That’s why we watch."
2020-09-02 01:25:54,Peter_Banning,1,Diamond hand tech leaps? Sell?
2020-09-02 01:25:46,Buildingdetroit,3,#MARTIN SHKRELI FOREVER WSB MOD. WAT UP DOE
2020-09-02 01:25:31,BestLoLadvice,3,"People should be picking up NVDA at a premium right now, all of you are just looking at hurrdurr DOCU earnings tomorrow and typical TSLA and AAPL. Look at the play that is right in front of you. So many people will buy in because of reading the news about it. NVDA 565 EOD tomorrow, 575 EOW, 600 EOM"
2020-09-02 01:25:23,hoobaacheche,1,P/E! Say what?
2020-09-02 01:25:11,PregnantPickle_,8,"It was the best of times, and it was the best of times"
2020-09-02 01:24:55,infinitelimits00,3,"It would be nice if GSX could tank on its earnings tomrorow but seeing they've been continually pumped last few months, I have low hopes for my puts which are already -50%+."
2020-09-02 01:24:47,jmc774,3,RKT bull bros what are we doing tomorrow? Dumping or holding past ER?
2020-09-02 01:24:44,Invincilble,12,I remember back when the riots first started from the killing of George Floyd and I thought a sell off was actually going to happen and lost 97% of my portfolio buying puts. Now I’m only buying calls. You’re straight up retarded if you think this is going down anytime before November. But don’t listen to the people making money. Keep buying puts because you’re too prideful/autistic
2020-09-02 01:24:40,G23456789,-6,How many circuit breakers tomorrow? 1? W? Maybe be 3?
2020-09-02 01:24:30,carlians,3,AMZN 10/16 4000C a stretch or just get a shit ton of December in the money AAPL calls?
2020-09-02 01:24:28,optionsCone,3,"Post Covid PE has been redefined to potentially exponential

See $ZM"
2020-09-02 01:24:19,thehope12345,5,Should I buy CRWD calls tomorrow?
2020-09-02 01:24:13,Iamkzad,6,This has been the longest game of baccarat with you autist retards. God bless you all.
2020-09-02 01:24:04,labradorstock,2,Will DOCU be another ZM?
2020-09-02 01:23:57,TH3PhilipJFry,22,What if WallStreetBets ISSSSS the bubble?!?!
2020-09-02 01:23:57,billygoatdaboss,15,Recently 29 and finally a tinder chick calls me “old man”. Guess it’s time to hit silver singles
2020-09-02 01:23:53,SpacklerCarl,1,thoughts on CLDR in the am?
2020-09-02 01:23:38,1005thArmbar,10,"""wug puww tomowwow uwu""

shut the fuck up, you prancing shits. no rugs will be pulled any time this week"
2020-09-02 01:23:31,jyjdlns,8,"I want to be in miami in the 80's and be like a rich man with a white suit

Would be so cool

Wish me luck"
2020-09-02 01:23:27,JawnxWick,4,TSLA to the Andromeda Galaxy Tomorrow after refueling today on Mars.
2020-09-02 01:23:20,MakerofMarkets,1,I need a play
2020-09-02 01:23:14,Mikey_GG,14,AAPL 140 EOW
2020-09-02 01:23:07,robbinhood69,9,"I’ve never seen this sub so bullish. Normally when everyone on this sub is betting one direction we’ve got like another week before half of us get wiped out

We still got time tho homies 😎 enjoy"
2020-09-02 01:22:33,MR_ARI_G0LD,20,Fuck I need Tesla to be bigly up tomorrow
2020-09-02 01:22:24,sc0tt_1990,12,Bulls very cocky.  Imma near permabull but this is getting ridiculous.  Sometime soon the MMs are gonna take that profit and the FDs are gonna remember why they are named.
2020-09-02 01:22:23,im4stocks,9,Smith and Wesson about to pull a ZM this week with earnings coming up. So glad I loaded the boat on that tasty dip yesterday 📈
2020-09-02 01:22:17,eyerollingsex,-2,"PELOSI SAYS AFTER PHONE CALL WITH TREASURY SECRETARY MNUCHIN THAT DEMOCRATS AND THE WHITE HOUSE HAVE SERIOUS DIFFERENCES UNDERSTANDING THE GRAVITY OF THE CORONAVIRUS RELIEF SITUATION -STATEMENT

[source](https://twitter.com/fxhedgers/status/1300964219957858304?s=21)

This why futures down now?"
2020-09-02 01:22:16,Dawgs0nTop,-3,Circuit breakers incoming tomorrow tread lightly
2020-09-02 01:22:12,thejoker4059,4,There's a 3X leveraged TSLA etn? 3LTS oh boy
2020-09-02 01:22:10,hushky,6,"Today's gain + tomorrow's watchlist: https://imgur.com/a/bwpSeou

Today:

- Added heavily to ZM, DOCU, and TSLA short put spreads

- Closed out TSLA long calls and call spreads (stock sale reverses trend, will wait for confirmation of upward trend to buy)

-  Closed out NVDA, W put credit spreads at ~80% gain. These were small-ish positions from Monday

Tomorrow:

- Look for opportunities to close out ZM 9/4 put credit spreads
- Add to TSLA put credit spreads for 9/4
- Add to DOCU put credit spreads for 9/4
- Add long calls for NVDA
- Close PD call credit spreads (wish I had bought naked calls here)
- Continue rolling 1% of daily profits into VXX 27/28 call spreads for 9/18"
2020-09-02 01:22:07,thegreengrendel,7,This is not a bubble
2020-09-02 01:22:06,Start155,3,$13K gain in a day is not that bad [https://imgur.com/a/Q3W2N3g](https://imgur.com/a/Q3W2N3g)
2020-09-02 01:22:05,-NardDog,5,when’s the last time we had a 1% down day on Spy? serious question
2020-09-02 01:22:00,carlians,8,Why are AAPL LEAPS so cheap?
2020-09-02 01:21:53,-nye-,11,I think Facebook is super gay but I made like $500 on a 2 minute day trade so it’s cool now
2020-09-02 01:21:50,xbonzox,1,TIL you can buy options on Manchester United and they report earnings on 9/22
2020-09-02 01:21:27,EdwardTittyHands,9,To buy or not to buy rkt calls in the morning
2020-09-02 01:21:20,churnAmex,-1,Wanna fuck something
2020-09-02 01:21:17,G23456789,1,Recent uptick in golden fuckboys. Some of you guys must have taken out your Tesla earnings and gave back to the WSB community
2020-09-02 01:21:13,lookingatstocks,1,My GLD calls are so fucked
2020-09-02 01:20:52,AlpacaStrap,5,"CLDR cloudera has solid gains as a tech stock and cheap premiums. Earnings is after close tomorrow

Gonna jump in some calls in the AM

Other than that TSLA AMD and AAPL"
2020-09-02 01:20:36,GTFOScience,5,"TSLA

AAPL

NVDA

What else is off the rails?"
2020-09-02 01:20:29,batmanonthelow,3,Anyway my 350 puts exp tom print 🙏🏻😭
2020-09-02 01:20:13,hellooodarkness,14,Damn my AAPL comment got 50 upvotes. I start to get really worried about my AAPL calls now
2020-09-02 01:20:06,eyerollingsex,1,Futures blew its load too quick
2020-09-02 01:20:01,kookchaser,3,Anyone else sell RKT calls eod?
2020-09-02 01:19:55,Isorry123,11,Coworker just mentioned he’s buying a PRPL mattress because it’s “comfy as fuck.” He has no idea its a meme stock hmm bullish
2020-09-02 01:19:39,obi1013,3,"buy every calls close, its free money on blue chips...but i didnt because im a fuckin pussy"
2020-09-02 01:19:36,infinitelimits00,3,Nikola Jokic doing some free advertisement so far for Trevor Milton tonight. Solid start for Nuggets but I wanna see Jazz win.
2020-09-02 01:19:36,Howard_510,6,Elon really had to fuck with us today with that offering announcement smfh
2020-09-02 01:19:22,duma0610,12,u/cpttonystark is the type of dude who....oh what the hell. WELCOME BACK!
2020-09-02 01:19:09,richhomie66,3,Micron is the sleeper long play. Might just put all my RKT earnings into them 2021 calls.
2020-09-02 01:19:05,silverlink22,8,"So how the fuck is this even happening? Everyone is just like, let’s wait for stocks to hit ATH, to start buying the fuck out of tech."
2020-09-02 01:18:49,SilverSpirit7,4,"Although every bubble is different, one common element in most bubbles is the willingness of participants to suspend disbelief and to steadfastly ignore the increasing number of cautionary signs. Another is that the bigger the bubble, the greater the damage it inflicts when it bursts.




An excerpt from Investopedia. Tread carefully gentlemen. We are clearly in a bubble."
2020-09-02 01:18:47,versacemansion229,2,"Seems like MOMO is a play for tmrw. Earnings up play, gotto go tits up"
2020-09-02 01:18:39,Mitesite,3,"Friendship ended with TSLA

Now AAPL is my best friend"
2020-09-02 01:18:39,-rigga,4,AMD leaps? 2022 ATM not too pricey tbh
2020-09-02 01:18:38,Smooth-Criminal-TCB,3,What time is generally best to sell the day of earnings
2020-09-02 01:18:37,bl0ckburner,1,This is the last time I’m going to preach about SBUX$.
2020-09-02 01:18:24,kw2024,5,rUg pulL ToMoRrOw
2020-09-02 01:18:21,Bluerigg,3,When do we retest the lows I was told in April we will retest the lows
2020-09-02 01:18:08,Itsme_eljefe,2,"ASML TSM MU 

All going to be solid plays for the next long while"
2020-09-02 01:18:05,perpendosi,1,Can a vaccine news cause nasdaq to correct?
2020-09-02 01:18:03,LeVraiLomepal,12,Watch tesla have a mega green dildo as soon as sp500 is announced. My retard senses tell me it’s coming very soon🚬
2020-09-02 01:18:03,robbinhood69,1,"Do any of ya’ll get some cheap weekly hedges ? I mean i know they normally expire worthless but also makes it so I can sleep at night

I know I could also just not have the entirety of my account in positions but that’s just not realistic"
2020-09-02 01:17:50,Dawgs0nTop,2,Aladdin will be in town tomorrow for what they call a rug pull
2020-09-02 01:17:32,SemperPereunt,9,Bag hold my RKT call through earnings and lose money when it crashes after selling my ZM call before earnings yesterday and missing out on too many tendies.
2020-09-02 01:17:31,Osgiliath,6,"Can someone explain what happened in June, how fast it was, how widespread, and why you couldn’t sell fast enough to avoid getting wiped out?

I started trading in August so I wasn’t there."
2020-09-02 01:17:24,WhiteWhenWrong,7,The leaked dark blue iphone looks good as hell
2020-09-02 01:17:23,Trumpowell,8,$PTON is going to $120+
2020-09-02 01:17:21,gherna67,3,"So, I know this is a denny's but tomorrow I plan on actually picking up my first set of leaps.

AAPL 185C 1/21

RKT 45C 3/19

UAL 50C 1/15

does anyone have any advice? Plan on actually putting them into my long term portfolio and just not paying attention to em for a while"
2020-09-02 01:17:17,905the_one,1,Hulk dick green on slv
2020-09-02 01:16:52,ASuag,8,"Wug Pull needs a trigger, there's no trigger this week. Ride on boys"
2020-09-02 01:16:49,trulygenericname1,-6,"What will hit 400 first? SPY, QQQ, or TSLA?"
2020-09-02 01:16:49,-NardDog,5,SPY 369 EOM
2020-09-02 01:16:45,ilivehereyouleave,7,Bitch
2020-09-02 01:16:33,dsugg24,11,Held my 550 and 545 9/4 Tesla calls... little sketchy but I know papa Elon will cum thru
2020-09-02 01:16:26,silverlink22,6,"SMH, South Korea literally is about to get wiped out by two typhoons over the next 5 days and they(KOSPI) are rallying."
2020-09-02 01:16:18,takehtakeh,1,יש דוברי עברית כאן?
2020-09-02 01:16:17,TSLA1000,6,Buy high sell higher
2020-09-02 01:16:04,PassiveF1st,1,Think I can go wrong just investing all my money in Amazon Netflix Nvidia PayPal and Tesla?
2020-09-02 01:16:00,zrsper,8,"ZS, RKT, CRWD, WORK, AAPL"
2020-09-02 01:15:54,SolitaryEgg,2,Man futures really didn't waste any time finding the reversal point. Shit usually doesn't happen until like 2am
2020-09-02 01:15:45,alex21turner,6,"We’re just missing the icing on the cake, the moneyshot finish on bears face.. the Tik Tok MSFT deal being official. We have a 3% day minimum for SPY QQQ and even boomer IWM"
2020-09-02 01:15:39,infinitelimits00,5,"I'm not a bear but I've started putting on some small shorts last few days. Not Tesla, Apple, Microsoft, or 🚀 though. Those will moon hopefully."
2020-09-02 01:15:23,GlassNeighborhood,3,um so who in America is buying all these tech goodies if we have 10% unemployment and the fed is pushing an agenda of high inflation?
2020-09-02 01:15:22,dd16134,2,"I told people on here to buy $SWAV when it was $42, again when it was $50, and I think once more at $57. FFS if you like money at least buy and hold 1 or 2 Dec slightly OTM calls"
2020-09-02 01:15:20,mussorgskysghost,3,The DXY has caused innumerable issues for my portfolio
2020-09-02 01:15:20,Zorbok97,1,Anyone playing EGAN? What are you opinions on holding through earnings or bailing?
2020-09-02 01:15:15,kananishino,2,I was told everything was priced in such as my existence but it doesnt feel anything is priced in.
2020-09-02 01:15:13,perpendosi,3,What are your thoughts on costco
2020-09-02 01:15:12,Septseraph,1,Is bubble the new leg down? The is no bubble. Just the new paradigm.
2020-09-02 01:15:05,-nye-,2,Rag Pill
2020-09-02 01:15:02,SpacklerCarl,2,what calls in the A.M
2020-09-02 01:14:59,hutch281,4,Any guesses on when Tesla will be included in the S&P?
2020-09-02 01:14:59,EpiStat,5,"Is it stupid to buy a single AAPL 1/21 $140c?

Edit: it’s all I can afford"
2020-09-02 01:14:47,killeral7,9,"Imagine you time the bubble and sell before it pops and buy some puts... I think this is what every bear behind the scenes are thinking tonight, universe give me a sign"
2020-09-02 01:14:46,tendie-dildo,11,"Thank you Tim 🍏, formerly Tim 👨‍🍳, for all the gifts given 🇺🇸💪🐂"
2020-09-02 01:14:45,daytrader7222,9,"How high SPY and QQQ could go, before some pullbacks??"
2020-09-02 01:14:24,Desertbears,9,TSLA stock price guesses for battery day?
2020-09-02 01:14:24,throwingitanyway,15,fuck i've never even come close to paying as much in taxes as i'm going to have to next year. shit's about to get weird
2020-09-02 01:14:11,SpacklerCarl,13,I honestly feel like I should only trade when I have a day trade...
2020-09-02 01:14:10,4chanstan,2,Imminent rug pull is imminent
2020-09-02 01:13:54,lgdamefanfanfanfan,16,Nasdaq is undervalued
2020-09-02 01:13:44,howboutthemgators,19,I bag held my WMT 9/18 140c’s for 6 weeks and I finally let those fuckers go today. I earned that shit
2020-09-02 01:13:39,shacoand2boxes,10,I’m thinking of going long $MSFT til tiktok deal is over.
2020-09-02 01:13:12,manufacture_reborn,13,"Every day I think we can’t go higher - and every day I’m wrong. Seems that this rally refuses to quit.

Mark my words, knowing when to set aside greed for more gains will separate those who gain from this insane rally and those who lose it all."
2020-09-02 01:13:05,Smooth-Criminal-TCB,8,Mulling over whether to hold RKT options through earnings
2020-09-02 01:12:53,TEdward504,-18,This bubble pops tomorrow boys. Hope you have puts or cash
2020-09-02 01:12:49,JerseyFlashBoys,14,Utah Jazz a bunch of bums
2020-09-02 01:12:35,joefromdownstreet,8,"Apples to apples comparison here. RKT is 20x bigger than $TREE (20k employees vs 1,000), TREE has $4B mkt cap, $RKT should have $80B cap to be even. Divide that by 2billion share and that would give RKT a share price of $40. Not even accounting for Rockets projected growth, a fair stock price as of right now should be $40 per share. Still WAY undervalued💰"
2020-09-02 01:12:32,troylus81,2,I'd be surprised if the pj traders can get NQ past 12k on their own. I feel like we'll have to at least test it and come down a little for a refuel.
2020-09-02 01:12:29,SDOW-Investments,9,I’m in a great deal of pain following an ankle surgery but I’m still laughing at u retards and autists. I seriously love u guys sorry for getting emotional😥👨‍❤️‍👨
2020-09-02 01:12:16,marketingdesigner,3,Whats the best money/macro podcast you listen to?
2020-09-02 01:12:12,eyerollingsex,1,If you’re using an options profit calculator on weeklies you probably shouldn’t be trading weeklies
2020-09-02 01:12:03,Dawgs0nTop,-11,Rug pull tomorrow
2020-09-02 01:11:59,905the_one,1,Wayda go chynaaaa what’s next a new Covid strain ?
2020-09-02 01:11:55,ensoul,4,Gold will go back up after it bounces off of some bogus trend line that changes every week
2020-09-02 01:11:51,986fan,1,I'm impressed with the resilience of $RACE the Ferrari F1 team is utter shit this year but the stonk doesn't drop much if anything it goes up
2020-09-02 01:11:50,kflippy,2,Is anyone playing FedEx?
2020-09-02 01:11:45,TH3PhilipJFry,10,It’s not a bubble until Apple hits 3T and TSLA hits 5T
2020-09-02 01:11:35,duathman,3,Man I think I just saw SLV die.  That was one giant red pecker
2020-09-02 01:11:06,BertMacklinFB1x,14,FYI Dot Com Bubble lasted 5 years.
2020-09-02 01:10:54,Whit3Claws,3,is MSFT 240 possible by next Friday?
2020-09-02 01:10:48,I_Play_a_Girl_Sport,16,this market moves on retard strength and retard strength alone
2020-09-02 01:10:40,WhiteWhenWrong,4,Yoloing into bubbl..er...tech calls tomorrow
2020-09-02 01:10:38,UnwantedRelishMan,1,So just found out the public school I went to transports kids to the local Christian private school. Like is that shit even legal?
2020-09-02 01:10:20,WolfOfNallStreet,14,Where's secret Intel gang...shhhh👀🤫
2020-09-02 01:10:19,jimmyolsenblues,5,"##HOLD THE FUCKING PHONE.

if you make less than 104k a year, which I do. About half of that.  

I get a payroll check bonus cause Orange Man signed a document that says my paycheck is higher.

More Tendies for me.

Politics do not mean shit until it impacts a paycheck.

Did OrangeMan give me a pay raise? 

If so, Biden is done.

*edit* to every cunt who says ""u've pAy bAcK"" 

fuck your mother, i am trying to make tendies not pay roll taxes you awful shit cunt."
2020-09-02 01:10:07,thebigshowishere,14,"""We appreciate your business with us and apologize for the frustrations you’ve encountered with your Robinhood brokerage account. It’s very upsetting when we receive emails from our Robinhood customers with inappropriate language.""
						  						
""Though we understand your frustrations, the use of foul or threatening language will not be tolerated.""
						  						
Sincerely,
						
Francois





Fuck myself"
2020-09-02 01:10:00,MakerofMarkets,4,If you aren't loaded to the absolute tits with WMT calls are you even alive?
2020-09-02 01:10:00,BabyPanda-007,5,"Sold 25k worth of NIO, RKT & PLUG yesterday. I fuckin hate money."
2020-09-02 01:09:43,DOESNT_BE_LIKE_IT_IS,6,"WMT did me well today

sold to close a few of the Sept exp contracts and then sold calls on most others to lock in some profits

Holding the rest and praying for Tiktok news 🙏 

[https://imgur.com/a/Y3rE2g2](https://imgur.com/a/Y3rE2g2)"
2020-09-02 01:09:32,KelbySmith,1,any other 10 bagger earning plays or OTM options you guys eyeing
2020-09-02 01:09:26,G23456789,2,"Need to follow the whale buy and sell orders for RKT tomorrow, that’ll decide whether I sell or hold"
2020-09-02 01:09:22,throwawayitouch,3,I've been getting all my options plays from TikTok influencers and I can't believe it's working lmao
2020-09-02 01:09:14,BuyThoseDips,7,Odds that S&P announcement comes before weekend?
2020-09-02 01:09:11,infinitelimits00,3,DOCU about to tank 20% on earnings because I said so and it's gonna tank the entire stay at home tech sector.
2020-09-02 01:09:09,mlbmpc1210,5,"Waiting to see who buys tic tok, so holding  my calls on both MSFT & WMT"
2020-09-02 01:09:05,YOLOing_2Success,7,Red days are extinct lmfao RIP bears
2020-09-02 01:09:02,adamantiumstaff,2,How would the tech bubble burst even happen? Or even look like?
2020-09-02 01:08:57,BentoMan,7,What if no one is buying these stocks and it’s just hackers printing dollars or some shot and this market will never crash because it’s digital and who knows what is real or not.
2020-09-02 01:08:47,sideways923,3,might sell everything tomorrow. just kidding i'm buying more
2020-09-02 01:08:42,somanychins,3,How the F did silver get this high if it only dumps.
2020-09-02 01:08:24,Ban_787,10,"Futures are bullshit gunna be flat by open like every fucking day. Don’t get excited till morning, less pain."
2020-09-02 01:08:16,mdudigam,4,Anyone NIO $20c 9/4
2020-09-02 01:08:16,frzgg,3,"If the benchmarking numbers are legit for Intel tomorrow, can this get back to the 60s soon and get back in on AMD?  Should change the narrative that caused the flip."
2020-09-02 01:07:57,475563,13,"Listen to this:

Before the crash (correction)... The whole kingdom of WSB (🐻, 🐂, 🦘, and 💵cash holders) will unite. We will all agree that a correction is needed, for the good of all, for the good of the Index, and for the good of our Economy🇺🇸.

 I'm not saying, I'm just saying."
2020-09-02 01:07:49,clarence_worley90,5,holy fuck the volume and ramp in futures
2020-09-02 01:07:47,imsilver4fukyou,2,"Damn, must be a rough week for one of you [bears] (https://www.reddit.com/r/tifu/comments/ikhubg/tifu_by_asking_my_gf_why_she_was_feeling_sad/)"
2020-09-02 01:07:41,somanychins,2,Tomorrow is TWTR day. You heard it here first.
2020-09-02 01:07:39,bobachop,4,Tsla is making literally the dumbest people I follow on social media thousands... this is the definition blissful ignorance
2020-09-02 01:07:34,frzgg,2,I really hope everyone who is heavily invested in calls also has a large VXX call position.  The shake out from June is coming soon.
2020-09-02 01:07:34,TheCuriousKea,2,If ATVI could peak at $90 in the next 2 weeks that’d be greaaaaat
