date,author,score,body
2020-04-27 22:10:51,BVB_TallMorty,4,"""Nancy pelosi was out in the streets and dancing in chinatown"""
2020-04-27 22:10:46,v0xb0x_,0,So no one's gonna ask a disinfectant question?
2020-04-27 22:10:43,dwdsquared2,2,He's flying through questions
2020-04-27 22:10:38,flyingeverywhere11,1,JOHN
2020-04-27 22:10:37,,3,"Forget it gay bears,  It's Gynatown"
2020-04-27 22:10:36,Balzac7502,0,Tyrone has to read his question from his phone
2020-04-27 22:10:32,,1,PPPPPPPPPPP
2020-04-27 22:10:32,ABirdOfParadise,1,oan gets a chair today
2020-04-27 22:10:32,Fakerul,1,Sell any major index
2020-04-27 22:10:31,kkeshav97,1,Trump has a crush on Nancy
2020-04-27 22:10:30,Schobeyy,3,what do I do when my 112 shares of LK get delisted from RH lmfaooo
2020-04-27 22:10:26,AveenoFresh,3,Democrats have inflated the mortality rate? Sounds about right.
2020-04-27 22:10:25,NoftScarlet,1,Bulls r kill
2020-04-27 22:10:21,pervsensei11,1,Will the real slim shady please stand up
2020-04-27 22:10:15,,2,draftkings losing all their gains. smh
2020-04-27 22:10:14,PeanutButter91,4,These questions seem planted
2020-04-27 22:10:07,balloonhi4000,2,🚀🚀🚀🚀🚀
2020-04-27 22:10:05,GatorMD12,7,Fav story:  Nancy dancing in the streets of CHYNA town.  LMAO
2020-04-27 22:09:58,curiousprovisions,3,I love how this entire sub is bearish on AMZN. Thank you! Can't wait for my calls to print on Thursday
2020-04-27 22:09:56,AveenoFresh,2,"""The situation is always evolving and the messages to journalists are always dependent on incoming information""

Would have been a good answer."
2020-04-27 22:09:51,pervsensei11,5,Let’s go out and PARTY
2020-04-27 22:09:50,ubun7u,2,Please stand up
2020-04-27 22:09:43,Dans2016,10,"DO NOT ask ""unfair questions"" people. China is banned. No more red days."
2020-04-27 22:09:35,socalfive,3,"Someone ask him what countries are asking advice from this admin, so I can buy puts against them."
2020-04-27 22:09:31,THExNeo,16,NANCY DANCIN IN CHINA TOWN! GOT EM!
2020-04-27 22:09:30,myerszombie,1,calls on AAL
2020-04-27 22:09:29,DonnySmallHandsTrump,6,PARTY GIRL NANCY!
2020-04-27 22:09:26,worldsbestuser,3,lets go out and   p  a  r  t  y
2020-04-27 22:09:24,ayymerican,1,where the fuck is gordon
2020-04-27 22:09:23,dwdsquared2,10,"""I can tell you that Nancy Pelosi was dancing in the streets in Chinatown""

-DJT"
2020-04-27 22:09:21,Replicant07,3,"So all I heard on today’s briefing was CALLS on: 

CTN0
RAD
QTIP:CN
WMT
CVS
WBA

Did I miss anything ?

EDIT: + DGX , LH"
2020-04-27 22:09:15,newiphonettt,4,lol trump not falling for the reporter BS today
2020-04-27 22:09:08,BroasisMusic,3,A lot of people didn't get that right.
2020-04-27 22:09:00,Fujit0ra,2,"Kids going to carry it right into their Nana's lap. Can't pay for the old and sick anymore, best to let the virus take em out."
2020-04-27 22:08:59,xlmtothemoon,4,this first question is a sign trump is gonna go off today i can feel it
2020-04-27 22:08:59,ApartheidClyde,2,LOL Azar cucked
2020-04-27 22:08:53,balloonhi4000,6,SHOP MSFT AAPL FAT GREEN TOMORROW PLEASE WITH CUM ON TOP
2020-04-27 22:08:53,slothtastic24,5,"So unless this constant going up does actually hold. If there is another decline/crash of some kind, VIX, HAS to go back up right?

 I don’t think there would be any kind of gradual drop. It’s not like we’d see weeks with 3-4, -3 to -5% days. I don’t think it’d be possible to get back to lows without severe drops. 

 If that starts happening, panic sets in and leads to swift sell offs and crashes, meaning VIX goes up. Again that’s only if it doesn’t just keep going up. 

Dont even know why that matters, just trying to discuss"
2020-04-27 22:08:51,patmccock86,2,"lol what a deflection, feather and tar Azar"
2020-04-27 22:08:50,b3rnitalld0wn,1,Anyone have tickers on the CEO parade today? Looking for some individual company puts.
2020-04-27 22:08:50,gambler_no_1,1,Video from 2020 audio from 1990
2020-04-27 22:08:42,Steve529882,4,“Rapid but safety”
2020-04-27 22:08:36,Howard_510,1,Donnie’s shoulders looking extra square today
2020-04-27 22:08:35,dopeztmc,1,Franklin the turtles gone 😕
2020-04-27 22:08:30,AveenoFresh,3,"The word is safety, rapid but safety."
2020-04-27 22:08:30,swift_sadness,3,Just because the kids are fine doesn't mean the people the kids interact with are?
2020-04-27 22:08:22,TheyCallMeSWIM,2,I'm going to double down on GDX calls.
2020-04-27 22:08:20,karanrucks,3,Barron Trump wants to go back to school!
2020-04-27 22:08:16,mcchicken2,1,BYND and NAT calls for tomorrow. can i have one green day for the love of god
2020-04-27 22:08:14,Mintiful,1,Who bought 20k shares of MTCH at 81 after hours?
2020-04-27 22:08:10,CommandanteMeow,0,WAOWE FUTURES BLOOD RED -10% DAY TOMMOROW? BILL GATES LITERALLY CALLED IT SHOULDA LISTENED COCKY BULLS
2020-04-27 22:07:59,SaltyTrident,7,Futures could hit limit down 5 minutes from now and I still would believe we’d open green until it’s still red at 930
2020-04-27 22:07:58,ShwaggyDog,5,Safety...mmmkay
2020-04-27 22:07:57,pervsensei11,3,"As quickly as possible but safely.

THATS WHAT SHE SAID"
2020-04-27 22:07:52,,1,OPEN THEM SCHOOLS UP YEEE HAW
2020-04-27 22:07:49,yolo2death,1,Let’s go boys let’s pump this baby up 🚀🚀🚀
2020-04-27 22:07:48,Schobeyy,2,"does anyone know what NAT is?? my dad bought a bunch of things named ""calls""? for them expiring may 15th for me and it looks like theyre worth something so imma just sell them"
2020-04-27 22:07:44,FederalFood2020,1,I've often thought of becoming a swab.
2020-04-27 22:07:41,flyingeverywhere11,2,QAQAQAQAQAAAAAAAAAAAAAAA
2020-04-27 22:07:37,ryit29,2,Bear markets don't moon enough to let longs cash out. This is no exception
2020-04-27 22:07:31,GamblingMikkee,1,Dow down 150 points
2020-04-27 22:07:31,121518nine,2,NAT is gonna cum hard tm
2020-04-27 22:07:31,ABirdOfParadise,1,YES QUESTIONS
2020-04-27 22:07:30,soap808s,4,Who would be fucking excited if SP gets back to 3300 so we can short this fucking scam.
2020-04-27 22:07:26,Marnsy16,2,"Internship just got moved to online, big W boys. Calls on me"
2020-04-27 22:07:17,StreicherADS,2,"Our testing will be 4x Korea's

Meanwhile our population is what, 8x higher?"
2020-04-27 22:07:17,JoJoBabbit,1,My guess is we’ll open at Spy 282/283.
2020-04-27 22:07:17,pervsensei11,1,"Someone please write a swab count script.

Number of swabs = point at what SPY opens tomorrow"
2020-04-27 22:07:16,Arcanne,2,Only a matter of time til we open green 1% 🚀🚀🚀
2020-04-27 22:07:16,alohaclaude,5,"🌈🐻gang  we are fighting the good fight, no matter how much we lose. :I"
2020-04-27 22:07:14,Howard_510,1,I thought Donnie was done with pressers. Couldn’t help himself huh. Good I fucking love these
2020-04-27 22:07:13,newiphonettt,1,STEVE-O TIME
2020-04-27 22:07:13,,1,QUESTION TIME BABY
2020-04-27 22:06:58,bdepz,4,Questions are happening bois
2020-04-27 22:06:58,dwdsquared2,2,Scarf Wars!!!!!
2020-04-27 22:06:56,WittsandGrit,3,Here we go
2020-04-27 22:06:55,USFederalReserve,1,"""I'm very exciting right now"" 

Bet."
2020-04-27 22:06:48,SJWBill,3,Can it just be tomorrow already?
2020-04-27 22:06:42,THExNeo,3,GALVANIZE
2020-04-27 22:06:24,PlasticRice,7,"WSB: Oh man, the market is always rigged! It's all market manipulation! I'm never trusting futures again!

--> futures at 6:01 PM show we're down -0.7%

WSB: YOOOOO MY PUTS ARE GOING TO PRINT, LET'S DO THIS LMAOOOOOO GOOD THING I ALL-INNED ON EOD FD'S

--> market opens following day, trades sideways / SPY up +2%

WSB: Oh man, the market is always rigged! It's all market manipulation! I'm never trusting futures again!"
2020-04-27 22:06:15,Madchillhouse,3,Where were you when VIX was killed 😢😢😢
2020-04-27 22:06:14,PeakOfTheMountain,3,Has ZM died yet?
2020-04-27 22:06:09,24901Miles,2,Calls on SWAB
2020-04-27 22:06:09,Trenchalicious,2,Rocket firing in the background? KJU still going strong!
2020-04-27 22:06:08,TheHydroElite,1,Look how weak the bears are !! LMAO get fucked noobs
2020-04-27 22:06:05,bdepz,3,So far this is basically no news.
2020-04-27 22:05:55,MagJack,1,you ever had a swab shoved up your...?
2020-04-27 22:05:55,BVB_TallMorty,5,"No one cares, just tell us if tomorrow is uppy or downy"
2020-04-27 22:05:50,Dans2016,2,Why they're talking so much about cotton? Making q-tips is highly complicated?
2020-04-27 22:05:49,socalfive,4,"OH FUCK WE'RE OUTSIDE! GREEN TOMORROW BOYS 

YOU KNOW THE RULES >"
2020-04-27 22:05:40,,2,Longs sound nervous.
2020-04-27 22:05:38,JoJoBabbit,5,How did those USO calls work out autists?
2020-04-27 22:05:35,PeakOfTheMountain,5,Everything is fine. We've made it to checkmark 8/8.
2020-04-27 22:05:35,DrDonkeyBrains,3,S W A B S
2020-04-27 22:05:32,ChunsLLC,3,Swabz count: 4
2020-04-27 22:05:25,Trenchalicious,2,Futures are literally the 🌈 🐻 last stand
2020-04-27 22:05:23,option-whisperer,2,Before messing with USO [read this](https://www.forbes.com/sites/jimcollins/2020/04/20/the-us-oil-etf-uso-is-the-culprit-behind-oils-massive-plunge/)
2020-04-27 22:05:23,MmmDarkMeat,3,"Trump issues new guidelines opening up the country and getting people back to work and WSB is claiming it’s going to be a red day. 🙄


Texas just opened up too."
2020-04-27 22:05:22,cobaltz0rz,-1,Futures way down boys. Looking like those 5/1 spy 240p gonna print!!!
2020-04-27 22:05:11,ThePickleJarGambit,5,Can’t wait for red futures to turn green overnight. DIX dropping tho so that’s nice.
2020-04-27 22:05:10,newiphonettt,2,this presser so boring. THANKS FOR RUINING IT REPORTER CUCKS
2020-04-27 22:05:08,stinkyholetime,3,Seems like these pressers aren't that entertaining anymore. boring really
2020-04-27 22:05:03,notenoughminera1s,3,Any of you autists holding INO calls?
2020-04-27 22:04:56,GatorMD12,3,"DD:

Zantac pulled from market for causing cancer 

Pepcid gonna cure Rona and increase market share 

MRK with other COVID activities.  

MRK 100c 6/19  YOLO"
2020-04-27 22:04:48,drummerboye,5,"""My life is about swabs"""
2020-04-27 22:04:44,TheOriginalRK,3,Really hope Tesla rebounds in the morning
2020-04-27 22:04:40,I_have_a_dog,2,Puritan (sp?) calls ASAP
2020-04-27 22:04:32,THExNeo,3,A lot of my life is also about swabs.
2020-04-27 22:04:26,metamaoz,7,Charles Swab
2020-04-27 22:04:24,pervsensei11,5,8 part plan. 8 points. 8 days to get us back in business. 1 day 1 point. 8 days AMERICA IS BACK IN BUSINESS
2020-04-27 22:04:21,interviewshirt,3,Rule 4 is the dumbest rule in here
2020-04-27 22:04:19,CCPCanuck,5,High speed chase going in the background?  Fuckin DC 😂
2020-04-27 22:04:13,dwdsquared2,5,This guy swabs
2020-04-27 22:04:06,umbrellacorgi,12,This guy looks like he uses the dewey decimal system to organize his sock drawer
2020-04-27 22:04:04,DynamicDentures,6,"Recession over, pandemic cancelled, I’m going to baskin robbins tomorrow boys"
2020-04-27 22:04:04,ChunsLLC,4,Dr. ambASSador Brix
2020-04-27 22:04:00,dopeztmc,5,turtles up to speak 🐢
2020-04-27 22:04:00,WVULuke,2,"I’m pretty sure 90% of the people who say “bulls are fucked” at 6-midnight are just fucking around as jokes, but then the other 10% of you actually are serious and cling to the futures to try and help comfort your self while lying in the fetal position that you won’t be down $1,000 at open in the morning from your puts."
2020-04-27 22:03:57,duch350,3,Anyone playing pfe earnings
2020-04-27 22:03:57,mindx3d,2,"Looks like green by 12 pst.


always happens"
2020-04-27 22:03:54,Howard_510,4,-5% tomorrow would be nice. I’m counting on this single Vxx call to save my portfolio
2020-04-27 22:03:44,Balzac7502,2,Starting to look like a normal person
2020-04-27 22:03:39,pervsensei11,13,Donnie pls go off script and ask me to down a tide pod.
2020-04-27 22:03:36,newiphonettt,2,Looks like he got a slick new haircut for the opening of the country
2020-04-27 22:03:35,aunitpls,4,just red enough to give bears hope
2020-04-27 22:03:34,drummerboye,3,"""Ambassador Birx."" She is from outer space after all"
2020-04-27 22:03:33,Cam2071,1,I wonder why he just doesn't sit down?
2020-04-27 22:03:31,YangGangBangarang,3,Flatter than my girlfriends tits
2020-04-27 22:03:30,bdepz,2,Stage 3: coordinate with governors. Govs are making their own pacts and doing their own shit. This is not coordinated at all
2020-04-27 22:03:22,GRINGOxFLAMINGO,-1,We’re opening at 275 tomorrow
2020-04-27 22:03:20,JustLookingAroundFor,4,Trump should say some wild shit so everyone forgets he asked about injecting Scrubbing Bubbles
2020-04-27 22:03:16,BVB_TallMorty,3,Did he call this meeting to pimp 10 companies and tell us we are testing
2020-04-27 22:03:13,Lothire,2,DEEP fuckin red futures boys!! Almost 0.07%
2020-04-27 22:03:11,throwaway78907890123,3,Ambassador Birx?!
2020-04-27 22:03:07,soap808s,5,Anyone here think Donnie is a smart and sharp businessman?
2020-04-27 22:03:01,galra001,3,Wow really should have held NAT :(
2020-04-27 22:02:54,mattlockesreddit,5,id date dr Birx
2020-04-27 22:02:49,NoftScarlet,0,🚀
2020-04-27 22:02:47,rekdizzle,5,Never flying a Boeing plane again. I avoided Boeing’s 737 max on my Europe trip anyway last year and took a nice sexy AirBus. So salty about my calls.
2020-04-27 22:02:47,gambler_no_1,7,"People with 7 figures in bank balances, how does it feel to wake up and see those numbers ? 🤤"
2020-04-27 22:02:47,PeakOfTheMountain,3,It's 60 degrees there. Why she dressed like it's snowing?
2020-04-27 22:02:45,ballstreetwhets,2,Calls on Mugatu Fashion House and I guess shodily made scarves
2020-04-27 22:02:45,HazardousMako,1,rip bulls. had good run. smart money peace'd out and we will be **BIGLY** red tommorow.
2020-04-27 22:02:44,bear2008,2,If NAT hits 10 by eow I will shit my pants
2020-04-27 22:02:38,balloonhi4000,3,TOMORROW AAPL MSFT AND SHOP WILL BE SUPEr GREEN
2020-04-27 22:02:38,THExNeo,3,"Alright this presser is lame, we need Donnie to go off script and tell us to drink bleach again"
2020-04-27 22:02:38,guykirk9,1,"“.1%” “bLoOd rEd”

🥴"
2020-04-27 22:02:37,zeddknite,6,"This what they want to do, not the plan of how to do it"
2020-04-27 22:02:35,ryit29,2,Why does futures even bother being red when they know it's going up
2020-04-27 22:02:27,pervsensei11,5,This slide was made by some intern 5 min before the presser
2020-04-27 22:02:26,serg-dawg,9,Futures could go -5% tonight but I know 30 mins before open that shits going to the moon
2020-04-27 22:02:22,lucasandrew,3,"I love how /ES closed at 2856, opened at 2867.75, then dropped a little (still above the 4:25 close) and people are yelling ""RED."""
2020-04-27 22:02:21,feral_tit,3,Wow UFOs from the navy
2020-04-27 22:02:18,Nilladg,4,Tomorrow we gonna blow green dildos boisss and I’m sad cause I have puts😢😢😢😶😶😶😕😕😕😕😕😕
2020-04-27 22:02:15,tendiebears,-3,BLOOOD REDD Y'ALL THOT THIS RECESSION WAS CANCELLED
2020-04-27 22:02:14,Count_Stacksula,1,"Will the dollar maintain global reserve currency status if interest rates go negative?  

\*shakes magic 8 ball\* 

&#x200B;

&#x200B;

 signs point to yes"
2020-04-27 22:02:12,WittsandGrit,2,85% chance that Birx has healing crystals in the pockets of that jacket.
2020-04-27 22:02:10,mrauls,1,Say INO trump
2020-04-27 22:02:09,bdepz,3,Fuck the scarf lady where's fauci
2020-04-27 22:02:08,Nemo-pluribus-unum,4,First question going to be about bleach. Watch.
2020-04-27 22:02:07,HiBoobear,1,Serious question. What would have to be announced during TSLA earnings for it to actually go down?
2020-04-27 22:02:03,GatorMD12,2,LEAN HOG BITCHES
2020-04-27 22:02:00,moneyandbanking1,4,"Hoping John from CNN throws a shoe.

Let's spice this bitch up already!"
2020-04-27 22:01:55,DonnySmallHandsTrump,1,hahahah wtf was that
2020-04-27 22:01:45,Dyunder,2,Quick write a 1500 page paper on testing. Got you bro
2020-04-27 22:01:43,BVB_TallMorty,3,He always says 1917 lmfao
2020-04-27 22:01:42,drummerboye,2,I'm sure Republicans agree that government has no way to pull off this plan.
2020-04-27 22:01:39,jb767,6,Activate Birx space suit moon rocket  🚀
2020-04-27 22:01:35,cackalackattack,3,BLOOD. FLAT.
2020-04-27 22:01:32,Dans2016,2,"So, ""partnership"" means FDA approving all the stuff these companies make, right?"
2020-04-27 22:01:29,Clipy9000,2,"Is there any actual reason why bears hate zoom? The whole world is either using zoom now as a lifeline to continue business or will likely start using it as a risk mitigation/disaster recovery for future pandemics. 

I don't see why this isn't gonna keep mooning"
2020-04-27 22:01:27,dnesdnal17,2,Printers jammed?
2020-04-27 22:01:25,Switchrx,5,Y’all member VIX? I miss vix
2020-04-27 22:01:23,EugeneApplebottom,4,Birx looks like one of the rich people buying slaves in Get Out
2020-04-27 22:01:21,TheHydroElite,4,HAHA time to get bears excited all night and Ramp their arse
2020-04-27 22:01:17,basegodtrevor,1,Whys FB tanking ah?
2020-04-27 22:01:15,JustLookingAroundFor,1,Why are they outside she looks freezing
2020-04-27 22:01:15,Trenchalicious,5,Robot testing. That’s how we beat this. Get on it Elon
2020-04-27 22:01:14,saiine,7,"You telling me they have unlimited QE and cannot get a fucking clicker for presenters so they don't have to yell ""next slide please"". Is this the White House or a fuck boy IT org."
2020-04-27 22:01:14,pervsensei11,5,Birx’s hair looks like she was raw dogged by Trump before the presser
2020-04-27 22:01:11,FBULLFORD,-2,futures blood RED
2020-04-27 22:01:06,flyingeverywhere11,3,they couldn't give her a fucking clicker?????
2020-04-27 22:01:02,UnwantedRelishMan,2,I thought Donnie was done with his press conferences
2020-04-27 22:00:57,,4,"I'm out. Nothing new, boring bla hblah

open the economy let's go"
2020-04-27 22:00:51,serg-dawg,-9,Futures BLOOD RED
2020-04-27 22:00:49,ApartheidClyde,3,"Didnt this bitch Birx talk about using a Google site 2 months ago, where Google will tell everyone where the testing center is and people will go there.

Why will anyone believe this bitch now?"
2020-04-27 22:00:49,bloopy3,3,Hello Star Trek lady
2020-04-27 22:00:48,TheAvantGardeners,1,Where's Tony Fauci?
2020-04-27 22:00:47,karanrucks,3,seems like she wore that scarf before. Can we get the WSB intern to check
2020-04-27 22:00:42,ryit29,4,"If you guys spent more time researching stocks than watching these press conferences, you would make more money"
2020-04-27 22:00:39,mindx3d,-1,🅱️ed
2020-04-27 22:00:38,flyingeverywhere11,1,"if there's QA, I wonder if a reporter will ask about drinking clorox"
2020-04-27 22:00:33,pervsensei11,4,1917 was a 100 years ago.
2020-04-27 22:00:33,DomOnRs,1,big red DILDO
2020-04-27 22:00:29,Isthiswittyenough92,3,He definitely forgot what the spanish flu was
2020-04-27 22:00:27,roast617,6,Who’s slanging lean hogs tonight with me? Yeeeehawwwwww
2020-04-27 22:00:27,ABirdOfParadise,1,alexa play wayfaring stranger
2020-04-27 22:00:25,WittsandGrit,15,Birx looking like an early morning Manhattan walk of shame.
2020-04-27 22:00:19,BVB_TallMorty,1,Dr Bear coming up
2020-04-27 22:00:19,Bluerigg,2,"2020 - 1917 = 103

103 > 100

You're right donny!"
2020-04-27 22:00:16,wizard_mitch,7,1917 over 100 years ago confirmed by Trump. I wish he messed that up somehow.
2020-04-27 22:00:16,soAsian,3,1917 - Is Mango talking about WWI?
2020-04-27 22:00:16,THExNeo,2,OH FUCK BIRX IS COMING UP. IM FUCKING BONED UP BOYS.
2020-04-27 22:00:16,fritalar,2,Now its time to getting his dick sucked by Birxie
2020-04-27 22:00:13,newiphonettt,2,Facui in basement
2020-04-27 22:00:12,DonnySmallHandsTrump,3,man fuck this fake bitch
2020-04-27 22:00:11,PeakOfTheMountain,2,I can't stop putting migo's ad-libs behind everything he says.
2020-04-27 22:00:11,pervsensei11,1,Energy and spirit like the world hasn’t seen for a LONG LONG TIME
2020-04-27 22:00:07,BroasisMusic,1,"1917 was over a hundred years ago?

No body could have known."
2020-04-27 22:00:03,virtu333,8,"""you all know what happened in 1917"" 

he forgot what happened in 1917"
2020-04-27 21:59:58,XPgains,4,"Going ALL-IN on Boeing this week.

[https://www.cnbc.com/2020/04/27/airbus-warns-staff-of-coronavirus-impact-potential-for-more-job-cuts.html](https://www.cnbc.com/2020/04/27/airbus-warns-staff-of-coronavirus-impact-potential-for-more-job-cuts.html) 

Boeing will have almost no competition, if Airbus can't even stop the bleeding for 2 months."
2020-04-27 21:59:54,DonnySmallHandsTrump,1,^(what happened in 1917?)
2020-04-27 21:59:42,pervsensei11,5,Donnies new favorite word has changed from VENTILATORS to TESTING
2020-04-27 21:59:41,Jfri33ss,1,"“And here we go” 

*done in Rick voice.*"
2020-04-27 21:59:40,newiphonettt,4,Trump pumping so hard for futures open
2020-04-27 21:59:34,dwdsquared2,2,Get ready for aggressive flip-points at reporters.
2020-04-27 21:59:31,TripBallsEveryday,1,What's the consensus on HOG?
2020-04-27 21:59:26,drummerboye,2,"""other countries are calling us to ask how to do testing. We're helping *them* just like we helped them with ventilators."""
2020-04-27 21:59:23,,2,"ES first 15 min candle closes red.

edit: timeframe don't matter tho tbh"
2020-04-27 21:59:23,moneyandbanking1,3,"Come on just say ""hidden enemy"" so I can get a bingo"
2020-04-27 21:59:21,lucasandrew,1,"My favorite part of holding options on futures is that after a short break, I get to watch things go up and down all night if I want and I can dive into another trade if the government fucks something up or good news happens."
2020-04-27 21:59:20,BrownBoiler,2,This dude is so fucking dumb I want to pull my hair out
2020-04-27 21:59:12,24901Miles,6,"What a stupid play, fuck up testing response, then come now bragging how you boosted the testing, even as it is 10s of millions less than if you just got off your ass originally. Hopefully the market is smart enough to know this number is woefully less than near what is needed to reopen"
2020-04-27 21:59:09,EugeneApplebottom,11,Do bears not understand they can just buy calls and make money?
2020-04-27 21:59:04,BVB_TallMorty,3,There was literally no point to this press conference
2020-04-27 21:59:04,pervsensei11,2,Recession cancelled bois Donnie has a BLUEPRINT
2020-04-27 21:59:02,,1,Losing on snap puts and MSFT calls. Isn’t that great??
2020-04-27 21:59:00,,4,Pence told me there would be a testing facility in every walgreens and walmart a month ago
2020-04-27 21:58:55,saiine,2,"I hope he takes questions and the very first one is about the bleach, and he just storms off - but he sort of scuddles like a penguin instead of walking regularly and cries."
2020-04-27 21:58:52,JustLookingAroundFor,3,Why doesn’t trump make other people say the boring shit then he just comes out after and starts calling CNN gay dog shit
2020-04-27 21:58:52,MagJack,1,where is Birx
2020-04-27 21:58:47,Nemo-pluribus-unum,3,King of ventilators!
2020-04-27 21:58:46,manufacture_reborn,1,"Jumped on to some May 1 PFE calls for no reason except the autists told me to. 

Reminds me of when I was just a wee retard here on WSB and yoloing at Micron. Simpler, stupider, times man."
2020-04-27 21:58:42,PeanutButter91,5,TAKE YOUR SHIRT OFF DONNIE!
2020-04-27 21:58:36,dwdsquared2,2,"Walmart having COVID-19 testing sites by end of May is pretty green for the whole market tomorrow, I think.
Testing was Birx & Fauci's big hesitation before opening."
2020-04-27 21:58:35,TKSGosu,5,"The one fucking time I yolo 10k into TSLA calls for earnings

Why the fk would you say you're re-opening factories in the morning and then say JK it's just a prank bro after markets close. Motherfkers gonna cost me big tomorrow"
2020-04-27 21:58:35,bdepz,3,Press questions are gonna be the real show
2020-04-27 21:58:24,orangemanbad20,1,Lol he’s making all these CEO’s sit through this
2020-04-27 21:58:18,feral_tit,2,I hope the country enjoys their last excursions outside of their homes
2020-04-27 21:58:16,creamdreammeme,1,SMG = 420 = 69
2020-04-27 21:58:14,DontKnowWhatImDoinnn,1,DGX (Quest Diagnostics) at ATH rn
2020-04-27 21:58:09,IronSunDevil,1,ITS A GIGANTIC NUMBER
2020-04-27 21:58:03,,1,BOOOOOORRRRRRRIiiiiiiiiiiinnnnnnnnnnnnggggggg
2020-04-27 21:58:01,dccourtesan,2,Please pump Teladoc and Labcorp please.
2020-04-27 21:58:01,steatorrhoea,-3,Futures gap down
2020-04-27 21:57:58,abeslton_Trees,0,My MRNA 5/1 52.5c calls are going to print tomorrow morning. New ATH possible with phase 2 article. Love u pharma
2020-04-27 21:57:56,ZenDreams,1,I wonder if Donnie will take questions today
2020-04-27 21:57:45,tonygenius,-1,Is he quivering?  Is he that afraid of saying the wrong thing now?  Kind of feel bad for him.  Almost.
2020-04-27 21:57:34,,5,"He hasn't said anything retarded yet and sounds coherent.

Blood red tomorrow."
2020-04-27 21:57:28,trumpuniversity_,2,Did Vince McMahon speak yet?
2020-04-27 21:57:27,dccourtesan,1,SPY doesn’t need your negativity Trump.
2020-04-27 21:57:26,_FundingSecured420,3,"#Gigantic, absolutely gigantic"
2020-04-27 21:57:22,el_copt3r,3,i legit thought he was about to say he fucked up
2020-04-27 21:57:20,ch1p_skylark,3,wtf lmao who is he trying to blame?
2020-04-27 21:57:18,THExNeo,3,THE LIST DONNIE! HOLD UP THE LIST!
2020-04-27 21:57:17,moneyandbanking1,9,"After watching all the pressers to this point 

This shit is boring

Wheres the arguements? Video clips? Conflicting statements?"
2020-04-27 21:57:14,IVCrushingUrTendies,3,Is he going to mic drop at the end of this and skip the Q/A?
2020-04-27 21:57:13,Quatto,-1,These CEOs will help put the light in your body
2020-04-27 21:57:13,diabeetusboy,1,I don’t know how AH works- if MRNA pops 10% tonight I assume we expect a gap up tomorrow? Am I too late to the tendy show if I buy at open?
2020-04-27 21:57:07,Pineapple_applesss,2,What is the sentiment on $F earnings?
2020-04-27 21:56:58,ubun7u,3,Why does trump stand like there are oranges stuffed in his armpits
2020-04-27 21:56:54,newiphonettt,2,someone could have stopped all this? wtf
2020-04-27 21:56:49,saiine,5,Did he just blame WHO for all the deaths of the pandemic?
