date,author,score,body
2020-07-26 23:47:08,ShawnHans007,11,PLUNGE PROTECTION TEAM ROLLIN UP IN CYBERTRUCKS AND BLACKED OUT CHEVY TAHOES
2020-07-26 23:47:08,alecisdad,6,who gives af about futures GREEN BY OPEN
2020-07-26 23:46:58,stunner47,1,One can actually start betting on dow futures if it finally ends at red or green !
2020-07-26 23:46:47,dodoei,1,What’s the big deal. Make it 3205 then. 3205 will be the new ceiling!
2020-07-26 23:46:29,bagel-master,4,"Sooooooo

Airlines are gapping up 10% PM and then another 10% normal hours, right?

Please confirm my biases"
2020-07-26 23:46:23,ArUaArugula,3,Lets see em asian markets
2020-07-26 23:45:57,zayplus1997,8,$CDE & $AUY calls. Optimistic yet realistic unlike these moon monkeys
2020-07-26 23:45:57,dingdongs-4-charity,3,If only bears could sell their horrible options at 6:30 on sundays
2020-07-26 23:45:54,SusiePowell,3,"I just need like one day at 330 and then do whatever you want markets idc fucking go to 0 idc. Just go to 330 real quick, like all I need is 30 seconds"
2020-07-26 23:45:50,ExtremelyQualified,2,I’m a big ol bear but y’all need to chill. NQ is only down -0.25% and people out here talking about circuit breakers.
2020-07-26 23:45:44,Throwawayeconboi,10,melt up plz melt up plz melt up plz
2020-07-26 23:45:43,xS0uth,5,My moves tomorrow? To lose money like everyone ... Isn't that the point of this game?
2020-07-26 23:45:41,CambodianInvestor,-6,gold will never ever hit ATH again
2020-07-26 23:45:24,Relaxed_Engineer,1,Alexa play Rise by Herb Alpert
2020-07-26 23:45:17,CombodianBreastMilk,1,1 red day won't kill my vibe.
2020-07-26 23:45:12,JefBezosExWifesNewBF,14,WHO IS FUCK PLEASE SOMEONE TELL ME WHO IS FUCK😭😭😭😭
2020-07-26 23:45:08,JustAsk_Me,2,$AMZN 7/31 3500c ! Earnings this week and it’s already touched 3200 before
2020-07-26 23:45:04,Rianis96,4,Bears are so retarded ik because i was a bear for the last 4 months getting absolutely railed
2020-07-26 23:45:01,tropicalia84,10,Oh no. Asia and Europe futures are going to pump like crazy tonight.
2020-07-26 23:44:44,AsaKurai,5,"The news headlines will drive Monday and it’s nothing but Covid so, we’ll see whether this weekend has been more good news or more bad news"
2020-07-26 23:44:22,Nick9502,6,Nikkei Futures up pretty well. Asia might take us with them
2020-07-26 23:44:17,RightTackle,5,"For you metals retards: whatever is the prevailing WSB sentiment of the moment, do exactly opposite of that. Signed, the corpses of last week's Tesla call gang, MGM gang, tanker gang, SPY 220p gang."
2020-07-26 23:44:17,AdmiralSnakbar,1,How my MSFT 7/31 ninjas feeling
2020-07-26 23:44:14,bringerofheat,8,"Stocks only go up, everyone moons tomorrow🚀"
2020-07-26 23:44:05,JayCee842,1,Is Intel going to rebound
2020-07-26 23:43:56,winkerpack,4,"Anyone have some hand sanitizer or a wipe I can use? Thanks 

#👐🏻"
2020-07-26 23:43:46,Revolant742,-1,Nikkei no stop
2020-07-26 23:43:34,kriegkopf,5,Futures bipolar tonight
2020-07-26 23:43:32,horribleatthis1313,3,"If we could have a circuit breaker in the morning followed by the biggest pump this side of the Mississippi, I think I'd break even."
2020-07-26 23:43:21,SusiePowell,-2,"My life in a nutshell 


[works until it doesn’t ](https://i.imgur.com/YDpOuln.jpg)"
2020-07-26 23:43:16,nate223,10,AMD 📉
2020-07-26 23:42:51,Glass-Gain,2,I just know if I finally decide to buy some tech puts its gunna moon the next day
2020-07-26 23:42:21,reditt84,6,Nasdaq tanks after earnings this week and dow rises. Make no sense but it will happen
2020-07-26 23:42:13,spikiera,15,"check wsb, people screaming BLOOD RED.

check investing.com, future down 0.1%."
2020-07-26 23:42:11,fyuce,0,So whats the sentiment here? Was gone for a couple of hours.
2020-07-26 23:42:06,MediumDe,1,"Been looking into silver recently, what’s the best company to buy?"
2020-07-26 23:42:05,CptTonyStark,17,"This is the first time in months that my portfolio is all stocks, no options. I feel so peaceful. I can go to a Himalayan monastery and just meditate for years and come back and check my brokerage. 

I don't even care if the market collapses completely, I've already taken out my initial investment and half of my profits.

Every 0.01% movement in futures doesn't affect me anymore, whereas earlier it would lead me on a rollercoaster of emotions. I have achieved Zen."
2020-07-26 23:42:03,Gypsykilla,-1,Bears getting nervous
2020-07-26 23:41:51,HoosierPride,10,So who’s going to pay for this next Trillion? Here’s a hint: it’s not our parents. It’s all of us. Let’s not get numb to the magnitude of what’s actually going on rn
2020-07-26 23:41:34,piaskyj,6,Nikkie mooning
2020-07-26 23:41:27,SPB69420,1,Can anyone offer any serious suggestions for silver and gold stocks?
2020-07-26 23:41:10,genericQuery,1,"gonna buy a super OTM tesla put and sell it to some other loser. 

pretty sure tesla's going down for now."
2020-07-26 23:40:49,option-whisperer,0,Fuck the futures. When I decide to pull the trigger it V's bac. FUK FUK FUK. An fuck all of you!
2020-07-26 23:40:39,analfarmer10,16,BREAKING: UFC legend Conor McGregor announces he’s coming out of retirement for the 3rd time
2020-07-26 23:40:22,iWriteYourMusic,1,This SLV thing is so stupid. It already spiked hard. This is the opposite of buying the dip!
2020-07-26 23:40:20,dodoei,1,Told you 3200 is THE top
2020-07-26 23:40:18,argyleshu,-6,"You fuckers should be buying land, not stocks."
2020-07-26 23:40:02,howboutthemgators,6,Got in on SLV shares and 2021 calls back in May. Called a retard so many times. Now it’s funny to see the whole sub do a 180 in a week
2020-07-26 23:39:34,TeeDubbed,4,Picked up 7/31 SLV 18c's in June and sold way too early for a tiny profit...😢  Hoping these 10/16 30c's will make up for it!
2020-07-26 23:39:11,EasyResponsibility0,7,Buy 10k of SLV
2020-07-26 23:38:58,piaskyj,0,So I know we joke but is their a real posibility other countries start losing faith in our currency and it actually breaks down
2020-07-26 23:38:58,MoarTarriffs,7,"Calm down gay bears, we’re recovering already, your puts will be in shambles"
2020-07-26 23:38:20,ReftLight,12,"Bruh, futures is only a quarter down, more than 12 hours away from open, and some y'all acting like red day confirmed."
2020-07-26 23:37:46,Redhouse425,-7,2200 this week on the SPX retards. Heard it here first. Sunday 07/26/2020  6:38pm central
2020-07-26 23:37:35,learningoptions,6,"that's it, I'm jumping in on /GC"
2020-07-26 23:37:30,Vinyyy23,8,"SLV $22 leaps, CHGG $75 8/21, ED $80 8/21, LL $15 1/2021 (bought weeks ago sub $14).    Lets get it"
2020-07-26 23:37:04,Tendiebendie,5,"My opinion, most likely unpopular,  we're starting a bull run. Nobody stopping it, no matter how hard they try.

News is out. Money is changing hands 💰 

Close your shorts my fellow autists.."
2020-07-26 23:36:59,brianjamesxx,3,Bears: MaRkEt WaNtEd $3 TrilLiOn
2020-07-26 23:36:59,GGININDERLAH,1,"7/31 325P, when do we sell?"
2020-07-26 23:36:53,bobyhey123,44,literally masturbating to the silver futures chart
2020-07-26 23:36:36,lucasandrew,4,"Not the best start to the trading week I've had.

https://i.imgur.com/yQ2UieX.png"
2020-07-26 23:36:15,Tendiebendie,5,"Time has come to tell all yall Autistic fucks the truth about our man, the King.. u/CptTonyStark...."
2020-07-26 23:36:13,Sam_Handwich69420,8,State Farm. Has anybody ever met a black dude named Jake?
2020-07-26 23:36:12,oughmoment,9,I thought we were down 1% based off how bears were talking here jeez
2020-07-26 23:36:09,a_dumb_noob2,7,100x AMD 45p's 7/31 expiry gonna make me rich yo
2020-07-26 23:36:09,RememberSLDL,8,"Trump will pump SPY to $400, don't worry my brothers"
2020-07-26 23:36:01,quit_your_glitching,4,I’ve been screwed having puts too many times on stimulus news. If this is the one time it’s red on good news I think I’m done
2020-07-26 23:35:43,aryalmuskan17,0,It would be real nice for green day tomorrow after all this fucking blood last week. PuLlBaCkS aRe HeAlThY. Yea. Well now let’s Fucking pump
2020-07-26 23:35:39,PedoFileDoggy,1,You know what turns me on? Futures on a Sunday evening
2020-07-26 23:35:31,gege12345572,9,Spy 317p for tomorrow printing?
2020-07-26 23:35:25,cchung22,6,Need SPY below 316 EOD tomorrow. What are my chances?
2020-07-26 23:35:25,bobstaman,5,Yo for everyone riding commodities like gold/silver right now. Be cautious because it could take a fat shit if the market takes one. They'll bounce back even stronger but there could be a fat dip.
2020-07-26 23:35:06,ReadAndReddit123,8,"Man I miss mid April until early June those were the days. Everyone was hyped about their fresh new stimulus checks, extra $600 unemployment with no end in sight, no worries about paying mortgages or rent, and the market basically limited up every single day. It was like a 75 day cocaine party and now it’s all over"
2020-07-26 23:34:43,AdmiralSnakbar,1,"Geez you’d think it was -5 percent in here
Fucking bears man"
2020-07-26 23:34:19,RealisticHumanBot,6,"this is the part all the bears get quiet and sad

*dang, it happened again*"
2020-07-26 23:34:16,piaskyj,27,Who here is shiny metal gang?
2020-07-26 23:34:10,thtguy90,4,Double bottom on the 15 minute confirmed. Green as fuck opening.
2020-07-26 23:34:04,Tomos1977,8,Lol precious metals are the way of the future...the US dollar is now monopoly money. Literally invest in gold unless you want to be stuck holding worthless paper and fiat currency. We're now Zimbabwe
2020-07-26 23:33:49,reditt84,3,"Someone in their right mind tell me how we can possibly be red this week with amazon and google reporting this week ? You guys are dumb as fuck 
Maybe after they report by not before"
2020-07-26 23:33:46,ComplexLock,11,"How many times have we seen red futures turn green overnight and green futures turn red overnight? 

Hint: Futures don’t matter until like an hour before open ✌️"
2020-07-26 23:33:41,AssistRegMngr,3,Small cap has always been bullied
2020-07-26 23:33:38,SusiePowell,3,"EVERYONE Stressing the fk out and this negativity over isn’t helping me! Can we just have some positive news for a second 😭. Anything plz, I’m scared."
2020-07-26 23:33:34,rojan-rando,5,How do you exercise your call instead of just selling it? Is it automatic in Robinhood if you have enough cash
2020-07-26 23:33:10,Algorisum,8, JPow printer going brrrrrrr my GLD calls going brrrrr
2020-07-26 23:32:56,pyramid_eth,5,GOLD 2000
2020-07-26 23:32:54,GardinerAndrew,3,Is there a inverse usd etf?
2020-07-26 23:32:53,IronManKillsThanos,16,"Lol silly bears, we haven't had a red monday since......*checks calendar*.......last monday!"
2020-07-26 23:32:45,xRiotZx,12,KEEP DRILLING DXY YES OH YESSSS
2020-07-26 23:32:44,Purple-Flurple,1,"Monday looking rough. I think over next 8 weeks I’m going to scale out of this qqq and hope my theta brings me gains. 

Doing about $14k a week in decay"
2020-07-26 23:32:43,kohlarncowboy69,9,"So if more free money is gonna be sent out then I can YOLO $1,200 on a weekly lottery. If it doesn't work out then I lose nothing if I win I make more to lose later.  📈🧠"
2020-07-26 23:32:35,CaptainPlatano,38,i want my stimulus check sent in silver.
2020-07-26 23:32:35,MushroomManiac,8,125k - SLV $26c 12/31
2020-07-26 23:32:30,dodoei,7,3200 is now the absolute ceiling. Sell everything near it.
2020-07-26 23:32:29,AdrianThatGuy,12,"Every 60 seconds in Africa, a minute passes"
2020-07-26 23:32:29,NursingMajorMatt,3,"Honestly, I’m not to worried at all. Circuit breakers and limit up days are behind us now. We have grown from that"
2020-07-26 23:32:22,stanky_puss,4,"People playing silver are just like tanker gang. They go so in depth on DD even though any retard knows silver will go up. Just like tanker gang, they will be so consumed in their over complicate DD that they will hold and watch their 2000% gains wither away into a 95% loss."
2020-07-26 23:32:20,stonkpicks,1,I don't even know what is real and what is an onion article anymore: https://www.mirror.co.uk/3am/celebrity-news/elon-musk-challenges-johnny-depp-22420043
2020-07-26 23:31:58,Rvin16,11,Some retard compared metal gang to tanker gang lmao. Gtfo
2020-07-26 23:31:57,Post_Austin,3,"Silver chart gonna make me cummm

https://www.jmbullion.com/charts/silver-prices/"
2020-07-26 23:31:53,analfarmer10,1,iPhones >
2020-07-26 23:31:46,bigkev2569,3,GDXJ 7/31 65c 🤑
2020-07-26 23:31:29,HumpedHerDumpedHer,7,so here's my morning tomorrow.  wake up.  scratch nuts for a bit.  roll out of the sack.  have a healthy dump.  put on a coffee.  short the sweet and ever living fuck out of NKLA.  then either jerk one out or just go back to bed.  god bless.
2020-07-26 23:31:15,Bender-BRodriguez,11,"If you havent learned to inverse WSB by this point, you have no hope."
2020-07-26 23:31:15,Bubbledood,5,Can you make beef tendies? Chicken fried steak is a thing- has anyone ever thought of cutting it into strips first?
2020-07-26 23:31:08,Freeon1,-1,"Fucking Bulls kept saying it all day.. 

Anyway bull or bear

Read this 

https://www.axios.com/senate-republicans-white-house-covid-stimulus-a7490c48-fa66-455f-82f3-24405b351621.html

Don't be so fucking sure bout your bill as I have been saying

Now fuck off retards"
2020-07-26 23:31:01,argyleshu,-3,We have reached a point where corporations are looked at as higher powers. Kind of weird to think about to be honest. They aren’t going to save you. They are full of greedy fucks that are selling their shares to you as we speak.
2020-07-26 23:30:54,CambodianInvestor,3,not too late to ride silver and gold to the sky
2020-07-26 23:30:46,kex06,9,"See comments that say we're blood red. Decide to check futures

&nbsp;

SPY down .25%

&nbsp;

LOL"
2020-07-26 23:30:45,lakersbestinleague,7,Sold my silver but at least I got gold+gold miners still
2020-07-26 23:30:43,sasqus,1,stocks only go down 😔
2020-07-26 23:30:28,ThePeoplesBard,4,https://i.imgur.com/KmRAczJ.jpg
2020-07-26 23:30:26,Personmind,1,I expect a lot of fake good news this week to combat July 30th. Theta gang I guess?
2020-07-26 23:30:12,Frijolesenyourmouth,2,"if by some miracle it is actually seriously red tomorrow, just remember, you can always take safety in a Roku.

&#x200B;

lol fuck that shit and that pos company...unless you have like a tube tv or some poor old people shit."
2020-07-26 23:30:06,bobstaman,-1,BILL BILL BILL BILL! DRILL DRILL DRILL DRILL!!... OH...
2020-07-26 23:30:03,lacasabatlot,1,"rate VISA 202.50 7/31 c

&#x200B;

am i retarded?"
2020-07-26 23:29:56,StockNewbs,6,SLV +2% lol
2020-07-26 23:29:53,Colonel_Cubical,3,Guess I should have held SLV
2020-07-26 23:29:45,sfsfsfsfsf1,1,maybe DIX is onto something. consistently at or below 45 for 2 weeks or so...
2020-07-26 23:29:40,SwoleStoner,2,"Hope my AMZN 7/31 bros make some tendies, I bitched out and sold for about 3.5k loss cause I got TP hands."
2020-07-26 23:29:32,bobstaman,3,"SSSSSTAGGGGG....  
FLAAYYYYYYYY....  
SHUUUUNNNNNNN....."
2020-07-26 23:29:23,lag_daddy,2,For anyone who thinks we're crashing take a look at the Daily/Weekly chart.  Enjoy your max 0.5% dip tomorrow and I'll see you at 330 on Friday
2020-07-26 23:29:15,IveGotNoOtherOptions,6,"Bears have been malnourished, starved, endangered. Only the strongest bears have survived, relying on old tendies from a previous time where bears roamed free and wild. These bears are fighters and they may come to reap tendies before going back into hibernation."
2020-07-26 23:28:55,freezmaface,2,Chasdaq will be leading the indices by open and that’s a fact
2020-07-26 23:28:48,AltMayne,0,"tHiS tImE iT's DiFfErEnT. 

Just buy calls on the gun manufacturers who are gonna make bank from all the new traders. I'm looking at a nice smith and Wesson for when I lose everything."
2020-07-26 23:28:34,argyleshu,4,The recent selling has been insider selling and some hedge funds switching their positions from net long. The real selling hasn’t even started yet.
2020-07-26 23:28:18,Harry_Butterfield,18,AUY $7 at open 💪😤
2020-07-26 23:28:17,the90sbaby,15,"Boys.. we spent thursday and friday consolidating at 320, which is super bearish. Now when the 320 support finally breaks we are going down hard and fast to the next support. Don’t act surprised when you see spy down 2-3% tomorrow"
2020-07-26 23:28:17,RightTackle,-2,I'd smash
2020-07-26 23:28:15,RealisticHumanBot,0,"stimulus is equitably distributed which reduces wealth inequality which is why we're not mooning

layoffs though? war? bezos trillionaire? bullish"
2020-07-26 23:28:13,2019alt,9,"For anyone too stupid to look for themselves, NASDAQ is down .35% and SP500 is down .25%. Fucking relax, people."
2020-07-26 23:27:56,-nye-,6,This sub is like looking at the market under a microscope.
2020-07-26 23:27:55,MoarTarriffs,2,"[WSB prediction poll for tomorrow ](https://www.strawpoll.me/20667895)

This sub is 15/27 on predictions so far"
2020-07-26 23:27:47,seesaw32,8,Ooo fuck. Accidentally just clicked the Indices tab and not the Indices futures tab and had a mini stroke. If you know you know.
2020-07-26 23:27:43,financethrowaway889,2,"I tried to make them go metal gang lawd, but they just wouldn’t listen."
2020-07-26 23:27:41,Harry_Butterfield,9,SLV +5% at open. 💪😤
2020-07-26 23:27:22,MoarTarriffs,17,Damn whyd this sub get bearish so quickly
2020-07-26 23:27:18,Give_me_an_M3,5,AMZN and MSFT WILL NOT FALL
2020-07-26 23:27:13,aryalmuskan17,3,I cant do anything right. Paper handed my amd 60c 8/21. Paper handed my SLV August calls. I need to sit of my fucking hands and be patient and stop looking for the 20% gain on the august 21 calls when there’s a month left
2020-07-26 23:27:13,FPSJon,2,7/31 AMZN are we scared?
2020-07-26 23:27:05,tipsystatistic,19,"Sure, we wasted $7 Trillion and destroyed the dollar, but at least we made stonks go up for a few months. Worth it."
2020-07-26 23:27:01,Vincent3313,-2,Are my 8/7 aapl and intc calls fucked
2020-07-26 23:26:53,omswindles,1,Close some atm calls I wrote on spy.. try not to lose my last shirt.
2020-07-26 23:26:42,Albylikes24,-1,It is time.
2020-07-26 23:26:28,argyleshu,9,"Government debating stimulus is basically arguing whose rich friends gets the most money since the country is fucked. If it’s not a universal basic income, it’s just to butt fuck the middle class and make the rich richer."
2020-07-26 23:26:22,OverAndUnder500,3,[bears when they see futures are red](https://mobile.reuters.com/article/amp/idUSKCN24P288)
2020-07-26 23:26:18,RightTackle,8,Imagine being so gay that betting on fucking metals gets you going
2020-07-26 23:26:06,fbi-office,-1,[Some of us have been saying this](https://www.reddit.com/r/wallstreetbets/comments/hwd4xj/daily_discussion_thread_for_july_23_2020/fz06bmr/?utm_source=share&utm_medium=ios_app&utm_name=iossmf)
2020-07-26 23:26:03,SusiePowell,5,HODOR HODOR HODOR HODOR
2020-07-26 23:26:00,dylansd8,6,2000 gold is a must
2020-07-26 23:25:58,blasianduuuuuune,15,Never thought I’d feel FOMO on fucking Silver 😂😂😂
2020-07-26 23:25:45,Twoverybigwords00,7,I ❤️🥈😍🥰
2020-07-26 23:25:43,ReadAndReddit123,5,[Wow that guy was right about Women’s College Beach Volleyball ](https://www.instagram.com/p/B8zwAF3ABvZ/?igshid=11m3xjnhyqzq3)
2020-07-26 23:25:39,iredditacc,-1,How predictive are futures of the market? Can’t  futures be red and Nasdaq still go up?
2020-07-26 23:25:35,oughmoment,3,GLD predictions for tomorrow?
2020-07-26 23:25:32,Threwaway1994,3,"Jerome Powell used Stimulation!...

*It was not very effective.* 

Donald Trump used Twitter!...

*The Market hurt itself in confusion.* 

Coronavirus used Spread!...

*The Market fainted.* 

MM fled away safely."
2020-07-26 23:25:09,Bluerigg,1,I wonder who goes to bed to earliest here 🤔😴
2020-07-26 23:25:00,RealisticHumanBot,2,time to take out friday's LOD
2020-07-26 23:24:59,brunoclement,7,let's fucking go gold! all time high 7 dollars away
2020-07-26 23:24:54,Whiskey-Papa,9,"SLV predictions for tomorrow?

Up 5%"
2020-07-26 23:24:47,BaxterFax,4,"Well I got these AMD puts at the top, hope they be printing this week"
2020-07-26 23:24:34,wolfenstein1998,3,[Nancy Pelosi still supports $600 unemployment ](https://twitter.com/SpeakerPelosi/status/1287487113408249857?s=20)
2020-07-26 23:24:26,skrrtingallday,8,Spy down .3% and we have bears throwing a party when the sun is still up
2020-07-26 23:24:15,rah_karo3,1,1.... red ... 2 red ... 3 red .... drop
2020-07-26 23:24:11,SusiePowell,3,"Bro I swear you gay bears are good. You ALMOST had me this weekend, but I snapped myself out of it. I’ll never fight the feds. I love the feds. The feds are friends not food. Y’all almost had me this weekend I’ll tell you what boys... almost got me."
2020-07-26 23:24:00,RedBull2408,11,Green face ripper tomorrow
2020-07-26 23:23:48,,19,"How green we opening, kings?"
2020-07-26 23:23:46,oradell18,13,Silver you beautiful angel. Just float back on up to heaven no one will stop you🥰
2020-07-26 23:23:45,KingInTheNorthVI,3,Well shit thank god im cash gang. Can’t wait to buy some of these dips
2020-07-26 23:23:31,ShakerIce,16,Metal Gang 🥇🥈🤘🏼
2020-07-26 23:23:11,Ban_787,8,Cant remember the last time bears got 3 red days in a row
2020-07-26 23:23:04,Harry_Butterfield,4,I'll give you 30 shares of SLV to stab that dude over there.
2020-07-26 23:22:58,Hippoman_,7,"Lol we're not even down 1% and you guys are all like omg futures look bad, shit never matters. It matters where we're at open."
2020-07-26 23:22:56,Davejacobs257,5,My amzn plays are done for tomorrow.  I tried.
2020-07-26 23:22:50,NormalGap,5,For the next 2 weeks being a ~~bear~~ bull is officially retarded.
2020-07-26 23:22:40,ProfessionalCrazy3,10,Yes baby! Gold is up 0.42%!
2020-07-26 23:22:38,Laurensio_,5,Bloodbath tomorrow
2020-07-26 23:22:21,staywavvy,7,All weekend I’ve been thinking about entering on some SLV calls Monday 😡now I’ll have to wait for a small pullback
2020-07-26 23:22:09,xRiotZx,3,God I'm so glad I didn't listen to any of the bulls on USD here. We are drilling straight to hell. Gonna add to my short position tomorrow.
2020-07-26 23:21:33,ThePeoplesBard,20,"Every day at 12 PM: “Damn, all the movement is AH and premarket.”

Every night at 12 AM: “Futures don’t matter!”"
2020-07-26 23:21:25,tipsystatistic,11,"“Senate Republicans grow weary with White House over stimulus bill

Frustration among many Senate Republicans, not to mention Democrats, toward the White House has hit a fever pitch, with many lawmakers — including Majority Leader Mitch McConnell — admitting they could break for the August recess without a stimulus bill.”"
2020-07-26 23:21:19,GnRgr2,2,"Chamath is bullish on tesla

https://youtu.be/hX6Cp4vNexc"
2020-07-26 23:21:08,e_brakedrip,4,"Say hello to the new depression guys; $dxy still getting smashed a long with USDJPY. Metals soaring; and even now /es continues down even after stim news.

Let’s all give a warm welcome to hyper inflation!"
2020-07-26 23:21:05,KingInTheNorthVI,13,Women’s college beach volleyball?? Sign me the fuck up
2020-07-26 23:21:01,MoarTarriffs,0,Can someone reassure me that my calls will be ok
2020-07-26 23:21:00,ReadAndReddit123,11,Can’t wait to finish a six pack in the morning and tell everyone how I really feel on this 9AM conference call
2020-07-26 23:21:00,daddyjumboshrimp,6,Be smart. BTFD retards 🇺🇸
2020-07-26 23:20:46,GourmetFilet,6,"Hey Alexa, play Red Dildos Up the Ass"
2020-07-26 23:20:44,Ramboow23,1,"My INTC short position that I held on to by accident, because I didn’t close my ITM put position on time, would love a red Monday."
2020-07-26 23:20:39,NoLimit315,0,"And therefore Crates replied to the man who asked, ""What will be in it for me after I become a philosopher?"" ""You will be able,"" he said, ""to open your wallet easily and with your hand scoop out and dispense lavishly instead of, as you do now, squirming and hesitating and trembling like those with paralyzed hands. Rather, if the wallet is full, that is how you will view it; and if you see that it is empty, you will not be distressed. And once you have elected to use the money, you will easily be able to do so; and if you have none, you will not yearn for it, but you will live satisfied with what you have, not desiring what you do not have nor displeased with whatever comes your way."""
2020-07-26 23:20:24,CaptainPlatano,1,WE NOT HAPPY WITH $1 TRILLION STIMULUS?
2020-07-26 23:20:24,somanychins,1,"Gotta find the bottom before we can start climbing. That didn't take long. Whew, was looking pretty bad for a minute there."
2020-07-26 23:20:18,WDWCastMember,-1,"Uh oh, we're in trouble. Something's come along and it's burst our bubble."
2020-07-26 23:20:15,hakkihan,6,"Reckon NASDAQ will go down to 10,000? Or is that a bit too gay?"
2020-07-26 23:20:15,AssistRegMngr,7,My baby silver 😍
2020-07-26 23:20:15,argyleshu,6,"Get some land and invest in your soil boys, buy some seeds, get an arsenal of some guns, stimulus addiction is the beginning of the end."
2020-07-26 23:20:11,brunoclement,4,🥈🚀🌛
2020-07-26 23:20:03,PalekSow,5,Is this the gay bear experience. Being excited about shit tanking because that means my glorious metal calls will only become worth more.
2020-07-26 23:19:55,Give_me_an_M3,5,Nice little green chode there
2020-07-26 23:19:55,dodoei,5,Smart money ran away last week. Bagholders will feel the pain. Black Monday!
2020-07-26 23:19:39,wolfenstein1998,1,CNBC keeps mentioning the $1200 payment as if it is a fuck ton of money.
2020-07-26 23:19:37,jjwax,8,Y'all act like you've never seen -0.4% pump to green by open before
2020-07-26 23:19:14,G23456789,4,"Not gonna check this shit till 12 am, when I’m back this shit better be green"
2020-07-26 23:19:14,sfsfsfsfsf1,8,$1T stimulus isn’t enough
2020-07-26 23:19:13,thebreadjordan,4,Do I buy even more SLV tomorrow? Or is this the top?
2020-07-26 23:19:07,GourmetFilet,5,I think metal gang gayer than theta gang.
