date,author,score,body
2020-05-19 12:58:45,OverallPriority,1,home depot was destined to be flat. Everyone saw that beat coming a mile away
2020-04-02 19:52:07,baloobanooba,4,6 million people lost work last week.  That's like unbelievably huge and we know just the tip of the iceberg.  How the fuck is this market going up??
2020-04-02 18:35:40,buriburix,2,It hurts for 2 weeks. Been losing since that happened
2020-04-02 18:21:48,undermon,2,Bye bye uber 👋
2020-04-02 17:32:55,fbi-office,5,For sure ending red
2020-04-02 16:54:14,kevindgeorge,1," [https://twitter.com/realDonaldTrump/status/1245754978880241666](https://twitter.com/realDonaldTrump/status/1245754978880241666) 

&#x200B;

~~15~~ 30 days to slow the spread"
2020-04-02 16:22:54,thegregslife,-7,"Wow. Literally told y’all to buy calls EOD yesterday for a green pump today and I got downvoted into oblivion. Whatever, I’m making tons of tendies."
2020-04-02 15:42:59,Astures_24,4,Spy needs to pick a direction and stop jerking off 250.
2020-04-02 15:13:18,YT-JustLivinLife,8,Legally I can’t talk to you about my moves. You’re gonna need to talk to my advisor Gordon the gecko.
2020-04-02 15:11:12,Really_Very_Expert,3,"Bought some $DRI puts. 

Hopefully my butthole isn’t relentlessly ravaged by unlimited breadsticks in the next month"
2020-04-02 14:31:25,karlaxel2,7,Somewhere out there is a poor soul that “bought the dip” on Luckin Coffee before today...
2020-04-02 14:15:14,stefanyeung,6,jesus.how the fuck is boeing green?
2020-04-02 14:01:16,bshaman1993,2,Where's the volume? In this sub
2020-04-02 13:53:20,futureisours,2,Alright who yolod on lk when you saw it down to 4.6 or lower this morning. Going to be printing free money if you bought stock. Even at 8 bucks.
2020-04-02 13:52:46,,1,If I didn’t TP hands my Tesla puts yesterday I would’ve made up all my losses on Ulta beauty puts 😞
2020-04-02 13:48:16,michael_bud,2,Goodness TSLA tell us how you really feel.
2020-04-02 13:46:18,armadillo-army,3,stonks go up and down? weee
2020-04-02 13:40:18,jeffdidntkillhimslf,1,Higher number = higher number
2020-04-02 13:37:22,hardwaresofton,3,"Who is propping up Dave & Busters ($PLAY)? What am I missing about this company, do they have 1B in liquid cash just sitting around or something?"
2020-04-02 13:34:18,bshaman1993,3,Maybe if we had worse employment numbers spy would have mooned
2020-04-02 13:27:37,clay5049,3,Which lucky fucker had LK puts??? I made BANK on the LK rise but then got out.
2020-04-02 13:25:35,robert_is_cool,7,Sitting on my 5/1 SPY puts very patiently
2020-04-02 13:23:57,Tommys2Turnt,1,"ATVI go up all other Stonks go down, I'll be very happy"
2020-04-02 13:20:30,JediRoadie,3,Oh man if I held my 4/9 LK put.....
2020-04-02 13:17:35,jiraiya73,5,"BRRRRRRRRRRRRRR

Thats NOT the sound of printing

Thats the sound of drilling

BRRRRRRRRRRRRRRR"
2020-04-02 13:17:16,esisenore,3,Hows your calls looking today champ ?
2020-04-02 13:16:29,Fantasnickk,10,"6.6m unemployed announced

Fed: we will buy treasuries"
2020-04-02 13:13:27,AsaKurai,8,Can’t believe the market needed 6m job losses to barely turn red. Jfc
2020-04-02 13:12:51,itradeoptionsandfail,2,"I was prepared for to get my ass gaped being a gay bear, but now it seems the markets might have other plans"
2020-04-02 13:07:11,tt598,4,"[Coronavirus: Start-ups use Zoom app to lay off staff](https://www.bbc.com/news/technology-52091615)

Why is Zoom down?"
2020-04-02 13:03:51,ButtFart88,2,"“B-b-but the pandemic!!””” -future traders wondering desperately why we’re going down

Sorry future traders. You used impeccable logic to pump futures green amidst a global pandemic, but sometimes your amazing logic loses 😎"
2020-04-02 13:03:24,parker2020,2,Woah wait it wasn’t priced in and an almost 2% fade down is possible??? Printer went BANG last night
2020-04-02 13:02:37,Zaetzj1793,3,bear f(L)ag
2020-04-02 13:02:26,yeeeknow,7,"So in the last two weeks, we’ve had more workers laid off than during the housing crisis. Not trying to be a “fear mongerer” but this is scary. Anyone who is actually bullish at this time is delusional imo."
2020-04-02 13:02:04,tt598,2,https://pbs.twimg.com/media/EUmaXOrXgAAZGg2.jpg
2020-04-02 13:00:28,ftrv8,5,JPow has calls. 6.6M unemployed ain’t shit.
2020-04-02 12:53:26,yourfanboynick,3,This drop is totally normal.... apparently nothing is priced in
2020-04-02 12:52:41,eggsvy20,3,"Double claims for unemployment?

You know what that means: double moon!"
2020-04-02 12:51:19,toolfan21,3,"Giant red dildo! Bahaha, it pumped all night just to puke it all out in a matter of min."
2020-04-02 12:50:36,walrusrampage,5,"I'm jacked to the tits in energy sector and oil calls. Finally, my portfolio might see a solid green day."
2020-04-02 12:49:08,POOTERSS,3,6.6 mil that is ridiculous...
2020-04-02 12:47:41,Throwmeaway199676,4,This pump is actually the fakest shit I've ever seen
2020-04-02 12:46:16,IVCrushingUrTendies,1,So where do we stand as an unemployment percentage now compared to a couple months ago?
2020-04-02 12:45:35,youneedjesusbro,1,Look me like jeromes pumping
2020-04-02 12:44:03,purepwnage85,4,Did anyone here not think it wasn't already priced in? lol! JP morgan predicted 6m
2020-04-02 12:43:06,ColdManWinters,2,LK revealed to not be serving coffee at all
2020-04-02 12:40:57,vegaseller,7,Literally Great Depression 2.0 and futures still green.
2020-04-02 12:40:30,everythingisvanity,4,Can the market sell off any slower to this record unemployment news?
2020-04-02 12:36:50,karlaxel2,5,HO LEE CHIT
2020-04-02 12:33:26,everythingisvanity,11,6.6 million plus is priced in. 60 million was also priced in.
2020-04-02 12:32:44,IAmClaytonBigsby,8,6.64M! Holy shit
2020-04-02 12:32:34,anonimalman,7,Holy crap. 6.6 million
2020-04-02 12:29:39,Sircampsalot111,1,Keep arms and legs inside vehicle at all times
2020-04-02 12:29:19,BkkPla,5,"jobless claims all time record of 10M...then spy will moon 6% lmao, one min to go"
2020-04-02 12:26:40,ddiddy171,2,Jobless claims in t minus 5 minutes 🐻
2020-04-02 12:26:02,BkkPla,2,"good links to jobless claims...in 5 min? cheers

trade balance as well, coming up in 5"
2020-04-02 12:25:56,oskarege,1,"Volvo cars sold 31% less in March compared to the same period last year

https://www.media.volvocars.com/global/en-gb/media/pressreleases/265747/volvo-cars-reports-first-quarter-global-sales"
2020-04-02 12:20:19,cyberarc83,1,What is the best indicator on how the economy is doing. Any site or graph that I can use ?
2020-04-02 12:09:15,tt598,2,"Got me a short position on DIS today. Cinemas closed, parks closed, movie productions delayed. $7 a month Disney+ isn't going to cover the fortune people pay for hugging mouse actors."
2020-04-02 11:35:34,BuyThoseDips,8,"What non-economic, social impact do you think Corona will have long term?...like 3-5 years down the line"
2020-04-02 11:34:57,churn_after_reading,2,So happy im theta gang. Enjoy your losses tards.
2020-04-02 11:33:59,DoctorBalpak,2,"Three possibilities -

1. Worst data - we drill to a breaker
2. Bad Data- Priced in - We moon
3. Good Data - That's impossible but that will be a face ripper.

So the possibility of all of the three not happening is like 5% or low right ?"
2020-04-02 11:32:26,shamusotool,4,Thank fuck CCL is headed back down. I was about to long $ROPE on margin for holding those puts overnight
2020-04-02 11:32:08,wsb4eva0712,2,You all complaining about a gap up when they are barely green lool
2020-04-02 11:27:01,Tbones014,4,EWZ puts were a bad choice. Brazil is too stupid to sell off.
2020-04-02 11:22:42,rp_whybother,5,"Ok so let me get this right, jobless report with very high number of unemployed bad so printers go brrrr so green day. Jobless report not so bad no brrrr red day?"
2020-04-02 11:22:19,waylon106,-8,Wordwide markets in red
2020-04-02 11:21:59,Evie_Chandler,4,"Well, if we open green at least I can get out of these AMD calls."
2020-04-02 11:21:12,BuyThoseDips,8,Gonna be making a grand a week just off unemployment. That’s retarded
2020-04-02 11:19:02,hk_enthusiast,6,"Gap fills gap fills, i see them everywhere. Just some green consolidation for the next red dildo down"
2020-04-02 11:16:37,MLCollector,2,Who’s keeping this trash market up let it fall already
2020-04-02 11:13:33,NormalWaterBottle,11,Last time before jobless claims premarket was red. This time it’s green. Hopefully an inverse effect......
2020-04-02 11:12:14,EPLFantasyGuru,6,"The sell off stops when the virus peaks. This has been true since this all began (as evidence of h1n1, SARS, and China with covid). We will get bear rallies, but the virus is weeks from peaking. Just remember that."
2020-04-02 11:10:39,creature1231,11,"Goldman saved the economy again, just up the expectations and when they report under the market will go up. 

Why not just make an expectation of 200 million unemployed? 

These 💎✋ will be the end of me.

4/17 and 5/15 puts."
2020-04-02 11:08:11,m77w,10,Opinion: precise jobless claim data irrelevant in current environment.
2020-04-02 11:08:02,,-3,"When will be the best time to load up on Puts today?
At open or EOD? 06/19 240P are the plan.."
2020-04-02 11:07:47,kingkex22,-1,Ok so I know about iv crush and all but how do you actually check iv on Robinhood? Or do I need a “real broker” to actually do that properly. Also at what point in the day is the best time to buy in to no deal with a metric fuckton or iv? I’m assuming probably midday when there’s less volume? I
2020-04-02 11:07:03,arkansas_elk,5,I’m going to laugh my ass off if the 20 JNUG $10 4/17 calls I bought actually make me money
2020-04-02 11:06:43,hhampe,2,Puts on [$ZM](https://www.reuters.com/article/us-spacex-zoom-video-commn/elon-musks-spacex-bans-zoom-over-privacy-concerns-memo-idUSKBN21J71H?feedType=RSS&feedName=technologyNews&utm_source=feedburner&utm_medium=feed&utm_campaign=Feed%3A+reuters%2FtechnologyNews+%28Reuters+Technology+News%29)
2020-04-02 11:06:01,cuddlypolarbear1,2,Is Narcos Mexico as good as the original Narcos?
2020-04-02 11:05:53,Treecrust,5,I'm going to move across the country and I am driving instead of flying. Pretty pissed that state parks have decided to close down :/. I've never seen Yellowstone before but I am pretty sure that the hot springs would kill the coronavirus 🤔? Like cmon  🤏^^^🧠
2020-04-02 11:05:46,Nonotreally999,7,CNBC jobless claims estimate at 3.1 Goldman says 6 hmmmmm 🤔
2020-04-02 11:05:40,,2,Market go up? I got moves. Market go down? I got may puts. Is this supposed to be tough?
2020-04-02 11:05:01,imFreakinThe_fuk_out,2,It's going to bounce today to spy 300. Fed accidently left the printer on over night
2020-04-02 11:05:00,Light5567,2,"They're pumping today and [tomorrow](https://www.newyorkfed.org/markets/domestic-market-operations/monetary-policy-implementation/repo-reverse-repo-agreements/repurchase-agreement-operational-details), so just buy some calls  **: \^ )**"
2020-04-02 11:04:57,Sea_Seaworthiness,4,"Everyone saying it's gonna be a green day, so it's definitely going to be red"
2020-04-02 11:04:02,Onion-Fart,4,red day
2020-04-02 11:03:40,jimjoekelly33,-1,Is yoda cubd hotter or sahara guthry!?
2020-04-02 11:02:46,Lolkac,7,"eu just released crisis response in tune of 2.7trilion eur

https://twitter.com/EU_Commission/status/1245666411936198657"
2020-04-02 11:01:55,leomeng,-2,Feels good to have cashed out all my puts yesterday and sit on calls and shares
2020-04-02 11:01:51,eggsvy20,-3,"To 🌈🐻,

I will happily buy one of your puts in exchange of you sucking off 🐃🍆

Best regards,
🐃 & JPOW"
2020-04-02 11:01:23,Regjohn,16,"My doggo have the same haircut as Boris Johnson.

[Proof](https://i.imgur.com/knLsLF2.jpg) 

Also puts on everything because the world went to the shitter"
2020-04-02 11:00:54,shamusotool,10,"I wonder if this will have an overall effect on long term consumer spending? People aren’t out buying useless shit and just maybe see the benefit to their finances, especially over leveraged middle class families. Same for restaurants. Maybe you save a significant amount each week by making a sandwich for lunch instead of $12 for a cheap lunch at $60 week / $240 month / $3000 year 

Probably not because Americans are shit with money but who knows"
2020-04-02 11:00:45,ClearHouse6,8,So hype for the sequel to the war on drugs. We are totally gonna murder tf outta some drugs this time around.
2020-04-02 10:59:53,raptorsonacid,-3,"Big rally today after yesterday’s hemorrhaging, sideways probably tomorrow and big red dildo Monday morning"
2020-04-02 10:59:15,CursedEthirty,5,These pretzels are making me thirsty.
2020-04-02 10:59:13,arod42,5,My SPY 240 puts are -58% rn😑 but I got those RobinHands baby!
2020-04-02 10:57:47,AnOddvacado,19,"Welcome to Whose Stock Market Is It Anyway, where everything is made up and your options don't matter.


Hosted by JPow, motherfuckers"
2020-04-02 10:57:25,itsfoine,2,And spy yup in the pre market so far ... great didn’t sell my put yesterday
2020-04-02 10:57:15,bigpoppag91,-4,New enough to make some cash money of it?
2020-04-02 10:57:09,,10,"There is an overt attempt to pump oil bigly. Most likely to divert attention from massive unemployment. 

Trump mentioned in news conference last night that he's meeting with oil execs, talked about an hypothetical deal with Russia and Saudis, then on Twitter he threatens Iran with retaliation for a hypothetical plot they have against Americans. Meanwhile China says they will increase oil reserves. Hmm. 

This combined bullshit is already ⛽ pumping the whole market."
2020-04-02 10:56:34,TAWS,3,"The only factor that matters right now is consumer spending. If you think it's going to recover, buy calls. If not, buy puts."
2020-04-02 10:55:59,finalyst19,2,Anyone here trade from weird time zones? How the do you balance it with your life?
2020-04-02 10:55:50,bigpoppag91,10,🚨🚨🚨🚨 CCL have CANCELED All Cruises for 2020! 🚨🚨🚨🚨
2020-04-02 10:54:14,steffur,2,"What time is the jobless claims report, cant find the retarded govt website thats supposed to post it or information regarding the publishing time/date.

E: thanks!"
2020-04-02 10:52:55,KimchiFitness,4,"[Bloomberg: CHINA CONCEALED EXTEND OF OUTBREAK, US INTELLIGENC SAYS](https://www.bloomberg.com/news/articles/2020-04-01/china-concealed-extent-of-virus-outbreak-u-s-intelligence-says?fbclid=IwAR3f2XmCvhR-9trB00YOVasJ6dTdE7PNk1DZYpYcx8Q1CBt32CJXyXb226I)

[WSJ: ITALYS CORONAVIRUS DEATH TOLL IS FAR HIGHER THAN REPORTED](https://www.wsj.com/articles/italys-coronavirus-death-toll-is-far-higher-than-reported-11585767179?mod=hp_lead_pos2&fbclid=IwAR2Fum_arv2E-NLORtxYIcOpYNmBE1Q6r-XhSOVy3GKlJmeaBArw-tpnd00)"
2020-04-02 10:52:55,wellzy17,3,Damn am I dead... bear gangg
2020-04-02 10:52:09,BubblesShedNbfast,18,"DD: the more deaths the virus causes, the less people there are to file for unemployment."
2020-04-02 10:51:39,ch1p_skylark,3,whys crude moonering
2020-04-02 10:50:04,JefBezosExWifesNewBF,6,Stocks go up today. But tomorrow they go down. Monday too.
2020-04-02 10:49:36,Sircampsalot111,11,"The people who tax the shit out of us.

https://mobile.twitter.com/KaivanShroff/status/1245354213288357888"
2020-04-02 10:48:36,TAWS,6,Bunch of college students are graduating next month and need to look for jobs. Won't that make the unemployment numbers even worse?
2020-04-02 10:47:16,MalcolmTucker,-5,"It's always beautiful to see a few generations collectively find out they have fEeLiNgS. We don't need RH, we need a brand new app for futures so everyone can become a pajama-trader. Nerds should get to it."
2020-04-02 10:45:18,Sworn_to_Ganondorf,7,Same as usual waking up at 2pm and seeing if fed is manipulating the market and im red or green. Cause my puts are for a few weeks out and im in quarantine.
2020-04-02 10:44:55,lerakk,1,Im really just afraid the cdc or who is going to announce this virus will take the rest of the year or longer to completely eradicate. The only way to properly do that is people not going out.
2020-04-02 10:44:13,Jackismyson,13,"News Flash:

Priced in does not equate to retail investors reaction to news."
2020-04-02 10:42:15,Aliencj,10,"https://www.cnbc.com/2020/04/01/jobless-claims-will-be-huge-but-millions-more-are-expected.html

If this is true, then the unemployment claims will dwarf 2008-2009. Some forecasters are calling for 32% unemployment (most pessimistic). They are also saying higher unemployment than projected would NOT be surprising, therefore priced in? So dont expect a big drop after unemployment numbers come in."
2020-04-02 10:41:24,allezphill,-6,da gween is fadin away
2020-04-02 10:41:18,APHAbaghodler,2,"Why is Brian Williams or ""Bri Wi"" on MSNBC..? Thought that dude got fired for lying about what he saw in Iraq?"
2020-04-02 10:41:15,letsdothisfam7,7,I am here for the “fake and gay” comments by the 7/11 employees
2020-04-02 10:40:08,amoctar,2,Buying vix puts. Bull gang fo life
2020-04-02 10:35:45,Fangslash,1,"I began to have mild regrets on my VIX 5/20 50c

Then again my SPY puts are spreads and they have retarded vega/IV 

Hard choice here"
2020-04-02 10:33:19,International-Wealth,-10,"Why stonks not go down?

4/3 SPY 7p"
2020-04-02 10:32:32,TheLastAckbar,1,JNUG just endlessly teasing us. How rude.
2020-04-02 10:30:38,Cnastydawg,12,https://twitter.com/livesquawk/status/1245626145392877569?s=21 Goldman ups jobless forecast to 6 million
2020-04-02 10:28:54,Xall1996,5,Today is a green day. We bears are getting fucked anally no lube.
