date,author,score,body
2020-04-28 05:17:50,JoeNiw,7,Future literally went up 0.01% and there are people unironically saying it's mooning. I'm a bull but come ON
2020-04-28 05:17:28,wd1998313,3,"Be honest, how many of you actually made money from options?

I'm down 300 dollars"
2020-04-28 05:17:13,Reddi__Tor,2,"[SURVEY: Market Sentiment](https://freeonlinesurveys.com/s/kbgc7FcR#/0) 

[Results](https://freeonlinesurveys.com/r/9ravWLe2)"
2020-04-28 05:17:08,THUGGERSEASON,6,UBS cutting dividends.   Loan losses will occur
2020-04-28 05:16:59,smallchimpu,0,How many of y'all wanna have brother and son at the same time
2020-04-28 05:15:57,jebus14,4,"hoping my

SPCE 5/1 $18

MSFT 6/19 $200

SPY 5/13 $290

Calls print so I can lose it all next week."
2020-04-28 05:15:55,LpTrizzax1982,1,Run up always starts at 12:00am est
2020-04-28 05:15:51,WorthyAlpaca,1,BYND bois where you at
2020-04-28 05:15:42,YepRabbit,-3,Future Mooning!
2020-04-28 05:15:11,smallchimpu,1,"""yes I print and I am not ashamed"" guess the author"
2020-04-28 05:15:10,Mpcars,0,KaChow!
2020-04-28 05:14:49,rustyryan27,2,"*lights cigarette*

*buys UCO*

Fuck."
2020-04-28 05:14:47,NoftScarlet,5,Even BAC reported a 45% profit decline in their earnings. What's so shocking about HSBC?
2020-04-28 05:14:31,ApartheidClyde,3,"to AMD bulls, what is the bullish case for AMD ?

That we have increase in demand for chips going into a depression with AMD trading at ATH?"
2020-04-28 05:14:27,TheHydroElite,-6,Get fucked bears
2020-04-28 05:14:19,MonseurPineapple,8,"Did you hear Trump at today’s press conference re China? Tariff man is coming back and he’s going to nullify China’s US treasury holdings, massive drop coming in the next few months."
2020-04-28 05:13:21,SeabassJohn,7,0.2% in 10 seconds. Jpow not even trying to hide fact he printing
2020-04-28 05:13:20,Berlin_China_Wall,0,"Tesla propped up the market Monday. Tuesday, I assume not.

https://www.cnbc.com/2020/04/27/tesla-cancels-plans-to-bring-workers-back-to-us-car-plant-this-week.html"
2020-04-28 05:12:41,aidan4388,2,Question about iron condors on RH. Why is the max profit listed where the price usually is with “credit” under it? Does it not just cost the max potential loss like regular options?
2020-04-28 05:12:36,partially__derived,6,https://i.imgur.com/V8jOHMH.jpg I’ve seen this scam across multiple YouTube videos now. Can we all message Stephenbriggs and DDoS him? It’s fucking annoying
2020-04-28 05:12:36,theohellos,6,I think i will buy NAT calls tomorrow
2020-04-28 05:12:33,RozarioGroup,1,What’s a good site to see after market trades and stocks?
2020-04-28 05:12:10,Hookset23,1,"BA price prediction tomorrow 

I think some bullshit flat 132 eod"
2020-04-28 05:12:00,ether-by-nas,2,What’s all this alien talk?
2020-04-28 05:11:48,BVB_TallMorty,6,And the futures march from red to green commences. Same shit different day
2020-04-28 05:11:14,Emper0rG0d,1,"If people are betting on negative rates, why did TLT have a sharp decline on Monday and why is gold dropping? I don't see Powell going with negative rates."
2020-04-28 05:11:14,your-missing-mom,3,Tnp and tnk and open tmrw and collect tendies next week.
2020-04-28 05:10:47,Bennylegend,3,Market falls off a cliff and snap moons
2020-04-28 05:10:38,consultant_25,1,Just FYI oil is fuk again today. Not that it matters
2020-04-28 05:10:25,GatorMD12,1,I think they are gonna go negative rates.  Look at data after Great Depression there was a big spike in savings for years which makes sense.  Donnie and the economy needs the opposite to get moving again. Neg rates in theory would help nudge consumerism vs saving.  Just spit balling here.
2020-04-28 05:10:10,ApartheidClyde,1,"June oil contract looks to be going negative too.

When will Gay Dowell print oil tankers to save the oil bulls?"
2020-04-28 05:10:09,713gang,0,AutoModerator flair me as a pussy
2020-04-28 05:10:06,pump4iron,6,They said this will end in depression. They were right. I'm depressed with my SPY Puts.
2020-04-28 05:08:58,smallchimpu,2,"Hi it's your well-wisher smallchimpu, do you have short position on spy?I am not here to ask why, but would recommend try shorting individual stocks instead ! ""Bro but I have spy put position  rn, what should I do"" , you sure know what you should do, use whatever money you get and focus on individual stock, and go long on it of you feel so! See it won't mean that you will 100 % earn money, but the probability on individual stock will be higher than index. Take  a deep breath and say goodbye to spy, and when next rug pull occurs it will be obvious, that time load up on that juicy spy puts, It's yo boy smallchimpu and I wish y'all the very best, sleep well, drink enough water and remember it's just money and life is more important :)"
2020-04-28 05:08:55,JJJJJay,4,"AMZN, NAT, DIS, and TSLA will be my moves tomorrow

probs intraday - maybe monthly on NAT"
2020-04-28 05:08:46,consultant_25,1,I just need a +-5% day. Will I get it this week?
2020-04-28 05:08:34,LBgeckos,2,holding my 5/15 ATVI and MTCH Calls and deleting Robinhood till Thursday.
2020-04-28 05:08:22,WorthyAlpaca,2,"SHOP Ima need you back up above $650, my calls EOD depend on it"
2020-04-28 05:07:53,hurttuagood,2,"so first Kobe, then a global pandemic, then an almost recession (still possible), now aliens. FUCK!! this will be the longest chapter ever in future history books."
2020-04-28 05:07:47,Landlubber420,6,Alien technology == bullish
2020-04-28 05:07:26,philmacrack123,3,At least HSBC still made profit 🧠 to the moon
2020-04-28 05:07:12,CoronaMoney,4,Can anyone explain what would happen if July oil goes negative while we are still in June? It is at 18.19 and dropping.
2020-04-28 05:07:11,pump4iron,-11,"Donald J Trump, J stands for  Jackass."
2020-04-28 05:07:04,,5,"Don't understand gay bears bitching ""but but the market keeps going up with Coronaaa and unemploymenttttt numbersss whyyyyy this is riggedddd😿😿"". If you noticed a trend of the market continuously going up.... Buy calls you fucking retards."
2020-04-28 05:06:27,BeerAndWeedMe,2,Thoughts on short term credit spreads vs diagonal spreads? Which is better?
2020-04-28 05:06:20,NotBrianCSGO,2,Anyone use Plus500 here ?
2020-04-28 05:06:07,mrbiggles2020,2,I miss 3/12.  330 pt range on /es.
2020-04-28 05:06:04,,5,"THE ALIENS ARE HERE TO GIVE US

EGYPT PART 2 ELECTRIC BUGALOO

BE PREPARED TO BUILD SOME FUCKING PYRAMIDS!!!!"
2020-04-28 05:05:43,WSB_Autism,5,In honor of WSB making me more tendies than I can hold in my diamond fucking hands I will put down 1k tomorrow on the highest voted trade you guys want
2020-04-28 05:05:01,joefromdownstreet,8,Losing 2K on the shittiest faggot decision I can ever do this week. Help me become more poor after losing 50K total this month. Worst decision to YOLO my 2K on wins a Papa Johns Pizza covered in COVID sauce
2020-04-28 05:04:43,trumpdiego,6,China taking this virus dead ass serious looking at us going these idiots are going to retard strength their way out of this batflu aren’t they?
2020-04-28 05:04:33,nutotac,6,Should I buy nat calls at open?
2020-04-28 05:04:32,your-missing-mom,3,Tnp june contracts r extremly cheap 🚀🚀🚀
2020-04-28 05:03:51,undermon,-1,here comes the breakout
2020-04-28 05:02:06,kvla1,5,"How would an oil spill affect the market ?
With so much oil tanker out, the odds are high that it would happen."
2020-04-28 05:01:36,duch350,1,Are people who create companies to launder money through creating zombie companies?
2020-04-28 05:01:33,saadbruh,4,"Considering from the time I was 17 to now which is 25. So 8 years is almost 3000 days. I think I've masturbated every day since 17 and maybe twice or 3 times in one day. 4 or 5 in others. Easily 13,000k or more overall"
2020-04-28 05:00:49,CoronaMoney,4,"#MOTHER OF GOD, -57% 

HSBC Holdings said Tuesday its first-quarter profit plunged 57% compared with a year earlier, mainly as the global coronavirus pandemic and oil-price weakness caused higher expected credit losses and other credit impairments."
2020-04-28 05:00:48,btoned,10,"Everyone is on NAT now so it's going to dip tomorrow.

Good job assholes."
2020-04-28 05:00:40,NotBrianCSGO,6,"I’m using Plus500, can’t find TNP"
2020-04-28 05:00:32,Brandon3618332,4,UFO footage was unreleased test of a groundbreaking BA prototype. $BA to $9000 EOW
2020-04-28 05:00:19,Howard_510,5,Wtf still flat as fuck
2020-04-28 04:59:55,GatorMD12,6,So big news this week is fed announcement Wednesday about interest rates going negative.  If fed continues buying every dirty pair of ur moms stank how underwear and slashed rates then we def hitting that spy 300+.  If not we may see a gap down.  Do I got this shit right?
2020-04-28 04:59:28,flowkingfresh,5,No one believes these pussy pink futures lol
2020-04-28 04:59:11,27onfire,1,Aight.. night night.. 🏳️‍🌈🐻 signing off.  Going to put on some lux stockings and a pink dress with blue velvet ribbons.. get in bed and watch Dirty Dancing.  💋💋
2020-04-28 04:58:52,dawson3678,1,Yo can anyone check if I can get a call on UFOs?
2020-04-28 04:58:24,RckZilla123,6,"People will mistake UFO for USO

USO to the moon tomorrow"
2020-04-28 04:57:54,neatnessnutshell,5,Fucking hate getting +2% green days then -0.5% red days. Like what the actual fuck.
2020-04-28 04:57:45,smallchimpu,14,"""Bruh anything in futures that's  not limit down means green by open"".  - Jenifer Anniston"
2020-04-28 04:57:41,NotBrianCSGO,2,I have $500 what do I put it on ( using plus500) noobie here!
2020-04-28 04:57:37,jonwilkon,5,"NAT was #8 gainer percentage wise in nyse today. Let's hit #1 tomorrow. Source: https://www.marketbeat.com/market-data/biggest-percentage-gainers/


Edit: #9"
2020-04-28 04:56:46,pump4iron,12,"6 months ago, SPY was at this level...since then Corona pandamic, oil crisis and massive unemployment and job loss happended. Unfucking believe. How optimistic can this market get?"
2020-04-28 04:56:42,yachtsandthots,8,The loss and gain porn has been 🔥lately keep up the good work everyone 👍
2020-04-28 04:56:35,Mpcars,1,If futures could stay up this time that’d be great
2020-04-28 04:56:29,thenamesake11,5,RIP USO 0.5p 5/1. You will be remembered.
2020-04-28 04:55:43,RckZilla123,5,"UFO's are official now

Calls on SPCE just for MERICA!!!"
2020-04-28 04:55:00,Bennylegend,7,"Boarding TNP train, looks like a solid trend upwards yolo"
2020-04-28 04:53:47,throwaway60501,4,I think that the worst trade objectively is NAT puts
2020-04-28 04:53:38,terrei,2,$BA $100 tomorrow?
2020-04-28 04:53:37,JeromesPendulum,3,HSBC.... just fucking LOL
2020-04-28 04:53:04,financeexpertsagree,16,"""So supposing we hit the market with a tremendous pump — whether it's stimulus or just a very powerful bailout — and I think you said that hasn't been checked because of the bears,"" Trump said, speaking to Bryan during the briefing. ""And then I said, supposing you brought the pump inside the bears, which you can do either through the anus or some other way, and I think you said you're going to test that, too.""

""I see the ER that knocks the put out in a minute, one minute. And is there a way we can do something like that by manipulation inside or almost a cleaning? As you see, it gets in the puts, it does a tremendous number on the puts, so it would be interesting to check that."""
2020-04-28 04:52:59,TheChaoticYeet,1,BABA earning plays?
2020-04-28 04:52:48,27onfire,1,I am starting a newsletter.. I have to make money somehow..
2020-04-28 04:50:52,WetDonkey6969,13,Fuck this I'm going into Bitcoin
2020-04-28 04:50:48,,3,Bulls being blinded by hubris and getting greedy? I wonder what happens next
2020-04-28 04:50:39,,7,"PENTAGON OFFICIALLY DECLASSIFIES UFO FOOTAGE

Aliens are real and we're stupid apes!!! STUPID APES!!

[https://www.reddit.com/r/WTF/comments/g9c4fe/pentagon\_declassifies\_footage\_of\_ufos\_caught\_by/](https://www.reddit.com/r/WTF/comments/g9c4fe/pentagon_declassifies_footage_of_ufos_caught_by/)"
2020-04-28 04:50:10,Grifbrochill1,5,DHT less hype more moon
2020-04-28 04:50:05,27onfire,3,See I could sit here and tell you that I hoped a fucking meteor wiped out a couple countries while we sleep tonight but I know SPY would only trade over 300 by afternoon.. so I don't wish these things.
2020-04-28 04:49:57,philmacrack123,10,So is the world just gonna completely ignore the Pentagon releasing videos of objects they describe as defying our knowledge of flight and completely unidentified.
2020-04-28 04:49:03,TheHydroElite,2,"What a great sight to see! Trap the pajama traders and climb slowly all night!

Calls printing tomorriw"
2020-04-28 04:48:35,brunoclement,1,I bought HD 140p sept 2020. Thoughts?
2020-04-28 04:48:13,Cwc123,9,No chance NAT goes to 12. Wat too many people thinking its free money. Literally the new spy 200 4/17
2020-04-28 04:47:59,gambler_no_1,21,"Cannot wait for this shit lock down to end, wanna pick up a chick at bar and eat her ass like a cupcake"
2020-04-28 04:47:34,spudleego,2,Anyone taking a bet on BA? Either direction.
2020-04-28 04:47:20,ishkabum,3,Vix boys. Rise up. I am tryna get saucy
2020-04-28 04:46:59,626reppin,1,How fucked are my tsla 1000c’s
2020-04-28 04:46:58,wsbShitBot,2,silly futures
2020-04-28 04:46:54,PurpNYellow,3,"When all is said and done, clubs in Vegas never gonna be the same. Puts on all that shit"
2020-04-28 04:46:51,okaw,1,Anyone here been holding SPY calls for one week +?
2020-04-28 04:46:13,Single-Distance,5,Full send on MSFT puts?
2020-04-28 04:45:59,TempIetonFerrari_III,7,Fellas is NAT free money until it hits $15?
2020-04-28 04:45:34,philmacrack123,5,Where's the fomo Bois? Everyone's just been salty about puts for weeks now. Suck it up and start yoloing tsla 1000c
2020-04-28 04:45:21,1A4,4,calls on UBER can't go tits up
2020-04-28 04:44:36,27onfire,11,"I am on a pretty respectable streak I must say.. every morning when I wake up and open up Mr. Hood he tells me that my portfolio is down 35%.. this is 8 mornings in a row now.. no, I'm not kidding, it is pretty fucking incredible really."
2020-04-28 04:44:05,Gilbertgodfries,1,https://m.imgur.com/a/vJjwjwO u/he_shootin u/teemo911 literally can't go tits up!
2020-04-28 04:43:57,q112,3,What are some valid reasons I why I should be playing oil tankers other than everyone in this sub pumping NAT? Legitimate question just wondering why you guys think it’s going to continue to rise.
2020-04-28 04:43:54,saadbruh,7,"I've probably nutted over 13,000 times in my life"
2020-04-28 04:43:37,27onfire,9,Another night where the 🏳️‍🌈🐻s (of which I am one) are given hope only to have that hope snatched away by the time the dew lays upon unused lawns.. *green* **green** ***green*** - fucked again..
2020-04-28 04:43:21,NakedTrooper,3,cUP aNd HaNdlE oN fUtuRes?
2020-04-28 04:42:55,DKM_Official,7,"Robinhood let me transfer $14 in to my account when I have $7 in my bank.

Uh oh."
2020-04-28 04:42:49,option-whisperer,2,Winter is coming. Buy and hold is dead.
2020-04-28 04:42:14,Jaxtaposed,2,Anyone playing AMDs earnings?
2020-04-28 04:41:18,ab111292,5,"isn't it obvious that the market isn't going to ""collapse"" again anytime soon? Fed won't let it with QE, states are beginning to open, businesses coming back online, lots of companies developing/testing corona solutions.

Why would you bet against the momentum?"
2020-04-28 04:41:16,elkox,7,"Anyone still holding puts bought from 3/22 waiting for the rug pull? If so, how red is your portfolio? Send me your loss porn."
2020-04-28 04:40:45,Marnsy16,4,Idk about you but it’s usually not a good idea to doubt Elon musk... I’ve heard a couple people have been burned... like really badly.
2020-04-28 04:40:32,kckckc111,5,This short squeeze to 300-310 will likely accelerate since most short sellers stop losses are 290-300ish which will accelerate the move once they are stomped out
2020-04-28 04:39:51,us1549,3,"Anyone looking at PINS calls for earnings? If SNAP was any indication, ad rev should be strong and they have little debt."
2020-04-28 04:39:40,Gilbertgodfries,1,What's a good limit order on Nat 5/15 9 calls before open. I'm think 0.55 - 0.60 does that seem like it'll get filled?
2020-04-28 04:39:38,GamblingMikkee,-1,Bonsoir tout le monde. Je m'appelle Michael et j'aimes les grooses queues noires
2020-04-28 04:39:10,EugeneApplebottom,9,"Investing.com glitching 

Saying futures are red? Everybody knows stonks go up"
2020-04-28 04:39:05,joefromdownstreet,3,"Holy shit, Fidelity and ToS is 69,420x better than Robingay POS. 

Maybe orders will actually get filled now."
2020-04-28 04:39:04,Brandon3618332,7,Do people buying USO shares realize they could get 2 Beefy 🅱️ritos Burritos for the same price?
2020-04-28 04:38:45,averagenoodle,3,Has NAT tendie train left already or is this going to 15+
2020-04-28 04:38:35,okaw,3,I've been holding calls since last week Tuesday. Somehow haven't sold yet. Reached my maximum return on investment once last week and then towards EOD today. We're trading so damn flat I want a break out but I don't think I'll get it. Maybe Weds Thurs? So much possibility for market moving news this week.
2020-04-28 04:38:26,Dedent98,2,Thinking on throwing 10k to AMD calls in the morning. How retarded?
2020-04-28 04:38:21,q112,4,Kimmy J has been so dead/not dead for the past week that I think it’s kind of lost it’s luster and isn’t going to effect the markets as much as it would’ve last week
2020-04-28 04:38:09,LBgeckos,1,"Have the last of my bloody and beaten account into ATVI 68c 5/15 and MTCH 82.5c 5/15 with a  1-IWM 97p 6/19 as a remnant of better times and what I am calling a hedge so I can sleep at night. 

That said - kinda nervous about this week. If we tank heavy this week - will that hold into next for ATVI & MTCH even if there is hype around their earnings & if they beat? I will most likely be selling EOD Monday tho. 

Just trying to figure out if I need to get out of this play. 

Im already down 80% on the account since the last month. I was a smart autist and played with what I could lose."
2020-04-28 04:37:58,Bustincherry,1,IRL Mark Baum said to short European and Canadian banks last week on CNBC and to go long on US banks. Seems to be right again.
2020-04-28 04:37:50,cool_BUD,2,FB calls or puts?
2020-04-28 04:37:35,optionseller,2,limp dick futures ->  SPCE to 19 tomorrow
2020-04-28 04:37:29,eyebeeleaf,3,The frenchman is up!
2020-04-28 04:37:10,its_me_poida,4,David Koresh: I've taken the burden of sex on all of your behalf ... cucks.
2020-04-28 04:37:05,philmacrack123,12,"God the quad witching man what a memory. 

""It can't go tits up, biggest short squeeze in history!""

The retards hurdled themselves at 0dte calls an hour before close, 5 percent out of the money 30min to expiry calls lmao, no chance of escaping if it went wrong, absolute massacre that day was."
2020-04-28 04:36:59,keyokenx1017,1,"Should I sell half for cheeseburger money, and hold the rest?"
2020-04-28 04:36:31,PopcornGeorge,0,I just bought about 143 of CAnopy Growth. I been going thru their EDGAR and they’re growth year over year plus the corporate restructuring leads me to think it’ll do well. I said fuck it and put down all the money I could scrounge into it. Fingers crossed🤞
2020-04-28 04:36:29,ParzivalVonUbermench,2,"What’s everyone’s opinion on $ARCT$ 

How high can it fly?"
2020-04-28 04:35:50,Adrolehn,6,Where do I trade lean hogs?
2020-04-28 04:35:43,Marnsy16,2,Où sont tous mes français???
2020-04-28 04:34:56,Davidkanye,4,"Boring day. Red open. Side ways gay. 

Watch the VXX and consider SQQQ EOD. Glad I have CHWY calls."
2020-04-28 04:34:55,cruzemmanuel277,2,"If tomorrow is red should I sell my zoom puts at a small loss/close to breakeven

138 5/15"
2020-04-28 04:34:55,626reppin,4,As a bull I’m getting scared
2020-04-28 04:34:42,tender-town,1,Thoughts on Hertz Leaps?
2020-04-28 04:34:33,RayCashIsTrashDalio,11,powell at 3am: how many times do I have to teach you this lesson u gay bears
2020-04-28 04:34:14,MeiIsSpoopy,5,What time does uso reverse cowgirl. I sold my uso puts so I can reload when it happens.
2020-04-28 04:33:20,repagator8,2,"Reload investment.com on mobile it will show indices of today's market close  

Who ever done that and thought futures turned green"
2020-04-28 04:33:10,infinitelimits00,3,"AMD, GOOG, and SBUX tomorrow afternoon. BA Wednesday morning. 

Means I’m flipping 4 coins."
2020-04-28 04:32:53,Marnsy16,1,🇫🇷🇫🇷🇫🇷🇫🇷🇫🇷🇫🇷🇫🇷🇫🇷🇫🇷🇫🇷
2020-04-28 04:32:48,spanishgalacian,2,Oil playing limbo right now.
2020-04-28 04:32:44,Hellforasailor,-5,"I usually block most autistic screeching, 500$ account balance, 20$ position holding, zoomer born, bears/bulls fukt, wanna be gangstas using twitch speak in this sub.  

It’s exhilarating you should try it too."
2020-04-28 04:32:30,KimJongUnsTrousers,5,Oil going to zero again. USO puts might still be a profitable trade. What a time
2020-04-28 04:32:10,spy66may,4,For every -$XXk screenshot there is an equal and opposite theta gang screenshot
2020-04-28 04:32:04,plimsickins16978,3,"My tummy hurts. Can't sleep. Futures are boring.

Ehh.."
2020-04-28 04:31:55,Ralphadayus,4,"Shower thoughts... 
Maybe my SPY puts will finally print this week?
... I'm such a retard and belong at wsb."
2020-04-28 04:31:53,mr_blockchain_,13,"Kim is in a ""vegetative"" state: https://imgur.com/gallery/KivZMYZ"
2020-04-28 04:31:34,herrmannc1899,1,"Long $ACC. 

DD: I already signed my damned lease despite possible plans to have next semester be online"
2020-04-28 04:31:32,LiftSleepFDsRepeat,1,ATVI is making me soft lately .... thinking of exiting at even and putting my capital on some other pretty whore 😘
2020-04-28 04:30:29,Lothire,2,"Which monthlies are most bears still in from the whole ""cant go tits up"" bearish phase from last month? May 15? June 19th? Once the last of the bears go extinct will be the time to buy puts."
2020-04-28 04:30:20,Marnsy16,1,Elle et lui existent pas
2020-04-28 04:29:57,HealthyRacer,-1,Reversal of futures
2020-04-28 04:29:51,ShotAmount,4,we shorting oil tomorrow?
2020-04-28 04:29:32,Gilbertgodfries,7,Alright someone recommend a play that doesn't sound completely retarded. I'll dump 1 k into it and if the position doubles in value over the next week I'll give you 25 % of the position. Will buy tomorrow a few hours after market opens to post proof. (No spy puts or USO calls fuck those bitches killed my account 3 times now)
2020-04-28 04:29:31,27onfire,2,Where are we? Are **bul fuk**? or.. what's the status?
2020-04-28 04:29:22,,3,"These glitches where futures quotes pre-open are red happens so often

Thankfully it is almost always fixed by market close"
2020-04-28 04:29:12,Xbsnguy,2,Anyone with June+ MSFT calls thinking about holding through earnings?
2020-04-28 04:29:09,mxdSirty,5,Snap better die
2020-04-28 04:28:39,givememobeypapi,4,Futures BLOOD RED📌🎈🧸
2020-04-28 04:27:46,tayzer91,5,Have yall seen when people bought out the meat at the supermarket and all that was left is the trash BYND patties? Meat shortage or not ain’t nobody buying that trash!
2020-04-28 04:27:34,Xinlitik,5,"HSBC's pre-tax profit falls 48% year-over-year in the first quarter to $3.2 billion https://www.cnbc.com/2020/04/28/hsbc-reports-first-quarter-2020-earnings-amid-coronavirus-pandemic.html?__source=iosappshare%7Ccom.apple.UIKit.activity.CopyToPasteboard


We should be hitting the moon any time now. I’m not sure how this could be any more bullish"
2020-04-28 04:26:41,,14,"Wow I love stocktwits, nothing like giving an opinion that means nothing and slapping a ‘bullish’ on it only to have someone with a warren buffet profile picture call you a retard"
2020-04-28 04:26:20,Turlututu_2,16,"i dont look at futures, i just read this thread to get an idea

im guessing we are either limit down or -.2% 

tough to say"
2020-04-28 04:26:05,svadrif,3,"Alright so I'm gonna ask this again but clarify things a bit better.

This is for someone I know. Basically he hasn't filed for taxes this year but has for 2018. The problem is he didnt have to provide direct deposit info because he didn't owe anything. And looks like there is no way to provide this info now because IRS has an error on their website and it's not allowing anyone submit this info.

Instead, they said they would mail the check. The problem is he has moved to a different location since 2018. So what happens now?"
2020-04-28 04:25:30,saifly,6,Are my eow TSLA 950c I bought at today’s highs safe?
2020-04-28 04:25:22,smallchimpu,6,"""If it's not green it's wrong"".  - Riley Reid"
2020-04-28 04:25:18,kvla1,3,Does the war in Yemen will affect oil price ?
2020-04-28 04:25:02,spy66may,6,I look at plummeting oil candles longer than I should imagining that it's SPY
2020-04-28 04:24:57,KingAyy,5,Looks like VIX is on a bull run.
2020-04-28 04:24:34,KushJenkinzz,1,Bounced off that yummy support 😋😋
2020-04-28 04:23:55,,8,Why does Tesla have the retarded autistic strength of Sloth from the Goonies?
2020-04-28 04:23:49,chibuezephoibos,6,"I'm holding off on anything this week. Waiting for the big 5's earnings reports to come in, S&P is too tied up in that shit. Expecting a big dump in about 3 weeks when lockdowns inevitably get extended and the panic continues."
2020-04-28 04:23:47,,3,Big red tomorrow 8======D~~~
2020-04-28 04:23:38,klogdor,3,FUTURES ARE FUK
2020-04-28 04:23:11,,1,What are some long term stock holdings you guys are losing up on
2020-04-28 04:22:44,ClearHouse6,1,GUH for my DIS 107c and CVS 65c that expired last week.
2020-04-28 04:22:37,WittsandGrit,10,"Instead of water, I'm going to put Dr. Pepper in the Keurig tomorrow morning to kick the day off."
2020-04-28 04:22:34,chibuezephoibos,1,Throwing some shorts onto iShares CMBS...maybe. Thoughts? It's the only way poorfags like me can get into Icahns play.
2020-04-28 04:22:26,wd1998313,3,Thank god I always do shorts before close😵
