date,author,score,body
2020-08-18 23:46:45,festivebird,1,"Market primed for the kind of sell off that may give dip-buyers pause - probably by end of week, mayybe next week, but very possibly tomorrow. Get your hedges in.."
2020-08-18 22:16:54,Bundpatt,2,Thoughts on $WORK. I got 20 contracts 31c/aug 21 bought at $1 premiums. How fucked am I?
2020-08-18 19:53:14,TequilaTrader,1,**RXT gone way up then down on acquisition news.  Prolly BS**
2020-08-18 18:36:22,ExcellentInflation0,4,"Smoking my 1st cig of this trading day and I see a school bus roll down my street, I live in the burbs; i havent seena school bus post Corona. Puts on civilization. Sending your children to school while you're afraid of a fake airborne virus.  Man STOCKS ONLY GO UP."
2020-08-18 18:35:25,Redhouse425,0,"To my fellow WSB and RH traders and DDTG:

If we keep pumping this market up and up and up, you know TRUMP will no doubt win the November election.

If you want Biden in there, time to SELL is NOW, like me, at ATH's!!!

IMHO.  Good luck tards."
2020-08-18 17:39:30,Bytemebytch,1,Found out it is the founder of Blackberry yacht. $150mill
2020-08-18 17:04:12,Aeiden1989,1,we dead today?
2020-08-18 16:42:13,timtimzi,1,I feel like I missed the initial sell off for Tesla this morning at 6:30 am. Went back to sleep.. Now waiting for it to moon again.
2020-08-18 16:32:09,jefreyq,1,BJ 📈🚀
2020-08-18 16:05:09,_blk_swn_,2,NVDA tomorrow anyone? I sold put spreads at 420/430 and bought calls at 480. How high we think this gonna rip?
2020-08-18 15:18:01,Muffiiin,1,Big TSLA dip here ready for us to take advantage
2020-08-18 14:58:14,bshaman1993,1,Red robinhood is fake news
2020-08-18 14:51:08,uniaintshit,2,My wife is gonna kill me (as if I had one)I bought tons of fake meat and BYND shares and both are rotting away
2020-08-18 14:30:13,UsedTask,4,"There's no reason to buy anything right now other than TSLA.

It's very rare to see a company this size with IV like this.  You can make 10/20% in 10 minutes if you buy the dips."
2020-08-18 14:25:28,papaken69420,1,"I’m loading Walmart calls in a little while, screw you pansies"
2020-08-18 13:52:23,gpkgpkgpk,1,imagine not buying tsla dip. 2k is guaranteed
2020-08-18 13:46:07,JT4_JD,3,"Amazon, greatest but in a long time this morning"
2020-08-18 13:41:16,CaptainPlatano,1,drill tesla i need to get in cheaper
2020-08-18 13:38:49,jackacesd,1,JD BABYYYY
2020-08-18 13:35:34,WestCoastWhiteBoy,2,HD crushes earning and take a gainer off the cliff. Wtf
2020-08-18 13:16:41,ceskanda,1,Leather jacket man cracked 500
2020-08-18 13:11:31,EdoStrike,1,Got it when it was $288
2020-08-18 12:44:48,Revolant742,4,Ya'll ready to hit ATH and then a circuit breaker in one day?
2020-08-18 12:44:06,EdoStrike,2,"Not sure about where the market is going myself, but I’ll take my gains before the fangs of capitalism suck my gains away."
2020-08-18 12:32:15,aragorndxb,3," 

# U.S. housing starts total 1.496 million in July, vs 1.240 million expected"
2020-08-18 12:10:14,mcridefanboy,7,Is there a carbon monoxide leak in this thread?
2020-08-18 12:10:13,Safina_,2,"Sold WMT before close, I feel for anyone watching it now"
2020-08-18 12:06:29,Not_reddits,-4,Don’t think we’ll be breaking past $1913 today for TSLA
2020-08-18 11:58:07,Matrix1216,3,Amazon will be interesting today. Looking for an entry above 3250 and then potentially ATHs!
2020-08-18 11:55:52,cloutkilla420,1,Rest. In. Peace. ALL THE WALMART 140 CALL HOLDERS.
2020-08-18 11:34:01,Throwawayeconboi,1,Come on AAPL :(
2020-08-18 11:20:36,degenerati1,1,"Amzn pops. Well well well, how turn the tables"
2020-08-18 11:20:30,smarteezyh,2,bout to buy this aapl dip so hard
2020-08-18 11:20:24,irresponsible_cactus,1,lol TSLA has NO chill
2020-08-18 11:09:58,stonksupanddown,5,Can’t wait to short TSLA at 2000 🤡
2020-08-18 10:58:25,so364,14,"Well bois, my TSLA 1460C 9/11 I picked up a week ago can now buy me a tesla with the profits if it stays like this, thank me later for rasing their market cap by 6 mil"
2020-08-18 10:58:18,mrl2r,2,I feel like the same 4 pj traders play a game of hot potato with NET.
2020-08-18 10:57:20,perpendosi,3,Ok.. should i sell my boomer shares and buy tesla shares?
2020-08-18 10:54:51,iwillflymetalbirds,1,Please stay this way
2020-08-18 10:53:09,creatingabetterblank,2,I’m scared of TSLA...
2020-08-18 10:48:17,ThatHotGuyIRL,2,"Sold my spy 340c weeklies yesterday, prepare to moon boys"
2020-08-18 10:47:44,Bexanderthebex,3,Jfc tsla
2020-08-18 10:45:31,junkrattrap,8,15 minutes and robinhood/TD gonna pump TSLA to $2069
2020-08-18 10:39:34,mrl2r,8,Oh man. Is this real life Elon. Fuck me
2020-08-18 10:38:45,KetaBoy123,10,"Everyone looking so bullish, i'm turning a little gay i'm afraid."
2020-08-18 10:38:10,killeral7,7,TSLA is just trying to get to 2020 before screwing us all just like how this year is going
2020-08-18 10:38:00,ascendant23,7,I haven’t seen this much unanimous excitement over a single stock here since PRPL on August 2
2020-08-18 10:37:38,q112,4,Imagine if we open above 2k
2020-08-18 10:36:03,MP1182,17,AAPL take a good fucking look at TSLA...
2020-08-18 10:34:39,ascendant23,8,"I ain’t gonna even try to call the top of this TSLA run, but wherever it is, the people who FOMO in there will give us enough loss porn to last a month"
2020-08-18 10:34:27,InterimNihilist,1,"Once we cross 2k, we're never going back down"
2020-08-18 10:33:26,yaboigoat53,3,LETS GO HOME DEPOT NOW THE PUMP BEGINS
2020-08-18 10:31:32,iwillflymetalbirds,1,omg please stay like this
2020-08-18 10:31:23,junkrattrap,7,If you think Tesla is selling off at open — the $180M in Premarket volume is gonna fuck your wife and her boyfriend
2020-08-18 10:30:03,RichBat4,10,"Tesla could rally to 2500 end of week... last time this happened it was 5 straight days, 5!"
2020-08-18 10:29:10,MrFisher_,12,TSLA single-handedly bringing me into the yacht club
2020-08-18 10:28:56,canitreallygetworse,1,is anyone else playing visa rn if so what
2020-08-18 10:27:47,junkrattrap,10,TSLA gonna open and fucking moon 10% in first 30 min
2020-08-18 10:27:34,InterimNihilist,7,"I mean it makes sense why TESLA is mooning. People like me aren't selling, and if it dips it's a great price to add more"
2020-08-18 10:27:17,ascendant23,2,I could see TSLA hitting 2000 this week but not beyond. Seems like way too many people will want to take profits there
2020-08-18 10:27:06,nosalute,3,# WTF TSLA THAT SQUEEZE
2020-08-18 10:26:43,The-Hyrax,5,"1924 PM. 

Wtf. 

Just. 

Wtf."
2020-08-18 10:26:36,boukmw,-1,I was expecting the dollar would recover with the descending curve on the US. Why isn't it recovering?
2020-08-18 10:25:31,RainMan214,10,Everybody is buying and not selling a lick of Tesla... this shit has no price target right now all it knows is moon... I’m so tempted  to sell my shares and go all in on FDs bc the amount of money I’m missing out on right now is ridiculous
2020-08-18 10:25:26,redditgod16,3,I told y’all to get on the HD train. Monster beat today
2020-08-18 10:25:04,Chicano_Ducky,2,"SI rose then flat

It doesnt wanna get closer to ATH until open

Ominous"
2020-08-18 10:24:46,dblink,6,"It's been posted 13701 times already, but TSLA 2000 EOD, 2200 EOW. If you still think the climbing will stop anytime soon, the meme power alone will carry it."
2020-08-18 10:24:04,EatMaTesticles,4,Im holding Apple and Tesla. Tesla will moon again but I’m not sure about Apple :(
2020-08-18 10:22:36,nosalute,4,🚨SPY 40 CENTS AWAY FROM ALL TIME HIGH🚨
2020-08-18 10:21:37,nosalute,10,If I buy TSLA it'll drop when it hits 2000. If I don't buy TSLA it'll rocket to 2500
2020-08-18 10:19:54,duhpolan,12,Honestly congrats to all TSLA holders y'all deserve it. Held that shit for a couple hours and it was scary
2020-08-18 10:19:51,JefBezosExWifesNewBF,1,"Curaleaf reported earnings this morning (CURLF). Largest cannabis company in the world by revenue and operating presence. 

Total revenue:+142% yoy

Gross profit: 133% yoy

All records and great forward guidance. Just buy some american pot companies on the OTC or auxilliary businesses (GRWG) the time has come"
2020-08-18 10:19:03,clarence_worley90,3,"GOOGL calls are 100% the play, eventually some money has to rotate over to good ol' Sundar"
2020-08-18 10:18:59,duhpolan,2,What's the next move? AMZN 4000?
2020-08-18 10:18:39,justinswagvila,7,"Once again I’m late to the TSLA party but I’ll probably get in anyway, only for it to reject 2,000."
2020-08-18 10:18:38,Fakemage,13,"Shit looking at TSLA makes me sick to my stomach, not because I shorted just because I have no position on this fucking rocketship"
2020-08-18 10:18:37,lakersttgy,10,"Holding NVDA and TSLA calls. Both deep itm. Selling at open bc I’m taking profit and sitting it out. I don’t even care about further gains, just want to lock up profits. I’m gonna be up 1200% on my Tesla calls..."
2020-08-18 10:18:04,Bexanderthebex,3,Someone giving out plat awards is getting 2 lambos and a model s tomorrow
2020-08-18 10:17:59,degenerati1,4,I was so close fomoing into Tesla calls at open yesterday instead went with nvda and amzn. I would be up 100k right now fml
2020-08-18 10:17:55,stupidgutsneverglory,1,Thanks for the gold man much appreciated homie.
2020-08-18 10:17:35,nosalute,7,Glad TSLA cooled off. Now I can buy calls for cheap at open
2020-08-18 10:17:25,DirtMcNast,1,I’ve never bought any TSLA but I did scoop some shorts but they’ve been delayed.
2020-08-18 10:17:06,CaptFeelsBad,4,u/free_dharma you are a rose amongst thorns. Thank you for the thingy on my other comment.
2020-08-18 10:16:28,TurboFreak10,2,Holy shit Elon is actually undercover giving gold left and right. All in Reddit calls 🚀🚀
2020-08-18 10:16:19,duhpolan,3,AAPL better run up to 470 today to make up for 1/100 of what I woulda made in TSLA if I yoloed on Monday like a planned before pussying out
2020-08-18 10:15:57,killeral7,3,At this point is it retarded not to liquidate everything at open and go balls deep in TSLA FDs?
2020-08-18 10:15:27,redditgod16,2,Kinda obvious that HD will get to 305 today
2020-08-18 10:15:11,canitreallygetworse,1,visa puts gonna pay today?
2020-08-18 10:14:52,AmbitiousSingh,5,"So I was just joking about it hitting 1950 by open. But now that it looks like it might just happen, I'm thinking of rolling out my 1900c for 2000c."
2020-08-18 10:14:47,justinswagvila,7,Why don’t I ever have the balls to get rich on the TSLA run up? I’m literally going to put my dick in a pencil sharpener as punishment.
2020-08-18 10:14:14,nosalute,8,"Should I do coke and stay awake till open?

Haven't felt this much of a rush since holding puts during limit downs in March"
2020-08-18 10:13:28,DingleberrySquirt,2,Reading all the TSLA post as I hold WMT has got me feeling like a boomer
2020-08-18 10:13:28,haasvacado,1,Cheetos are dubbed with the extremely appetizing moniker of “extruded product”. Do with information what you will.
2020-08-18 10:13:17,Cookiiiiiii,1,All gold rewards but no Plat?
2020-08-18 10:13:16,nosalute,10,Wedbush tomorrow: Upgrade to 2500 cause it already passed previous 12 month price target in less than 24 hours
2020-08-18 10:13:04,Johnnyy29,1,🍾🍾🍾🍾🍾🍾🇺🇸🇺🇸🇺🇸🇺🇸🇺🇸 TSLA
2020-08-18 10:12:41,Throwawayeconboi,3,AAPL bruh
2020-08-18 10:12:34,TairyHaint,3,My TSLA debit spreads are going to be in the money AFTER the split at this RATE lmao
2020-08-18 10:12:27,cycocrusher,3,Am I too late for the gold rush?
2020-08-18 10:12:24,nosalute,6,Maybe the real stimulus was the tesla calls everyone bought along the way
2020-08-18 10:12:22,prestiCH,5,"Tesla results and stock price to be boosted by the teslas purchased thanks to the tendies of wallstreetbets degenerates  

It's a self-sustaining cycle of autism"
2020-08-18 10:12:19,YourPalCal,7,TSLA paying for Reddit's servers indirectly
2020-08-18 10:12:15,emirsway,12,Apple due for space mission.
2020-08-18 10:12:05,Jumping_Kangaroo,9,Someone bought $11.89m worth of 8/21 $1920 TSLA calls just before the market closed yesterday. That was a clear sign another gap up was coming.
2020-08-18 10:11:30,iReddit_Noob,2,gonna make tendies off Tsla then not buy an EV
2020-08-18 10:11:27,smengi94,2,Might as well apply at Tesla already got the skills know 2-3 people including one software engineer that’s been liking it.. sold my shares way too early to get calls before the crash 😂
2020-08-18 10:10:51,,8,What color Model 3 should I get?
2020-08-18 10:10:39,clarence_worley90,4,these premarket fags are so scared to hit that $500 bid on NVDA
2020-08-18 10:10:34,nskhan84,5,What if Tsla entered talks to buy TikTok now?
2020-08-18 10:10:22,cpscott1,7,Looks like we hitting 2k TSLA today boys
2020-08-18 10:10:13,q112,5,"I keep trying to go to sleep, lay for 5 minutes, check my phone, see she’s moved up another few bucks, try to sleep, check phone, up a few more bucks, rinse repeat"
2020-08-18 10:10:05,duhpolan,6,My regret in not fomoing into TSLA is... Too much. And on top of that I bought AAPL at open yesterday.
2020-08-18 10:09:52,StreetSweepingKing,5,So...who else didn’t buy TSLA...?
2020-08-18 10:09:51,familiar_of_zero,2,"Let me just say to those who are feeling like shit not hopping on TSLA: it could've gone the other way. Also... fuck you, to the moon baby! 🚀👨‍🎤"
2020-08-18 10:09:50,iReddit_Noob,5,Time to fomo tsla
2020-08-18 10:09:32,biglettucee,3,Chegg. College students are all renting books and getting hw solutions with chgg
2020-08-18 10:09:31,wnsgus,2,maybe I should have held 🤔
2020-08-18 10:09:26,errlmcdabbed,5,gold man has tiny pp but big bank account thanks to tesla
2020-08-18 10:09:23,unequalfever,2,1926 holy shit
2020-08-18 10:09:10,Pr333n,3,Im a bull but fuck everyone is so bullish atm. Getting worried.
2020-08-18 10:08:41,AnOddvacado,2,$FREE is whole foods SPAC. It's at about $7.50. Should be at least $10 like other acquisition company's right?
2020-08-18 10:08:39,AdrianThatGuy,3,I sold my $1720 calls thinking I made smart decision 🤡
2020-08-18 10:08:38,My_Papa_Is_Elon_Musk,1,"Hope all those boomers who sold all their portfolios at the bottom reinvested into tsla, otherwise they are doubly in shambles."
2020-08-18 10:08:36,CaptFeelsBad,6,"The gold given out this morning is honestly worth more than my entire portfolio already

Edit: thank you u/free_dharma you are a rose amongst thorns. Love you."
2020-08-18 10:08:30,junkrattrap,9,Tesla call holders.....who keeps refreshing price and checking the option profit calculator???
2020-08-18 10:08:28,YourPalCal,3,This sub will probably never get banned because of all the gold being thrown around every so often
2020-08-18 10:08:17,InterimNihilist,5,Wtf we gonna open at 2k it seems
2020-08-18 10:08:10,scopolamine,5,"Once Elon becomes the richest man in the world, you know the top is in. 

We are not yet there. We need more bull runs."
2020-08-18 10:08:10,nosalute,9,Are you fucking kidding me TSLA the line isn't even showing on marketwatch its like off the graph
2020-08-18 10:07:56,irresponsible_cactus,2,Oh snap that TSLA morning wood! 🚀 🚀
2020-08-18 10:07:54,redditgod16,2,Home Depot killed it will rip today
2020-08-18 10:07:45,JaJaJalisco,3,Everyone take your TSLA profits and dump it into AMD 🙏
2020-08-18 10:07:37,SurgeonLoki,3,Im so pissed because I’m not in Tesla! Puts on everything !!!
2020-08-18 10:07:16,Drghettoj,1,"Heard fuckboys were being given out 🌈🐻

Fuck bears actually tho"
2020-08-18 10:07:11,Trisstanroberts,4,u/free_dharma dad?
2020-08-18 10:07:07,familiar_of_zero,10,Dropped 10k on Tesla on a whim. TY gut.
2020-08-18 10:06:58,My_Papa_Is_Elon_Musk,3,"AAPL, be like TSLA"
2020-08-18 10:06:38,cbitz,1,"Ok bears time to pack up 

 [https://www.youtube.com/watch?v=24T6FpUqReQ](https://www.youtube.com/watch?v=24T6FpUqReQ)"
2020-08-18 10:06:37,SurgeonLoki,3,Can i still FOMO into Tesla ?
2020-08-18 10:05:30,Snoo1726,3,"thank god for my pdt diamond hands on tsla

what the fuck even is this stock"
2020-08-18 10:05:17,spanishnuku,8,A reminder too all autists out there thinking of buying TSLA. Buy high sell low.
2020-08-18 10:05:04,TheRahulParmar,1,"Home Depot suspended its fiscal 2020 outlook in May, citing the uncertainty related to the duration of the outbreak and its impact on the broader economy.


Rip"
2020-08-18 10:05:03,My_Papa_Is_Elon_Musk,7,The tsla 420 after the split is becoming a reality
2020-08-18 10:04:57,Fobias21,1,Gotta start raining those golden fuckboys.
2020-08-18 10:04:43,JaJaJalisco,5,"It’s TSLAs world, and we’re all just living in it."
2020-08-18 10:04:39,liquidizeass,3,"Should I hate myself for not being in TSLA, or my broker for not having options on TSLA?"
2020-08-18 10:04:37,nosalute,6,Jacking off to TSLA pre-market but I'm not even holding anything
2020-08-18 10:04:37,SurgeonLoki,2,Tesla on Full Retardation Mode like in july
2020-08-18 10:04:33,ProbablyDisagreeing,8,Literally have all my rent money in TSLA so I have a place to live and it does this. Thankyou Elon. TSLA to the moon boys!
2020-08-18 10:04:33,Teckel22,9,"Lol America literally raised their debt to 140% of GDP so the people could speculate on stocks. Money could have been spend on solar panels, electric cars or road and bridges. The 1% must love it though"
2020-08-18 10:04:24,YourPalCal,3,Gold man is gonna make so much money in the morning apparently
2020-08-18 10:04:13,hypertr00per,2,"pet rocks almost always pump before FOMC, which is tomorrow

edit: we also have OPEC, a good reason for a good old fashion Oil pump and dump"
2020-08-18 10:04:02,LehmanParty,1,"Bailed out of my AGQ (Basically the meme 2x SLV) short put position because I collected 66% of the weekly premium earlier today, but I'm kind of kicking myself for not rolling it up instead. Sold $50's when it recovered back to $58 from $49, but it's like $64 already after jumping 15% between intraday and overnight. Having some safe plays mixed in with the yolos is always important, but man the fomo is real. Considering that was the ""conservative"" play and GNUS is rounding out the risky portion of the portfolio, maybe it's for the best to have a little reservation somewhere."
2020-08-18 10:03:46,repyourmax,1,I just realized that Cardi B. Is just a lazy anagram of Bacardi. The world is retarded and so am I.
2020-08-18 10:03:42,luponicdistortion,4,"I love waking up to see the boys celebrating tendies like this 

🍻"
2020-08-18 10:03:42,InterimNihilist,5,It's raining gold in here!
2020-08-18 10:03:23,Not_reddits,8,I'm guessing we have another TSLA millionaire today?
2020-08-18 10:03:10,usernemame,4,VW style short squeeze incoming for TSLA
2020-08-18 10:02:50,Jerbsybear,7,"""Umm we print money digitally"" ~~JPow~~ Elon Musk"
2020-08-18 10:02:49,nosalute,4,# THIS IS IT BOYS SPY GONNA BREAK ATH TODAY
2020-08-18 10:02:36,Mountain_dog_oc,2,How much is this cyber gold worth anyway?
2020-08-18 10:02:14,creature1231,2,"Okay praise u/free_dharma, I'm going to start my day though, thanks for the awards, Elon!"
2020-08-18 10:02:10,clarence_worley90,3,La Casa De Marijuana is mooning
2020-08-18 10:02:07,Throwawayeconboi,4,HOME DEPOT SMAAASHED
2020-08-18 10:02:03,prestiCH,5,"I've seen it all.

Golden Fuck Boy award

Tesla gaining more in pre-market then my whole portfolio last calendar year"
2020-08-18 10:01:54,jono5,5,G.Oldman is the hero we don't deserve
2020-08-18 10:01:48,subzero12320931,2,Make me feel better about selling my calls yesterday plz
2020-08-18 10:01:43,junkrattrap,2,HD and LOW gonna mooooon!
2020-08-18 10:00:57,Coffeewin,10,"For those of you who can't afford TSLA single call options because they are so expensive, a smarter way to play the bullish move is to buy OTM debit call spreads. The benefit is that they have positive theta, are asymmetric in nature and have a positive skew. For instance the 8/28 2000/2050 call spread will cost you ~$700 with the max possible profit of ~$4300. You can still take advantage of the move by playing spreads instead of paying for a single call, say 8/28 $2000 which costs about $4800 (as of yesterday) with the downside of massive theta decay."
2020-08-18 10:00:52,halfbaekd,5,u/free_dharma pop is that you?
2020-08-18 10:00:47,Knowsence,2,You won’t give the Ternion award.
2020-08-18 10:00:37,nosalute,7,Don't be a cock tease  [u/free\_dharma](https://www.reddit.com/u/free_dharma/)  post positions I want to pretend I'm holding them
2020-08-18 10:00:29,ExceptionallyGreat,5,This mysterious gold awarder is different than our regular one?
2020-08-18 10:00:28,stupidgutsneverglory,7,"TSLA made ventilators when we were in need , now they make tendies because they heard about the stimulus delay. goodguytesla"
2020-08-18 10:00:27,wardosouthport,2,Normally I’d say that these TSLA pajama traders are getting ready to throw you guys off a cliff at open but the past week has taught me that’s probably not the case. Wish I had a larger set of balls and would have get in on this. G.G. guys
2020-08-18 10:00:22,djsmitty25,4,"1800c 8/21
Thanks for the early wedding gift Elon 🎉🎊"
2020-08-18 10:00:14,ShickyMicky,1,Floating in space is even more exhilerating than I thought. So excited to leave the solar system.
2020-08-18 10:00:08,throwmeawayafter111,1,gold
2020-08-18 10:00:04,junkrattrap,3,Golden fuck boy and I hold my $15k in Tesla weeklies till Friday.
2020-08-18 09:59:56,Kingfapa,4,Just made back all my losses with Tesla and still got a 5k profit.
2020-08-18 09:59:55,Mondrayish,6,Why would anyone invest in anything other than Tesla?
2020-08-18 09:59:49,properbenj,5,Tesla 2000 EOD.
2020-08-18 09:59:20,q112,7,"Alrighty boys I gotta catch a few hours of sleep, here’s to hoping we’re at 2K by the bell and no pussy bois sell off.


Next stop 2500"
2020-08-18 09:59:16,stonksupanddown,2,"For those who trade Spot gold/silver (XAUUSD, XAGUSD), is there an equivalent for oil? Spot oil? If so, Ticker?"
2020-08-18 09:59:09,lululemonhead,2,u/free_dharma has aligned his TSLA chakras
2020-08-18 09:59:01,slightbulb227,1,all y’all fishing for a golden fuckboy are pathetic 😂
2020-08-18 09:59:01,Rich265,8,"This is gonna end badly. The last one out of the stonk market turn the lights off, please. Thanks."
2020-08-18 09:58:57,creature1231,3,"u/free_dharma actually giving a golden fuckboy, you could've actually freed Dharma with all these reddit coins"
2020-08-18 09:58:54,CaptFeelsBad,5,"Can’t say for sure, but when all the rest of the TSLA twats show up for the daily thread might not even come back myself. Won’t see anything else for at least the rest of the week. Enjoy y’all, and congrats on tendie-train ticket. Just gonna sit here at the empty Harry Potter station with my bullshit AAPL calls looking like V’s conscience."
2020-08-18 09:58:53,Cookiiiiiii,6,Elon daddy showing us some love
2020-08-18 09:58:52,prestiCH,3,"Tendies award pls

GOLD, SLV and TSLA Calls only"
2020-08-18 09:58:47,nosalute,10,🚨🚨🚨GOLDEN FUCK BOY HAS BEEN DEPLOYED ELON ACTUALLY HERE🚨🚨🚨
2020-08-18 09:58:42,WowVeryJosh,6,Chad Tesla investors vs virgin Nikola soyboys
2020-08-18 09:58:29,angryirishman,1,Reverse roaring 20s conspiracy
2020-08-18 09:58:04,phunbagz,2,Is there a feature on Robinhood to enabled self exclusion from buying puts
2020-08-18 09:57:58,silverlink22,1,What the fuck NASDAQ?
2020-08-18 09:57:52,subzero12320931,4,Guess who sold yesterday? Yup this 🤡
2020-08-18 09:57:30,toeofcamell,4,"I made $3000 today on 1 tesla option. Why haven’t I been trading tesla for months or years now?  

Seems so easy,  what are the risks with tesla?"
2020-08-18 09:57:12,DeanYerdon,5,Is there even gonna be a breather to load up on more TSLA? Or are we just gonna fuckin facerip straight to 2200 by Friday
2020-08-18 09:57:05,ThatHotGuyIRL,2,Tesla’s blowing my mind. Kinda sad that I played NVDA but also not
2020-08-18 09:56:59,ascendant23,5,Just wanted to give you all a heads up that TSLA has officially hit the PRPL ratio: more than 8 out of 10 top level comments are about it
2020-08-18 09:56:56,zeeubermensch,6,Show yourself Elongated Muskrat
2020-08-18 09:56:53,cbitz,4,"Bulls in Lambos Bears in Shambos, and guess what i'm getting 🤡🤡🤡"
2020-08-18 09:56:53,ZillionMidi,3,Tesla over the last two days is what we I’ve been dreaming of hitting on and I sold at close yesterday. Would’ve made back all the money I’ve lost so far this year had I held until now.
2020-08-18 09:56:49,IDoLikeMyShishkebabs,4,Mods we need a custom TSLA award asap to pass around with these rich bois
2020-08-18 09:56:49,Acrippin,5,Is this papa Elons stimulus package
2020-08-18 09:56:41,errlmcdabbed,7,"lmao i get so embarrassed everytime TD sends my trade confirmations. I know some recent college grad making $18 an hour is reading through them thinking ""what a fucking tard"" and he is not wrong"
2020-08-18 09:56:35,nosalute,14,No golden fuckboy? Elon Musk must not actually be here
2020-08-18 09:55:56,prestiCH,5,"Tesla to $2,000, U.S recession cancelled. BIG!"
2020-08-18 09:55:54,RADIO02118,5,"Everytime I buy puts on TSLA I get fucked. When I buy calls I make my annual salary in a few days. But there’s a little voice rn whispering “fade the rally.”  Fuck you little voice. Allocating the remainder of my capital into more calls. 

Like Elon always says, “if Tesla goes bankrupt, I go bankrupt. As it should be.”"
2020-08-18 09:55:50,creature1231,6,"I would like to go ahead and be the first to completely give myself over to u/free_dharma, a man does crazy things for platinum."
2020-08-18 09:55:48,phunbagz,2,"What goes up, must come down said Mr Newton. Then stonks happened"
2020-08-18 09:55:41,Crackbot420-69,5,Blaring ragtime music at 3 in the morning because Tsla is in the 1910's. The roaring 20's are coming.
2020-08-18 09:55:25,ProbablyDisagreeing,5,u/free_dharma are you the platinum man
2020-08-18 09:55:19,trilightning,1,Fucking etrade check clear has been like 5 days at this point i would've got more tsla these past 5 days😒
