date,author,score,body
2020-01-16 03:17:31,oregon_forever,3,https://bighugelabs.com/output/poster644de313383be9e6230c1bade3a36869551ff082.jpg
2020-01-16 03:15:52,Sonyooo,5,Nio gonna dump tomorrow. 1 billion pretty sure it’s YAN which ain’t shit in USD.
2020-01-16 03:13:28,,8,"so if a base model 3 is 35k, how long until we start seeing 15k used ones on craigslist?"
2020-01-16 03:13:16,fin425,3,I gotta be at work at 3am and I can’t sleep. Someone tell me a bed time story.
2020-01-16 03:13:08,DuckPunchxxx,3,"Never see anyone talking about BABA. It dipped pretty hard from the trade deal news that almost everyone already knew (no tariffs off China till phase 2... maybe), but it’s up in Honk Kong right now (search HK 9988) and will likely recover the small dip it suffered. Come join BABA gang! This is an incredibly strong company and possibly China’s Amazon.  
But nobody here cares about any of that, go short TSLA you bunch of autistic cucks."
2020-01-16 03:12:49,realister,3,> US Treasury Sec Mnuchin: USMCA And US-China Trade Deal Will Add 50 To 70 Basis Points To US GDP – Fox
2020-01-16 03:12:24,,1,That fugging volcano in manila is about to xplode🐻🐻
2020-01-16 03:11:51,oregon_forever,8,SPY might never see 200s ever again. Even a full blown 10% correction would take us to $300.
2020-01-16 03:11:26,BigDickDarrow,3,Trouble with a monster pump like the one Tesla has had is that it’s impossible to know where the stock is going to settle. If it drops tomorrow I could see a correction to ~470 at least before earnings. After that who knows
2020-01-16 03:11:08,fallouthong,4,ALL HAIL C C WEI
2020-01-16 03:10:36,RamaZamas,0,TSLA will fall like that Persian messenger in 300. Puts tomorrow and ride that wave down with me bois
2020-01-16 03:10:21,SvenTropics,14,"Being a bear in this market is like being a straight man at a lesbian bar and hitting on everyone. Everyone else looks like they are having fun, but you feel decisively left out... and everyone else is gay."
2020-01-16 03:10:11,Analslammer,13,"Banned for saying saying Tesla might have some support around 420.69. pussies 

https://imgur.com/a/dTojUpU"
2020-01-16 03:10:05,Shkreli2020,3,Volume end of day today got me all up discombobulated
2020-01-16 03:05:40,justinswagvila,4,Aapl circle jerk tomorrow at noon and you’re all invited.
2020-01-16 03:05:25,bimmertechin,2,Keep my Twitter calls and continue to sit on my hands for another 3 weeks
2020-01-16 03:05:04,zeek_12,1,https://twitter.com/cgrantwsj/status/1217636856709423104?s=21
2020-01-16 03:04:56,jt_the_autie,1,Inb4 tsm earnings have been priced in for 3 months & long term holders dump on you cucks
2020-01-16 03:02:45,winkerpack,6,Any of you watch the aaron Hernandez doc yet? I'm just starting it
2020-01-16 03:00:53,,2,"Why Xiaomi stock keeps climbing, they released some good news or something?"
2020-01-16 02:59:18,corey_trevorr,5,"Just boarded my plane amd sitting in row ""fd."" The universe told me what I'm doing tomorrow."
2020-01-16 02:59:11,RoyalPatriot,5,Buy TSLA if it drops tomorrow. There’s some bs articles coming out. Good luck.
2020-01-16 02:58:45,geflab,12,SPCE to the moon my dudes
2020-01-16 02:57:53,nadoterisback,6,[diamond 💎 hands nancy pelosi after she cashed out her aapl and fb calls for > $1m](https://media.giphy.com/media/JO9iWihHBzgR2PEHSt/giphy.gif)
2020-01-16 02:56:23,winkerpack,1,Mr Rooney 👉🍩 jeanie bueller
2020-01-16 02:55:57,chessiechoice,4,Winker is the type of guy to volunteer for a cavity search at the airport
2020-01-16 02:55:42,choose_a_use,-1,JPM baby don’t drill tomorrow plz
2020-01-16 02:54:59,fallouthong,3,3 more hrs till C C WEI print us tendis
2020-01-16 02:54:24,drkgla,1,Pls pray for Nvidia tomorrow
2020-01-16 02:53:16,daddydickie,1,ULTA has a huge gap to fill.
2020-01-16 02:51:08,doctordanieldoom,5,V
2020-01-16 02:50:11,fin425,13,"Today I was not scouring the internet for Ferrari’s, I was making a food budget. Tomorrow may be different."
2020-01-16 02:49:57,rentmypie,8,Hoping my $TSLA 522.50 puts keep printing
2020-01-16 02:49:21,,3,"So hypothetically, if you had 10k losses one year and then the next year you made 10k in short term gains.... The IRS of course wants your short term capital gains taxes, but do you still get to carry over of the loss from the previous year?"
2020-01-16 02:48:16,DGAF0752,4,Anybody here with $RUSL exposure? 3x leveraged Russian ETF up 117% for the one year🤷🏻
2020-01-16 02:48:15,oregon_forever,41,"On green days: Shit, I'm as good as Buffet, gonna get myself a yacht soon.

On red days: Money doesn't bring happiness anyways. I can just live off of dollar menu items."
2020-01-16 02:45:58,analyst_84,4,If we fail to break 300 tomorrow it looks like a triple top. Which is always bearish AF
2020-01-16 02:45:11,zeek_12,5,Buy Tesla dip tomorrow
2020-01-16 02:41:59,Casual_Joe,7,"Theta gang is so 🏳️‍🌈since I’ve been pledging. Is this what a reluctant bottom feels like? 

What are the veteran gays doing? call spreads? Risking $1000 to make $80 is the dumbest thing ever."
2020-01-16 02:41:12,veritasinvestments,2,Anyone playing Morgan Stanley’s earnings?
2020-01-16 02:41:08,ch1p_skylark,12,"nothing was priced in, we're gona open at 330 then moon even further"
2020-01-16 02:40:56,Truethoughts92,-7,Any of you fuckers that are married want to start a snap group or discord and talk stocks/cars/sex and about our wifeys? 😂😂😂
2020-01-16 02:39:48,Midgetfarm,14,L2fmw doesnt fuck married women or any biological women
2020-01-16 02:38:58,Cola9,4,Hello darkness my old friend
2020-01-16 02:38:38,_klopper,5,how much is TGT rebounding tomorrow
2020-01-16 02:38:15,love2fuckbearasshoe,7,"BA gonna moon 

Every body expects a shitty ER 

It’s to obvious with bad news everyday"
2020-01-16 02:35:32,Jzsjx9jjqz,7,"$TSLA bulls, [Get out before earnings. ](https://finance.yahoo.com/news/tesla-registrations-california-nearly-halves-010526006.html)  You can still be a long term bull, but FFS get out and get back in after earnings, which are sure to dissapoint."
2020-01-16 02:34:44,Big_Factz,4,Flat waiting for reports
2020-01-16 02:34:13,Spartan_Blazer,3,"got it qued up and errything

&#x200B;

[**https://youtu.be/MfEmH\_h89oY?t=120**](https://youtu.be/MfEmH_h89oY?t=120)"
2020-01-16 02:33:40,Cnastydawg,11,"Fuckers in school telling me, always in the barber shop
""Chief Keef ain't 'bout this, Chief Keef ain't 'bout that
My boy a BD on fucking Lamron and them
He, he, they say that nigga don't be putting in no work”
Shut the fuck up!
Y'all niggas ain’t know shit!
All ya motherfuckers talk about...
“Chief Keef ain't no hitta, Chief Keef ain't this, Chief Keef a fake”
Shut the fuck up!
Y'all don't real with that nigga!
Y'all know that nigga got caught with a ratchet
Shootin' at the police and shit
Nigga been on probation since, fuckin', I don't know when!
Motherfucka, stop fuckin' playin' him like that
Them niggas savages out there!
If I catch another motherfucker talking sweet about Chief Keef
I'm fucking beating they ass!
I'm not fucking playing no more!
Y'know them niggas roll with Lil Reese and them"
2020-01-16 02:32:16,MP1182,7,Fuck SPY and AAPL and MSFT and FB.  From now on I’m only playing SPCE and SDC.  They are the future of America.
2020-01-16 02:31:50,mrenormous,3,i might have to go theta gang soon. i have a bad feeling about this. fuck the bears though
2020-01-16 02:30:54,Sonyooo,1,So uh do I unload nio puts on am IV spike or hold for the drill
2020-01-16 02:30:49,love2fuckbearasshoe,11,"I bought 117 Apple share at 311.88$ 


I’m hoping to get some lunch money at open 


Apple has always been my favorite swing trading stock as I know of I get stuck bagholding I would never sell at a loss"
2020-01-16 02:30:38,mw8912a,1,Debit spread for LULU 242.5 245
2020-01-16 02:29:25,Truethoughts92,6,I'm all in on square this year fuckers. We're going to $100. Who is going to make some tenders with me 😂😂😂
2020-01-16 02:29:11,indrgun,2,FB is a good bet to jump?
2020-01-16 02:28:57,M0ngoos,0,Just spent 10$ on KOTOR II for nerdstalgia. Better have a good trading day tomorrow to make this back.
2020-01-16 02:26:47,,7,GE is up 33.52% for the last 3 months and AAPL is only up 32.30% lul
2020-01-16 02:26:03,DaJOiNTLiT,4,"If I was a bear I would say FuTuReS bLoOd GrEen, in reality it’s only up .10%. To a bull that ain’t shit but to a bear anything in red is a recession. It’s actually quite sad"
2020-01-16 02:25:32,,12,BAKIN' SODA I GOT BAKIN' SODA!
2020-01-16 02:23:50,Jzsjx9jjqz,2,"$ZEN ""We have incurred net losses each year since our inception (2007)""

Stock straight up since IPO. This is the fucking economy we live in people. Companies just have to grow, even if they lose more money as they do. 

Literally no path to profitability, just growth. Which is fucking easy to do when you sell shit as a loss.

Shit companies like this are packed into $IWM. When JPow can't prop the market up anymore and you want to go bear gang, short $IWM over $SPY."
2020-01-16 02:23:03,DGAF0752,6,How does Theta Gang make money
2020-01-16 02:22:24,WallStreetBitch,7,"So who buys 0DTE ITM option right before market closes, and why? Are they getting it at slight discount on the intrinsic value from people with no capital to exercise?"
2020-01-16 02:21:27,Jordykins850,-7,"It’d be nice if Iran stopped being a little Pussy and do something. Lash out, civil war.. do something, bitch."
2020-01-16 02:21:22,JimCramersCoke,3,$SDC to $15 tomorrow
2020-01-16 02:20:14,Spartan_Blazer,-2,Finally got my [license key](https://youtu.be/o-fMm9LTveg)  🙌 oh baby it’s been so long
2020-01-16 02:19:07,Muntberg,25,"EOD pump? Check ✔️

After hours pump? Check ✔️

Futures blood green? Check ✔️

We going to the moon tomorrow 🚀🌕💰"
2020-01-16 02:18:55,oshbear,6,"Why don't people use Merrill Lynch to trade? Money can be easily transferred between accounts if you also have a Bank of America account.

Realtime pricing and a decent platform called Merrill Edge Market Pro."
2020-01-16 02:16:11,dontlookup25,4,"I have a BYND $147c that expires on 1/31 and is down 80% (I'm retarded, but you knew that already).

I need someone to convince me either to sell it at 80% loss or hold. Either way I'm trying to stop trading afterwards because it's taking my attention away from college."
2020-01-16 02:14:05,23therealme23,12,We should all use our combined $100 in buying power to short TSLA...
2020-01-16 02:13:59,weedbrowines,12,"Big money putting out bear articles on $TSLA now that they exited their positions and dumping on retail to panic sell. Nice. Puts gonna print! 

https://www.reuters.com/article/us-tesla-registrations/new-tesla-registrations-in-california-nearly-halves-in-fourth-quarter-data-idUSKBN1ZF03N"
2020-01-16 02:12:42,choose_a_use,3,"TSM guidance is $10.2 - $10.3B assuming 30.6 exchange rate. Analyst estimate is $10.5B. Average exchange rate in the last quarter is approx 30.3... with this additional help from weakened USD and companies stocking their warehouses anticipating more tariffs last quarter, surely they have to beat. Also almost no competition in advanced nodes after Globalfoundries fucked up big time last year."
2020-01-16 02:12:36,Rikiking,3,Bynd 127 and tsla 560 EOW
2020-01-16 02:10:51,winkerpack,2,Trying to figure out which alt belongs to which users is a full time job for me 🧐
2020-01-16 02:10:07,UnsolicitedPeanutMan,3,"God, I was going to buy SPCE calls ten days ago but some rando on here told me it was garbage. Finally entered a position earlier today but I feel like I missed a big opportunity."
2020-01-16 02:08:55,Sonyooo,4,"BA thoughts, 320 or 340 tmrw?"
2020-01-16 02:07:34,SomeComparison,2,Anyone buying calls on pot stocks? Thinking about calls on $MJ any better trade setups?
2020-01-16 02:06:45,analyst_84,1,A sphincter says what.
2020-01-16 02:05:53,HoorayForSnail,2,"Trying to decide if it's best to get in on TWTR before their earnings report or after. Gotta think with the Olympics, Euros and an election that they'll have a big year but with how shaky q3 looked last year, I'm a bit uneasy."
2020-01-16 02:04:20,Evie_Chandler,3,"Will V continue the upward trend, or has the markets already absorbed all the good news?

Looking for a short-term play. Maybe I'll just FOMO into SPCE and hope it goes on for another day."
2020-01-16 02:03:52,1353-,2,^(Boeing 🤞🏻)
2020-01-16 02:03:43,e_brakedrip,6,Why is everyone hating on Tesla all of a sudden...there were down days then spiked up. So why not buy dip until it doesn’t work? Did the stock move to fast.... yeah I said that so long ago. But that stock works with its own rules. Someone will come out tomorrow with a PT of 6001 and show grand master China guy riding in one. Then hit 600.
2020-01-16 02:03:29,P05E1D0N,2,$12 GE calls tomorrow maybe puts in the afternoon. It keeps bouncing between like $11.75 and $12.25
2020-01-16 02:03:24,wolf_of_wall_mart,2,anyone else ever had their ear like.. deteriorate i guess?
2020-01-16 02:03:04,digitalradiohead,8,https://finance.yahoo.com/news/tesla-registrations-california-nearly-halves-010526872.html https://finance.yahoo.com/news/tesla-registrations-california-nearly-halves-010526872.html
2020-01-16 02:02:58,Kane014,5,"How do are people able to read all the autistic 🌈🌈 comments on these threads when there are over 3k comment? Also how do you all make money, I think my screen is broke it is always red"
2020-01-16 02:01:49,hello-world-foo-bar,2,"I read from reuters that tesla registration may have fallen by half in q3/q4

The argument is that demand d was pushed forward as everyone got in on the final 1800 rebate before it expired at end of year in q3.

Growth is from countries that continue offering rebates.  Tesla model 3 owners are price sensitive"
2020-01-16 02:00:20,rickknightpcw,6,"Spent the day driving from chgo to Tampa. Stopped to take piss and found my SPCE calls, I bought Tuesday, ,  were up 100percent.  Thanks to whomever posted on Tuesday,  how hot they were. Thinking bout tsla calls for tomorrow."
2020-01-16 01:59:26,Orgasimo,14,"Eyo my guy u/stormwillpass how would you feel about being portrayed as ""giant hentai tentacle monster"" in my next meme?"
2020-01-16 01:57:31,Sonyooo,3,"I’ll give you guys some advice here... some quality DD if you will. No shit post. Buy BlackBerry LEAPS $BB. 01/2021 7.5 calls are .9 a piece and will print this year. 01/22 1.2 a piece. Stock in on an uptrend and you can at least scalp but this will blow past $7 very soon, lots of positive news for this stock and they’re sitting nicely with their QNX and Cylance integration with large contracts with many brands. God I sound like Trump. Listen or not, let me know if you make tendies though."
2020-01-16 01:55:54,BennyFlocka,5,Anyone else watch the Aaron Hernandez doc on Netflix? Shit
2020-01-16 01:55:28,Hyilix,5,SPY puts. We’re up 18% on the Nasdaq in the last three months? Autist time.
2020-01-16 01:55:19,WorthyAlpaca,5,I really fucked up here with BYND. Any thesis on a bounce? Lol
2020-01-16 01:55:18,optionstudent516,1,Taking my autism to the borgata winter open
2020-01-16 01:55:13,mrenormous,6,Robinhood is so fucking bad
2020-01-16 01:54:59,sk169,8,"No more ww3, fed repo is known, trade war calmed down.. What can moon the markets now? Good earnings in the next two weeks?"
2020-01-16 01:54:50,bbvending88,3,I almost want to do a yolo on SPY $330 calls
2020-01-16 01:54:38,Aerhinki,3,How bad is going down 10% in one day
2020-01-16 01:53:37,HereForMadden,3,Is iv generally highest in the morning and eod?
2020-01-16 01:52:24,1sildurr,9,"I have absolutely no predictions about what any stock, etf, futures, or index will do tonight, tomorrow, or anytime in the future.

So I'm going to play theta gang because I can't predict shit."
2020-01-16 01:51:03,,-11,"
There were a lot of things we couldn't do in an SR-71, but we were the fastest guys on the block and loved reminding our fellow aviators of this fact. People often asked us if, because of this fact, it was fun to fly the jet. Fun would not be the first word I would use to describe flying this plane. Intense, maybe. Even cerebral. But there was one day in our Sled experience when we would have to say that it was pure fun to be the fastest guys out there, at least for a moment.
It occurred when Walt and I were flying our final training sortie. We needed 100 hours in the jet to complete our training and attain Mission Ready status. Somewhere over Colorado we had passed the century mark. We had made the turn in Arizona and the jet was performing flawlessly. My gauges were wired in the front seat and we were starting to feel pretty good about ourselves, not only because we would soon be flying real missions but because we had gained a great deal of confidence in the plane in the past ten months. Ripping across the barren deserts 80,000 feet below us, I could already see the coast of California from the Arizona border. I was, finally, after many humbling months of simulators and study, ahead of the jet.
I was beginning to feel a bit sorry for Walter in the back seat. There he was, with no really good view of the incredible sights before us, tasked with monitoring four different radios. This was good practice for him for when we began flying real missions, when a priority transmission from headquarters could be vital. It had been difficult, too, for me to relinquish control of the radios, as during my entire flying career I had controlled my own transmissions. But it was part of the division of duties in this plane and I had adjusted to it. I still insisted on talking on the radio while we were on the ground, however. Walt was so good at many things, but he couldn't match my expertise at sounding smooth on the radios, a skill that had been honed sharply with years in fighter squadrons where the slightest radio miscue was grounds for beheading. He understood that and allowed me that luxury. Just to get a sense of what Walt had to contend with, I pulled the radio toggle switches and monitored the frequencies along with him. The predominant radio chatter was from Los Angeles Center, far below us, controlling daily traffic in their sector. While they had us on their scope (albeit briefly), we were in uncontrolled airspace and normally would not talk to them unless we needed to descend into their airspace.
We listened as the shaky voice of a lone Cessna pilot asked Center for a readout of his ground speed. Center replied: ""November Charlie 175, I'm showing you at ninety knots on the ground."" Now the thing to understand about Center controllers, was that whether they were talking to a rookie pilot in a Cessna, or to Air Force One, they always spoke in the exact same, calm, deep, professional, tone that made one feel important. I referred to it as the "" Houston Center voice."" I have always felt that after years of seeing documentaries on this country's space program and listening to the calm and distinct voice of the Houston controllers, that all other controllers since then wanted to sound like that, and that they basically did. And it didn't matter what sector of the country we would be flying in, it always seemed like the same guy was talking. Over the years that tone of voice had become somewhat of a comforting sound to pilots everywhere. Conversely, over the years, pilots always wanted to ensure that, when transmitting, they sounded like Chuck Yeager, or at least like John Wayne. Better to die than sound bad on the radios.
Just moments after the Cessna's inquiry, a Twin Beech piped up on frequency, in a rather superior tone, asking for his ground speed. ""I have you at one hundred and twenty-five knots of ground speed."" Boy, I thought, the Beechcraft really must think he is dazzling his Cessna brethren. Then out of the blue, a navy F-18 pilot out of NAS Lemoore came up on frequency. You knew right away it was a Navy jock because he sounded very cool on the radios. ""Center, Dusty 52 ground speed check"". Before Center could reply, I'm thinking to myself, hey, Dusty 52 has a ground speed indicator in that million-dollar cockpit, so why is he asking Center for a readout? Then I got it, ol' Dusty here is making sure that every bug smasher from Mount Whitney to the Mojave knows what true speed is. He's the fastest dude in the valley today, and he just wants everyone to know how much fun he is having in his new Hornet. And the reply, always with that same, calm, voice, with more distinct alliteration than emotion: ""Dusty 52, Center, we have you at 620 on the ground.""
And I thought to myself, is this a ripe situation, or what? As my hand instinctively reached for the mic button, I had to remind myself that Walt was in control of the radios. Still, I thought, it must be done - in mere seconds we'll be out of the sector and the opportunity will be lost. That Hornet must die, and die now. I thought about all of our Sim training and how important it was that we developed well as a crew and knew that to jump in on the radios now would destroy the integrity of all that we had worked toward becoming. I was torn. Somewhere, 13 miles above Arizona, there was a pilot screaming inside his space helmet. Then, I heard it. The click of the mic button from the back seat. That was the very moment that I knew Walter and I had become a crew. Very professionally, and with no emotion, Walter spoke: ""Los Angeles Center, Aspen 20, can you give us a ground speed check?"" There was no hesitation, and the replay came as if was an everyday request. ""Aspen 20, I show you at one thousand eight hundred and forty-two knots, across the ground.""
I think it was the forty-two knots that I liked the best, so accurate and proud was Center to deliver that information without hesitation, and you just knew he was smiling. But the precise point at which I knew that Walt and I were going to be really good friends for a long time was when he keyed the mic once again to say, in his most fighter-pilot-like voice: ""Ah, Center, much thanks, we're showing closer to nineteen hundred on the money."" For a moment Walter was a god. And we finally heard a little crack in the armor of the Houston Center voice, when L.A.came back with, ""Roger that Aspen, Your equipment is probably more accurate than ours. You boys have a good one.""
It all had lasted for just moments, but in that short, memorable sprint across the southwest, the Navy had been flamed, all mortal airplanes on freq were forced to bow before the King of Speed, and more importantly, Walter and I had crossed the threshold of being a crew. A fine day's work. We never heard another transmission on that frequency all the way to the coast.
For just one day, it truly was fun being the fastest guys out there."
2020-01-16 01:50:59,,7,New strategy in getting my foot in the finance world door: 1) begin networking by caddying at local country club during day 2) read and reread art of the deal and how to win friends and influence people at night 3) compliment old farts at country club on breaking 90 while joining them in making wise cracks about minorities 4) casually segue conversation from banter and witticisms to my expertise in options trading 5) profit
2020-01-16 01:50:43,Madrid_Fan,21,Taking some acid tonight I’ll let you guys know what big brain stonks to buy tomorrow 😎📈
2020-01-16 01:50:35,Droidvoid,4,"It’s funny how owning a certain position can make you change your perspective on something. Lol TSLA is in fact a $100 billion company. It has AI, battery tech, the infrastructure and so on, but if you asked me last week... goddamn me and the puts I sold this morning"
2020-01-16 01:50:26,FailCrew,2,What should I lose money on tomorrow?
2020-01-16 01:49:24,spyaintnobitch,4,SPCE up nicely AH
2020-01-16 01:49:10,S_Jack_Frost,5,Just learned that Mark Cuban saved his money and made more by selling calls on yahoo and buying puts before/during the dot com crash. How the fuck did he time that so well?
2020-01-16 01:48:25,PrinceofPeachtree,9,I’m seriously considering buying more Tesla puts. Feel like this is a massive opportunity but I’m scared of Daddy Elon.
2020-01-16 01:48:15,JustAnotherFKNSheep,7,Amd please moon
2020-01-16 01:48:14,,2,"I feel like longing LYFT is a must right now. Quietly having a constant amount of 📈days (currently in their 2nd best streak since their IPO), partnerships with JPMorgan Chase & Delta recently. Unless one of their drivers kidnaps and kills someone I don’t see any reason for this to drop anytime soon"
2020-01-16 01:47:49,chaney3,3,What if Warren buffet was a WSBs degenerate? Lucky for you I've been working on the answer for a few weeks now and will be releasing my research this weekend!
2020-01-16 01:47:48,galactictaco42,2,"what do you do if a stock/etf breaks out of a daily bollinger set, and puts a hard green cock right on top with minimal wick? fully....extended, out of the bollinger bands

just liike....before i say a ticker, those sets of facts, what do you rule of thumb that?"
2020-01-16 01:47:44,chobochocobo,2,$SHAK round 2 tomorrow
2020-01-16 01:47:25,LEROYJANKUM556,2,Out of ten how fucked am I on ACB 1.5p 2/14 ?
2020-01-16 01:45:58,analyst_84,4,The next crash wont happen during business hours. It will be overnight or over the weekend.
2020-01-16 01:45:46,Ugadawg7,3,I'm going from locking in a rate to closing in 2 weeks for my refi. Long online mortgage companies
2020-01-16 01:45:32,CommanderInTweet,8,"WE WANT THE PUMP 

GOTTA HAVE THAT PUMP YEAH"
2020-01-16 01:43:45,fallouthong,7,TSM SUPPORT GROUP.  WHOS HOLDING AND WHOS SHAKING RIGHR NOW?
2020-01-16 01:42:43,Guygenist,19,Closed on a house today. Now $340k in debt 😭
