date,author,score,body
2020-06-16 02:15:36,giggyhawk,1,apples
2020-06-15 01:14:18,Calhockeypw,1,North Korea saying there boutta start a war might be the most bullish thing ive seen in a while
2020-04-19 19:29:12,KilgoreTroutSoItGoes,1,Wtf is guaranteed to happen w $tvix this week?
2020-04-18 08:41:51,The_Real_Hmm,1,Anyone have any experience with SPACs?
2020-04-18 02:40:39,,1,What’re your thoughts on “EWLL”? Will it ever go up?!
2020-04-17 20:40:46,kloudsta7,1,Spy just go down 280 on Monday then I'll buy you end of day calls plz PLZ PRETTY FUCKING PLEASE HOLY FUC K!!!!!!
2020-04-17 19:55:43,stk1818,3,why is spy not drilling???
2020-04-17 19:39:32,help-yo-bro-out,3,What if this whole rally is a scheme made by rich hedges to buy cheap puts for the next drop 🏳️‍🌈🐻 a little birdie told me their hedge sold 75% of holdings 😳
2020-04-17 19:02:22,KingAutist-0004,1,I’ll cum if it hits that
2020-04-17 18:33:35,koreantoplobster,1,Rip
2020-04-17 18:07:19,wesmt,1,We aren't reopening anytime soon.
2020-04-17 17:45:36,koreantoplobster,1,[https://www.reddit.com/r/wallstreetbets/comments/g36n4h/what\_did\_i\_do\_wrong/](https://www.reddit.com/r/wallstreetbets/comments/g36n4h/what_did_i_do_wrong/)
2020-04-17 17:22:30,dawhizkid,2,Is 285 a real resistance level? Heard 292
2020-04-17 17:20:24,trade_-,1,“Pound Down” - NJ Governor
2020-04-17 17:16:21,shehatezme1,1,BA FLAG
2020-04-17 17:03:48,grigsbie,5,"You’ve heard of 💎🤚🏻

But have you heard of 🚫🤚🏻?


I’m seeing comments where people are buying puts and immediately cashing out for a loss."
2020-04-17 16:52:05,DismalBread,3,"Congratulations, you are wrong about everything"
2020-04-17 16:44:52,DecentPhase,1,I love seeing bears Reeeeeeeeeee on this board
2020-04-17 16:32:06,diunay_lomay,2,GLD wont die.  What the fuck
2020-04-17 16:28:45,diunay_lomay,2,"I went retard and became a bear.  SPY 282P  , GILD 80P and SHOP 550P

I should have just stayed cash and relax for today.

Might cash out soon so I don't have to look at this shit today"
2020-04-17 16:20:29,diunay_lomay,3,EOD Moon or Drill.  I picked up SPY 282 puts let's see if it screws me
2020-04-17 16:20:25,isles478,1,spy and only going up and then gapping higher the next day name a better duo
2020-04-17 16:08:33,isles478,1,of course the day tech stonks drop other stonks go up so spy still goes up. it’s like the system is rigged against bears haha
2020-04-17 16:05:26,Blue_dick,-2,BA loves fucking $150 like I love fat bitches.
2020-04-17 15:54:33,michael370662,1,How to buy puts on Chinese manufacturers? Not ecommerce
2020-04-17 15:49:19,FootofGod,-1,"So does anybody doubt Trump told JPOW. Straight up ""you'll do whatever is necessary to create a V shape or you're out and the scapegoat for everything,"" so we're going to at least see 300, fly the ""MISSION ACCOMPLISHED"" banner once more before it falls apart from overuse, and spiral into oblivion."
2020-04-17 15:49:07,trump_sucks_we_know,3,One wasted day ain't hurting these puts. Diamond hands.
2020-04-17 15:47:29,trump_sucks_we_know,2,"You know it's fake when every CEO on earth goes on Bloomberg and the first thing they say is ""demand has never been higher"". What a joke. Follow their puts and make money."
2020-04-17 15:46:09,Got_Fired_Twice,2,you know its a fake pump when AMZN starts crawling back up. Holding May Calls until it hits 2500.
2020-04-17 15:37:10,Kramnet,1,Can things go my way just once.... like damn
2020-04-17 15:29:40,VickysTits,1,breaking the low on spy today. Might get ugly
2020-04-17 15:25:34,14361rock,1,Made a good profit this morning
2020-04-17 15:06:44,botulism69,1,Thank God I sold calls right at open. Fake pump boyz
2020-04-17 15:00:26,Pittsstopdu,2,SPY $285p 5/18
2020-04-17 14:59:37,throwawayed11,1,msft 200c 5/15 yolo all in bois. whos with me
2020-04-17 14:50:59,human_experience123,1,BUY CALLS BUY CALLS BUY CALLS
2020-04-17 14:44:14,86_105,2,SHOP is moving nicely today
2020-04-17 14:17:41,fap_nap_fap,5,Cash gang never felt so fucking good
2020-04-17 14:17:01,nats7798,5,"Guys I told u already

Funds and asset managers are dumping today

Weekend will have bad news"
2020-04-17 14:12:24,OneCardiologist1,1,How do you guys check open short positions on a stock ?
2020-04-17 14:12:03,peanut-britle-latte,1,Hope I'm not being too greedy with my MSFT & SPY limit sells. I set price targets for MSFT 180 (4/17) & SPY 290 (5/15).
2020-04-17 14:09:43,isles478,1,I’m so excited for 4 hours of slow climb
2020-04-17 14:00:51,isles478,7,market sells off in first 20 mins. now prepare for 4 hours of slow climb
2020-04-17 13:56:11,CuiVerde,1,Invert wsb best thing in this muddy water
2020-04-17 13:53:25,blueairplane123,1,GDX calls are dirt cheap rn
2020-04-17 13:47:18,DelaRosaX,2,Are y’all buying GILD puts?
2020-04-17 13:44:23,hjames9,3,Any dip in AMZN should be bought considering they took over the retail business of the entire world and all...
2020-04-17 13:41:43,DTLACoder,3,Lmao all the AMZN gravy train chasers getting fkked
2020-04-17 13:39:18,KeenisBeenis,4,"This market in a nut shell

https://i.imgur.com/fk3YbNE.jpg"
2020-04-17 13:37:16,amer_detroit,5,My puts arent as ded as i thought theyd be this morning.
2020-04-17 13:35:25,battousai1130,3,My moderna puts are fucking 60 percent down fuck me
2020-04-17 13:35:12,akhtarst,1,You guys are commenting on the wrong thread
2020-04-17 13:33:44,Rich265,1,"And the profit taking begins. Thanks for the SPY ETF pump, JPOW."
2020-04-17 13:32:25,DelaRosaX,1,TSLA CALLS WE SELLING OR HOLDING
2020-04-17 13:32:03,ion3,1,So what’s going on here??
2020-04-17 13:28:34,but-this-one-is-mine,2,Thanks
2020-04-17 13:26:29,KeenisBeenis,3,"Smoking a bowl before open because lord knows I wasn’t going to make the right plays sober anyway.

These past 2 months have broken me friends"
2020-04-17 13:23:32,_penseroso_,2,Hey guys stop looking at the May WTI oil contract (the one Investingcom defaults to.)  Everybody is rolling off it to June and June is pretty flat today
2020-04-17 13:15:00,Watblieft,2,"Oil dropped below 17,50, going even further down. Wow."
2020-04-17 13:10:58,QuasiQwazi,2,"In 1918 after the Spanish Flu killed tens of millions the stock market went ballistic (up) without the economy being shut down and without a Fed printer going Brrrr. Imagine this market with the Fed printer going Brrr.

AMZN calls

Spy calls"
2020-04-17 13:06:17,,1,"TLT not getting rocked like I thought.
Strange world."
2020-04-17 13:05:07,pojo18,3,"back in the 285's

sorry bulls!! jpow taking a 3 day weekend!

FLAT open!"
2020-04-17 13:03:51,Rich265,2,"CNBC says economy will take a year to recover, but stonks ATH. It's like me selling you a broken TV for full price, but I'll come by sometime next year to fix it if I'm still around."
2020-04-17 12:54:09,Salty-Grips,1,"AMD 60 call holders, what are you guys gonna do open?"
2020-04-17 12:41:49,DelaRosaX,3,TSLA CALL SQUAD RISE UP
2020-04-17 12:33:45,xGOXSTRAPx,5,Holy shit crude getting fucking SLAPPED
2020-04-17 12:29:46,rmrd26,3,Its going to be a bigly green day isn't it 🤦😭
2020-04-17 12:17:03,wesmt,9,Futures held. We are going up all day
2020-04-17 12:15:34,Zsaszal,0,need RF to take a fat dump at open
2020-04-17 12:11:18,compoundpat,4,CNBC is pumpppping
2020-04-17 12:06:00,BigPoppa2323,-12,"not sure if wrong spot to post this, but I am thinking about dropping 1000 bucks into my robinhood account and trying some options, keep in mind I have never bought an option in my life, what do you guys think?"
2020-04-17 12:05:30,share_the_groove,1,Thinking uvxy calls today. There has to be a sell off at some point.
2020-04-17 11:42:39,SexyAssLatino,-1,"Dudes, this year is going to be an absolutely awesome Fall. All the good Music Festivals and All of the January-May Sporting events have been pushed to Fall. There's going to be so much more than typical to do then."
2020-04-17 11:41:18,qwpajrty,3,Is there any chance for AAPL to recover today or should I just get out and lock in the profits from yesterday?
2020-04-17 11:40:43,yourfanboynick,3,I dont know whether to bail out of my puts or hold. This shits rough
2020-04-17 11:36:38,Isthiswittyenough92,-5,Dumb question - does robinhold allow selling options pre-market or shares only?
2020-04-17 11:31:30,Heim23,4,"Market hits 288, falls back to 266."
2020-04-17 11:23:22,Vinny32295,3,I am going all in on BA 5/1 $180’s. Once they announce a deal with Fed shit will moon. I think it’s going to be around when they announce earnings 4/29
2020-04-17 11:21:51,PAPaddy,1,5/15 expiry. Gonna wait
2020-04-17 11:18:14,captainlvsac,4,Zillow is still fucked long term right? Bag holding all those houses they bought to flip?
2020-04-17 11:17:37,rioferd888,2,USO. fuck sake
2020-04-17 11:09:40,Hupepak,4,AMZN back to 2400 😃
2020-04-17 11:05:54,wsb4eva0712,2,amc calls are free monnnney
2020-04-17 10:59:56,LastTrainToHome,2,Should we sell calls at open or hold through weekend or day?
2020-04-17 10:57:58,rioferd888,3,Tsla really is going back to 900. lol
2020-04-17 10:51:52,AnyStormInAPort,2,"What day do forward oil contracts roll over? 

Is it today?"
2020-04-17 10:50:03,rmrd26,1,What hpnd to europoor..why is it rippin
2020-04-17 10:49:50,WSBewb,1,"Uber, roku, okta all calls June expiration.

Maybe some puts on RCL"
2020-04-17 10:43:08,uninfinity,6,"Goldman pumped the market earlier this week saying their SPY 180 scenario no longer applies and March 23rd was the bottom and they now see SPY going to $320. 

After probably successfully exiting their underwater positions they are now bearish again.

 **Goldman strategist says market rally has been ‘too rapid’**

 [https://www.marketwatch.com/story/goldman-strategist-says-market-rally-has-been-too-rapid-2020-04-16](https://www.marketwatch.com/story/goldman-strategist-says-market-rally-has-been-too-rapid-2020-04-16)"
2020-04-17 10:41:59,ddiddy171,2,"Debating selling GOOGL, bought it at 1060 and it ad dollars are going to take a hit and slow on cloud growth"
2020-04-17 10:39:57,stk1818,1,"thoughts on this at open...

all will be bought $20 in the money expiration may 15th need to know asap???

spy puts

ba calls

nflx puts

work calls

tsla puts

gild puts

msft puts (because its at an all time high and has to fall)"
2020-04-17 10:38:44,Bighonk97,1,"[https://www.marketwatch.com/story/goldman-strategist-says-market-rally-has-been-too-rapid-2020-04-16](https://www.marketwatch.com/story/goldman-strategist-says-market-rally-has-been-too-rapid-2020-04-16) 

Goldman Calling Top"
2020-04-17 10:37:51,ev01ution,5,Anyone else buying Amazon calls at open?
2020-04-17 10:37:27,ddiddy171,5,Market forget we have 20% unemployment 😳
2020-04-17 10:36:07,Radiologer,4,Bears Im worried about you. You dont call or write anymore. Is everything OK?
2020-04-17 10:33:47,LiviuDragneaOfficial,2,"If europe is 4% AMERICA MUST BE 15%   
AMERICA IS BACK AHAHAHA BEARS"
2020-04-17 10:31:58,LiviuDragneaOfficial,3,"Apparently boomers have been blowing their brokers phones, buying shit load of stocks while cursing millennials. Imagine being a millennials and not having any assets"
2020-04-17 10:30:59,Makxz,0,"This thing has retard strength bears

Don't go for puts EOD"
2020-04-17 10:29:37,Lagaru,1,Federal reserve can’t print money forever eventually people will use scarce assets that are immutable. Wake up people.
2020-04-17 10:28:49,ddiddy171,7,MSFT is $9 from it all time high lmfao
2020-04-17 10:26:17,RANDY_MAR5H,3,"Question for you guys: How reliable is the robinhood STOP limit? Because I know at open, the percentages/prices get wonky and IF a limit breaker is it, once again it gets wonky.

Are those things to worry about or can I set it and go to sleep?"
2020-04-17 10:26:01,klopolo,1,"Anyone else think reality will set in and stocks will all go down. I want a bull rush I do i got my little fatty calls but god dam this shit isnt real. Its not sustainable and I feel like itll pump till 10-10:30 then that pump will get readjusted to reality and plummet down. I hope it skyrockets green today and stays that way I tried gay bear shit and it's only lost me money even with plummets. So I'm bull all day cause nothing makes sense up is down. Down is up and its fucking fun and wild all at the same time.

40 cts 01jan21 tna 70$ call good luck autist"
2020-04-17 10:25:10,creedthoughtsblog,7,"200 Day Moving Average 292.9, pre market 287/288 ish.

if SPY pushes through then it would be quite bullish"
2020-04-17 10:24:37,THlS_GUY_FUCKS,-6,"Glad im out of my calls, this is some fire player shit"
2020-04-17 10:23:55,oAquaman,9,"So Europe is breaking +4%, and with us having the strongest economy in the world, that means we will be +10% 🚀🚀🚀"
2020-04-17 10:22:51,niceguy897,4,everyone is talking about the printed money but [dollar index](https://www.investing.com/indices/usdollar-chart) is still higher than mid-february levels. seems like printed money couldn't find its flow in the system.
2020-04-17 10:21:36,LiviuDragneaOfficial,0,V SHAPE RECOVERY
2020-04-17 10:20:31,tibi888,2,Gamestop still shows AH on marketwach. Anyone? No volume on PM or what?
2020-04-17 10:20:18,IVCrushingUrTendies,-1,Unless they knock futures lower before open there’s no way there was enough liquidity in AH for shorts to cover right?  Can that drive this thing higher in the morning?  I can’t decide with monthlies expiring today and the gap up on everything even if the news was questionable
2020-04-17 10:19:56,Mario_209,2,DAX at 4%.....today we drown in tendies
2020-04-17 10:19:53,OKOKOK405,11,Oil is just being crude at this point..
2020-04-17 10:19:49,CptTonyStark,7,Does anyone else feel like 290 is the ceiling?
2020-04-17 10:19:00,ThatOneDrunkUncle,6,Goldman calling the top. Glad they recommended buying all week
2020-04-17 10:18:46,CptTonyStark,2,So glad I didn't sell my 4/17 TSLA 1000c
2020-04-17 10:17:59,bctTamu,2,The gay bear population in here is still too damn high.
2020-04-17 10:17:07,burkie1487,1,What happened to AAPL? China. News? It was up big last last night
2020-04-17 10:16:58,,2,"UPVOTE for SELLOFF AT OPEN, RED BY CLOSE

DOWNVOTE for BIG GREEN TO CLOSE"
2020-04-17 10:16:47,Wakanda_Dreams,2,Did Cramer recommend buying GILD?
2020-04-17 10:16:43,wsb4eva0712,1,Yes amc support yourself above $3. Next stop $4!
2020-04-17 10:16:34,Kramnet,4,"I think I know what’s happening...

Trump announced on the 14th that he’d be meeting with every big name in each sector of the economy via teleconference to devise a “plan” from very “smart” people in how we’re going to open America again and sky rocket the v shape recovery. Every person and company he mentioned colluded and devised this plan. They knew that the only way the investors and even American people would back up the companies even in the MIDST of a pandemic is to use our FOMO THATS been bottled up and jerked around with every pump that the feds have thrown at the market since the crash. There is obviously no cure, you’re not retarded enough to believe that, which is why it brings the question of what the fuck is going on?? Is this real?? The answer is, it’s a complete fabricated attempt timed so perfectly with trumps reopening guidelines that he worked with the governors, also business men who have a lot lost a lot of money so far, and have so much to gain at everything being this low. Trump is a businessman, a piece of shit businessman, which makes him dangerous to the public. He and the other top 1% working together against natural orders and make the economy succumb to their will. That’s where Gilead comes into play. It is the “justification” or the green light that we’ve all anxiously been on the lookout for, because we knew it was coming one day and we were sure as hell not gonna miss out on it. Trump hates amazon, this is the second sign to my conspiracy. Amazon was not invited to the meeting and you can find out who else werent by seeing there stocks drop while every one else’s sky rockets. This is all I have so far, I don’t know what this means in the grand scheme of things tbh cause I’m still a peasant and learning how to put 2 and 2 together in a world full of manipulation and lies. But I truly believe that this is what’s causing all of this to happen. Complete fabrication, they sped up the recovery before its due time. We are not recovered as a country. If someone has further insight on what this could mean a year or two down the line for the economy if we don’t have a cure by then, which is what they’re banking on. They’re hoping we have a cure by then and the lives lost until then won’t mean shit to them. Leave any comments thanks.

TLDR: the 1% fabricating events to revive the market and gain more power than before. There is no cure. Just read it..."
2020-04-17 10:15:05,marvin_droid,5,GUH
2020-04-17 10:14:18,wsb4eva0712,1,GLD puts at open?
2020-04-17 10:13:46,mourningbagel,7,If my gut tells me it's peaking I'm selling these calls with no hesitation. Not gonna get musked again
2020-04-17 10:13:04,APHAbaghodler,15,Put holder here. Not checking the market today.. i already know it's sky high. No need for that negativity.
2020-04-17 10:12:38,maggiathor,4,So I just watched the Cramer bid on banks and Gilead ([https://www.youtube.com/watch?v=N8jX0Vai3eM](https://www.youtube.com/watch?v=N8jX0Vai3eM)). Are people fucking retarded? Only Remdesivir can save the banks?  Why are people buying this as if this is bullet proof hair loss reversal? Best case you get a few less severe cases.
2020-04-17 10:12:07,JefBezosExWifesNewBF,7,Omg you people with CHEWY calls are betting on the new pets.com🤣🤣🤣🤣true autists only
2020-04-17 10:11:13,scopolamine,15,"China recorded **its first negative GDP** quarter since reporting began in 1992. -6.8% GDP growth in Q1.

Take this number with a bit of salt since it is coming out of China. How big do you think the whole picture is?"
2020-04-17 10:10:52,delonl,5,Hold or sell my tsla puts at open? What an insane pump lol
2020-04-17 10:10:11,SometimesImOp,5,Everything is green and chewy keeps falling.. fuck me side ways raw
2020-04-17 10:10:00,ShawnHans007,2,Imagine betting against the USA
2020-04-17 10:09:53,jeffynihao,2,Fuck. It helps throwing the night. Fuckity fuck.
2020-04-17 10:09:42,boscodown,4,"What does everyone think spy will top out at this am, or do we see gap down asap cause AH was uncalled for."
2020-04-17 10:07:56,,7,During bear times we liked the weekend for the new Covid case increase. Now we like the weekend for the new treatments news.
2020-04-17 10:07:29,CptTonyStark,10,I was gonna sell my calls at open but now WSB is agreeing with me which is making me nervous...
2020-04-17 10:07:07,LirarN,8,remdesivir gonna pump spy so hard we will reach a new ath
2020-04-17 10:06:57,Rajiaa,5,I've been incredibly gay these last few weeks and only have $37 left. Send help
2020-04-17 10:06:42,TAWS,2,Gold about to drop below 1700
2020-04-17 10:05:56,yeahman64,4,MSFT stock price is factoring in 0 change to consumer demand or company investment even though household income will be fucked and company Income will be fucked
2020-04-17 10:05:27,scopolamine,13,"Unemployment claims and jobless numbers from US labours are not matching. It's important to see that many applications are rejected, which has created a gap between the initial and continuing jobless claims. This trend will result in a lower than expected unemployment rate but a significant increase in the number of Americans leaving the labor force. Only 65% of unemployment application is being accepted currently.

[http://si.wsj.net/public/resources/images/B3-GN478\_Dshot\_NS\_20200417052205.png](http://si.wsj.net/public/resources/images/B3-GN478_Dshot_NS_20200417052205.png)

Really sad to see this. In order to save the market, let's not accept unemployment applications. Problem solved! Stocks to the MOON! Really ridiculous."
2020-04-17 10:05:15,benjohnson1988,15,Germans so socially awkward virus stands no chance.
2020-04-17 10:04:41,TAWS,5,That futures spike is why everyone should set limit sell orders
2020-04-17 10:04:34,iamjt,5,I feel like if I short DAX now its gonna moon dick me
2020-04-17 10:04:08,R3YS,3,"Just asked Alexa is AMZN would rise tomorrow, she said she doesn’t know the answer to that one.

Friday Dump Confirmed.

Edit: Today, damnit I need sleep"
2020-04-17 10:02:34,waverlyandsixth,2,"Can someone text me at 9:28am to let me know it’s time to sell my SPY $277p at a 15% gain? Otherwise I might forget and sell at a 100% gain at 3:58pm later in the day, which would be antithetical to what we’re trying to do here."
2020-04-17 10:01:56,argyleshu,7,You’d think oil would be the one to pop after a return to work plan... something really fucking fishy is going on here.
2020-04-17 10:01:46,your-missing-mom,6,Tesla and amazon both delaying earnings... what kind of market conspiracy going on?
2020-04-17 10:01:45,MoneylossAutists,2,sell GILD call at open and switch to puts or hold call 🤔
2020-04-17 10:01:38,ishkabum,10,"If it can go up that fast for no reason...

It can also do something else which I forget now"
2020-04-17 10:01:05,qwpajrty,2,Why is AAPL so flat? It was up 3% AH.
2020-04-17 10:00:42,ShawnHans007,2,I'm out for dead presidents to represent me
2020-04-17 10:00:37,dprocks17,4,CNBC going to ride the GILD story through market open.  What is GILD going to take up with them that I can also play against
2020-04-17 10:00:21,klopolo,2,I feel like this huge uptick won't hold past 10:30. Itll probably plummet. But I'm just an autist so what do I know
2020-04-17 09:59:57,,4,Should I hold my amzn calls over the weekend 🤔 they expire 5/15
2020-04-17 09:59:33,scopolamine,4,"At the peak of Bernanke-era QE, the Fed was buying $120bn per month. In 2020 purchases are running at $70bn+ per day!

[https://pbs.twimg.com/media/EVwiXAcWkAMYa58?format=jpg&name=medium](https://pbs.twimg.com/media/EVwiXAcWkAMYa58?format=jpg&name=medium)

The Fed has opened the floodgates of credit. It is going to park the entire deficit of this year on its balance sheet and US inflation expectations 5 years out rebound to …. Drum roll … 1.75%. What will we NOT worry about?  I N F L A T I O N 

[https://pbs.twimg.com/media/EVwhxtPWsAEoPUk?format=jpg&name=medium](https://pbs.twimg.com/media/EVwhxtPWsAEoPUk?format=jpg&name=medium)"
2020-04-17 09:59:29,TheLastAckbar,11,Guys. I really recommend selling at open.
2020-04-17 09:59:24,CptTonyStark,3,"Open 287, ride up to 290, then slow fade to 280"
2020-04-17 09:58:46,THlS_GUY_FUCKS,5,There is no way TESLA does not see a crash until june.
2020-04-17 09:58:37,oAquaman,4,"All in calls, let's go"
2020-04-17 09:57:46,ShawnHans007,0,Why ole keep gun durn
2020-04-17 09:57:44,CptTonyStark,4,"First TSLA delayed earnings, now AMZN is delaying earnings. WTF is going on?"
2020-04-17 09:57:35,Ankel88,-1,lets open the country AGAINNNN
2020-04-17 09:57:16,2gurleys1kupp,0,"https://www.youtube.com/watch?v=kVIZB8rqBDc

bears are efukt"
2020-04-17 09:57:14,JefBezosExWifesNewBF,6,Good morning🌅 bear dicks are swinging low this morning despite green futures.  Makes me uneasy. Best play is probably cash or calls on Dow companies for a day trade. Smooth brains calling for a rug pull aren't sated by the blood bath in March apparently. I think the most likely scenario is one none of us have considered
2020-04-17 09:57:13,sternone_2,0,BEARS = DEAD
