date,author,score,body
2020-01-16 06:39:41,Leaky_Buns,15,"TSM earning reports are up

 [https://www.tsmc.com/uploadfile/ir/quarterly/2019/4fMj5/E/4Q19ManagementReport.pdf](https://www.tsmc.com/uploadfile/ir/quarterly/2019/4fMj5/E/4Q19ManagementReport.pdf) 

 [https://www.tsmc.com/english/investorRelations/quarterly\_results.htm#2019Q4](https://www.tsmc.com/english/investorRelations/quarterly_results.htm#2019Q4)"
2020-01-16 06:38:02,fallouthong,9,C C WEI sounds super nice and smiles all the time. Take note Bob Swain
2020-01-16 06:37:22,k0du,3,CTST to the moon 🚀
2020-01-16 06:36:38,Chodemachode,11,AMD Rise 🆙️🆙️🆙️
2020-01-16 06:35:07,winkerpack,3,Good morning
2020-01-16 06:33:34,triple_verbosity,4,"Urgh. Sold my netlfix and bought shitty fake meat calls yesterday expiring this week. Sold them midday and pissed away 3k. Holding Facebook calls. 3/20 and 6/19. Holding fast. FB is gonna crush earning and I’ll cash in 70k. Gonna be just a sexy little retard stuffing my fat autistic face with trendies. Nom nom nom. Still up 80k the past year, let’s do this you fucking degenerates."
2020-01-16 06:33:17,oregon_forever,12,"I just went grocery shopping and all I'm gonna say is this: ""1% inflation my ass"""
2020-01-16 06:32:59,,3,"Did i just see #GUHH on WE tv under a Growing up Hip Hop preview..
Edit. Ohhhh i get it"
2020-01-16 06:31:25,ilovewsb,2,Guess ima have to watch all potential DIS and WMT trades evaporate in front of me
2020-01-16 06:30:45,ilovewsb,3,This is so fucking gay. I was making what I make on my credit put spreads in 2-3 weeks in a fucking day. Stupid ducking PDT rules
2020-01-16 06:30:19,sadlone,3,"APPLE Q4 PROFITS UP 16.1%

Profit beats forecast powered by chip demand.

Maybe my calls will moon"
2020-01-16 06:29:49,,2,is daddy elon a genius himself or does he just have a lot of money and a team of engineers to carry out wild ideas?
2020-01-16 06:29:13,chodmode2,5,What's happening with TSM boiz? I'm too retarded to join earnings call. we makin tendies tomorrow or nah?
2020-01-16 06:27:50,RideTheWaveRW,9,"Get puts on $FLNT.

I shorted at 3.72 today, it closed around 3.08.  Pumped 65% because they raised 2019 guidance by $15M which in turn pumped the market cap by about 150M which is insane.  Going to dump super hard tomorrow.  

Been digging thru SEC files, apparently it’s changed names 5 times in the last 11 years to muddle it’s paper trail.  Loses all of its value then refreshes the name.  Huge secondary offerings too and this one hasn’t gotten one yet, but today’s pump feels like it’s primed for one.

Even juicier, Michael Brauser owns a good chunk of the company and was more deeply involved when it was prior names.  He colluded with John McAffee in years past and has been running pump and dump scams since the 80s.

Anyway, this shit will be $0 in a year or two. So buy long dated puts and you will make money on its collapse."
2020-01-16 06:27:48,IamAsonofhorus,4,Waking up to Es at 3300? 😍 I feel so blessed. Goodnight
2020-01-16 06:26:47,WorthyAlpaca,5,Imagine BYND up 10% tomorrow
2020-01-16 06:26:38,fallouthong,8,TSMC just said the news article today is BULL SHT
2020-01-16 06:25:59,Itzep23456,5,Idk bro I been watchin vids bout warren buffet holdin cash n shit n how stocks r overpriced Rn sorta scary but pls bulls last another year :)
2020-01-16 06:25:58,gigantoir,4,bro im watching doomsday preppers my favorite recurring character is the bitch wife who rightly thinks her husband is crazy
2020-01-16 06:24:34,3at,9,"TSLA dipped, so it'll moon tomorrow"
2020-01-16 06:23:53,dungbat83,9,Markets will start Mooning from every tweet about tax cut 2.0 and trade deal phase 2. Be ready
2020-01-16 06:22:41,_kilometers_,4,Lord forgive me for I have my portfolio resting on $SPCE FDs
2020-01-16 06:22:32,DaSmartGenius,5,TGT rebounding tomorrow or flat? No way it's red again
2020-01-16 06:22:31,JaeRex,1,Lol are futures just mimicking the daily movement this evening?
2020-01-16 06:22:11,Jer_bear_716,-1,cry
2020-01-16 06:22:11,freshness4,1,AMZN bout to go upsies?!?!
2020-01-16 06:21:51,svpa3991,4,Are my NVDA calls going to moon finally 😳
2020-01-16 06:21:19,Enra_,2,Imagine believing in bears doom-mongering and sell EOD
2020-01-16 06:20:37,dankgeebs,3,im jacked. IM JACKED TO THE TITS
2020-01-16 06:20:37,ImHereForTheTendies,3,March $50 PTON calls
2020-01-16 06:19:19,itsdrivingmenuts,1,"Thinking about a COF earnings straddle. For $1.35, a 1.3 point move in either direction wins tendies."
2020-01-16 06:18:44,dankgeebs,2,its not even about what he's saying but how hes saying it. 2 foot dick confidence
2020-01-16 06:18:26,dankgeebs,5,lisa su is my mom and cc wei is my dad
2020-01-16 06:18:14,dawhizkid,5,"The Aaron Hernandez Netflix docu is...dark as hell 

Need to watch something happy to clear my head now"
2020-01-16 06:16:57,adamT1224,3,My manager at work tried to black mail me into giving him a hit of acid
2020-01-16 06:14:57,fallouthong,6,WE LOVE YOU CC WEI
2020-01-16 06:14:51,peridotdragon33,7,TSM come on baby lets moon
2020-01-16 06:14:29,KimchiFitness,3,"Finished the day up $500 after being up $3000

That spy sell off at 3:30 really fucked me"
2020-01-16 06:13:24,Muntberg,2,Realistically 50% of your portfolio should be committed to SPY calls at all times (or credit spreads if 🌈)
2020-01-16 06:11:09,zevzev,3,Where do y’all get your news for plays besides WSB
2020-01-16 06:10:37,Gator432,7,TSMC’s Profit Bigger Than Expected
2020-01-16 06:09:20,Shmokesshweed,3,"My Netflix app on the Xbone won't play 4K HDR. It just hangs at 25%

Do I buy NFLX or MSFT puts?"
2020-01-16 06:09:16,Yo__Highness,5,"I’m a little stupid can someone explain this 

Why is S&P 500 3299 but SPY 328"
2020-01-16 06:08:49,WarrenBuffetsSon,4,Asia still dicking around in red last few days. What do they know that we don't? Maybe if they had FEDs and boomers they'd be more like us
2020-01-16 06:08:39,fallouthong,8,Let’s go TSMC
2020-01-16 06:08:32,Muntberg,3,"I shouldn't sell ITM spy calls if I think it will keep going up, right? Because delta is higher?"
2020-01-16 06:08:03,OblivionXBA,9,BEARS CAN NEVER WIN HAHAHAHAH 💚💚💚🐸🐸🐸🐸🥦🥦🍀🍀🍀🍀🍀🍀🌈🌈🌈🌈
2020-01-16 06:06:41,ZeWolfve,11,This week made me realize how the right options make so much more money than just trading the stock. Holy shit.
2020-01-16 06:06:33,,6,#You can get PDT reset with most of brokers once every rolling period of 90 days.Read about it you fucks!!And get a REAL BROKER with customer support number.
2020-01-16 06:05:50,JerseyFlashBoys,2,I wanna catch the next AMZN rip so bad
2020-01-16 06:03:42,ilovewsb,4,Robinhood flagged me as a pattern day trader. Just received their email. I understand all your pain now
2020-01-16 06:02:50,Nomadic_Marvel07,4,That moment when you get an earnings right..the stock drops...then you get IV crushed..looking at you BAC
2020-01-16 06:02:35,fallouthong,5,TSM CONFERENCE CALL IS SO FANCY.
2020-01-16 05:59:33,,1,NIO or TSLA puts?
2020-01-16 05:58:43,CielRouge74,2,"I'm new to the stock market, but have been playing around with some Alibaba options.  Unfortunately, because Altaba has been liquidating their remaining BABA stock since Monday, the price continues to drop on what has been a very strong bull run over the  previous few weeks.

But at 4:03pm  after the market closed on Wednesday, there's a minute with over 3 million volume with no price change...what are the chances that a broker bought the remaining 3 million shares and the liquidation is over allowing for some upward movement on the stock?  (Last update on [Altaba.com](altaba.com) still shows just over 2 million shares have been sold.)

Thoughts?"
2020-01-16 05:58:19,runner008,14,"Wow, if we open at $330 then $332 is in reach 🤮🤑🤮🤑🤮🤑🤮🤑🤮🤑"
2020-01-16 05:58:12,RubenZ217,0,r/gay
2020-01-16 05:57:53,TequilaTrader,3,https://www.bloomberg.com/news/articles/2019-12-17/big-vix-call-options-trade-suggests-re-emergence-of-50-cent
2020-01-16 05:56:02,The_toast_of_Reddit,2,"Should congress since they're old fucks put out a big reward for curing Alzheimer's such as 50 or even 100 billion since it's going to cost the country MUCH BIGLY than that? Get China, Korea, and Japan, and Europe to contribute to the jackpot.

Not a treatment for symptoms, but something a patient can go in after a few visits and they would be cured."
2020-01-16 05:53:06,choose_a_use,7,"https://www.reddit.com/r/wallstreetbets/comments/epf5go/tsm_earnings_thread/?utm_source=share&utm_medium=ios_app&utm_name=iossmf

Let’s get it bois"
2020-01-16 05:52:32,,12,Bro we just signed a Fucking trade deal. Off to the moon we go boys
2020-01-16 05:52:02,BigDickDarrow,1,Almost bet on the Lakers tonight so glad I did not
2020-01-16 05:52:00,,8,Futures looking creamy
2020-01-16 05:49:39,,12,based on these futures gay bears are about to get slaughtered AGAIN. smh they were out in full force during the 8 recessions we had these past 3 days but now they're quiet
2020-01-16 05:49:35,choose_a_use,9,TSM gang. Where you at
2020-01-16 05:48:38,fallouthong,6,Someone make a TSM earnings thread?
2020-01-16 05:48:30,Muntberg,4,rocking a solid .0049Δ on my BAC calls
2020-01-16 05:46:51,digitalradiohead,0,The dollar really looks like it wants to roll over. I think the set up is really good for oil and gold prices for at least the next couple of months.
2020-01-16 05:46:36,ThatNewNewNewGuy,4,TSM 🚀🚀
2020-01-16 05:45:45,The_toast_of_Reddit,2,So are we mooning tomorrow?  Why didn't the markets like phase one?
2020-01-16 05:44:49,,2,First time thinkorswimmin on a laptop. 🤯.   Ive gootttaaa get internet at the house
2020-01-16 05:44:45,Nomadic_Marvel07,9,"TSLA releasing Cyber Truck pre orders tommorow and have moved earnings up to Wednesday of next week. Where Elon just walked up to the mic. Said and I quote ""6,000 Telsa bitches"" then dropped the mic and walked out. TSLA 200% gains today Jan 16th 2020.

#Hashtagfuturenews"
2020-01-16 05:44:22,fallouthong,3,15 minutes for TSM CONFERENCE
2020-01-16 05:43:08,,5,$Snaps got more green candles than a guy who owns a green candle store..
2020-01-16 05:42:36,,1,quick someone take a pic when sp500 futures pass 3300. historic milestone.
2020-01-16 05:41:55,InKanosWeTrust,9,Retards still talking about a “rug pull” The only things getting pulled tomorrow is bear penis. We’re gonna rip that shit off of them and put em all in a blender.
2020-01-16 05:40:56,,7,At what point does WSB send over cavalry to do welfare check on /u/stormwillpass for selling those tesla calls naked?
2020-01-16 05:40:44,EmperorTrunp,2,Tsla puts
2020-01-16 05:38:52,numbnah,3,"Giving bynd until monday to 🚀🚀
Aimt to 🚀🚀 confirmed
Load up Spce
Waiting for tsm news

Amzn fd calls earnings
Ba long leaps

Hail Mary tsla fd puts on earnings for fun"
2020-01-16 05:38:46,MrSalami0,5,"We need to have the rest of the Dem primary MTV Real World style. Cameras and mics on the candidates 24/7 and every night they end up back in one house getting drunk and getting into arguments and then hooking u....wait, not that last part"
2020-01-16 05:38:13,Not_reddits,8,I see all the bears are out in full force. I thought they all got killed off after the last run up. Guess there’s still more bears to slaughter
2020-01-16 05:35:16,Nghtmare-Moon,9,"My experience from yesterday, hope the lesson learned can be passed on:  
- Have NKTR calls at 0.15, are now up to 0.85 ~400% profit.  
*my mind*: sell you fool! Walk away and post tendies!!!!  
*my dark mind* nah! Remember all those WSB people repenting having paper hands, you’re a real autist with iron hands!! PDUFA will pass, you’ll snore coke off a hooker tomorrow!!  
*my mind*: ahmmm... better safe than sorry?  
Finally I decided to not sell and hold until PDUFA results.  Well shit my calls are now gonna expire worthless and I’m down 3.0k (2.5 from profits that got lost).   
So the lesson here, my fellow friends is the following:  **REAL TRADERS HAVE IRON HANDS**"
2020-01-16 05:35:11,Evie_Chandler,1,"NIO puts tomorrow? Or will it gap down and stay flat for the day, thereby ensuring I missed my chance?

Might just YOLO SPCE"
2020-01-16 05:34:48,HowLongCanIMakeAName,3,"Just watched first 2 episodes of kill la kill

Wtf

Long $JPN"
2020-01-16 05:34:20,digitalradiohead,2,For those with tsla puts what is your target price to exit your puts? If it gaps down tomorrow is there a chance it breaks below 500?
2020-01-16 05:32:39,fishdonglul,1,👀😎$WIT Looking kinda cute tho 🔥🔥 Supreme Leader Abidali Z. Neemuchwala will not fail me this time.
2020-01-16 05:32:36,,3,I don’t give a shit what the market does tomorrow as long as Boeing moons on the news about starting test flights for the new 777’s and refurbished 737’s and Apple jumps like $1 and flat lines until Monday
2020-01-16 05:31:45,fallouthong,7,30 MORE MINUTES TILL TSM Earning. Please Lord Jesus save me
2020-01-16 05:31:23,DaKaiser21,2,Where my SHAK Bois at?
2020-01-16 05:27:25,Spartan_Blazer,2,u think storm ⛈ ever date me❓🧐🤭
2020-01-16 05:17:02,bonsaiorchids,1,"Im a little disturbed by the fact nobody seems to be aware the rug could be absolutely swept out from the market tomorrow.

Its a really important day. 

IMO big uptrends like this rarely get so weak, without seeing a major correction, HOWEVER in the case where new uptrends simply continue.

I think tomorrow will set the tone for the next week or so with an influx of volatility"
2020-01-16 05:14:50,tdotz123,1,Will tesla go up tomm I'm deep in calls
2020-01-16 05:14:13,,3,"Vix statistics since 2004 courtesy of Winker Capital 🤗🤗🤗

Min: 8.56 (11/24/2017)
Max: 89.53 (10/24/2008)
Mean: 18.22
Median: 15.59
Close on 01/15/2019: 12.42"
2020-01-16 05:11:52,Cnastydawg,1,Stormie is a classy broad that needs more love
2020-01-16 05:11:36,yinatom,4,Sold my cgc calls 12 hours ago so I think it’s finally safe to talk about it 🥳
2020-01-16 05:10:24,,9,🙆🏼‍♂️🔫 that’s Tim Apple holding people with calls for ransom tomorrow
2020-01-16 05:08:45,madmax_br5,4,Some boring theta shit. But hey at least I’ll probably make some money
2020-01-16 05:07:55,Nomadic_Marvel07,1,"I wonder if you have to pay gains on the free stock you get from different apps?  And if so are there going to be a ton of people who cashed out the stock, don't claim the gains, and go to jail for tax evasion?"
2020-01-16 05:07:46,astroyeet,3,What time is TSM earnings?
2020-01-16 05:06:41,TradeCalls,2,You know my moves for tomorrow 😉
2020-01-16 05:02:34,Rubenov,7,u/stormwillpass ass blasted by $TSLA run-up... is she ok?
2020-01-16 05:01:21,fairygame1028,1,Buying puts tomorrow on weed stonks.
2020-01-16 05:00:17,SomeComparison,2,"Anyone playing Lithium with calls? Was looking at $LIT, but volume is pretty low. Top holding of $LIT is $ALB. Oddly enough $TSLA is the 3rd largest holding at 6.8%. Has Lithium been behind the $TSLA rally?"
2020-01-16 04:58:59,HellaSexySparklePony,3,Went full Becky on PTON
2020-01-16 04:56:28,LessThanCleverName,1,"Feels like the market could go flat waiting for a new catalyst for awhile  here. It’s been a long time since this bitch consolidated, could see MM waiting until the end of the month on the big boys earnings before deciding a direction."
2020-01-16 04:56:06,gamblinproblem,3,VIX is very low for Trump getting ~impeached~ fuck outta here! whole lotta bull gang shit 🐂🐂🐂
2020-01-16 04:54:57,Syncoped,4,Took profits from February SPCE calls and bought SPCE leaps today. Will I become rich or broke?
2020-01-16 04:53:24,bretatatatata,10,Hoping for a strong SPY 330 open tomorrow
2020-01-16 04:52:14,wolfenstein1998,3,Is it too late to jump into V train?
2020-01-16 04:51:55,,8,"S&P 4,000 by end of 2020 is about 12% annualized return for 6 years

Not too crazy given extremely accommodating monetary policy and zero interest rates

If there is an epic blow off top, perhaps 6,000+ by 2022"
2020-01-16 04:51:49,PrinceofPeachtree,4,Remember when V Stiviano called herself Donald Sterling’s “silly rabbit” on live TV when asked if she was having a sexual relationship with an 80 year old man who was giving her a monthly allowance and luxury vehicles?
2020-01-16 04:47:55,Sonyooo,6,Realistically how many people can SPCE send to space a year?
2020-01-16 04:47:50,fraqaq,13,The Microsoft 5 year chart on robinhood is beautiful.
2020-01-16 04:46:07,printingious,3,China's markets DGAF about this trade deal
2020-01-16 04:44:44,mauimikes,6,I wonder if $V would still go up during a recession since everybody will be broke and need to put even more shit on credit. 🤔🤔
2020-01-16 04:41:47,hamsupjai,6,Man how does it feel to live without knowing about the stock market? And how headlines can mean trillions of dollars?
2020-01-16 04:40:46,Promo7,24,"I started following this sub last week and decided to put $1500 in my robinhood account and go all in on [spy calls and spreads.](https://i.imgur.com/BUpChBK.png) I immediately lost $250 the next day, but I'm not a commie bear so I held on (💎 🖐️). 

I was up $470 today so I sold everything off and rolled the $470 back in to more calls. My asshole unclenched now that money I actually worked for isn't on the line. 

Let's see where this $$$ takes me. Already lost $88 today but stonks only go up and bears r fuk. Don't forget it chief.

Edit: here's the [weekly chart ](https://i.imgur.com/FGHkSld.png)"
2020-01-16 04:39:28,fin425,4,Would you rather cum every time someone calls your name or never cum at all?
2020-01-16 04:39:24,,13,Have an interview on Friday for a very competitive finance internship at an sp 500 company. Gonna explain to them why Im holding puts on their stonk to try and stand out
2020-01-16 04:35:26,sleepyfries,-2,"Does this change impeachment calculus?

https://www.reddit.com/r/politics/comments/epd4aj/megathread_lev_parnas_states_in_interview_trump/?sort=top"
2020-01-16 04:30:27,dawhizkid,11,Build a Bear $BBW really mooning because they have baby Yoda 🤔
2020-01-16 04:30:14,Sinadins,3,Futures near flat until all the box-jockey analysts have pulled their all-nighters going over the trade deal documents and reassessing their capital allocations.
2020-01-16 04:28:37,,11,"Feeling SPY calls tomorrow, honestly the market is irrational af right now but it has been for so long that this type of movement seems normal. Their is no major catalyst in play right now so I expect it to move up slowly."
2020-01-16 04:28:35,Sonyooo,6,How far NIO dropping tomorrow🤔 flew up on a funding secured hot air balloon ran outta gas pretty quick
2020-01-16 04:26:27,PutsTookMyMoney,12,Maybe I should’ve bought calls
2020-01-16 04:25:15,runner008,4,Woh just realized NIO took a dooky
2020-01-16 04:24:34,ruizirvin0,0,I have $700 on my RH ACC what should I do 😐
2020-01-16 04:23:19,gigantoir,0,chet hanks is a king
2020-01-16 04:20:59,Shmokesshweed,11,"HOLY SHIT

BAD BOYS 3 IS COMING OUT ON THE 16TH (TOMORROW)

IM JACKED TO THE TITS

BAD BOYS BAD BOYS WATCHA GUH-NA DO..."
2020-01-16 04:20:57,ReverseMtg_BuyCalls,1,Anyone long NTDOY?
2020-01-16 04:20:31,omgroki,3,"Will I wake up to red or green futures? And will cash open invert or match what I wake up to?

FIND OUT IN 10 HOURS FOLKS"
2020-01-16 04:19:51,IAmNotThatGood,1,How long bot test.
2020-01-16 04:18:48,,4,"Twas a cold January morning,

Bunch of retarded 🐃 with their free repo money,

Walked into the trap of a hungry 🐻,

What happened to 🌈🐃s will live infamy"
2020-01-16 04:18:34,mrenormous,7,i already forgot we used to pay for stock purchases
2020-01-16 04:18:01,thethiefstheme,4,Just here for the stupid daily graph to post $APHA win big you piece of shit
2020-01-16 04:16:34,Midgetfarm,2,U guys r mean 😢
2020-01-16 04:13:01,oriolesa,5,"🖐

❓

🤭🤭"
2020-01-16 04:12:00,,-6,"#Can u really feel the market?

I smell 🐃s getting slaughtered.


🍆💦💦💦💦💦💦💦"
2020-01-16 04:11:50,GTmalik,7,Futures Natalie Portman
2020-01-16 04:10:55,TequilaTrader,9,"Is it poor judgement to bet $20k to make $500 in 15 minutes.  I mean, it worked?"
2020-01-16 04:09:21,DotaAndKush,3,When you close a regular credit spread where does the option you sold go that allows the trade to end? Random guess but do you buy that same option you sold canceling them out?
2020-01-16 04:09:16,gamblinproblem,3,Paying taxes on tendies is really heterosexual
2020-01-16 04:06:35,,9,"The lights cut, the curtains are drawn before your eyelids, your removed from this mask of life, seeing nothing not even black. And then, your rotated around, blinded by a stage filled with equipment and machines stemming back to you. In the corner are tall men pulling strings attached to tickers swirling their hands like dmt simulations as numbers fade and appear you realize the market is not what it seems."
2020-01-16 04:04:16,,6,Hope TLRy gets to $23 plz omg
2020-01-16 04:02:00,JerseyFlashBoys,8,Lexi Belle is back in the game. Is that bullish or bearish?
2020-01-16 04:01:59,droppinloadsyeah,6,"Just curious, what percentage of your net worth are you using to play options?"
2020-01-16 04:00:45,oregon_forever,3,Let's get so rich that Warren Buffet shines our shoes and Bill Gates wipes our butts.
2020-01-16 04:00:17,Grrr_Mondays,2,"Realistically, since the fed is going to do everything and anything to keep the US market up, what foreign country could potentially disrupt our economy? (excluding China)"
2020-01-16 04:00:06,Ponypoops,10,Praying for BYND to nut 🙏🙏
2020-01-16 03:59:01,JerseyFlashBoys,3,I fux heavy with a lil Topo
2020-01-16 03:58:49,mauimikes,-8,I’m like “who is dumb enough to be buying TSLA calls at these outrageous prices?” And then I come to WSB and I have a giggle 😂😂😂😂😂 and by giggle i mean more like a ROFLMAO 🤣🤣🤣 sorry dudes better luck next meme stonk
2020-01-16 03:57:02,actuarial_defender,11,Stocktwits is so funny man
2020-01-16 03:56:35,webulltrade,2,Did Apple really drop to 263 after hours or is TD being weird?
2020-01-16 03:56:34,Trippstarr21,8,I lost 3k on amd fds. I’m gonna try Apple 1 month out itm and maybe slowly creep up and recoup my losses in over a month instead of one big trade I hope in a day. 🤮🥴
2020-01-16 03:56:03,dang3r_79er,3,There is a restaurant in my city charging $825 for 20lbs of beef and chicken fajitas to go. The audacity of this makes me think we’ll be in a bull market forever.
2020-01-16 03:53:37,Not_reddits,5,My 1/24 $600 calls are dead 💀
2020-01-16 03:53:23,Nix14085,6,God damn it tgt why couldn’t you keep your big fucking mouth shut for two more days
2020-01-16 03:51:50,MrBingCrosby,2,Is another else buy weekly lotto ticket 305s just in case?
2020-01-16 03:51:35,TeslaLeafBlower,6,Hope those extra TGT stonks I added to my portfolio today go up
2020-01-16 03:50:53,Midgetfarm,-4,Give me gold
2020-01-16 03:48:24,ProTrader112,8,What is the most liquid option chain in the world🤔
2020-01-16 03:47:04,fallouthong,8,"SHT, TSM DROPPING IN TAIWAN AGAIN. FFS."
2020-01-16 03:40:50,Wolf_Of_1337_Street,8,How do you guys hear about buyout rumors? Random twitter accounts? Stocktwits?
2020-01-16 03:38:27,YepRabbit,9,"r.i.p NIO

So the rumored new funding source, GAC, just send an official notice to several chinese media that the rumor was fake news, they don’t have plan to do anything with NIO so far.

NIO literally rallied with completely fake news today lol"
2020-01-16 03:37:43,chaney3,1,Almost out of Bordeux :(
2020-01-16 03:36:56,CommanderInTweet,7,How fucked are my Tesla 550c?
2020-01-16 03:34:54,wolf_of_wall_mart,-11,when I’m gone; who’s gonna stir the pot for the entertainment of all at the expense of their image. Who has what it takes
2020-01-16 03:34:44,justinswagvila,1,"Aapl looks tasty when looking at the 15 min candles, but also no charts or candles matter at all I guess."
2020-01-16 03:34:27,sadlone,16,"Gonna double down on my 7k of APPLE 🍎CALLS tomorrow and probably triple down on Friday. 


330 here we cum mr stark 🚀🥴"
2020-01-16 03:34:23,blackisthenewsids,8,"I just might have discovered that i am a major a-hole, so my moves for tomorrow are goinb to be 'being extra nice to everyone' ..."
2020-01-16 03:29:54,Agent248,4,"There are some really great minds on this sub. Can I ask a question?

How long can market remain irrational? Asking for a friend."
2020-01-16 03:29:04,Billie__Gates,12,"Sometimes I believe in my options I hold overnight as much as those chefs that send out their ""house special"" to Gordon Ramsay. Like I'm still hopeful about it until morning comes and it turns out I'm a complete moron and shouldn't have expected anything less."
2020-01-16 03:27:24,YeOldeFirstTimer,1,"^^who🤔

^in

the

## FUCC🥵

Are These DumDums^™️ Who Follow Me On Reddit?😂"
2020-01-16 03:26:49,indianfungus,5,"Aapl is gonna fucking moon tomorrow:

https://www.marketwatch.com/story/apple-snaps-up-artificial-intelligence-startup-xnorai-for-about-200-million-reports-2020-01-15?siteid=rss&utm_source=feedburner&utm_medium=feed&utm_campaign=Feed%3A%20marketwatch%2Fmarketpulse%20(MarketWatch.com%20-%20MarketPulse)"
2020-01-16 03:26:33,mauimikes,6,"Futures = boring


WSB = boring

Guess I’ll get some sleep for once"
2020-01-16 03:26:29,23therealme23,6,"A lot of economic data coming tomorrow...


8:30 am Weekly jobless claims
8:30 am Retail sales	
8:30 am Retail sales ex-autos	
8:30 am Philly Fed
8:30 am Import price index
10 am Business inventories
10 am NAHB home builders' index"
2020-01-16 03:22:36,jakersthepig,8,It's hilarious that these Tesla articles are coming out about California and how the sales are dropping but they fail to mention the brand new fuckin giga factory they just built in China
2020-01-16 03:20:07,,11,Time to put some 🅱️ussy on the Chain-wax 😤
2020-01-16 03:20:01,Gibby1928,5,are V calls free money
2020-01-16 03:19:34,follow-spy,2,"lol

[https://www.youtube.com/watch?v=PCrn8lT1I\_o](https://www.youtube.com/watch?v=PCrn8lT1I_o)"
