date,author,score,body
2020-09-04 17:42:52,JabootieeIsGroovy,1,also guys don’t worry i’m about to buy a single tsla 200p ur welcome bulls
2020-09-04 17:40:06,JabootieeIsGroovy,1,"idk why i’m freaking out, literally all my expos are at the least 2 weeks out, besides i think the bears r a little cute when they get all excited"
2020-09-03 04:19:27,zestykite,1,dxy starting to look a little bullish. i dont think this is good for us
2020-09-02 23:51:29,bettercallsaully,0,"so, is the party over?"
2020-09-02 19:01:36,Jv_waterboy,1,"I've only been playing SPY and I'm up 70% on the week, 24% today. So, SPY."
2020-09-02 17:42:19,seancarr181,1,I love how TSM is down 0.22% but my 01/15/21 $150C is up 40%
2020-09-02 17:13:16,musicamusement,5,"My WORK call is going up, even though the stock itself is going down. That's that earning IV lol"
2020-09-02 16:42:47,warrior5715,5,Just ran to the bathroom to take a huge dump during a meeting. I’m gonna get fired. I wasn’t muted.
2020-09-02 16:27:30,SlightlySalty007,3,GO GO GO AAPL my whole portfolio depends on it!!
2020-09-02 16:06:55,IIINevermoreIII,5,"FOR EVERYONE ELSE HOLDING TESLA, you only LOSE money if you don't hold. that stock is a meme and sometime between this week and the next, its gonna hit 500 again."
2020-09-02 16:03:02,NYCpedestrian2,1,The fake rug
2020-09-02 16:00:36,SlightlySalty007,2,Apple gonna move babay
2020-09-02 15:59:29,JTCampbellJr,1,ATVI looks good at these levels to bad I am bag holding ATM.
2020-09-02 15:50:39,gherna67,1,"Added some AAPL and UAL Leaps this morning and pretty much have just been scalping SPX all day, up 9% aint too shabby"
2020-09-02 15:47:25,tda0813,3,Buying RKT at the top and praying it becomes a meme stock before I blow up my account.
2020-09-02 15:46:29,maxsull,3,apple coming alive?
2020-09-02 15:42:38,yungTrevo,6,Apple fucking my ass
2020-09-02 15:28:39,tkhan456,7,My move for today?  Drive to Elon’s house and take a shit in his front yard
2020-09-02 15:20:31,mikey2style,2,Is it smart to leg into a debit spread for RKT right now? Have 11 $30c 9/18 thinking of selling $40c 9/18. Or just sell? Help me out please only been doing options for a month
2020-09-02 14:57:46,The_gray_ghost,2,Appl?
2020-09-02 14:55:32,Datkidloic,4,All in on apple calls from the dip lets print. baby
2020-09-02 14:54:01,Datkidloic,3,Sold my tsla calls this morning so fast as a clenched my ass cheeks
2020-09-02 14:46:12,WIPESASSWITHSOCKS7,3,"TESLA HOLDERS DONT GET FLUSTERD OK 

WE HAVE A CATALIST “ BATTERY 🔋 DAY” ok 


Don’t there will be a up trend as closer we get 



If u got weekly well bitch your gambling so u know the risk 

But !!! It ain’t over yet 

Tesla can move by 50$ in a fucken day"
2020-09-02 14:45:40,NYCpedestrian2,3,Costco 🚀
2020-09-02 14:36:57,brendoh223,1,Spy calls are just free money. Too easy
2020-09-02 14:34:45,cheeseandbeans4,1,"[https://www.reddit.com/r/wallstreetbets/comments/ikrr8t/what\_are\_your\_moves\_tomorrow\_september\_02\_2020/g3n4e39?utm\_source=share&utm\_medium=web2x&context=3](https://www.reddit.com/r/wallstreetbets/comments/ikrr8t/what_are_your_moves_tomorrow_september_02_2020/g3n4e39?utm_source=share&utm_medium=web2x&context=3)

&#x200B;

i know this dude is sweating rn"
2020-09-02 14:33:15,Investinwaffl3s,2,"NVDA is literally free money

Who the fuck would ever sell or short NVDA? No one except Sue Bae but she gets a pass due to her mythical and superhuman status"
2020-09-02 14:30:10,The_gray_ghost,1,Appl calls
2020-09-02 14:26:01,WIPESASSWITHSOCKS7,1,"BUY TESLA DIP!!

IRON HANDS"
2020-09-02 14:25:33,Mwazoski4,3,My zoom puts printed (:
2020-09-02 14:24:34,Investinwaffl3s,1,FB!!!
2020-09-02 14:15:34,Investinwaffl3s,1,TSLA W SHAPED RECOVERY???
2020-09-02 14:15:26,Iamkzad,2,What the fuck is happening with ToS???
2020-09-02 14:14:17,yungTrevo,2,I bought the dip in apple lets go tim cook
2020-09-02 14:11:27,hakkihan,2,Pray the gay away pray the gay away
2020-09-02 14:09:38,mils_bk,1,About fucking time
2020-09-02 14:08:36,Investinwaffl3s,2,"BUY NVDA 590C for SEPT 18

FREE MONEY"
2020-09-02 14:05:29,,3,"I fucking held, not gonna be scared off that easily"
2020-09-02 14:03:06,EdwardTittyHands,7,Ok tesla that was cute. Now get back on track to 500
2020-09-02 14:03:04,Lil_Pump_Jetski,4,i just woke up holy shit tesla
2020-09-02 14:02:34,hakkihan,2,That’s it buy the dip
2020-09-02 14:01:40,Stockengineer,2,damn a flash crash lol
2020-09-02 13:58:22,chuck_portis,3,tech bubble canceled
2020-09-02 13:58:14,Move-your-Ass69,1,Msft
2020-09-02 13:56:30,flyingorange,7,Fucking Americans. It's always us Europoors holding up your market and then you blow it on hookers and blackjack
2020-09-02 13:48:49,hakkihan,1,How far do you think tesla can drop realistically? 450 lowest?
2020-09-02 13:46:48,Blackfyre567,4,what is rkt doing?
2020-09-02 13:45:07,8KB8_M,3,**GODDAMNIT NVDA DUMPED AT OPENING GLAD I SOLD FAST**
2020-09-02 13:44:08,maxsull,2,tesla does what tesla wants
2020-09-02 13:43:48,Persian_Allah,7,Here’s that TSLA dip you all wanted to buy so so bad
2020-09-02 13:43:28,maxsull,5,buy this fucking dip
2020-09-02 13:42:38,aravreddy22,1,Buy the dip my friends!!!!
2020-09-02 13:42:25,RealBullishcowboy,1,Call me crazy thinking ctas next tesla style stock split play
2020-09-02 13:41:11,f_ra,3,I was told there was a bubble on tech
2020-09-02 13:40:08,Poland_Spring10,2,alright I hit 300k with COSTCO and NVDA now what ... Do I go for $500k or call it quits
2020-09-02 13:39:44,Persian_Allah,6,Everyone say it with me ! TSLA DIAMOND HANDS
2020-09-02 13:39:40,OfficerTenBagger,2,Paper hand cunts
2020-09-02 13:37:35,CASH_K1NG,1,KO just popped over a double top resistance let's go
2020-09-02 13:35:34,yungTrevo,1,APPS WTF
2020-09-02 13:33:11,Trisstanroberts,2,paper hand kids going crazy at market open
2020-09-02 13:31:14,hakkihan,3,Hold my hand FUCK FUCK FUCK TESLA NO
2020-09-02 13:29:49,akorn77,2,"PTON holy crap it was 2% pre-market this morning, just checked again its almost 11% lmao. And still 1 week till earnings!"
2020-09-02 13:29:13,im4stocks,2,"I told y’all mofos on Monday to buy calls on DKNG, SWBI and WMT today is a beautiful day looking just like my day yesterday 💰🤑"
2020-09-02 13:27:32,SexKingComes,1,Let's go make some fuckin money
2020-09-02 13:21:04,Trisstanroberts,2,docusign free money
2020-09-02 13:13:49,yeamannn,3,Dkng gonna make me fucking cum
2020-09-02 13:12:22,cnbPEE,3,"Yesterday I got DKNG, NVDA, and AAPL FD’s. Today will be nice."
2020-09-02 13:07:06,PM_Me_Macaroni_plz,6,Oh good morning Draft Kings. Wtf
2020-09-02 13:03:18,hakkihan,5,Apple is now more valuable than the whole FTSE100 LOOOL
2020-09-02 13:03:05,bottledfart_tv,0,Bought 1 NVDA 610c 9/4 at close yesterday for like $0.70
2020-09-02 13:02:58,Titans_2001,1,Peloton 🚀
2020-09-02 12:57:12,Blackfyre567,4,Is it too late to get into nvidia?
2020-09-02 12:53:53,tindalos,1,Still waiting for a strong NIO push.  Looks like it may break 20 resistance finally.   By Friday would be great for my $16c 9/4s
2020-09-02 12:51:34,jyjdlns,2,"Man i feel so bad, I am always late.

I finally want to leave the cash gang again, but everything is mooning, so if I buy in now, it will crash :("
2020-09-02 12:49:13,8KB8_M,9,**NVDA GANG UP BY 6.30% GET IN IF YOU LOVE MONEY  🚀  🚀  🚀**
2020-09-02 12:48:43,thechartrusetalisman,2,Never felt comfortable paying double digits for a call. Glad I changed my mind yesterday and bought 2 NVDA 9/11 555c
2020-09-02 12:47:27,killerk14,1,"I could only afford the highest RKT strike at the soonest expiry. Slightly worried the whole pump getting absorbed by IV. Oh well, green is green"
2020-09-02 12:46:37,flyingorange,1,"Today I'm looking at TWLO, SQ and PTON"
2020-09-02 12:45:34,SnowConeYeti,5,Fuck me I really should’ve bought that NVDA call
2020-09-02 12:42:54,Numaru1,3,MJ on draftkings somehow feels way more surefire than anything for a huge pump and dump today.
2020-09-02 12:39:08,CuriousNecklaceGuy,10,"Lmao at MJ joining the DKNG team. That is pretty much a wet dream for a call holder...

Like wtf MJ?? Be like if warren buffet joined the board of RH"
2020-09-02 12:35:34,HungryAsparagus,3,"My dad bought a Peleton almost 3 months ago, shipping got delayed 3 times since peleton delivers the bikes themselves and can't keep up with demand. Now set to be delivered 9/12.

If you buy puts you're truly autistic and there is no helping you"
2020-09-02 12:25:37,hakkihan,14,"Legend says if you like this comment, Tesla will power up and shoot off at market open

Edit: 20 minutes to supercharge Tesla come on guys"
2020-09-02 12:20:30,leftyjef,2,"Went into Monday holding RKT, NVDA, and DKNG calls. Let the DKNG calls go yesterday. Always finding ways to fuck up a good thing."
2020-09-02 12:15:20,gainingperspective69,2,What Docu calls should I buy?
2020-09-02 12:14:38,Throwawayeconboi,4,"NVDA finally reacting to the amazing RTX 3000 lineup. Love that AMD moons as well though, because investors have learned AMD is gonna be here to compete 😈"
2020-09-02 12:14:29,LifesABeta,4,"NVDA let's goooo. TSLA needs to green, all other tech is green"
2020-09-02 12:14:11,Throwawayeconboi,0,"Pick it up TSLA, I need you for my ARKK calls."
2020-09-02 12:10:39,lbj2k17,5,Grabbed 5 x 580C on NVDA yesterday 🚀
2020-09-02 12:08:03,WIPESASSWITHSOCKS7,6,"TESLA LETS GO !!! 

Guys give Tesla energy !!!!! Your calls depend on it !!!

Looking at NVIDA and all the other tech Tesla don’t seem that bad now this thing deserves 500$"
2020-09-02 12:00:19,flyingorange,4,"I made $23 in pre-market, should I sell?"
2020-09-02 11:57:38,gainingperspective69,4,I sold my 130 Apple calls yesterday. Not upset but damn coulda had more
2020-09-02 11:52:55,Nick9502,3,"CRWD, RKT, DOCU printing"
2020-09-02 11:52:32,LazyBo1,5,Can’t believe I sold NVDA yesterday fml
2020-09-02 11:49:31,UnwantedRelishMan,3,"My god, my shits this morning are hot as fuck"
2020-09-02 11:41:02,leftyjef,4,Is this a dream?
2020-09-02 11:38:48,OfficerTenBagger,4,BABA vs FB. Whos breaching 300!
2020-09-02 11:36:05,RealBullishcowboy,1,Nasdaq may break  15 k soon lolll
2020-09-02 11:35:28,RealBullishcowboy,1,Place your bets on the next nasdaq 100 tesla style  stock split....shorts now in trouble
2020-09-02 11:29:46,junkrattrap,3,$20k in NVIDIA $600 at open?
2020-09-02 11:28:33,NoMoneyNoTalk69,1,My nvda 550c 9/4 looking good
2020-09-02 11:27:49,Dustinulter,2,What are the best PTON plays
2020-09-02 11:25:24,hakkihan,1,What’s your favourite award on this sub
2020-09-02 11:24:10,ColdBoiGreg,2,RKT after hours is give me a rocket
2020-09-02 11:22:42,AnOddvacado,2,"AAPL call holders, sell at open and rebuy later? 145c and 150c checking in"
2020-09-02 11:22:33,vibhormit,2,Is zuo a buy
2020-09-02 11:19:44,hakkihan,2,"Elon, fuck you dad!


Edit: this is why my sugardaddy is Bin Li"
2020-09-02 11:18:46,dghmuiytd,1,During covid crash I sold 20k of SE 60c exp jan 2021 that I bought for $4.9 and 55k worth of msft 65c exp sept 2020 that I bought for $7.9.....sigh.
2020-09-02 11:15:30,churn_after_reading,2,What are we buying at open?
2020-09-02 11:12:34,notcrottsfire,6,TSLA why’d you do dis ?
2020-09-02 11:09:59,ggFuji,3,No way reddit bans us. I think we're like second for comments and we give them tons of $$$ from awards.
2020-09-02 11:04:16,8KB8_M,8,"**NVDA 3.24% UP  🚀  🚀  🚀**   


**I'M ABOUT TO FUCKING COOM**"
2020-09-02 11:03:24,RightTackle,1,DOCU fuckin yo wife and yo girlfriend *AT THE SAME TIME!*
2020-09-02 11:01:56,8KB8_M,6,**NVDA FUCKING  BOOMING GET THE FUCK IN OR BE POOR FOREVER**
2020-09-02 10:59:37,RandyCrane17,3,"I'm not too sure about playing DOCU earnings. It's running on Zoom momentum but Zoom is being used absolutely everywhere worldwide, from board rooms to class rooms, everyone knows what zoom is. Electronic signatures don't have the same appeal and only needed for like official documents from what i understand. I work at a giant law firm and even for court filings, a simple ""/s/"" is enough for an ""electronic signature"". On the other hand, we are using Zoom for court conferences and client meetings."
2020-09-02 10:58:48,ggFuji,11,Lmao at this point a flat day would wipe out 90% of the people on here
2020-09-02 10:58:37,Ricketycrick,2,Gonna liquidate all my $SPY holdings and invest exclusively in meme stocks
2020-09-02 10:57:02,Ricketycrick,2,"There was a time when a good bit of movement happened premarket

Now the whole fucking trading day happens premarket"
2020-09-02 10:54:01,unemployedbull,2,Damn the DOW trying to compete with our beloved QQQ. when was the last time both rose together like this!?
2020-09-02 10:49:15,MisterSpace,2,"TSLA. Thought I was slowly recovering from my yolo play yesterday, but no crashing again, that shit hurts.
Ameririches, please pump the shit out of TSLA the next days so I can at least break even again, thank You🙏🏻"
2020-09-02 10:44:39,RedBull2408,5,NVDA. DOCU. Going 5K calls in each on open. Embrace the autism
2020-09-02 10:42:27,RandyCrane17,2,DOCU and CRWD earnings are going to be very important. If they moon everything else will keep going up at this insane pace for another week. If they don’t than things will come to a halt.
2020-09-02 10:41:36,Elforas_Tero,3,"Fuck it, we should be able to trade options during premarket. My TSLA 9/4 was ITM and there was nothing I could do to profit from it. Fuck it."
2020-09-02 10:41:34,random-notebook,4,Loading up on NVDA at open
2020-09-02 10:40:08,TonguePressedAtTeeth,10,Europoors should be kicked out of the market for always fading everything.  Whole continent is paper handed scalper losers.
2020-09-02 10:38:14,RandyCrane17,3,Reminder that SPY was at $344 last week lol
2020-09-02 10:37:46,Markham5,1,"How do you deal with paper-handing a call Monday and having to watch that baby grow and still has 10 days?   


I think i'll go with drinking and take my new LEAP as solace."
2020-09-02 10:31:53,UsernameTaken_123,6,spent some of my TSLA profits going to the barber for the first time in months. love how fresh u feel after getting a good haircut and getting your beard lined up
2020-09-02 10:31:52,vjsworld,2,Wtf tsla fading :(
2020-09-02 10:31:28,StonkAutist,2,Can we get a fade for those on the sideline to enter - this is insane!
2020-09-02 10:29:46,RandyCrane17,5,FOMO levels almost as high as SPY
2020-09-02 10:29:21,flyingorange,1,"Just to give some context, these were the % changes of stocks *one hour ago*:

|||
:--|--:|
|TSLA|3.36%|
|KR|0.48%|
|AAPL|1.95%|
|FSLY|1.10%|
|NET|0.40%|
|RKT|10.06%|
|DOCU|5.62%|

You can see that most stocks are basically on a downward trend at the moment... RKT down 3%, TSLA down 1% in the past hour."
2020-09-02 10:29:05,buchnasty,11,There's shit winds abrewin... We're headed right into the eye of a shitticane
2020-09-02 10:28:41,slimkay,5,"PTON 9/11 100C or 

CHWY 9/11 80C"
2020-09-02 10:27:55,I_Am_Bill_Buttlicker,6,"RKT holders, stop worrying about earnings. Hold. Hold. Hold."
2020-09-02 10:27:01,SolitaryEgg,-1,Tsla gonna be red by open at this rate
2020-09-02 10:24:16,reddituserzerosix,1,Wow everything mooning
2020-09-02 10:23:22,Waffle_Authority,5,I think I’m gay
2020-09-02 10:22:52,SolitaryEgg,3,TSLA fadin
2020-09-02 10:22:20,PM_ME_UR_LEFT_SHIN,3,"Bumble IPO

https://twitter.com/DeItaOne/status/1301102963939778560"
2020-09-02 10:22:19,I_Am_Bill_Buttlicker,4,Holy RKT FOMO!
2020-09-02 10:22:18,ElvanKing,2,PTON to $90 today?
2020-09-02 10:21:10,dan220201,3,PS5 news September 9th good time to buy SONY?
2020-09-02 10:21:06,UsernameTaken_123,2,Imagine being a 🍺
2020-09-02 10:20:55,J-Lam,1,"Repeat after me:

AMZN SPLIT TSLA S&P AMZN SPLIT TSLA S&P AMZN SPLIT TSLA S&P"
2020-09-02 10:19:14,haasvacado,5,The dips will keep being bought.
2020-09-02 10:18:21,Mrivera45,2,#Stop shorting NIO
2020-09-02 10:17:52,The-Hyrax,-6,Y'all too bullish and jinxing it
2020-09-02 10:16:13,Simercs,6,Honestly Nancy Pelosi offends me. How could you have deep insider knowledge for centuries and not even be a billionaire?
2020-09-02 10:15:58,Matrix1216,4,Netflix and chill to 580 plz!
2020-09-02 10:14:40,yaboigoat53,5,Tesla you need more than a couple percent?!
2020-09-02 10:14:15,Ricketycrick,3,It should be a fucking warcrime to sell earbuds with no volume
2020-09-02 10:14:12,LaurieDavis23,10,NVDA 9/25 550C + 9/11 520C got me so fucking wet right now 😭. Diamond handing these to Tendy Station 6 on Mars 🚀
2020-09-02 10:13:36,i_love_my_scrotum,2,"IMO, Apple's future growth isn't all that much in tech anymore. It's health. Wearable tech is going to change health. Apple Watch continues to pick up new features (next model to measure blood oxygen). IF rumors are true that they're able to figure out non-invasive blood glucose testing, that would be a game changer. Tons of possibilities with their upcoming augmented reality glasses as well. Could see Apple pushing 3 trillion next couple years."
2020-09-02 10:12:48,SinatraC,5,Best non tech plays? I need to diversify.😭🙏🏼
2020-09-02 10:12:00,Wade12323,5,Moment of silence for all the AAPL yolo short sellers
2020-09-02 10:11:36,RandyCrane17,1,Better play at open DOCU or NVDA? Looking to put 5K in and be out before the end of the day.
2020-09-02 10:11:35,redUSAKA,2,Seriously rkt at least $35 after er?
2020-09-02 10:11:28,lasco10,14,Everything I’m holding is so fucking green right now. I can’t wait for it to all fade by open. This is the way
2020-09-02 10:11:24,BrrromePowell,2,"Me earlier this week: Spy and QQQ are very overbought. Let me put half my portfolio into vxx calls and the other half into metals

Me yesterday and today: Fuck it. Everything in NVDA AAPL WM LULU CHWY Weeklies"
2020-09-02 10:11:11,haasvacado,6,Mixed non-US economic data out today. Slightly bearish overall I suppose. Aussies missed considerably on GDP. Germany beat on YoY retail but missed MoM. Spanish unemployment missed huge. EU PPI barely beat. Big Green Day I suppose because why the fuck not.
2020-09-02 10:11:06,Mrzbady,1,I really don’t have a play today. I made a shit ton of money yesterday on SWBI. I’m holding tsla but I need something else bros.
2020-09-02 10:10:32,pilotbots,8,Imagine being a 🌈🐻 it’s to a point I feel sorry for them?😂
2020-09-02 10:10:12,schnauzage,11,How do I buy calls on my calls?
2020-09-02 10:10:00,APHAbaghodler,4,When was the last time we made daily RSI numbers like this? Ah yes.. January 2018.. when that dude turned 100K into 3MM or some shit on SPY calls. Remember it like it was yesterday.
2020-09-02 10:09:36,touchhimwiththejab,13,"NVDA upgrades slowly rolling in 


BZ: B of A Securities Raises NVIDIA Price Target From $600 To $650

9/1/20, 9:59 PM

Don’t be a boomer, buy NVDA at open"
2020-09-02 10:08:55,Hookers-n-options,7,"RKT gang rise up! I sold my Sept 30c yesterday though, sadface."
2020-09-02 10:08:46,PM_ME_UR_LEFT_SHIN,2,"Alexa play Creed one last breath

This one's for you bears"
2020-09-02 10:08:27,scopolamine,10,"Imagine buying $TSLA but not 3x leveraged long $TSLA ETP 3LTS:

[https://www.tradingview.com/symbols/LSE-3LTS/](https://www.tradingview.com/symbols/LSE-3LTS/)

>GraniteShares 3x Long Tesla Daily ETP seeks to provide 3 times the daily performance of the Tesla stock, adjusted to reflect fees and costs inherent to maintaining a leveraged position in a stock

Come on, WSB. GO LEVERAGED!"
2020-09-02 10:08:17,BrrromePowell,3,any of you guys get so excited when you know your calls are about to PRINT
2020-09-02 10:07:26,touchhimwiththejab,12,"NVDA to 600 today

FOMO at open if you’re not a puss"
2020-09-02 10:06:58,Ricketycrick,2,Why did everyone keep saying “dow Jones erased all loses in 2020” last week when it clearly hasn’t? Am I Rarted?
2020-09-02 10:06:53,hithisisjukes,3,lets go qqq! these calls gon' print!
2020-09-02 10:06:28,Oamlyaa,3,Is it a bad idea to hold calls over the long weekend?
2020-09-02 10:06:25,AdditionalLawyers,13,Everyone is talking about how MSFT might buy Tik Tok but nobody is talking about the potential for Tik Tok to buy MSFT
2020-09-02 10:06:14,1005thArmbar,13,"The Prime Minister of Tunisia won a vote of confidence from Parliament

TSLA 525 EOD"
2020-09-02 10:05:32,i_love_my_scrotum,1,"Does TSLA still have a solid day of growth left in it? I keep seeing people making life-changing money and I'm picking up scraps with my $30,000 of capital, just itching to turn it into $40,000....but also too big of a pussy to go all in."
2020-09-02 10:05:29,WizKhalifv,14,You had me at Nvidia 🤗
2020-09-02 10:05:20,kananishino,3,How should i prep for a RKT dump?
2020-09-02 10:05:16,LostAndFoundWSB,0,I wish someone told me what play to make. I'm so tired losing money bejng a bear
2020-09-02 10:05:03,Bigbotofernz,10,So we’re just gonna forget about corn smh
2020-09-02 10:04:47,Bennylegend,2,Sold my NVDA FD yesterday cause it was trading sideways mid day. Yeah I'm retarded.
2020-09-02 10:04:31,mmmttt123,1,Donnie going to be waking up with the biggest smile this morning.
2020-09-02 10:03:52,silverlink22,19,CNBC said we are green because stimulus talks are going well. Lol.
2020-09-02 10:03:39,MP1182,8,"As bullish as I am, this shit is wild.  I don't know about this one today."
2020-09-02 10:03:32,Wade12323,8,I’m here for a good time not a long time
2020-09-02 10:03:10,ShickyMicky,9,"If you lose money today, just remember: If the sun was any closer to the Earth, we would fry. And if it were any farther, we would freeze. Keep things in perspective."
2020-09-02 10:03:04,YourPalCal,12,Pajama traders been snorting coke all night apparently
2020-09-02 10:02:49,SkuxxMyster,12,"YES IM HERE AFTER ONLY FOUR HOURS OF SLEEP, I HAVE A PROBLEM"
2020-09-02 10:02:43,light-yagamii,6,Goddamn how is spy so high? Wish I had more calls. So fucking glad I didn’t sell at close like a pussy
2020-09-02 10:02:09,RightTackle,3,DOCU doing its best ZM impression
2020-09-02 10:02:01,buchnasty,10,Oh how I wish I could buy calls premarket
2020-09-02 10:01:56,scopolamine,6,">The European Union’s securities watchdog is worried that the stock market is overheating. **-** [Reuters](https://uk.reuters.com/article/uk-eu-markets-regulator/eu-markets-watchdog-says-stocks-rebound-out-of-kilter-with-covid-hit-economy-idUKKBN25T178?il=0)  
>  
>The European Securities and Markets Authority (ESMA) said there has been a “potential decoupling” between the recent gains in the financial markets, and the economic damage caused by the COVID-19 pandemic,  
>  
>ESMA said its latest “trends, risks and vulnerabilities” report continued to see very high risks in markets, suggesting that the market rebound which began in late March may not be sustainable.

Umm watchdog is finally putting an alert out there."
2020-09-02 10:01:52,8KB8_M,12,**HOLY FUCK NVDA KEEPS CLIMBING 570 OPEN?**
2020-09-02 10:01:30,learningtosail,0,"Today's i-Ching Hexagram: 2 (all broken lines) [䷁](https://en.wikipedia.org/wiki/List_of_hexagrams_of_the_I_Ching#Hexagram_2)  

Bloody hell it even matches the weather. I think it is a day to take some risk off the table.  

>Line 1 (bottom line) (concerning)  
>  
>Something in your current situation or a close relationship is  foreboding, like the first frost of the autumn season that warns of the  deadly cold of winter. Heed small warning signs that you may see at this  time. Prepare yourself. Gather firewood now, and you will be prepared  to fend off the fiercest cold. Watch for signs of decay.  
>  
>Line 2  
>  
>Let movement and stillness meet. When action springs naturally  from inner calm and proceeds to harmonize with external creative forces,  all is well. Good results are achieved without contrivance, complex  intentions, or even great effort. Let nature serve as a reminder of how,  without artificiality, everything good can develop naturally."
2020-09-02 10:01:07,AdditionalLawyers,5,"Feeling like DOCU might make a last minute swoop for Tik Tok. 

DOCU C 9/11 420"
2020-09-02 10:00:54,SolitaryEgg,8,Jesus christ. Is there any chance this continues for another 3.5 hours?
2020-09-02 10:00:46,silverlink22,9,Two straight weeks of green lol. Nasdaq 12K. Wtf is this lol.
2020-09-02 10:00:40,Throwawayeconboi,3,"What just caused that spike? TSLA, AAPL, AMZN, etc. didn’t go up with that, so which stock was it


This is why I prefer QQQ 🤩🤩"
2020-09-02 10:00:36,MikeOck619,2,Any news on LMND ?
2020-09-02 10:00:30,ichbintrash,7,red days are literally discount days nowdays
2020-09-02 10:00:22,assjuice94,3,"Just saw the notification that i cant  make anymore day trades for 90 days. oops.. was worth it for the ZM, TSLA, and hopefully NVDA gains."
2020-09-02 09:59:53,RoyalFail6,30,"If you’re not holding tech, you ain’t black"
2020-09-02 09:59:48,touchhimwiththejab,7,"Homeboy is getting his dick sucked tonight

Zoom CEO Eric Yuan Becomes $6.6B Richer In A Day, Thanks To 40% Stock Surge

9/2/20, 11:09 AM
September 2, 2020 02:01 AM ET (BZ Newswire) -- News

Zoom Video Communications Inc. (NASDAQ:ZM) CEO Eric Yuan added $6.6 billion to his net worth Tuesday, according to the Bloomberg Billionaires Index."
2020-09-02 09:59:23,Dregin001,2,"As someone who ""dabbles"" in the markets, the Health the of stonk market is more important to me than anything else. I guess those who care about stuff other than the markets are not exposed with options or stocks. Maybe their 401Ks but we here only care about the health of the markets and they are HEALTHY! PUMP more liquidity into the system JEROME. We need more LIQUIDITY!"
2020-09-02 09:58:26,cat_modeler,14,APPLE BOIS 🙌
2020-09-02 09:58:14,jnkrumah96,18,Did tech cure corona ? 👀
2020-09-02 09:57:58,cat_modeler,6,"What was that green candle, I felt it in my stomach from my ass"
2020-09-02 09:57:58,hk_enthusiast,1,When is tic tok news coming?? Will it be Oracle? Have 100k calls in ORCL
2020-09-02 09:57:28,Nate_Doge,4,What’s the move WMT gang?
2020-09-02 09:57:21,Throwawayeconboi,5,GREEN COCKAROONI 👀
2020-09-02 09:56:51,tutah,1,RKT will drop to 31 by open because that’s how RKT do.
