date,author,score,body
2020-01-15 23:30:51,jt_the_autie,6,spy gonna beat 330 down like a red headed step child
2020-01-15 23:30:40,TimAppleBurner,1,"If I went long  on Apple at 10am today, but at 2:30 I sold a short call same exp 1 strike above my long to hedge in case of a further move south today and maybe tomorrow, does that make me a bear? 

Didn’t buy puts. Not trying to make money necessarily on a market drop on Apple. Just wanna protect my precious long baby"
2020-01-15 23:29:55,hamsupjai,18,"Today was a ""Sell the news but immediately buy it all back"" event. AKA STNBIBIAB"
2020-01-15 23:29:48,RubenZ217,3,SPX stop cockteasing and get to 3300 already
2020-01-15 23:29:17,love2fuckbearasshoe,10,BTFD ON APPLE BITCH
2020-01-15 23:29:09,fairygame1028,-6,Buying puts tomorrow
2020-01-15 23:29:02,webulltrade,4,Continue the play of buying every dip. We have at least until beginning of fall for this method to maybe stop working. Easiest money ever.
2020-01-15 23:28:47,mauimikes,1,Everybody and their mother jumping on SPCE now and for that reason... I’m out ✌️✌️🤟✌️✌️👋👋
2020-01-15 23:28:22,,7,*sigh* gay bears getting slaughtered again tomorrow. actually at this point im tired of saying it. from now on the bears should just say it themselves
2020-01-15 23:27:51,FourOranges,3,Uh oh... I thought I was bagholding so I sold [these](https://i.imgur.com/hhbxeJh.png)... Had 500 in total. Should not have done that.
2020-01-15 23:27:45,BedRiddenWizard,2,"GODDAMN SPCE.

I could sold ETSY today at peak when I saw bid volume dropping like a rock and gone balls in SPCE 16c.

Fuck I'm annoyed"
2020-01-15 23:27:15,daytrader987654321,1,What can I buy in this overpriced environment?
2020-01-15 23:26:46,barker-wise,1,Need teva stock to jump 2.00
2020-01-15 23:26:13,Shmokesshweed,1,"https://www.foxnews.com/food-drink/mcdonalds-worker-hand-pants-pictured

MCD puts"
2020-01-15 23:26:01,shanemontaque,5,Yeah I think I'm gonna jump on SPCE next.....
2020-01-15 23:25:46,,3,"https://www.cnbc.com/2020/01/15/apple-acquires-xnor-ai-startup-that-spun-out-of-allen-institute.html

Stonks go up"
2020-01-15 23:25:37,Muntberg,10,HOLY FUCK POST-MARKET
2020-01-15 23:24:56,cmcewen,6,"Bought 35k in target calls for a month out 
 at the dip this morning.  Up 2k at close today.  It comes back even 1-2% after that drop and I print money"
2020-01-15 23:24:55,dungbat83,3,Palladium making new ath every day wtf
2020-01-15 23:24:49,BedRiddenWizard,2,Lmao 10 cents from it's high today. Good job SPY
2020-01-15 23:24:29,DaKaiser21,1,DIS was too boring so I’m in SHAK and TLRY now. At least they both look somewhat strong AH
2020-01-15 23:23:38,Enra_,7,"Blood green, say your prayer bears"
2020-01-15 23:23:22,DeliciouslyUnaware,2,Pajama traders going the wrong way! We need a big red futures close so that we can skyrocket tomorrow. Futures is always wrong.
2020-01-15 23:23:12,J4ck3d,1,"Rolled my $SPY put gains into more $SPY puts for tomorrow's open

Picked up $GOOS calls for the week of ER on 2/13 -- people still getting robbed for these jackets around my city so there's my dd

Thinking of getting into $IBM in the morning for the ER run up and dumping it"
2020-01-15 23:22:24,,1,Pajama traders need to make America great again
2020-01-15 23:22:01,TEZLAGREEN,2,Anyone know the TSLA margins on superchargers? I’m thinking 70-80% based on my current electricity rates vs what they charge me for a supercharge. I know all money gets reinvested to expand the network but eventually network will be everywhere then what?
2020-01-15 23:21:59,seanjbln,3,This market can keep pumping to infinity as long as the fake meat stock dies.
2020-01-15 23:20:58,mrenormous,7,what if we were all meteorologists and we were like damn is the sky gonna open +2 or -2 degrees tomorrow
2020-01-15 23:20:12,WallStreetBitch,7,Imagine stonks going down 🤣
2020-01-15 23:20:03,,9,Now if Apple can go up tomorrow that would be great
2020-01-15 23:20:02,smackinov,2,Unreal. What a sham
2020-01-15 23:19:59,but-this-one-is-mine,4,"Short interest on Tesla is increasing

There will be a huge squeeze soon and it'll be epic"
2020-01-15 23:19:55,Lil_Musket,2,Any attempts to predict the market have failed
2020-01-15 23:19:44,Idoriskymemes,6,What Time does TSM report ?
2020-01-15 23:19:06,gregot76,3,What the fuck
2020-01-15 23:18:55,thowthembowz,4,we actually hit 3300 this game is so fukt i want a refund
2020-01-15 23:18:42,oregon_forever,7,I wonder what Pelosi is buying this week.
2020-01-15 23:18:02,,8,tesla scamming customers for 10k each by auto purchasing upgrades on their credit cards and then making it nonrefundable. tell me how their revenues arent going to skyrocket this earnings?
2020-01-15 23:17:17,TEZLAGREEN,2,🔋🔋🔋TSLA BATTERY CHARGING🔋🔋🔋
2020-01-15 23:16:52,TEZLAGREEN,2,fLy Me To ThE mOoN 🌝 ⚡️🔋🚗
2020-01-15 23:16:19,realister,36,"TSLA call I sold to some sucker went from $1400 to just $100 today, ouch."
2020-01-15 23:15:54,youralltwisted,2,Can we do another poll on if they’ll open green or red tomorrow
2020-01-15 23:15:35,svpa3991,6,Futures giving me a hard on that the trade deal failed to give 👀👀😩🍆💦
2020-01-15 23:14:43,winkerpack,7,"So I filled out all my membership paperwork and have been PayPal-ing the mods $300 a month for the last year and I still dont have my WSB membership certificate.  I know that shouldn't be the only reason I became an official member, and it's not, but I would really like having it to frame :("
2020-01-15 23:14:34,jake9892,1,Trump blowing up Tim apples spot
2020-01-15 23:14:02,JerseyFlashBoys,5,Bought a BA call the second i heard it on the livestream. Didn't work
2020-01-15 23:13:14,TheWhiteDelight,1,Do you think China will be mad when they wake up and find out they aren’t rolling back tarrifs?
2020-01-15 23:12:39,HowLongCanIMakeAName,2,Who’s this winkerpack character I keep hearing about?
2020-01-15 23:12:38,Midgetfarm,5,"Canada's oil industry has been taking a hit lately

https://www.bloomberg.com/news/articles/2019-08-21/the-30-billion-exodus-foreign-oil-firms-are-bailing-on-canada

But we are stealing market share for trans activists 

https://www.zerohedge.com/health/trans-gression-female-activist-who-flipped-out-when-women-refused-wax-his-balls-attacks"
2020-01-15 23:12:33,ItsBOOM,6,"Mnuchin on Fox News just said it could be Phase 2: A, B and C 😂"
2020-01-15 23:11:35,xxesus,3,"Why are **Morgan Stanley**, **Merrill Lynch** (BOA), **UBS**, and **Wells Fargo** considered ""wirehouses"" broker/dealers, but not JP Morgan ?"
2020-01-15 23:11:19,filthycasual9,4,I bought a 360 tsla feb 7 put for 1.41
2020-01-15 23:10:56,cool_BUD,5,TGT
2020-01-15 23:10:46,mynameisjoe78,2,Truth is im too scared to buy puts. Just feels so wrong
2020-01-15 23:10:42,ProOrlando,2,"Look at this shit, already back to the high of day day"
2020-01-15 23:10:17,adamT1224,3,Tomorrow bears get a huge wedgie then shoved into locker band instruments snapped in half etc etc
2020-01-15 23:10:15,inceptive,4,"Sold my TSLA puts today, bought ULTA and BYND calls. What do you guys think?"
2020-01-15 23:09:07,Treecrust,8,"I think I fell for the bear trap

*looks at 3 month chart on SPY*

Yeah... puts... great idea...."
2020-01-15 23:08:41,oregon_forever,5,"We beat China, Iran, North Korea, Turkey and Mexico into submission. What's next? We are running out of enemies to beat. Venezuela and Cuba are already as good as dead. Maybe we should bring back the Soviets so that we can beat them once again."
2020-01-15 23:08:09,frickin_darn,3,ACB put for the open
2020-01-15 23:08:04,IronManKillsThanos,3,"Hold up some of you guys are getting paid for this?! 

I thought I just deposited part of my paycheck biweekly for the entertainment subscription WTF"
2020-01-15 23:07:37,ShogunLos,11,If aapl moons tmrw I might actually kermit sewer side
2020-01-15 23:07:17,Frogfrog14,5,"Down 50%. Gonna see what tomorrow morning holds. 

What’s the best mid day play if I bail out of all positions and go all in for a 1/31 call"
2020-01-15 23:07:01,dungbat83,5,Futures taunting bears
2020-01-15 23:05:49,bainza,5,Anyone else make tendies on NIO today? I only made a small though. AMD turned my 💎👐 into 🧻👐
2020-01-15 23:05:04,winkerpack,11,What are yall doing tonight? Ain't it wild its already getting dark on the east coast but our cali bros are still at work for a couple more hours?
2020-01-15 23:04:37,sawyerG123,3,Who else is in 1/17 SDC calls ?
2020-01-15 23:04:22,HSL,6,FEDs have injected over 400 BILLION DOLLARS in just THREE months. That's TWO FUCKING TRADE DEALS OVER FOUR YEARS. Tell me again why the fuck is there a central bank?
2020-01-15 23:03:43,Northwooods,8,SPY 331 tmrw ⭐️⭐️
2020-01-15 23:02:40,Not-The-Government-,3,Some big dicks are swinging around AH and selling a shit ton
2020-01-15 23:02:18,monclerman,1,"Wish I had money to ride those BYND swings, all my mental plays hit 😒"
2020-01-15 23:01:57,jbor_9,3,Iran trying to sue trump?
2020-01-15 23:00:56,Shmokesshweed,2,frturs blood flat
2020-01-15 23:00:50,banieldello,4,bought the dip today. confirmed aapl moon to 320 tomorrow 🌙
2020-01-15 22:59:15,IamAsonofhorus,3,Blood green futures in one minute :)
2020-01-15 22:59:02,,0,"REEEEEEEE........


🐻🐻🐻🐻🐻🐻🐻🐻

🧨🧨🧨🧨🧨🧨🧨🧨🧨

📉📉📉📉📉📉📉📉

🍆💦💦💦💦💦💦💦

🐃=🌈"
2020-01-15 22:56:30,liquor_for_breakfast,4,"MoM Auto Sales, MoM Retail Sales, Retail Sales Control Group, Initial Jobless Claims 4-week average, and Initial Jobless claims all come out tomorrow at 8:30AM EST

Fuck I really need to start checking for this shit before I hold overnight SPY options"
2020-01-15 22:54:44,oregon_forever,1,"Tesla will pass $100B market cap in no time, especially given how the company has been diluting away its share count.

Look at this graph showing Tesla's dilution over the years: https://media.ycharts.com/charts/e55a1290dba1117eb76196ca3b1f40b4.png

Their market cap will easily add a $3-5 billions this year even if the stock remains flat. Elon's bonus is in the bag."
2020-01-15 22:54:14,Ardesic53,-4,"Im tryna hit 5 figs so $100 matters as much as $10 does. I have a few net worths to beat amongst friends. 

Lowest is 25k

Then 40k 

Then 90k

Gotta hit 1MM first"
2020-01-15 22:53:20,shmowker,7,"Autie did the Double XL 

Autie bought my bitch Chanel

Autie bought a brand new Porsche


Skkkrrt"
2020-01-15 22:53:00,BennyFlocka,3,$11k on the sideline. What’s the monthly play?
2020-01-15 22:51:41,mauimikes,4,GONNA WATCH THESE TARGET CALLS PRINT LIKE A MOFOING ATM MACHINE!!! 💯💯💰💰💰
2020-01-15 22:50:01,,5,"whats up with wsb refusing to sell when theyre up, and then finally choosing to sell when they're down? thats how u always lose money. cant lose money if u dont sell. btw tesla +5% tomorrow dont @ me"
2020-01-15 22:49:29,oze4,4,SO I HAD TO RIP UP HALF MY SPEECH
2020-01-15 22:48:46,oregon_forever,2,Alcoa misses estimates as always.
2020-01-15 22:48:22,sadlone,6,"https://imgur.com/a/skbvHXQ

APPLE HURT ME TODAY 🍎 

🚀 🚀 🚀 🚀"
2020-01-15 22:47:56,TEZLAGREEN,2,"TSLA - $1,000 next year, $5,000 in 5 years. $10,000 in 10 years. Get used to it"
2020-01-15 22:47:08,thirdc0ast,3,thoughts on consumer spending index #s tomorrow? don’t know much about it but saw someone bring it up in another thread
2020-01-15 22:45:31,justinswagvila,8,I actually feel pretty secure with my aapl calls. No way this bitch stays under 315 for a week. It swings $6 a day.
2020-01-15 22:45:23,THUGGERSEASON,8,"We hittin' 331 tomorrow.  

Mark my words."
2020-01-15 22:43:32,eltoroalldaylong,4,No one is talking about pelosi delivering articles of impeachment to the senate yet??
2020-01-15 22:43:18,benjamminson,6,"made 1200% on VFF breakout today. Been holding for 3 weeks. Looking to long a dip for continuation, maybe not tomorrow tho"
2020-01-15 22:42:52,Probably_Faking_It,3,"Ok, Theta Gang, I have a question about calendar spreads. If you open a long call calendar spread, and your short call expires OTM, then after that the stock value moves above the long call, could you potentially profit not only off of the theta decay from the spread, but then also from the increase of intrinsic value on the long call? So, for example, if I opened a SPY call calendar spread at a 330 strike with expiration on 1/17 on the short call and 1/24 on the long call, SPY doesn't hit 330 by EOD Friday (I know, blasphemy to bulls), but then it shoots above it on Monday, wouldn't that be like.. the perfect position for that play, and increase earnings potential to infinite? Or, is it NEVER a good idea to allow the short call to expire, and to always close it before then? Just curious."
2020-01-15 22:41:09,oregon_forever,9,"Ivanka 2024: Make tendies great again.

SPY to $5000"
2020-01-15 22:39:38,wolf_of_wall_mart,16,"might make an actual meal tonight, doing this $2 meal thing for 2 months has left me down 15lbs it’s prolly why I look like such a crack enthusiast

Step one at market open is to sell off all my BAC earnings plays that left me feeling salty

I don’t have a step two, I’m pullin out to 80% cash for a bit. Getting too stressed out from this shit and i usually buy monthly’s

Could be worse. Godspeed to stormy ⛈❤️ 


I’ll be back in a better mood after my two beer limit with some food in me"
2020-01-15 22:39:32,winkerpack,7,"Your girl knows me well 🙋‍♂️

But to you, I'm just winker 😉er

A secret she'll never tell 🤫

Is that I put it in her stinker 👉🍩"
2020-01-15 22:39:29,OblivionXBA,3,"I was up $250, fell asleep, woke up only up $30. 😁 What’s the rule, sell once up 20% or something?"
2020-01-15 22:39:12,TEZLAGREEN,2,"TSLA is at a 30BLN run rate. So 3x sales valuation. This is just auto business(which is growing +50% YoY) Wait for solar/battery ramp in 2020, Model Y (high end model sales at start) and RoboTaxis? That will change life as we know it. This is where the real opportunity lies and if successful Millions of millionaires that believed will be made!"
2020-01-15 22:38:18,designeddeception,2,"Love Netflix but really, how is it making more money? Everyone and their mothers already has Netflix and they’re pumping out $140 million movies?? Are we shorting this shit?"
2020-01-15 22:38:02,M0ngoos,3,Welp no 🌳 day 10 time to smoke a hookah like an Iranian retiree.
2020-01-15 22:37:51,kemar7856,5,you ppl are crazy not to get a peloton only $123/mo !!!
2020-01-15 22:37:47,oregon_forever,10,"Fuck, I've wasted another day mostly at WSB inbetween work or should I say work inbetween WSB."
2020-01-15 22:37:15,WallStreetThreads,2,Thoughts on SHAK?  Gonna keep climbing?
2020-01-15 22:36:44,psychcloud,0,What is the probability of Trump getting removed and markets dipping subsequently next week. How large of a dip would we see?
2020-01-15 22:36:07,EraEric,4,Trade deal was bullshit. House formally impeaching the president. Brexit still going horribly. BAC missed earnings. Holiday retail earnings underperforming. Repo pump continues. Market needs to cool off. SPY $325 by next week. SPY 2/3 $327p is my move.
2020-01-15 22:35:41,oregon_forever,39,"The last red day we've ever had: 1/14/2020

The last -0.5% day we had: 1/3/2020

Last -1% day we had: 10/8/2019

Last -2% day we had: 8/23/2019

Last -3% day we had: 8/5/2019"
2020-01-15 22:34:53,Austin141414,0,Guess I’m going to have to work some overtime to make up for today’s loss... up $3000 at one point yesterday on tsla calls down $1200 today
2020-01-15 22:34:33,indoloks,2,can anyone explain why after hours some stocks will be sold way above the book order. like amazon had 9 shares sell for 1936.
2020-01-15 22:34:26,VacationLover1,11,**WHEN ARE WE CASHING OUT OUR 409Ks? YOU BROS BETTER TELL ME WHEN YOU ALL DO**
2020-01-15 22:34:23,corytrade,5,Just applied for an options account with Vanguard. Incoming homeless post shortly.
2020-01-15 22:33:22,sp3xl,7,"Fuck anal cysts, it hurts too much."
2020-01-15 22:33:20,OntheBeat17,3,"Welp doubled down on baba calls lmao. If shit hits the bed, I'll be on the streets sucking cock for moneyssssd"
2020-01-15 22:33:18,mrenormous,2,Hey all just wanted to remind you about ETHANOL
2020-01-15 22:32:05,sheffieldda,4,Actually made money today [it’s not a rick roll I swear ](https://imgur.com/a/iBVqP6d)
2020-01-15 22:31:11,shmowker,4,TIMOTHY WILL NOT CUCK US AGAIN
2020-01-15 22:31:05,sadlone,3,"Holding 65 330$ 1/24 calls 

I will let it expire worthless, 

As is tradition."
2020-01-15 22:30:33,loneranger07,2,GE $11.00 put buy 1/24
2020-01-15 22:30:33,burkie1487,7,"And you get a pen, and you get a pen, and you get a pen, and you get a pen... is this the US Gov’t or Oprah?"
2020-01-15 22:29:44,Crosa13,1,The amount I made on spy NTM long expiry calls today was next to nothing so now it’s spy FDS tomorrow
2020-01-15 22:29:24,ilovewsb,1,WMT and DIS as usual
2020-01-15 22:29:19,zebrawaterfall,1,Let me hear your TSM plays. I was busy at work and missed getting in. I would have bought 55p. What's everyone sitting on?
2020-01-15 22:29:17,jackemcpherson,2,Thoughts on NYSE: EBS? Looking to play the NarCan angle.
2020-01-15 22:29:00,BlueKnightJoe,2,"If I somehow won the Powerball jackpot tonight, the biggest gambling win in wsb history, I couldn't tell anyone let alone wsb. That would end badly for me."
2020-01-15 22:26:26,nocap2k,1,UPS 120
2020-01-15 22:25:37,BiggiCalls,9,"I got big calls on the TSM

Taiwan numbah won!"
2020-01-15 22:23:48,Habstah,45,"> Damn I fell asleep after tripling down on my TSLA calls, buying both dips to ~530 earlier... And now I'm below break even again after being up 400% :-(

Taken directly from r/teslainvestorsclub, in true WSB fashion lmao"
2020-01-15 22:23:43,fraqaq,2,Lost 400 today. Maybe I’ll win the powerball tonight 🤔
2020-01-15 22:23:32,THUGGERSEASON,4,"Ya'll, I'm really on board with this SmileDirectClub shit.   This is the ultimate $BECKY stock.   Ugly bitches got bad teeth and can get some 23.99% financing on straight teeth for half the price AND NOT HAVE TO GO TO A REAL FUCKING DENTIST.  DO YOU KNOW HOW SCARED I AM OF DENTISTS.   The IPO was 20 something and this was before the Walmart and direct to sale route.  Ya'll are crazy not to buy into this.   I bought 20 14c expiring tomorrow. Will roll the profits on those to Feb or March calls.   This is gonna fucking moon."
2020-01-15 22:22:49,Billie__Gates,2,"Shove an apple up my ass, because that's what holding their calls feels like right now anyways."
2020-01-15 22:22:26,MP1182,2,System is rigged.  SPY will pump tomorrow since it’s Thursday and no 0 DTE available.  Should have caught them at open.
2020-01-15 22:22:25,throwaway78907890123,2,RH screwed my option stop-loss. Anyone has any experience dealing with this?
2020-01-15 22:22:13,JerseyFlashBoys,-1,"Did we have a celly  🍾 for LMT 420.69 today???

We droppin bombs on that bussy 😭😭😭"
2020-01-15 22:21:58,,8,"Uploading my resume to LinkedIn. Debating on whether to include ""turned $600 into $2,700 in May of 2019"" under skills and accomplishments. Also lost half of that 2.7k the next month but they don't need to know that😏"
2020-01-15 22:20:42,love2fuckbearasshoe,6,"DIAMOND 💎 HANDS PELOCI 


LETS GO BABY 

APPLE CALLS HOLD BITCH"
2020-01-15 22:19:51,Analslammer,15,"https://imgur.com/a/U95zItl

Sweet haircut bro"
2020-01-15 22:19:44,love2fuckbearasshoe,9,"APPLE is gonna fuck all bears hard 


BTFD it’s apple u stupid cucks  I mean do I need to fucken explain myself 

It’s Apple u idiots"
2020-01-15 22:18:23,y7nx90,5,"Can't wait until next week with NFLX, where real earnings actually start to roll in and not 2% moves on these financials."
2020-01-15 22:17:17,istergeen,3,"Congratulations, you honey dicked yourself"
2020-01-15 22:16:49,jakedasnake011,6,"https://www.marketwatch.com/story/the-last-time-this-clear-danger-sign-flashed-was-in-1999-and-we-all-know-what-happened-next-fund-manager-warns-2020-01-15?mod=home-page

So I’m pretty autistic, but seriously this shit is comparing TSLA to GE and saying IPOs are overpriced so we’re about to pop the bubble lol what the fuck is this trash"
2020-01-15 22:16:08,17461863372823734920,4,watch tsm print
2020-01-15 22:13:23,oregon_forever,9,"If you are only up 50%, what are you doing wrong?"
2020-01-15 22:13:06,ryit29,2,"If it turns out 5G actually does raise cancer risk, puts on the telecoms would be the biggest trade of the century"
2020-01-15 22:12:38,wewantcars,7,Remember diamond hands Pelosi. Hold those Apple calls!!!
2020-01-15 22:12:27,oregon_forever,20,"Daily reminder: We got 10 trading days behind us in 2020 and 243 left to go which means bears will get fucked 243 more times this year. So far the market is up 1.9% year to date. This is impressive but we were up 4.2% in 2019 and 3.6% in 2018 by this date, so the market still has some catching up to do.

At this rate we should end the year up 48% give or take 5%."
2020-01-15 22:12:06,,2,more sq calls or am i autist
2020-01-15 22:11:49,adeptwheel69,1,I fomo’d out of 1/17 SPY 325c for 65% profit I wanna kill myself id be 100+% rn
2020-01-15 22:11:49,straightCrimpin,2,"AMZN will be green tomorrow. Hopefully it will open at 1860 so I can close my short position, and then rocket up to 1890."
2020-01-15 22:11:29,SpiceJe,1,Why Tesla up so much after market?
2020-01-15 22:10:51,Jordykins850,4,Y’all cray cray
2020-01-15 22:09:16,Ashes1984,4,alright folks..any earning plays for tomorrow?
2020-01-15 22:09:03,HinduHamma,0,"It’s mind boggling the amount of people losing money from going long on Apple, one of the most overbought stocks in the past 12 months...Like did you all just buy at fucking $315 for the first time? Holy shit."
2020-01-15 22:08:16,gigantoir,11,haven't had a bad loss in a while i hate being due
2020-01-15 22:08:07,DadGoneGamer,6,Nice pump on TSLA. It’s all about the pre-market though.
2020-01-15 22:08:04,adeptwheel69,2,Wtf is target gonna do tomorrow
2020-01-15 22:07:07,Dolancorp,1,"Got bored sitting on the puts i sold, but did another -1 FSLY 21p for next month. 

Got some shitty 5c on PBI for friday because crazy high open interest.

Got an SPY 327.5p for friday because we all know THIS IS THE TOP."
2020-01-15 22:07:00,jakedasnake011,25,Donny was just listing his calls list earlier during his “thank you speech” and is gonna pump that shit like no other until next week. He was out of day trades in his RH account today so that’s why the market stagnated.
2020-01-15 22:06:51,ymi2f,8,Watch SPY open and bounce off 330.02 just like 329.02 today.
2020-01-15 22:06:04,link5114,10,"Baghold spy calls like I have been doing for 2 days and hope for another green day

Like a true wsb user"
2020-01-15 22:06:00,CreditSpreadz,11,"Sometimes I win, sometimes I lose. 

But I sleep better than you 📰🖐 pussies knowing my balls and hands are made of straight 💎💎💎"
2020-01-15 22:05:28,SmoresPies,16,we're never going to correct are we?
2020-01-15 22:04:09,ryit29,5,Imagine being the richest person alive and dating Amber Heard
2020-01-15 22:04:02,love2fuckbearasshoe,6,BTFD APPLE 👊👊👊👊👊👊🇺🇸🇺🇸
2020-01-15 22:03:56,TheFracas,2,Very cool TSLA
2020-01-15 22:03:52,Zer033x,4,"I sat cash all day. Didn't see any good opportunities on my watchlist and knew there would be some reaction to the signing today. After the dip at end of day I played it safe and bought some roku shares for a quick swing tomorrow but that's it.

Tomorrow I'm going to be looking for call option day trades with 10k capital. I found out through paper trading that I'm best at high capital option trades at a good entry that I sell within minutes instead of hold overnight option trades that theta decay."
2020-01-15 22:02:47,Trappin-Shoes,8,Bears so desperate for a correction they celebrate a mere .2% up rather than the usual 1%
2020-01-15 22:02:46,Desertbears,2,Selling another spx put spread. And hopefully AMZN unfucks itself.
2020-01-15 22:02:41,The_toast_of_Reddit,3,Did phase 1 get signed?
2020-01-15 22:02:17,LessThanCleverName,5,"Big boys seem to be looking at energy stocks as the undervalued assets recently, I missed the OXY train, what’s your pick?"
2020-01-15 22:01:58,WallStreetBitch,5,[Magic crayon TA on SPCE as requested](https://i.imgur.com/oX4B8NB.jpg).
2020-01-15 22:00:42,ray_kats,4,I'm going to continue to watch SPCE soar!
2020-01-15 21:59:55,but-this-one-is-mine,6,There goes the Tesla pump
2020-01-15 21:59:40,ruthlessinternet,1,ACB & SPCE
2020-01-15 21:58:59,Midgetfarm,14,"Won a contest and get to meet lizzo 🤩

How many donuts should I bring"
2020-01-15 21:58:13,Deezkicks,11,Tsm 🙏🏼
2020-01-15 21:57:50,oze4,8,"C'mon Donnie say something good ab Timmy I need this!

Who else is in deep on AAPL??"
2020-01-15 21:57:49,Muntberg,35,Hmm call me crazy but I'm thinking stocks might go up tomorrow.
2020-01-15 21:57:29,WallStreetBitch,3,The amount of god damn times I have to see a headline about Elon’s pay package as TSLA gets near $100B market cap 😑🔫.
2020-01-15 21:57:25,R2LSD2,4,PCG calls?
2020-01-15 21:56:54,Meritage-,2,Hoping JNUG keeps this momentum going :s
2020-01-15 21:56:35,IamAsonofhorus,5,329 tomorrow 330 Friday 😀
2020-01-15 21:56:13,karlaxel2,2,Top premium porn sites? Need some suggestions besides Brazzers and Blacked.
2020-01-15 21:55:12,Nomadic_Marvel07,1,Fomo'd into Bynd and TsLa calls at mid day...might be fucked
2020-01-15 21:54:26,k7rk,6,look at that massive v-recovery on the s and p futures chart. were going to 330 whether u clowns like it or not so buy calls at open or ur a retard
2020-01-15 21:54:09,ImLennyBruce,3,TSM reports earnings at 1am est/10pm pst tonight
2020-01-15 21:53:26,ayyojohnnyy,3,Bought 1/24 312.5 calls for Apple during the dip 🤓
2020-01-15 21:53:14,LessThanCleverName,2,We back to calls EOD puts at open?
2020-01-15 21:52:28,DocDino_,3,"NEO $35 calls for 2/21, im ready to win"
2020-01-15 21:52:24,yjruan,5,how do i buy call with margin?
