date,author,score,body
2020-04-05 23:25:13,weedstocks,4,"Today was really productive for me.

I ate some cake, took two naps, watched some cam girls, said guh when futures came out, played some online scrabble.

Was a good day. Good day."
2020-04-05 23:25:13,zaktrades123,2,"I’m not bull or bear anymore riding these waves as they come 

Bought SPY calls before close 250c 5/15"
2020-04-05 23:25:09,AvgJoeCrypto,5,"That first slide basically showed most states have not even started spreading yet, and just started testing, how are we almost peaked?"
2020-04-05 23:25:09,myglasstrip,3,Stabilize? With a barchart going everywhere but stable.
2020-04-05 23:25:09,stonktraderman1002,1,"We need a ""volunteer"" for this new coronavirus ""vaccine""  


Deb pushes slide person into stepping forward."
2020-04-05 23:25:08,itsdantheichiman,1,"Wow, NY And NJ testing around 40% postive..... but what is really big is that some ~80% of states are under 5% which means that we really might be flattening the curve."
2020-04-05 23:25:05,tolz2,2,I NEED TO SEE THE Y-AXIS
2020-04-05 23:25:02,illusiveab,3,IV will lower as more people take fewer positions on SPY puts for future dates
2020-04-05 23:24:59,Howard_510,3,Trump struggling to understand what these weird looking pictures mean
2020-04-05 23:24:50,ThatOneDrunkUncle,10,My three year old daughter just asked why people are still going outside when they could possibly infect other people. He's only 5 😢
2020-04-05 23:24:46,UeberMeister,7,I swear I'm not touching SPY ever again
2020-04-05 23:24:46,Andymackattack,3,Move out of the way of the graphs you doofus
2020-04-05 23:24:43,jukito1,6,I can make better graphs than this.
2020-04-05 23:24:41,mijnpaispiloot,5,"Imagine Trump contracting this... He would be dead, wouldn't even make it 2 weeks."
2020-04-05 23:24:41,EdgyInsurgency,4,"I don’t think people realize that if we don’t keep business closed, we’ll just got back right to where we were or worse"
2020-04-05 23:24:40,TobyInHR,5,THE FUCKING SNL SKITS WRITE THEMSELVES
2020-04-05 23:24:37,cashflow_,2,I like how Trump is looking at the diagram like he’s actually comprehending what’s on it
2020-04-05 23:24:36,Private_Void,2,Did she just call patients clients?
2020-04-05 23:24:36,_elroy,9,LMFAO THESE GRAPHS MEAN NOTHING WITH TRUMP STANDING ON THE Y-AXIS
2020-04-05 23:24:35,,1,"So this thing doubles every 2.5 days. 40,000 people dead by Friday. Holy shit."
2020-04-05 23:24:27,FormulaKimi,3,"Sunday futures don’t mean shit, have to wait until the markets open"
2020-04-05 23:24:26,NdSeIr,0,Lol Trump awkwardly looking at the slides
2020-04-05 23:24:21,MissionIncredible,4,"4/17 Puts on Fauci

https://talkingpointsmemo.com/news/fauci-false-statement-coronavirus-outbreak-under-control"
2020-04-05 23:24:18,HeaterKing92,2,Fauci dead?
2020-04-05 23:24:09,sailing_jabroni,4,I get it at 2am because we out source it to india on fiver.
2020-04-05 23:24:08,JustLookingAroundFor,3,Lol trump looks so funny
2020-04-05 23:24:04,xKhaos420,10,"You would think after weeks of pressers they would give Birx, a powerpoint clicker and bigger screens to present info. 

Nah"
2020-04-05 23:24:04,_FundingSecured420,5,"# Donnie looks pissed...

He looks like hes ready to blow up on a few reporters and tell them to fuck off..."
2020-04-05 23:24:02,kariappa,8,lol what kind of data teams create these shitty graphics
2020-04-05 23:23:56,Eager_af,14,Donny covering up the y axis to hide the numbers
2020-04-05 23:23:54,LakeShowForLife24,5,Feed cut out.. she said she gets a booty call at 2am?
2020-04-05 23:23:54,BakedForskin,5,"Fucking dr birx looking like the king of Zamunda.


https://imgur.com/a/fzbaLDV"
2020-04-05 23:23:49,Noticeably,2,Went cash gang and lost $1200 on Friday. Part of me thinks I saved myself from bleeding out entirely.
2020-04-05 23:23:49,giant24us,2,So will tsla and uber moon tomorrow or do my puts have a chance?
2020-04-05 23:23:47,smallchimpu,4,"#recession cancelled ,scarf fell"
2020-04-05 23:23:43,TigreTigerTiger,3,I think I’m officially broke. God damn it.
2020-04-05 23:23:43,ColbyL93,2,"2 slide slideshow.   



Nice"
2020-04-05 23:23:41,drummerboye,3,"OH MY FUCKING GOD 

SHOULDER SCARF DOWN!!! SCARF DOWN!!!!"
2020-04-05 23:23:39,deangeloyouknow,2,put the fucking scarf on all the way and stop playing with it.
2020-04-05 23:23:37,thesaddestcuck,5,Omg the PJ traders are fucking it up for everyone
2020-04-05 23:23:30,Gilbertgodfries,1,Lol Detroit
2020-04-05 23:23:24,truredman23,2,I wish trump push button to go to next slide i bet he would have fun
2020-04-05 23:23:21,NSAsnowdenhunter,0,Futures opened up and are pretty stable.
2020-04-05 23:23:19,Crude_Future,-3,Bears paniking. Come here to shit post... pathetic
2020-04-05 23:23:17,bsrbsrbrs,1,Futures so green can't say I'm surprised
2020-04-05 23:23:17,sailing_jabroni,2,Wait till they really start testing those 38 states.
2020-04-05 23:23:14,alchemyla,1,JNJ calls you guys!!!!
2020-04-05 23:23:06,deangeloyouknow,4,"The slide person is fired, already fucking up."
2020-04-05 23:23:00,dreggers,3,"apparently for retarded bulls, futures only matter when it's green"
2020-04-05 23:22:59,dagowankmaster,8,lmao trump's stance is hilarious
2020-04-05 23:22:57,MrDTremens,3,Wonder if anyone is watching this and realizing it's not a NYC virus but also headed for them at some point.. prob not.
2020-04-05 23:22:54,kalnard8,6,I live in Wayne County Mi my girlfriend lives in Oakland county Mi can I get some prayers?
2020-04-05 23:22:53,21ew_,25,"Why does Trump turn like a fish man? Instead of turning his head, he slowly turns his entire body."
2020-04-05 23:22:50,global-e1337,7,"Trump is totally me in high school, when presenting..


Just standin next to the Powerpoint nodding while the class geek is talking"
2020-04-05 23:22:48,Iknowyougotsole,3,"Autists with calls last week

Did you guys profit last week or did IV crush kill you calls too?"
2020-04-05 23:22:46,truredman23,1,Cured
2020-04-05 23:22:33,chessiechoice,6,Y doesn’t she just use a clicker for the slide show instead of “next slide PLEASE!!!!!”
2020-04-05 23:22:32,fresh5447,3,What is even the point of this conference Has he said anything new or relevant at all?
2020-04-05 23:22:32,bear2008,2,Dow going up a 1000 tomorrow.
2020-04-05 23:22:32,Hookemvic,3,I guess clickers don’t exist in the White House.
2020-04-05 23:22:29,Dynamik_,3,Maybe buying UVXY Friday wasn't the right move
2020-04-05 23:22:28,G0ttkaiser,2,SLIDES YESSS
2020-04-05 23:22:15,redisamyth,1,DEATH CHARTS!
2020-04-05 23:22:12,Ijustquaffed,0,Can't watch - summary so far?
2020-04-05 23:22:12,job182,4,"he literally said cases are peaking.. the docs wont tell ya that because they dont want you to get jumpy and go out but its a fact, italy has got over it, so has spain."
2020-04-05 23:22:11,iLuvRachetPussy,9,This graph is the biggest bullshit. You have to compare the curves from a set point. Otherwise you have this nonsense that makes it look like the rest of the states won't get hit as hard as NY.
2020-04-05 23:22:07,biganth,4,"245p 4/17, any comforting words?"
2020-04-05 23:22:04,psytokine_storm,5,"Italy and Spain are hopeful because they have already gone through hell. 

Without a widespread, enforced shutdown, the US will experience far worse than what Italy and Spain have gone through. 

It's like people think that the US is going to immediately get better because Italy and Spain are showing signs of improvement. They were getting crucified for weeks, and the US hasn't even scratched that surface."
2020-04-05 23:22:03,Septseraph,2,8 more months.. 8 more months.. only 8 more months.........
2020-04-05 23:21:59,RfLock7,2,NECK SIDE PEEZ
2020-04-05 23:21:54,cashflow_,2,#NEXT SLIDE PLEASE
2020-04-05 23:21:52,larry_dallas99,2,Weekend dow has called it like 5 times in a row. Just sayin'
2020-04-05 23:21:48,dirusICO,6,kinda sus that twitter took away Trending Worldwide like they trynna to hide some shit
2020-04-05 23:21:48,Cryogenx37,2,VIX long puts
2020-04-05 23:21:46,sh1t_trader,3,Worth buying USO Jan 2022 $6c tomorrow?
2020-04-05 23:21:43,Bigfudge312,3,"At this point, my puts need jesus"
2020-04-05 23:21:42,tychus-findlay,4,"Dr ""next slide please"" birx"
2020-04-05 23:21:42,realitytimes,2,"they couldn't figure out how to make this shit full screen? The resources of the most powerful nation in the world, ladies and gentlemen."
2020-04-05 23:21:38,Dabbymcgee69,4,This is the most retarded chart I have ever seen
2020-04-05 23:21:36,drummerboye,5,shoulder scarf? duh fuh?
2020-04-05 23:21:34,StreicherADS,3,TRACING OR TRACKING DEBRA!
2020-04-05 23:21:31,ImNoAlbertFeinstein,3,Covid and spy chart move together
2020-04-05 23:21:27,MP1182,1,I’m not watching but did he say when gyms and barbershops are opening back up yet
2020-04-05 23:21:27,27onfire,3,Can we all stick our asses out like that in solidarity?
2020-04-05 23:21:19,_FundingSecured420,7,"# The 🍺🦠 is an equal opportunity virus. 

It does not discriminate against race, religion, sexual orientation, etc."
2020-04-05 23:21:17,IgrewAtomato,2,Birks brought her crayons.
2020-04-05 23:21:16,TX50BMG,8,"Puts on their chart creator, these charts are unreadable garbage."
2020-04-05 23:21:15,webulltrade,5,"Every time the market is up and you're wondering how the hell it could be up, just remember: brrrrrr"
2020-04-05 23:21:14,italysky08,7,I’m straight fucked.  5/01 and 6/19 and I still feel fucked
2020-04-05 23:21:13,deangeloyouknow,4,trump where am I at? oh Washington DC fuck
2020-04-05 23:21:12,B3LYP2,3,Him just standing there hunched over is so fucking weird.
2020-04-05 23:21:09,Nemo-pluribus-unum,7,Puts on that scarf
2020-04-05 23:21:07,tolz2,7,donnie is blocking the Y-axis ):
2020-04-05 23:21:05,anonimalman,3,Does she always need a fucking scarf?
2020-04-05 23:21:03,ABirdOfParadise,3,don't lose your corona scarf!
2020-04-05 23:21:02,Amon7777,9,"Trump is shilling an unproven drug which causes fun things like heart failure.

Also, Carol Baskin killed her husband"
2020-04-05 23:21:02,MrBigBossMan,1,Omg imagine being a bear right now lolololol
2020-04-05 23:21:02,CrateMayne,4,"Is a scarf required piece of clothing for Dr. Birx? Her obituary is going to say ""died riding an escalator."""
2020-04-05 23:20:59,Bustincherry,3,Don't worry my puts will only need to go up 100% for me to make my money back and that's definitely gonna happen while IV keeps getting crushed.
2020-04-05 23:20:58,dotarock,0,Imagine betting on the US government handling a public health crisis. It's free money right now.
2020-04-05 23:20:56,ddiddy171,8,"Bears listen, Buffet sold his Airline stock, your puts are still good!"
2020-04-05 23:20:54,ColbyL93,3,Those crayon drawings look delicious
2020-04-05 23:20:49,Unfathomable_Stench,8,Birx needs to be on the cover of the next issue of Scarves & Shawls Monthly
2020-04-05 23:20:48,CroissantDuMonde,5,Dr Deb lookin fine today
2020-04-05 23:20:46,InferiousX,2,"Alright welp. 

I'm bored."
2020-04-05 23:20:45,Mr_Burkes,2,S H R E K D I C K G R E E N
2020-04-05 23:20:45,RfLock7,4,"Shit is going to be so unreal when we open up prematurely in 3 weeks only to have it hit harder and retreat back to where we are now

SPY 180p 7/17"
2020-04-05 23:20:43,whatshisuserface,4,stimulus so successful we may have to make it larger!
2020-04-05 23:20:42,giant24us,4,If futes were 300 points in the red market would be green by open. But the reverse is never true because I have fucking puts.
2020-04-05 23:20:42,msimp000,1,NY on its own level...
2020-04-05 23:20:41,drummerboye,8,Bitch I'll be impressed when this graph looks like my portfolio
2020-04-05 23:20:40,cashflow_,2,Diagrams always do it for me
2020-04-05 23:20:40,DandierChip,3,This guy looks in no mood to mess around with reporters now. Puts on the press people asking questions
2020-04-05 23:20:38,StreicherADS,9,Holy fuck meme template of trump looking at the graph please
2020-04-05 23:20:36,ElementShield,5,the charts gonna pump up the futures a little bit more
2020-04-05 23:20:36,reactor_raptor,1,"As you can see from the length of my scarf, I am very excited"
2020-04-05 23:20:35,McGarnagl,1,This women's shoulders are never cold.  Always at least 2 layers on them.
2020-04-05 23:20:31,WittsandGrit,2,Crude tanking. Hate to see it
2020-04-05 23:20:31,global-e1337,5,"I hate this bitch on stage, dunno why"
2020-04-05 23:20:25,motorsingleberry,3,Does that mean he’s done for the day? No oil talk?
2020-04-05 23:20:24,deangeloyouknow,2,I can't fucking see these charts
2020-04-05 23:20:23,dwdsquared2,3,"F A U C I F U T U R E S 

Coming up"
2020-04-05 23:20:18,paxnjackson,3,Fuck it’s going green isn’t it
2020-04-05 23:20:17,ImNoAlbertFeinstein,3,Hella scarf
2020-04-05 23:20:17,dagowankmaster,3,lol donnie blocking the screen
2020-04-05 23:20:17,peace_seeker007,1,Chat timeee
2020-04-05 23:20:16,_elroy,5,"""We need to get back to work""

Translation:

""I gotta get my hotel chain open or I'm fucked"""
2020-04-05 23:20:16,undermon,0,THINK ABOUT IT YOU FUCKING RETARDS. WHY WOULD IV GO UP. WE ARE GETTING MORE DATA. MORE TESTS. EUROPE HAS PEAKED. THINGS ARE BECOMING LESS AND LESS UNCERTAIN.
2020-04-05 23:20:15,overmotion,3,Dr Birx in her Hunger Games outfit
2020-04-05 23:20:13,ThatsMyPurse69,3,Yo what is that scarf
2020-04-05 23:20:10,pojo18,5,"weekend dow green.

futures green (probably limit up)

tremendously bullish presser.

nyc cases peaking,  global cases peaking.

&#x200B;

Bears r fuk"
2020-04-05 23:20:09,ImFeelingSparked,6,YOU GUYS HEAR THAT? LADY SAYS RECESSION CANCELLED
2020-04-05 23:20:04,HourPackage,2,IS FAUCI THERE?
2020-04-05 23:19:58,NdSeIr,2,Donny has gained a lot of weight
2020-04-05 23:19:58,SlamminMuff69,2,Prior to my administration it was 151 countries now we have 182.
2020-04-05 23:19:57,JustLookingAroundFor,3,Bears about to get fucked by these charts
2020-04-05 23:19:56,parker2020,3,GET DOWN SHE HAS A CHART
2020-04-05 23:19:56,,1,I really don't want to go back to work because I'm already working from home
2020-04-05 23:19:54,ringrawer,2,"So it looks like even apple sees medical equipment having better margins.

https://www.cnbc.com/2020/04/05/apple-will-produce-1-million-face-shields-per-week-for-medical-workers.html"
2020-04-05 23:19:51,chessiechoice,1,Charts to show ya: stonks only go up
2020-04-05 23:19:49,saiine,4,"""calls all day long"" you heard him"
2020-04-05 23:19:49,deangeloyouknow,4,dr berks
2020-04-05 23:19:49,TheRezonator,2,"Green Monday, Les go boys. We've found a bottom. Corona Virus priced tf in 💪"
2020-04-05 23:19:46,gatorademe,3,🧣🧣🧣🧣🧣🧣🧣🧣🧣🧣🧣🧣🧣🧣
2020-04-05 23:19:46,ebkallday1,2,He said CALLS
2020-04-05 23:19:45,drummerboye,2,How long can this act last as deaths ramp up. Months?
2020-04-05 23:19:42,bshaman1993,1,Red or green day Theta Gang will win!
2020-04-05 23:19:42,overmotion,2,Cmon! Let’s start the Q&A and get this party started 🎉
2020-04-05 23:19:39,Balzac7502,5,I need to hear Fauci speak before I go to sleep
2020-04-05 23:19:36,_elroy,5,"Hahaha this tweet has me rolling:

“What do I know, I’m not a doctor,” @potus says with uncharacteristic humility after touting the promise of hydroxy chloroquine to combat"
2020-04-05 23:19:35,McGarnagl,3,Most people tell me they didnt even know there were 182 countries!  (which means he didn't know there were that many countries)
2020-04-05 23:19:23,RHRiskManagement,4,"I’m thinking international indices are gonna drag us lower and lower tonight. Things aren’t getting better out there

I’m saying this hoping I don’t lose more"
2020-04-05 23:19:20,thenamesake11,2,Another week of shitty pump and dumps then? I cant take it anymore.
2020-04-05 23:19:18,new_at_CA,4,151 countries...so many countries!
2020-04-05 23:19:14,OutsideTheBay,1,We need DR JOHN TRUMP on this task force. One of the great minds
2020-04-05 23:19:14,Lolsmileyface13,3,fuuuuuck 252 new floor
2020-04-05 23:19:11,themolarmass,2,"ah yes, thoughts and prayers will make it go away"
2020-04-05 23:19:09,mj1mj1,3,Come on we need PISSED DONALD
2020-04-05 23:19:02,geddyclaus,4,It's a great hour of grief.  Possibly the greatest.
2020-04-05 23:19:02,Hookemvic,2,In the Lord's name we pray...AMEN
2020-04-05 23:19:00,stonktraderman1002,6,"Praise be thy Tendies

\-Donald Trump as said in Printer Go Brrricus 420:69"
2020-04-05 23:18:59,JustLookingAroundFor,-2,"You can tell trumps getting positive numbers 

This thing is peaking over the next few days for NYC (way under the absurdly high estimates) and every other state is already peaking or peaked 

Sorry bears

Trump has no poker face so you know it’s getting better"
2020-04-05 23:18:57,moroniccow,6,"#FireFauci 

Is trending on twitter. Wtf the guy is a saint"
2020-04-05 23:18:51,d3-AZ,5,BIGLY Grief
2020-04-05 23:18:45,BakedForskin,3,I wonder if the First Lady tells Donny before bed that he sounded like a fucking idiot during his speech since they don’t like each other.
2020-04-05 23:18:44,27onfire,6,Trump tryin to get into Hospital locker rooms now a la Miss America pageant.. ***how can we get me into the Hunter College Nursing program locker room so I can give a speech***?
2020-04-05 23:18:40,cashflow_,4,I have a friend that is exactly like Trump and loves him. He’s so stupid he doesn’t realize how stupid he is. He actually thinks he’s smart. Can’t learn anything new. Couldn’t learn options so just trades stocks. At least I know I’m not that smart.
2020-04-05 23:18:38,jukito1,15,CNN: Trump continues to push unproven drug for virus. Lmfao
2020-04-05 23:18:37,Smit_W,2,"🌈🐻's died of there death, unfortunately"
2020-04-05 23:18:34,learningoptions,4,Great hour of grief
2020-04-05 23:18:33,ABirdOfParadise,5,greatest hour of grief
2020-04-05 23:18:33,21ew_,2,"Oh god, we are so fucked tomorrow lmfao...."
2020-04-05 23:18:31,Gilbertgodfries,2,A great hour of grief
2020-04-05 23:18:29,shamusotool,3,Are nurses firefighters now or what the fuck is he on about
2020-04-05 23:18:29,selfmadebro,6,I wanna hear Fauci tell us we’re fucked. Bring that manga cake on stage
2020-04-05 23:18:28,deangeloyouknow,2,"god, please stay out of my way."
2020-04-05 23:18:27,mcchicken2,1,TIL church heals state
2020-04-05 23:18:20,SlamedCards,4,if god existed he would make the market go red
2020-04-05 23:18:20,ProcessTrustee3,3,I drank the blood of Jesus therefore I am exempt from coronavirus
2020-04-05 23:18:17,DrUNC83,6,The most annoying part of the press conferences is when trump breaths in/ sucks in his spit after a paragraph
2020-04-05 23:18:14,MustWarn0thers,3,"My 3 year old son does the free associative nonsense talk when he's in the tub at night getting his bath and he legit just asked me if Carole Baskin poops, while playing with his suction cup water tubes.

Yeah buddy, she shits on everyone and everything."
2020-04-05 23:18:12,ymi2f,9,Please pray for my spy puts.
2020-04-05 23:18:09,NdSeIr,2,Stick to the god damn script you idiot and wrap it up Jesus Christ
2020-04-05 23:18:09,Andrew_the_giant,3,WAAAAARRRRR
2020-04-05 23:18:06,,2,Hold onto my May puts (possibly roll out) and keep loading up on stock. Good chance we don't retest the bottom again.
2020-04-05 23:18:06,illusiveab,1,your brayers
2020-04-05 23:18:04,moroniccow,6,TIL oil and gas in-duh-stree was doing great before corona
2020-04-05 23:18:03,LakeShowForLife24,2,LOL people in apartment houses screaming and shouting
2020-04-05 23:18:01,millert13,1,So my Boeing calls gonna print?
2020-04-05 23:18:00,,3,Can Allah smite the infidel market
2020-04-05 23:17:56,deangeloyouknow,1,"and there putting there maskes, and outfits.."
2020-04-05 23:17:56,StreicherADS,3,Pray the gay away
2020-04-05 23:17:48,HourPackage,7,WTF is he blabbing about?  Anything of value?
2020-04-05 23:17:46,wain_hay,2,Puts on god. He’s fucked up worse than trump
2020-04-05 23:17:43,ebkallday1,2,Jesus
2020-04-05 23:17:43,anonimalman,3,Can’t wait for Trump’s sermon on Easter Sunday.
2020-04-05 23:17:43,shamusotool,6,Donnie is like a dude who's sat in college classes for 9 years and hasn't learned anything at all but he's heard enough words and phrases that he can start repeating a whole bunch of shit
2020-04-05 23:17:38,_elroy,8,"### President Trump: Going To Take Care Of Airplane, Airline Industries"
2020-04-05 23:17:34,AlmightyCheesusCrust,7,Pastor Donald
2020-04-05 23:17:33,mijnpaispiloot,9,What the fuck is he talking about with the light at the ebnd of the tunnel? USA is literally at the beginning of a mass death-spree...
2020-04-05 23:17:33,ThatOneDrunkUncle,1,Equities can't ignore the carnage in other markets forever
2020-04-05 23:17:31,ColbyL93,3,No oil news.  Nice
2020-04-05 23:17:30,DogOfDreams,5,These green days do give me a bit of fomo but somehow I still feel comfortable not placing bets against the current state of reality
2020-04-05 23:17:28,Lolsmileyface13,2,if anyone here has family in hospitals request IL1/6 inhibitors. zithro/chloroquine are hot trash.
2020-04-05 23:17:26,27onfire,1,My plastique wife is wearing a face mask.. but me.. no.. never.. I don't think I'll do that.
2020-04-05 23:17:24,vauux,1,boring
2020-04-05 23:17:18,ktrash,6,"in duh strees if you’re listening we are sending you hydroxycuckloquine and azipottydootimycin

I’m not a doctor but go ahead and take it I mean what’s the worst that could happen?"
2020-04-05 23:17:17,msimp000,2,Models starting to look good to me!
2020-04-05 23:17:17,ImNoAlbertFeinstein,3,InDustrys worked until it didnt
2020-04-05 23:17:12,_elroy,2,"This is one of the weaker press conferences IMO. I hope Trump picks it up with some entertaining Q&A.

This pressor has no new information, no new sound bites, nothing."
2020-04-05 23:17:10,JustLookingAroundFor,1,MAXIMUM DEATH
2020-04-05 23:17:10,IgrewAtomato,3,Mother fucker we ain't even half way through the tunnel and that light is a fucking freight train!
2020-04-05 23:17:05,fuegocossack,2,Death to an absolute minimum? Very bearish. The market gods demand death.
2020-04-05 23:17:04,isles478,2,how could we see light at the end of the tunnel 24 hours after we were told the next 8-9 days were gonna be a disaster? these goofballs change their tune every single day.
2020-04-05 23:17:04,trclausse54,3,FUCKING PRAY
2020-04-05 23:17:03,deangeloyouknow,5,"holy week, WTF is this shit?"
2020-04-05 23:16:59,lizardwizard77,6,Follow the light Donald
2020-04-05 23:16:52,Kamanar,6,"Airline in dust tree.

oil and gas.

'like nobodies ever been hit before'"
2020-04-05 23:16:48,rapidermine,1,There you have it folks...mission accomplished
2020-04-05 23:16:43,ImFeelingSparked,4,Oil pump in 27 minutes.
2020-04-05 23:16:35,phanatic1030,7,they weren’t going to do a presser today. Why the change a couple hours ago. For this. He’s rambling for nothing.
2020-04-05 23:16:32,96ZJ,2,Just pump everyone lol
2020-04-05 23:16:30,Dans2016,3,"Calls on AAL UAL JBLU LUV

He just said ""airlines are doing great"""
2020-04-05 23:16:30,AllJuiceMustDie,3,PUMP IT UP AND DONT LET FAUCI SPEAK
2020-04-05 23:16:30,rugglenaut,1,"Every time the markets moves a little green the wings are plucked from a little bear fairy like so many in this thread. Once enough wings are collected, big bear baby jesus is summoned to dump the philistine market into oblivion. Amen."
2020-04-05 23:16:28,Iknowyougotsole,8,"I bought calls on Friday for no other reason than inversing myself

It’d be so funny if this pays off lol"
2020-04-05 23:16:28,undermon,3,I'm not industry I'm in da streets
2020-04-05 23:16:27,RfLock7,2,"“ if we do more, we’re gonna do more! 

We are going to fix everything! Don’t worry about this in 5 years we will have our avengers erase this virus and bring everyone back” 

- D.T."
2020-04-05 23:16:23,EatzGrass,2,"Sadly all of our doctors and nurses seemed to have gone, how do you say it, tits up, ya know croaked. It seems the fishtank food had some side effects that we didn't anticipate"
2020-04-05 23:16:23,Bustincherry,2,SPY will be at 260 by the end of day tomorrow for no good reason lmao
2020-04-05 23:16:21,geddyclaus,3,In-DUST-trees    long DUST
2020-04-05 23:16:19,Stonk_Attonk,3,InDUHstry
2020-04-05 23:16:17,xKhaos420,1,PUMP MY OIL CALLS DONALD
2020-04-05 23:16:16,thenamesake11,2,Just close the damn country
2020-04-05 23:16:16,Cam2071,4,"He is the definition of a con man. Like Jesus Christ.  

Airline In-duh-stry

In-Duhhhhh-streee

Things are indeed happening"
2020-04-05 23:16:15,Renaliiii,2,In DUS treeeees
2020-04-05 23:16:15,daddydickie,1,"light in the end of the tunnel

from dark to light"
2020-04-05 23:16:12,parker2020,3,OIL?!?!?
2020-04-05 23:16:09,_FundingSecured420,2,"#Come on Donnie, name drop!

So we can prepare our plays for tomorrow! 🤣"
2020-04-05 23:16:08,,2,"There’s nothing that’s ever been like this. 

#facts"
2020-04-05 23:16:05,its_that_dude_,7,"wtf is this dude saying?  all i hear is ""blah blippity blah blahpba;ldksafjsdvlsdivhuopsas""

never has someone talked so much and said so little. how is this dude president."
2020-04-05 23:16:02,selfmadebro,4,He’s taking care of both the airline and airplane industries
2020-04-05 23:15:58,Kamanar,1,"It's all about business.

Puts on worker lives.  
Calls on stonks."
2020-04-05 23:15:57,,1,"""IN DUST REEEEEEEEE"""
2020-04-05 23:15:56,deangeloyouknow,3,"the airplane industry, the airline industry."
2020-04-05 23:15:53,GamblingMikkee,2,OIL OIL CALLS
2020-04-05 23:15:52,ijakebeltran,5, #FireFauci is trending on Twitter... that’s bullish
2020-04-05 23:15:52,Simpso1996,2,Boeing moon confirmed!
2020-04-05 23:15:51,new_at_CA,1,MY JNJ leaps say thanks!
2020-04-05 23:15:50,alexbui91,1,"Oil got hit like nobody has been hit before. 

Haha"
2020-04-05 23:15:50,Sircampsalot111,10,Holy fuck. 1.6 mil tested and 350k cases.  %25 of america wtf?
2020-04-05 23:15:49,,2,Induuustries.
2020-04-05 23:15:49,adderallanalyst,-4,"Hahaha. I knew it.

SPY is an ETF not a stock, a percentage of it is exposed to oil not the whole thing and oil company prices are already bottom of the barrel if they drop more the effect is rather minor."
