date,author,score,body
2020-01-31 21:19:27,Konkyschlong,1,Just dip country and join the French foreign legion
2020-01-30 02:18:19,bluerise1,2,"Hey man seen your story if you consider running away hit me up , I'm in Texas and live 600 miles from the Mexican Border . I would be willing to help you get set up over there and should be pretty easy for you to get in since you are a Canadian Citizen. Please never consider suicide you can always pull your self out from what ever situation you are going thru right now.  Please reach out if you do want the help ."
2020-01-21 21:46:10,PrestigeWWinc,1,My 10 522.5c’s printed
2020-01-21 17:29:06,Thecreedthoughtsgov,2,Buy now?
2020-01-21 16:13:53,,1,"Shop bro


I don’t want to short you but I almost have to"
2020-01-21 14:33:38,Cnastydawg,4,LULU puts to $237
2020-01-21 14:19:51,johnny-orange,2,"I would think BABA would go up with current outbreak going on in China. People will want to avoid stores even more, ya?

So. Go. Up. BABA."
2020-01-21 13:49:30,saifly,1,Why is BA opening so low
2020-01-21 13:16:08,wowasg,4,Lol my spce. Option paid off. Think I'll sell and option. With the same expiration to lock in profits
2020-01-21 13:01:13,jakedasnake011,3,Well good morning SPCE! Crossed $16 and then some
2020-01-21 12:47:00,wowasg,3,Is today the day I sell my first option?
2020-01-21 12:32:28,1AdamsApple9,1,$SQ testing the gap. Hope it pushes through this week.
2020-01-21 12:07:40,THUGGERSEASON,6,🐻 get recked.  Almost back to green.
2020-01-21 11:57:01,subaeisgood,2,"Where is the fucking dip ??? 


Biden do something 

BTFD"
2020-01-21 11:19:47,astafe,1,Will open green guys
2020-01-21 11:14:56,ch1p_skylark,0,i'd say worst case scenario SPX closes red by 4-5 points today 😐
2020-01-21 11:05:54,BrendanIsThrew,4,"Hey Donnie say something interesting to these international money guys. no one wants a toned down version of your stump speech. need them to help the pump  
edit 1: oh christ he's talking about Ivanka  
edit 2: PHASE 2 NEGOTIATIONS STARTING SHORTLY. GOOD STUFF ON IP THEFT. RELATIONSHIP WITH CHINA NEVER BEEN BETTER.  
edit 3: NAFTA was terrible. USMCA includes Mexico and Canada. Whoa!  
edit 4: US joining 1 Trillion trees initiative. Long $WOOD"
2020-01-21 11:02:49,subaeisgood,3,Where is the fucking dip ?
2020-01-21 11:02:33,ch1p_skylark,2,Stay stronk Gold bulls. We will rise again
2020-01-21 11:02:17,austinblacknj,2,Anyone betting googl will hit 1600 in the next month or so?
2020-01-21 11:00:26,Eatjerpoo,7,"It’s Tuesday, $SPY usually has weekly lows today because the algorithms need to make room for stocks to go up."
2020-01-21 11:00:23,UsuallylurknotToday,1,"Sikorsky Helicopter just left Langley- long USO

(Has worked 3/4 times or so for me)"
2020-01-21 10:58:09,Rubenov,2,How are all you boomers handling $BA's crash?
2020-01-21 10:56:38,austinblacknj,3,Baba down $3 already 😅.cheap calls hell yeah
2020-01-21 10:55:02,uninfinity,11, ***US President Trump says the US is in the midst of an economic boom***
2020-01-21 10:50:44,ch1p_skylark,4,"If you're too scared to play NFLX, consider picking up some pre-earnings cheap ROKU calls.

If NFLX smashes it, ROKU will probably get a small sympathy rally, especially since it's fallen pretty hard from its recent highs & earnings in early Feb."
2020-01-21 10:49:58,gforSVJ,4,Trump speaking
2020-01-21 10:47:00,onceuponathrow,3,I’m afraid to share my plays here now because it always jinxes it
2020-01-21 10:34:04,ch1p_skylark,8,"every country could simultaneously get 16 viruses

if earnings ""beat expectations"" SPY is still going to 340."
2020-01-21 10:31:52,BrendanIsThrew,9,Trump a few minutes away from speaking at Davos...He's got the ability to override any selloffs over Gyna and Hong Kong. However his speech goes will be what CNBC will be talking about all morning
2020-01-21 10:30:19,,5,alright im all in PALL calls in the morning this thing is unstoppable
2020-01-21 10:27:13,,10,can u imagine if it was the US that had a budlightvirus rather than asia? GUH luckily we live in the greatest country in the world and our stonk market is unstoppable
2020-01-21 10:20:32,chodmode2,-1,dunno if you guys believe in omens but this right here is some [scary shit](http://imgur.com/gallery/R7vW4pc)
2020-01-21 10:20:08,theCramps,3,This the LK dip I Need ty SARS 2.0
2020-01-21 10:17:54,IVCrushingUrTendies,3,Ouch. I’ll look again at 8am
2020-01-21 10:15:50,ethereumkid,3,Gimme a nice dip to 229.50. Then you can rip all you want.
2020-01-21 10:15:43,ch1p_skylark,4,Which one of you retarded necromancers just sold naked Natgas calls?
2020-01-21 10:13:31,orrangearrow,9,"Today’s word kids is “Buy the fucking dip”. Ok KIDS! Repeat after me. BUY. THE. FUCKING. DIP!!! YAAAAAAAAAAYYYYO!!!!! Wasn’t that fun??? Ok kids, WHAT ARE WE GONNA DO TODAY???"
2020-01-21 10:12:40,,16,Last time it opened red of note (after that Iran bs) it was bought so hard outta gate that poor bears didn't even have time to get rid of puts before going negative again.
2020-01-21 10:07:13,galactictaco42,3,"Remember when west nile was a thing?

I remember being afraid to go to little league. I thought id get bit and die"
2020-01-21 10:06:30,astafe,2,Who thinks that BA will broke the very strong resistance of 320 so that my puts will works . Who I’m I kidding it didn’t work for me for few months now
2020-01-21 10:01:57,galactictaco42,1,Are we down on news or just a regular dip?
2020-01-21 10:01:35,ch1p_skylark,2,"so apparently nothing happened at Davos except a lot of Greta Thunberg

i wonder how she feels about all them private jets"
2020-01-21 10:00:47,oregon_forever,2,Tesla is down for the 4th day in a row but at least this time it's only 0.5%.
2020-01-21 10:00:21,Cnastydawg,2,So the corona virus is basically no big deal other than weak people that can lead to SARS?
2020-01-21 09:58:43,astafe,3,I didn’t expect the small recession to last this much. Will be green by open
2020-01-21 09:58:08,GeneralGay421,2,"Confirmed fish sars in AUS

https://www.smh.com.au/national/first-australian-monitored-for-coronavirus-authorities-confirm-20200121-p53tc7.html"
2020-01-21 09:55:07,cadenkai171,1,Sgmo and dks maybe
2020-01-21 09:52:03,,2,ok in the past 4 months i dont think we've seen 2 red days in a row. if tuesday and wednesdasy are both red it may be time to switcht o puts
2020-01-21 09:47:20,Muntberg,2,"holy fuck SPCE, it's actually the answer to the zombie apocalypse"
2020-01-21 09:47:09,legend27tv,3,"SPCE JUST MOONED!!!!!!!!

THANK YOU WSB FOR YOUR RETARDED ADVICE THAT WORKS! YOU GUYS ARE MY SAVIORS AND WILL HELP PAY MY TUITION, THANK YOU !!!!!!!!"
2020-01-21 09:43:46,WallStreetBitch,0,Something something about greedy and fearful.
2020-01-21 09:42:56,DarthBeast,1,Inclined to buy SPY 335 C 1/27 for $46/leg
2020-01-21 09:32:49,gaysaucemage,1,"Why is BABA dropping so much? I kinda wanna buy the dip, but don't understand if there's a real reason for it to drop more."
2020-01-21 09:31:22,GeneralGay421,6,Long PTON no one wants to catch sars at the gym
2020-01-21 09:30:49,Regjohn,9,"Be carful there buying puts, I heard that’s how the virus transmit"
2020-01-21 09:30:21,ItsJambalieya,4,Anyone who think a virus is causing this red is retarded
2020-01-21 09:29:40,chodmode2,4,"airlines down, SPCE up. aint no virus on the mooon"
2020-01-21 09:26:14,wsb_mods_R_gay,5,"Fake Meat up 5% premarket, why tho? zombies don’t eat veggies."
2020-01-21 09:20:26,Muntberg,2,"well things aren't good boys but look on the bright side, SPCE is up 6 cents pre-market."
2020-01-21 09:16:50,Droidvoid,5,This selloff is weak. Everybody is so levered that they’ll do whatever they can to keep VIX down. Only a black swan event will cause VIX to spike hard enough to cause another vixpocalypse. VIX will be red by EOD
2020-01-21 09:16:18,fieldG,1,Shouldn’t gold be up in a zombie apocalypse?
2020-01-21 09:13:33,OblivionXBA,2,WTF SPY
2020-01-21 09:13:10,teegacy,1,Rip to my $baba calls
2020-01-21 09:13:01,chodmode2,3,[Long AMD](https://twitter.com/MConnatserAPC/status/1219424355396046850/photo/1)
2020-01-21 09:12:31,greentea45,1,if AAL drops below 27 ill probably buy calls for earnings
2020-01-21 09:11:31,GeneralGay421,2,Woot I get to buy DAL on the cheap
2020-01-21 09:11:16,Muntberg,2,"https://www.breitbart.com/2020-election/2020/01/20/joe-bidens-brother-frank-linked-to-projects-receiving-54000000-in-taxpayer-loans-from-the-obama-administration-despite-no-experience/

yo peter schweizer is a madman"
2020-01-21 09:08:23,GeneralGay421,11,"80,000 people died of flu last year in the us alone. 4 people died in China this month from fish sars. Big fucking deal"
2020-01-21 09:07:22,grito94,6,Why is BYND up so high
2020-01-21 09:05:39,oregon_forever,3,Tesla is down half percent in the pre hours. No big deal.
2020-01-21 09:04:47,ballsvanhouten,2,I pray to the Blessed Exchequer this day
2020-01-21 09:02:57,Mothyzx,3,Guys please help me out. So this zombie apocalypse is more serious than the world war 3 we've been through a few weeks ago?
2020-01-21 09:02:05,GeneralGay421,6,"Wallstreet bets starter packs
Green dildos 
TSLA calls
Spy calls
1% drop
Lose everything"
2020-01-21 08:59:56,chodmode2,2,massive green dildo on TSLA and fake meat up 4%
2020-01-21 08:54:59,dnesdnal17,3,"[The Senate will control the cameras during the impeachment trial, limiting what viewers will see. Reporters will be confined to roped-off areas. The effect is to make it harder to chronicle the you-are-there details of a historic moment, journalists say.](https://twitter.com/nytimes/status/1218948777417027586?s=21) 



Hey kids look! A virus!


Oh what’s that? Phase 2? 


Oh what’s that? Look, ATH!"
2020-01-21 08:50:57,YangGangBangarang,1,Premarker in 10 minutes?
2020-01-21 08:50:56,weed_stock,1,Target of 9085 on the q's
2020-01-21 08:47:33,denali4eva,1,Uhm... corona virus gang?
2020-01-21 08:44:03,chodmode2,3,even GC's down. calls on 3M for their N95 and N100 virus proof masks.
2020-01-21 08:42:55,oregon_forever,3,"Bears went to bed dreaming of tendies, they will wake up to disappointment but they are already used to that."
2020-01-21 08:42:52,trapfactory,2,Why is oil down again..? Kill me
2020-01-21 08:42:00,kevinlin1995,1,"im thinking BA hits below 300 this week, and back up 300 after earnings next week"
2020-01-21 08:41:11,dnesdnal17,4,Buy whatever dip tomorrow. A fucking virus? They’re just trying to shake weak hands smh
2020-01-21 08:40:49,,1,XLV at open?
2020-01-21 08:37:28,Regjohn,2,So TSLA immune to the zombie plague? Still up Euro markets(compared to the US close price)
2020-01-21 08:36:00,Droidvoid,3,"Damn a lot of big funds sold AAPL shares this last quarter, including BRK.. hmm will probably be weak tomorrow"
2020-01-21 08:35:19,wsb_mods_R_gay,2,"At open, if there’s a run up, I’m gonna close my calls, prob at -40%, gonna use the remaining on Mc D fries and coke, won’t be able to afford the nuggets."
2020-01-21 08:35:12,Muntberg,2,fuck me boys
2020-01-21 08:34:14,UsuallylurknotToday,0,SARS Phase II deal confirmed. Will exchange American Soy for Chinese virus says USTR.
2020-01-21 08:34:08,YangGangBangarang,1,"All trump has to do is tweet “we won’t put new tariffs on France” and shit will pop.

The same way shit dropped when munchkin told us we won’t drop tariffs on China phase juan deal (shit was known)."
2020-01-21 08:33:50,dungbat83,2,Shit new low
2020-01-21 08:29:19,,2,Literally killing 80year olds.. china prolly set this shit loose to help lower elderly populations.. markets shitting over a damn head cold...  glad im hedged out the ass..
2020-01-21 08:27:30,mikes703,2,Tesla my Esla!
2020-01-21 08:27:12,,0,"i think we should all get into trading lean hog futures. with the swine flu in china and this epidemic, theres going to be an increase in demand for pork. im buying calls on lean hogs. whos with me?"
2020-01-21 08:25:58,wsb_mods_R_gay,1,"Goddam just for a second there I thought we were going to recover, now I got blue balls."
2020-01-21 08:23:25,technicallyiminregs,2,Fuck it might as well stay up for premarket right?
2020-01-21 08:17:43,FringeDerivatives,2,China virus spread to Europe and even laying waste to commodities. We should just delay open until we find a cure.
2020-01-21 08:17:11,YangGangBangarang,9,"Everyone, this weekend:  please just let me see a dip so I can buy in

Everyone, now:  zombie plague world is over"
2020-01-21 08:16:16,vjsworld,2,Are my AMD and MSFT FDs are fucked?? 😭
2020-01-21 08:16:07,dungbat83,1,Another bounce at 3309?
2020-01-21 08:15:54,chodmode2,3,holy fuck we need that big dick bull to get us a strong green dildo again. gold isn't going up though.. this market..
2020-01-21 08:15:41,,4,ok. so this is the black swan eh? repos cant stop a fucken viral plague about to decimate the entire world. welp it was nice knowing u guys
2020-01-21 08:12:00,KimchiFitness,3,Holy fuck futures volatile af
2020-01-21 08:10:32,DadGoneGamer,3,I came to take a dump and not a second after this giant turd fell from my ass did that big red candle form on ES.
2020-01-21 08:10:15,oneeyedty,1,Gyna dropped damn near 3% goddamn I’m about to lose money both fucking ways
2020-01-21 08:08:15,dungbat83,0,Lol bull trap?
2020-01-21 08:06:16,23therealme23,4,"Asia down 2-3%, Europe down 1%, US futures only down .3% and showing strength. Merica!"
2020-01-21 08:04:40,JaeRex,1,Futures red; bears are dead.
2020-01-21 08:04:40,,5,its ok. everywhere else is taking a dump so they can pull their money out and pour it all into the us stock market. we'll open super green today
2020-01-21 08:03:49,bme098,2,How the fuck can even gold dip??? Isn't gold supposed to go through the roof at a time like this?
2020-01-21 08:02:57,greentea45,3,"well, that was a big equities dump

got mostly bought up though"
2020-01-21 08:02:30,,4,honestly they should just close all asian markets so this whole ebola shit blows over. everytime theres a crash incoming just close the entire markets until people dont feel like selling anymore
2020-01-21 08:02:18,nfa1234,6,"Aaah my calls are safe. It was never in doubt. NOW I can sleep well. ( I always do, because I have a weighted blanket!)"
2020-01-21 07:59:52,dungbat83,3,I hope oil keeps dumping. I have 2 short calls and a straddle
2020-01-21 07:58:27,23therealme23,7,Imagine all the bears right now sleeping thinking that they will wake up to gold tendies 😂😂😂
2020-01-21 07:58:08,greentea45,3,"lol gold now red
all precious metals dumping not sure why"
2020-01-21 07:57:44,dungbat83,5,Huge red on metals. Recovery should be real
2020-01-21 07:57:28,shmowker,3,"Gap closing, bears are commies, virus is fake and gay"
2020-01-21 07:56:29,ch1p_skylark,4,"No reason to be scared right now, even if we open red b/c of random BS the admin can always boost us with some phase 2 talk"
2020-01-21 07:56:19,27onfire,2,Aight.  Goodnight retards.  I'll see you in the morning when I am swimming in a lagoon full of tendies or making an appt to get a zoloft prescription.
2020-01-21 07:53:14,wolfenstein1998,2,Are futures red because of Moody’s downgrade or the virus
2020-01-21 07:52:47,Evie_Chandler,2,"What earnings are y'all playing this week?

Thoughts on NFLX? Bullish or bearish?"
2020-01-21 07:52:34,23therealme23,3,Hang seng on a drill mission
2020-01-21 07:51:33,Cnastydawg,1,"Peloton new bike trials, should I order one?"
2020-01-21 07:45:09,27onfire,13,"I fucking love this sub.. every 3 days futures simply touch red, sometimes they dip 1.5-1.75-1.99 percent and 80 percent of us freak the fuck out.. claim the end of the world is nigh.. then just as we start sharpening our knives and drawing our last bath the bears come out of their 10 plus year hibernation and tell us 'everything will be okay.. join us.. you shall soon see the light, it is our time for glory.. we told you this day was coming soon' then 9 minutes later sometimes 191 minutes later futures turn green and people rejoice and act like they did the day they lost their virginity at 27 years old.. that of a man in complete relief."
2020-01-21 07:45:05,winkerpack,5,"Good night, love you"
2020-01-21 07:39:23,greentea45,3,"OMG. DID ANYONE ELSE SEE THAT PALLADIUM CRASH

i think that /ES pump was related"
2020-01-21 07:38:49,dungbat83,2,That's a lot of volume
2020-01-21 07:38:35,YangGangBangarang,5,"Prematket in 82 minutes.

SPY SBGL and SPCE to mars"
2020-01-21 07:38:13,winkerpack,3,Why are you still awake. Wtf
2020-01-21 07:37:09,RobRex7,3,Futures recovering Les go
2020-01-21 07:36:53,Master531,3,u/love2fuckbearasshoe I’m jumping in on the $12 dividend train
2020-01-21 07:36:07,teh_longinator,2,"Selling all my pending medical, going balls deep in weed.
Gonna turn some quick flips this week and hopefully get back on the medical before it makes an upswing"
2020-01-21 07:35:42,YangGangBangarang,6,"#It’s been a loooong day, without you market.  And I’ll tell you all about it when you open again."
2020-01-21 07:35:37,High-__-there,1,BA supply chain is gonna get rekt
2020-01-21 07:35:24,Mothyzx,6,DON'T LOOK NOW!! IT SEEMS THAT PPT IS DOING IT'S MAGIC. GREEN BY OPEN!
2020-01-21 07:35:20,dungbat83,4,Even gold is dying
2020-01-21 07:34:37,ThatNewNewNewGuy,7,Recovering green by open. See you all in the morning.
2020-01-21 07:34:26,greentea45,6,"maybe this recovery is real, gold going down too

did china find the cure?"
2020-01-21 07:33:48,Muntberg,5,HAHA ALREADY RECOVERING
2020-01-21 07:33:30,27onfire,4,Remember in 489 minutes when the market opens and your portfolio rockets or goes boom boom down it was is and always will be **priced the fuck in**.
2020-01-21 07:33:08,chodmode2,5,YASSSSSS YAASSS BOTS OBEY YOUR INDICATORS AND FOLLOW THE BIG  GUY WHO JUST BOUGHT A FUCK TON OF FUTURES
2020-01-21 07:32:52,dungbat83,3,Whew closed my /es put as a hedge for 80%
2020-01-21 07:32:05,YangGangBangarang,3,Is the recovery starting?  Depression over?
2020-01-21 07:31:28,GeneralGay421,1,"If Boeing drops the MAX completely and designs a new aircraft entirely, would you even fly on it?"
2020-01-21 07:31:12,dungbat83,3,Bears dying already
2020-01-21 07:29:30,,5,Holy fuck someone big just stepped in
2020-01-21 07:29:29,oregon_forever,1,What's the smart watch with best battery life?
2020-01-21 07:27:39,dawhizkid,2,Recovering 👀
2020-01-21 07:27:10,spycall420,1,Dow futures...down to 29100...this is all just a dream. I need this like a hole in the head.
2020-01-21 07:25:34,richy7600,7,"NETFLIX is adding studio ghibli films!

LOnnnngggg calls boiiss"
2020-01-21 07:22:40,weed_stock,3,Gay Powell and his PPT probably gonna step in soon.
2020-01-21 07:22:35,winkerpack,1,1
2020-01-21 07:18:22,,2,Imagine buying European stonks yesterday when they are retesting 13 yr or 20 yr old highs lmao
2020-01-21 07:18:18,Regjohn,3,I hope the china zombie apocalypse doesn’t spread to the US
2020-01-21 07:16:02,thepagemasterT,8,Hopefully this virus is meat based so my BYND calls moon
2020-01-21 07:14:15,jakedasnake011,9,"How the fuck have I never seen this? This is the best history lesson I've ever seen.

[Retard Day Traders - The Insanity of r/Wallstreetbets](https://www.youtube.com/watch?v=h8Mme_UKD8k&t=)"
2020-01-21 07:13:17,svpa3991,2,Sheeeeet is it time to buy puts now
2020-01-21 07:13:06,ItsDijital,4,"I wanna open a bar brokerage. Like it's a bar but you can instantly deposit money into an account we give you. Just give cash to the bartender or venmo us or some shit. Since everyone goes to the bar at night you can trade futures.

Basically a casino but it's not gambling because we are a ""brokerage""."
2020-01-21 07:12:26,FishPenut,2,"The guy posting about not drinking water to edge his piss is legit retarded, read thru his profile."
2020-01-21 07:12:03,Nomadic_Marvel07,1,Did you know? That if you are paying for a streaming/cable/dish TV service 40% of that money is going to Disney..  long Disney
2020-01-21 07:11:46,webulltrade,3,HSI gonna get interesting if 28k doesn't hold.
2020-01-21 07:10:51,WallStreetBitch,3,Stores in China fully embracing the opportunity of selling 😷 for the virus. You smell that? It’s the smell of fear and capitalism.
2020-01-21 07:08:40,JerseyFlashBoys,0,lmao fook
2020-01-21 07:07:40,winkerpack,1,🅱️all 🅱️ighter 🤭🤭🤭
2020-01-21 07:07:36,,6,"If we open red, buy atm spy calls 3 weeks out. If we open green, atm amd call fd and buy atm spy calls 3 weeks out if we drop .02%. If we open to hell on earth because of resident evil shit in china, lmao fuck"
2020-01-21 07:07:17,1se,3,Tonight I am sad
2020-01-21 07:06:03,austinblacknj,2,I’m having a hard case of insomnia tonight
2020-01-21 07:05:47,greentea45,2,"china is crashing
this year it is year of the mouse
=buy DIS puts mouse is going down?"
2020-01-21 07:04:25,theycallmeryan,6,Now this is pod racing
2020-01-21 07:04:08,greentea45,2,"welp, definitely gonna see Dow 30K before HSI 30K"
2020-01-21 07:03:35,oregon_forever,3,I don't think the drop has much to do with the disease in China. It is probably a technical sell off since markets have been extremely overbought for the last week.
