date,author,score,body
2020-07-27 05:24:36,lostinrabbithole,7,is there a site where you can just type in a ticker and it'll give you the next earnings date? why do they make it so hard fuck
2020-07-27 05:24:34,subnative1,7,NASDAQQQQ
2020-07-27 05:24:34,Sam_Handwich69420,2,You bears just don’t get it. My friend is a sales rep at SPY and he said they fuckin crushed earnings this quarter. Good thing you bought puts though >!🤡🤡🤡!<
2020-07-27 05:24:32,Cnastydawg,6,"The amount of chat room shitposting for signals is now ridiculous on twitter. Sometimes I used it to get other ideas and confirmation bias, but literally every tweet with a ticker like spy is just “WE HAVE THE BEST SIGNALS WE SAID THIS A WEEK AGO. SUCK MY ASS IF YOU DONT JOIN MY CHATROOM FOR $999.97 A MONTH” shits annoying bruh can’t wait for the next crash to wipe people out so this shit can stop."
2020-07-27 05:24:06,magadavixt,2,You guys holding SLV or selling at open?
2020-07-27 05:24:04,Stockengineer,10,Damn tim Apple going to bring me to tendietown
2020-07-27 05:23:47,Throwawayeconboi,7,"Hang Seng red, U.S. stonkies green? What is this sorcery"
2020-07-27 05:23:41,GBAgency,13,"for my move tomorrow, I'm gonna overpay for silver at open then watch it tank or go sideways until weds then sell at a loss. when it goes back up on friday I'll buy more. rinse and repeat."
2020-07-27 05:23:26,LePootPootJames,5,Vagina-shaped recovery
2020-07-27 05:23:21,howboutthemgators,7,Cash Gang has been a losing position so far today and the markets aren’t even open
2020-07-27 05:23:19,ShawnHans007,5,"plunge protection team drives in cybertrucks and chevy tahoes

drill team 6 takes the bus"
2020-07-27 05:22:49,BigHouse5,8, Alexa play Wiz Khalifa - Black and Yellow
2020-07-27 05:22:46,nosalute,1,"Come on Euororich ya'll dumped for 3 months straight, take us to tendie town."
2020-07-27 05:22:22,pittmastiff,7,Always buy calls on red days
2020-07-27 05:22:10,LoveandRockets,2,Looks like Garmin is getting back up. There goes my move tomorrow.
2020-07-27 05:22:07,indonesian_activist,-2,"🏳️‍🌈🏳️‍🌈🏳️‍🌈🏳️‍🌈 BNN Bear News Network 🏳️‍🌈🏳️‍🌈🏳️‍🌈🏳️‍🌈

CNN Confirms black bear sightings, Top is in

[https://edition.cnn.com/2020/07/25/us/huge-black-bear-in-pool-trnd/index.html](https://edition.cnn.com/2020/07/25/us/huge-black-bear-in-pool-trnd/index.html)

🏳️‍🌈🏳️‍🌈🏳️‍🌈🏳️‍🌈🏳️‍🌈🏳️‍🌈🏳️‍🌈🏳️‍🌈 🏳️‍🌈🏳️‍🌈🏳️‍🌈🏳️‍🌈🏳️‍🌈🏳️‍🌈🏳️‍🌈🏳️‍🌈🏳️‍🌈"
2020-07-27 05:21:53,GBAgency,-1,"cash gang not a bad mafia to be in this week.   


but fun is happening with FUV 8/21 7.5c. Earnings 8/13.  


And cash gang prally smart gang until weds"
2020-07-27 05:21:51,throwaway10k10k10k,0,"Funny how the boomers stopped caring about balanced budgets & the national debt once they got close to dying of old age to focus their efforts on ending abortion, as if they're religious virtue signalling."
2020-07-27 05:21:30,LargeFatherOrtiz,12,Time to fomo silver at open
2020-07-27 05:20:47,Daosim,5,My 4K of nkla puts say it’ll stay red on tmr
2020-07-27 05:20:09,dvnonewlands,3,Can PPT demolish drill team six?
2020-07-27 05:20:03,purple99x,2,Add to my stake in USAS only 8 bags to go before it reaches the level it was last time metals were this high.  Also SILV about to put in work.  Both of these consolidated last week and ready to rip tomorrow.
2020-07-27 05:19:24,RandyCrane17,-16,"Some retard is running around Downvoting everyone.  Show yourself, coward!"
2020-07-27 05:19:20,bigguccisaso,4,Alpha Pro Tech APT APT APT CALLS!
2020-07-27 05:19:02,funkin1224,1,I will sell my 7/31 calls at open. Lets see if it happens.
2020-07-27 05:18:55,tomtom6400,15,Silver 25 by open
2020-07-27 05:18:54,Revolant742,10,"July 29th. 8:00 am.

The Dollar has continued to crash. In anguish, Jerome Powell has stripped naked, his body profusely sweating, and curled into the corner of his office. His secretary runs in after hearing his sobs echo throughout the halls of The Fed.  She lets out a shriek of terror. Powell begins to repeat the same phrase over and over but its muttered and his secretary can barely hear. It sounds something like...

""We have to raise rates. We have to raise rates. We have to..."""
2020-07-27 05:18:37,sisev,6,Apha 🌝
2020-07-27 05:18:30,GBAgency,9,do not short boston beer. very bad gay bear. bad. bad bear. broke bear. do not short boston beer.
2020-07-27 05:18:30,BubbleTeaExtraSweet,12,"This FOMO is making me fidgety , missed the boat for TSLA, sure as hell ain't gonna miss the SLV boat  


Hi Ho Silver! Show me the way Lone Ranger!"
2020-07-27 05:18:25,tsaullgoodman,9,"Just checked, futures still green. Goodnight y’all"
2020-07-27 05:17:54,neutralpoliticsbot,1,Alexa play Dolly Parton - Silver and Gold
2020-07-27 05:17:35,toomuchgoodstuff9,8,"Yall ever try and be a quirky autist who gambles on a direction that the current market sentiment doesnt agree with, because you actually believe ""all these people cant be right"" and then lose all your money..."
2020-07-27 05:17:34,cozigang,1,so snap is going to 30 this week right?
2020-07-27 05:17:33,purple99x,5,"Sit and hold my portfolio of 30% silver, 25% gold, and 25% junior silver and gold miners and go fishing"
2020-07-27 05:17:29,somanychins,1,Not a lot of AMD talk tonight. Is that rocket about to stall out?
2020-07-27 05:17:21,shadowfx23,-3,Gonna short the fudge outta Boston Beer market open...
2020-07-27 05:16:41,RandyCrane17,0,"Do we think this working from home shit will last forever or even expand? I’d love to keep my cushy, high paying NYC job and move to like Vegas or Miami working from home in a sick crib with a pool."
2020-07-27 05:16:23,Jer_bear_716,10,"well right now what concerns me is SPY option activity is 1:2 calls to puts, there are almost 2 times as many put contracts than call contracts"
2020-07-27 05:15:54,RareRationalFan,27,Everyone please shut the fuck up about SLV we’re gonna give it the WSB jinx
2020-07-27 05:15:52,GBAgency,10,"had covid too  


wasn't shit.  


kinda great now"
2020-07-27 05:15:32,TrenAndOptions,10,"My dream as theta gang for this week to sell so many puts: 

SBUX to $70
BA to $160 
MGM $13-14
AZN & GILD stay where they are 
INTC tank more with good AMD earnings"
2020-07-27 05:15:08,Dontlovemoney,5,"Got to go fishing in the morning, hope my options don’t take seeing as I might not have service . Good luck tomorrow boys. 🤙"
2020-07-27 05:15:07,TheTigersAreNotReal,9,"Damn the dollar is down a ton. That’s typically good for stocks, right?"
2020-07-27 05:15:00,RozarioGroup,6,About 60 days ago I was COVID19 positive. It helped me become sober and stop drinking. Instead of drinking at night now I eat ice cream. How do I stop that?
2020-07-27 05:14:11,bobstaman,8,BILL NYE THE DRILLIN GUY.....
2020-07-27 05:14:11,astafe,9,Tesla at 1400$ hard to believe
2020-07-27 05:13:26,dnesdnal17,1,"What if with the whole remote going away thing, WeWork had the right idea, just the wrong timing and we’ve been clowning them. Lmao"
2020-07-27 05:13:18,GBAgency,4,"gaza stripper  


Big call rippa  


Load you in his rifle shoot you out his little dipper"
2020-07-27 05:13:13,Strangerdanger8812,1,Wmt 135 tomorrow...sam called me
2020-07-27 05:13:13,RandyCrane17,-3,Is SLV this weekend’s AZN?
2020-07-27 05:13:04,ShawnHans007,4,ice cold bath time.. puts on my wang
2020-07-27 05:12:33,2Mango2Tango,2,"This is why aapl is going to keep climbing. A $129 cable and you know people will buy it 

https://www.reddit.com/r/gadgets/comments/hy8xy8/new_thunderbolt_3_pro_braided_cable_shows_up_on/?utm_source=share&utm_medium=ios_app&utm_name=iossmf"
2020-07-27 05:12:29,StreetSweepingKing,11,I remember my bad trades more than my good ones.
2020-07-27 05:12:17,GBAgency,0,"""da gaza stripper"""
2020-07-27 05:12:16,RPskillet,10,Can’t believe I was already holding positions in a wsb meme stock before it made a huge move. God bless you slv
2020-07-27 05:12:09,somanychins,2,Why is HKD pegged to the USD? And how does that work?
2020-07-27 05:11:57,waylon106,1,Unless more gyna fud we’ll pump
2020-07-27 05:11:40,TrenAndOptions,4,Well you guys may not believe in these green “fake and gay” futures but VIX certainly does
2020-07-27 05:11:30,I_KNOW_EVERYTHING_69,2,need a new nickname preferably bad ass was thinking Gaza strip or something hardcore like that.
2020-07-27 05:11:18,throwaway10k10k10k,1,"Holy cow, that's crazy.

https://en.wikipedia.org/wiki/Murder_of_Bobbie_Jo_Stinnett

Crazy woman hacked a baby out of a womb to make it hers.

--------------------------------------------------------
What could we do with gold if it was as cheap as pig iron due to space mining?"
2020-07-27 05:10:53,lucasandrew,12,"Calls until 3220, then puts until 3205, then do whatever you want because anyone who gives you predictions like this are just masturbating to their egos."
2020-07-27 05:10:43,AdmiralSnakbar,3,Futures red by morning
2020-07-27 05:10:43,lululemonhead,9,Gonna take all the silverware from work and sell it ON MARKET
2020-07-27 05:10:35,oregon_forever,16,"Fuck, it's almost August. The summer barely started and it's gonna end soon."
2020-07-27 05:10:20,Tiberius08,5,"There are clearly 2 different zerohedge guys, 1 who posts articles about how covid is a diasaster and will kill everybody and the other who posts articles saying covid is nbd and a total conspiracy to hurt trump. Its funny to watch them duel lol"
2020-07-27 05:10:18,Not_reddits,14,Why does everyone keep talking about the Saturn Launch Vehicle? “SLV” launched quite a few decades ago idk what the big deal is about it?
2020-07-27 05:10:08,fyuce,10,"Buy 100 SLV shares and sell CALLS, you’re welcome (:"
2020-07-27 05:10:05,GBAgency,1,"FUV is the new and fun ev play. When y'all get your trump $420, fuck NIO. FUV 8/21 7.5c"
2020-07-27 05:10:05,PaperShark0001,5,"Gn fuckers, u sexy af if u reading this. Make some money tmr by selling crack!"
2020-07-27 05:09:35,alexanderflynn81,5,Why everyone so hyped on silver
2020-07-27 05:09:32,fomhau,3,Gold & Silver
2020-07-27 05:09:30,Soon2beonthestreet,2,"Currency nerds, DXY drilling is good for stocks/shiny things/digital shiny things/T's

Does the weak dollar cause these assets to go down at a certain level or rotate into foreign/EM markets?"
2020-07-27 05:09:00,wassupobscurenetwork,2,Sold my gc position earlier and am really regretting it..I actually bought /es after that and am up a whopping $25 instead. Fuck me
2020-07-27 05:08:39,RyFba,8,If spy opens down buy calls. If spy opens up buy puts. Whatever you do get rid of dollars cuz those things suck now
2020-07-27 05:08:31,BubbleTeaExtraSweet,5,What's the cheat code to convert my World Of Warcraft gold into real gold? The Konami code ain't working
2020-07-27 05:08:31,lacasabatlot,2,we are entering levels of priced in that shouldn't be possible
2020-07-27 05:08:26,oregon_forever,6,VIX is dropping again. Good riddance.
2020-07-27 05:08:17,DonCorleone47,20,Who else puts too much money into calls that fail and not enough money into calls that moon 😒😒 smh
2020-07-27 05:08:15,winnning007,1,Calls until 326.9. Unload and wait. Prob will get some puts to hedge at that area until 327 is support.
2020-07-27 05:08:11,gdsmonster,1,BAC 999C get in quick
2020-07-27 05:08:01,Frijolesenyourmouth,2,"I dont care what direction this kangaroo market goes, but if Roku could just go out of business tomorrow, that would be just great and restore some faith that there is truth in this market."
2020-07-27 05:08:01,humblepharmer,1,"My prediction for this week: huge swings both ways from earnings, stimulus and Covid news, but SPY closes around 230."
2020-07-27 05:07:27,jbnhrpr,5,gains
2020-07-27 05:07:19,toasted_t_rav,22,"One time a tinder girl came to my house and we were boozing. I said I had to pee. 

She told me to pee in her mouth. She actually wanted me to pee in her mouth."
2020-07-27 05:07:14,Mittens1987,9,"You guys actually have positions that didn't already expire Friday?  I won't even buy anything until Thursday afternoon, more likely to get the good gains."
2020-07-27 05:07:08,drkgla,5,tanker gang has alien technology
2020-07-27 05:07:05,neutralpoliticsbot,5,ok how much metal is in my chair boys lets go
2020-07-27 05:07:02,Stonksradamus,2,"Silver and gold, silver and gold 

Ev'ry autist wishes for silver and gold

How do you measure its worth?

Just by the tendies it gives here on earth

Silver and gold, silver and gold 

Mean so much more when I see 

Silver and gold options

On ev'ry autists’ screen

For millions of girls and for millions of boys

When Green Monday is here

The most wonderful day of the year!"
2020-07-27 05:06:54,EatTacosDaily,7,Where my ACI gang at?
2020-07-27 05:06:34,Whatisthisnonesense,10,"alright all of the retards in here being so bullish silver has me fucking worried now, but fuck it I aint selling shit until we at least hit 40+"
2020-07-27 05:06:19,ProOrlando,0,"I know we don’t talk about it much...but the “coins” are about to explode 🤫

Typical downvotes..smh"
2020-07-27 05:06:05,ShawnHans007,6,will it be a green and glorious week
2020-07-27 05:05:59,Sayter,20,cocaine should be written off as like a business expense.
2020-07-27 05:05:35,lostinrabbithole,1,"Considering some ATVI 8/7 81C, how have their games been faring during Coronavirus?"
2020-07-27 05:05:30,96reltihleih,5,"Need some advice peeps: Starting a business (family owns multiple)  and contributing to the economy or passive investments only.

Edit: I just want to say the money I have earned to start a business myself is entirely my own."
2020-07-27 05:05:13,Triumvus,2,anyone planning on holding PINS FD’s through earnings?
2020-07-27 05:05:08,us1549,3,Any Intel bagholders here? I'm 1k shares at $52
2020-07-27 05:04:21,SquintsRS,-9,Ain't no stimulus getting passed this week. You think the Liberals will just agree right away? Hah
2020-07-27 05:04:15,GBAgency,6,Holy shit. China just announced 61 new corona cases! That's like... nothing. At all. 1.385 billion people and Bloomberg is pathetically spinning 61 like it means anything.
2020-07-27 05:04:14,JustLookingAroundFor,13,When will trump just start tweeting tickers each morning at six am
2020-07-27 05:03:49,griswalt7,6,Another beautiful week ahead of us. Up or down we are all losing money in some way.
2020-07-27 05:03:42,cat-spores,11,Hot young singles in your area willing to give you insider info for the low low.
2020-07-27 05:03:26,PalekSow,3,Are you obligated to buy a silver Lambo if you made the money on silver?
2020-07-27 05:03:25,wsb_roulette,18,Does anyone know when SLV reports earnings? I can't find it anywhere.
2020-07-27 05:03:22,,1,stocks up and gold up. more logical action in the markets
2020-07-27 05:01:58,nfa1234,0,Anyone ever fucked a grandma? (Your own doesn't count)  Also when you get old do you start finding old women attractive?  Like if you are 80 do you think a 70yr old is a hot piece of ass? Or do you just get what you can?
2020-07-27 05:01:32,AssistRegMngr,9,"We had experts on this sub predicting silver crashes right before futures opened, but they dieded"
2020-07-27 05:01:29,rmft4660,7,You haven’t truly lived until you’ve YOLO’d Lean hog weeklies
2020-07-27 05:01:08,OG_KarBone,7,"If Donald Trump ran a 40yard dash, what we thinking his time would be? I know for a fact Big Don putting up 225 for 20+ reps on bench too"
2020-07-27 05:00:48,xxshadowcavexx,-6,We’re gonna open red aren’t we...
2020-07-27 05:00:41,red_man_dan,8,"A Dude just stumbled out of the Airbnb across the street from my house screaming, slammed a brown bag with a liquor bottle in it on the street and drove off"
2020-07-27 05:00:41,SquintsRS,1,Bro watch this shit flip over
2020-07-27 05:00:36,BrbPoolOnFire,3,Amazon earnings worth playing?
2020-07-27 05:00:15,lacasabatlot,1,Are V and MA gonna get raped has hard as AMEX? Why or why not?
2020-07-27 05:00:08,MrRigobertos,29,"When does Trump tweet :

 “Silver is doing GREAT. Lots of hard working Americans love silver.  Silver miners, best Americans out there. I know some very personally...PORTLAND LAW AND ORDER”"
2020-07-27 04:59:59,nosalute,10,Crazy how the oil crash was perfectly timed with the peak coronavirus scare
2020-07-27 04:59:48,RIZup18769,6,"Screw the perfect people, fuck they all look the same. Gn."
2020-07-27 04:59:32,SkyBIueDreams,8,"I’m going to bed. If this somehow finds a way to reverse by the time I wake up, I will mentally snap."
2020-07-27 04:59:29,toomuchgoodstuff9,6,Not sure how some of yall can watch futures overnight. Not a vibe
2020-07-27 04:59:26,LeVraiLomepal,1,iPhone >
2020-07-27 04:59:25,vouching,7,"Sector rotation from tech to weed 😎

I hope. 

Please. 

Let me have this."
2020-07-27 04:59:21,red-chickpea,1,Man these secret reddit elite subs are incredible
2020-07-27 04:59:14,rmft4660,4,Theta gang this will not be your week
2020-07-27 04:58:32,howboutthemgators,8,The weakening dollar has made the €uropoors the €urorich
2020-07-27 04:58:14,Dougiejurgens2,13,I’ve been a member of at least 100 gangs since joining wsb 📈📉♿️🔫🔫🔫
2020-07-27 04:58:03,LagoArgentino,1,Alexa Play All Alone by Blind Witness
2020-07-27 04:57:43,ShawnHans007,15,your girlfriends a lean hog
2020-07-27 04:57:28,MiltDavis,9,"The first time a President ever moved a market live via mass communications was during the first ever live satellite simulcast in 1962. 

Walter Cronkite led a ‘world tour’ that showed— for the first time ever— live shots from different nations across the world in a choreographed debut of the first  communications satellite. 

President Kennedy allowed the telecast into his press briefing, off limits typically, where he welcomed viewers from across the world before they listened in as he explained he wouldn’t be devaluing the dollar to stem the tide of gold. 

The dollar soared and the value of gold fell across the world."
2020-07-27 04:57:27,neutralpoliticsbot,18,"by the time we get the next $1,200 stimulus check we will only be able to buy 1 beer with it."
2020-07-27 04:57:21,NYGiants1532,6,"Bullish for SQ for 2nd round of stimulus? More for Cash App? Or priced in? I'm the retard who still has his calls, up 2500% (Edit: I'm holding through earnings that's why I didn't sell)"
2020-07-27 04:57:20,acesfullcoop,8,All in SPY call at open?
2020-07-27 04:57:04,winnning007,4,322 is a bitch until it’s support and not resistance.
2020-07-27 04:56:58,LDeezzy15,4,Lean hogs down 1.15% 😳😳😳
2020-07-27 04:56:39,dvnonewlands,5,"Remember  🌈🐻 JPOW has infinite ammo & can ""print money digitally"" not only is the game rigged against you it always has been"
2020-07-27 04:56:30,rmft4660,2,"Separate Variation, where are you now?"
2020-07-27 04:56:28,glov,2,"Not a single person here gave a flying fuck (nor even knew they existed for that matter) about $FE, until they caught a case. Suddenly you got WSB's top analysts talking about how this company is best poised to cure cancer. Vultures"
2020-07-27 04:56:16,PrezzNotSure,1,My 11 year old asked me to open her an account so she can buy $SNAP... if she's anything like me you should short it... idk tho
2020-07-27 04:56:12,lgdamefanfanfanfan,1,#
2020-07-27 04:55:53,lucasandrew,5,"If LUV climbs tomorrow, I'll be 100% into futures and finally out of equities. Until the next earnings play drags me back in, that is."
2020-07-27 04:55:34,samaritan1331,-8,Yo my man u/Sayter wassup? What do you think is tending? Just wanna chat lol
2020-07-27 04:55:14,Daertrider,12,This place is excitable right now. Almost like it was in April. Digging the mood.
2020-07-27 04:55:09,sheboftek,11,Monday is always green
2020-07-27 04:54:35,mdudigam,2,PFE any guesses for earnings? 7/28 ? $40 or $30?
2020-07-27 04:54:33,purity08,9,"Europoors, pop out that big green dildo"
2020-07-27 04:54:30,Post_Austin,6,What if its the same 100 people in here making 10k plus comments every night 😂🤣
2020-07-27 04:54:20,PalekSow,1,Guys is it time to finally take JNUG out of the banished box?
2020-07-27 04:54:16,JustLookingAroundFor,6,I’m dyslexic so I read bears as beans
2020-07-27 04:54:15,rmft4660,16,Where were u when USD was kil
2020-07-27 04:54:10,flamintuna,7,Green futures means red day
2020-07-27 04:54:00,ThisIsBiggy,0,So I can confidentially say that it’s not too late to hop on gold and silver
2020-07-27 04:53:41,dameLillardManiac,7,SLV bagholders rich tmrw -\_\_- why didn't i buy the dip
2020-07-27 04:53:27,oregon_forever,4,"If you looked at hotel prices in Oregon Coast, you'd think the economy is booming. Even Motel 6 rooms start from $200 a night with decent hotels starting from $350 and hotels are reporting 98% occupancy rate at the moment."
2020-07-27 04:53:22,Nomadic_Marvel07,1,The great thing about the Asian market is the EOD pump
2020-07-27 04:53:19,ukfan758,27,"A reminder that the next stimulus check will still probably exclude dependents, which is about 75% of this sub."
2020-07-27 04:53:15,skrrtingallday,5,Literally all the bears that were talkin when futures opened are quiet as hell now
2020-07-27 04:53:14,waylon106,0,Gyna fud diminishing ?
2020-07-27 04:53:04,nosalute,6,Where were you when USD was murked?
2020-07-27 04:52:54,neutralpoliticsbot,13,#go outside start digging for metal!!!!!
2020-07-27 04:52:48,lostinrabbithole,3,"Can someone explain how JPM manipulates Silver? Seen some talk here that suggests mining companies are the way to go to avoid manipulation by JPM, but don't get it"
2020-07-27 04:52:24,PaperShark0001,9,Anyone else stalk people or am i just weird
2020-07-27 04:52:19,MarksVette,3,The only time stonks will go up is when JPow takes the purple pill....he's probably having a good night's sleep tonight and tomorrow you'll see him looking like a playboy on the podium. Stonks to the mooooooooooon!
2020-07-27 04:51:40,catholic_cowboy,9,The bears finally went to sleep. You guys should of heard them yapping earlier.
2020-07-27 04:50:54,StreetSweepingKing,4,Cats or dogs?
2020-07-27 04:50:47,2Mango2Tango,12,Ready for a big green day
2020-07-27 04:50:46,Gypsykilla,12,Hopefully tomorrow is green so I can eat
2020-07-27 04:50:41,bearsofberenstain,10,"USD down, GLD up, SLV up, Stonks...?"
2020-07-27 04:50:21,neutralpoliticsbot,4,europoors about to laugh at our weak dollar aren't they. Its just cold outside! Ok?!
2020-07-27 04:50:10,jz103,1,"Lol yes, holding a few AMD puts and then the plan is to move bigly into FE"
2020-07-27 04:50:10,Michael12390,3,My balls itch
2020-07-27 04:50:05,RIZup18769,3,That one girl that says no on that discovery card commercial am I right?
2020-07-27 04:49:29,IAintSelling,-1,Wonder if there will be less buying from retail autists now that their $600 unemployment benefit is over.
2020-07-27 04:49:00,jeromepowel,53,"Attention. Jerome Speaking.

Bears, you may want to reconsider your positions tonight. 

I am about to turn on the printer at 9:30 a.m. EDT. The printers have been serviced over the weekend and a fresh supply of ink and paper have been procured. 

  
Godspeed Bull warriors.

Stonks, only, go up."
2020-07-27 04:48:12,WillyGeyser,10,Alexa play Lazy Eye by Silversun Pickups
2020-07-27 04:48:01,Huey_Long_Schong,3,Any European here in this sub? Do you need a Schengen work VISA prior to or after you have gotten a job offer from a company based in the EU? I'm totally not hypothetically planning to earn top Euro to then convert it to the devaluating USD lol
2020-07-27 04:47:51,OG_KarBone,14,Anybody ever invite a girl over from Tinder and fuck? I’m worried this hoe may try and steal shit like my car or weed when I get up to take a piss or  something
2020-07-27 04:47:26,sisinana,5,I have an odd feeling there is going to be a run on the USD over the next two days.
2020-07-27 04:47:25,BeneficialHeart8,2,Could someone point me to a broker that’s quicker with releasing funds? Sent a transfer to etrade thurs and they haven’t even pulled it out yet smh
2020-07-27 04:46:44,glov,15,"As much as I'd love for us all to win here, the majority just don't. Strong sentiment here is silver will continue to take off, everyone's in on it. Seems logical that it'll fail, because there's no way this many of the ""little guys"" get to eat. Real play is probably puts on silver/gold, but I'm not even going to fuck with it. Hope I'm wrong and you all get to eat, but that's just not usually the case realistically.

TL;DR $ACI 17.50 calls 8/21"
2020-07-27 04:46:32,PregnantPickle_,36,Yeah I’m gonna need a 30 minute press conference where Donny tries to describe the UFO tech in his own words
2020-07-27 04:46:11,ShawnHans007,9,futures greener than my mexican neighbors lawn. he owns a successful landscaping company
2020-07-27 04:46:04,Tao-Lee,5,"Calls on that new SPAQ making the Sneezy XL, a 45 HP with antilock brakes.... It's Sneezy, deezy, McDeluxe."
2020-07-27 04:46:02,barelyreadsenglish,6,"If there was a week to hold vxx calls has to be this one right? Stimulus being negotiated, big tech earnings, tech ceos going before congress, dollar fuckery, china fuckery, fomc meetings and jpow speaks"
2020-07-27 04:45:55,sfsfsfsfsf1,7,"so protesters have started burning federal court buildings 

when the Fed Reserve 🧐"
2020-07-27 04:45:53,neutralpoliticsbot,22,"All those guys that bought packs of quarters for years to hunt for silver ones are looking at their wives right now with the ""I told you so, Sharon!"" look lmao.

🥈🥈🥈🥈"
2020-07-27 04:45:23,MybellyYourbacK,2,"Is it possible all this recent UFO talk with ‘out of this World’ is us flexing on China with what we may or may not posses technology wise?  Either way, war with China or alien invasion....

 calls on RTX, NOC, LMT."
2020-07-27 04:45:19,toasted_t_rav,-2,Anyone in here listen to the wet jeans podcast?
