date,author,score,body
2020-07-27 22:51:30,Tomos1977,5,Lol precious metals are the way of the future...the US dollar is now monopoly money. Literally invest in gold unless you want to be stuck holding worthless paper and fiat currency. We're now Zimbabwe
2020-07-27 22:48:09,its_h12,3,I had low expectations for Walmart but holy fuck. 17 days of no movement. It would be above $140 if they launched Walmart+
2020-07-27 21:24:40,JimmyChill2020,1,"If silver and gold go up 1% tonight, I'm buying a boat"
2020-07-27 19:51:58,astafe,0,I’m up 1k on my eBay calls do sell or diamond hand
2020-07-27 19:49:11,Sidthepaulkid,1,Buy feathers at the ge for 2 gp and sell for 3
2020-07-27 19:44:57,Realmadrid712,1,should i hold to gold or sell?
2020-07-27 19:35:03,Tomos1977,1,Lol precious metals are the way of the future...the US dollar is now monopoly money. Literally invest in gold unless you want to be stuck holding worthless paper and fiat currency. We're now Zimbabwe
2020-07-27 19:16:20,astafe,2,Jump in to the eBay wagon already up 20%
2020-07-27 18:34:27,Throwawayeconboi,2,INTC CALLHOLDERS IN SHAMBLES
2020-07-27 18:33:58,Throwawayeconboi,2,Raise your hand if you thought AMD was gonna “correct” LMAOOO
2020-07-27 18:22:10,alphabravosix,1,Where’s the guy that said to laminate
2020-07-27 17:58:50,cyrilsuave,2,This market is so random. No more logical reasoning why it goes up or down
2020-07-27 17:38:11,maroonmagic2,1,Pretty new to options trading and I have a couple hundred laying around and debating CCL calls exp 8/14  with a 1.49 premium. Is this a smart trade imagining that carnival can be at 17 a share by then?
2020-07-27 17:09:18,Realmadrid712,1,long otm calls for gold and silver smart move???
2020-07-27 17:03:34,Mossed84,1,Why did Aphria moon and is it coming back down
2020-07-27 16:57:59,DogSplooge,1,Okay TSLA just go up a couple hundred more by Friday pls
2020-07-27 16:51:35,AlmightyHamster,3,Happy that I finally see some green in TSLA today but sad that PFE is going red again 🥺
2020-07-27 16:48:12,NoLimit315,1,True autist here repetitively buying at open
2020-07-27 16:28:49,moblo231,3,Kucklow needs to get his head checked
2020-07-27 16:27:33,SmokingOnTheBombHay,1,Waiting for apha er
2020-07-27 16:26:53,Ankel88,1,wasnt supposed to be some announcement by Munchy about... something today..? xD
2020-07-27 16:14:18,mexipill,5,"Is... is the whole US economy a ponzi?
Plz don’t die dollar-sama. I don’t think my country can survive you."
2020-07-27 15:47:29,Lightningm340,1,NVDA calls???
2020-07-27 15:36:20,gamechump,1,AMZN 2900 EOD?
2020-07-27 15:29:06,gravityCaffeStocks,2,hi
2020-07-27 15:28:57,gravityCaffeStocks,1,hello wsb synth listeners. there is a daily thread that wsb synth has not picked up on because it was created by a non mod.
2020-07-27 15:21:48,ragunaatr,1,*YOLO'ed* NVDA *$430 Calls for 8/7.*
2020-07-27 15:12:24,SullyBrr,1,UnderArmor gets a Wells notice and goes up 2%. Makes sense makes sense.
2020-07-27 15:01:40,StudentLoanBets,4,"Anyone else having problems with [WSBsynth.com](https://WSBsynth.com)? It's giving me the ""what are your moves tomorrow 7-27?"" feed"
2020-07-27 14:51:37,lucasandrew,1,The dollar is eating shit along with my short /6A contract. At least I have more money to deposit until this works.
2020-07-27 14:34:32,JonFrost,1,Woo up $20 on a CHGG call held for 1 minute. Big green day bois. 😎
2020-07-27 14:31:37,HeinekenCoC,3,Where the fuck is the new thread?
2020-07-27 14:18:01,arichnader,1,Carnival 🔥🔥🔥🔥🔥
2020-07-27 14:17:51,MrMango34,0,Are you not in aapl??
2020-07-27 14:14:35,pmcredit,1,"Mondays always green, usually a dip around 11.  That,s the time to jump in .  BTW, where is everyone, used to be 10 comments a second."
2020-07-27 14:12:30,MrMango34,1,Who in their right mind would buy nkla
2020-07-27 14:09:27,tryingtolearnitall,3,Dude UUP puts are good fucking plays now
2020-07-27 14:09:15,rankiba,2,ANOTHER FADE WTF
2020-07-27 14:06:31,Trillionaire333,1,Just woke up and Tesla and silver stay winning I’m going back to bed
2020-07-27 14:01:17,UpDimension,0,Ha
2020-07-27 14:00:42,DingleberrySquirt,2,"Up 900% on my $GLD calls I bought a few weeks back.

Now all in on $SPCE 26c"
2020-07-27 14:00:26,frzgg,8,"Bought $TSLA 7/31 $1600c for $10.10 this morning.  10 minutes later, they are at $22.52."
2020-07-27 14:00:03,SaltyKrew,1,TSM wtf
2020-07-27 13:59:14,billbrown96,2,ACI tanking because no guidance was released
2020-07-27 13:58:33,The_brave_potato,1,DM me if you can predict the market perfectly
2020-07-27 13:57:15,zSalsy,2,"Does anyone know when the stimulus will actually be signed/announced? 

They said today but didn’t specify"
2020-07-27 13:54:48,stonksupanddown,1,What’s the best way to check if a stock will get IV crushed at ER? Want to sell AMZN puts before earnings but trying to do some DD first
2020-07-27 13:54:39,lacasabatlot,1,VISA CALLS ARE FUCKING ME IN THE ASS GOD HLPE ME
2020-07-27 13:48:11,wild__illusion,1,Why is DBX tanking? Good time to load up on calls?
2020-07-27 13:43:29,LeoFireGod,2,So explain this.  I have a GLD call for 176. It’s trading at 182.50 rn.  My option is only worth 4.30. How???
2020-07-27 13:32:20,billbrown96,1,ACI tanking? What?
2020-07-27 13:27:29,bodhi24,1,Where is everybody?!
2020-07-27 13:26:01,RandyCrane17,1,Volume on the daily threads has dropped significantly. I feel like I’m talking to myself sometimes.
2020-07-27 13:25:08,SinatraC,1,Should I hold my 9/18 thru earnings this week or sell before? Not sure how hard I’ll get hit with IV since it’s a lil longer???
2020-07-27 13:17:51,UpDimension,-3,NE is all about Jeeps. You don't have a jeep in New England you are nothing.
2020-07-27 13:14:33,tsla-too-low-imo,8,TSLA price target of $7000 is too low imo.
2020-07-27 13:12:44,financethrowaway889,2,"I’m metal gang, what’s the opposite of GUH"
2020-07-27 13:09:51,IronManKillsThanos,2,We really dont have any mods that wakeup before 9 that could sticky a daily discussion thread? Wtf
2020-07-27 13:09:41,chessiechoice,4,Amd at 70 is so good looking
2020-07-27 13:06:07,heartstesler,2,"Trump National Security Advisor Robert O’Brien Has Coronavirus  

https://www.bloomberg.com/news/articles/2020-07-27/trump-national-security-advisor-robert-o-brien-has-covid-19"
2020-07-27 13:04:58,RandyCrane17,4,"Hey look, wmt is down again. Shocking."
2020-07-27 13:02:58,puckerMeBum,2,AMD defying all logic rn
2020-07-27 13:02:48,reditt84,2,Where is today discussion board ?
2020-07-27 13:01:31,billbrown96,2,ACI gonna moon? What's earnings
2020-07-27 12:57:40,RandyCrane17,-1,Why aren’t we mooning?
2020-07-27 12:55:20,ColdBoiGreg,5,AUY to $20 by September
2020-07-27 12:54:10,RealBullishcowboy,0,"Usa dollar collapse means vote of no confidence

Get out of Usa equities ...the dollar....gold surging as safe haven as tge value of the greenback tumbles

Take any profits and hide"
2020-07-27 12:50:31,ian_v_t,2,Note to self: Don’t be greedy and take profits
2020-07-27 12:50:02,Mrivera45,1,#What’s going on buy da DIP
2020-07-27 12:36:31,dragoniteVS,6,"Alright, got woken up at 5am to my dogs whining because a smoke detector battery died, and my wife screaming to kill a spider on the ceiling. How's your morning going?"
2020-07-27 12:32:18,LamboBy22,9,Green Day please lord my account can’t take another red day
2020-07-27 12:25:01,Ernest_EA,2,Look at that huge scamwick.
2020-07-27 12:24:20,Mrivera45,2,#Kss dip
2020-07-27 12:14:32,abramoam1,12,Monday mornings feel like Christmas mornings now when pre market is in your favor
2020-07-27 12:10:45,yeahman64,5,Before you go long on Ford/Toyota remember they could file for bankruptcy and restructure to suit electric car manufacturing if things get really bad.
2020-07-27 12:09:52,DepressedPeacock,3,I have so many regerts
2020-07-27 12:08:56,silverlink22,9,"Fuck it. Amazon calls at open. I’ll take the 1K loss on puts. Looks like a big day for NASDAQ. Switching to puts EOD though, stimulus reveal gonna be bearish af. 😈😈"
2020-07-27 12:08:00,gerjerb,-1,"i feel like theres a whole new wave of new retail investors. folks who wererent around in march and they april and they keep asking ""what good news is out there to make stocks go up?"" and i get it - i asked the same shit. but trust me, stonks only go up. invest in good companies, don't play a 90% options 5%equities 5%cash strategy like everyone here"
2020-07-27 12:06:52,TheCuriousKea,3,"GLD 9/4 $200 call let’s goo, hope I get a good premium for the gap up"
2020-07-27 12:01:35,tokyobob,3,"AGI Albertsons, talk about under the radar. Earnings this morning premarket. Opening's the time to hop on IMHO."
2020-07-27 11:58:50,seesaw32,9,It's wild to me that TSLA has a market cap 10x the size of Ford and I've seen 3 Teslas on the road here in the midwest in my entire life
2020-07-27 11:57:38,BallScratcher123,8,Is the stimulus announcement going to be a sell the news event?
2020-07-27 11:57:21,yolo_tron,0,Has anyone had copious in a TSLA?
2020-07-27 11:57:12,The-Hyrax,1,Too late to get into GLD and SLV?
2020-07-27 11:55:37,ddiddy171,3,Wasnt Gordon Johnson fired because he was too much of a 🌈🐻 on TSLA
2020-07-27 11:55:24,acornsuser,3,After careful consideration ive decided I woild like to finally buy amd calls
2020-07-27 11:54:21,blasianduuuuuune,5,How do y’all deal with your bad trades like selling too early and missing out on huge gains? Sold TSM and ACQ calls days before they popped and missed out on thousands. Guess I’m just here to vent into the ether
2020-07-27 11:53:06,ClevelandReaper216,2,"Does it ever make sense to close a short position on a vertical spread to try to maximize upside gains? Say you have call spread that's OTM right now but you think your long position will print.... does it make sense to buy out the short position or does it end up with too much cost to get out of it, and just sitting in the vertical position and taking the capped gain makes more sense?"
2020-07-27 11:52:19,Hurtem,2,Daily thread is up my guys
2020-07-27 11:51:06,scopolamine,2,"Daily thread is up:

[https://www.reddit.com/r/wallstreetbets/comments/hyqt0p/daily\_discussion\_thread\_for\_july\_27\_2020/](https://www.reddit.com/r/wallstreetbets/comments/hyqt0p/daily_discussion_thread_for_july_27_2020/)"
2020-07-27 11:51:05,RayCashIsTrashDalio,5,"omg TSLA entered phase 3 coronavirus vaccine trials!!!! and elon said tesla trade talks are going well!!!! relations with gyna very gud!!!! 


now pls go up my calls need some life"
2020-07-27 11:50:33,LanN00B,3,Jesus are all the litium producers going to moon this morning. I was looking at a few and don't like the premarket jumps. Should I wait until around 10 or 11 or just go for it.
2020-07-27 11:50:20,scopolamine,3,I have a joke about living in a country with a strong currency but Muricans won't get it.
2020-07-27 11:50:18,BULLSONYA,2,"The day you can buy something extravagant from stocks. Fucking do it, could have had my AMG GT twice and fucked myself. Trust me"
2020-07-27 11:50:07,jimmyolsenblues,1,Really hope $TSLA can be closer to 1480 on 7/31 not 1300.  So much pain.
2020-07-27 11:50:02,DadINeedMoreMoney,1,"Every dip being bought, calls at first dip can be a play for those cash gang"
2020-07-27 11:49:18,aerrreaa,3,I pray to God that apple can hold these damn gains until open. Top bad nearly 2 hours to go
2020-07-27 11:48:39,Trenchalicious,8,I'm buying silver calls at open. Get ready to get out of it everyone.
2020-07-27 11:48:32,jstromdabomb,1,"Holding GLD, SLV, INTC & AMD calls... Could they possibly all be green today?"
2020-07-27 11:48:26,Ale28297,2,Support for TSLA at $1375...more calls?
2020-07-27 11:48:00,waylon106,4,Spy calls at open
2020-07-27 11:47:18,Post_Austin,4,Silver baby yes keep going 😩😱
2020-07-27 11:47:08,Soon2beonthestreet,10,"TSLA put holders strutting with their nuts swinging out the bottom of their short shorts 

TSLA call holders wearing burkas giving dry handies at the back of the bus the hairy Arabs to pay rent"
2020-07-27 11:47:01,swypeprophet,5,"It’s refreshing how much the market gives no fucks. It makes me not either , I am a autist to everyday life now  

People dying , unemployment up, $ going to shit ,  companies going bankrupt."
2020-07-27 11:47:00,SpiralSummitGames,7,I think I'd rather join theta gang than keep playing sector hot potato
2020-07-27 11:46:46,,1,Anyone here know anything about $yuri?
2020-07-27 11:46:17,Trenchalicious,13,automod more worthless than puts
2020-07-27 11:45:56,RayCashIsTrashDalio,10,"tsla red for an entire week. market is green, tsla is still red. market is red, tsla is still red. the one day the entire market circuit breakers down 7% is when tsla finally goes up 20% in a single day"
2020-07-27 11:45:55,AlmightyHamster,1,Is it a good move to enter PFE calls right now? Would choose a September expiry though to capture any potential good news until then.
2020-07-27 11:45:39,sheboftek,4,apple please do it for me
2020-07-27 11:45:19,ThePeoplesBard,11,Cash gang? More like Monopoly money gang.
2020-07-27 11:45:14,LamboBy22,-7,By what age do you guys think you should have a million dollar net worth
2020-07-27 11:45:04,BallinLikeImKobe24,1,Match 8/4 earnings! Already smashed q1
2020-07-27 11:44:12,Gua_Bao,1,automod lives in hawaii. hasn't woken up yet.
2020-07-27 11:44:08,recorrupt,2,gg Dollar index below 94!
2020-07-27 11:43:54,StockNewbs,7,I heard JPM invested in $rope 👀
2020-07-27 11:43:45,TheCuriousKea,1,When do we short SLV and GLD?
2020-07-27 11:43:29,ultraplay37,-1,"lollllll ""would you ask him not to sell shares forward""?"
2020-07-27 11:43:22,SummerSnow8,3,AMZN with one of those 200 day?
2020-07-27 11:43:07,yolo_tron,15,3 beers in and it not even pre/market
2020-07-27 11:43:02,helloIAmDan7,1,Damn VXRT got kil.
2020-07-27 11:42:59,NEWS0CKS,4,Aliens landed looking to collect SLV and GLD. Every 1000 years the aliens collect those PMs. Bullish
2020-07-27 11:42:16,LightningLegend999,1,think amzn can moon this week?
2020-07-27 11:42:11,Davejacobs257,1,Mrna up 8% and phase 3 now?!?!
2020-07-27 11:41:55,DocDino_,1,"I’ve got 10K, calls or puts on TSLA"
2020-07-27 11:41:51,Throwawayeconboi,2,When will copper moon
2020-07-27 11:41:39,GourmetFilet,11,GIVE US THIS DAY OUR DAILY THREAD 🧵
2020-07-27 11:41:34,learningoptions,1,My AMZN butterfly spreads that were OTM on friday are now ITM.
2020-07-27 11:41:33,cryptooakmont,6,Who else is going to fomo into some silver calls today and lose some money?
2020-07-27 11:41:29,SquintsRS,2,Bancel getting fucking blasted for selling right now. Scammer
2020-07-27 11:41:28,haasvacado,6,🍇member when the Automod made daily threads? I member🍇
2020-07-27 11:41:15,calfwarrior,3,I'm going all in on Visa calls fuck it
2020-07-27 11:41:13,dairek0405,4,Most stocks exept tesla is green. Gonna invest in $ROPE soon
2020-07-27 11:41:05,slymerva,5,"SLV 8/21 23c, anyone else with a similar position thinking about taking profits and rolling back today? or should I wait"
2020-07-27 11:40:55,alex_bbp,1,TLSS the real dub
2020-07-27 11:40:40,csjrgoals,0,"dOlLaR fAdInG

okay, we get it. now shut the fuck up."
2020-07-27 11:40:34,flmosinman124,0,🐻 about to get their assholes rekt
2020-07-27 11:40:31,TakeaRun,1,Peter still asleep
2020-07-27 11:40:24,Leaky_Buns,9,"If you think you are too late to the TSM game, keep this in mind.

In late 2019, TSM announced a CapEx increase of 40%. That means they increased the amount they spend to invest in things such as new facilities and R&D. They have also committed to this increased spending throughout 2020.

This was the main reason why this stock was kinda flat with super low IV for awhile. Because people thought they were using too much of their profit on CapEx.

Now this investment is starting to pay off way more than anyone ever imagined. Keep in mind that while the U.S. had to initially shutdown for a bit and then now operates on reduced capacity, Taiwan has been almost totally coronavirus free and during this time, they have been constantly improving their capabilities. This is on top of all the other problems that Intel has been facing before coronavirus.


This is not a stock that will stay under $100 for long. 

Personally I am buying 2022 leaps, selling once in the money and then rerolling them into higher strikes, while reinvesting the profits into more leaps and shares. On any significant dip, I’m just gonna add more positions.

Good luck to all."
2020-07-27 11:40:20,Bluemoonclay,6,In hindsight I should have bought some metals
2020-07-27 11:39:59,CambodianInvestor,3,the trillionaires are pumping metals and crypt o to protest the stimulus being given to the peasants
2020-07-27 11:39:02,DifferentKindaHigh,1,holy guacamole we green
2020-07-27 11:38:48,Chicano_Ducky,3,Wow the yen is pearl harboring the USD right now. 0.84%.
2020-07-27 11:38:43,JensJuergen,6,"Gold is not a bubble, your Dollar is.

#facts"
2020-07-27 11:38:42,RoyalFail6,3,Intel up today 😌
2020-07-27 11:38:39,luponicdistortion,3,"2 things arent really adding up for me right now. 

Dollar weakening fairly significantly, while bond yields are still falling. Of course the fed buying is a factor, and I haven't seen the data for a week or two, but I thought their buying had largely been arrested by a lack of sellers. Who is buying these bonds, and why?

Housing market. Seems to be booming in a lot of areas, homes selling like hotcakes for over the asking prices. Why? How? Banks are coming out hot with loans? To who? I know the feds been buying MBS but with the current situation I am struggling to understand why banks feel so good about making these loans"
2020-07-27 11:38:33,ambitlover,9,"remember, the market tells the fed what to do..."
2020-07-27 11:38:01,CombodianBreastMilk,7,"If you make your money on calls, you have to get a green huracan.  If you make your money on puts you have to get a red le sabre."
2020-07-27 11:37:57,Tbones014,12,Have you guys ever gone through the replies to a trump tweet?  Wow puts on the human race.
2020-07-27 11:37:40,GourmetFilet,5,"Too many double ipa last night this shit is violent. 

Not a good sign. This might not be the pump we are looking for after all"
2020-07-27 11:37:20,Chicano_Ducky,2,"YFW looking at futures

 **👁👄👁**"
2020-07-27 11:35:48,AdrianThatGuy,8,SLV a 10 bagger?
2020-07-27 11:35:46,DadINeedMoreMoney,1,Anyone know why my calls are worth less on Schwab than RH? Ah priced in?
2020-07-27 11:35:26,iSufiyan,3,"So all of my spreads and calls are in the money/past break even. 
Definitely gonna dump 90% at open and ride the rest. 
I have no idea how we’re swinging today."
2020-07-27 11:35:07,kiwiatv,7,I love AUY
2020-07-27 11:35:01,AlmightyHamster,3,"Judging from the pre-mkt and Friday's activity it seems TSLA is going to float around $1430, unless very bad or good news come out."
2020-07-27 11:34:54,tgundlach1,3,French scammer alert
2020-07-27 11:34:53,jimjoekelly33,12,recession cancelled
2020-07-27 11:34:45,BentoMan,2,ELI5 why dollar value is decreasing? And how to protect myself from it.
2020-07-27 11:34:41,MattDamonIsGod,4,"I remember like two years ago every single podcast I listened to had a Blue Apron ad. It was inescapable. Now, I forgot they existed and thought they folded. Earnings are in two days. Buy puts."
2020-07-27 11:34:31,ddiddy171,11,Moderna CEO looks like he wants to sell some of his Stonk after this interview
2020-07-27 11:34:29,SquintsRS,1,October or November for Moderna to get their phase 3 results...
2020-07-27 11:34:14,AMcMahon1,2,Gonna be a great time when big tech is broken up.
2020-07-27 11:33:44,GourmetFilet,4,"Ima fan boy of TSLA stonk. 

I hope you people wishing ill will on my boii get fuckd"
2020-07-27 11:32:55,anujfr,1,moderna ceo on cnbc right now
2020-07-27 11:32:03,boludo1234,0,Why amazon is not going down right now
2020-07-27 11:31:28,DeepBass10,3,Better buy some stonks quick before your $$$ are worthless....
2020-07-27 11:31:15,ismytatbad,2,Amazon showing love in this morning to shed it all off in premarket
2020-07-27 11:31:04,UnwantedRelishMan,11,So gold and silver are possibly rallying because it’s getting harder and harder to tell if we will be in a deflationary market 2 years out. All the bond bois are going gold and silver
2020-07-27 11:31:02,A1739,7,Amazon with 2 upgrades. Calls it is
2020-07-27 11:30:47,DeepBass10,0,Dollar on a parabolic decline......
2020-07-27 11:30:30,youreaditfirst,16,What time does your McDonald's shift start today boys? Yall are up early today
2020-07-27 11:30:24,tubby_LULZ,8,Ayyy let me see another 8% Monday for AMZN
2020-07-27 11:30:18,CambodianInvestor,0, no safe space for jew hate! https://twitter.com/OwenJones84/status/1287526393526484998?s=20
2020-07-27 11:30:04,TheLastAckbar,5,All I'm asking is for tesla to get to 1500 today.
2020-07-27 11:30:03,rankiba,6,CptTonyStark I hope you're doing well
2020-07-27 11:29:56,SaneAndChill,0,Hey Frankie how’s the weather
2020-07-27 11:29:49,frankiepwilly416,5,JPMorgan is about to have a really bad day lol.  $SLV
2020-07-27 11:29:04,GourmetFilet,8,AAPL and DKNG calls I picked up friday probably the smartest thing I’ve done a long time
2020-07-27 11:28:50,i__like_turtles_,12,"stonks go up 📈

stonks go down📉

stonks on the merry go round 🎠"
2020-07-27 11:28:47,SurgeonLoki,7,Tesla falling into the abyss. So sorry for the call holders :/
2020-07-27 11:28:23,buckey5266,4,"APPL up premarket, let's goooo"
2020-07-27 11:28:21,Bluemoonclay,3,"May only be PM but my watchlist is greener than Shreks cum, lets have a week boys"
2020-07-27 11:28:17,sloop703,7,"Oh shiiiit it’s literally National Chicken Tender Day. SPY better rip I WANT MY TENDIES 


https://www.daysoftheyear.com/days/chicken-finger-day/"
2020-07-27 11:28:15,argyleshu,7,Can't blame Elon. I'm sure he appreciates all you retards for making him filthy rich.
2020-07-27 11:28:14,JensJuergen,1,You printed so many 💵 you made gold 🚀🌕
2020-07-27 11:28:05,stonksupanddown,3,"Just bought gold, silver, and PSTH. Went full retard"
2020-07-27 11:27:55,glov,10,"The closer you are, the less you can see. Looking a little further:

8/3:

CHGG - calls (online classes up)

CZR - puts (vegas is empty)

8/4:

ATVI - calls (gaming up bigly)

ALL - calls (less driving, less claims)

NDLS - puts (when did you buy noodles from a restaurant during quarantine?)

8/5:

CVNA - puts (who the fuck buying a car from a vending machine?)

TWNK - calls (stress eating)

ELF - puts (no clubs, no makeup)

8/6:

AMC - puts (movie theaters are a thing of the past)

STFC - calls (same as the other auto insurance companies)

APLE - calls (people will think it's APPL)

JACK - calls (stress eating)

8/7:

NATH - calls (I like Nathans)"
2020-07-27 11:27:22,internet-commenter99,6,Half my portfolio is in GLD and SLV calls. May just fuck around and FOMO into more at open
2020-07-27 11:27:07,IronManKillsThanos,5,"Fuck yes 1390 broke on TSLA, let's get it to 1300 today!"
2020-07-27 11:26:55,ibmartinezz,2,All I do is buy options and listen to bladee
2020-07-27 11:26:42,gaylonelymillenial,1,Any word on what’s causing EV stocks to drop? Also AMZN looking nice 😁
2020-07-27 11:26:34,alwayshungry0704,4,Is this the end of TSLA? Papa Elon🥺🥺🥺
2020-07-27 11:26:17,AMcMahon1,7,Amazon has no business being worth what they are. They killed off a lot of brick and mortar stores then let chinese scammers destroy their marketplace. If it wasn't for AWS they wouldn't worth nearly what they are.
2020-07-27 11:26:17,AlmightyHamster,2,Please TSLA don't give those tendies to the shorties 🥺
2020-07-27 11:26:04,troylus81,4,This much green and VIX up 2%. Feels like a trap.
2020-07-27 11:25:47,creature1231,8,"I'm out of gold, hearing you autists talk about it this much is making me nervous."
2020-07-27 11:25:37,rankiba,3,AMZN upgraded but can it at least reach $3300?
2020-07-27 11:25:30,ch1p_skylark,6," [https://twitter.com/aRishisays/status/1287709507087249408](https://twitter.com/aRishisays/status/1287709507087249408) 

wsb bears will probably read this and think he's serious"
2020-07-27 11:25:28,lasco10,2,Cmon GLD give me 6 more cents so every position in my account is ITM
2020-07-27 11:25:26,flmosinman124,2,"DKNG mooning today, the Yankees National game was the most online betted ever."
2020-07-27 11:25:23,seesaw32,2,FB how do you feel about 240 this week??
2020-07-27 11:24:50,helloIAmDan7,3,"JNUG got dang, golden tendies"
2020-07-27 11:24:48,King_of_Ooo,5,Who's ready to get Macro Hard today?
2020-07-27 11:24:45,TheLastAckbar,11,Everything I touch goes the wrong way. I killed tesla.
2020-07-27 11:24:43,pstric8,1,Im debating on holding my AMZN 3200C 8/7 or selling at open
2020-07-27 11:24:35,RayCashIsTrashDalio,7,"elon needs to tweet ""TESLA TRADE TALKS GOING WELL"".

pls my calls are dying."
2020-07-27 11:24:15,by_any_other_names,1,You misspelled innovation
2020-07-27 11:24:08,silverlink22,3,"Once again, I’m completely retarded. I keep doing the exact opposite of fucking amazon."
2020-07-27 11:23:41,Vyruz2,12,"Anyone wanting to short Gold because its at ATH is a fucking moron, look at DXY you clowns Gold isn’t mooning the Dollar is crashing."
2020-07-27 11:23:40,RightTackle,5,It’s slow bleed time. Fuck
2020-07-27 11:23:40,ibmartinezz,1,Wake up $AMD plz
2020-07-27 11:23:23,Patriotnation5,6,I want automod's head on a stick.
2020-07-27 11:23:13,Chotothegoth,3,"Just this past 2 weeks like 10 different firms raised their price target on Amazon to $3500+


Yup I'm thinking they are about to post record breaking revenue and growth"
2020-07-27 11:23:11,The-Hyrax,3,Where can I submit a refund request at Nasdaq?
2020-07-27 11:23:04,ohmy420,2,"So every single day when they go ""stocks rise on vaccine hopes"" is it really a rise of it went down 5% last week"
2020-07-27 11:22:53,pythophile,2,Anyone playing Blue Apron earnings? ... looks like people aren't happy with it and canceling on  [/r/blueapron/](https://www.reddit.com/r/blueapron/)  only DD i've done on it.
