date,author,score,body
2020-01-08 00:02:03,EEBucks,1,Lol spy already following futures and markets closed
2020-01-07 17:23:30,Michael---Scott,1,buy silver bois
2020-01-07 16:15:00,dungbat83,3,Su bae showing off her red dildo collection
2020-01-07 15:50:09,JaeRex,3,God bless you $mu.
2020-01-07 13:32:34,DeliciouslyUnaware,3,"[Quick 4x play...](https://www.reddit.com/r/wallstreetbets/comments/el0az6/comment/fdesmh2?context=1)

Probably gonna take profits and stick them on $sq 62p since SQ got drunk overnight and thinks it's a real company now."
2020-01-07 13:18:12,PSwayzeInRoadhouse,1,I knew I should’ve bought TSLA calls at close yesterday
2020-01-07 13:13:58,Myack_,1,What’s gonna happen at open bois
2020-01-07 12:40:00,Sunnydee91,1,Spy puts sell at open or hold
2020-01-07 12:33:28,jayp20122,1,im at least going to throw a little bit of cash at this weeks push if this fkn thing pushes into 470. its my obligation to
2020-01-07 12:32:46,jayp20122,1,tsla 470 squeeze inbound at the cash open
2020-01-07 12:14:36,gregot76,1,I think trump has puts with all these tweets he is pushing
2020-01-07 11:41:39,artichoke2me,2,So anyone think there will be any changes with TSM tomorrow?
2020-01-07 11:17:13,ThetaBurnVictim,4,Looks like we’re headed back to ATHs boys! Good job everyone we won the war and made it through the recession 👊
2020-01-07 11:14:32,spanishgalacian,2,"Been selling Tesla, PCG, CRWD and AMD puts. Easy money."
2020-01-07 11:12:31,LogicUpgrade,2,I bought bunch of shit on Jan 2 right before the Iran news. Pray for me today.
2020-01-07 11:08:59,ghosting386,-1,"So, not that I have weak hands, but I'm trying to pay off my mortgage early and I want to start a solar business. But would selling most of amd, 50 contracts worth, and jumping into Tesla 460 maybe 470 be a bad idea? Or hold on amd?"
2020-01-07 11:04:55,,1,"BABA 220 call 
NVDA 247.5 call
SPY 330 call 
All looking 🔥"
2020-01-07 11:00:43,bobvonbobby,5,Its 3 am west coast and I cant sleep fuck me. Let's go NFLX 360!!!
2020-01-07 10:38:54,winkerpack,1,"So pre market and after hours trading is up to the discretion of your broker of which tickers will be allowed to be traded? For example, on robinhood,  not everything is open to pre or after market hours."
2020-01-07 10:25:30,chaney3,2,I haven't been able to sleep all night. Guess I'll get up now and go to the diner. Maybe get some work done before market open.
2020-01-07 10:25:13,TheReferee_101,1,Amzn going up hurts when you know you shouldn't have sold your calls
2020-01-07 10:22:20,underarmourgold,3,PUMP PUMP AMD PUMP
2020-01-07 10:20:01,,5,"alright im fucking all in on 1/31 TSLA calls. 100k in TSLA calls if i dont pussy out at open. if i profit before then, i'll sell. if i lose money on it, ill hold through earnings and pray to papa musk. 500 is the goal"
2020-01-07 10:18:48,curiousprovisions,9,"$TSLA $460, $AMD $50 & AAPL $302 ... *nuts*"
2020-01-07 10:16:49,EnemiesAllAround,1,"Go long on the vix. Buy calls. Regardless of individual decisions today, volatility is going up if you have the capital"
2020-01-07 10:07:30,ThatDidntJustHappen,1,Anyone in Target? I’m not having a good time.
2020-01-07 10:01:16,astafe,8,"Bois I have six positions of puts , after seeing this green dildo , I’m gonna watch the big short films for the next three hours to calm my nerves"
2020-01-07 09:59:02,chrsb,1,I’ll buy new knee pads if we hit 330 by end of week.
2020-01-07 09:58:10,semeon_,1,"Wouldn't buying SPDR Gold calls for a while make a bit of sense, as a result of potential stock market turbulence?"
2020-01-07 09:55:07,fin425,6,Happy anxiety Tuesday guys!
2020-01-07 09:53:51,astafe,10,I thought someone  was asking earlier the video that Elon  was dancing .                          https://twitter.com/ray4tesla/status/1214471587589607424?s=21
2020-01-07 09:48:50,dnesdnal17,3,"[this the guy that’s supposed to save our planet? cool, i guess](https://twitter.com/elonmusk/status/1214483582363693057?s=21)"
2020-01-07 09:32:05,stormwillpass,4,Good morning. Just shorted one lot NQ to test waters.
2020-01-07 09:30:57,Robbinh00d7,1,Feels good holding through a recession and actually making gains instead of watching Al Theta win again
2020-01-07 09:26:50,realister,2,Iran used the secret technology to send a Tsunami at the USA. Aaaaa
2020-01-07 09:24:41,SquirrelinaSuit,1,Nio 👀
2020-01-07 09:20:18,wolfenstein1998,8,"I am literally balls deep in amd, amd is up now I won’t be able to sleep fuck"
2020-01-07 09:12:43,uninfinity,9,"Pump

***Iran is prepared to ""come back to full compliance in the Nuclear deal"", according to a senior Iranian official***"
2020-01-07 09:12:21,Muntberg,1,If you could just hit 330 eow that would be great kthx
2020-01-07 09:12:18,dfordestroyer,4,Predictions on $TSLA prices?
2020-01-07 09:12:03,winkerpack,5,I think we should all set aside $500 and everyone make the same exact trades on the same time and days and win/lose together as a family. Let's all become millionaires together then go to vegas and party 🍻👨‍🚀🚀💒😎
2020-01-07 09:11:01,Sonyooo,4,"It seems like futures are holding and amd up? I’ll sleep for a couple more hours report in the AM, autists!"
2020-01-07 09:09:06,SmallPotGuest,9,AMD up. Hope it makes a lot of people here a lot of money.
2020-01-07 09:05:35,shmowker,6,Amd up big
2020-01-07 09:03:37,winkerpack,7,"If green days and stonks going up dont make your cock hard, you should probably leave this sub and visit r/gaybears"
2020-01-07 09:02:15,Deezkicks,0,amd :(
2020-01-07 08:57:35,BrendanIsThrew,10,"Iran says they have come up with 13 ways to retaliate. Numbers 1 through 6 are tweeting angerly at Trump.  
Also -- Iran is ""ready to come back to full compliance"" with its nuclear deal.  
Nuclear war is cancelled. Back to waiting for the recession."
2020-01-07 08:55:14,Muntberg,11,The market literally does not care about Iran lmao.
2020-01-07 08:50:15,oregon_forever,11,"If Iran fails to retaliate within 72 hours, we automatically win the war and our stock market gains 10%. It's been 48 hours so another 24 hours to go."
2020-01-07 08:49:27,oregon_forever,5,"Fed is still printing in case you were wondering.

https://www.federalreserve.gov/monetarypolicy/bst_recenttrends.htm"
2020-01-07 08:49:00,Billie__Gates,5,Historically isn't war usually profitable and an economic boost to the countries winning? Wouldn't we be green if world war 3 were announced?
2020-01-07 08:44:56,oregon_forever,10,Looks like bears are dead again for the 1000th time. They were so hopeful over the weekend.
2020-01-07 08:37:55,Rojamo2914,2,"Adding to my AUDNZD position. Bought aud at 1.041, bought some more at 1.039 and 1.037.

Will continue to increase position incrementally down to par. 

This currency pair always trades between 1.02 and 1.11. Swings throughout the last decade. Easy bet. Hoping to sell somewhere in 1.06"
2020-01-07 08:36:33,goatdara,3,Need nvdia to AT LEAST stay flat tomorrow if not to the moon!!!
2020-01-07 08:33:59,,4,fuck forgot to tell you autists to all in QQQ calls before market close today. the CES shit is going to pump all tech stocks up. massive gap up tomorrow
2020-01-07 08:33:38,J_Powell_Ate_My_Ass,-1,Holy shit Team America World Police is so fucking topical right now
2020-01-07 08:28:26,,3,"Tesla event just ended. Tomorrow should be profitable?

But real talk, his presenter chick (in all black) was looking like a snack👌🏼🔥"
2020-01-07 08:27:51,ilovewsb,2,"This hedge fund guy thinks PTON will go to $5 a share 

[https://robinhood.com/news/article/2c60a5f2-5a01-3008-9a8c-ac0ff7bff43e](https://robinhood.com/news/article/2c60a5f2-5a01-3008-9a8c-ac0ff7bff43e)"
2020-01-07 08:20:42,Cola9,11,Amd calls. Bears can suk balls and I'm goin to the mall.
2020-01-07 08:20:27,astafe,-8,Fingers crossed for red when the market opens at 9:30 . hope Iran will do something stupid so that my puts will print
2020-01-07 08:18:25,Spartan_Blazer,8,Fuck I’m already bored with Iran. What’s next
2020-01-07 08:18:04,Hanz-Wermhat,4,"So I used to post about how stonks only go up in an ironic way before repo started. But now thanks to Powell, a fucking major diplomatic incident barely gets 1 red day before rebounding. Without a hint of irony, stonks literally only go up. A Wonder if it was like this in 99/2000..."
2020-01-07 08:16:41,Nomadic_Marvel07,3,If gold and stonks go up..do I break even tomorrow?
2020-01-07 08:16:09,Elecfin,3,"Citric Acid. You son of a b*tch, I'm all in

https://m.investing.com/news/stock-market-news/lefts-citron-hedge-fund-posts-43-gain-in-first-year-2053568"
2020-01-07 08:15:24,Spartan_Blazer,5,Imagine the rally if LMT Lasers an Iranian missile out of the sky as it’s inbound to the US
2020-01-07 08:11:48,oregon_forever,6,Last Friday was the last red day for 2020. I hope you all bought the dip.
2020-01-07 08:09:35,Spartan_Blazer,6,"I don’t necessarily agree with the caption but that’s kinda crazy

https://twitter.com/fuckingsidiots/status/1214457793828179969"
2020-01-07 08:02:51,sweeg77,2,Waiting for my salary to make a move. Looking for interesting stonks.
2020-01-07 08:02:31,,11,nasdaq futures are way biglyer up than sp500 futures. this can only mean that amd gapped up to $60 and is carrying the weight of nasdaq on its own
2020-01-07 08:02:18,,4,"$TSLA calls are gonna print♥️

Avoided the hype till now. Fuck China but like, also yay China..."
2020-01-07 08:02:10,ChinaUnfairGoingWell,2,Need a 10x play. What's the move? ROKU?
2020-01-07 08:01:37,Muntberg,3,"[Why yes, I do stay up all night overreacting to futures markets. How did you know?](https://i.imgur.com/CVUjOHk.jpg)"
2020-01-07 08:01:31,BOOGNISH_IS_REAL,2,"Getting some sleep, hopefully Hang Seng doesn’t get any more spooky after dark"
2020-01-07 07:58:43,iwasannon,0,Sold my first put give me the theta gang flair please
2020-01-07 07:57:35,Spartan_Blazer,2,It’s already 11:30 am in Iran so..
2020-01-07 07:52:27,Billie__Gates,3,Why aren't my cattle futures moving?
2020-01-07 07:52:11,greentea45,3,"i meam to be fair this zarif guys is just pulling the same trick as trump with the trade war. ""soon"". which means never

guess itll be 2 years before the phase1 iran attack is ready"
2020-01-07 07:48:54,wsb_mods_R_gay,3,Lol that spook didn’t last long it’s already pumping back up
2020-01-07 07:44:56,InKanosWeTrust,2,Fuck this war shit. My salesforce calls will print regardless
2020-01-07 07:43:42,J_Powell_Ate_My_Ass,4,"For my DD I'm gonna have to re-watch Team America

edit: lots so far

KO, SBUX, JPM think i saw virgin and viacom too"
2020-01-07 07:42:33,Huntforyoullk,6,Tesla $600 by mid 2020. Drove around LA today for an hour and saw a Tesla at every stoplight.
2020-01-07 07:42:13,y7nx90,4,"Most of these ""pajama"" traders are actually like algos from trading firms that just run overnight and have 1 guy in the office making sure they don't mess up.  Given they already sold, they've messed up because stonks only go up."
2020-01-07 07:41:26,greentea45,4,"pretty sure this was planned by iran so they could buy cheap calls tommorow morning

also is now making enemies out of europe

> ZARIF: THE POSITION OF EUROPEAN COUNTRIES ON THE RECENT EVENTS IS A STRATEGIC MISTAKE AND WILL NOT BE IN THEIR FAVOR"
2020-01-07 07:40:57,Spartan_Blazer,2,Oil definitely hitting $74 off this shit
2020-01-07 07:40:30,Nomadic_Marvel07,5,Future proof stocks AMD TSLA and GLD
2020-01-07 07:40:15,oregon_forever,3,"America vs. Iran (or any third world country)

https://www.youtube.com/watch?v=7t8xwpW8gJQ"
2020-01-07 07:40:15,Elecfin,1,WW3 is back on the menu boys & girls.
2020-01-07 07:40:13,Huntforyoullk,5,"Futures falling slightly don’t mean crap, we ended up green yesterday after being bloody red"
2020-01-07 07:39:49,y7nx90,1,"Lol I wish markets were open now, would be easiest buy the dip right now."
2020-01-07 07:39:00,wolfenstein1998,2,Futures are fucked
2020-01-07 07:38:58,sola_rpi,2,futures fading
2020-01-07 07:38:46,Regjohn,3,AAPL TSLA SPY calls ez game
2020-01-07 07:38:44,dnesdnal17,1,"This Zarif fella is just talking spicy. What happened to your “we’ll wait 2 days and retaliate.” You ain’t got no plans, you don’t want no smoke.  Just buy your calls and gtfo"
2020-01-07 07:37:50,KimchiFitness,3,"FUCK YES

IRAN IS ASSESSING 13 REITERATION ‘SCENARIOS’ AGAINST THE US – FARS

""Iran parliament passes motion designating US military a terrorist organization."""
2020-01-07 07:36:55,greentea45,2,"i thought this shit was over with the trade war but now its real war

fuck this market and its bipolar disorder"
2020-01-07 07:36:47,Droidvoid,1,Pajamas on. Ready to go!
2020-01-07 07:36:43,NoftScarlet,-1,fading into bloodbath🐻
2020-01-07 07:36:35,Huntforyoullk,0,Anyone playing Walgreens earnings? Premarket January 8th
2020-01-07 07:34:36,theslickplay,1,Future this night has been a emotion of roller coaster.
2020-01-07 07:34:30,,3,asian stock markets be like: this iran us shit dont affect me. time to moon lololol
2020-01-07 07:33:40,,1,GUH futures fading war is coming.
2020-01-07 07:33:10,greentea45,3,war back on.
2020-01-07 07:27:03,Droidvoid,4,My FB and AMD positions looking nice right now
2020-01-07 07:26:57,InKanosWeTrust,4,Life sucks sometimes. Im happy i have yall as a community though. Thankful for you autists.
2020-01-07 07:25:31,gigantoir,3,damn asia up bigly yall talk about futures too much
2020-01-07 07:18:41,Spartan_Blazer,5,Get ready boyZ found [this](https://imgur.com/a/fH2T6RP) in an old ww2 survival guide
2020-01-07 07:18:34,Nomadic_Marvel07,7,If NASDAQ is up 50 points...I would only assume that would be all AMD. Open at 96.27 confirmed.
2020-01-07 07:14:23,KimchiFitness,2,"As of 2:13 AM, investing.com says s&p futures are up 0.24%, but ES mini futures are up 0.14% 

Never seen such a large difference between the two"
2020-01-07 07:11:03,oregon_forever,3,I'm glad that the war is already priced in.
2020-01-07 07:09:31,Spartan_Blazer,3,Fishy 🎣 says no 🅱️ang Mormon ☹️
2020-01-07 07:09:10,,4,algos: RUSSIA MOVING BATTLESHIPS TO SYRIA? GOOD NEWS *pump pump pump*
2020-01-07 07:06:47,dungbat83,3,Futures pumping again
2020-01-07 07:05:20,The_Pandemonium,7,Does anyone have the slightest idea on why we cant trade speghetti futures?
2020-01-07 07:05:03,23therealme23,2,Algos = still buy everything because stonks only go up and just hedge with metals. Make everyone happy.
2020-01-07 07:01:43,iliveforedm,10,Late night Lisa Su boner thread
2020-01-07 07:00:48,al409,0,Someone give me a majorly oversold stock
2020-01-07 06:58:29,Muntberg,1,"Alright, after much deliberation, I'm thinking 02/21 $135/$140 credit spread on DIS."
2020-01-07 06:57:44,dungbat83,4,Algos are confused as hell lol
2020-01-07 06:57:40,InKanosWeTrust,3,"Guys im fucking blasted, lets hope for a green open tomorrow and tendies for everyone."
2020-01-07 06:55:43,DarkKnightAccord,3,Apple calls 306 tomorrow
2020-01-07 06:51:05,The_Pandemonium,6,Just learned half of Australia is on fire. I mean like damn that shit sucks but it's kinda killing my vibe.
2020-01-07 06:49:43,Crosa13,6,how ya doin cocksuckas
2020-01-07 06:48:58,gigantoir,-2,bro i dont have the attention span for three hour bachelorette episodes 😂 least im fucked up on some vodka tonics
2020-01-07 06:46:37,winkerpack,6,Those who pull all nighters might get something special 😎
2020-01-07 06:43:13,flowkingfresh,2,Metals climbed out of red now strong green
2020-01-07 06:40:57,Nomadic_Marvel07,4,My strategy for the next coming weeks. Hedge with gold
2020-01-07 06:34:40,dungbat83,10,Recession cancelled.
2020-01-07 06:28:15,winkerpack,13,"Quit stressing so much about futures. They were -.5% at one point last night and look what happened. Just either go to bed, or pull an all nighter with me"
2020-01-07 06:26:35,winkerpack,5,🅱️all 🅱️ighter 🤯👨‍🚀🤷‍♀️🥂🗣😎
2020-01-07 06:23:46,dungbat83,20,Dude. If that Iranian was driving in a Tesla Cyber truck he would have live through that bombing and Tesla to 694.20
2020-01-07 06:21:48,,19,"dude this is literally the worst time to invest in anything. stocks are flat, commodities are flat, oil is flat. we could randomly moon or we could drop in an instant. there is literally no clue as to what the markets will do right now. sucks being a bear, bull, gold, oil, and theta gang. we're mooning on 0 news, we can possibly drop on fake news. what a retard market. just gunna go jerk off and go back to working full time as a wendys manager"
2020-01-07 06:21:15,bonsaiorchids,-3,Markets fucking tanking tomorrow boys!
2020-01-07 06:19:13,Muntberg,2,How should I feel about my 1/10 $51 calls?
2020-01-07 06:16:45,dungbat83,1,Damn should have sold my TSLA calls at 20% profit.
2020-01-07 06:14:38,23therealme23,4,“US Warns Iran May Target Saudi Arabia.”
2020-01-07 06:13:18,23therealme23,5,BREAKING: U.S. Embassy in India has issued an alert saying there may be demonstrations today in the area of the embassy. American citizens are advised to avoid areas with demonstrations and to keep a low profile
2020-01-07 06:12:55,MandingoPants,3,"Bought facebook puts :/. Hopefully it comes down by next week.

I at least made some dinero on NBA DFS though!"
2020-01-07 06:12:54,winkerpack,8,Give me a 50% pump on Amazon and apple tomorrow
2020-01-07 06:12:47,,9,"i hate to be a downer but iran is literally powerless against the US. idk why theyre trying to talk tough. if they do anything to harm any americans, theyll literally get fucking nuked and trump wouldnt bat an eye"
2020-01-07 06:12:22,Nomadic_Marvel07,6,Sony didn't throw a brick through their prototypes window...short Sony
2020-01-07 06:11:22,23therealme23,1,"Precious Metals update:
DGCX Gold  1567  +0.09%
DGCX Silver  1818  +0.18%"
2020-01-07 06:10:27,23therealme23,2,"IRANIAN FOREIGN MINISTER ZARIF: ""The path America has chosen for itself and for the region is the path of war and bloodshed."""
2020-01-07 06:09:49,23therealme23,5,BREAKING: Iranian parliament has approved a motion designating the United States Army and Pentagon as terrorist organizations - Iranian state-run media
2020-01-07 06:09:32,love2fuckbearasshoe,6,"BA$ is about to short squeeze so fucken hard 

Served shorts good for shorting a company that wallstreet institutions have there back like who the fuck u think is keeping this shit above 330 

Not retail money u stupid  fucker"
2020-01-07 06:07:05,Spartan_Blazer,4,Ok shit. Is Iran actually drafting mofos. Like they still can’t do shit but that’s a whole nother level of shit hitting the fan.
