date,author,score,body
2020-06-02 01:06:39,NoftScarlet,9,"What will happen if riots stop, trade talk ends and covid vaccine completes? SPY drill 25%?"
2020-06-02 01:06:36,knicksAHgoat,-12,"my sister wants me to quarantine for the next month with my mom because shes having a baby due in 4 weeks and it will ne only way we can hold the baby.


im currently at my girlfriends and wont be able to see her for a month because of baby.


im going to respect her decision and do it but is it me or is this batshit crazy?"
2020-06-02 01:06:13,,2,How tight does GLD follow gold price?
2020-06-02 01:05:56,CMac681,4,I dare them to come to the suburbs. I FUCKING DARE THEM.
2020-06-02 01:05:53,ch1p_skylark,6,imagine being such pussies that you say youre not going to buy soybeans cuz youre mad and then you buy soybeans anyway because you love soy
2020-06-02 01:05:47,SoberCharlieSheen123,8,Time to crack open a cold one and watch the world go to shit
2020-06-02 01:05:39,whofcentury,1," [https://www.twitch.tv/woke](https://www.twitch.tv/woke) 

An Atlanta reporter who has done nothing but film was just arrested"
2020-06-02 01:05:04,ottermodee,4," [https://www.twitch.tv/woke](https://www.twitch.tv/woke) 

woman being arrested for breaking curfew"
2020-06-02 01:04:43,ottermodee,9,Lotsssss of people breaking curfew
2020-06-02 01:04:41,boomerzoomers,9,I just realized there is more forces (police and ng) in some cities than there are soldiers in the Canadian forces army
2020-06-02 01:04:37,Flowbro11,0,Legit what happens if options date comes and I’m in the money but I don’t buy the options
2020-06-02 01:04:29,m77w,0,Ok thanks bruhs I have a plan
2020-06-02 01:04:15,whofcentury,1,"[https://www.youtube.com/watch?v=MGwQZfrdl8Y&feature=youtu.be](https://www.youtube.com/watch?v=MGwQZfrdl8Y&feature=youtu.be)

Police arrived to the pharmacy store that was just being looted by many people."
2020-06-02 01:04:11,carlians,2,"Really not fucking with this after hours bed shit on DKNG. My positions....should be good....right?


https://imgur.com/a/DeUTvy0"
2020-06-02 01:03:50,ChiefDewy,7,"Bruh I honestly would of been better off buying btc instead of wasting 10,000$ shorting spy"
2020-06-02 01:03:40,JoJoBabbit,3,I guess only communists trade futures in the early hours
2020-06-02 01:03:37,SummerSnow8,6,Will NKLA run like DKNG?
2020-06-02 01:03:37,angel_m_,4,Just wait for a cop to “forget” to use rubber bullets
2020-06-02 01:03:27,whofcentury,9,Atlanta Police starting to mass arrest
2020-06-02 01:03:26,LMY723,5,"Big tropical storm in Gulf of Mexico, will likely hit next week. Puts on insurance. 

https://www.accuweather.com/en/hurricane/tropical-depression-forms-in-gulf-of-mexico-may-soon-become-cristobal/750223"
2020-06-02 01:03:17,follow-spy,3,"Police moving in

[https://www.youtube.com/watch?v=a-J\_1pJfYMc](https://www.youtube.com/watch?v=a-J_1pJfYMc)"
2020-06-02 01:03:02,mke1996,3,Damn I wish I had picked up micron today. Just noticed the price
2020-06-02 01:02:07,,-1,Bears alone are best. You all must die. Die! Die! Die!
2020-06-02 01:02:01,69Tyrone420,2,Oil about to take me on the next space mission
2020-06-02 01:01:54,BillyG803,2,"What’ll happen to the futures if trump has an emergency press and legalized weed?

Edit: y’all really gone make me edit it. I hate it here lol."
2020-06-02 01:01:46,TheWallStreetBear,1,Where’s the photo?!?
2020-06-02 01:01:37,thejoker4059,3,Picked up MU calls today on the cheap. Research checks out too.
2020-06-02 01:01:32,idsimon,1,My noodle arms are so sore from punching air. Might take my spare change to coinstar tomorrow and buy a call.
2020-06-02 01:01:28,leomeng,5,Did JPow walk to the church too? Was he carrying a printer? Was it HP?
2020-06-02 01:01:10,sadlovesongs,5,zoom puts is like a literal gold mine but i’m too pussy to play it
2020-06-02 01:01:09,JoJoBabbit,5,And then Winston turned and said: “stonks only go up.”
2020-06-02 01:01:06,MotorizedDoucheCanoe,7,So this is how liberty dies.. with thunderous applause
2020-06-02 01:00:50,orlando_ooh,5,"Positions (small 1.7k acc) 

SPY 07/17 310c

DKNG 07/17 50c 

DIS 06/05 122c (GUH)"
2020-06-02 01:00:12,UgerVon,-6,"The teenage protestors and gang bangers have cucked the Chicago tax paying home owners in curfew. 
Spy puts"
2020-06-02 01:00:10,poppamack,-1,"I feel like cuomo is overrated. 

Spy 24p 5/4"
2020-06-02 01:00:01,ODNI_NSA_FBI_CIA_DIA,4,"https://www.youtube.com/watch?v=inQzzlIHmC4&feature=youtu.be

Is this priced in? NYC getting looted again live and NYPD is just watching. This is a bubble , and I'm just waiting for it to pop."
2020-06-02 00:59:59,,2,If you aren't buying NKLA what are you doing? Electric is the future and their semis are better than Tesla's. They already have orders!
2020-06-02 00:59:56,mattbeau80,2,Is only bad news priced in?
2020-06-02 00:59:55,NewportBarGuy,2,"Did you know that Barack Obama nominated Jerome to the Federal Reserve Board? I just learned that. First time a President nominated an opposition party candidate in 20 years. Hmmmmmm...

Very interesting."
2020-06-02 00:59:52,ottermodee,2,Are the protests significantly down after all this curfew stuff?
2020-06-02 00:59:50,consultant_25,4,Crypto is up 7% today. Wtf goes in that dark world?
2020-06-02 00:59:50,wanttoplayagain,2,"VTIQ hype

Besides that I like to play spy calls and vxx calls, you get gains if spy goes up and gains if spy goes down usually. Weird shit going on where sometimes they are both up."
2020-06-02 00:59:49,TonguePressedAtTeeth,4,Sick 400 protesters gathered at police precinct by my place in south williamsburg.  Party.
2020-06-02 00:59:39,lilfianchetto,1,"in all seriousness, any bears left in here? haven't seen many bearish sentiments in here the past couple days . . . suspiciously quiet"
2020-06-02 00:59:20,Ban_787,5,"Went too heavy on TSLA, gonna be a sleepless night boys"
2020-06-02 00:59:13,oz_-,3,"Dude's so done with his stupid stunts

[https://twitter.com/corinne\_perkins/status/1267614867361579008](https://twitter.com/corinne_perkins/status/1267614867361579008)"
2020-06-02 00:58:44,JoJoBabbit,0,I’m actually surprised futures are red today. Thought we’d get solid green futures than a $3 Spy gap up
2020-06-02 00:58:40,Vinny32295,4,Riots are bullish as fuck! More Stimulus and Govt assistance to help the people!!
2020-06-02 00:58:40,JonSnohthathurt,5,It’s so much more fun to be a mindless bull than be a 🌈🐻 by actually looking at how fucked the market is. Stonks only go up. This is the way.
2020-06-02 00:58:40,BillyG803,2,ZNGA. I liked you at $10. Let’s do it during market hours tomorrow ok bb. I love you
2020-06-02 00:58:38,GlassNeighborhood,5,let me guess the death of democracy is priced in. yeah yeah i know.
2020-06-02 00:58:26,Printer_Go_Brrrrrr,2,Fuck nasdaq so much.
2020-06-02 00:58:13,Green_luck,5,Please can we just have Tesla go to 1000 and VTIQ to go to 60 by end of week. Not too much to ask for. Thanks
2020-06-02 00:57:54,crewcabin_,3,"the thing is is that

if we can maintain these prices we make institutional money capitulate and buy in

then we take the tendie train all the way to gravy town

spy 400"
2020-06-02 00:57:41,m77w,1,"My ZM 205/220 bear call spreads look vulnerable. 

Close the 205, the whole thing or diamond hands?

Advice appreciated 

6/5 exp"
2020-06-02 00:56:54,kvla1,9,4 minutes until curfew in La
2020-06-02 00:56:54,Hellforasailor,6,These riots are already over?
2020-06-02 00:56:48,HarbingersRefuge,1,Has anyone added up the value of all real estate owned by publicly traded firms?
2020-06-02 00:56:41,,1,"Hey kid, you ever see a rabid grizzly bear get into a cattle paddock?

I'll show you."
2020-06-02 00:56:29,dawhizkid123,14,What a Chad https://twitter.com/corinne_perkins/status/1267614867361579008?s=21
2020-06-02 00:56:26,goldensteaks,2,Is zoom gonna crush earnings and melt everyone with puts?
2020-06-02 00:56:24,ELC183,7,"You know, probably just kinda hang out. I was gonna...Oh man, tomorrow, I really wanna make an egg salad sandwich and I’ve just been obsessing about it and i’m like, “Man, I'm gonna make one of those.” So tomorrow, I’ll go out and get, like, a dozen eggs and then boil them all and I’ll just, spend, I dunno, probably three hours, like three and a half hours making, you know, the mayonnaise, and the onions and paprika and, you know, the necessary accoutrement. And then, by the time I’m done, I probably won’t even feel like eating it."
2020-06-02 00:56:22,boognish_1000,8,Long pepper spray
2020-06-02 00:56:17,averagenoodle,13,Boys what's the quickest way to thaw chicken? I googled but Sally used her journalism degree to write a whole life story before giving me shit advice
2020-06-02 00:56:07,Buildingdetroit,1,Gyna! Haong! Kaong! Ann Tee Fuh!
2020-06-02 00:55:56,kvla1,0,Anyone on dvax?
2020-06-02 00:55:52,nostylist2900,10,i have a feeling tomorrow will be a giant green fucking dildo
2020-06-02 00:55:39,IcyFinds,8,Markets going green tomorrow fuk u bears.
2020-06-02 00:55:36,follow-spy,8,"Obama will be giving a televised address at 9:30 PM.

Just kidding..lol"
2020-06-02 00:55:26,YepRabbit,5,"Angry 🌈 🐻 join the riot tonight in order to save their puts

Will 🌈🐻 success this time?"
2020-06-02 00:55:25,gekalx,3,Holding DOCU 200
2020-06-02 00:54:53,YABadUserName,2,"ZM call credit spread, TQQQ put debit spread, spy put debit spread. Do i hate money?"
2020-06-02 00:54:51,Overwatch1818,6,Looks like puts on protestors is the play tomorrow. Calls on the united states military
2020-06-02 00:54:36,Diethlem,1,Anyone else have a curfew before this?
2020-06-02 00:54:36,mke1996,2,The great journey waits for no one brother. Not even you
2020-06-02 00:54:23,TheWizardOfFrobozz,2,"Bagholding WORK shares (I know, I know) from their IPO day that are green for the first time ever running up into earnings on Thursday. Sell before earnings or hold and gamble?"
2020-06-02 00:54:06,Flowbro11,0,Is anyone still unironically  un oso?
2020-06-02 00:53:51,blackholesarecool,2,"DKNG over 30,000 call volume today, majority are $45 exp EOW. yall really think itll hit 45? Why not 50?"
2020-06-02 00:53:48,Schobeyy,4,Your brokerage could never 🔥🔥🔥 https://twitter.com/robinhoodapp/status/1267619918591127553?s=21
2020-06-02 00:53:48,canadianformalwear,1,Anyone think the DIS press about them opening but without most of the things someone associates with Disney will have some sort of flak? Seems like all it will take is a few people getting / bringing C19 while there and then at least part of the park(s) get shut down again.
2020-06-02 00:53:47,YABadUserName,0,anyone else praying for a red day?
2020-06-02 00:53:37,PhillipJFry3020,4,"I’m convinced if these riots happened 15-20 years ago, no one would think they are a big deal.

It’s literally only because everyone has a phone with internet now.

And that’s why they aren’t anything to be worried about."
2020-06-02 00:52:59,follow-spy,1,We lost the plot!
2020-06-02 00:52:46,bearsgotoalaskanstfu,1,"What makes a meme stock? SPCE, BYND, DKNG, VTIQ. 
What do they all have in common to reach absurd valuations? I know FOMO, pure plays, but still..."
2020-06-02 00:52:28,xpo140,2,Can Jerome’s printer do it again?
2020-06-02 00:52:25,pillow38164926,-10,#BEARS IN SHAMBLES
2020-06-02 00:52:19,not_batsoup,1,Any earnings tomorrow that could move the market?
2020-06-02 00:51:44,Vanhandle,2,Rumor around that MLB is going to propose a 60 game season
2020-06-02 00:51:24,DrMac6666,2,Praying that TSLA stays under 870 by the end of the week to save the credit spread I sold. Big Daddy Musk is screwing me rn
2020-06-02 00:51:14,theohellos,5,Is the curfew nationwide I’ve gone to 3 closed chipotles and I’m suburban Indiana
2020-06-02 00:50:59,mattbeau80,4,So glad we didn’t move to downtown Sacramento last year and decided to stay in the suburbs.
2020-06-02 00:50:58,ArsonDub,7,"How come there is no ""Roof Koreans"" sports team?"
2020-06-02 00:50:50,thesillyshow,6,Eating 🍗 wings and 🍉 just watching tv like a good ol American boy
2020-06-02 00:50:35,fuegocossack,8,"As a 🐻 I'm kinda excited for tomorrow to be green and to rip up to 320-340 over the next couple weeks.

Then come the 100 baggers 🐻🔪🩸"
2020-06-02 00:50:14,pillow38164926,3,"#BEARS: uber eats

#BULLS: 👱🏻‍♀️ Postmates 👩🏻‍🦳"
2020-06-02 00:50:12,thunderchkn07,3,Wtf why didn’t someone scream about ZS?!!
2020-06-02 00:50:02,Collectorguy00,2,Buying more nak and going to try my hand at some dkng fd.  I really want to jump on docu puts but that iv
2020-06-02 00:49:37,Warren_Budgett,5,Can Berkshire buy the whole country?
2020-06-02 00:49:28,VacationLover1,35,"Robinhood did an ad on Facebook that says ‘black lives matter’.. clicked on the comments to see ‘Wallstreet bets is going to have a meltdown.’ Aaron, I know you’re in here"
2020-06-02 00:49:16,WinterWeather5,6,Uber Eats is very expensive...the service fee kills me
2020-06-02 00:49:14,SayCyberAgain,1,$VISL is a great short term play
2020-06-02 00:48:45,DifferentKindaHigh,22,"Why the fuck am I under curfew, I’m no longer 12 😤😤😤"
2020-06-02 00:48:44,Little-Cardiologist,5,I got ZM puts - $260s that expire 1/15/21. Breakeven is $174.90. I'm risk averse ...
2020-06-02 00:48:37,batmanonthelow,6,When futures down .40% put your put is so fucked up that you’ll still open red unless we hit at least 1% down
2020-06-02 00:48:10,decjr06,3,Futures slowly melting up probably flat/green by open
2020-06-02 00:47:43,S28E01_The_Sequel,2,What do you guys think the market would do if Jerome Powell got Covid?
2020-06-02 00:47:33,moongoose16,27,Why do I have to literally sift through so much shit just to find people actually talking about thier moves tomorrow???
2020-06-02 00:46:55,knicksAHgoat,8,"https://twitter.com/realwillmeade/status/1267586368156438531?s=21


How hasnt anyone posted this Meadebomb? Hes calling for JPOW prison time😂😂😂🤣🤣🤣😂😂"
2020-06-02 00:46:49,pseudo_rockstar,10,"Washington, DC, reported a spike of coronavirus cases, pushing back the city's timetable for moving to the second phase of reopening additional businesses and public spaces.

oh HELLO"
2020-06-02 00:46:39,infamousnj69,11,Never thought I’d go through a curfew and quarantine at the same time. Wtf
2020-06-02 00:46:26,Huey_Long_Schong,9,The mfs just looted my town's Chinatown. Calls on Roof Koreans!
2020-06-02 00:46:22,not_batsoup,8,Still can’t believe i sold my TSLA 1000c on friday. Sold them for .90 now 4.88
2020-06-02 00:46:05,GodHog777,1,Predictions in SWBI eow?
2020-06-02 00:46:02,YABadUserName,-1,futures are red yay!
2020-06-02 00:45:51,,-1,"Futurebulls ruin at 3038. Beware, bulls. The cards are lining up once again for your demise. If the fates will it."
2020-06-02 00:45:39,Krusher4Lyfe,3,Any chance good news about HBO Max subs comes out this week? I can’t remember how long after Disney+ came out that DIS went up a lot AH on their sub announcement
2020-06-02 00:44:58,SuperTraumatic,8,They haven't rounded up the curfew-breakers in DC yet
2020-06-02 00:44:31,gambler_no_1,11,Imagine all of a auddent the whole country becomes 5 starred GTA game
2020-06-02 00:44:24,thepatientislight,0,"The good cops should shoot the cops harassing peaceful protestors right in the nuts. Then, proceed to shoot each and every looter and arsonist. Who loses?"
2020-06-02 00:44:21,Krahndaddy,6,I knew that as soon as wsb started calling tsla 1000c eow that tsla would tank
2020-06-02 00:44:20,Jfri33ss,2,Well we are kinda flat it seems with small gains. Not enough to crush theta on my end. Last time I trade option on the DIA 😂
2020-06-02 00:43:24,v1truvian,3,This market is so fucking strong right now. Futures barely even in the red. It just wants to keep going up and there is nothing that can stop it
2020-06-02 00:43:22,I-got-options-,5,"If spy dumps overnight Tsla will open 870-880 range. If it stays up, Tsla calls will be saved."
2020-06-02 00:43:20,121518nine,6,"TSLA call holders rise up, 1k"
2020-06-02 00:43:18,HarbingersRefuge,7,"Now that people can get more from being unemployed than they did working AND whatever free shit they want from Target/Louis Vuitton, they’re never going to go back to Wendy’s."
2020-06-02 00:43:15,guykirk9,7,"“Is it your bible?”


“A bible”"
2020-06-02 00:43:14,Derpissime,5,Cheers to trump for fueling my AAXN and DGLY calls
2020-06-02 00:43:04,sovinder,5,"Chill guys once Hang Seng opens up green, cause why the fuck would they care about US riots shits gonna go so fuckin green"
2020-06-02 00:42:55,traz64,3,I work near a Kia overflow lot that's been empty for 2 years but filled up this weekend. They can't sell these cars. So I guess I'm shorting Kia
2020-06-02 00:42:55,fuzzyfucklord,5,"So are my Facebook calls printing tm???

Thoughts"
2020-06-02 00:42:44,old_atlanta,7,BIG MOVE: Someone just bought $800k in IWM puts expiring 6/12.
2020-06-02 00:42:38,,14,Imagine not getting DKNG calls
2020-06-02 00:42:21,Emergency-Goose,3,Bears wish there was a curfew on futures
2020-06-02 00:42:13,BorisYeltzen,-3,All in on tie-wrap stonks.. They are going through them like wildfire arresting all these Antifas
2020-06-02 00:42:05,GatorMD12,4,ok we gott get back on track here retards:   plys looking at for tom:  DKNG and ZM for round two.  Gun stocks for martial law shit.  VTIQ for NKLA revMerger.  anything else looking really good.
2020-06-02 00:42:00,gabethebaeb,7,how do you guys keep buying calls when stocks get so high in price? 😳 surely there’s a ceiling??
2020-06-02 00:41:47,restlessleg,4,will jnug break $110 this week?
2020-06-02 00:41:35,APHAbaghodler,7,Wow.. how many going to get rekt during/after ZM ER tomorrow? Jesus fucking FOMO. Better question: How many buyers even know that ER is tomorrow...?
2020-06-02 00:41:11,turgidloveslug,5,Straddle every shitty volatile ticker I can find
2020-06-02 00:40:59,iWriteYourMusic,0,we need the national guard up in nyc. de blasio has completely lost control.
2020-06-02 00:40:37,pillow38164926,2,"SMALLCHIMPU

CPTONYSTARK 

LOVE2FUKBEARASSHOLE 

VISIONARY EMOJI NIGGA

VACATIONLOVER1


R my favorite niggas yes"
2020-06-02 00:40:34,Eric_goody,6,So nikola votes tomorrow guys. Then the change may happen the day after or the next.
2020-06-02 00:40:34,YepRabbit,-9,"These lootors and riots won't bring gun because they can't afford and no way to get one 

Weapons are not cheap, even in black market

A decent gun cost more than your already expensive smart phone"
2020-06-02 00:40:28,JRange,10,Hoping this VTIQ merger goes through and becomes NKLA. Had a nice run up today
2020-06-02 00:40:22,VapeItSmokeIt,1,Should I hold my zoom / docusign/ cloudera/ smart sheet/ digital turbine/ zuora calls until after earnings or sell before close each day?
2020-06-02 00:40:20,SolitaryEgg,2,"the 830 red dildo parade

ya love to see it"
2020-06-02 00:40:16,GrandArchitect,7,"Calls on literally anything.

JPOW gonna keep the shopping spree going until President Trump is officially King Trump"
2020-06-02 00:39:58,ch1p_skylark,2," [https://www.reuters.com/article/us-usa-trade-china-soybeans/china-buys-at-least-three-cargoes-u-s-soybeans-for-oct-or-nov-shipment-traders-idUSKBN2383CM](https://www.reuters.com/article/us-usa-trade-china-soybeans/china-buys-at-least-three-cargoes-u-s-soybeans-for-oct-or-nov-shipment-traders-idUSKBN2383CM) 

um WHAT 

CALLS ALL DAY"
2020-06-02 00:39:46,VacationLover1,8,"🐝🐝🐝

*murder hornets enter chat* 

🐝🐝🐝

it feels like we skipped the murder hornets"
2020-06-02 00:39:28,GamblingMikkee,5,Stocks simply going up since USD is getting crushed recently
2020-06-02 00:39:27,bizobingo,1,Could you beat the Trix rabbit in a fight?
2020-06-02 00:39:26,lame_irl,1,Pretty clear range trading lines set
2020-06-02 00:39:18,e30jawn,-6,goodbye 300 its been real
2020-06-02 00:39:13,Bluerigg,10,So we're just gonna ignore the bible thing...
2020-06-02 00:39:08,jonnydoo84,2,"i'm not into high priced clothing and such, but I got this Arctyrex fleece kinda jacket, and shit is comfy"
2020-06-02 00:38:57,ricoravage,6,$RIOT
2020-06-02 00:38:48,the-agent-scarn,6,VTIQ FB all i care about tomorrow
2020-06-02 00:38:44,follow-spy,6,"Lol what the fuck is that 😂😂  dude decided to go for a walk 


https://youtu.be/9pnmW-ANY3c"
2020-06-02 00:38:34,HinduHamma,0,"Welcome to wsb. where any negative news in click bait media should automatically cause a drop in the market. 

Most people here are still salty about stock market not taking a 50% dive because of Coronavirus, as if FED and ECB pumping out trillions is somehow not impactful and couldn’t prop the market, it’s wise to just go ahead and say “meh that’s nothing. You can’t print your way out of this!! Puts will win out.!! “"
2020-06-02 00:38:28,LadyForlornn,5,Wtf yo RIP my Tesla calls
2020-06-02 00:38:17,TheOldKing42,1,"Listen here mother fuckers


$GDEN"
2020-06-02 00:38:08,DCook0308,3,Is TSLA gonna die tomorrow?
2020-06-02 00:37:58,gigantoir,11, columbus ohio police authorized live rounds for protests lmao fuck
2020-06-02 00:37:56,Gua_Bao,1,when does vtiq become nkla? today?? tomorrow??
2020-06-02 00:37:49,MotorizedDoucheCanoe,-4,Huge red dildo wtf happened
2020-06-02 00:37:38,yjruan,11,Looters are making more money than me with those Gucci bags and iPhones.  We been doing it wrong this whole time boys
2020-06-02 00:37:29,AlonneCaptain,1,Got 9 contracts exp 6/19 for AVGO. Exit before or after ER?
2020-06-02 00:37:27,HarbingersRefuge,2,Is there any way to buy calls on the local fence? I think he’s about to have a lot more inventory.
2020-06-02 00:37:22,knicksAHgoat,-2,"https://twitter.com/b_fung/status/1267595260894552066?s=21

maybe because they got tested right before? ratio'd cuck lmao"
2020-06-02 00:37:07,GamblingMikkee,-1,The $USD is worthless
2020-06-02 00:36:54,CoconutSh,1,Anyone holding CRWD through ER or did ZS already drive the run up?
2020-06-02 00:36:42,Bgt098,15,Trump’s Operation warp speed actually refers to the virus spreading exponentially during these protests. At this point we are just going to try herd immunity.
2020-06-02 00:36:32,lilfianchetto,1,"big glorious green dildos oh what a surprise. bears were rejoicing at the prospect of a red day once they saw their measly obligatory -.5 futures indicator. not this time, not ever, ol' smokey"
2020-06-02 00:36:07,CallsCallsCallsCalls,9,"Just had a fucked up series of thoughts that went like this:

1) The protests marching down the street today seem to be getting along better with the cops and vice versa. Maybe we'll settle down and it will continue to be peaceful. 


2) Things are crazy, I remember when my mass shootings were our biggest problem, I wonder what happened to that?


3) Oh yeah, the pandemic. There was no one in large groups to shoot at probably. 


4) Wait a minute, the mass shooters were usually mentally ill racist white guys.  Maybe they don't exist anymore?

...

5) Shit. Better buy calls."
2020-06-02 00:35:57,moongoose16,1,"I really like VSTO tomorrow. Target hold date is until the election. 

They sell ammunition of all types, to the private and public sector.  They also sell non-lethal ammunition to law enforcement. 10% of sales according to their 10k is from law enforcement.  Got a bump today, but seems like there is still a long way to go.  They basically already said they can't keep up with demand and are planning on pumping out as much as they can make all summer long...

Thoughts???"
2020-06-02 00:35:55,IAmConsidering,0,I truly wonder why we think our own voices sound so bad? Is there any reasoning behind this?
2020-06-02 00:35:53,ottermodee,14,Biden needs to stop pandering to every audience so hard if he wants to win imo. Just don't act retarded and the presidency is yours.
2020-06-02 00:35:41,MOTHMAN666,4,"Feels like we're trading on pins and needles, Jerome can only print so much before... something happens"
2020-06-02 00:35:40,Japples123,1,Trump wants to teach overnight bag holders a lesson. That is what I’ve learned
2020-06-02 00:35:34,ensoul,6,Green by 3am
2020-06-02 00:35:22,cutiesarustimes2,3,I'm confused why don't all these protesters pick up the tear gas cans and throw them back
2020-06-02 00:35:22,2Mango2Tango,3,"Anyone else think Tesla is going to come back down if they don't have more good news? I know the SpaceX rocket was a good sign for Elon, but I'm not sure it raised Tesla's value by 8%."
2020-06-02 00:35:01,Turlututu_2,4,who is marshall and what is his law??
2020-06-02 00:35:00,PaperShark0001,6,Cnn=fox for bias right?
2020-06-02 00:34:57,poppamack,11,I honestly don’t even know what to think anymore lol
2020-06-02 00:34:56,OblivionXBA,1,How far we got WORK going this week? I’m wondering how long I should hold my 10x 40c’s
2020-06-02 00:34:56,houseatreides1776,1,https://twitter.com/hal_1415/status/1267610661678243840?s=21
2020-06-02 00:34:51,orlando_ooh,2,"Why do I play SPY when there are so many companies out here 

07/17 310c"
2020-06-02 00:34:36,option-whisperer,-3,How about dem dare futures!
2020-06-02 00:34:33,,5,"Europe, I know I’ve said some terrible things about you, none of which I take back. But we’re kinda having a thing right now so if you can please pump up futures a little tonight? Thanks."
2020-06-02 00:34:30,pillow38164926,10,"#BEFORE RIOT:

Hey babe where’s the crockpot at?



#AFTER RIOT:

Aye babe where my new Chanel and Prada shoes at?"
2020-06-02 00:34:20,yachtking1,-1,"Due to the protests a second wave starts, mail in ballots required, they steal the election. Fuck that bullshit"
2020-06-02 00:34:12,bizobingo,1,How would President Taft impact the market if he was currently president?
2020-06-02 00:34:06,smackinov,1,Lol that 8 pm pump right on schedule
2020-06-02 00:33:59,thepatientislight,2,PCG should be at an ATH right now. They can blame fires on looters.
2020-06-02 00:33:55,GamblingMikkee,1,Wowo $USD dying again
