date,author,score,body
2020-08-14 04:42:39,slightbulb227,3,Serious Q: Does Robinhood let you sell covered calls on stocks you bought on margin? Or did ironyman ruin that?
2020-08-14 04:42:27,elija_snow,4,"I love CNBC article: China didn't keep up their end of the Phase 1 bargain of  the deal, but we need them to buy more soy because of RED STATES. LOL"
2020-08-14 04:42:25,AirspeedIsLife,4,Buy some corn stalks with some CORN stonks
2020-08-14 04:42:23,mannequit,6,"all in on SLV puts bought at the top today

oh lord"
2020-08-14 04:41:42,welwheel,16,Been eating like shit these days calls on my weight
2020-08-14 04:41:19,FalconGhost,4,No stimulus fucks americans and SLV gang
2020-08-14 04:41:16,narcandistributor,6,anyone ever go on twitter and just fuck with people? I was trolling people on forums back in 2003... OG troll right here. Can't keep up with you young bucks though- keep up the good work.
2020-08-14 04:40:51,hoobaacheche,1,Can you buy and hold VXX shares or do they expire?
2020-08-14 04:40:32,LMY723,2,"Why’d y’all bet on mattresses, we told you. COB. MOB."
2020-08-14 04:40:31,SaqJones,17,"https://twitter.com/redtraccoon/status/1294009923907485699?s=21

Congress went on a 3 week vacation today amidst no stimulus or unemployment extension.

Im probably not voting anymore."
2020-08-14 04:40:22,mootymoots,2,"Metal Gang:

8.30am eastern the retail sales measure is released for August. Expecting 1.9%. If it goes higher, that’s bullish for the USD, which could drop metals. Lower is bearish for USD, which should be positive for metals. 

Other things at play obviously but something for the radar."
2020-08-14 04:40:16,sjmarch33,2,Sep. 18th $NAIL calls
2020-08-14 04:40:14,The_toast_of_Reddit,2,How long until APPL hits 500?
2020-08-14 04:40:04,MoneybagginYourMom,7,Aapl $500 baby
2020-08-14 04:39:42,ayysilver,5,imagine posting back in March saying that SPY will be back at all time high by the summer
2020-08-14 04:39:40,trainwreck001,0,BULLS are Fukkk
2020-08-14 04:39:28,Rhokelly,17,You're the best big brother I could've ever asked for
2020-08-14 04:39:27,EssentialUSAWorker,6,Who else has a CyberTruck reserved?
2020-08-14 04:39:25,macklin1287,2,"To the guy that said Dame was only good iN tHe ReGuLaR sEaSoN you can politely eat my ass now. 

CCL leaps"
2020-08-14 04:39:19,tryagain1985,1,"Sorry if this is a stupid question I’m fairly new but.. wouldn’t it be a good idea to buy like an October call close to the money for say, amazon, and then just sell weekly calls that are 5-10% otm and pocket the premium over and over? Seems like quite low risk, you might get hit once but then you just pay the premium but that means your call probably went up in price a bunch too. Where is my flaw in this reasoning please help?"
2020-08-14 04:38:59,TheTigersAreNotReal,3,Die DXY
2020-08-14 04:38:46,YoYo_Da,7,Check out 10Y bond yields this week vs the early June rug pull.
2020-08-14 04:38:45,Swartzcoff,8,Anyone else think a wsb yacht party would be fun af?
2020-08-14 04:38:35,Kombucha_Slim,8,"Ever read investing .com comments?

Those pplnare idiots"
2020-08-14 04:38:26,nosalute,7,/u/CptTonyStark the type of dude to yolo 5k into a 0DTE option and not have any day trades left
2020-08-14 04:38:23,choose_a_use,3,Buy SPX 5 points otm 0DTE call at 3 pm tomorrow to make 10x
2020-08-14 04:38:00,SlAddict,3,"How much will my PRPL 35c fall? I was already up like 20%(3900$ and I plan to buy a Tesla by 2021 when Covid is cured) but people r talking shit. I read that there’s “unlimited risk” so I don’t want to sell calls, is it possible to lose more money than I put in? What kind of Tesla should I buy?"
2020-08-14 04:37:17,ductrinhgogo,3,Hey guys tesla call for tomorrow?
2020-08-14 04:37:15,AceVonSpades,-14,Down voters are out in force tonight..
2020-08-14 04:37:04,FearlessTrader,1,My W puts don’t feel so good looking at the futures 😕
2020-08-14 04:36:34,atoweru,7,"Thank you to whomever posted that Cramer Manipulation video today. Really interesting information that explains a lot. 

Given that we’re at near ATH and in the midst of stock splits and vaccine news, I feel like there’s going to be a lot of fuckery tomorrow and into next week"
2020-08-14 04:36:12,choose_a_use,0,Got out of idea to sell 20strike  puts on PRPL
2020-08-14 04:36:02,SocialSuicideSquad,4,"Silver, stop being so coy, we know you're showing us 30 tomorrow."
2020-08-14 04:35:59,Jackandgrill,4,"US-TECH looks bearish, thin air up here."
2020-08-14 04:35:16,choose_a_use,1,Tell me about what you’re bag holding now
2020-08-14 04:35:16,devildog9,-5,Bears are fukkkkkk
2020-08-14 04:34:55,nosalute,7,My hand smells like kimchi but I haven't had kimchi in years
2020-08-14 04:34:47,Boomhauer_007,1,Does anything consistently gain like 0.5% AH? I always toss my leftover money from a day into random stock shit but then stuff like DDOG and BIDU happen and I feel extra retarded
2020-08-14 04:34:47,JimbatheLion,15,"OKAY BEAROTHERS. 

Eviction protection expires Aug 24. Rent will be due for September 1st and well. Somewhere in this time frame we will see massive pulling out by retail since no more Trump bucks. That will be our rug pull. Mark it on your calendars and remember I told you so."
2020-08-14 04:34:06,throwAwayMyCsDegree,2,Thoughts on ACLS? Bid ask sucks but got an upgrade from a big analyst
2020-08-14 04:34:00,Yamilo_oWarrior,10,This barely green I’m gettin puts tomorrow
2020-08-14 04:33:02,PM_ME_HOT_EEVEE,14,"I fear what will happen when the market realizes up is not an option

Haha just kidding I bought puts"
2020-08-14 04:32:13,HiBoobear,5,Does TSLA poke 1700 in the ass tomorrow?
2020-08-14 04:31:45,EssentialUSAWorker,15,I honestly have no idea how people afford $60k pickup trucks
2020-08-14 04:31:35,ThePeoplesBard,-6,"If you Bull cucks don’t reach out and grab ATH tomorrow, I’ll be a Bear for life. Your low T, lazy, lounging climbs are disgusting. Wake up. Fuck. And get the job done."
2020-08-14 04:31:32,Hugepenisinbutt,-8,"People are always confused on why large cities are democratic and rural cities are republican for the most part. Most people think its because large cities are better educated than rural cities but they are mistaken. It's because in a big city when you're poor you're in far more agony because you are near people who are rich and have so much more than you. In rural cities everybody is poor like you for the most part therefore you don't feel as poor as some poor in the big city does. Modern democrats cater to those poor poor people and ""help"" relieve some of their poorness with welfare/food stamps/subsidized housing etc etc. Rural poor folk don't consider themselves to be in need of ""help"" and are more on the side of fuck off with your help the less of you the better. The only problem is that both parties are actually for larger government these days and so in reality it doesn't really matter and needs to get overthrown so we can have a reset back to the constitution and try this again. Anyways i still got calls on HD and this shit is going to pump."
2020-08-14 04:31:12,121518nine,6,when is MSFT gonna go $220
2020-08-14 04:30:33,theineffablebob,10,"Are we seriously not getting stimulus

Market is gonna drill isn’t it"
2020-08-14 04:30:25,jcreamsickwhooo,0,CETV calls? Or stay away
2020-08-14 04:30:05,nosalute,5,"Yo wtf the guy that downgraded AAPL is a 5 star analyst

[https://www.tipranks.com/analysts/amit-daryanani](https://www.tipranks.com/analysts/amit-daryanani)

But it also says to buy CSCO so......."
2020-08-14 04:29:51,Tokin_Daley,18,"""Yeah mom I lost most of my life savings on silver and mattresses but corn is going to bring me right back."""
2020-08-14 04:29:26,wolfenstein1998,0,Anyone knows why futures are  so flat for the last 2 days? Are we waiting for a data to come out?
2020-08-14 04:29:20,ayysilver,0,anyone think we see SPY 250 before the end of the year?
2020-08-14 04:28:55,RayCashIsTrashDalio,7,"when futures arent being manipulated, this is what it actually looks like. flatter than ur grandma's titties, low as fuck volume. its mostly just retail traders buying 1 contract size at a time hoping for a random PPT pump like back in the april/may/june days"
2020-08-14 04:28:01,liquid_swords,4,"I’ve been away from this sub for awhile, whatever happened to the mod who tried to monetize this sub and organize some sort of bunk sponsored trading competition? Is he trading corn futures from a halfway house these days?"
2020-08-14 04:27:18,Tjhuntz,12,Made it to the 5 figure club yesterday now to take it to the 6 and not fuck this up definitely do not tell me plays
2020-08-14 04:27:04,Dedent98,0,SLV gang futures not looking so hot
2020-08-14 04:26:51,605_,1,What’s the play for Mondays earning reports
2020-08-14 04:26:35,Estri_Grobbulus,1,Two extremely boring days in a row for futures 💤
2020-08-14 04:26:29,tendie-dildo,-2,Did Trump say anything wild today?  🤥🤗🤥
2020-08-14 04:26:20,pron_site_operator,11,"This week's price action could be the result of price pinning by the MM's knowing that there are probably people loaded up to either take advantage of a near certain move to test the ATH's or to profit from a rejection from ATH's, but what to keep pin the prices to rake in that sweet sweet theta.  Either way smart money is just waiting on the sidelines right now so prices aren't really moving convincingly in either direction."
2020-08-14 04:26:15,BaruchFeldheim,4,"I have a 23.5 kohl’s call expiring tomorrow. Good fucking riddance, it’s not gonna hit and I’m tired of looking at it so I’m happy to eat the loss."
2020-08-14 04:26:12,The_toast_of_Reddit,-8,"Trump is a 5/10 could be worse, could be better but I'm not going to waste my time with the whole biden Vs. Trump thing. Hell I don't feel motivated enough to go to the polls.

All trump needs to do at this point is push for Pot to be legalized with an EO or something. If the Republican leadership freaks out then do the Hearing Protection ACT through an EO.IF you're an out of touch boomer the HPA would  allow you to go to a hunting shop, do a quick background check, and let you bring home a suppressor without needing to mess around with tax stamps."
2020-08-14 04:26:06,thesafegambler,7,RESISTANCE BECOMES SUPPORT
2020-08-14 04:25:47,qwpajrty,-1,Futures bloody green. Why bears happy?
2020-08-14 04:25:15,uniaintshit,8,"That Epic game ad taking a shit on Apple was so clever, it’s perfect trigger for their user base to rebel against the evil empire (Apple)"
2020-08-14 04:24:46,Tjhuntz,11,Calls on the vix 3 weeks before election seems like free money
2020-08-14 04:24:46,throwmeawayafter111,11,I'm boutta do the my last final of the term 🤞
2020-08-14 04:24:14,thesaddestcuck,1,♿️🐽♿️
2020-08-14 04:24:07,Thevoleman,7,"Dropped 10k into PRPL over the past 2 months, going to fucking hurt tomorrow."
2020-08-14 04:23:26,Lief1s600d,5,"Wtf, 107 tomorrow. Jeez"
2020-08-14 04:23:23,YoYo_Da,17,Bruh. Today was the 100th trading day since March 23rd. 100 trading days to recover SPX almost completely and to set new ATHs on so many companies.
2020-08-14 04:23:20,nosalute,5,""" will be hosting a protest outside the evercore office tomorrow if anybody wants to join "" - 17 year old hedge fund manager😂😂😂

 [https://twitter.com/rvc330/status/1294119826995269633](https://twitter.com/rvc330/status/1294119826995269633)"
2020-08-14 04:23:14,StreetSweepingKing,1,Been eying RST and other Ed tech stocks. For a bit now. RST had a buyout rumor a few weeks ago but no news since. Anyone have any DD on it?
2020-08-14 04:22:21,atomic_gecko,1,I’m so fucked up I haven’t looked at futures yet. TSLA BABY. BRR GANG.
2020-08-14 04:22:08,reditt84,1,"If AmD was able to make a run after earnings the WMT can too. 
Buying calls tomorrow"
2020-08-14 04:22:06,GnarlyPounderWoo,12,"My dad has tons of gold coins. I mean hundreds, I don’t think he knows the spot price of gold and silver he just collects them. I thought it was $5 coins he was collecting, them shits are 500-2k a piece now. Hes been hoarding since 80’s. 💎🖐🏾"
2020-08-14 04:20:59,choose_a_use,2,Get approval for futures and stop cribbing about 25k rule. You need about 13k to trade each /ES contract where each point nets you $50. Also effective tax rate is 23% for futures assuming you make any money
2020-08-14 04:20:38,jl109445,4,Ppl acting as if evercore downgrade will tank APPL 😂
2020-08-14 04:20:37,weshuhangout,14,"SLV gang, SLV gang, SLV gang"
2020-08-14 04:20:23,ExcellentInflation0,3,"Some men run on different principals. Some men cannot be bought, swayed or bargained with. Some men; just want to watch the world burn. CB Friday. No stimulus is a big fuck you to the American populace. Aka stocks only go up."
2020-08-14 04:20:14,FalconGhost,1,This week has been choppy AF for me. I think it has been net neutral. C’est la vie. Didn’t have the risk energy
2020-08-14 04:19:41,Thevoleman,3,"Still holding 20k of FSLY shares, will be 100 again."
2020-08-14 04:19:25,jabracoroni,4,options be a tax on autism
2020-08-14 04:19:09,obiwang,11,I put about 63k into Robinhood earlier this year when I knew pretty much nothing about options. I have 54k left now. Lots of ups and downs but the 9k loss was mainly from buying tsla 1700c 7/17 like a fucking retard. Hope I can get back to green this year so I can hide my loss from wife during tax season.
2020-08-14 04:19:03,ElonTaxiDriver,4,Don’t be bearish here and you won’t get downvoted. Stupid bears
2020-08-14 04:18:27,AdrianThatGuy,27,Tomorrow I have a first date after so long! I’m excited for it!
2020-08-14 04:18:21,tommylty,3,Will tdoc go back to 200+? I’m so worried
2020-08-14 04:18:19,PeakOfTheMountain,34,"Sup bears. Just a quick fuck you before bed. Love, bull gang"
2020-08-14 04:18:08,xesus2019,6,"96 million single family homes in the United States * $300,000 each, is about 29 Trillion Dollars, worth of homes.

The same amount of wealth (30 Trillion) that the 1% have tucked away in offshore bank accounts?

The homes get PROPERTY-TAXED through the nose, at about 8 or 9 percent per year.

The offshore money doesn't get taxed, at all.

How did that happen?"
2020-08-14 04:17:47,MoarTarriffs,4,"[WSB prediction poll for tomorrow ](https://www.strawpoll.me/20765738)

This sub is 23/39 on predictions so far"
2020-08-14 04:17:43,WagieInTheCagie,14,I feel an obligation to jerk off even when I'm not horny. It's a routine thing you now? Gotta empty the pipe
2020-08-14 04:17:37,toasted_t_rav,12,"As soon as I saw the sheer number of people talking about PRPL in this sub, I closed all my positions. Get rekt nerds"
2020-08-14 04:17:37,-rigga,2,Holy fuck. Why haven't I been running the wheel strategy this whole time. Anyone here running it on any of their accounts?
2020-08-14 04:17:34,MakerofMarkets,2,Alexa play Father of Mine ft. JPow
2020-08-14 04:17:28,geooooorge,1,where you guys get your stock market news?
2020-08-14 04:16:59,Not_reddits,11,#That bitch Carole Baskins!
2020-08-14 04:16:50,HourPackage,1,"Lack of stimulus has to eventually get priced in or we get a double-dip recession. Which is going to happen first?

VV"
2020-08-14 04:16:23,DankMemelord25,6,I am saddened by the lack of imagination on CLANG GANG. Gold to 3k and SLV to 80 EOY. You will all be sorry if you sell early!!! Gonna feel like a 🤡🤡🤡
2020-08-14 04:16:19,SwoleStoner,9,What’s your ATH in gains and what’s your gains/loss as of right now?  I was up $30k now down -7k
2020-08-14 04:16:11,Tjhuntz,3,This news about forknife is bullish AF when apple and google combine they make mega lawyers when the case is dropped to the fuk moon
2020-08-14 04:16:08,ascendant23,3,"In writing and programming the cliche is ""I have an idea, you write / program it, and we'll split the money"" - the idea is everyone has a million ideas, but actually doing it is what counts. But here in WSB it's ""I'm droppin $5K on a YOLO what should I buy"" 

Can you imagine if everything was like that? ""Yo, I'm gonna spend the next ten months of my life writing a novel - anyone got any story ideas?"""
2020-08-14 04:16:05,wd1998313,2,I have visited 3 McDonald's in NYC today. Non of them even heard about the coin thing.
2020-08-14 04:15:42,Meme_Burner,2,"So I got tired of losing money on RH, need a change of scenery. Hows Ally? or TD Ameritrade?"
2020-08-14 04:15:38,NSAsnowdenhunter,-1,Anyone feel like there could be a big limit down either Tmrw or Monday?
2020-08-14 04:15:34,choose_a_use,4,Load up big time on AAPL if there is a dip tomorrow
2020-08-14 04:15:24,TimeBndit,3,Sup
2020-08-14 04:14:51,Emerl,3,I wrote a post making fun of NET but was actually quite surprised it ended the day red. Literally the red headed stepchild of the cloud family.
2020-08-14 04:14:47,Teachyouright,5,Facebook is gonna jump 5 dollars
2020-08-14 04:14:22,choose_a_use,2,"https://twitter.com/livesquawk/status/1294116123613462529?s=21
AAPL opens at 468"
2020-08-14 04:14:16,welwheel,-6,"SLV gang in shambles, futures down 1.5"
2020-08-14 04:13:58,Nemo-pluribus-unum,6,"AAL is the most manipulated stock. Change my mind.

See below, how it's done:

https://www.cnbc.com/amp/2020/06/12/cramer-thinks-wall-street-pros-may-be-playing-a-game-with-amateur-robinhood-traders.html

https://youtu.be/gMShFx5rThI"
2020-08-14 04:13:28,MattDamonIsGod,5,If I bought every noontime dip and sold at 3 PM I'd be a millionaire by now.
2020-08-14 04:13:27,Jeanne_D_arc-,10,Stimulus bill not getting passed anytime soon and we can't even get -1% lol
2020-08-14 04:13:17,ControlAltDelTiddy,8,"Who here remembers all the ""We're in this together"" commercials from March. All I see now is ""buy our shit we don't care if you have a job 🤷🏾‍♂️""."
2020-08-14 04:12:27,junsy85,0,"NVDA calls,   surge after a increase in stock value."
2020-08-14 04:12:07,CaptFeelsBad,7,"EpicGames - “fine. I’ll start my own service...with black jack and hookers!!”

AAPL & GOOG - “*shuts door*”

EG - “on second though, fuck the black jack and hookers, I’m suing you.”

Everyone “hehe you’re in danger.”"
2020-08-14 04:11:56,Donttouchmydorritos,0,"Guys brain fart

What’s that Twitter account name for market news? Is it livesqwuak? I literally can’t think of the name."
2020-08-14 04:11:42,Lief1s600d,14,"Watching Mad Max, and all I can think about when he says ""You shall ride eternal. Shiny, and chrome,"" is silver gang."
2020-08-14 04:11:09,MakerofMarkets,3,Is this hell? This is hell isnt it
2020-08-14 04:10:31,DOESNT_BE_LIKE_IT_IS,11,on episode 3 of true detective. Like this if you think i should get off wsb and continue giving it a shot
2020-08-14 04:10:29,SwoleStoner,8,"Just need to recover $7k more in losses before I break even. I can do this, right?!"
2020-08-14 04:10:15,FalconGhost,12,Robinhood be like: we don’t trust you morons to trade 0DTE options
2020-08-14 04:10:01,Not_name_u_lookin_4,10,"How is this not the top?

https://www.reddit.com/r/RobinHood/comments/i9f3lf/cant_figure_out_how_to_withdraw_money/?utm_medium=android_app&utm_source=share"
2020-08-14 04:10:01,nafinmasjid,-4,"lately, ive been, ive been thinkin"
2020-08-14 04:09:53,shabbos_roller,7,"The best way to create value out of thin air is to split your stock so more people buy it.  

It’s science."
2020-08-14 04:09:50,hodlforlyfe,0,"Yawn, boring futures"
2020-08-14 04:09:27,tacspeed,2,What is wrong with JD
2020-08-14 04:08:35,worsethanwetsocks,4,no point of watching futures anymore. boring unplayable spy is back for a few weeks
2020-08-14 04:08:27,SocialSuicideSquad,0,"So no stimmy until Labor Day confirmed.

Can Trumpy save my calls?"
2020-08-14 04:08:24,jackohh22,1,Dkng better fuck up earnings
2020-08-14 04:08:06,The_toast_of_Reddit,14,"becoming rich through day trades is not hard.

What's difficult is not being greedy and knowing when to close a position.

Look at mattress king."
2020-08-14 04:07:50,thestashman23,7,"Fuck Evercore, none of my homies fuck with Evercore. If we see Evercore, it’s on sight"
2020-08-14 04:07:31,yushey1,5,BABA is down on honk kong market. time for cheap calls tomorrow for the earnings run up :)
2020-08-14 04:07:31,nosalute,1,"AAPL vs Fortnite ESPN 8PM EST 5PM PST

3 rounds. Anything goes. book it"
2020-08-14 04:07:30,shabbos_roller,2,So how about that Sorrento IV crush tomorrow?
2020-08-14 04:07:01,2Mango2Tango,1,This last hour of futures has been boring af
2020-08-14 04:05:52,throwaway78907890123,-7,This Fortnite things is going to fuck AAPL tomorrow isn’t it?
2020-08-14 04:05:52,mv4lent3,4,BA 🌝 tmrrw
2020-08-14 04:05:43,shabbos_roller,8,Tech calls....aaaand tech calls.
2020-08-14 04:05:25,ElPatronDelDesierto,6,"All this talk of CORN makes me think of the movie Trading Places - a classic comedy starring Eddie Murphy and Dan Ackroyd (commodity trading features prominently in the film). All you kids who haven’t seen it need to go watch it now, it’s a fantastic movie."
2020-08-14 04:05:24,Buildingdetroit,5,As to that APPL downgrade. That no name firm is either a salty bear that owns them or it is a chinese company as Epic is owned by Tencent. The US will never let a chinese company win this suit. 十二个春秋twenty springs and autumns FUCK YOU CHINA remember tiananmen square
2020-08-14 04:05:19,MakerofMarkets,10,"Would have been cool if we evolved different assole shapes like those playdoh machines. 


Some people would have star poop. Some people would have triangle poop ect."
2020-08-14 04:05:14,choose_a_use,2,I like TD over Etrade. More transparent on commissions and much much better app. Btw anyone knows how to see ytd commissions paid on etrade?
2020-08-14 04:03:43,Cramer4President,0,Easy money
2020-08-14 04:03:32,LOLWOWgetWAXED,9,Eastern time zone the GOAT time zone. Imagine having to wake up at ungodly hours or trade these small time markets.
2020-08-14 04:03:19,tdotz123,5,I bought 4 tsla 1600 puts for tomm at end of day today. Who thinks we see a bit of a pull back?
2020-08-14 04:03:13,lakersttgy,-5,Rip anyone holding Apple calls
2020-08-14 04:02:44,jmatACT,14,God Covid 3 days before college move in. I’m literally about to gamble all my money
2020-08-14 04:02:44,bye_ear,1,The restrictions on posting here about issues that actually affect market movement are dumb as shit.
2020-08-14 04:02:28,Mdalkirk,2,Just learned about the term ‘aroflux’ but it just sounds like how 99% of people are  ? Maybe I’m not getting it
2020-08-14 04:02:23,tendie-dildo,5,"There are dumb people, then there are people who still post in the daily thread and not 'what are your moves tomorrow' thread 🙄"
2020-08-14 04:01:44,fuddermuffin777,12,Reading through r/Unemployment makes me sad
2020-08-14 04:01:07,VTaco7,7,Here to watch the PRPL massacre
2020-08-14 04:01:02,oughmoment,6,Dropping 4K on a yolo any ideas
2020-08-14 04:00:58,Chicano_Ducky,-5,why SLV dumping?
2020-08-14 04:00:56,hoodedcactus,3,"DXY rejecting $93 again today was interesting, we could realistically consolidate here through around the election then have the dollar breakout once stimulus/monetary policy changes"
2020-08-14 04:00:54,TSLAQ_FTW,3,CORN is where its at for the next week.
2020-08-14 04:00:18,MattDamonIsGod,1,I hate arcades. They're lame. Why would I go somewhere and play games that are worse than the ones I have at home? If I'm going out somewhere I want it to not just be a bad replacement for what I do already.
2020-08-14 04:00:08,Boryuha,3,Dame DOLLA
2020-08-14 03:59:49,Staygangponyboy,5,"Guys be smart BEFORE getting into corn. 

This ticker is already rinsed till next May - early July, don't get stuck on this bag. 

Just check the 5Y, it jumps and falls the same time every year."
2020-08-14 03:59:45,br0botic,17,"One of these days, a dump won’t just immediately V back up. Probably when I am no longer solvent..."
2020-08-14 03:59:35,ThePeoplesBard,5,"So can someone tell me why I shouldn’t buy 2021 calls on airlines far OTM? Even if one goes bankrupt, the rest would pay for the others. Right?"
2020-08-14 03:59:22,nuthatch43,4,How are my aapl calls doing?
2020-08-14 03:58:52,drkgla,8,Easy mode is just buying square calls and uninstalling the app
2020-08-14 03:58:37,youngdoug,7,Would you guys let Jesus Christ hit it raw or would you make him wear a rubber? Asking for a friend
2020-08-14 03:58:29,Mdalkirk,6,New fresh prince of bel air ? 🤔 I’m in
2020-08-14 03:57:49,Effective_Stand,3,Why do I hold puts overnight? Pajama traders literally never let it go red overnight and yet every few weeks I say tonight's the night. Then I stay up all night thinking how I never learn my lesson. I deserve to lose money.
2020-08-14 03:57:21,manufacture_reborn,14,"Everyone is sleeping on Planet Express (PLNX). Deliveries are through the roof these days, and their C-Suite is full of go-go 80's Reaganauts. I'm thinking they get acquired here soon. MOM probably?"
2020-08-14 03:57:03,choose_a_use,14,AAPL getting downgraded is hilarious. Fomo gang never stops
2020-08-14 03:56:48,g____19,17,How many of you are also drunk rn?
2020-08-14 03:56:29,nafinmasjid,8,time to listen to some drain gang
2020-08-14 03:55:40,youngdoug,8,"This market is fucking lame, not really looking forward to another day of bobbing about 337 with fake dumps sprinkled throughout. 🤬"
2020-08-14 03:55:13,winkerpack,18,"Maybe an unpopular opinion here, but i wish corona never happened 😕"
2020-08-14 03:55:02,ONLYBUYCALLS2020,3,Switching over to Intel since AMD lost the juice for now.
2020-08-14 03:54:17,FFaddict13,7,Felt cute at close and YOLO'ed my entire portfolio into 0DTE JNUG calls...going to do some Nyquil shooters and set my alarm for 9.
2020-08-14 03:54:01,black_and_shredded,8,[AAPL downgraded](https://twitter.com/livesquawk/status/1294116123613462529?s=21) + Fortnite controversy = beautiful weekend calls at the inevitable dip
2020-08-14 03:53:54,CroissantDuMonde,3,Someone give me the tl;dr of what happened to PRPL? thx bb
