date,author,score,body
2020-04-28 01:14:37,yosheroni,0,Ughhh.. why is crude dropping?? Bringing futures down. Fucking BS
2020-04-28 01:14:31,Nonotreally999,1,Odd. Futures usually moon in anticipation of China open but tonight they're hammering.
2020-04-28 01:13:46,love2fuckbearasshoe,2,Watching. WWE RAW WTF THET DISOBAYING SOCIAL DISTANCE !!!
2020-04-28 01:13:31,Sirwompus,3,https://youtu.be/Sff7Kc77QAY great foundation for the next bears r fuk meem video. I lack both the motivation and skills to pull it off but someone here should.
2020-04-28 01:13:14,neutralpoliticsbot,3,"I got $200 SPY puts lol some guy name control the narrative told us we drop to $180 

did I get scammed?"
2020-04-28 01:13:06,spy66may,7,VIX futures up 1% LET'S GOOOOO
2020-04-28 01:12:59,feral_tit,2,defense against the dark arts is ordering small when the Wendy’s clerk asks medium or large
2020-04-28 01:12:49,,1,Red rocket red rocket whee!
2020-04-28 01:12:39,HotStockSlinger,3,"[My fire tonight turned green, bears r fuk](https://i.imgur.com/U4GPKmI.jpg)"
2020-04-28 01:12:39,bmrjmr,2,It seemed like last week it was the only thing that brought market down a little.  Short and just trying to unwind this shit show ASAP.
2020-04-28 01:12:33,Shacreme,7,"I'm sorry for raging but is the Fed seriously bailing out CRUISELINES? Why dafaq do they deserve a BAILOUT? I seriously cant believe that when I went off to my family about this my grandparents and my parents didnt care, but when it's about Medicare for all, they just grow horns and get pissy. I want to see them without their Social Security and Medicare. I'm sorry for getting this angry, but seriously.....no one brings up the question of ""How are we gonna pay for this"" or ""Money doesnt grow on trees""......Fuck this."
2020-04-28 01:12:21,TheLastAckbar,4,"These futures are as red as us bears are getting this week, take it in, boys."
2020-04-28 01:11:42,optionseller,0,how do I get leverage in selling options? I applied for selling naked call/put but TD Ameritrade rejected my request
2020-04-28 01:11:30,loIigasm,2,"When it’s tax time, do you pay based on what your final profit is after losses, or do you pay taxes on all profits regardless if you lost it?"
2020-04-28 01:11:26,kilorunner,1,Is if too late to get into NAT or other Tankers?? My money doesnt come into Robinhood until tomorrow
2020-04-28 01:11:16,yeppersOTM,6,"Not too late to buy $NAT. Worst case scenario, you make me money am i rite"
2020-04-28 01:11:12,mattbeau80,4,"Is RH just impossible to close spreads? What’s the secret? OPC says they’re worth about .18 each and I couldn’t even get them to close at .15 each. Open interest for the longer call is at 7,000 so what gives?"
2020-04-28 01:11:09,bdepz,2,Fed two day meeting starts tomorrow right?
2020-04-28 01:10:55,JacobAguirre9,-1,SPY PLEASE HIT 285 and then go back up
2020-04-28 01:10:54,RybosWorld,1,Any of you mad men sell leaps?
2020-04-28 01:10:27,LehmanParty,3,"The 20 day chart gives me hope for my puts, but the fact that I'm looking at the 20 day chart for hope brings me despair."
2020-04-28 01:10:21,xxyoungmoneyxx69,1,"Anybody in here trade FI? Thoughts on energy/utility credit spreads? Can't seem to find any paper with attractive yields at par for the last few weeks except energy/utilities (BKR etc.) - back to ""pre-crisis"" trading environment"
2020-04-28 01:09:58,yosheroni,-3,Rona is overblown
2020-04-28 01:09:49,cireb5,1,Is there a way to play WTI Crude front-month futures without risk of receiving physical product? Something like USO that isn’t constantly shuffling/rebalancing months?
2020-04-28 01:09:12,OldAdOpsMan,2,can we claim our losses on day trading on our taxes?
2020-04-28 01:09:11,BMH0918,1,HELLOOOOOOOOOOOO
2020-04-28 01:08:49,Schobeyy,5,"If Oil goes down, technically that means NAT should go up, right?"
2020-04-28 01:08:38,Osmosis_Bones13,8,"I really don't care if I am holding 10k in puts, I just want the market to go up cause my small cap pharma goes up with it and fucks all the jackass shorts that literally have been talking shit about my sweet baby for 3 years now. Bunch of paid short selling shills"
2020-04-28 01:08:12,mages112,4,"guys, I think I found our teacher

[https://www.youtube.com/watch?v=uzj1XLaFo3A](https://www.youtube.com/watch?v=uzj1XLaFo3A)"
2020-04-28 01:08:09,bmrjmr,3,Does OIL matter?
2020-04-28 01:07:50,balloonhi4000,1,"Think about more 2021 Jan leaps

AAPL

GOOG

MSFT"
2020-04-28 01:07:47,blueairplane123,4,I really hope NAT pulls more money into the tanking sector. Everyone sees how much NAT is up and either FOMOs into NAT or buys DHT or STNG instead because they have more upside
2020-04-28 01:07:22,splendidG00se,4,Fed blackout period ends Thursday. Any predictions for announcements resulting from meetings? No way they decide “more qe” is the answer right? Even the fed has to be freaked out at their balance sheet.
2020-04-28 01:07:22,balloonhi4000,2,MGM put credit spreads are amazing
2020-04-28 01:07:12,xxyoungmoneyxx69,3,Looks like names are trading up after earnings if they fulfill two criteria: 1) Capital on hand to sustain 12 months of operations at current burn rate; 2) Restructuring/recapitalization plan - this seems to be in spite of eliminating guidance for 2Q20. Backed up by convertible syndicate issuance compared to equities since 2/26 - buying within a standard deviation of current px seems like a good bet with how low IVs are in certain names (LOGI etc). TLDR LOGI 50C 6/19
2020-04-28 01:06:40,us1549,3,"Theta gang - as IV has tanked for most safe stocks, what's a good ticker to sell covered calls on expiring this Friday? High IV and a company you wouldn't mind bagholding if it goes against you...

I've got open positions on $BA $120P and $130P and $AAL $10P's expiring this Friday."
2020-04-28 01:06:20,dwdsquared2,5,"https://www.reddit.com/r/investing/comments/g98t1o/luckin_coffee_office_raided_as_china_regulators/?utm_source=share&utm_medium=ios_app&utm_name=iossmf

$LK Offices raided during investigation"
2020-04-28 01:06:13,thonagan77,3,Is NAT tapped out or is there still time for a decent play?
2020-04-28 01:05:47,A1739,1,It’s not too late to get into NAT calls
2020-04-28 01:05:20,winkerpack,5,Hey guys
2020-04-28 01:05:09,shotplacement,2,"DIS $125 5/15
Edit: muh sarcasm"
2020-04-28 01:04:41,nikusha333,2,So is NAT the third one up after TSLA & SPCE ? It’s all over the news lol
2020-04-28 01:03:54,Hupepak,1,How far out expiry dates work out best for you guys? Trying to not do weeklies anymore.
2020-04-28 01:03:51,moneyandbanking1,2,Are aliens bearish?
2020-04-28 01:03:32,consultant_25,-5,How does VIX immediately turn green on red futures and green on red futures? I thought VIX was based on future 30 days option positions. Someone explain it to me.
2020-04-28 01:03:06,Patroller69,6,"Alright, alright, bois. I need a tendie play for tomorrow otherwise I’m getting evicted"
2020-04-28 01:02:48,petersp8,3,293 and I officially become a bull again. Downward leg confirmed
2020-04-28 01:02:37,dayfly96,0,Does anyone stalk Elon Musk twitter to guess what TESLA will do tmr lmao.
2020-04-28 01:02:31,joey_minaj,13,"Praying for Bears tomorrow with futures mooning (+0.03%). Bears r so fuKk.

Edit: I mean Bulls. Praying for Bulls tomorrow with futures drilling (-0.08%). Bulls r so fuKk."
2020-04-28 01:02:11,Nonotreally999,1,God damn Asia just hammered futures gains
2020-04-28 01:01:23,GamblingMikkee,2,Honestly when does June oil contract hit 0??
2020-04-28 01:00:47,IronSunDevil,8,"Bull/bear r fuk aside, The U.S. has lost \~60,000 people to COVID-19 in basically 6 weeks, WITH shelter in place orders from every state, and the sentiment is that we should reopen and we went too far with shelter in place? Our entire country is retarded, redpilled, or both. Convince me otherwise."
2020-04-28 01:00:32,MaksG,1,"Got 5/1 NFLX calls just to see what happens, probably will go down lol"
2020-04-28 01:00:25,feral_tit,5,Collecting unemployment is like having slaves
2020-04-28 01:00:23,RayCashIsTrashDalio,-1,"pretty sure u should just stay cash gang this week. lots of earnings, lots of options will get IV crushed. since we're still in a relatively volatile market, its probably best to just buy options AFTER earnings after the IV crush. unless you want to play earnings. but shit like amzn nflx tsla amd nvda all seem to be priced in already, so im guessing like 80% of earnings plays will just be IV crushed"
2020-04-28 00:59:48,Yematulz,2,So many people are bullish rn. Red open confirmed.
2020-04-28 00:59:45,soupofbowl,1,hows everybody feeling about their UPS positions for tomorrow? up 25% 5/1 $105c **🙏**
2020-04-28 00:59:16,creature1231,3,The only thing that helps me sleep at night is the delusion that huge downward swings have an effect on markets.
2020-04-28 00:58:55,dayfly96,6,Pentagon releases UFO videos. Is this some kind of distraction?
2020-04-28 00:58:54,xxyoungmoneyxx69,3,Is l2fmw still alive
2020-04-28 00:58:18,gambler_no_1,-2,Why is vix 0 when it should be down by a percent since futures are green
2020-04-28 00:58:11,yyc1981sm,3,What is the best way to play oil without opening a futures account? Is it even possible anymore?
2020-04-28 00:58:03,tryingtogetgood,2,Looks like uncle JPOW turned the printer on!
2020-04-28 00:57:56,TheOriginalRK,2,any chance Tesla moons again tomorrow? Or all my calls fucked
2020-04-28 00:57:51,shagagav,1,Why a Bullish view for BA earnings?
2020-04-28 00:57:28,SVXYstinks,1,$WEN is almost back to ATH’s... gotta love this market huh?
2020-04-28 00:57:12,190octane,3,Hope those PFE earnings are good because I’m counting on my calls to save me from all of my horrible spy and iwm put plays.
2020-04-28 00:56:41,BVB_TallMorty,7,Tinfoil hat time.. think of all the times trump insulted Powell. Hes gonna wait to yank the fuckin rug out right before elections. Ultimate revenge move
2020-04-28 00:56:41,Cdales92,-7,Bears are fuk!!!
2020-04-28 00:56:24,browhodouknowhere,2,Amd is going to moon...on what idk...but it moons
2020-04-28 00:56:23,buijk51,1,Will BYND calls print tmr?
2020-04-28 00:56:19,moneynotwork,6,We’re getting to overbought territory testing 290 resistance if FAANG earnings don’t get us a breakthrough we going down back to test 260
2020-04-28 00:56:18,Dc1993x,-1,"These futures are flat AF 

Good news.. if you’re holding over night... your options might actually be worth something in the morning"
2020-04-28 00:55:44,BuyThoseDips,5,Amd calls for earnings > MSFT calls for earnings > AYX calls for earnings. Can’t go tits up
2020-04-28 00:55:36,Dykchaney,3,Whats up with all the oil/tanker shills with <1m old accounts tonight
2020-04-28 00:55:26,Nakura_,2,Dump LOGI 5/15C $50 asap
2020-04-28 00:55:25,hodlforlyfe,2,"I'm playing strangles, so I just want movement, but bruhhh how is this shit still green? We've had like 20/25 days green in a row. Ridiculous"
2020-04-28 00:55:19,isles478,3,Bears are on ventilators
2020-04-28 00:55:11,leomeng,3,"My dumb ass didn’t realize ZM was going to be added to an index, hence mandatory buying. Maybe it’ll crash after the 1st"
2020-04-28 00:54:45,cod_owl,3,I stick to like 3 or 4 stocks which I buy options and so far I’m up mostly. People would be better served if they avoided looking at unusual options activity or any of that bs.
2020-04-28 00:54:20,MostRetardedAutist,12,"Cramer said don't invest in stocks that have been beat down and might do well as states reopen. Stocks such as KSS, AAL, CCL, MGM, etc.  Guess what I'm buying calls on tomorrow?"
2020-04-28 00:54:16,GourmetFilet,5,Come Friday I’m finna bust out the Popeyes Blackened Ranch packets I’ve been saving for these tendies 🍗 🍗 🍗
2020-04-28 00:53:53,Panda_Pineapple,7,The best thing about futures is I never have to sleep and the markets are always open
2020-04-28 00:53:49,LostComradeInOhio,1,My DHT calls are up.  Makes me feel slightly better until I look at my F and SPY puts destroying me.
2020-04-28 00:53:28,PappleD,3,Spy 290 calls are literally free money
2020-04-28 00:52:36,MesmerizerLIVE,4,Sold some puts today. Not telling you degenerates what  on though cause you will ruin it.
2020-04-28 00:52:09,USFederalReserve,0,Do you NAT retards thing NAT's going to 14? Asking for a friend.
2020-04-28 00:52:07,cashmoneyballer69,6,$BA calls fo shizzle
2020-04-28 00:51:59,dbgtboi,42,just a friendly reminder that an interest rate hike at the end of 2018 by JPow scared the market more than an economic depression
2020-04-28 00:51:30,Jfri33ss,3,[guys should I do it? 😂](https://imgur.com/gallery/qYxUwgT)
2020-04-28 00:50:59,Enra_,2,"Don't worry bears, if your net worth is under $5 I'll double it for you for a blowjob"
2020-04-28 00:50:56,cod_owl,1,"Looking at the dt, it looks like 90% of this subreddit is bears. Do the bulls just not post here since they’re not losing money or is this sub just that bearish?"
2020-04-28 00:50:51,feral_tit,6,Why don’t ppl post pics of their one night stands prolly cuz no one here be havin sex
2020-04-28 00:50:27,pepperonibologna777,4,Spy 300 tomorrow
2020-04-28 00:49:53,lord_blankfiend,4,Stupidest. Thread. Ever.
2020-04-28 00:49:47,yeppersOTM,2,"Just put your life savings in NAT. Its my last 100 bucks, i need a rack plz"
2020-04-28 00:49:05,Crude_Future,2,End of day spy poots got me sweating!
2020-04-28 00:48:44,whatisliquidity,1,Anyone else pig out on HOG puts today?
2020-04-28 00:48:43,Philtrades,1,Honestly is USO dead in the water or is her finger twitching with some light at the end of the tunnel?
2020-04-28 00:48:37,WinXP001,3,"ah beautiful, perfectly set up to get fucked tomorrow with my trusty spy puts and good ol 5/1 amd puts. god help me"
2020-04-28 00:48:37,skabellyfurtado,0,Energy companies are actually cheap.
2020-04-28 00:48:29,skykitty89,14,"I got a check today for part of my inheritance from my grandmother who died at the end of last year... my mother said it would be smart to ""invest"" this... Do you think she means options?"
2020-04-28 00:48:29,gambler_no_1,2,I was so close to join bear gang at 260s I am not even kidding fr. God help me 🙏#bullforlife
2020-04-28 00:47:55,NoftScarlet,1,We probably -4% at open boiz
2020-04-28 00:47:48,ModelXtreme,5,"MY MOVE:  TSLA Calls.  Weekly.  900.

&#x200B;

Fight the Musk, get the Tusk.

&#x200B;

If the calls too scary,  I might go shares.

&#x200B;

SAFE.  HAVEN.  ASSET.

&#x200B;

Can't go down while people are still willing to buy at higher rpices (and they are, it seems -- another 10% day, back up to January prices, pre Corona, which people thought were insane then)."
2020-04-28 00:47:16,MorpheusOnAcid,0,MRVL or WORK weeklies?
2020-04-28 00:47:11,Pinaivan,6,I need help
2020-04-28 00:47:04,1secwhileiyeet3,6,Feeling puts for aapl earning
2020-04-28 00:46:51,nafinmasjid,7,What color Ferrari should I get once my USO $2.5C 5/15 prints?
2020-04-28 00:46:19,virtu333,2,"it is interesting that WING/CMG and pizza stocks boomin, while MCD/YUM/WEN have done relatively meh. 

I guess WING, pizza are more takeout/pickup, CMG is better at digital?"
2020-04-28 00:46:14,Am821,1,How y’all feeling about sbux for earnings
2020-04-28 00:46:11,TenMegaFarads,2,"Buy drunk sell sober, right?"
2020-04-28 00:45:51,adamparent,1,"So what's your call on the oil shipping industry before it comes to a halt? 1 month? And until then, are you out? Or are you jumping in? I've been eyeballing PXJ if prices level out"
2020-04-28 00:45:47,JefBezosExWifesNewBF,6,All of you questioning your the Tesla calls are lowest the low. You should be ashamed you cowards
2020-04-28 00:45:46,KushJenkinzz,4,Nflx better be fuckin green tomorrow i swear to god
2020-04-28 00:45:41,thenamesake11,8,Sir this is a bull parade
2020-04-28 00:45:32,Throwmeaway199676,2,Why would you buy puts when VIX just keeps falling? At least wait for it to get lower if you're gonna short
2020-04-28 00:45:19,Madchillhouse,6,"First night in a long time I'm actually ok with the market going up. This feels strange, but nice."
2020-04-28 00:45:09,GourmetFilet,13,"The most successful people believe in themselves. If you don’t believe in your positions how the fuck can they be successful? 

Gotta have faith. 

Musk Daddy, Su Bae, and Roomba looking over me. I really believe that."
2020-04-28 00:45:09,yosheroni,-1,Oil is fucking mooning... damn it
2020-04-28 00:44:31,neutralpoliticsbot,10,"things that are green:

✅💹🦎🐊🐢🐍🦚🐉🐸👽🤢🤑🎄FUTURES🔋📗🧃🥝🥑🥒🥬🥦🍏🍀🌲🌳🍃🚜💚✅✳🈯🟩🟢"
2020-04-28 00:44:30,Bluemoonclay,7,"I literally can’t learn, why do I buy puts"
2020-04-28 00:44:21,whey2awsm,1,"I have so many cheap beer calls. VIX murdered me today, but we not red or green..Waiting to buy puts with money I dont yet have"
2020-04-28 00:44:09,Miker1730,3,"i am just speechless , i have amd shares but am a true believer that this market is not a true representation if anything true"
2020-04-28 00:44:08,JefBezosExWifesNewBF,4,Newest macrovoices is all about Robinhood users buying USO😂
2020-04-28 00:43:45,love2fuckbearasshoe,4,"If we lived in India how many of ya would be untouchables ? 
I mean be honest if u can’t make it in America u pretty fucken stupid"
2020-04-28 00:43:26,RayCashIsTrashDalio,6,"https://www.cnbc.com/2020/04/27/tesla-cancels-plans-to-bring-workers-back-to-us-car-plant-this-week.html

lmao pump and dump. TSLA up 10% on news of reopening announced sunday. 1 day later: ""nvm guys. we're closed"""
2020-04-28 00:43:25,zaktrades123,1,Here cometh the pump
2020-04-28 00:42:52,rendrag09,1,"Observations today: 

Lowe’s/Walmart is packed in the middle of a Monday. 

ABC stores are not packed. Asked the worker, said the weekends are crazy busy. 

Grocery stores stay busy."
2020-04-28 00:42:49,AveenoFresh,1,"What's with this AH action?

https://imgur.com/a/yeV4t28"
2020-04-28 00:42:46,Ijustquaffed,8,"There goes my futures, watch them as they go."
2020-04-28 00:42:45,tayrawrchan,3,"after getting fucked on GM puts today, my account is now at $420. will probably just sell at open to keep the meme number."
2020-04-28 00:42:34,creature1231,1,Heyo too late to FOMO into oil storage?
2020-04-28 00:42:31,Mr_Burkes,-1,Big 🅿️🅿️ J🅿️OW
2020-04-28 00:42:14,,9,So instead of getting a W we are getting a square root.
2020-04-28 00:42:08,GourmetFilet,3,Waiting on my curbside groceries from wegmans. Just want to get home so I can start drinking and convince myself I’m gonna be rich by eod Friday
2020-04-28 00:41:54,Raccoonpug,4,Lets open the economy up like nothing ever happen. Such a bull shit.
2020-04-28 00:41:50,trade_-,2,Will my $SPY 300c 05/11 print?
2020-04-28 00:41:44,Redditlover1981,1,$OXY. Is it relatively safe from bankruptcy?
2020-04-28 00:41:44,UnpluggedUnfettered,3,fucking around with uso is like fucking around with your cousin. stfu and post the porn or do it quietly until you have the balls for a proper tifu.
2020-04-28 00:41:33,TheHydroElite,3,LET ERRR RIP BABY
2020-04-28 00:41:15,NipzNchipz,1,Good luck I decided on amd calls instead of ba for my earnings play this week...
2020-04-28 00:41:12,JeffBezosNewWife,0,Anyone else seeing as ascending wedges on SPX and HG?
2020-04-28 00:41:10,,0,teladoc calls anyone?
2020-04-28 00:41:00,The_Weekend_DOW,3,"Is there’s a meat shortage, where will my mom buy tendies?"
2020-04-28 00:40:48,GatorMD12,2,[https://www.ncbi.nlm.nih.gov/pmc/articles/PMC7102550/](https://www.ncbi.nlm.nih.gov/pmc/articles/PMC7102550/) potential drug targets for COVID
2020-04-28 00:40:30,IronSunDevil,2,Futures green even VIX lmao fun game this is buy calls on literally anything at this point
2020-04-28 00:40:21,yushey1,2,"RCL June 19 @ 30p

&#x200B;

SPY June 30 @ 250p

&#x200B;

I bought these before market close. thoughts?"
2020-04-28 00:40:15,LivinLike,2,Haven’t seen futures this flat in forever.
2020-04-28 00:40:08,Crude_Future,4,These fucking nat shills pissing me off. There fucking nat bugs. Ban em!
2020-04-28 00:40:03,VladdyGuerreroJr,3,I have a serious question for the bears: Why do you do this to yourself?
2020-04-28 00:39:55,WVULuke,4,Mmm calls will print
2020-04-28 00:39:43,hot-tamales-1,8,NAT is the new liquid lumberjacks
2020-04-28 00:39:38,SeabassJohn,11,Remember when the market soared for months while rona cases rose around the globe and economists increasingly began claiming a global recession was imminent. Pepperidge bear remembers
2020-04-28 00:39:21,AveenoFresh,1,Mtch calls will print tmr.
2020-04-28 00:39:14,strawberry-jam-boy,4,"What’s to stop me from diversifying what remains of my portfolio into some nat, tnk, eurn, fro, and dht?

Nothing. Absolutely fucking nothing"
2020-04-28 00:38:41,Schobeyy,11,I need a favor. I need everyone to keep talking about NAT. It had ridiculous volume today. My calls I bought last week loved it. If we keep hyping this shit up until earnings we’ll all be rich
2020-04-28 00:37:47,gordsnipes,11,36k in BA calls. Wish me luck
2020-04-28 00:36:55,inb4ElonMusk,5,"Goddamn, these people buying USO and USL and running around acting like they’re oil barons.

No matter how many I block, new ones keep popping up."
2020-04-28 00:36:54,IoI132,4,"where are we landing on NAT, boys and girls"
2020-04-28 00:36:54,westHype,4,i’m worried for my tesla 5/1 calls
2020-04-28 00:36:44,virtu333,3,Surprised Uber hasn't moved too much with the re-opening swirl that has driven some of the garbage up. I guess it's within 25% of its recent high
2020-04-28 00:35:58,ceskanda,8,"Been a lurker on here about a couple months. This sub has kept my spirits up, thanks for the solid entertainment and perspectives. Got lucky selling out at the top in Feb-liquidated about ~500k. However missed making big gains from the dip and the quick rebound by being too conservative. I have a banking and PE background and have been teaching myself options with around 75k and am down a little over 10k mostly from dumb mistakes and capitulating too early. Tomorrow: 1) thinking of buying 30-50 Bill.com 60 5/15C and holding until the day before their earnings date: 5/7.  It’s  a solid leader in the AP/AR automation space. 2) Also considering CRWD 80 5/15C. 3) Longer dated call options on a basket of casinos, hotels and restaurants. Not looking to put a ton of capital at risk or big time YoLo, I’d be happy with a 1.5-2X on what I play with this year. Appreciate any good or terrible ideas. Thanks guys!"
2020-04-28 00:35:46,gambler_no_1,0,Wanna hear the biggest joke of our lifetimes - gay Bears
2020-04-28 00:35:36,,2,Anyone worried with TSLA?
2020-04-28 00:35:25,THExNeo,0,I have a theory. What if Kim Jung Un was never having North Korea make nukes. They have been working on the vaccine. Kim has since gone into hiding with Donnie under the whitehouse because he has denounced his Chinese/Tik Tok overlords. Spy 300 by July 4th.
2020-04-28 00:35:20,Ijustquaffed,6,What time is the Fed announcement tomorrow morning?
2020-04-28 00:35:10,DJButterscotch,0,Are we allowed to post a screenshot of someone else old post to prove a point?
2020-04-28 00:34:56,Jetisfly420,2,Someone said $BA ER leak that’s a lie right??
2020-04-28 00:34:50,Michael12390,1,Wallstreetbets is so fun in the night
2020-04-28 00:34:48,Mrhungrybear,5,"Anyone else buy NAT stocks that they plan to sell at peak instead of buying those delicious July calls? Yep, I'm a moron afraid of high IV."
2020-04-28 00:34:41,CurtHolls5,5,Not sure if this is known I haven't been on this thread tonight but Mnuchin on CNBC tomorrow at 8:30... morning pump central
2020-04-28 00:34:03,nooobbbbtrader134,1,AMD to the moon?
2020-04-28 00:33:43,MrBrojaySimpson,3,"Suck my HOG, all the way down."
2020-04-28 00:33:43,Big_Factz,1,TSLA googl tomorrow anyone?
2020-04-28 00:33:41,Veqq,6,USO is selling then buying back the same contracts for more... https://twitter.com/ZR1Trader/status/1254914285920063489/photo/1
2020-04-28 00:33:36,neutralpoliticsbot,1,Kim it started so good
2020-04-28 00:33:30,feral_tit,2,Why is Elon Musk SHITTING UPON Silicon Valley?
2020-04-28 00:33:12,Michael12390,1,Dow futures -1 bulls r fuk
2020-04-28 00:32:36,redroux,-5,Why are futures mooning? /s
2020-04-28 00:32:17,osomdude,2,is it too late to jump on the NAT train?
2020-04-28 00:32:06,JustLookingAroundFor,9,"Tyson lying about the food chain to boost panic buying of tendies 

Scumbags"
2020-04-28 00:32:03,Conny-Bravo,12,I'm out of trump bucks.
2020-04-28 00:31:54,miketarann,3,Tomorrow red speak into existence
2020-04-28 00:31:15,ahypeman,3,"calls on beef

>Prices are surging. U.S. wholesale beef touched a record in the week ended April 24, and wholesale pork soared **29%**, the biggest **weekly gain** since 2012

https://www.detroitnews.com/story/business/2020/04/26/experts-say-us-just-weeks-away-meat-shortages/111625802/"
2020-04-28 00:30:59,cillian3651,2,"My first trade I bought NAT at $7, kinda worried but any advice etc and opinions on how the company could go I did some research etc and I’ve high expectations but not guaranteed of course"
2020-04-28 00:30:47,Dedent98,5,Whos getting AMD calls at open tomorrow
2020-04-28 00:30:44,TrumpisTopKek,4,Calls on pillow mans new book “What are the odds?: from crack addict to CEO” (and no I’m not making up the title.)
2020-04-28 00:30:40,BoredHobbes,1,XOP    .... hammer time or rocket time?
