date,author,score,body
2020-06-02 04:09:35,NovelOrganization5,-1,"Rumors that they’re bussing in rioters to my city here soon. Not sure how credible all this is, but this shit has gotten way out of hand"
2020-06-02 04:09:26,xKhaos420,8,"Green by noon, it's too obvious"
2020-06-02 04:09:18,chronic_johnson,7,Shits just getting hit on the west coast. Seattle about to pop off.
2020-06-02 04:09:16,Kevinyeungg,3,is tesla going up tomorrow still
2020-06-02 04:09:12,Arcanne,10,Omg being a bull is so easy lmao
2020-06-02 04:09:06,OblivionXBA,8,"Guys I fucking figured it out. SPY trades in a range.

300-Infinity."
2020-06-02 04:09:02,Acroozlooze,1,What does a rug pull even look like at this point? Surely it would have to be way bigger than a few months ago right? Otherwise I feel like the market would just bounce back
2020-06-02 04:08:59,AnonZeit,1,IIS NIKOLA MERGING WITH VTIQ OR GETTING LISTED AS NKLA? I DONT UNDERSTAND SO CONFLICTING
2020-06-02 04:08:55,lame_irl,1,"3035 to 3045 range feels eternal 

Is this where the inevitable stagflation begins?"
2020-06-02 04:08:49,kidruzen,1,Suspects are fuk
2020-06-02 04:08:22,Dougiejurgens2,13,Deblasio’s daughter got arrested hahaha oh man
2020-06-02 04:08:12,lcsaenz979,2,Any car chase links?
2020-06-02 04:08:01,Cnastydawg,0,That smelly smell that smells... smelly🤮
2020-06-02 04:07:52,namsilat,5,"I just took this in downtown Portland. Really nice of Apple to donate the space to public art.  They put plywood up for them and everything.


Apple calls. 

https://ibb.co/m4GHCHq"
2020-06-02 04:07:48,JoJoBabbit,15,Imagine looting a Target instead of buying WORK calls
2020-06-02 04:07:37,shesh9018,11,And to think we still have 5 more months until election...bulls and bears unite bc we about to hit some volatility and tendies are on the menu
2020-06-02 04:07:21,elija_snow,4,"Yo, so I just watch that police chase the white SUV.  How did my man not swipe any parked car?"
2020-06-02 04:07:08,StopDoxxingMePls,7,Red day tomorrow 71% chance
2020-06-02 04:06:55,RozarioGroup,1,Damn we are red by .45%
2020-06-02 04:06:44,Dougiejurgens2,7,"99% of my account is VTIQ, DKNG and Lowe’s."
2020-06-02 04:06:41,wsasix,-1,guh is it gonna be red.. hopefully red open green close
2020-06-02 04:06:40,Mrivera45,2,New York gonna reduce their black population by kicking them out. Flatbush is next place to get gentrified.
2020-06-02 04:06:39,kiwiatv,3,"My $4k EOD calls play was between VTIQ, DOCU, or TSLA.

I chose...poorly."
2020-06-02 04:06:37,PlasticRice,-11,"Guh...guh..gween bai open? 🥺👉👈 r..right, guys?"
2020-06-02 04:06:16,OldTrillionaire,0,"NBD don’t mind me, just over here selling legal weed in the middle of a riot zone to fuel my tendie addiction. Nothing to see here move along. 

Meanwhile, the market keeps going up, fucking over any Short position I try to open, and draining the money that I’m putting my life at risk for. 

😰F boys. Just gonna keep averaging down"
2020-06-02 04:05:58,BLACKdrew,-1,"when was the last time yall were in a real, fucking do or die fist fight? if youve never been in a fight, how?"
2020-06-02 04:05:26,BullSheiss,10,"Riots and looting getting worse. Sad, sad videos from all over. I don't see how that can help the economy / consumer sentiment / companies / earnings / market... ah, right, I forgot. None of that matters any more! Calls it is!!!!!!!"
2020-06-02 04:04:45,mloeber98,7,VTIQ continuing call tm?
2020-06-02 04:04:36,kei0145,3,How much you think the average looter in NYC took home this past week? $20 grand?
2020-06-02 04:04:07,wsasix,1,"i figured it out. cop is gonna get epstein'd in prison, everyone will unite #spylivesmatter"
2020-06-02 04:04:03,cuddlypolarbear1,10,I wouldn't mind some free LV shit. For equality of course
2020-06-02 04:04:02,330rgs,2,I think Trump just beat his own record of tweeting spree
2020-06-02 04:03:46,nosalute,3,LOL WTF  I thought it was just protesters standing there on NBCLA live but they're all arrestees  😂 😂 😂
2020-06-02 04:03:25,waterfly9604,11,incels crying about the american flag being burned on wsb is peak lmfao
2020-06-02 04:03:11,mr_blockchain_,1,"Every time I think of u/CptTonyStark, I suddenly feel at peace"
2020-06-02 04:03:10,nikofili,7,lol why are people driving around in the city. Asking to get your shit all fucked up
2020-06-02 04:02:56,SlamedCards,4,how is soho still getting looted. cops dumb
2020-06-02 04:02:42,3min33sec,6,Protestors protesting for what ? I mean the guilty policemen are punished. They seem to be just greedy violent looters. They won't have an excuse if they get shot and die.
2020-06-02 04:02:36,MrWSB,2,"10,000$ worth of GOLD stock 

10,000 worth of VNQ CALLS FOR JAN 

10,000 worth of IVR stock (gonna buy calls on this for earnings on 6/24 

Rate my robinhood play portfolio"
2020-06-02 04:02:35,Beyond_Duality,-2,"You dweebs do realize Reddit awards are like a dime each right?

🤨"
2020-06-02 04:02:31,thediesel651,3,Omg I pulled out of ZS because I got scared it wasnt going to moon.  Smh. Would of been major gains.
2020-06-02 04:02:27,Mr-Big-Baguette,2,I need to head to downtown Portland it’s about to turn into a mayhem
2020-06-02 04:02:25,malloun123,3,"Is an Adobe call for earnings the move? Or is it too locked in, I know they report on June 11th"
2020-06-02 04:02:09,kma4ek,4,Do any other bulls somehow feel richer watching all this riot shit? Makes me gains this year feel even more lucrative
2020-06-02 04:02:09,Twoverybigwords00,0,FB and NVDA are absolutely mooning tommorow right?
2020-06-02 04:01:27,190octane,5,"FYI... best car chase of all time. It was great even without the Benny Hill theme, but the Benny Hill theme makes it *chef’s kiss* amazing.


https://youtu.be/LUYbu5DJA1U"
2020-06-02 04:01:07,PaperShark0001,4,Goodnight fuckers
2020-06-02 04:01:06,4chanstan,4,This shit is dipping tonight bois
2020-06-02 04:01:02,whofcentury,8,Mass arresting in NYC apparently
2020-06-02 04:01:01,vouching,1,Any good twitter accounts for riots?
2020-06-02 04:00:54,option-whisperer,1,I went to go get my free louis vuitton and they were all gone. WTF?
2020-06-02 04:00:51,senditboy,2,"Are curfews justified when a city is losing control? I feel like that's a sensitive topic and I'm not sure where I land.

On one hand, no need for people to be out protesting all night when the looters and rioters are out taking advantage of the situation. It's easier to differentiate between the people who are protesting for a reason and the people looking to start shit.

On the other hand, you have people bitching about being required to wear masks, but now they're bending over and letting the state dictate when they can and can't go outside. If the situation keeps escalating, we keep losing our rights and freedoms."
2020-06-02 04:00:44,ElKetoNino,7,Not buying DKNG FD’s is anti American and you will be forced to give your great aunt Kathy a kiss
2020-06-02 04:00:44,IronManKillsThanos,14,"I was comparing inflation over the years and found some pretty depressing numbers. 

Brand new mustang was $3k in the 60s when minimum wage was $1. 3000 hours of work for a new car.

New mustang now starts at $35k and minimum wage is $7.25. 4800 hours of work now.

You don't want to know housing."
2020-06-02 04:00:44,Rvin16,3,"How quick would  these ""protesters"" go back home if martial law was declared?"
2020-06-02 04:00:43,RedHotChiliBoners,5,Best Futurama episode ever is on SyFy right now.
2020-06-02 04:00:41,PULSARSSS,2,So our glorious Michigan governor lifted our lock down early. I’m convinced she’s watching the news going oh fuck fuck oh no send them back to work you arnt burning our city down
2020-06-02 04:00:39,shacoand2boxes,5,"I bought $CRWD calls for Sept $150 not knowing what tf the company is, or that their earnings is tmmrw. Let’s hope this shit flys 🚀"
2020-06-02 03:59:54,letsgetapplebees,11,Imagine having so little hope about the future that you destroy your own damn neighborhood
2020-06-02 03:59:54,gladitwasntme2,1,Give me links give me links
2020-06-02 03:59:43,bfairrob,2,She's taller than me DAMNIT
2020-06-02 03:59:36,EugeneApplebottom,2,Oil up chevron up? Or oil up spy down chevron down?
2020-06-02 03:59:28,Lunaberri,5,TSLA to 950 or 1000? Also wonder how battery day will affect it
2020-06-02 03:59:08,THExNeo,6,I’m over it with the whole “let’s do a race war” meme; people are just bored and stir crazy. You keep people at home for 60+ days they’ll snap at fucking anything like a junkyard pitbull - people need jobs. I want productivity. Not glorified traffic jams 🤷🏽‍♀️
2020-06-02 03:59:07,JoJoBabbit,0,You are a meat robot with no value.
2020-06-02 03:58:48,cutiesarustimes2,2,LOL. NBC 4 LA is just trolling for another chase right now
2020-06-02 03:58:29,UsernameTaken_123,3,how long until trump implements The Purge ?
2020-06-02 03:58:27,Soon2beonthestreet,4,"3035 is too stronk, will the euros break through or melt up to 3060 again"
2020-06-02 03:58:20,_72wavemaster,1,Can I get a play for the month of June? I’m liking adobe calls and ZM puts?
2020-06-02 03:58:05,TrenAndOptions,-20,Anyone who burns the U.S. flag should be deported out of this country. Like seriously how can you defend someone burning the flag? If you hate America so much you’re free to live elsewhere
2020-06-02 03:57:46,Rianis96,14,"Literally the absolute most racist people complain about racism the most, quite ironic tbh"
2020-06-02 03:57:40,willbh1,4,Brick & mortar stores destroyed you say? Another day of zoom and wayfair going medieval on my ass awaits!
2020-06-02 03:57:39,nosalute,-1,[LMFAO NYT is so fucking retarded](https://twitter.com/search?q=Blackhawk&src=trend_click). They think any green plane is a blackhawk 😂 😂 😂
2020-06-02 03:57:32,BrownBoiler,14,"Man there’s some real toxicity in here. 
Have some respect for what’s going on and the implications it’s going to have..."
2020-06-02 03:57:20,UsernameTaken_123,18,"uh oh, looks like the incels are out in full force again"
2020-06-02 03:57:20,AnonZeit,2,I know u/CptTonyStark 's second account he posts undercover all the time. P.s hes a perma bull
2020-06-02 03:57:14,mywifeleftme_420,3,Stayed out past curfew tonight and didn't get arrested
2020-06-02 03:56:59,jmatACT,1,I mean I wouldn’t understand how the markets can go up but I expect nothing less than a flat day at least up .5% pre usual
2020-06-02 03:56:58,vegaseller,2,If trump declares major cities into purge zones you think spy will hit 350 or 450?
2020-06-02 03:56:56,thesillyshow,1,We live in a society
2020-06-02 03:56:43,ozzyteebaby,0,RH is way to high right? No way people spending 13k on couches still
2020-06-02 03:56:35,nitz21,2,[https://www.cnbc.com/2020/06/01/talkspace-pulls-out-of-deal-with-facebook-over-violent-trump-posts.html](https://www.cnbc.com/2020/06/01/talkspace-pulls-out-of-deal-with-facebook-over-violent-trump-posts.html)
2020-06-02 03:56:33,Mr-Big-Baguette,2,"Anyone that has a stream for a new car chase hit me up, NBCLA is just looking around"
2020-06-02 03:56:20,xRiotZx,-6,Sometimes when my knees get cold I look for a nice warm neck
2020-06-02 03:56:15,Turlututu_2,24,"so many joggers out tonight in LA

not sure why they got shopping bags though"
2020-06-02 03:55:59,reddeadginger,6,"Has anyone ruled out if u/CptTonyStark is in fact Elon Musk? Dude hands out awards and Elon is the closest thing to real life Tony we have 

Edit: Tony if you are in fact Elon, you’re a fucking gangster in a corporate sea of baby back bitches sipping soy boy Frappuccino"
2020-06-02 03:55:56,burrowed_greentext,18,"In a world of instant gratification only now u can see who got caught up in the easy dopamine hits and is out of touch when easy dopamine goes away.

Chase happiness and cling to it with ur fucking last breath. Turn off the fuckin news and play that videogame u haven't played in a while. Call up that girl u like and write ur fuckin love story with the world as ur witness.

U think those fucking Syrian children getting acid-bombed or those women in Iran getting mutilated and gang raped would give up and roll over in America rn?

Nah man fuck that shit. If ur sad because some shit is getting broken go watch fuckin Saving Private Ryan and watch all those fucking 18yo's get fucking obliterated the moment the boat doors opened up. That's some real disastrous, horrific shit worth being shell-shocked over, not some glass on the streets or cars on fire cuz some dudes be pissed that their skin color brings them absolute hell in this country sometimes.

A whole bunch of poor, beaten-down-and-tossed-aside Americans are bearing their teeth. Fuck it if their methods suck ass that's still some bald-eagle ass spirit knowing any of these fuckin cops could end their lives in a heartbeat and they'd become another number and name on a sign.

If ur fuckin sad rn get the fuck off this sub, save some money, go take a fucking roadtrip tomorrow and see this beautiful nation for what it is, beyond whatever bullshit ass short term shit we in right now."
2020-06-02 03:55:50,heresmykey,8,Imagine thinking you can outrun a chopper
2020-06-02 03:55:44,RPMayhem,1,All this juicy Bear news and they can barely get half a percent down on futures. If a rug pull is going to happen they certainly have the ammo for it but at this point JPOW is too powerful! All bow before our internet economy and infinite money printers! We're buying the moon this year boisss
2020-06-02 03:55:29,Iwishiwasachad123,3,"Why waste all that time running just go give up and lay down? 

What if they’re drawing all the police away from something"
2020-06-02 03:55:09,nosalute,25,Only in LA where you can zoom out and find 4 other chases going on at the same time
2020-06-02 03:55:08,cpc98,3,I wish I got rid of my DIS $120 6/12 :(
2020-06-02 03:54:55,wsasix,5,chase over. spoiler: caught the guy
2020-06-02 03:54:49,,2,"Where is our king going?

https://twitter.com/elonmusk/status/1267650659320500226?s=20"
2020-06-02 03:54:47,emirsway,4,F.ck the looters they deserve to be locked up. They're showing peaceful protests as riots. F.ck them arrest all those looters. I don't know why police is soft on some states to arrest these looters.
2020-06-02 03:54:38,Marnsy16,-1,I want to be like u/CptTonyStark
2020-06-02 03:54:34,PlasticRice,4,"God damn. I'm actually legit frightened. People were gassed and shot outside of my apartment last night for protesting.

Every time I open Twitter and see that Trump might declare martial law and protests getting worse, my hands get more papery and I wanna sell all my calls.

G..g...gr..green by..open..? 🥺👉👈"
2020-06-02 03:54:33,yeamannn,1,I shorted one share of Tesla AH. Printing
2020-06-02 03:54:28,WDWCastMember,20,"It's that time of night when ""investors"" suddenly realize that markets are several hundred million dollars undervalued because reasons."
2020-06-02 03:54:14,,1,"Anybody know the stock SONN. I had 200 shares when it went from $5 to $16 in an hour. Now I have 500 shares with a 4.77 average and ive been waiting for a month for at least a pop to $9-10. I don’t need the money, but I’m sick of holding it and watching it bleed every day. Should I get rid of it or does anyone have a reason why it may go parabolic again"
2020-06-02 03:54:10,cutiesarustimes2,7,OMG. Another chase?
2020-06-02 03:54:04,pboy1232,1,"Everyones forgotten about the second wave, 'Rona boutta have a field day"
2020-06-02 03:53:57,LamarHusky,4,"If you remember this shit you a real OG

https://m.imgur.com/a/Nmx1Lf3"
2020-06-02 03:53:48,ScallyWag-Idiot,-7,"YYOOOOO GUYS SHITS SAVAGE OUT THERE I JUST GOT BACK FROM A LICK AT SPENCERS GIFTS DOPE SCOOPED UP FEW BONGS, SOME DILDOS, INCENSE, AND SOME GUMMY DICKS FUCK WHOOOOOOO TIME TO BUY SPY PUTS"
2020-06-02 03:53:44,flyingeverywhere11,7,those fucks broke into a mercedes dealership and fucked up all the cars...
2020-06-02 03:53:44,fin425,8,How do you ever think you can outrun cop cars and a helicopter in a fucking pick up? Big retard.
2020-06-02 03:53:37,mjgcfb,2,They must have been part of Tanker Gang.
2020-06-02 03:53:13,Lunaberri,2,"Is DKNG priced in, ready for a correction, or going up tomorrow?"
2020-06-02 03:53:03,0z1o2t,8,White truck guy is gonna wonder for the rest of his life if he would have escaped had he kept going
2020-06-02 03:52:45,lame_irl,2,Saint Louis setting some MF fires tonight
2020-06-02 03:52:45,Rianis96,-7,"the only times I've been a victim of racism it was by a black person, never experienced racism by a white ever"
2020-06-02 03:52:42,aeipownu,11,Fucking Bellevue should have come down on the looters yesterday. It was such a joke watching those fuckers loot freely
2020-06-02 03:52:41,190octane,2,Did that cop just kick the guy in the gooch or ass from behind?
2020-06-02 03:52:34,snipsthekittycat,6,These car chases are hype
2020-06-02 03:52:01,nosalute,9,# HE WAS WHITE. HALF OF WSB LOST ON THAT BET😂😂😂
2020-06-02 03:51:57,spy66may,1,Midnight pump getting front run right now
2020-06-02 03:51:54,lame_irl,8,Chase #2 guys not as quick on their feet as chase  #1 team
2020-06-02 03:51:53,zevzev,1,Buying hella SPY CALLS hopefully infections don’t increase in the cities with mass protests would prove something about c19
2020-06-02 03:51:48,DifferentKindaHigh,3,"That guy gave up so easily and I’m not even tired yet, NEXT ONE PLEASE"
2020-06-02 03:51:44,lincoln929,7,So many car chases innLA. What’s going on?
2020-06-02 03:51:42,BRIAN8D,3,"Thinking about casino puts a lot of places in Vegas are closing and boarding up , no way the casinos are going to be set up to open June 4th."
2020-06-02 03:51:34,openyourmindpls,9,Imagine joining the Army and your first deployment is to Washington DC
2020-06-02 03:51:23,spyaintnobitch,7,They just gave up after driving for so long. What a bunch of pussies
2020-06-02 03:51:22,ottermodee,2,HANDS UP!
2020-06-02 03:51:10,trumpdiego,-4,"##ITS JUST STUFF BOOTLICKER!!!  
Tell that to the actual slaves that have to remake that stuff at 95c/day. Don't worry, with overtime they'll get 99c and can afford the good brown rice that day."
2020-06-02 03:51:09,PaperShark0001,2,A hole is a hole if ur eyes are closed
2020-06-02 03:51:08,DifferentKindaHigh,3,HE ASSUMED THE POSITION
2020-06-02 03:51:07,joje7,6,holy fuck LAPD is good at chases
2020-06-02 03:51:06,Rianis96,10,vxx is too low imo
2020-06-02 03:51:01,AirspeedIsLife,6,"VTIQ 6/19 40c printing tomorrow?

They caught the white truck so I'm thinking yes"
2020-06-02 03:50:56,Clawkwork,7,"Alright, next chase.  Real life GTA continues."
2020-06-02 03:50:52,nosalute,6,White truck driver is the biggest pussy! Drove around trying to escape for 50 minutes and immediately got on the floor after hopping out
2020-06-02 03:50:51,ThatOneDrunkUncle,9,LA chase is over. What else you got?
2020-06-02 03:50:50,bohochique,2,Bought 5k of AMD calls at the top today AMA
2020-06-02 03:50:43,SlamedCards,5,these dudes so fat they cant run
2020-06-02 03:50:41,MuskIsAlien,1,BULLS R KILL
2020-06-02 03:50:28,Mr-Big-Baguette,5,“Why drive all the way out here just to do that” lmao reporter is a fucking savage
2020-06-02 03:50:25,RADIO02118,3,So tired of this weekly sector rotation in and out of tech. Looks like a risk on sorta week with Nasdaq leading the index futures.
2020-06-02 03:50:24,Mishaloli,5,Neon green lmao
2020-06-02 03:50:24,190octane,4,Was that fucker wearing a neon luchador mask?
2020-06-02 03:50:23,saliym1988,8,"America is so ghetto right now, from the president to the cops."
2020-06-02 03:50:21,UsernameTaken_123,3,"u/CptTonyStark how rich are you lol

Literally gotten 3 awards from that guy this evening"
2020-06-02 03:50:08,devildog9,4,I'd let someone fart in my mouth for green open tomorrow
2020-06-02 03:50:05,rob_mail,2,Ok next chase let’s go
2020-06-02 03:49:56,CoolPerformance0,-4,Conspiracy theory: What if there was a high up far leftist that paid off/blackmailed this cop to play it out just like he did? Knowing this would be the outcome with everything going on recently and everything on the line with the election this year. 🤔 Really makes you scratch your head and wonder.
2020-06-02 03:49:41,Mr-Big-Baguette,2,KTLA5 let’s go
2020-06-02 03:49:41,BLACKdrew,2,u/pennystockplayer why are you [ignoring me bby its just $300](https://www.reddit.com/r/wallstreetbets/comments/gurxgt/what_are_your_moves_tomorrow_june_02_2020/fskzmzb?utm_source=share&utm_medium=web2x)
2020-06-02 03:49:38,gslime,2,"WGI tp boiz,  moneygram merger, and people are using that to send bail money to their relatives.   Call ups!"
2020-06-02 03:49:35,xRiotZx,-14,Derek Chauvin was just kneeling to protest police brutality and there happened to be a black guy's neck right there
2020-06-02 03:49:34,190octane,7,These car chases are wild also because the streets are wide open.
2020-06-02 03:49:32,jasonmydini,1,If everyone sold their stonks we could ruin Donald!
2020-06-02 03:49:29,VacationLover1,4,"Night night, keep your buttholes tight.. looters gonna get you when you sleep tonight"
2020-06-02 03:49:24,nosalute,4,QUICK WHAT RACE IS THE GUY IN THE WHITE TRUCK? I'M TAKING ALL BETS
2020-06-02 03:49:17,cutiesarustimes2,3,This helicopter anchor is really into it
2020-06-02 03:49:02,UsernameTaken_123,5,are waffle houses still open in ya'll states?
2020-06-02 03:48:50,PutsTookMyMoney,4,Where are you guys hearing about these police suits in LA?
2020-06-02 03:48:13,Lief1s600d,7,Portland protest always look so professional
2020-06-02 03:48:09,tobbyboi,2,ooh i heard wendy's done fucked up 😨
2020-06-02 03:48:06,Rsiros,8,"If I had a shop in the looters district, damn if I wouldn’t clear out and booby trap that place like Home Alone."
2020-06-02 03:47:55,190octane,2,"Holy shit, a 2 for 1 tonight on car chases!"
2020-06-02 03:47:48,rob_mail,2,What’s in the back of the truck do u think
2020-06-02 03:47:46,QuantitativeTeasing,3,RIP Joe Rogan?
2020-06-02 03:47:42,elija_snow,9,"Hey guys, just want to let everyone know I just got marry.  My wife is asian, her name's BABA and we will make beautiful babies together.  I'll name my first born ""Tendies""."
2020-06-02 03:47:38,xRiotZx,-10,Calls on George Floyd Knee Warmers(tm) it gets cold in Minnesota
2020-06-02 03:47:32,lame_irl,1,"Portland getting nothing done but virtue signaling and chanting for fun

Not a shock"
2020-06-02 03:47:16,PurpNYellow,4,"I’m living the dream, two police chases in a row"
2020-06-02 03:47:15,NoftScarlet,1,🚨
2020-06-02 03:47:11,nosalute,7,**White truck in LA puts expiring in 10 minutes**
2020-06-02 03:47:09,thesillyshow,0,Where can I watch LA riot NY 😴
2020-06-02 03:47:06,BlackSky2129,3,"Anyone know how I can access paid research like this for free? If not, has anyone bought a 150 market analysis report on a product and sector? Is it worth it? It’s about $3k"
2020-06-02 03:46:53,CMac681,5,Calls on auto industry if they burn enough cars this week
2020-06-02 03:46:50,SlamedCards,-1,"gotta get lasers to Antifa. holy shit its effective, vids of chile"
2020-06-02 03:46:48,joje7,8,Half the people in quarantine and the other half rioting. Does anyone fucking work anymore?
2020-06-02 03:46:44,lame_irl,7,"I’m guessing this ain’t the impact Donnie thought he would have.

Even DC is still going"
2020-06-02 03:46:41,AbruptlySoundCeased,15,Can we talk about trading in here. There's plenty of other venues to discuss the social unrest
2020-06-02 03:46:37,willbh1,2,Shall I join Green Gang or Purple Gang?
2020-06-02 03:46:33,mywifeleftme_420,7,"God bless this retard.

https://www.reddit.com/r/RobinHood/comments/guxj83/can_i_sell_this_call_despite_it_not_hitting_its/?utm_source=share&utm_medium=ios_app&utm_name=iossmf"
2020-06-02 03:46:20,shitwede,5,Lmao now everyone knows that yellow Porsche crashed looks like driver couldn't handle it haha.
2020-06-02 03:46:14,thezac2613,3,Anyone know who’s dick I need to suck to get level 1 options approval at Schwab?
2020-06-02 03:46:07,kvla1,4,Lol another pursuit
2020-06-02 03:46:01,saliym1988,6,another car chase in la lol. 3 for the day
2020-06-02 03:46:00,joedunn567,1,So I bought tsla puts on Monday morning and got fucked! What we think rest of the week tsla goes down?
2020-06-02 03:45:52,RedHotChiliBoners,5,"Time Person of the Year odds:

The essential worker +100

J Powell -150

The protestor -200

Money printer -250

Carole Baskin -300

The online worker -500

Kobe Bryant -1000"
2020-06-02 03:45:52,BigDickDarrow,5,TSLA $1000c 6/5 gang where you at? How we feelin?
2020-06-02 03:45:43,PuzzledJournalist212,3,"Going into tarkov with decent gear, wish me luck boys"
2020-06-02 03:45:31,realister,7,Buy police chase calls
2020-06-02 03:45:26,AnonymousAstro,11,So if in two weeks we don’t see a second wave or spike in cases...corona was fake?
2020-06-02 03:45:17,atomic_gecko,3,Bought SPY Puts at the top. Probably sell AM because we’ll end up green. Thinking about tech earnings spreads to sell run up.
2020-06-02 03:45:08,Bperez8029,10,If I am from Chicago. Should I be a bull because of the chicago bulls. Or a bear because of the chicago bears?? Or a thug because of the riots
2020-06-02 03:45:08,,4,"i just was on a riot in the city. totally not worth it. just get a fucking job and save money, then invest"
2020-06-02 03:45:05,nosalute,8,Anyone else see that NBCLA camera zoom? This motherfucker zoomed in on a freeway and then zoomed out like 5 cities
2020-06-02 03:44:55,MybellyYourbacK,12,I bet Canada feels like they live in an apartment above a meth lab right about now.
2020-06-02 03:44:45,dekbrner,7,If you guys wanna make money just inverse me seriously. Every play I make goes the exact opposite
2020-06-02 03:44:38,fRaNkR016,5,2nd Police chase in LA
2020-06-02 03:44:35,Lief1s600d,1,"Woke has to be following this thread to get the chase up again that quickly.

I see you!"
2020-06-02 03:44:26,defiladefire,5,"People saying the protests/rioting/looting are worse haven't been watching these streams since Friday.  The volume of people is way down and I'm not seeing tear gas flying non stop.

$CRWD 6/5 100c"
