date,author,score,body
2020-08-18 09:55:18,JonnyBGood74,2,Wonder if there are any Tesla shorts still alive?
2020-08-18 09:55:17,Justcorn34,1,Which Tesla juggernaut got a golden fuckboy for me
2020-08-18 09:55:05,Throwawayeconboi,3,AAPL has a stick up it’s ass while TSLA and NVDA are running up a check
2020-08-18 09:54:58,hkusbeckham,2,"Yeah. I sold nvda call to buy AAPL call EOD yesterday, and I didn't buy TSLA call at all. My portfolio is going to look like shit compare to those who bought TSLA."
2020-08-18 09:54:58,carlians,7,I can’t sleep thinking about my TSLA calls. Feels like Christmas Eve when I was 8.
2020-08-18 09:54:45,ProbablyDisagreeing,1,What is gold and how to get it
2020-08-18 09:54:31,gigantoir,1,"DAE TSLA????

shut up we get it"
2020-08-18 09:54:28,prestiCH,2,Found Elon's account. It's u/free_dharma
2020-08-18 09:54:13,www123x,2,Tesla reaching Overstock levels of retardation
2020-08-18 09:54:07,SkyBIueDreams,1, I need WMT to absolutely destroy earnings and announce Walmart+ like I NEED it
2020-08-18 09:54:05,ProbablyDisagreeing,1,Guys should I short Tesla? My uncle said big money to be made??
2020-08-18 09:53:40,MetalliTooL,3,Friendly annoying reminder:  TSLA was in the $300s just at the end of March.
2020-08-18 09:53:27,poundofmayoforlunch,1,"Holy duck

TSLA over 1,900 

Cot damn"
