date,author,score,body
2020-06-25 01:46:19,leonardnimoyNC1701,10,"Imagine missing out on one of the greatest runs in stock market history and then buying calls at the top.

Srry."
2020-06-25 01:46:19,Ultimate_Legitness,3,It's time boys
2020-06-25 01:46:18,DustyBowls,5,**PAGING MY HOMEBOY LAMAR TO WAKE JEROME THE FUCK UP.**
2020-06-25 01:46:11,ephapax1,6,I might have bought the dip too early. Guh.
2020-06-25 01:45:46,tipsystatistic,17,Some Dallas restaurants voluntarily locking down.  Uh oh.
2020-06-25 01:45:42,IndependentMeaning1,5,how accurate are futures boys! need a serious answer
2020-06-25 01:45:38,TheTigersAreNotReal,11,I miss checking futures and seeing it at +0.75% and knowing I could sleep easy
2020-06-25 01:45:38,howardgatsby,3,what’s support?
2020-06-25 01:45:33,yjruan,6,"Buy shares DCA and hedge with spy, sell your hedges for profit and put those into shares.  Stocks WILL go back up.  Apple will hold up the whole market."
2020-06-25 01:45:32,GamblingMikkee,3,The day the Nasdaq closes below the DOW will be the day we stop sliding
2020-06-25 01:45:30,drewthegoat3,3,wow my dick just got short squeezed
2020-06-25 01:45:29,Howard_510,5,Fuck guys I think this time it’s serious
2020-06-25 01:45:22,SDOW-Investments,13,We’re at support guys (nervous over leveraged bull)
2020-06-25 01:45:18,blackcoffee0123,4,BEARS DEEP DOWN YOU KNOW WELL BE GREEN IN A COUPLE HOURS LMAO
2020-06-25 01:45:16,nate223,33,EGGS IN SCRAMBLES
2020-06-25 01:45:14,AntiqueFig0,3,Can a positive stress test even help us out?
2020-06-25 01:45:14,cryptwalkin,-1,Going all in on zoom at open
2020-06-25 01:45:12,smmartinez6,4,Spy June 26 303p please print tomorrow 🙏🥃
2020-06-25 01:45:11,PM_ME_BONG_WATER,7,I’m just praying this open has mercy on me
2020-06-25 01:45:08,,4,Next pit stop to hell - 301
2020-06-25 01:45:07,beepbopwollytop,2,China on dragon boat holiday
2020-06-25 01:45:02,uninfinity,4," 

***Chinese companies including Huawei Technologies Inc., China        Mobile Communications Group and Hikvision Visual Technology        Co. could face U.S.        sanctions after a finding by the Trump administration that they are        owned or controlled by China's        military***"
2020-06-25 01:44:59,Mookypooks,3,OH...FUK
2020-06-25 01:44:58,victorsicilia,5,Bill r fuk
2020-06-25 01:44:57,GamblingMikkee,1,Hang Seng closed?
2020-06-25 01:44:51,shanish82,3,Asian traders scramble  and bulls are in ShAmBLeS!
2020-06-25 01:44:47,ElvanKing,5,"Ah fuck, are my BA calls really ded?"
2020-06-25 01:44:43,24901Miles,2,GE $4 tomorrow?
2020-06-25 01:44:41,brunoclement,2,safe to say bull is fuk
2020-06-25 01:44:40,deloitte202020,4,Shake out the weak handed CNBC Cramers. Jpow and p-o-r-t-n0y taking us to the moon
2020-06-25 01:44:35,Master_Sword,1,SPX Puts
2020-06-25 01:44:34,pennystockplayer,2,So calls on stay at home stocks I guess
2020-06-25 01:44:32,wdcvvv,1,"all of a sudden fear-mongering news is all over the place

hello $Rope"
2020-06-25 01:44:29,1234567890-_-,2,did someone say dump oclock?
2020-06-25 01:44:28,elesdee1,1,RIP
2020-06-25 01:44:16,gainsusmaximus,1,"I think the market is pricing in the second wave, but we know this market is BS anyway. It probably should be at SPY 240, so this is still just sideways action. I still think SPY 340 EOY is a good target. 

CCL 28c 10/1"
2020-06-25 01:44:13,MajesticSale9,3,Tomorrow is going to be v green tomorrow. Fundamentals looking positive
2020-06-25 01:44:13,West-la-thr0waway,-3,"Your mom is fuk

By your dad🍆"
2020-06-25 01:44:12,TrueHavoc,1,"WSB introduced me to  Mr. Tfue, incase you guys need more things to watch during quarantine. Armageddon DIY home improvement."
2020-06-25 01:44:10,Double_Anybody,3,We’ll be up by open. You guys know the deal.
2020-06-25 01:44:08,JamesRoth949,-7,Not trying to sound sexist but is there a reason why there arent many women trading? Small brains?
2020-06-25 01:43:47,ItsDijital,4,TradeTalks.exe crashed?
2020-06-25 01:43:46,deagleracesupreme,2,hold me guys im holding puts :((
2020-06-25 01:43:39,K215215,0,In the 3rd season of Billions. Its hard to watch and get over how insanely stupid the Ice Juice scheme was by Chuck
2020-06-25 01:43:38,jooocanoe,4,"We’re going to 295 this week, trade flat just to fuck everyone. Then vaccine news back to 320"
2020-06-25 01:43:16,devodid,2,Fuck sake
2020-06-25 01:43:16,Hot-Perspective,2,"Futures down.

  
FASTLY"
2020-06-25 01:43:08,ejethan123,7,My move tomorrow is to roll around in my own tears
2020-06-25 01:43:03,not_batsoup,7,"Imagine if futures were up +.5%. Bulls would be like “ BER R FUK BER R FUK”

*bulls will comment BER R FUK under this post as well*"
2020-06-25 01:42:58,AllSir,3,I bought calls at the bottom today. Somebody give me any good news PLEASE
2020-06-25 01:42:58,waterfly9604,8,Opening sub 300 would be real interesting.
2020-06-25 01:42:56,an2200,5,Yo wtf just happened
2020-06-25 01:42:54,aditya9967,3,Bulls have to bend over to see what bottom is it touching!
2020-06-25 01:42:52,whatisliquidity,1,Yikes where did that come from?
2020-06-25 01:42:49,jday112,0,Cmon Amazon just dump 1 more day ill never bet against you again
2020-06-25 01:42:49,UD88,9,"It appears that financiers and politicians are not as good at predicting the outcome of a pandemic as epidemiologists, and that a number of Americans are morons.  Ironically, this was quite predictable."
2020-06-25 01:42:40,PhillipJFry3020,5,"That guy who just said put/call ratio was at 75%. They were lying, and is probably why they deleted their comment."
2020-06-25 01:42:30,pinkumbrellla,5,I keep begging for a red day so I can buy in. But dude the recent crash has been bigggg. Hoping for a Green Day tomorrow.
2020-06-25 01:42:25,idsimon,13,"New indicator is pretty successful. Type ""buy puts"" in the Daily thread and if you get more than 5 downvotes buy puts and if you get more than 5 upvotes buy calls."
2020-06-25 01:42:23,24901Miles,6,Now the fun can begin
2020-06-25 01:42:18,Dreaming_Desires,4,if MM's squeeze these faggot bulls past 300/290 with all the bulls in the market the capitulation will be glorious
2020-06-25 01:42:13,jimmyhandz22,-2,What is a soy and europoor? Boomer here.
2020-06-25 01:42:11,esisenore,2,Relieved i didn't end up buying calls.  When in doubt stay out.
2020-06-25 01:42:06,SkyBIueDreams,3,It’s over boys.
2020-06-25 01:42:00,IndependentMeaning1,6,how accurate have futures been?
2020-06-25 01:41:59,Chotothegoth,9,sub 300 tomorrow if job numbers are bad and the reality starts setting in
2020-06-25 01:41:59,AntiqueFig0,1,Wow I’m just speechless. I must be an idiot.
2020-06-25 01:41:58,MagJack,0,"tomorrow and friday trickle down, maybe flat, monday will be bloodier than dexters wifes bathtub"
2020-06-25 01:41:56,Hegemon90,4,36k cases in 1 day. Stocks gonna dump.
2020-06-25 01:41:49,MoarTarriffs,2,"[WSB prediction poll for tomorrow ](https://www.strawpoll.me/20430801)

This sub is currently 2/6 on predictions"
2020-06-25 01:41:49,K215215,2,Can someone explain GNC to me? So now company announcing its going bankrupt sends stock up 30% is how things work?
2020-06-25 01:41:45,k-mac23,2,Damn sold my puts early
2020-06-25 01:41:36,bliss16,3,"sold DIS 7/17 90p. game on, ya fucks."
2020-06-25 01:41:35,NBrod,3,So why did futures just tank so aggressively? Any news??
2020-06-25 01:41:35,PrepareUrAngus,5,Oof. We definitely waking up to 298
2020-06-25 01:41:28,MotorizedDoucheCanoe,3,Wow bulls super fuk
2020-06-25 01:41:27,Redknife11,2,"I think it pops at least tomorrow on ""better than expected numbers,"" but we will see.

I'm pretty bearish but sold my puts at the bottom today and only hold a small call position.

Additionally there were probably a lot of short positions entered today, There will be a squeeze."
2020-06-25 01:41:23,Putsonpope,8,"Was going to quit after loosing 5,000 but might as well make it 6,000 and then on..."
2020-06-25 01:41:22,pm_me_floof,3,I got myself stuck in some oil positions and I’m about to get fucked. Shoutout to Cory Chase.
2020-06-25 01:41:20,FPB_III,6,#ITS TANKING
2020-06-25 01:41:14,Its_the_dankness,3,Lol holy fuck futures are aggressively red so early in the evening
2020-06-25 01:41:13,69InstantKiller,14,Fuck i got calls today i am so FUCKED
2020-06-25 01:41:07,tar_baby33,2,How're my June 26 Kroger 35c looking?
2020-06-25 01:41:00,Jeffamazon,5,JEROME??
2020-06-25 01:40:57,FPB_III,2,HUGE CANDLES
2020-06-25 01:40:57,cecpiece,5,I actually feel like people look at me sideways when I wear a mask out in public since barely any of them do it. Corona cancelled.
2020-06-25 01:40:49,MyBobber113,3,🥳😳🥳
2020-06-25 01:40:47,eyerollingsex,6,"Does anybody else think Chick-fil-a is amazing but the pricing holds it back

Like if it was a little bit cheaper they could dominate the market

Edit:

But I guess that’s why it’s always nice and enjoyable  inside when you go as opposed to the whackness you witness inside a Popeyes

Also I wish the northeast had Zaxbys"
2020-06-25 01:40:42,Iknowyougotsole,7,"I’ve seen this bullshit play out too many times.

Gonna be some hulk green candles to rocket this bullshit 30 points to 330 by the end of next week just like what happened at 292"
2020-06-25 01:40:37,GatoAmarillo,3,How are my $315c SPY 7/31 looking boys?
2020-06-25 01:40:33,catchy_phrase76,1,"My CC $29 weekly Put on DAL is bending me over, oh well, roll if premium is there on Friday or start selling calls"
2020-06-25 01:40:26,sneaky_alien,1,"How should you interpret the massive increase in /es futures volume that peaked on 6/16/2020 and has come down.  Does futures volume matter to normal markets?  Or, are the futures markets completely separate with regards to matters of volume?  As in, just because a large volume of futures contracts were traded that day, does that mean anything to the underlining index or no?"
2020-06-25 01:40:10,spy66may,7,Asia crashing. Buckle up
2020-06-25 01:40:03,G23456789,8,What time do futures actually predict the open? 9:29?
2020-06-25 01:39:56,thejoker4059,5,Thank god we have GDP and durable goods numbers tomorrow before open.
2020-06-25 01:39:54,Sorzine,2,LLEX
2020-06-25 01:39:53,sebach22,7,"Alrighty anyone who sees this, give me any play, Trying to yolo myself into a yacht or off a bridge"
2020-06-25 01:39:51,michaelchao,6,Future is down... and there is no Trump tweets or FED announcement to save the day.. so I tend to think the selloff will continue tmr..
2020-06-25 01:39:50,cryptwalkin,2,I think we fill the gap from May from this Corona virus second wave shit but that’s about it
2020-06-25 01:39:31,-rigga,17,Having Rona day 2: Taste and smelling ability is kill. No other issues so far..
2020-06-25 01:39:14,NoParlayNoFood,4,SRNE up today bigly off no news...up 8% during trading and 15% AH.
2020-06-25 01:39:14,Robbie_nwp,10,"I must be going bankrupt because everything hertz.

See what I did there?

I'll see myself out."
2020-06-25 01:39:02,maxy_spy,24,Fuck this option shit. I made more money selling toilet paper in the hood. :/
2020-06-25 01:38:58,MOTM_NW,7,Will DIS really pull down the market or just call holders ;)
2020-06-25 01:38:39,bear2008,6,Is 90% of my portfolio to much to put into GNC stocks?
2020-06-25 01:38:34,Real-Baseball,7,"It is time.

I have fought long and fought hard against buying puts, but these are the end times my friends.

Buy them now, and buy them often. It’s about to test 18k in DOW.

I cannot believe I am posting this bullshit.

(Godspeed Gentlemen)"
2020-06-25 01:38:32,Nayroxh,7,I can't believe we're opening largely green tomorrow. That's crazy.
2020-06-25 01:38:29,blackcoffee0123,7,if MM's squeeze these faggot shorts past 306/307 with all the shorts in the market after today the capitulation will be glorious
2020-06-25 01:38:28,dabearww,4,Blood red
2020-06-25 01:38:14,Jason-Griffin,6,"The rational thing would be to drop, so probably regain all the losses by noon"
2020-06-25 01:38:08,TrantMerris,1,BUY SOY
2020-06-25 01:37:49,beowulf50c,7,So from my financial homework rn it turns out stocks can be a great investment; I just need hands so diamond I can hold til I die.
2020-06-25 01:37:44,Midgetfarm,11,"Livin' my life in a 🐻 hell

Dodging margin calls everynight at the hotel

I ain't seen the sun shine in three damn days

Been fuelin' up on cocaine and whiskey

Wish I had play that enriched me

Lord I wonder if I'll ever change my ways"
2020-06-25 01:37:38,Yamilo_oWarrior,4,"Red at nigth, Bulls delight"
2020-06-25 01:37:27,AboveAll2017,11,"Gents, I went out with a lady this weekend and we ended up hooking up and I thought it went great. But she ghosted me. Why?"
2020-06-25 01:37:26,JustLookingAroundFor,9,"import JPow from ‘jpow’

let printer = new JPow({ direction: “uppies” })

printer.on()"
2020-06-25 01:37:19,BrownBoiler,4,Well. I don’t know what to think anymore
2020-06-25 01:37:18,Endura_GW2,5,Are you guys tired of me saying Tiffany & Co calls are free money?
2020-06-25 01:37:17,brownbrandon,4,T is on sale for anyone interested in a wholesome buy and hold ticker
2020-06-25 01:37:15,blackcoffee0123,3,if we break past 300/303 its gonna have to be during market hours. I doubt these limp smol PP bears have the selling power to do it in fewchas.
2020-06-25 01:37:03,Bakerslatt,1,Stonks go down
2020-06-25 01:36:50,Monkeycash,1,"DIS folks, from a scale of 1-10, how fuk you think you are?"
2020-06-25 01:36:49,The_Weekend_DOW,7,Fed got hit with that PC LOAD LETTER
2020-06-25 01:36:47,NotForrestGump,5,JBLUE puts please keep PRIIIIINTINGGGG
2020-06-25 01:36:47,Newtoiceyland,7,"One more warning for those retards who can't read.

Cases for red tomorrow in order of importance:

WSB voted Green (always inverse WSB).

The last few times we went red we had 2 or 3 red days in a row.

The last few big drops have been 20+ points, today was only 10ish

Fed talking negative most likely

Uncertainty about trade talks falling through

Cases spiking in FL CA TX

Poll showing Biden with a wide lead

Market symmetry (test 298)

A couple gaps need filling at 297ish and 286.

Bagholding calls but also cash gang and waiting for a re entry (not gay enough for puts)"
2020-06-25 01:36:42,odansteron,2,We are likely going to remain consolidating in this pattern until gdp announcement tomorrow.
2020-06-25 01:36:40,PoloNewt,3,Lobster or clam chowder?
2020-06-25 01:36:38,Septseraph,3,I hate chasing the rabbit.. but I sold 15k worth of puts for 300 yesterday. Live and learn..
2020-06-25 01:36:33,tyrannon,0,$ROPE
2020-06-25 01:36:18,PrepareUrAngus,4,Rip my spy 310 1/2021 calls
2020-06-25 01:36:06,silverlink22,24,"Damn coronavirus hits different when family is affected. Went from knowing no one with it a week ago to know having 17 people in the family with it. Jesus. Hospital back home kept telling most of them they were fine and releasing them, then they had to go to a nearby town hospital who actually tested them and they all came up positive. The shortness of breath was the most common symptom among them."
2020-06-25 01:36:04,brendannfitzz,5,"Eldorado and Caesar merger happening soon, once FTC announces its gonna EXPLODE

https://investorplace.com/2020/06/eldorado-resorts-stock-jump-caesars-merger-closes/amp/"
2020-06-25 01:35:58,iEatGarbages,2,Hang Seng Nooo!! We trusted you
2020-06-25 01:35:48,andyesandyes,2,What’s the crayon consensus about retard-strong support ? 300 and 280 something ?
2020-06-25 01:35:48,brunoclement,8,asia blood red
2020-06-25 01:35:48,4chanstan,1,Pamp it you dirty Euro bitches
2020-06-25 01:35:37,SquintsRS,8,Kinda scary this could be the start of a monstrous crash that bankrupts so many people and businesses....
2020-06-25 01:35:30,whofucknfarted,-5,"I went out to dinner tonight.. fully packed restaurant.. nobody wearing masks..

Now, a bear, naturally would look at this is bearish, because they want the world to burn because they are miserable and they trade their feelings. 

But, as a bull, I think its bullish because naturally I have calls and everything I look at must be manipulated to confirm my positions..

In reality, nobody gives a fuck about the fake China virus."
2020-06-25 01:35:29,TalkingFromTheToilet,0,Anyone else just hold blue chip stock and buy puts when it’s obvious that things are going down?
2020-06-25 01:35:28,Bluerigg,4,"Cramer calling a crash on July 4th

Or at least the next trading day after July 3"
2020-06-25 01:35:24,Skipperdees_ears,4,Welp...it’s been fun retards.
2020-06-25 01:35:11,spy66may,3,"Consolidate for about an hour, then a few small flat one minute candles to signal the start, then WHAM big red candles. It's been the same pattern since Tuesday PM"
2020-06-25 01:34:52,LightningLegend999,1,"if we rally back, think net calls are a good idea?"
2020-06-25 01:34:33,,4,What’s going on with Hang Seng
2020-06-25 01:34:32,SpaceToaster,9,"Feeling good about my DIS puts and VIX calls rolling into tomorrow. But in this market, anything can happen."
2020-06-25 01:34:31,Dc1993x,6,"Stronger dollar.. putting pressure on international equity holders..

Overnight sessions are going to get bloody"
2020-06-25 01:34:27,HedgeMyTaint,1,How'd everyone fair in The Rectoming today?
2020-06-25 01:34:22,epinephrin3,0,anyone in SLC? how’s the vibe there right now
2020-06-25 01:34:11,cryptwalkin,-4,Is this...the...top...? 😔
2020-06-25 01:34:02,blackcoffee0123,10,bears how many times until you learn. you keep getting your bussy wet in anticipation of a gap down past support but MM's are behind you forcing their cock  in your ass instead
2020-06-25 01:34:00,WannabeGoodGoy,5,"When/If I make it, I am gonna get an island and play GTA Vice City all day.  That game is fucking awesome: with amazing game play, amazing song tracks, the works."
2020-06-25 01:33:55,dweeegs,19,"I’m so glad we’re over that virus now that everyone stayed inside for months and did what they were supposed to, right guys"
2020-06-25 01:33:53,Iknowyougotsole,6,What time is the printer turning on?
2020-06-25 01:33:45,Revolant742,8,You can always count on Singapoor to drop us .25%
2020-06-25 01:33:37,Nick9502,3,I’m such a pussy for not getting more puts. I just literally froze at 3:59 with my finger on the trigger
2020-06-25 01:33:36,blehblehbleh333,7,I literally just came buckets.
2020-06-25 01:33:32,samalmarouf,4,I need everyone to be bearish so inverse WSB works and my calls print.
2020-06-25 01:33:30,Titan04151912,6,Bulls yet again in....Shambles
2020-06-25 01:33:30,ottermodee,7,Oh fuck MEEEEEEEEEEEEEEEEEEEEEEEEEE I AM SCREWED
2020-06-25 01:33:24,jraad0827,-1,Was watching CNBC and when they put shots of the airports it was all Chinese people 🤔
2020-06-25 01:33:21,idsimon,7,puts on colorblind traders
2020-06-25 01:33:18,goofy-boots,4,Puts on the rat
2020-06-25 01:33:08,silverlink22,3,I made a post a few days ago joking about Disney 100P 07/17 saying they wouldn’t be opening shit. Of course I didn’t actually act on it.
2020-06-25 01:33:08,ironichaos,1,Does anyone trade /ES? If so what are some good resources to learn about it.
2020-06-25 01:33:07,OblivionXBA,4,"I knew bailing out of my calls last second was the right move. I just didn't have the same confident feeling I usually do as a bull. 

My confidence will regain once we smell 299 though. That's a dip that'll send us kangaroo'ing through 300-315 again."
2020-06-25 01:33:06,pseudo_rockstar,8,"I’m shorting 150k$ worth of spx. Every point it goes down means 50$ for me- and vice versa.

😬 I kind of can’t sleep :D"
2020-06-25 01:33:03,Bluemoonclay,3,Well that’s a reversal
2020-06-25 01:32:56,shanish82,1,Credit suisse announced delisting of TVIX last week and will only offer them in the OTC markets... retail dumps TVIX.... TVIX GOES TO $1000 by eow. Rug pull and retail in shambles
2020-06-25 01:32:55,trustnobody01,1,"""One person has died and 465 people have gotten sick after interacting with pet poultry""

TSN puts it is!"
2020-06-25 01:32:49,eyerollingsex,6,"Ninety-nine red candles

Floating in the summer sky

Panic bells, it's red alert"
2020-06-25 01:32:46,afterkaze,7,"Life is like a sandwich. No matter which way you flip it, the **bread** comes first"
2020-06-25 01:32:45,fgiuty,1,Bears on bears on bears on bears
2020-06-25 01:32:42,cnh124,17,Bears = the white kids whipping themselves at BLM protests
2020-06-25 01:32:40,bonyCanoe,3,Premarket will be \~1% red then some ridiculous measure will be announced prematurely because god forbid the only KPI Trump cares about is 10% below ATH in a pandemic.
2020-06-25 01:32:40,leomeng,5,Any vaccine updates tomorrow?
2020-06-25 01:32:32,Yamilo_oWarrior,2,Bears still gay you will see !
2020-06-25 01:32:28,FeelinDangerous,5,Did you BTFD?
2020-06-25 01:32:22,not_batsoup,0,Tomorrow gonna be bloody
2020-06-25 01:32:07,blackcoffee0123,16,"Red at night, bulls delight"
2020-06-25 01:32:05,SVXYstinks,4,Yep looks like calls was a bad choice
2020-06-25 01:31:54,TrantMerris,4,"GO LONG ON SOY. 

Hear me out. The US dollar will become obsolete by Fall. WWIII will ensue. We will return to a barter system. Gold, silver, and other precious metals are unsustainable due to their limited amounts. 

You know what isn’t limited?

That’s right, your mom’s body count. 

And SOY. A new age of soy bartering will be the beacon of light going forward. And I for one welcome our new soy overlords."
2020-06-25 01:31:46,supercoolguy__69,5,"Don’t get your hopes up, bears."
2020-06-25 01:31:30,SquintsRS,1,"Hey American, if you could just die by eod Friday I'll buy a plane ticket to my private island from you"
2020-06-25 01:31:28,not_batsoup,-1,Bulls disappeared again. Now we bears get to enjoy the next month
2020-06-25 01:31:16,tayzer91,-1,I’m sheck wes and i’m gettin’ real riiich
2020-06-25 01:31:10,YourFriendlyAutist,8,"I’d like to think in some alternate timeline, I inverse every decision I made in the last month and vicariously live thru him."
2020-06-25 01:31:08,fulltimeledge,5,"Whenever I’m about to first make out with a girl, I say the words I’m a republican and then I go in for the kiss. Now I’m not even a republican but it’s been a good power move"
2020-06-25 01:31:06,PULSARSSS,3,When did Disney announce a post poned opening? Is it priced in? Or is it this fresh news? Cause I might hop on calls 2021 if it’s priced in
2020-06-25 01:31:02,A1739,3,Nike 105 tomorrow?
2020-06-25 01:30:56,samalmarouf,13,"Went all in on calls today. QQQ, amd, dis, spy, insg, Msft, all 7/17. 

I'm not feeling so well."
2020-06-25 01:30:55,Mpcars,3,Maybe tonight’s drop is pretty big deal so MM taking their sweet to time to plan it just right. I mean we did fall right below the 180 day moving average
2020-06-25 01:30:52,Mookypooks,1,OH FUK
2020-06-25 01:30:51,FPB_III,0,HUGE RED CANDLE
2020-06-25 01:30:44,FearlessTrader,-1,Mr Stark I don’t feel good 🥺 why do I see red futures!? Where are you JPow when I need you the most!?
2020-06-25 01:30:35,24901Miles,4,"Bad news for Bulls: Reports say Biden will still be ahead in the polls tomorrow also, and likely for the next month. Possibly 4 and a half years even... that's going to be a hell of a dip if true"
2020-06-25 01:30:34,eyerollingsex,6,We need the **Lobster King** 🦞 to pump this shit
2020-06-25 01:30:28,uninfinity,3,"Everyone knows back to back red days are illegal, green by open on ECB pump in wee hours"
2020-06-25 01:30:27,NotGucci,11,Futures can't stay green for more than 15 minutes. We going drop hard body tomorrow.
2020-06-25 01:30:27,lifesimulationadmin,0,I'm gonna inverse WSB and not ask for gold
2020-06-25 01:30:24,bxgoods,6,"China Hong Kong markets are closed, whyy"
2020-06-25 01:30:23,vxzvxzvxz,3,I’m going to flip a coin heads it’s is bull tails is bear.
2020-06-25 01:30:22,tonymuri,5,Is my 305 spy calls 6/26 safe? Find out next time on dragon ball z....
2020-06-25 01:30:13,jeveuxtevoir,1,"Navarro: ""Starcraft sucks."""
2020-06-25 01:30:08,iamtony36,2,Wow these red candles lol
2020-06-25 01:29:59,Implied_Volachillity,1,Cucked by the mouse again. Damn it to hell.
2020-06-25 01:29:59,PrestigeWWinc,3,Make VIX sexy again
2020-06-25 01:29:54,MartinePartEnSyrie,2,Don't tell me that some bulls were still hopeful? 😂
2020-06-25 01:29:54,Alkash42,7,This one feels like it will actually go down a lot more tomorrow cause I finally bought some calls after mostly holding cash for a couple of weeks
2020-06-25 01:29:52,iEatGarbages,3,This is pod racing?
2020-06-25 01:29:46,www123x,1,Thank god im in electric vehicles and not things that matter
2020-06-25 01:29:41,MyBobber113,-1,WHAT IS HAPPENING?!?!?!?!?!
2020-06-25 01:29:34,newanonthrowaway,7,"Gonna stake a claim and prospect for gold. 

1. No chance for covid

2. Probably less emotionally taxing than whatever this shit is

3. Have a pile of shiny rocks while the dollar crashes"
2020-06-25 01:29:32,MemeticEntity,7,"I saw that tesla puts were a pretty great value yesterday, bought some, and then panic sold this morning right before they gained something like 700 percent. Couldn't have waited 10 minutes.

Good times."
2020-06-25 01:29:25,Prodigyakajay,2,Community college is taking its toll on me
2020-06-25 01:29:19,iEatGarbages,6,Instead of locking down Texas is creating a board of shame to shame people not wearing masks or whatnot. Texas is so fucked right now
2020-06-25 01:29:16,Captain-Egg,1,Brrrrrrrrr it’s cold outside 😅😅 click click click goes the printer tho
2020-06-25 01:29:13,2easy619,0,"EXCLUSIVE - PENTAGON DESIGNATION INCLUDES CHINA'S HUAWEI, HIKVISION, CHINA MOBILE AND OTHER CHINA TELECOMS - DOCUMENT SEEN BY REUTERS"
2020-06-25 01:29:12,GourmetFilet,8,I turned away for 5 minutes and we went .25 to -.3
2020-06-25 01:29:08,RunYoJewelsBruh,2,"INO gets hated on here, but tomorrow would be a good time to release those Phase 1 results that were due this month anyway. The DOD dollars and PR drop seems like more than a hint that they will be very positive."
2020-06-25 01:29:02,TrantMerris,2,Man i fucking hate bears and I’m loaded to the tits in puts.
