date,author,score,body
2020-05-25 19:52:05,ceskanda,1,"Yo any moves this week. I’m thinking WDAY, Crwd, and have CRM calls."
2020-05-09 20:59:14,ceskanda,1,"What are you thinking this week? Made almost 20k from PayPal, Dropbox and roku calls last week. Would have been a better week if I didn’t fuck with net and switch."
2020-04-29 18:16:09,It-Wanted-A-Username,1,"Bought BYND calls without knowing exactly what it was. 

Out of day trades. I’m scared."
2020-04-29 06:31:02,thelonerainer,1,thoughts on $TSLA?
2020-04-28 21:45:55,iw12,1,Gay bears puts on SNAP??
2020-04-28 20:07:56,GoBeaversOSU,0,Where my GOOG miss bears at? Fuckin DED
2020-04-28 20:06:57,curiousprovisions,-1,Google just saved tech
2020-04-28 20:00:57,curiousprovisions,1,"Haha man oh man, got absolutely destroyed with $AMZN. Thanks MM's! Unbelievable."
2020-04-28 19:18:14,pmsyyz,3,"Sold LL for 21% gain.

Sold  TROW for 14% gain.

Closed $12k ROKU short for $700 gain.

Sold AXP for 8% in three days.

Down 99% on SPY 05/01/2020 240.00 P"
2020-04-28 19:17:14,Speedracer997,1,Spy pump yet
2020-04-28 17:44:19,hahaYuh,1,SPY baby what is you doin...ur so sexy....
2020-04-28 16:25:22,Poopinglog,1,"I have been holding my shorts since 240 on x2 leverage, and just doubled down on x5 leverage at 290 on some more.

SPY 270 will be my break even point hopefully."
2020-04-28 15:27:52,YungSwagLord666,6,WTF HAPPENED
2020-04-28 15:16:25,21ew_,3,My dumbass accidentally bought more calls instead of selling to close. Anyone know how to sell specific contracts on RH? I'm already flagged (yeah I know)
2020-04-28 15:08:09,killerz7770,1,I made calls on some stocks for INO and now I'm deeply regretting it.
2020-04-28 15:02:25,pipedrms,5,HahahahH some dumbass bull said recession cancelled ... loses all money in calls within 10 mins
2020-04-28 14:57:37,Ryanyourfavorite,3,What the actual fuck is $MSFT problem? Fucking god damnit.
2020-04-28 14:48:42,CuiVerde,1,"Day traders are the kings!
Obey plebs"
2020-04-28 14:45:47,ksyoung17,2,"It feels like the only way to make money is to either be a day trader, or trade after hours now."
2020-04-28 14:44:22,DrUNC83,1,"Just about hot that fib retracement, let’s die now market. I want death of the market tomorrow as googl bombs and Feds talk"
2020-04-28 14:43:55,gstechthrowaway,3,SPY no don't do that go up plz $290
2020-04-28 14:34:48,candymaxie,2,Up 20k in the past week do I sell or ride the green dildo?
2020-04-28 14:28:56,iluvhphihi,1,diamond hands or sell
2020-04-28 14:13:32,dr3773,2,All the bulls tendies are belong to me now. I just bought two 5/1 SPY 300c's. Let the crash begin.
2020-04-28 14:08:07,lame_irl,2,AMC
2020-04-28 14:02:36,rmrd26,1,Fucking SNAP the puts lose value so fast but they dont increase even when its stock is in free fall..fuck uuuuu
2020-04-28 13:58:05,elkox,1,LYFT and TWTR calls r fucked...slow ass day
2020-04-28 13:57:46,lucasandrew,2,HOG is going to slow fuck me the rest of the day isn't it?
2020-04-28 13:56:50,howardgatsby,1,it’s gotta be puts tomorrow right?
2020-04-28 13:55:09,DrUNC83,2,"This bullshit run up, bulls must be rich as I lost all my tendies."
2020-04-28 13:44:36,darthpotato94,1,GUYS QUICK WHAT CALLS DO I BUY? I DONT HAVE MUCH MONEY LEFT
2020-04-28 13:42:32,APHAbaghodler,1,BIDU is the biggest piece of shit stock..
2020-04-28 13:41:32,kyleharay,2,fuckin Robinhood. just accidentally bought a ba 135 call with a $6.00 premium am I fuk
2020-04-28 13:25:14,virtu333,1,glad i bought calls. no clue what now tho...do we sell at open or expect it to keep mooning
2020-04-28 12:38:46,AnonZeit,5,Are we still buying $10 NAT Calls at open or something changed in the last 3 hours?
2020-04-28 12:37:50,,1,PFE 🚀?
2020-04-28 12:35:15,InattentiveCup,1,Can I have a bear tell me how this the day will end red? I could use a laugh this morning.
2020-04-28 12:24:05,BoThSidESAREthESAME6,5,SPY 300 EOD
2020-04-28 12:06:26,,4,I put a dirt bike on the curb last night for someone to take (old locked up pit bike) some bitch just BEAT on my door at 8 am asking if i could put it in my garage and bring it back out for in 8 hours when she gets off work. it’s 8 am and it’s going to be a huge green day i was just trying to sleep through it tbh
2020-04-28 11:49:05,dbgtboi,28,"Daily explanation of why markets are mooning:

Once again, stop using earnings/guidance/pe/whatever other bullshit you are using to value stocks. Since 2008, the fed has taken control of the market, the only thing you should ever be looking at is the fed. When QE begins, stonks go up, when QE stops, stonks go down. This simple strategy would have predicted every goddamn movement for you in the last 12 years and made you a multimillionaire. Nothing has changed in 2020, market is still controlled by the fed, we have the biggest QE program we have ever had, so stonks go up. Do not bet against this shit until the fed turns off QE or you are basically flushing money down the toilet. Infinite QE will most likely not be turned off anytime soon because we cannot go back to fundamentals right now (that would be a 50% crash easily) so it will be here to stay for at least another few months. Yes, btw, we can easily go past ATH with this level of printing, like I said, ignore the goddamn economy, it isn't even remotely related to the stock market at this point."
2020-04-28 11:46:34,Myswag23,3,Is $hog tanking today or no
2020-04-28 11:43:23,ndog420,1,Aapl to the moon?
2020-04-28 11:19:28,akatheaja,7,Daily thread open fyi  [https://www.reddit.com/r/wallstreetbets/comments/g9kncr/daily\_discussion\_thread\_for\_april\_28\_2020/](https://www.reddit.com/r/wallstreetbets/comments/g9kncr/daily_discussion_thread_for_april_28_2020/)
2020-04-28 11:16:02,Bighonk97,1,Bear Sorkin Vs Bull Kernan
2020-04-28 11:12:56,NewportBarGuy,1,Computer: Sell everything. Now.
2020-04-28 11:12:48,how_can_he_slap,2,Anyone stuck with SIX puts? What are you doing with them?
2020-04-28 11:11:00,nysc3141,16,"I live in nyc had corona, was not fake, never knew anyone who died of flu, know 20 people who had family deaths from this, if we didnt shut down you would have millions dead."
2020-04-28 11:09:47,Huddster99,1,Loading up on AMD puts
2020-04-28 11:05:02,halfboxspear,7,CEOs are idiots... Everyone pulling guidance. Now is the time to unload all your dirty laundry. Everyone is getting a pass right now because of the pandemic so its time to get all your bad news out there. But nope... Let's push the bad news out as far as possible
2020-04-28 11:05:02,qwerty1234611,0,Amzn shitting the bed again
2020-04-28 11:00:36,CryptoMadeMeCrakHed,1,>290 wooow
2020-04-28 10:57:48,3min33sec,2,USO needs reverse split 100 fold to not go sub zero...
2020-04-28 10:54:56,originalmuggins,2,"I’ve been faking like I capitulated (gay bear) several times already, hoping it would be the classic “bears are capitulating, time for the drop” but it hasn’t worked. Will actually be capitulating this morning so when it actually drops you’re welcome"
2020-04-28 10:51:01,partially__derived,5,"“Real Life” - Young Dolph

Fantastic pre-market pump up song"
2020-04-28 10:50:48,pain474,2,"Can somebody tell me what the fuck is going on with RCL? Bought puts yesterday because it was mooning and it's almost +5% in AM, too. Holy shit."
2020-04-28 10:49:26,sailfish96,5,"ATTENTION GAY BEARS

Dont sell your puts, notice how everyone on here is starting to go long? Well institutions know this and will be shorting the market all week while it’s hyped up then big big crash. Time for diamond hands"
2020-04-28 10:48:36,Ankel88,7,IMAGINE if I had never the idea of fucking EDGE against the crash and buying PUTS... now I would be almost all recovered with my long term investement and  I wouldnt have lost money in idiotic options LOL
2020-04-28 10:47:21,Ijustquaffed,2,Hahahahahahahah green by morning every time
2020-04-28 10:46:54,,3,My 401k is about to hit ATH again.
2020-04-28 10:46:39,theknowndude,1,anyone playing net/fsly for akam earning report today?
2020-04-28 10:42:04,jf286381,0,Gap up.
2020-04-28 10:41:35,Lolkac,5,at this rate we will hit ATH in 2 weeks
2020-04-28 10:38:16,feral_tit,1,Everyone thinks google beats
2020-04-28 10:36:02,,-2,Lamestream media and SLEEPY JOE is spreading FAKR NEWS but the market never lies and wont listen to lies🗽🚀🚀🚀🇺🇸🇺🇸🇺🇸🤣🤣
2020-04-28 10:29:19,b3rnitalld0wn,2,"Larry Fink told everyone what BlackRock what planning on doing almost a year ago with fossil fuels. Even added...

“In the near future – and sooner than most anticipate – there will be a significant reallocation of capital.” -Larry Fink January 2020.

When the largest fund/retirement plan manager in the world tells us something is going to happen, we should probably listen."
2020-04-28 10:27:59,PrezzNotSure,4,"Sorry gay bears, I'm flipping bullish this week, my VXX puts lighting back up


spy will probably capitulate downwards now,  fuk ur welcome"
2020-04-28 10:27:27,pausemenu,1,Someone hit me with a couple day trades for today
2020-04-28 10:25:38,AngryPollo,2,Papa Elon take all my energy
2020-04-28 10:25:28,redsolocup6,0,Why are there so many bots in here?
2020-04-28 10:25:26,Andrew_the_giant,1,"See, I'd usually roll all of my untested sides of my short strangles up to mitigate risk . But this seems fucky. Going to maybe even move them down a few handles."
2020-04-28 10:24:23,UsernameTaken_123,0,"Im now 100% convinced we'll never have another red day in the market. Ever, in the history of the Universe. JPOW single handedly cured all economic recessions for the rest of eternity."
2020-04-28 10:22:24,ShawnHans007,4,If these nonsense lines I drew on my laptop intersect at some random point that must surely mean that the market will crash!!!
2020-04-28 10:22:16,johnnyappleseedgate,7,"I am now convinced that we are in a bull market.

&#x200B;

SBUX beat earnings! Who cares that they said they won't issue guidance for the rest of the year and that they expect to be materially affected by being shut down for a quarter? Consumers who had to switched to making coffee at home for the the amount of time it takes to form a habit surely will want to go back to spending $8/day and waiting in line at Starbucks.

&#x200B;

PE of 25 while all their China stores remain closed makes sense. 25 means growth company and when they reopen stores it'll be like they opened 4,200 brand new stores! They will be flooded with people!

&#x200B;

Anyway, SPY300C 5/15 gucci gang! Feels good to not be betting against America, the number one country in the world for everything including COVID and type 2 diabetes! #MAGA #JPOW2020"
2020-04-28 10:21:46,AnonZeit,1,lol this old guy doest stop beating on the young guy
2020-04-28 10:20:53,lefroncais,7,"As a bear, I must confess I'm losing hope"
2020-04-28 10:20:50,nysc3141,2,"I buy spy puts to protect individual stock calls , theta is becoming the hungry caterpillar,  buy short dated spy call to hedge decaying puts and they are printing but still crab gang."
2020-04-28 10:20:45,SiaCurious,2,"Imagine being loser Obama rn, such a weak, small dick recovery in 2008

Bigly pathetic"
2020-04-28 10:20:38,,-8,"REPLY IF YOU ARE BEARISH with your photo, want to see what an idiot looks like"
2020-04-28 10:19:25,gohome01,1,"You ever go 1k to 80? This is from me, don’t be afraid"
2020-04-28 10:19:02,,0,This will end in year 2030 🚀🚀🚀 KEEP CRYIN BEARS AAHHAHAHABha 🤣🤣😘😘
2020-04-28 10:19:01,tickled5679,4,Their evidence for Kim being alive is a letter he sent to workers. LOL
2020-04-28 10:18:14,tea_anyone,1,Every time oil rockets I just get back in for the way back down.
2020-04-28 10:17:40,MrSpaceCool,1,AMD calls today anyone ??!?!
2020-04-28 10:17:29,Tendiebendie,3,#This thing is set for orbit 🚀🚀🚀
2020-04-28 10:17:28,jf286381,1,"COVID-19 = War on Terror

> *the invisible enemy...*

Jeez, we're desperate for our 10 year panic cycles."
2020-04-28 10:17:28,Throwmeaway199676,3,I'm convinced we're going to test ATH before there's any kind of rug pull
2020-04-28 10:16:51,Ieperen,7,"Anyone here even thinking of buying puts? Lots of bulls jerking eachother off here, good bearish signal."
2020-04-28 10:16:21,LatinoMuyFinO,10,Bears be like: fettucince carbonaro retracement complete! Variation Separate prophecy complete! Time to load up on cheap puts boyzzz 😂
2020-04-28 10:16:01,theknowndude,2,"USA USA USA USA USA

https://www.reddit.com/r/PublicFreakout/comments/g9fxxg/usa/?utm_source=share&utm_medium=ios_app&utm_name=iossmf"
2020-04-28 10:15:52,jf286381,7,"Everyone is acting like this is a good thing.

Yeah, it's fun to fill your kid up with sugar. It's another thing to intentionally induce diabetes to kill your kid for a life insurance check."
2020-04-28 10:14:55,,1,We should deport all the bears to mexico
2020-04-28 10:14:47,ShawnHans007,-6,Imagine betting against USA USA USA
2020-04-28 10:14:33,jf286381,2,Say it with me class: **d e f l a t i o n**.
2020-04-28 10:14:30,I_have_a_dog,0,"After we cruise past $292 today, what’s the next resistance level that can’t be broken? $300? $310?"
2020-04-28 10:14:29,Miker1730,3,"what time are ""pre market earnings""?"
2020-04-28 10:13:43,SwHome,1,"If you had to pick, what would you short right now: SQ, SPY or TSLA?"
2020-04-28 10:13:41,,-3,"look at those small PATHETIC  red candles, like bears dicks tiny and SAD"
2020-04-28 10:13:39,Balzac7502,2,"S&P Dow Jones rolling WTI oil contract early, June to July 

 [https://twitter.com/JavierBlas/status/1255057888957079552](https://twitter.com/JavierBlas/status/1255057888957079552)"
2020-04-28 10:13:24,feral_tit,5,Selling my options the second this shit opens...the greed of the bulls is terrifying for call holders
2020-04-28 10:13:20,Benzo_Head,11,"S&P 500 giving me December 2017 cryptocurrency vibes

Some people are actually convinced that stocks CANNOT literally go down anymore lol"
2020-04-28 10:13:00,AnonZeit,2,yolo puts for tesla earnings
2020-04-28 10:12:54,jf286381,3,No one is impressed that the Fed pressed print. No one is a hero. All of this reeks of the big bad gay.
2020-04-28 10:12:52,ltsPricedIn,5,can't wait to see this week's DD threads about why we're going to crash any second now
2020-04-28 10:12:49,Tendiebendie,2,Coming Back for 2nd 290 retest...
2020-04-28 10:12:49,SiaCurious,0,"Wonder what Variation-Retard is up to these days, haven't seen him around in a while"
2020-04-28 10:12:28,Boomer2200,2,Can anyone say bubble? I’ll just hold my SQQQ till it’s $0
2020-04-28 10:12:03,ShawnHans007,5,"Satya Nutella, Tim apple, Jeff bullsoz, Elong musk, mark zuckerborg"
2020-04-28 10:11:54,be11end,4,"**MORTGAGE CHAOS**

>lenders and veterans of the 2008 financial crisis warn the real chaos won’t start until the pandemic passes.  
>  
>The problem is confusion over what will happen when borrowers have to make up those payments. Federal agencies that back most of the market have introduced policies, some of which could require documentation that overwhelms servicers, leading to lengthy wait times and, in extreme cases, foreclosures.  
>  
>unless there are dramatic changes, Americans should “expect even more chaos when forbearance ends”

[https://www.bloomberg.com/news/articles/2020-04-28/mortgage-chaos-threatens-to-worsen-once-it-s-time-for-repayments?utm\_medium=social&utm\_content=business&utm\_campaign=socialflow-organic&utm\_source=twitter&cmpid=socialflow-twitter-business](https://www.bloomberg.com/news/articles/2020-04-28/mortgage-chaos-threatens-to-worsen-once-it-s-time-for-repayments?utm_medium=social&utm_content=business&utm_campaign=socialflow-organic&utm_source=twitter&cmpid=socialflow-twitter-business)"
2020-04-28 10:11:47,feral_tit,5,"This is making me very nervous .. not scared, just nervous"
2020-04-28 10:11:01,realister,3,">Tesla (TSLA) May weekly 800 straddle priced for a move of 13% into the expected release of quarterly results after the bell on April 29.

good luck"
2020-04-28 10:10:32,WizardSleeves118,2,"holy fuck get ready for that big dick on GME too.

heheh...ha..hahaha...

AAAAAAAAHAHAHAHAHAHAHAHAHAHA"
2020-04-28 10:09:38,GunnerFanTB,12,"So I made like 300-400 a week prior to this. Now I make 875 a week 
on unemployment lol just got 1500 this morning in Florida... Money is obviously a joke now spy 4/29 600c"
2020-04-28 10:09:36,IronManKillsThanos,13,"I don't care about losing money, I don't care if SPY goes to 400 next month, I don't care about my student loans or car payments, I don't care about oil, and I don't care about tech or politics.

But please, fucking please can the housing market crash at some point in the near future. I'm not about to drop 200k on a FUCKING CONDO. Fuck those boomers and their 100k 3 bedroom houses in the 80s-90s shit has tripled."
2020-04-28 10:09:36,JDooners,3,It’s gonna be really hard not to FOMO in today but there’s no way I can hold with confidence into AH
2020-04-28 10:09:26,PrezzNotSure,3,"Which one of you autists....


https://www.reddit.com/r/RobinHood/comments/g9c42x/im_not_sure_if_this_is_the_right_subreddit_for_it"
2020-04-28 10:09:25,,1,Lol dumbass bears
2020-04-28 10:09:16,wolfenstein1998,6,“Dow futures rise more than 200 points as oil prices continue to fall” i remember spy was rallying when oil was going up. It just shows that the market is rigged to go up for any reason.
2020-04-28 10:09:15,FeelTheEarporn,7,"Lost so much money that i am depressed, this market so so fucking gay that i dont see the point

Rigged shit"
2020-04-28 10:09:02,,6,"Spy 300, all aboard the jpow trump train, NO BRAKES"
2020-04-28 10:08:54,ShawnHans007,3,Stock markets looking good to me!
2020-04-28 10:08:51,sirgattaca,2,"Can I get some help please? I've got 5/1 301c. Theta is against me. I bought these about two or so weeks ago. I know there are some major earnings today, tomorrow, and Thursday. I fear the sell off in the morning. What's the right play here?"
2020-04-28 10:08:45,jf286381,1,Fake rally virus.
2020-04-28 10:08:18,Carl_pepsi,1,Well I was going to ride my calls all the way but how you mfs are fomo time to flip again.
2020-04-28 10:08:05,Tendiebendie,2,B A T T L E O F 2 9 0
2020-04-28 10:08:04,Regjohn,0,"If you look at your phone upside down, it’s the recession"
2020-04-28 10:07:59,globalcontagion,0,Anyone see Gundlach on cnbc? How embarrassing for him right now. Out played by wsb acoustic permabulls. Wild.
2020-04-28 10:07:40,fjhvc,6,Some people are making a lot of money today.. I am not one of them
2020-04-28 10:07:18,ElvanKing,2,wtf TSLA
2020-04-28 10:06:53,luponicdistortion,6,My fuckin dad told me a couple weeks ago he bough a shitload of VOO at 205. I told him good job but to sell soon. Good thing he doesn't listen to his dumb kid because apparently he almost perfectly timed the bottom
2020-04-28 10:06:36,Notonfoodstamps,3,Today's Oil moon cucked our Tankers calls
2020-04-28 10:06:19,Benzo_Head,3,"Short squeeze before earnings, might even reach 295 this week

>Inb4 We aRe iN a buLL mArkET

Nope lol"
2020-04-28 10:06:15,notaengineer,1,I’m such a fucking idiot for not picking up more msft yesterday. Did 25% of my normal trade
2020-04-28 10:06:10,,5,Don't come to the market today bears. 👊
2020-04-28 10:05:57,Steaminmcbeanymuffin,4,Bull trap cancelled holy shit. I dont see how we possibly go back to test lows now.
2020-04-28 10:05:52,TheLastAckbar,4,"Terrible night of sleep, woke you to a tire being flat, SPY will probably be up 5% today. This is my life."
2020-04-28 10:05:42,feral_tit,2,Hope y’all just went short 🤣
2020-04-28 10:05:29,IronManKillsThanos,2,"Saw all the bitching about single digit oil happening, did you motherfuckers already forget we had that shit at -$40 last week?"
2020-04-28 10:05:04,,1,"Can we get a referendum to make trump king for life? he just saved the economy twice, what a legend 🤣🤣🚀😂🇺🇸🇺🇸🇺🇸🦅🚀"
2020-04-28 10:04:39,globalcontagion,7,All in on V shape recovery plus overdone stimulus and forever low rates. Holy crap this is the most juiced market in history. A+ to jpow and munchkin.
2020-04-28 10:03:58,Jimothy787,1,Bulls celebrated early 🤣
2020-04-28 10:03:51,bleeeeghh,6,Get your puts ready bears! The time to short is when it hits 4000!
2020-04-28 10:03:34,metamaoz,2,I think dow hits 25k. That trader with the white hair and dow 25k hat will pop up on the news. Trump will tweet dow 25k and then plops down.
2020-04-28 10:03:17,Schobeyy,1,Alright fellas what are the easy shorts at open ?
2020-04-28 10:02:46,FeelTheEarporn,7,THE FUCK IS THIS MARKET IM SO MAD HATE BEING A BEAR BUT OMG
