date,author,score,body
2020-06-09 20:03:54,Montana-Max,1,Smith and wesson is going back to $30. Trust and believe.
2020-06-08 01:21:03,ButtBubble,0,$90k worth of BA $190P 7/17.. how fuck am i (bought on Friday when it was at $216)
2020-06-07 06:47:55,CryptoMstrmnd,1,Yea bro
2020-06-05 21:50:43,spyaintnobitch,1,Up 500% on my htz calls and imma hold this biatch til the end
2020-06-05 19:34:43,Barkhamsted,2,Bought 2000 shares OXY two months ago around $12. All the experts said to sell it because it is heading to bankruptcy. Today it hit $20 and I'm a genius.
2020-06-05 19:20:47,TheBanjoShow,2,Wonder if we’ll see aliens this weekend
2020-06-05 19:12:09,your-missing-mom,-1,"Whoever said seaworld calls at open, fuck u"
2020-06-05 19:10:25,philmacrack123,2,"Buy calls, Monday is ATH"
2020-06-05 18:32:36,rlsands1997,1,I made 500% on my 6/19 $10 $DFEN calls today and sold before it dipped so that paid off. Wish I put more in but that’s always the way
2020-06-05 18:25:17,ChronicCSD,4,Bought BA and WYNN calls at open 👍👍
2020-06-05 18:04:01,Patcha90,1,Hope you're ready for the face rip EOD
2020-06-05 17:42:12,rocklobster123456789,0,IAU puts about to print
2020-06-05 17:41:58,Zurhk,1,BIG SWING ALERT PACD. OPEC MEETING TOMMOROW.
2020-06-05 16:49:44,robbinhood69,2,Who else bought the DKNG dip
2020-06-05 16:47:00,jetskionawaterslide,1,I have literally no idea what to do with my SPY $296p. Dont expire til 7/20 but jesus christ i dont know if were actually going to go down ever again.
2020-06-05 16:14:35,gnjapp,2,wow market is on fire today
2020-06-05 16:08:08,MerryBrickmass,3,god bless America
2020-06-05 16:02:54,smoothsoul,3,"$187-$4.1k in 2 days. After burning my RH account with 2.5k in my first two weeks of trading, feels fucking good. Would've been 10k if I held those sweet AAL calls I placed Wednesday."
2020-06-05 15:57:32,bespokenman,6,"Bought 6/8 SPY $311p when it was at $318, I never learn do I ;-;"
2020-06-05 15:57:12,diabeetis,3,Bear but hedges print so much chart is positive
2020-06-05 15:55:25,TrueHavoc,1,What are the chances we will gap up and pump tonight?
2020-06-05 15:51:49,johnyogurty,1,"Sooooooo, Spy 318 puts????"
2020-06-05 15:50:03,BallScratcher123,1,I'm out of my SPY 6/26 325c's +10k on 8k and into SPY 6/26 300p hoping we give back some gains before close.
2020-06-05 15:49:07,KvngGorilla,1,I’m wondering if I should keep holding my dfen $20c 10/16
2020-06-05 15:47:17,TrueHavoc,2,Anyone holding to tomorrow?
2020-06-05 15:44:52,MerryBrickmass,1,thank you RTX
2020-06-05 15:40:19,ClinicalCapper,3,I have no idea what the weekend move is.
2020-06-05 15:31:54,isospeedrix,2,looking forward to all the 5000% BA posts today
2020-06-05 15:19:55,GaryisBetter,1,DOCU has been a total clown stock today
2020-06-05 15:15:14,govindsingh4717,0,Would've made $3k instead $1k on my DAL leaps if I didn't sell yesterday. FML
2020-06-05 15:09:42,dudeeewhat,12,Hey guys - I’m up 4 dollars
2020-06-05 15:08:01,collegeboiiiii,1,I need mgm to jump at least another $1 so I can day trade these 15 $26c
2020-06-05 15:05:21,isospeedrix,2,"up 600$ on my BA 205c i got this morning

up 600% on HTZ 2.5c

up 300% on XOM 50c"
2020-06-05 15:00:43,Throwaway5panel,2,MGM 22.5c and JETS 22c both next Friday - hold?
2020-06-05 14:56:19,bardisviable,1,MGM starting to resist downward pressure
2020-06-05 14:55:06,Extension-appeal,2,"I’m losing my ass today, down $300. I’m glad your winning"
2020-06-05 14:54:36,junkrattrap,1,PUTS ON CHYNNNAAAA
2020-06-05 14:51:09,Republican_Atheist,2,"**PAPA PUMP** 

CALLS CALLS CALLS BA KEEP PRINTING BABY"
2020-06-05 14:50:13,canadianformalwear,1,"Step 1: Buy Calls that were looking hot at opening and into the green immediately.   
Step 2: Trump talks.   
Step 3: Calls now 33% down.   
Step 4: Vodka + OJ at 10:30am for breakfast.   
Step 4: Diamond hands."
2020-06-05 14:48:27,TrueHavoc,1,Whew UAL rebounding
2020-06-05 14:47:13,bardisviable,1,ITS A PUMPPPP
2020-06-05 14:45:32,ButtFart88,1,Trump’s giving this speech feeling like I feel when I hit it big on some Faggy D’s
2020-06-05 14:44:37,cpc98,2,Big numbers on DEATH
2020-06-05 14:44:30,pump4iron,1,Fuck
2020-06-05 14:42:23,junkrattrap,6,TRASHIN ON BUFFET LMFAO
2020-06-05 14:42:18,bardisviable,5,ROASTIN BUFFET LMAO
2020-06-05 14:41:59,junkrattrap,2,“This isn’t a V it’s a rocket ship.... keep pumping until we get next week protestor covid rates”
2020-06-05 14:41:20,bardisviable,2,ROCKET SHIP
2020-06-05 14:39:44,actually_dgaf,3,Trump said we solved the Minnesota issue overnight lmao. Calls cuz fuck it
2020-06-05 14:39:32,bardisviable,3,"Gift from China, very bad gift LMAO"
2020-06-05 14:36:28,donutman3211,1,need a yolo any recommendations for over the weekend?
2020-06-05 14:36:19,bardisviable,1,my is MGM and DIS falling :(
2020-06-05 14:28:16,collegeboiiiii,1,That better not have been the top for mgm today dammit
2020-06-05 14:20:00,vethyea,1,Did anybody hit on some HTZ calls today?
2020-06-05 14:18:49,huntpat11,3,Bought 2 apple $325c at close yesterday for .51 each woke up to $600 profit 😇 sold at 3.10
2020-06-05 14:12:07,vethyea,6,Do not put stop market orders on options...I learned this the hard way 😭
2020-06-05 14:11:51,cspauld,5,Golden Rule of 2020: Don’t Buy Puts
2020-06-05 14:06:09,TrueHavoc,1,Fuck I timed UAL terribly
2020-06-05 14:03:08,Throwaway5panel,2,hopefully this is an MGM dip and nothing more
2020-06-05 14:00:10,pottypotsworth,2,"Some stonks drop so rapidly at opening bell, are plebs like us just supposed to put in as a market order and hope for the best? You can't adjust the limit fast enough for the most part."
2020-06-05 13:58:35,collegeboiiiii,3,Nooo mgm what is you doin
2020-06-05 13:57:33,govindsingh4717,2,Calls to ride today?
2020-06-05 13:55:54,The_Cooler_Guy,2,You get back up there MGM
2020-06-05 13:54:48,I_have_a_dog,3,"https://i.imgur.com/sUjb1aQ.jpg

CCL gains. Was higher at open but those were the past contracts I had a little while ago. 

Finally made back all the money I lost on retarded puts."
2020-06-05 13:54:36,arharold,1,Anyone think WORK can recover by July 17?
2020-06-05 13:53:09,Mediocretes12345,1,Make your money while u can. This bull trap will be discussed for decades. These companies have no underlying value. It's a joke. Fed printer goes brrrrrrrrr we make money short term but any real market analyst will loon st then and put 9/20on any major stock. Set your reminders. 9/20 or prior the bomb explodes
2020-06-05 13:50:15,yawn_this_gets_old,1,Dump before the 10am press pump mixed with a scheduled fed pump.
2020-06-05 13:50:05,collegeboiiiii,2,On Sunday I was down $3400. Now my portfolio has doubled my initial investment. Big brain time
2020-06-05 13:48:57,VanillaBox,5,"Well I've now 2x'd my portfolio

Thanks retard market don't stop please"
2020-06-05 13:48:38,theetravismiller,3,"I was able to sell my RH trades thankfully but we seriously need to write these people.. I know it's free but fuck. This isn't instagram, it's real ass money"
2020-06-05 13:47:50,harronsayed,1,What's going on with TD?
2020-06-05 13:47:25,TheThanatosGambit,2,"Caution RH users, their servers are taking a shit. Both app and web versions are stalling/locking/forcing log outs. Was able to lock in a couple trades but shit is still going full retard"
2020-06-05 13:47:12,python_js,2,sold my SPY calls from yesterday for 2x the value 👍
2020-06-05 13:47:00,love2fuckbearasshoe,2,HOLY SHIT BRO 318$ wow
2020-06-05 13:46:30,MAGA_WALL_E,2,LMAO Even Vanguard is down. Are all these apps conspiring to shit the bed at the same time to fuck people out of gains?
2020-06-05 13:43:09,yawn_this_gets_old,1,"FYI...Fed is pumping bonds at 10am, right when Donnie is on TV."
2020-06-05 13:42:55,theetravismiller,2,I literally just shit myself in a good way.
2020-06-05 13:42:42,thunderchkn07,1,Lol cashed out F up 1k. Didn’t even drop $90 in
2020-06-05 13:42:07,yawn_this_gets_old,1,Donnie gonna pump at 10am?
2020-06-05 13:41:00,Traylortrash14,2,RH is a trash app and it’s frozen on me and won’t sell my limits. I fucking hate them. Anyways should I go completely balls deep on WFC? Is anyone else here pounding that
2020-06-05 13:40:51,yawn_this_gets_old,2,"So much autistic euphoria, the end is nigh."
2020-06-05 13:40:33,hulahoopbulaboop,1,Dude wtf is Robinhood
2020-06-05 13:40:29,yawn_this_gets_old,0,Dump it.
2020-06-05 13:39:51,MAGA_WALL_E,1,Robinhood is broken for me...
2020-06-05 13:39:40,VanillaBox,2,RH is completely shitting the bed right now. Can't trade anything
2020-06-05 13:38:37,FantasticInvestment,1,CVX 106c 6/26 110c 7/2 hold through Monday
2020-06-05 13:38:06,elvissssssssssssssss,1,Hmm sell SPY 320c 6/12 and buy back in or just hold?
2020-06-05 13:37:52,The_Cooler_Guy,3,"Come on MGM keep going up, I believe in you"
2020-06-05 13:37:14,Landlubber420,2,GUH!!! Ally Invest is even worse than RH.  Time to move to Tastyworks
2020-06-05 13:35:26,VanillaBox,3,My SPY calls aren't selling and my limit is under market price whats going on?
2020-06-05 13:33:55,Achuapy,2,why did i sell my 317 spy call yesterday...
2020-06-05 13:33:50,CryptoMstrmnd,4,Fucking piece of shit robinhood isn’t selling my order error detected
2020-06-05 13:33:23,yawn_this_gets_old,2,"What happened to the dip, do we not do that anymore?"
2020-06-05 13:32:44,Traylortrash14,2,You fucks. You took such beautiful green and destroyed it. All across the board
2020-06-05 13:30:07,SpaceCatVII,1,Pfffft I've seen bigger
2020-06-05 13:29:38,yawn_this_gets_old,1,"The selloff is starting. No way we hold $317 or higher today, nope."
2020-06-05 13:29:01,govindsingh4717,2,Sold my DAL 1/21 leaps for 100% yesterday. Yikes
2020-06-05 13:28:56,tendieking69,1,bears are fuk
2020-06-05 13:28:20,Jfri33ss,3,#this market has me so gay rn.
2020-06-05 13:27:20,yawn_this_gets_old,2,"So my puts are finally worthless, very cool and legal."
2020-06-05 13:27:04,mikis9,2,"Time to close calls.

[https://i.imgur.com/I9wH9Uy.jpg](https://i.imgur.com/I9wH9Uy.jpg)"
2020-06-05 13:26:49,maximuminimum,3,I’m jacked. I’m jacked to the tits!
2020-06-05 13:26:34,MarinoTheGOAT,1,Might just have to sell MGM immediately
2020-06-05 13:25:59,yawn_this_gets_old,1,We're gonna retest $313 at open.
2020-06-05 13:25:38,yawn_this_gets_old,1,"SPY can't just keep going, correct."
2020-06-05 13:24:57,Bigbotofernz,1,literally free money
2020-06-05 13:22:05,bardisviable,4,Holy fuck!!!! I nailed it with DIS!!! 💸💸💸
2020-06-05 13:21:35,Jfri33ss,4,Why did I buy puts. Mom I need more money.
2020-06-05 13:21:31,dont_judge_mee,2,"Holy fuck spy calls

Sell at open?"
2020-06-05 13:21:20,FusionTactique,0,"Donald Pump coming in clutch to pump the market even more! 10, 2 and 4."
2020-06-05 13:21:18,Traylortrash14,1,Is there time to buy shit at open
2020-06-05 13:21:08,JoeEggSockTick,2,Watch the market burn in 10 minutes
2020-06-05 13:19:11,jmatACT,7,I bought spy calls just to see a huge gap up over night as a yolo and it actually gapped up. Wow
2020-06-05 13:18:10,Bpallstar95,3,"I better see some serious gains on the front page from BA, MGM, and AAL."
2020-06-05 13:17:34,jcreamsickwhooo,7,Dkng gogo
2020-06-05 13:16:52,CryptoMstrmnd,2,Ahhh shit this is going to be good my penis is so erect . I have 50 on VIX puts Ima make moneyyyyy. Bears where y’all at
2020-06-05 13:16:35,beepbopwollytop,4,Yikes. The one day I don’t have calls
2020-06-05 13:15:47,The_Cooler_Guy,6,[MGM!](https://media2.giphy.com/media/WsMRY18qgNcH42qA42/giphy.gif?cid=4d1e4f29764a941e1fe3073170e442bcb7fad9c12275be90&rid=giphy.gif)
2020-06-05 13:14:08,sharkeezy,2,Do I sell Ford? I have 20 shares of them
2020-06-05 13:14:00,Kire29,1,Where are the WORK call holders😹😹😹
2020-06-05 13:13:29,MiltDavis,6,Holy. Shit. What the FUCK did I just wake up to TENDIES FOR BREAKFAST BOYS
2020-06-05 13:11:02,OblivionXBA,4,I almost don’t even wanna be on at market open because I might sell too early!
2020-06-05 13:10:48,moe2quick,3,Look out for Luckin Coffee..
2020-06-05 13:08:27,BallScratcher123,6,I've got 8k in SPY 6/26 325c bought at a .96 average over the last 2 days. I'm am soo ready for open.
2020-06-05 13:07:14,foot56,1,I’m up 25% on stocks 😂🤑
2020-06-05 13:06:59,tnmtnmtnm,6,Haha fucking wow
2020-06-05 13:05:55,TopHand92,3,Why did I sell me DIS 125C 6/5 when at 117. It’s in the money now! Lost 95% on that one.
2020-06-05 13:03:40,collegeboiiiii,6,I’m going to make so much fuckin money today
2020-06-05 13:02:03,Jfri33ss,1,What’s the airline play today ? Delta ?
2020-06-05 12:59:21,The_kew,4,3k to yolo boys. Let’s talk about it.
2020-06-05 12:59:09,quocho,3,So is this a fluke for airlines or they’re getting back to normal now?
2020-06-05 12:58:59,DrMoogala,3,ATNM moving 📈
2020-06-05 12:57:55,TrueHavoc,2,Dang thought UAL would dip more
2020-06-05 12:54:13,jstromdabomb,2,This BUDs for you!
2020-06-05 12:51:32,Mr_Options,4,All in weekly SPY calls!!!!
2020-06-05 12:44:34,shacoand2boxes,9,LMFAO BOEING REALLY BE $200. Wish I didn’t sell my leaps and shares at $130
2020-06-05 12:41:58,willpowerbuilder,2,nfp is so good! gay bears are doomed. I am going fucking long tonight. aggresive long
2020-06-05 12:41:58,SkyBIueDreams,4,If you have puts you better post your fucking loss porn EOD HAHAHA HOLY SHIT IMAGINE BEING A BEAR
2020-06-05 12:40:59,OGTuesday,3,SAVE 🚀
2020-06-05 12:40:19,urraca,3,The euphoriaaaaa
2020-06-05 12:39:32,Secret_Spaceman,2,Selling calls at open or holding?
2020-06-05 12:36:56,spyaintnobitch,1,MOON BOUND!!!
2020-06-05 12:35:17,cpscott1,5,If everything holds at open I would have at least doubled what my weekly goal was.
2020-06-05 12:34:57,BallScratcher123,3,Stage 2 booster is full of fuel and ready for launch.
2020-06-05 12:34:40,Watblieft,9," US MAY UNEMPLOYMENT RATE 13.3%; CONSENSUS 19.5%   


Okay, guess we bears are properly fucked now."
2020-06-05 12:33:56,cranial_pudding,3,"Everything on my list had big nights

BUD, SPR, USO, TAP, F...

I'm nervous now, this is geared up to be my greenest day in a long time. The only thing that I'm not getting tendies from is that GLUU play I chased"
2020-06-05 12:33:27,datchaekurasmile,2,BA just might hit 210 EOD
2020-06-05 12:31:45,werescrewedanyway,1,Beat forecast by 6%.... Jesus
2020-06-05 12:30:41,1538671478,2,GREEEEN DILDO
2020-06-05 12:27:33,Capt-Birdman,1,"AAL, DAL will hopefully keep growing, holding my pennies"
2020-06-05 12:25:36,foot56,1,What time do the job numbers hit
2020-06-05 12:23:49,knicksAHgoat,7,"I kno this will drop befofe the bell so heres some gain porn


https://i.imgur.com/PrU1du9.png"
2020-06-05 12:16:40,whiteninja123,0,"PLUG power, its bee asleep for too long, wallstreet is starting to notice"
2020-06-05 12:09:28,AntiqueFig0,4,I want to experience the feeling waking up to the stock you invested in being over 10% up.
2020-06-05 12:04:41,boscodown,4,Energy <3
2020-06-05 12:02:42,Pizza_Bagel_,1,"The fact that we have a company in GNUS that’s running up like this on the rumor of big news we don’t even know about—can’t help but draw parallels to the South Sea Bubble, when shit got so crazy a company’s stock ran up on a big idea that they couldn’t disclose yet."
2020-06-05 12:00:59,JB_work_account,1,"well all my AAL, LUV, and JETS calls should open nicely"
2020-06-05 11:58:11,Jfri33ss,2,Holy shit futures
2020-06-05 11:52:27,andthereoff,3,LFG!!!
2020-06-05 11:47:04,InvestmentActuary,8,Waking up to my SPY calls being ITM 🥵
2020-06-05 11:44:18,WSB_G0D,3,Job report priced in?
2020-06-05 11:44:13,hkusbeckham,8,God damn it. I miss these huge chance every fucking time.
2020-06-05 11:40:54,MrYacob777,11,"I think the market is officially broken. 

I enjoyed my fresh new tendies but things feels kinda gross."
2020-06-05 11:40:04,Secret_Spaceman,3,What oil calls should I be buying
2020-06-05 11:35:45,10centRookie,1,Is CCL bound to moon soon like airline stocks?
2020-06-05 11:35:12,brownbrandon,4,"CZR 12c 6/5

DKNG 45c 6/5

LUV 38c 6/12 & 40c 6/19

SPY 316c 6/8 & SPY 316c 6/10

SNAP 20.5c 6/12

FB 240c 6/19


Selling everything but the tech at open and enjoying the weekend early. Will be diamond handing DKNG until worthless."
2020-06-05 11:34:51,KingAutist-0004,7,HOLY SHIT!!!!!!
2020-06-05 11:34:28,OverallPriority,6,"Imagine all this green this week, Airline on a fucking tear, gaming on a fucking tear, REITs waking up. And HOLDING SHARES IN GNUS. A fucking children’s entrainment company."
2020-06-05 11:34:09,blackcoffee0123,2,Dave & busters popping off again lmao
2020-06-05 11:32:48,Dougiejurgens2,5,Keep going Boeing
2020-06-05 11:31:36,justjoe099,3,"Yes I'm gonna say it, wish I would've bought more AAL 13c 6/12, my single call I bought Monday is gonna be up 600%"
2020-06-05 11:30:37,arichnader,2,The bears are all gone? It's like corona never existed
2020-06-05 11:28:40,slymerva,1,This is so fucked up
2020-06-05 11:26:03,Voideded,1,How are my SPY $16 6/10 calls looking now?
2020-06-05 11:24:55,OverallPriority,9,"I never thought I would say this. I’m not sure If I would or should say this. But here it goes. 

We are so green rn I’m scared."
2020-06-05 11:22:17,pottypotsworth,6,"Too late to jump into OIL today to hold into next week?  


>There has been a breakthrough in OPEC+ talks over extending production cuts. Saudi Arabia and Russia [clinched a tentative deal with ](https://link.mail.bloombergbusiness.com/click/20532520.195546/aHR0cHM6Ly93d3cuYmxvb21iZXJnLmNvbS9uZXdzL2FydGljbGVzLzIwMjAtMDYtMDQvb3BlYy10YWxrcy1oaXQtaW1wYXNzZS1hcy1pcmFxLWdvZXMtc2xvdy13aXRoLXByb2R1Y3Rpb24tY3V0cz9jbXBpZD1CQkQwNjA1MjBfTUtUJnV0bV9tZWRpdW09ZW1haWwmdXRtX3NvdXJjZT1uZXdzbGV0dGVyJnV0bV90ZXJtPTIwMDYwNSZ1dG1fY2FtcGFpZ249bWFya2V0cw/5750b6c8a227624d318b46b4Bef2aa337)Iraq  which may force the country to cut even further in the coming months to  make up for over-production recently. Delegates will meet over the  weekend to finalize an agreement which will extend the cuts by members  until the end of July. Brent crude rallied to [close to $41 a barrel this morning](https://link.mail.bloombergbusiness.com/click/20532520.195546/aHR0cHM6Ly93d3cuYmxvb21iZXJnLmNvbS9uZXdzL2FydGljbGVzLzIwMjAtMDYtMDQvb2lsLXJpc2VzLWZvci1zaXh0aC13ZWVrLWFzLW9wZWMtY2xlYXJzLXBhdGgtZm9yLWN1dC1leHRlbnNpb24_Y21waWQ9QkJEMDYwNTIwX01LVCZ1dG1fbWVkaXVtPWVtYWlsJnV0bV9zb3VyY2U9bmV3c2xldHRlciZ1dG1fdGVybT0yMDA2MDUmdXRtX2NhbXBhaWduPW1hcmtldHM/5750b6c8a227624d318b46b4Beb7bd0b5), while West Texas Intermediate was trading above $38.

Any good oil tickers likely to blow up in the next few days?"
2020-06-05 11:20:35,blackcoffee0123,3,opec meeting on the weekend. chance it doesn't go through as always but if it does oil and super majors will pop
2020-06-05 11:19:57,SB52Birds,6,Keep dying ZM i’m getting horny
2020-06-05 11:19:44,XXXHELLBOY,5,It’s gonna be hard to not sell these 6/19 $BA 200c I’ve got at opening
2020-06-05 11:18:12,undeadxoxo,1,AAL covered calls?
2020-06-05 11:18:09,NewportBarGuy,-2,"If this opens up 300, I promise you this country will be on fire all weekend. If you seriously think you can rape and pillage in broad daylight, you are going to watch this country burn to the ground."
2020-06-05 11:17:44,j4rd7n,6,Who would’ve thought a bankrupt car rental company would be saving my portfolio right now
2020-06-05 11:16:02,willpowerbuilder,2,I start to wonder if over priced stonk ever existed and Buffett is so lame
2020-06-05 11:15:46,j4rd7n,2,Holy fuck HTZ
2020-06-05 11:15:21,STonks5346,2,Idk even know what to do today. Took some profit yesterday
2020-06-05 11:14:41,imsrrybby,5,Anyone who's not shorting overpriced tech right now is fucking up
2020-06-05 11:13:14,APDent,3,"Even when winning, i am losing. Convert my UAL 32c to MGM calls two days ago. Should have held the UAL."
2020-06-05 11:10:14,tgood87,2,Ive been diamond handsing dkng 20c aug 21 expiry. Up bigly but i feel like it's ran out of steam but still 2 months to expiry.
2020-06-05 11:09:47,NewportBarGuy,3,"So, what are the underlying technicals supporting the rise in our markets?"
2020-06-05 11:09:23,VirtusInjection,1,Oh no
2020-06-05 11:08:14,VirtusInjection,4,Whoever has puts on AAL probably is dead
2020-06-05 11:06:57,Autist4AudiR8,5,That gay TQQQ bear got me panicking and buying puts yesterday.  Fuck him.  I got looted by a bear.
2020-06-05 11:05:57,boscodown,2,Anyone watching pvac
2020-06-05 11:05:28,auscontract,2,"Okay so there will be a giant police reform, all police will need to use body cams 24/7 in the future, where can we profit off this?"
2020-06-05 11:04:04,clearingcreeps,1,"BA 195C 6/19

UAL 40C 6/19

WYNN 95c 6/19

SPY 311c 6/19

Sell at open or do they have more room to run?"
2020-06-05 11:03:09,VirtusInjection,1,What’s another good investment app. E trade sucks and fuck RH
2020-06-05 11:02:27,deweydecemial,1,Is it too late to get in on JETZ?
2020-06-05 11:01:17,willpowerbuilder,7,"this is the most ridiculous recession ever, qqq hits all time high and spy is only 3% from all time high. amazing to say the least"
2020-06-05 11:00:02,VirtusInjection,2,Mgm looking good yesss yesss
2020-06-05 10:56:43,Gilbert_AZ,4,Oil is on fire
2020-06-05 10:56:37,elija_snow,1,At this point anyone name (Jack) working in WH could just get fire for been name (Jack).
2020-06-05 10:51:54,VinnyTheFish89,3,"Going to sell out of my MGM 2 July 22c and wait for the dip to buy back in.  Maybe a little farther OTM,"
2020-06-05 10:50:51,clarkefromtheark,1,LOL I held my nclh and boeing calls cause I wasn't a pussy it payed off like a motherfucker holy shit
2020-06-05 10:50:33,Rulerdogma,4,Anybody holding calls over the weekend?
2020-06-05 10:49:33,RAINBOW_DILDO,-2,Kill your masters
2020-06-05 10:49:26,cutiesarustimes2,2,"Madoff denied early release.

If that dude just grifted a few hundred million and stuck the rest in spy he would have gotten away with it."
2020-06-05 10:46:38,subaeisgood,-8,For Floyd
2020-06-05 10:45:25,SkyBIueDreams,4,"No way this AAL run up is sustainable, even I. The short term. I know some of you are probably getting the urge to FOMO hard but use your brain and let it go. The ship has sailed."
2020-06-05 10:41:17,killerk14,3,Alexa play carmelldansen dirty trap remix
2020-06-05 10:38:03,wilhelm96,1,Will China’s response +8:30 non farm reports be sufficient to fully reverse AH/pre rally?
2020-06-05 10:37:31,SquintsRS,3,3 hours til we rich or 💎🖐
2020-06-05 10:32:12,soap808s,3,Thinking of buying $BUD calls for September - thinking they'll crush earnings. Anyone think they'll be a pullback/better entry? Thinking $60 or $65
2020-06-05 10:31:04,,2,🌈🐻 OR 🐂 OR 💵
2020-06-05 10:30:56,luckyguy64,4,"Looking for stonks that are still lagging behind with reopening news. SEAS still down almost 40% on the year, opening next week. Any others?"
2020-06-05 10:30:24,OblivionXBA,3,"Feels like MGM is tracking the S&P, that’s trash"
2020-06-05 10:27:51,The-Hyrax,8,"Lesson: when Buffet sells, btfd"
2020-06-05 10:27:23,YourFriendlyAutist,1,F to GNUS being dumped
2020-06-05 10:27:01,throwawaystemcel,-11,"""I'm gay, I'm really gay, I'm super duper gay

I'm gayer than a rainbow, I'm gayer than I'll say

Gay, I'm really gay, I'm truly very gay

You caught me, I'm a gay and I like it that way"" - Warren Buffett"
2020-06-05 10:26:31,Swannyj95,-8,LK? Buy or nah?
2020-06-05 10:25:51,pillow38164926,11,Taking these online classes mostly science. It’s fuckin retarded. The dumb bitches that are the TAs (teach assistants) think they are hot shit. Go fuck yourself I bet you live in a fuckin junkie 300 sq ft box in Harlem or south Brooklyn u fuck. Fuck this I probably make more just selling options fuck a real job
2020-06-05 10:25:16,long__the__vix,5,6/19 32.5c SIX will print
2020-06-05 10:25:04,SquintsRS,5,Tech stocks are gay
2020-06-05 10:23:58,gopoohgo,3,Lol the CCL $20cs i bought yesterday morning are almost ITM in 24 hours.
2020-06-05 10:23:31,,2,"I wish my stocks reflected my life. I changed jobs back to biomed engineer, knowing because of covid they needed people. They came in $5 over what I was asking, which was total a $13 pay jump from the job I was at. Now that Rona is over, I got a fat paying job. Meanwhile....... I'm a paper hand having bitch. Only 1k the last two days."
2020-06-05 10:22:09,Vinny32295,2,Should be a good entry point for Pepsi? Looks like it’s range bound between $130-$138 since April 6. If markets keep going up it should pop back to the upper range maybe higher?
2020-06-05 10:21:28,keyokenx1017,3,For once can we like stick to where futures runs up to its highest point this constant moving 1-2% in either direction halfway through the night then back to almost flat by open as actually fucking annoying as hell
2020-06-05 10:20:31,SquintsRS,6,This is turning into a letdown after tonight
2020-06-05 10:19:38,senpaistarkiller,1,Thoughts on SEAS?
2020-06-05 10:19:38,your-missing-mom,1,All the ford police cars are getting destroyed and needs to be replaced soon. Calls on fords. This is the best dd i can provide
2020-06-05 10:19:35,long__the__vix,7,Don’t FOMO into airlines now get into SIX it’s bound to explode soon once parks start to reopen
2020-06-05 10:19:13,corn_syrup_milkshake,1,"XLF 24c 7/2
NFLX 420c 7/10
SPY 310p 6/19

How long should I stay bullish for? Dump these calls as soon as they’re green?"
2020-06-05 10:19:11,Nochthitus44,12,"Me trading as a bear: read articles, nonstop follow chat rooms, draw graphs, make estimates, check fundamentals, news, events that are incoming - result 99.9% loss

Me trading as a bull: buy calls, set profit taker when they increase in value 30%, bingewatch netflix until notification pops up; check phone, buy other calls, repeat. - result - 40% gain"
2020-06-05 10:18:55,,1,"Fuck today, I'm looking forward. What do you think happens Monday?"
2020-06-05 10:18:10,throwawaystemcel,4,"""I take dick up the ass with jet fuel as lube"" - Warren Buffet"
2020-06-05 10:17:57,pillow38164926,4,Lmao at 8pm curfew cops in nyc will beat yo ass 😂
2020-06-05 10:17:40,infamousnj69,1,It’s always a good start to the day when you just woke up and click on the futures tab on investing.com it goes your way
