date,author,score,body
2020-06-26 00:08:56,Obliterated321,2,"Roller coaster day. Sat in bed for 4 hours watching my calls burn. Contemplating on if i should just exit the game altogether before a start taking all-time losses.

We're talking SIX, COTY, PFIZER, PBF, and NCLH calls. 

I end up selling about half of it by 1pm. And i think to myself, ""Is life worth living without stonks? What will i do at work? How will i cope with my mediocre life of being single forever? 

Then i remembered. *I remembered how many of you have gone to hell and back. ""Scared money don't make money""* My heart raced and i looked around for some degenerate plays that no sane man would make. Dumped 20% of my portfolio into a 6/26c on Tilray at about 2pm along with some PRPL puts and SEAS calls. 

By EOD my portfolio was up by 10% and i sold those damn gains. Now hoping to exit what i have tomorrow since my robinhood account is beyond fucked with all those day trades."
2020-06-25 23:05:46,rooster504,1,Anyone else think we are going to keep slowly bleeding down until the next big dump? Trump algos cant keep this up until election?
2020-06-25 20:12:25,nooobbbbtrader134,2,$pins you piece of shit go up
2020-06-25 20:03:28,StockNewbs,2,What time they publish stress test result I can’t find it
2020-06-25 19:52:11,i_am_bartman,1,I really don't want to buy into this. But I guess I am.
2020-06-25 18:21:02,Mario_209,6,I'm ready for the next plunge
2020-06-25 17:44:32,fulltimeledge,1,If I was to yolo into a short position. How do I ensure I can get the highest % return like when you see people hitting 2000%+.. is it going for something like spy 220 and having others keep interest in those options? Sorry for newb question but new to options
2020-06-25 16:06:22,Ephemeral_limerance,6,Big banks gonna moon over the next week
2020-06-25 16:03:19,Ephemeral_limerance,5,Gay bears got fukt 🌈🐻
2020-06-25 15:29:41,needadvice881,3,How did travel stocks make such a quick recovery
2020-06-25 15:19:26,dyuen138,2,Get some TLRY calls should be heading back to $10+ shortly
2020-06-25 14:57:51,AgentChester,4,AAPL and msft calls survived and I got the fuck out. All cash gang. Thinking about UNG puts
2020-06-25 14:46:47,polychris,3,"Usually when I take profit when it seems like there's still some upside potential but I'm happy with my return, I later realize that I sold pretty much near the top.

Take profit. Eat tendies."
2020-06-25 14:41:14,UsuallylurknotToday,2,Meant to reply my bad. Wrong comment
2020-06-25 14:37:49,jtb419,3,My calls survived and I exited. Screw that.
2020-06-25 14:31:30,I_have_a_dog,2,NVDA pump talks going nicely.
2020-06-25 14:14:41,sharpmoloko,10,a month’s worth of gains wiped out in a day :)
2020-06-25 14:13:37,frazerkrane,2,No clue what to do with DAL and JETS
2020-06-25 14:08:43,John_Mayer_Lover,5,"A little icon that says “ITM” showed up next to one of my puts in my TDA account. 

What the fuck does that mean???"
2020-06-25 13:44:17,chessiechoice,5,Markets r dropping but not fast enough to make big money on puts
2020-06-25 13:26:45,Crod1717,3,Would you consider it being up 35% premarket impressive after we talked yesterday or is it still not that crucial? Sorry I’m a rookie 😂
2020-06-25 13:07:50,yonce23,2,Where’s today’s thread? Why can’t I find it?
2020-06-25 12:59:55,bettercallsaully,2,"Kudlow to set your mind right.  
Just might find myself buying reits again"
2020-06-25 12:37:26,ThatBoiDonQ,1,Are stress test results today?
2020-06-25 12:37:00,beefmoe,2,Reeeeee
2020-06-25 12:35:17,dnldtrmp45,5,Lol we’re going green
2020-06-25 12:32:22,aragorndxb,4,"Jobless claims

1.48M vs 1.35M est."
2020-06-25 12:31:29,chadsterlington,6,what am I supposed to do with all these lean hogs?
2020-06-25 12:31:25,dnldtrmp45,-2,Omg unemployment
2020-06-25 12:30:54,MoarTarriffs,2,REEEEEER UNEPLOYMENT 1480k vs 1300k
2020-06-25 12:29:07,MoarTarriffs,3,gdp and unemployment in 1 minute
2020-06-25 12:09:24,02mg,3,Just woke up...who’s getting sum fuk? Bear or Bull?
2020-06-25 12:05:27,bettercallsaully,2,Let’s see these numbers
2020-06-25 12:04:14,letshonestlygo,0,"We’re retesting March lows, get on board or get fucked. Next two weeks going to be a bloodbath."
2020-06-25 12:03:32,IveLurkedWSB2long,2,Can the printer even save us?
2020-06-25 11:50:21,NotGucci,3,Spy 295 today?
2020-06-25 11:45:08,pausemenu,4,Ready to continue watching my stocks evaporate into worthlessness alongside my currently worthless July calls!
2020-06-25 11:41:53,NotGucci,0,Call holders are fucked. Tomorrow going be red too.
2020-06-25 11:40:16,ephapax1,2,This is bad.
2020-06-25 11:34:13,NotGucci,1,Jeez look at BA
2020-06-25 11:21:01,cryptwalkin,3,When printer ?
2020-06-25 11:20:48,job182,0,"Ok. Here’s what to do. Open the long term chart of the Dow. What does it look like? Yep. Its not about Jpow, never has been. In fact his actions are miniscule in scale compared to the generational heists that is consistently happening. Im a lifelong permabear, but not when it comes to stock and commodities trading."
2020-06-25 11:14:25,LivingTheHighLife,1,"Shoes or sandals

Bulls r n shambles"
2020-06-25 11:05:51,Amazedmagik,4,Spce preparing for second test flight. Hopefully it will recover my calls 😭
2020-06-25 11:03:36,SkeletonGrin666,3,"This is a 🌈🐻opportunity to make a video with Red Red Liiiinne🍷, my calls are sour 🍇."
2020-06-25 11:03:23,Crepesoleswaffleknit,2,"seriously tho, i still don't understand why bankrupted stonks going up like GNC how does this work???"
2020-06-25 10:59:23,AntiqueFig0,3,Never take advice from idiots here. I should of just followed my instincts and bought GNC shares.
2020-06-25 10:58:36,BillyG803,0,Gahdamn it. I just got PDT lifted like two weeks ago. Gotta make 2k as of now to not be poor
2020-06-25 10:51:11,SolitaryEgg,1,What are the meme stonks today boys?
2020-06-25 10:45:24,Amazedmagik,2,I’ll take what I ordered yesterday and I would like to supersize the drill please.
2020-06-25 10:41:50,iPretend2BeAble2Read,7,Is there anything more cringe than this old fuck that hosts the CNBC morning show? It’s on every day and idk this fools name but he needa go.
2020-06-25 10:41:39,globohydrate,1,Donkey Kong in brambles!!
2020-06-25 10:37:48,prometheusveins,3,Fuck this im moving to cash gang
2020-06-25 10:37:03,SpiralSummitGames,0,"Mixer is shut down, 
Twitch is full of sex offenders,
and FB gaming isnt woke enough.

Where will all the grown ass men with blue hair stream video games now?! 😱😱"
2020-06-25 10:36:40,amoctar,1,I hope I receive the paycheck at the bottom cuz idgaf about covid cases if I can get those cheap msft callz
2020-06-25 10:34:44,darnit_dang,14,When the fuck did this board get so cringe
2020-06-25 10:32:59,ts2981,3,Looks like FL and TX will be wildly out of control in a couple of weeks... I think TX will blink first on the second shutdown.
2020-06-25 10:31:43,infiniteindy,9,"The fact that so many on here are choosing cash gang is also interesting, more and more everyday"
2020-06-25 10:31:15,lululemonhead,2,turds in dangles!
2020-06-25 10:29:53,lululemonhead,-3,"Mi go so hmmmm and make a connection
She hear mi voice and get a nipple erection"
2020-06-25 10:28:34,kemal12315,7,Watching bears vs fed is fun
2020-06-25 10:27:21,SkyBIueDreams,-11,I’m bored. Should I jack it to a footjob video or a cum facial video?
2020-06-25 10:27:18,august_thecow,3,Bulls in lambos
2020-06-25 10:25:56,Mrivera45,3,#THIS MARKET OUT OF CONTROL
2020-06-25 10:24:28,SolitaryEgg,2,"Anyone know if you can run a cash account on ToS?

I wanna cash out and move everything to my boomer retirement accounts, and just keep like $10k on ToS for FDs. But I don't wanna deal with that PDT bullshit."
2020-06-25 10:23:02,Rich265,7,"Stonks -0.34% red

CNBC headline: ""Stonks seek recovery"" lol"
2020-06-25 10:23:00,thisisclemfandango,4,Can the market do something so I can stop rhyming things with shambles
2020-06-25 10:19:58,Treehugger2344,-3,Queers in buttholes
2020-06-25 10:19:56,Ahrimansghost,1,"On a jaunty ramble 
To the Trump mishandle 
Navarro causing a scandal
And we all in shambles"
2020-06-25 10:19:53,ElementShield,3,When’s job reports and gdp coming out ? Only thing to help market chose direction
2020-06-25 10:19:20,youreaditfirst,5,Last couple of days i have used a red dildo on my wife we went red. I used a green one yesterday
2020-06-25 10:19:06,Rich265,0,"CNBC, your daily desperate covid treatment pump isn't working. Stonks still down. Maybe you could talk about actual news or, \*gasp\* stonks?"
2020-06-25 10:18:39,ElementShield,0,Perfectly flat
2020-06-25 10:17:41,ASSU-WaZe,0,What happened while I went to the bathroom
2020-06-25 10:17:25,lululemonhead,4,Plebs and vandals!
2020-06-25 10:16:54,Baseballguy1999,7,Gym in the morning is far superior to gym after work
2020-06-25 10:16:24,diabeetis,3,Is it legal to require the inheritors of my estate to YOLO their portion on FDs on a Russell small cap company??
2020-06-25 10:16:00,thisisclemfandango,6,my mother has cankles
2020-06-25 10:15:32,lululemonhead,2,Kegs in brambles
2020-06-25 10:15:24,Bluerigg,1,TECH IS A BUBBLE CANT YOU SEE??
2020-06-25 10:14:45,Rich265,12,"CNBC Doctor: ""They're not going to shut down their economy.""

Okay, ""doctor"", thanks for the medical facts. Oh, you served in the Trump administration?"
2020-06-25 10:14:09,-nye-,5,Hares In Brambles
2020-06-25 10:14:05,uninfinity,7,"**Apple stock price target raised to $425 from $375 at Wedbush**   

LOL @ Goldman Sachs for their  220 price target for Apple"
2020-06-25 10:14:03,kkrw7401,-8,"1 upvote and I’ll go get a coffee and stay awake

Sleep it is"
2020-06-25 10:13:42,lululemonhead,1,🍩do-nut disturb🍩 whilst 👁 🛍️ the 📉
2020-06-25 10:13:38,SolitaryEgg,2,"If we head back down and break 300, there will be an actual bull genocide.

I sorta doubt it will happen, but it would be a sight to see.


Glad I'm cash gang."
2020-06-25 10:13:25,bobstaman,2,Yo bear or bull. We here for tendies. We should be like.. combining our powers to take down the MMs lol.
2020-06-25 10:13:20,Nocturnidae,1,get a ride in my Durango
2020-06-25 10:13:06,TheThanatosGambit,7,"Cocks in Cambell's. 

No literally, I'm balls deep."
2020-06-25 10:12:48,,1,I could watch this girl talk about vacines and drugs all day.
2020-06-25 10:12:47,smallchimpu,3,"We are relatively flat for past 2 months , we have entered contracting market phase"
2020-06-25 10:12:45,Nochthitus44,5,"anyone having random dreams every month/two about getting together back with your ex? Like she mover on 5 years ago, has husband and kiddo now; I also moved on 5 years ago, have superb high af paying job, another gf (of 2 years already), but probably the best moments in my life are those dreams. tendies cant cure it all?"
2020-06-25 10:12:15,Baseballguy1999,2,SPY 100 EOD
2020-06-25 10:12:11,thisisclemfandango,1,john coffey and mr. jangles
2020-06-25 10:12:09,Ahrimansghost,2,Sauce in pan-dles....hmmm...that one doesn’t work
2020-06-25 10:12:08,diabeetis,1,Lieutenant dangles
2020-06-25 10:12:06,PureDerek,1,Market is in scandals
2020-06-25 10:11:49,ar1195,2,Stimulants in mouth
2020-06-25 10:11:27,Bluengold1988,3,Wax in candles
2020-06-25 10:10:50,thisisclemfandango,6,bulls are stormy daniels
2020-06-25 10:10:42,ThatsMyPurse69,6,Rona in the panhandle
2020-06-25 10:10:17,jinky66,0,eggs in scrambles
2020-06-25 10:10:13,job182,5,"You guys need to realize that what matters is not reality but rather, the narrative that is being pushed. There will be a dip if THEY want a dip. There will be a crash if THEY want a crash. And so on. Don't try to read into it too much, fractional reserve banking is what it is."
2020-06-25 10:10:12,ReverseMtg_BuyCalls,8,Dudes in sandals
2020-06-25 10:10:07,Mario_209,5,"From the plebs that brought you the world famous ""where we dropping boys"".....we now bring you the new....""Why we dropping boys....?""

Bullmeat back on the menu after this next bull run"
2020-06-25 10:09:35,RandyCrane17,0,It’s true Kurt Angle
2020-06-25 10:09:33,howardgatsby,2,sticky candles
2020-06-25 10:09:15,Jackismyson,1,"Perfect place to go short (NOT). TA 101. This is the buy zone newbies.

Example:

[https://www.tradingview.com/x/mNJywlhQ/](https://www.tradingview.com/x/mNJywlhQ/)

[https://www.tradingview.com/x/3P25PLU0/](https://www.tradingview.com/x/3P25PLU0/)

[https://www.tradingview.com/x/CZpqv8Wl/](https://www.tradingview.com/x/CZpqv8Wl/)

[https://www.tradingview.com/x/xhZ4aorS/](https://www.tradingview.com/x/xhZ4aorS/)"
2020-06-25 10:09:09,UsuallylurknotToday,6,I get bears in shambles. Feet in sandals. Yea yea. But what happened to cause a 1% move in an hour?
2020-06-25 10:09:04,luponicdistortion,4,Booze in handles
2020-06-25 10:08:28,Crosa13,-1,What’s up with webulls settled funds. When I sell something on TD the money I put in is available instantly the money I made takes time to settle. I just liquidated a bunch of positions and none of the money is settled. If I really gotta wait that sucks they know that money is there.
2020-06-25 10:08:06,SolitaryEgg,3,Wax in candles
2020-06-25 10:07:59,SolitaryEgg,1,Feet in sandals
2020-06-25 10:07:38,PureDerek,3,Bears are in rambles
2020-06-25 10:07:09,hello-world-foo-bar,3,"Second wave exponential growth coming in july



https://www.google.com/search?safe=off&sxsrf=ALeKk01jJeENkCfU6ecwntgrj9L5MmTQ4Q%3A1593049358917&ei=DgH0Xrq_N8O8-gSbrK2wBQ&q=usa+oronavirus+new+cases&oq=usa+oronavirus+new+cases&gs_lcp=CgZwc3ktYWIQAzIECAAQDTIECAAQDTIECAAQDTIECAAQDTIECAAQDTIICAAQDRAFEB4yCggAEAgQDRAKEB46BAgAEEM6BAgAEApQmqIBWNmoAWC8qgFoAHAAeACAAfkBiAHWB5IBBTAuNC4xmAEAoAEBqgEHZ3dzLXdpeg&sclient=psy-ab&ved=0ahUKEwi6_pap65vqAhVDnp4KHRtWC1YQ4dUDCAw&uact=5"
2020-06-25 10:07:06,Sil6wnig,1,Wallstreetbets will make news in Germany with Wirecard lol
2020-06-25 10:06:56,ElementShield,1,I know some bears prob slept when futures were down 1.4 percent 😭😭 happens every time
2020-06-25 10:06:50,,4,"As apocalyptic as everyone is being this morning, I fully expect a face-ripping green day."
2020-06-25 10:06:47,ActiveGangMember,1,Finally a SOLID non volatile upswing into the green zone.
2020-06-25 10:06:00,3at,1,should i give up on BA
2020-06-25 10:05:33,Ahrimansghost,9,Doors in handles
2020-06-25 10:05:15,one_eyed_johnny,7,Whew that was a close one. Almost had to take the market seriously there for a minute
2020-06-25 10:03:41,PureDerek,12,Bulls are in gambles
2020-06-25 10:03:21,RatchetCliquet,3,Ouch my puts
2020-06-25 10:02:41,CoronavirusWithLime,-2,**DREGGS IN CRAMBLES**
2020-06-25 10:02:33,Rich265,2,CNBC:  -0.26% red means market coming off down day roaring back!!
2020-06-25 10:02:19,,17,"I respect banks so much more than tech companies. At this point, banks pretty much own the fact that they are sleazy pieces of shit.

Meanwhile we have scooter riding, vest wearing, quirky tech companies that are trying to argue they only care about everyone's welfare.

The H1-B argument is bullshit. It's not about providing opportunity to foreign workers. It's about owning them for higher profits and wage suppression. 

They post jobs in the newspaper to jump through the loophole for H1-B. Every tech company can shove its ukelele commercials up its ass. Wolves in sheep's clothing. All of them."
2020-06-25 10:01:40,flyfreeNhigh,3,How would stock market work if we had time machine
2020-06-25 10:01:18,Ankel88,2,"DISNEY PUT/CALL RATIO = 1

What do we do boys"
2020-06-25 10:00:54,banging_ur_mum_rn,8,See “eggs In scrambles“ 5 times a day noW. Was funny at first now people just use it to get 10 upvotes
2020-06-25 10:00:22,Nemo-pluribus-unum,3,"Can someone explain in simple words, why convalescent plasma hasn't been announced to be a cure yet? What are they waiting for?"
2020-06-25 10:00:15,throwaway60501,5,Fuck VIX. Give me straight green or red
2020-06-25 10:00:10,goldengod518,6,"Going back to bed, waking up to the abundance of reports that’ll save my account or blow it up"
2020-06-25 09:59:43,CoronavirusWithLime,11,If we go into lockdown again I’d say the world economy is fucked for years. There is no middle ground. I’m in constant fear of losing my job already. So fucking done with this bullshit man.
2020-06-25 09:59:28,bradleykirby,7,Can't believe I have to wait 4 more hours before I sell my calls.
2020-06-25 09:58:27,luponicdistortion,1,"Miss the old days where the mission was to exterminate the VIX

This shit is rough"
2020-06-25 09:58:20,thisisclemfandango,3,Hello I would like to buy chicken nuggie futures can someone please help
2020-06-25 09:57:51,KingAyy,2,"“In performing such rankings, the market capitalizations are calculated at some significant date, such as June 30 or December 31.”"
2020-06-25 09:57:31,bobstaman,11,"Orange County elevating Covid numbers. If we get to bed capacity this might get fucking weird.  
https://ochca.maps.arcgis.com/apps/opsdashboard/index.html#/cc4859c8c522496b9f21c451de2fedae"
2020-06-25 09:57:09,mstack,12,"the guy who suggested calls GNC yesterday, sadid to thank him later
thanks"
2020-06-25 09:56:49,RadiumShady,5,A fucking roller coaster lmao
2020-06-25 09:56:12,ink666,11,"Wirecard files for insolvency, BUY BUY BUY!"
2020-06-25 09:55:06,FelWill,4,I'm watching BBC News and Robinhood is getting a shout-out.
2020-06-25 09:55:06,youreaditfirst,9,I am about to loose it all. You can't see it but tears are tryinf to come out my eyes.
2020-06-25 09:55:03,Nocturnidae,2,oh oh.
2020-06-25 09:53:48,diabeetis,17,One day a WSBer will become CEO of JPM and crash the global financial system by YOLOing $20 trillion on AMZN FDs
2020-06-25 09:53:44,BlueTreeCloud,1,Futures are green buying me some GNC today
2020-06-25 09:53:29,SpiralSummitGames,11,"Remember like less than a week ago when kramer went on that ""DONT FIGHT THE FED DONT FIGHT THE TAPE"" rant as he rolled around on the floor?"
2020-06-25 09:53:18,ActiveGangMember,-9,Lofi music causes depression idc. Don't listen to that bitch shit!
2020-06-25 09:53:12,hyperinsane,6,Wirecard is back on the market at a fraction of the price. WSB... do your thing
2020-06-25 09:52:31,AntiqueFig0,1,God just loves playing with my emotions.
2020-06-25 09:52:27,printer_go_brrr,2,QQQ calls printing.
2020-06-25 09:52:18,CoronavirusWithLime,7,Today seems like a good day to day trade HTZ shares
2020-06-25 09:51:24,,9,"imagine there was a time  when everyone poured out in the streets in protest, and then went back home for 3 more months"
2020-06-25 09:51:21,PureDerek,-2,Is there an app to watch live futures
2020-06-25 09:50:55,hk_enthusiast,2,Guys remember shorting SNAP? Now it's at 23 lol...
2020-06-25 09:50:45,watchmaking,3,This market sucks I'm going back to r/BiggerThanYouThought
2020-06-25 09:50:22,YourFriendlyAutist,4,"Feel likes the next few trading says are going to determine what direction we go and if history repeats itself, we’re bearing to an edge soon"
2020-06-25 09:50:21,CoronavirusWithLime,-1,Ameripoors LUL
2020-06-25 09:49:42,itsbeenaminute1,1,"How retarded is it to think govt arbitrarily choosing a shell company to pump just to generate good news doesn’t fundamentally change a company? 

INO pumping pisses me off. A dump is inevitable right?"
2020-06-25 09:49:40,supercoolguy__69,12,We need a u/CptTonyStark DD and positions post/comment.
2020-06-25 09:48:23,fbi-office,7,[Disneyland WAS set to reopen July 17. Now? Who the fuck knows..](https://www.cnn.com/2020/06/24/media/disneyland-reopening-postponed/index.html)
2020-06-25 09:48:18,lululemonhead,10,Eggs in scrambles
2020-06-25 09:48:18,mango1144,0,"Because ACTT is halted for the ticker change to FREE, bears can't sell it off. Check mate bears! FREE is free tendies."
2020-06-25 09:48:14,xpo140,4,Printer ran out of ink... lol
2020-06-25 09:48:03,diabeetis,4,"🎶Devil dick man

Devil dick man

Devil dick  man hates hulk dick man

They have a fight, devil dick wins

Devil dick man🎶"
2020-06-25 09:47:46,tyranid441,9,imagine actually investing in stocks right now lol
2020-06-25 09:47:39,flyfreeNhigh,1,What should I do with my 13k
2020-06-25 09:47:27,Ankel88,8,"TRUMP JESUS H CHRIST, STOP WAGE WAR AGAINST EUROPE YOU DAMN IDIOT! EU is ally, CHINA is enemy! WTF IS WRONG WITH YOU!

TWEET IMMEDIATLY NO EU TARIFFS YOU DUMB FUCK"
2020-06-25 09:47:02,ActiveGangMember,6,two sided dildos just nasty fight all around
2020-06-25 09:46:47,NewportBarGuy,8,"Seriously guys, I think we broke the market. Who’s going to tell mom?"
2020-06-25 09:46:37,ar1195,2,Green dick win. Red dick win
2020-06-25 09:46:25,AccurateReference7,2,What’s the best way to bet on spike in volatility in the short term?
2020-06-25 09:46:16,putsandpizza74,4,They just threw futures out the window
2020-06-25 09:46:10,n4775u,9,futures having dildos fight
2020-06-25 09:45:53,AntiqueFig0,5,So the second stimulus comes with bonus for people returning to work?
2020-06-25 09:45:49,brucekeller,1,It's Brrrrsday!
2020-06-25 09:45:47,bradleykirby,3,"Hahaha. Wow. Literally go to the bathroom and come back to this. Guess we rejected 305 huh. 

This is going to be wild day."
2020-06-25 09:45:04,DoctorBalpak,5,"Bwahaha 
Just commented that bulls are cheering prematurely and that red dildo came 😂"
2020-06-25 09:45:00,diabeetis,4,Giant red dildos again bull r fuk
2020-06-25 09:44:48,youreaditfirst,-7,Someone give a link. Wtf are you guys looking
2020-06-25 09:44:47,dogecorleone,9,Some bulls lost 50% of their portfolio just now 😂😂😂😂
2020-06-25 09:44:35,vjsworld,1,Wtf is worng with futures
2020-06-25 09:44:27,wilhelm96,2,Yep that momentary green shit was fake. Back to normal
2020-06-25 09:43:49,luthan,9,USpoors waking up
2020-06-25 09:43:40,lowcas,2,Imagine all the German Nazis calling Gynas frauds lol. Luckin fabricated 310M USD and Wirecard 2b Euro. USA USA USA!
2020-06-25 09:43:13,ar1195,3,Was that a dump?
2020-06-25 09:43:11,MemeticEntity,12,DiD aNyOnE sEe ThAt ReD CaNdLe?
2020-06-25 09:43:07,catchy_phrase76,5,So what time are we getting the vaccine news? There's an election riding on this market.
2020-06-25 09:42:57,spy66may,9,Bulls may resume being in shambles
2020-06-25 09:42:51,RayCashIsTrashDalio,7,did something get leaked? we dumping fucking hard
2020-06-25 09:42:48,Turlututu_2,6,"if the Fed has only spent $143 billion out of a potential 2.3 trillion, we haven't even seen Jpow's final form yet"
2020-06-25 09:42:40,kkrw7401,9,"Red again 

When will we learn that nothing really matters until the market opens unless there is some massive news that blows things to pieces"
2020-06-25 09:42:30,SkyBIueDreams,5,o shit we dumpin
2020-06-25 09:42:13,mbr4life1,3,"Who sold their soul to the ghost of JPow to get this green so they can ""just exit their calls."""
2020-06-25 09:42:03,nate223,9,Buying cheap puts eod if green holds. 1 state closes we are gonna CB down.
2020-06-25 09:41:51,timtimzi,4,ANyone buying INO stock to hold
2020-06-25 09:41:40,youreaditfirst,2,I got SE calls and I bought them at when it drop to 104. How am I looking?
2020-06-25 09:41:35,Jpatrickj,4,Just got back to close levels on a fakely gay pump and permabulls acting like we’re closing in on ATHs
2020-06-25 09:41:32,ar1195,3,Let’s not get ahead of ourselves there’s still 4 hours till open
2020-06-25 09:41:32,goldengod518,5,"So it’s stairs down elevator up? Very cool, very legal"
2020-06-25 09:41:07,zenofthrones,2,Assuming no vaccine this year. $PTON $100 and $ZM $350 by eoy
2020-06-25 09:40:43,alreadyawesome,11,"*Futures barely green*

Bulls: See! See that! Stonks only go up, fuck you gay bears!
\*Pats themselves on the back*"
2020-06-25 09:40:19,nate223,2,"“Wow SPY, very cool”"
2020-06-25 09:40:14,uaoleksiy,3,"Gold down, 10 year down. Might be green today bois."
2020-06-25 09:39:28,The_Collector4,2,"Those darn Germans! First Bayer, now wirecard, good grief.  They are capable of anything."
2020-06-25 09:39:20,hk_enthusiast,2,Wow we dumped to a lower low then came all the way back up as usual
2020-06-25 09:39:18,ThatsMyPurse69,0,"What happens if you ignore a PDT equity call? Will they just sell your assets at FV, or leave them there and just take away margin / daytrading?"
2020-06-25 09:38:52,throwaway60501,1,Back in March I purchased 4/17 330c but if only I bought june ones man fuckkkkkk
2020-06-25 09:38:37,AntiqueFig0,4,Who else bought the wrong dip yesterday lol.
2020-06-25 09:38:29,ASSU-WaZe,2,Spy open at 306?
2020-06-25 09:38:20,SkyBIueDreams,1,Futures green? Even now there is hope for man
2020-06-25 09:38:14,Mrivera45,0,ACB lookin good 👀
2020-06-25 09:37:45,Patriotnation5,15,A real stress test would be having the banks yolo 100% of their capital on some weekly otm calls like the rest of us.
2020-06-25 09:37:42,MemeticEntity,4,"Futures are green but the rest of your life is red.

Give me some context and I'll give you your fortune"
2020-06-25 09:37:20,nate223,2,Hertz just won’t die 😂😂
2020-06-25 09:37:15,n0o0baca,8,"I bought calls back in March. SPY 230 6/26. AMA. About to purchase a lamborghini. Made about 20 mil from a 200k investment.  


Lol just kidding you stupid fucks we're all going str8 broke here"
2020-06-25 09:36:54,prometheusveins,4,Bro wtf is BA doing holy fuck
2020-06-25 09:36:36,touchhimwiththejab,2,The only gay gang affiliation you should pledge allegiance to is make money gang
2020-06-25 09:36:31,UsingYourWifi,0,"[Oh shit they arrested the former Wirecard CEO a couple days ago](https://edition.cnn.com/2020/06/23/tech/wirecard-ceo-markus-braun-arrested/index.html).

Super bullish."
2020-06-25 09:36:30,JRSmithwithabadshot,7,Things must’ve been really bad a few hours back if futures is looking “good” right now
2020-06-25 09:36:27,ayyopapi,7,Not to flex but I buy options just to watch them expired worthless
